职位,城市,公司,学历,经验,技能,薪资,工作描述,行业,职位URL,公司规模,发布时间
高级电气设计工程师,北京,中国建筑股份有限公司海拓工程分公司,本科,5-10年,"EPC,设计",2.5-4万,岗位职责：1.参与阿国新能源和电力项目市场投标、组价和市场开拓。2.参与新能源和电力项目的资源开拓、技术对接、方案确定。3.负责升压站或输变电网的设计方案，图纸审核，与业主、监理对接。4.负责新能源项目的升压站和电网工程安装和调试工作。5.公司安排的其他工作。 岗位要求：1.本科及以上学历，有注册电气工程师资格优先；2.至少做过2个以上新能源项目或变电站、电网的设计、采购、施工、调试等工作，具备6...,房地产开发,http://jobs.zhaopin.com/CC251251530J40826653003.htm,1000-9999人,2025-11-09 00:00:01
资深电气工程师（强电）,北京,中地国际工程有限公司,本科,10年以上,,2-4万,岗位内容： 1、熟练阅读电路图纸，能独立负责整个电路系统的技术复核、设计优化。2、负责电气设备选型，了解IEC标准中有关中、低压电缆及开关等电气设备的选型。3、熟悉低压TNS系统、变电站工作接地及防雷接地的经验方法。4、熟悉电力安全作业规程中变电站部分的内容。5、熟悉高低压电力设备的试验和调试。6、对接现场技术支持、操作指导及安全管理等工作。7、能够根据项目现场实际情况及专业技术角度，提出合理化建...,工程施工,http://jobs.zhaopin.com/CC151689510J40768655009.htm,300-499人,2025-11-05 00:26:03
传感器研发工程师,北京,北京好人好事人力资源有限公司,本科,经验不限,"研发,设计,传感器,测控系统,JG",2-4万·14薪,此岗位为急招岗位，优秀者薪酬可面议！欢迎前来投递！！！！！！！岗位职责1、负责传感器研发，根据市场需求独立完成技术调研，独立承担公司新产品的设计开发，编制相关技术文件，并负责产品实现全过程的控制，以确保产品满足客户指标要求，实现公司型谱产品的补充；2、负责对新研产品进行特性分析，充分识别制约产品设计和开发的关键因素和薄弱环节，并确定相应的措施；3、负责新产品的确认、试产、培训、指导服务型工作；4、...,人力资源服务,http://jobs.zhaopin.com/CC890014030J40817632214.htm,100-299人,2025-11-04 11:15:38
高级电气工程师,北京,北京中联太信科技有限公司,硕士,5-10年,"高压,中压,技术交流,电气现场运维环节",2.5-4万,岗位职责：1. 深度参与市场开拓，协同营销团队与客户进行技术交流，精准理解客户需求，提供专业的技术咨询与建议。2. 组织并主导技术方案研讨会，制定定制化的电气系统解决方案。3. 制作高质量的技术标书、方案文档及技术演示材料，进行技术方案讲解与答疑。4. 解答客户在电气设计、安装调试、运行维护等全生命周期中遇到的疑难问题。5. 收集、整理客户反馈的电气技术问题及行业技术动态，形成案例库与技术知识库。...,电力/水利/热力/燃气,http://jobs.zhaopin.com/CC310917510J40774926205.htm,100-299人,2025-11-01 00:00:01
电子设计工程师,北京,科益虹源,硕士,1-3年,"电子电气,电源",2-4万,岗位职责：1，协助工程师完成电源类产品开发、测试；2，收集整理研发过程技术资料；3，协助工程师更新设计文件、生产指导文件；4，协助工程师进行产品测试并进行数据的收集整理；5，负责新产品、试验平台的调试。任职要求：1，电力、电子、电气自动化、自动化控制等专业背景，本科985/211及以上学历；2，能够熟练阅读英文文献，有扎实的模拟电路，数字电路和电力电子基础；3，熟练使用制图、仿真软件，有大功率脉冲...,电子/半导体/集成电路,http://jobs.zhaopin.com/CC424343330J40773104107.htm,300-499人,2025-10-31 00:27:01
风电测试验证工程师（电气方向）,北京,中车山东风电有限公司,硕士,5-10年,"新能源,风电,电气",2.5-4万,岗位职责：1. 负责风电整机产品、电气系统功能及性能的验证和测试。2. 负责风电产品电气相关的设计问题处理，整改方案制定和设计质量提升。岗位要求：1. 具备风电机组整机电气系统研发或测试经验。2. 具备变流器、变桨、主控、辅控等部件厂家研发、测试经验。3. 具备电气类问题分析能力、出具分析报告能力。4. 能接受工作期间的出差安排。5. 硕士学历，工作经验5年以上。,新能源,http://jobs.zhaopin.com/CC488806720J40721113906.htm,300-499人,2025-09-29 10:49:22
资深电源开发工程师,北京,北京伟仕天成科技有限公司,本科,3-5年,电源开发,2-4万,任职条件：1、电气工程及其自动化、自动化等开关电源相关专业，本科及以上学历，能力突出者可适当放宽条件；2、有开关电源开发5~10年工作经验；3、了解开关电源发展趋势，熟悉功率变换拓扑、器件性能以及制程；4、具备较强的文档撰写和审核能力、独立分析和解决问题的能力、团队意识和协作精神。,电子/半导体/集成电路,http://jobs.zhaopin.com/CC339020120J00043850013.htm,500-999人,2025-09-25 09:40:01
项目技术经理（拉美片区）(J18969),北京,通用技术集团国际控股有限公司,本科,10年以上,"变压器,输变电,电网",2-4万,工作职责1. 全面负责项目的设计与施工管理，统筹协调各方资源，确保项目按计划推进，并有效落实设计和施工分包合同的履行与监督。2.组织编制和审核设计进度计划及成果文件，管控设计优化、技术评审与变更管理，保障设计工作符合合同与业主要求，按时高质量交付。3.牵头设计与施工分包合同的编制、评审及谈判，明确并维护我方权益，协调各分包单位之间的技术及组织接口，定期召开进度协调会议。4.负责对设计分包商和施工分...,工程施工,http://jobs.zhaopin.com/CCL1417043900J40836096303.htm,10000人以上,2025-09-23 00:15:04
电控硬件开发高级工程师-北京-C9771G,北京,广东美的制冷设备有限公司,本科,5-10年,"五险一金,管理规范,餐费贴补,岗位晋升",面议,岗位职责：1.负责光伏/储能逆变器、DC/DC变换器等功率硬件设计，包括拓扑仿真、元器件选型、原理图设计及PCB布局；2.负责功率电路调试、效率优化及EMC问题解决；3.负责SiC/GaN等新型功率器件的应用；4.负责控制板硬件设计（DSP/FPGA外围电路、信号调理、隔离驱动等）；5.负责开发硬件在环（HIL）测试平台，支持控制算法验证。任职资格：1.本科及以上学历（电力电子、电气工程、自动化等...,电子设备制造,http://jobs.zhaopin.com/CC270219410J40782946411.htm,10000人以上,2025-09-10 15:57:33
电气设计工程师（海外项目经验）,北京,中联云港数据科技股份有限公司,本科,3-5年,,2.8-4万,岗位职责：1. 负责项目专业设计方案的确定，并提供有效的设计建议，审核相关施工方案和施工图纸;2. 具备现场分析问题和解决问题能力; 3. 负责对本专业的新技术、新材料进行总结并提交总结报告;4. 制定本专业甲供设备、乙供设备、材料材料技术需求。任职资格：1. 需要海外项目经历不少于1年；能流利用英语进行技术交流沟通及工作；2. 本科及以上学历，5年左右工作经验，电气工程及其自动化/自动化/电力系...,IT服务,http://jobs.zhaopin.com/CC208499030J40499838503.htm,1000-9999人,2025-09-03 17:17:02
高级电子工程师,北京,北京国科欣翼科技有限公司,本科,5-10年,"研发,嵌入式硬件研发",2-4万·13薪,岗位职责：1.参与系统总体方案设计；2.参与电子学接口协调；3.负责模拟及数字信号的处理；4.负责处理系统联试问题和技术支持；5.产品持续改进。 任职条件： 1.本科以上学历，电子、通信、无线电等相关专业，5年以上工作经验，熟练阅读英文技术资料； 2.具有较强模拟电路设计开发能力，具有扎实信号处理基础，熟练运用常用仿真软件，熟悉光电探测器及其放大处理技术（模拟）； 具有扎实数字电路基础，对数字电路...,电子/半导体/集成电路,http://jobs.zhaopin.com/CC631591820J40731211207.htm,100-299人,2025-08-21 00:00:02
硬件工程师（影像）,北京,北京天星医疗股份有限公司,本科,1-3年,,2-4万·13薪,岗位职责：1.参加产品/项目的需求调研和需求分析、概要设计，撰写相关技术文档;2.完成医疗器械产品的电器硬件设计、器件选型、原理图设计、硬件调试等工作;3.与软件工程师实时沟通项目需求，协助完成项目的测试、系统交付工作，对项目实施提供支持;4.分析并解决产品/项目开发过程中硬件相关的技术问题;5.解决测试中出现的相关问题;6.协助解决生产过程中出现的相关问题。任职资格:1.本科及以上学历，电子相关...,医疗设备/器械,http://jobs.zhaopin.com/CC846968330J40834321908.htm,300-499人,2025-08-19 10:13:46
地面测发控设计,北京,北京箭元科技有限责任公司,本科,3-5年,"火箭,地面测发控,电气系统",2-4万,岗位职责：1、负责运载火箭电气地面电气系统技术抓总工作，完成运载火箭地面电气系统的总体方案论证和设计工作； 2、负责地面电气系统设计工作，包括地面测发控系统供配电设计、电缆网设计、电气接口规范等工作；3、负责传感器、控制器等电气设备选型与集成工作；4、负责地面电气系统的测试、调试工作；5、负责地面测发控软硬件技术文件编写、标准化流程制定；6、负责电气系统试验室条件、电气系统设计工具等基础建设。岗位...,船舶/航空/航天/火车制造,http://jobs.zhaopin.com/CCL1451662510J40595102914.htm,100-299人,2025-08-18 14:25:16
自动化控制工程师,北京,深圳市新凯来技术有限公司,本科,无经验,"自控系统,机械设备,电气设备,光学",2-4万,岗位职责：1、负责运动控制方案设计，基于系统规格需求及应用场景，快速完成控制运控架构设计、实现及应用；2、负责运动轨迹规划、系统辨识、扰动补偿与控制器参数整定，达成高实时、高精度的性能指标；3、利用时频域信号分析、处理和优化理论，结合多物理场优化设计方法，优化高速高精运动系统的各项性能指标；4、协同软硬件团队解决跨领域技术问题，进行异常定位（如通信延迟、逻辑冲突、数据丢包等）。岗位要求：1、自动化...,电子/半导体/集成电路,http://jobs.zhaopin.com/CCL1362239030J40859672115.htm,1000-9999人,2025-08-16 09:16:21
系统部经理(J10322),北京,北京索英电气技术股份有限公司,本科,10年以上,"储能系统,电气一二次设计,储能变流器,高压,变频器,变压器,配电柜,设计",3-4万,岗位职责:1、负责团队管理，包括部门组织的建设与管理，目标的制定分解与达成；2、负责系统设计管理：包括系统设计的工作指导与管理，带领团队完成项目系统一次、二次、结构方面的设计（包含预制舱、监控柜等产品的设计）；3、负责牵头组织常用项目文件，调试方案等的产品标准化建设；4、制定部门工作流程及系统设计规范与标准.任职要求:1、本科及以上学历，电力及电气相关专业优先；2、具备8年以上行业经验，有系统项目...,新能源,http://jobs.zhaopin.com/CC130236690J40760354512.htm,300-499人,2025-08-15 11:10:55
电控经理,北京,广东先导稀材股份有限公司,本科,5-10年,"设计,研发",2.5-4万,岗位职责： 1、负责MOPA光纤激光器、皮秒激光器、射频CO₂激光器的电控系统研发工作，涵盖电路设计、嵌入式控制、射频驱动、软件开发及团队管理，确保产品具备高稳定性、高可靠性及量产可行性。 2、负责激光驱动电路、脉冲调制、能量控制、同步控制、温度管理等核心电控系统的设计与优化 3、负责电控系统研发项目的立项、规划、执行与交付，确保产品开发进度、质量和成本控制 4、与光学、机械、软件、工艺、测试等部...,化工,http://jobs.zhaopin.com/CC268804910J40867944404.htm,1000-9999人,2025-08-11 09:29:48
地面电气控制设计师,北京,北京大航跃迁科技有限公司,硕士,3-5年,,2-4万,岗位职责：1.负责起竖发射设备电气控制系统设计;2.负责起竖发射电气系统任务规划，设计任务提出；3.负责起竖发射电气系统供应商选型，技术管理；4.负责火箭推进剂加注系统电气控制设计。职位要求：1.熟练掌握机、电、液（气）一体化设备电气控制相关技术；2.熟悉汽车或工程机械电气控制，有相关的工作经验；3.对液压系统或气动控制有一定的了解。,船舶/航空/航天/火车制造,http://jobs.zhaopin.com/CCL1485054130J40719252214.htm,20-99人,2025-07-29 09:24:55
制动电控集成工程师,北京,比博斯特(上海)汽车电子有限公司,本科,3-5年,"电控集成,汽车底盘制动产品,量产经验",2-4万·13薪,岗位职责： 1.负责制动产品电控系统的软硬件需求分析和架构设计，并编制相应的规范； 2.针对电控系统关键零部件进行设计和选型，编制相应的设计规范； 3.负责功能逻辑、安全分析、失效降级策略等设计和验证； 4.与软件/硬件/测试/功能安全等团队协作，完成产品软硬件开发、集成和测试； 5.搜集和整理业内制动产品的相关信息。 任职要求： 1.具备3年以上制动电控系统量产开发经验，且具有底盘零部件软硬件开...,汽车零部件,http://jobs.zhaopin.com/CCL1338576290J40438815116.htm,20-99人,2025-07-15 11:07:11
自动化控制工程师,北京,深圳市新凯来技术有限公司,本科,无经验,"设计,测试,安装/调试",2-4万,工作职责1、负责运动控制方案设计，基于系统规格需求及应用场景，快速完成运控架构设计、实现及应用；2、负责运动轨迹规划、系统辨识、扰动补偿与控制器参数整定，达成高实时、高精度的性能指标；3、利用时频域信号分析、处理和优化理论，结合多物理场优化设计方法，优化高速高精运动系统的各项性能指标。任职要求1、自动化、控制理论与工程、机械工程、机械电子工程、航空宇航科学与技术、机器人、仪器科学与技术、电气工程等...,电子/半导体/集成电路,http://jobs.zhaopin.com/CCL1362239030J40744573415.htm,1000-9999人,2025-06-12 10:54:00
电气系统设计,北京,北京大航跃迁科技有限公司,硕士,5-10年,,2-4万,岗位职责：1、负责电气系统技术抓总，配合总体完成火箭总体方案论证工作；2、负责箭上控制系统综合设计，提出箭上单机、软件研制技术要求，箭上电缆网图设计，提出地面测发控系统技术需求；3、负责电气系统对卫星、靶场等外系统的接口技术协调和状态把控；4、协调各专业开展全箭电气系统产品的研制工作；5、负责电气系统箭上产品的验收与质量管控；6、负责组织并实施电气系统相关试验，包括综合试验、总装测试、靶场测试及临...,船舶/航空/航天/火车制造,http://jobs.zhaopin.com/CCL1485054130J40719250114.htm,20-99人,2025-07-29 09:24:14
开关电源工程师,北京,北京龙腾蓝天科技有限公司,本科,5-10年,"开关电源,AC/DC电源,DC/DC电源,PFC,LLC,反激,半桥,大功率开关电源",2-4万,岗位职责： 开关电源产品设计开发 任职要求： 1、具有5年以上电源产品开发经验； 2、精通反激、正激等多种拓扑，以及PFC电路等； 3、能独立完成相关变压器的设计和功率器件的选型； 4、有高压系统设计经验者优先； 5、有EMC设计经验者优先。,IT服务,http://jobs.zhaopin.com/CC213873110J40358835801.htm,20-99人,2025-05-22 00:03:41
资深电气设计专家,北京,北京中科合盈数据科技有限公司,本科,5-10年,数据中心,2.5-4万,岗位职责： 1、负责公司项目电气专业的数据中心全生命周期（规划、设计、建设、运维技改）设计管理； 2、具备数据中心架构师思维，能够输出数据中心架构设计，独立或组织团队输出工艺解决方案（三图一表）； 3、负责制定公司级电气专业设计标准； 4、作为设计经理、专项工作负责人完成结果交付； 5、熟悉电气专业设备相关知识，具备独立编制电气专业大宗设备技术规格书，并配合完成设备招采。 6、进行新技术、新产品、...,云计算/大数据,http://jobs.zhaopin.com/CCL1285223320J40402852207.htm,100-299人,2025-05-14 11:38:05
机电工程师（持证）,北京,中国港湾工程有限责任公司,本科,10年以上,,2-4万,职责描述： 1.负责项目设备采购、进场和安装质量管理； 2.负责同当地电网的沟通协调，并制定年度电力调度、电量上网计划； 3.负责根据电厂设备情况制定生产物资采购及备品备件计划； 4.负责设备检修及对设备性能可靠度负责。 任职要求： 1.50岁以下，本科及以上学历，英语无障碍沟通； 2.水电站动力设备专业或电气自动化专业； 3.有10年以上水力机械或电力设备相关工作经验，有从事水力发电厂运营、维护...,工程施工,http://jobs.zhaopin.com/CC146542080J40726277514.htm,1000-9999人,2025-04-24 09:34:53
高级电气工程师,北京,江苏瑞盈智拓电力科技发展有限公司,本科,5-10年,"测试,高压,ABB,金风科技",2-4万,岗位职责： 一、 检测工作总体调度 1. 审核检测调度工作的合理性。 2. 保证人员水平匹配检测内容。 3. 保证检测设备匹配测试内容。 4. 随时解决现场发生的突发问题。 二、 建模工作总协调 1. 按照当地电网要求，开展收资工作。 2. 向中国电科院提资，并将不符合的数据反馈业主单位。 三、 CMA/CNAS体系管理 1. 资料维护及更新。 2. 根据公司业务发展需要对检测内容扩项。 3. 推...,电力/水利/热力/燃气,http://jobs.zhaopin.com/CC335532430J40696318112.htm,20-99人,2025-03-12 00:00:03
医疗器械手术机器人高级电气工程师,北京,北京智愈医疗科技有限公司,本科,10年以上,"设计,电气控制",2-4万·14薪,岗位职责：1. 按照医疗设备监管要求和研发体系质量要求，完成各项设计、开发、验证和文档工作； 2. 负责医疗设备电气系统的技术方案及原理设计，进行子系统及部件技术方案设计； 3. 负责电气件的计算及选型，运动机构舱体及控制柜体的布局和布线，电缆及辅材计算和选型，及电气组件BOM设计等； 4. 负责运动控制及流程相关程序的设计、开发及验证； 5. 持续跟踪运动控制等电气领域新技术进展及应用，转化为适...,医疗设备/器械,http://jobs.zhaopin.com/CCL1342152150J40686753308.htm,20-99人,2024-11-13 15:44:42
高级电气设计工程师-物流仓储自动化产品,北京,京东集团,本科,5-10年,"设计,自动化设计,线路设计,电机,传感器,控制器,仓储自动化",1.8-3.5万·19薪,岗位隶属于物流科技，基于京东自身千亿级业务规模，参与打造有深度、有技术壁垒的B端产品岗位base地区：北京京东总部-研发中心产品包含不限于：天狼四向车负责高密度存储转运，智狼系列聚焦 “货到人” 拣选，自动分播墙承接分拣分拨，智狼穿梭车支撑超高存储 —— 从入库到分拣，全流程闭环协同。岗位职责1.产品研发：独立完成仓储物流自动化产品，单机设备的电气设计工作；2.电气制图：熟练使用各类电气制图软件，...,互联网,http://jobs.zhaopin.com/CC192921310J40824015909.htm,10000人以上,2026-01-11 00:38:02
电子工程师（高级）(A111336),北京,光科芯图(北京)科技有限公司,硕士,5-10年,,2-3.5万,职位描述：1、负责整机（光机电综合系统）电子学系统的方案设计、具体实施，测试平台的设计，参与整机的装调测试； 2、负责子系统功能模块的实现，设计硬件电路的原理图和PCB，调试电路，后期测试工作，配合系统联调，性能优化及改进； 3、设计硬件的功能、性能、稳定性、可靠性等测试方案并实施； 4、编制相关技术文档及知识产权输出等；5、参与研发方案讨论，解决研发过程中遇到的各种难题；6、公司其他电子相关的工...,电子/半导体/集成电路,http://jobs.zhaopin.com/CCL1419461850J40835844605.htm,20-99人,2026-01-11 00:34:41
电气工程师（北京）,北京,江苏职接说人才服务有限公司,学历不限,经验不限,PLC设计,2-3.5万,岗位内容：1. 负责PLC及触摸屏编程、调试、维护、升级等日常管理工作；2. 协助客户解决现场调试、安装和故障处理等技术问题；3. 提供专业方案，为公司新产品开发提供技术支持；4. 参与制定自动化重大设备的维保计划并执行，对预防性维护和故障维修进行管理。任职要求：1. 电气自动化、自动控制等相关专业；2. 有1年以上PLC编程开发经验，具备良好的分析和解决问题的能力；,人力资源服务,http://jobs.zhaopin.com/CCL1478612040J40979294004.htm,100-299人,2026-01-09 16:50:31
电气工程师,北京,京东集团,本科,5-10年,"AGV,RGV,LGV",2.5-3.5万·16薪,工作内容： 1、解拣析项目标书、合同、技术书等项目标的文书中关键技术点并设计电气及电气控制履约方案；2、自动化设备电气设计、工业现场总线通讯、机电控制；3、电气调试、现场机电工程；4、安全规范、电气相关文书工作、调试工具及诊断工具开发；5、自动化设备问题分析及解决；6、工业机器人程序开发 7、电气成本核算 任职要求： 1.本科或以上学历，对机械设计及机电控制有深入研究和理解； 2.对运动及动力传动...,互联网,http://jobs.zhaopin.com/CC192921310J40731212609.htm,10000人以上,2026-01-11 00:13:02
专业工程师（电气仪表）(J10049),北京,中国有色金属建设股份有限公司,本科,5-10年,电气仪表,2.3-3.5万·15薪,岗位职责:1. 负责组织设计分包管理，开展设计单位沟通联络、合同签署等工作；2. 负责组织设计方案讨论、评审工作，按期提交设计文件；3. 负责设计交底工作，完整、准确交付设计方案；4. 负责组织设计、技术变更管理工作；5. 负责组织设计服务和支持工作，解决项目执行涉及技术、设计问题；6. 负责设计单位付款结算工作；7. 负责施工安装分包单位的沟通联络、商务谈判、合同签署等工作；8. 负责施工、安装...,矿产/采掘,http://jobs.zhaopin.com/CC000599560J40585725807.htm,10000人以上,2026-01-08 09:04:24
高级工程师/电气副总工,北京,北京航星科技有限公司,本科,5-10年,"变频器,传感器,控制柜,西门子,三菱,基恩士",2-3.5万,岗位职责：1. 项目负责人与总体设计- 全面负责非标自动化设备电气控制系统的方案设计、选型、编程（PLC、伺服、机器人等）、调试及现场交付管理工作。- 主导电气原理图、接线图、布局图等全系技术文档的标准化设计与审核。- 解决项目执行中的复杂电气技术难题，指导并培养电气工程师团队。- 跟踪业内先进电气技术（如机器视觉、工业物联网、数字孪生等），并将其转化为可行的解决方案。 2. 业务拓展- 深入潜在...,电子/半导体/集成电路,http://jobs.zhaopin.com/CC120397120J40854005613.htm,100-299人,2026-01-08 00:00:01
高级载荷控制工程师（偏控制方向）(J21046),北京,金风科技股份有限公司,硕士,5-10年,"设计,研发",2.5-3.5万,岗位职责: 1、主导或参与某一机型的控制软件的设计、开发和优化工作，熟悉控制算法及原理； 2、设计需求文件、技术方案等相关文件的编制与校核； 3、具备跨专业学科初级能力（如载荷、动力学分析等），能够从载控角度对机组载荷寻优进行分析及优化； 4、处理解决控制的问题及根因分析，指导现场运维人员的快速解决问题并能持续优化风机控制策略； 5、招投标项目的快速响应与支持，提高客户满意度； 任职要求: 1.硕...,电气机械/电力设备,http://jobs.zhaopin.com/CC138718430J40663553514.htm,10000人以上,2026-01-07 13:30:59
