职位,城市,公司,学历,经验,技能,薪资,工作描述,行业,职位URL,公司规模,发布时间
数据开发（郑州、南阳）,郑州,德科信息有限公司,本科,3-5年,"数据治理,数据仓库,数据建模,Flink,Sql,阿里云",1-1.5万,面试安排：笔试——初试——复试（均为线上）大小周！！大小周！！大小周！！郑州9：00-18：30，南阳8：00-18：00【数据开发工程师】 岗位职责：1、参与项目需求分析、根据需求设计文档、准确且高质量完成代码编写及技术文档编写: 2、按照项目计划，完成开发任务，确保项目进度和质量； 3、构建项目指标体系，并基于指标体系，及时发现与定位业务问题；4、设计数据质量监控规则，协同业务部门提升数据准确...,IT服务,http://jobs.zhaopin.com/CC589380620J40979262104.htm,1000-9999人,2026-01-09 15:28:21
大数据分析师/双休/五险一金,郑州,河南觉颁科技有限公司,大专,经验不限,Python,9000-15000元,岗位内容：1. 分析和挖掘大量的数据源，为业务发展和决策提供支持。2. 负责开发、维护和优化各类数据仓库和数据报表，保证数据质量和准确性。3. 与业务团队紧密合作，深入了解业务需求，提供全面的数据分析解决方案。4. 执行并监督指标和KPI体系，跟踪业务进展和成效。任职要求：1. 具备统计学、数学、计算机科学或相关领域的专科科及以上学历，2. 精通SQL语言和常用的数据分析工具和平台，如Excel、...,计算机软件,http://jobs.zhaopin.com/CCL1512550140J40744514206.htm,20-99人,2026-01-05 11:28:15
高级大数据开发工程师,郑州,郑州科瑞思拓软件科技有限公司,大专,5-10年,"数据建模,数据仓库",1.2-1.5万,岗位职责：1、负责公司大数据应用产品的平台搭建、架构优化、技术迭代和开发维护，提供稳定的大数据平台服务；构建数据存储、数据挖掘、数据计算及数据服务于一体的大型分布式数据平台； 2、负责构建和维护算法平台，对海量数据进行离线计算、实时计算等分析挖掘；协同数据分析师，根据业务场景设计并实现数据模型和服务模型，并跟进和评估模型效果，确保算法和模型的有效落地； 3、持续学习了解大数据领域的新技术，并结合实...,计算机软件,http://jobs.zhaopin.com/CC393603820J40853445103.htm,100-299人,2025-12-30 01:07:07
数据治理/技术服务工程师,郑州,郑州信大先进技术研究院,本科,3-5年,"数据治理,数据仓库,数据库开发",1-1.5万,岗位职责：1.参与数据治理平台的需求分析、功能设计与落地实施；2.参与具体业务场景的数据采集、数仓建设、模型设计、脚本开发等；3.制定并推动数据标准、数据模型、元数据规范、数据质量规则；4.设计数据资产目录结构、分类体系、标签体系等方案；5.配置并管理数据质量监控规则（完整性、唯一性、一致性等）；6.支持数据安全策略落地（如敏感数据识别、脱敏、权限模型）；7.与开发团队协作，将治理规则转化为平台功...,计算机软件,http://jobs.zhaopin.com/CC451155030J40865497503.htm,100-299人,2025-12-23 11:18:25
FineReport报表工程师,郑州,杭州中美华东制药有限公司,本科,1-3年,"FineBI,Tableau,Python,Oracle,MySQL,Kettle",面议,1、负责帆软FineReport报表开发，能够基于帆软报表进行二次开发，有帆软移动端开发经验；2、根据项目需求，进行数据可视化开发；3、对相关数据进行梳理、分析，搭建相关业务数据分析体系。4. 运用帆软报表进行BI报表的开发与维护；5、负责数据平台的性能分析与系统优化。技能要求：1、独立使用过帆软FineReport开发（必备），能够基于帆软报表进行二次开发，有帆软移动端开发经验；3. 使用过帆软...,医药制造,http://jobs.zhaopin.com/CC198426920J40817526710.htm,10000人以上,2025-12-20 01:29:18
程序开发工程师（数据方向）,郑州,河南拓达信息科技有限公司,大专,1-3年,"Python,Oracle",1-1.5万,岗位职责：1.数据库搭建与管理：负责设计并搭建符合公司业务需求的高效、稳定数据库系统，涵盖数据模型设计、表结构规划、索引优化等工作；持续维护数据库安全与性能，保障数据存储的完整性、一致性及访问效率，解决数据库运行中的各类技术问题。2.数据分析与结果输出：根据业务部门（如运营、销售、管理岗）的具体需求，制定合理的数据提取、清洗及分析方案，精准输出多维度数据分析结果，为业务决策、业绩复盘、风险预警等提...,在线生活服务（O2O）,http://jobs.zhaopin.com/CC843747440J40860786203.htm,1000-9999人,2025-12-18 01:06:56
数据分析师（双休-教培大厂-六险一金）,郑州,北京高途云集教育科技有限公司,硕士,1-3年,"Sql,数据建模,数据挖掘",1.3-1.5万,【岗位职责】：1-优化数据体系，完善数据产品，搭建数据看板，进行业务进度监控和异常指标预警2-做好预算管理，通过数据解读，协助业务及运营找到预算实现路径及提升点3-进行专题分析，能自主制定分析框架，输出分析报告，给出合理的策略建议及有力的决策支持【任职要求】：1-精通SQL，熟悉python、tableau、powerBI等数据工具，有较好的数据处理能力；2-较强的沟通表达能力、团队合作精神和主动...,培训/辅导服务,http://jobs.zhaopin.com/CC475394730J40855452502.htm,10000人以上,2025-11-28 10:57:58
数据治理工程师（省ETC/双休五险一金）,郑州,河南省视博电子股份有限公司,本科,3-5年,"数据治理,数据挖掘,ETL",8000-15000元,岗位职责：1、负责各业务的数据治理，根据业务数据现状，提炼并输出各业务块数据治理的方案，并推动业务数据治理的落地；2、参与集团数据治理系统的建设，推广应用，提升全公司数据治理文化；3、沉淀集团数据资产，建立健全数据资产目录，以及数据资产相关的系统落地。任职要求：1、国内外知名院校毕业，硕士及以上学历，电子类、计算机专业，3 年以上大数据相关经验；2、熟悉Hadoop架构，对HDFS、Hive、Sp...,IT服务,http://jobs.zhaopin.com/CC426904410J40902496308.htm,1000-9999人,2025-11-25 10:46:31
数据分析师（蜜雪冰城 五险一金）,郑州,蜜雪冰城股份有限公司,本科,3-5年,"数据分析,商业逻辑",1-1.5万,岗位职责:1、需求洞察及分析：负责海外国家相关需求的收集，明确目标、受众及需求的真实目的、业务痛点及潜在期望，结合现有业务流程及数据成熟度进行可行性分析；2、协同海外团队、BI开发和数仓开发，编写需求文档和指标白皮书，推动海外数据分析需求的落地，确保数据提取、处理和分析的准确性；3、深入理解海外业务流程（如招商管理、门店管理、供应管理等），分析海外各业务的机会和风险，建立海外国家专题数据分析模型，...,快速消费品,http://jobs.zhaopin.com/CC407014910J40735502106.htm,1000-9999人,2025-11-24 09:00:22
高级大数据开发工程师,郑州,郑州万特电气股份有限公司,硕士,3-5年,"Python,数据挖掘",1-1.5万·13薪,岗位职责：1、参与大数据架构的规划设计，参与业务建模及数据化运营平台的搭建、运维，对业务流程与大数据的结合提出建议和解决方案;2、完成基于大数据平台的业务项目的开发、实施和维护工作;3、负责解决大数据平台建设过程中的技术难点和性能调优工作;4、对大数据技术及开源框架充满热情，具有钻研精神。任职资格1、硕士及以上学历，计算机/通信等相关专业。2、熟悉大数据、数据仓库、湖仓一体、分布式架构技术理论，具...,仪器仪表制造,http://jobs.zhaopin.com/CC142539960J40512424711.htm,300-499人,2025-11-17 13:49:08
高级大数据开发工程师,郑州,郑州科瑞思拓软件科技有限公司,本科,5-10年,"Hadoop,Flink,Spark",1-1.5万,岗位职责1、负责公司大数据应用产品的平台搭建、架构优化、技术迭代和开发维护，提供稳定的大数据平台服务；构建数据存储、数据挖掘、数据计算及数据服务于一体的大型分布式数据平台；2、负责构建和维护算法平台，对海量数据进行离线计算、实时计算等分析挖掘；协同数据分析师，根据业务场景设计并实现数据模型和服务模型，并跟进和评估模型效果，确保算法和模型的有效落地；3、持续学习了解大数据领域的新技术，并结合实际需求...,计算机软件,http://jobs.zhaopin.com/CC393603820J40833411103.htm,100-299人,2025-10-15 08:41:40
大数据开发工程师,郑州,郑州信大先进技术研究院,本科,3-5年,"Java,Hadoop,Flink,Spark,数据仓库",8000-15000元,"1. 大数据基础平台、大数据能力开放平台、大数据交易平台的搭建与优化；2. 基于大数据平台(Hadoop)的数据仓库工具Hive/Spark/HBase, ETL调度工具，数据同步工具的开发、使用、集成和自动化运维，以及多租户与权限控制策略的实现；3. 研发基于大数据平台的数据仓库平台产品；4. 利用大数据相关技术实现对数据的加工、分析、挖掘、处理、及数据可视化等相关工作。5. 推动团队内成员技术...",计算机软件,http://jobs.zhaopin.com/CC451155030J40768339403.htm,100-299人,2025-03-28 10:11:12
数据开发工程师（牧原）,郑州,华企高科(北京)科技产业发展有限公司,大专,3-5年,数据开发,1-1.4万,岗位职责：1、参与项目需求分析、根据需求设计文档、准确且高质量完成代码编写及技术文档编写: 2、按照项目计划，完成开发任务，确保项目进度和质量； 3、构建项目指标体系，并基于指标体系，及时发现与定位业务问题；4、设计数据质量监控规则，协同业务部门提升数据准确性及完整性； 5、参与数据中台的开发、建设流程和规范设计，包括：数据建模，数据管理规范设计，ETL流程优化等； 6、协调业务与技术团队，推动数...,计算机软件,http://jobs.zhaopin.com/CCL1468998810J40746068706.htm,20-99人,2026-01-11 01:15:18
大数据开发工程师,郑州,八六三软件,大专,5-10年,"Python,Java,Flink,HIVE&NBSP,阿里云平台数据开发",1-1.4万,任职要求： 精通Hive SQL，Spark SQL，ODPS SQL等大数据SQL开发中的一种，熟练掌握python/Java、Flink语言； 熟悉或使用过阿里大数据产品：MaxCompute、Dataworks、DataX等优先； 熟悉数据分层原则，严格管控数仓各分层的数据流向，建设高效、安全、健壮的数据中台；,计算机软件,http://jobs.zhaopin.com/CC621497980J40813961009.htm,500-999人,2026-01-08 14:38:04
数据分析师助理,郑州,山东泽拢信息科技有限公司,本科,经验不限,"接受小白,五险一金,周末双休",8000-14000元·13薪,岗位内容：1. 收集和整理大量的数据，设计并实施数据分析模型和算法。2. 评估现有的数据集，并根据需要进行清理、转换和预处理。3. 对数据结果进行解释和汇报，向相关部门提供数据分析技术支持。4. 利用机器学习和人工智能技术改进公司的数据分析和决策过程。任职要求：1. 本科以上学历，接受应届毕业生，2. 熟练使用Python、R等数据分析软件和工具，能够独立完成数据分析任务。3. 深入理解机器学习和...,人工智能,http://jobs.zhaopin.com/CCL1514058360J40827136310.htm,300-499人,2025-12-24 15:11:19
数据分析员,郑州,瑞核(郑州)自动化科技有限公司,本科,经验不限,"数据治理,报表开发,数据建模,Python",7000-14000元,一、专业要求：电子信息，电子应用，电子科学与技术相关专业，测控技术与仪器专业二，任职职责：1.本科及以上学历2.熟悉单片机C语言程序开发3.具有分析能力4.沟通能力和抗压能力高职位福利：五险一金，周末双休，节日福利,智能硬件,http://jobs.zhaopin.com/CCL1492905920J40801200409.htm,20人以下,2025-12-17 14:09:38
数据技术工程师,郑州,北京华源格林科技有限公司,本科,3-5年,"ETL,数据中台开发,数据仓库,Python",8000-13000元,岗位职责：1.数据中台组件服务日志接入：熟悉数据中台组件（如ETL工具、数据仓库）的服务日志接入方法，能够实现日志的实时采集与存储。2.日志清洗与转换：具备日志清洗、转换与标准化能力，能够提取有效信息并支持后续分析。3.运维指标监控：熟悉数据中台运维指标（如性能、可用性、错误率）的监控方法，能够设置预警机制。4.故障处置：具备故障排查与处置能力，能够快速定位问题并恢复服务。任职要求：1、熟练数据中...,计算机软件,http://jobs.zhaopin.com/CC184536620J40911105408.htm,100-299人,2026-01-12 09:13:00
数据分析师,郑州,四川蓝航人力资源管理有限公司,学历不限,经验不限,数据治理,1-1.3万,岗位内容：1. 收集和整理大量的数据，设计并实施数据分析模型和算法。2. 评估现有的数据集，并根据需要进行清理、转换和预处理。3. 对数据结果进行解释和汇报，向相关部门提供数据分析技术支持。4. 利用机器学习和人工智能技术改进公司的数据分析和决策过程。,人力资源服务,http://jobs.zhaopin.com/CCL1458161680J40820009601.htm,20-99人,2026-01-11 23:14:51
大数据开发工程师,郑州,郑州宙珏汽车科技有限公司,大专,经验不限,Python,9000-13000元·13薪,岗位职责：1负责大数据平台的设计与开发2利用大数据技术进行数据分析和处理3构建数据模型，为业务决策提供数据支持4 参与大数据技术的研究和应用任职要求:1.要求大专及以上学历，专业集中在计算机、软件工程、电子信息、自动化等相关领域;2.需掌握至少一门编程语言，Python，Java， C/C+任一个均可3.具备良好的问题解决能力和团队协作能力。4.年满21周岁到30周岁。福利待遇:1.早九晚六，双休...,新能源汽车,http://jobs.zhaopin.com/CCL1510203490J40820058111.htm,20-99人,2026-01-11 01:28:33
实时数据开发工程师,郑州,中电金信软件有限公司,本科,3-5年,"ETL,Sql,Flink,银行",1.2-1.3万,岗位内容：1. 设计、开发和维护数据仓库以及相关的 ETL 流程。2. 对数据进行清洗、提取和转换，确保数据质量和可靠性。3. 编写 SQL 查询、存储过程和触发器等数据库操作脚本。4. 协调与数据分析师、应用程序开发人员和其他团队成员合作完成项目。任职要求：1.有金融业务数据开发经验优先;2.熟悉数据 ETL过程，具有良好的数据分析思维和逻辑推理能力；3.具有3年以上数据开发经验，熟练掌握SQL...,计算机软件,http://jobs.zhaopin.com/CC443657520J40813583609.htm,10000人以上,2026-01-11 01:22:55
数据分析师,郑州,四川蓝航人力资源管理有限公司,学历不限,经验不限,数据治理,1-1.3万,岗位内容：1. 收集和整理大量的数据，设计并实施数据分析模型和算法。2. 评估现有的数据集，并根据需要进行清理、转换和预处理。3. 对数据结果进行解释和汇报，向相关部门提供数据分析技术支持。4. 利用机器学习和人工智能技术改进公司的数据分析和决策过程。,人力资源服务,http://jobs.zhaopin.com/CCL1458161680J40820009501.htm,20-99人,2026-01-11 23:14:51
大数据开发工程师（双休，14薪）,郑州,郑州凝铎汽车科技有限公司,大专,经验不限,数据库开发,8000-13000元·14薪,岗位职责：1负责大数据平台的设计与开发2.利用大数据技术进行数据分析和处理3.构建数据模型，为业务决策提供数据支持岗位要求：1.计算机相关专业大专及以上学历2. 熟悉大数据处理框架，如Hadoop、Spark等3.具备一定的编程能力和数据结构基础 福利待遇: 1.早九晚六，双休，综合薪资8k--13k。 2.法定节假日福利:带薪休假。有六险二金 3.提供一日三餐，人才公寓单人间。高温补贴+采暖补贴...,人工智能,http://jobs.zhaopin.com/CCL1510203460J40813094411.htm,20-99人,2026-01-11 01:28:11
数据治理工程师-项目制,郑州,八六三软件,大专,5-10年,"数据建模,数据库开发,数据治理",1-1.3万,岗位职责：1、参与建立企业数据治理体系，涵盖数据标准、质量、安全、元数据管理等模块，制定相关制度、流程及技术规范；2、基于业务规划，落地主数据流程和标准建设，规划建立相关的工具系统平台;2、构建全面的能反映服务业务线发展健康度的关键指标体系，并基于指标体系，及时发现与定位业务问题3、设计数据质量监控规则，建立常态化评估机制，协同业务部门提升数据准确性及完整性。4、参与数据中台的建设流程和规范设计，...,计算机软件,http://jobs.zhaopin.com/CC621497980J40775937109.htm,500-999人,2026-01-09 01:23:01
数据治理,郑州,河南淼泓信息工程有限公司,本科,3-5年,"数据治理,数据仓库,大数据开发",8000-13000元,岗位职责: 1. 负责公司数据治理相关工作2. 确保数据的准确性和及时性，提升数据质量3. 与团队合作，共同完成数据治理项目任职要求: 1. 本科及以上学历，计算机、统计学、大数据等相关专业2. 能够高效处理数据，具备较强的分析和解决问题的能力具备良好的沟通能力和团队合作，对数据治理有一定的了解和兴趣,云计算/大数据,http://jobs.zhaopin.com/CCL1316153970J40820710109.htm,20-99人,2025-12-26 01:25:20
ETL开发（国企+长期稳定项目+五险一金）,郑州,软通动力信息技术(集团)股份有限公司,本科,5-10年,"分布式系统开发经验,ETL设计/开发经验,ERP数据库经验,Redis",9000-13000元,"1、具有5年以上数据研发或者测试经验，对数据仓库、数据平台、数据引擎领域知识有较好储备；2、必须有财经领域的工作经历，必须有ERP经验，熟悉ERP数据流3、熟悉数据仓库架构，并精通至少一种数据库产品；4、熟悉数据仓库模型设计、ETL开发、维度建模设计方法，具备海量数据处理经验；5、具备出色的需求分析能力及快速学习能力，能深入理解复杂的业务逻辑,具备良好的团队合作精神，具备出色的沟通能力",互联网,http://jobs.zhaopin.com/CC000544460J40660999116.htm,10000人以上,2025-12-23 01:46:06
数据开发工程师长期,郑州,八六三软件,大专,5-10年,"Python,Flink,Spark,Hive,SQL,阿里云平台数据",1-1.3万,【高级大数据开发工程师】岗位职责：1、参与项目蓝图规划、需求分析，根据需求设计文档、准确且高质量完成代码编写及技术文档编写:2、按照项目计划，完成开发任务，确保项目进度和质量；3、负责系统上线后的技术服务支撑，保障生产环境安全、平稳运行，支撑业务发展；4、对技术难点进行探索和预测，独立执行实施方案。任职要求：1、大专以上学历，计算机相关专业，5年以上项目研发经验；2、责任心强，沟通能力强，熟悉掌握...,计算机软件,http://jobs.zhaopin.com/CC621497980J40825725309.htm,500-999人,2026-01-07 20:14:57
大数据开发工程师,郑州,郑州科瑞思拓软件科技有限公司,本科,10年以上,"数据仓库,数据建模",9000-13000元,岗位职责1、负责公司大数据应用产品的平台搭建、架构优化、技术迭代和开发维护，提供稳定的大数据平台服务；构建数据存储、数据挖掘、数据计算及数据服务于一体的大型分布式数据平台；2、负责构建和维护算法平台，对海量数据进行离线计算、实时计算等分析挖掘；协同数据分析师，根据业务场景设计并实现数据模型和服务模型，并跟进和评估模型效果，确保算法和模型的有效落地；3、持续学习了解大数据领域的新技术，并结合实际需求...,计算机软件,http://jobs.zhaopin.com/CC393603820J40783635803.htm,100-299人,2025-12-07 09:56:11
数据分析专员,郑州,北京安鸿羽机械设备有限公司,本科,经验不限,"数据治理,数据挖掘,数据建模,Sql",7000-13000元·13薪,岗位内容：1. 收集、整理和分析各类数据，为公司提供基础数据和决策支持。2. 建立和维护各种类型的数据指标和报告，跟踪业务进展和趋势。3. 参与规划和执行公司数据战略，推动数字化转型和技术创新。4. 探索和应用数据挖掘和机器学习技术，提高数据价值和利用效率。任职要求：1. 熟练使用常见的数据分析工具和平台，如Excel、SQL、BI工具等。2. 具备较强的数据处理和分析能力，可以根据业务需求制定相...,电气机械/电力设备,http://jobs.zhaopin.com/CCL1501746840J40823062702.htm,100-299人,2025-10-21 15:02:11
大数据开发工程师,郑州,八六三软件,大专,5-10年,"数据仓库,数据库开发,Flink",1.1-1.3万,岗位职责：1、参与项目蓝图规划、需求分析，根据需求设计文档、准确且高质量完成代码编写及技术文档编写:2、按照项目计划，完成开发任务，确保项目进度和质量；3、负责系统上线后的技术服务支撑，保障生产环境安全、平稳运行，支撑业务发展；4、对技术难点进行探索和预测，独立执行实施方案。任职要求：1、计算机相关专业，5年以上项目研发经验；2、责任心强，沟通能力强，熟悉掌握阿里云平台数据开发技术；3、精通Hiv...,计算机软件,http://jobs.zhaopin.com/CC621497980J40762538809.htm,500-999人,2025-12-01 16:17:14
数据采集员 单人宿舍+五险+餐补+福利,郑州,郑州华原机械有限公司,大专,无经验,"SQL,数据统计",6000-12000元,工作内容：1、负责对公司相关文章视频进行各个网络平台转发；2、负责网络平台相关信息搜集、整理、统计、分析、归类、反馈、汇报；3、负责网络平台点赞评论回复；4、公司安排的临时性工作事宜；5、工作内容简单，入职培训，上手快，接受小白，不要求工作经验；6、提供丰富技能培训，可转岗至更有发展前景的岗位 例如运营岗；7、服从领导管理，较高的薪酬绩效体系，完善的培训体系，有专门培训人员进行培训； 任职要求： ...,专用设备制造,http://jobs.zhaopin.com/CCL1507155770J40850790103.htm,100-299人,2026-01-12 01:06:06
6k-1w报表开发工程师数据开发,郑州,宿州飞鑫文化传媒有限公司,学历不限,经验不限,"SQL,MySQL,报表开发,数据清洗,数据可视化,FineBI,FINEDATALINK,FineReport",6000-12000元,注意！此岗位需要来安徽省宿州市上班！待遇保底6000-10000元招报表开发工程师职位描述1.项目设计：参与项目经理组织的需求调研、需求分析会议。2.项目开发：基于模板应用开发需求，使用finereport、finebi等帆软产品，完成模板应用搭建开发工作，包含但不限于报表、大屏、移动端等；3.项目测试：具备自测能力4.项目交付：具备一定实施部署能力，保持项目文档的完整、连续和可追溯性。任职资格1...,文化艺术/娱乐,http://jobs.zhaopin.com/CCL1348710510J40744633506.htm,500-999人,2026-01-12 00:11:20
大数据开发（项目制）,郑州,八六三软件,本科,5-10年,"数据中台开发,数据库开发",1-1.2万,岗位职责：1、参与项目蓝图规划、需求分析，根据需求设计文档、准确且高质量完成代码编写及技术文档编写:2、按照项目计划，完成开发任务，确保项目进度和质量；3、负责系统上线后的技术服务支撑，保障生产环境安全、平稳运行，支撑业务发展；4、对技术难点进行探索和预测，独立执行实施方案。任职要求：1、计算机相关专业，5年以上项目研发经验；2、责任心强，沟通能力强，熟悉掌握阿里云平台数据开发技术；3、精通Hiv...,计算机软件,http://jobs.zhaopin.com/CC621497980J40816519609.htm,500-999人,2026-01-10 01:27:07
信息采集员 单人宿舍+五险+餐补+福利,郑州,郑州华原机械有限公司,大专,无经验,"SQL,数据统计",6000-12000元,工作内容：1、负责对公司相关文章视频进行各个网络平台转发；2、负责网络平台相关信息搜集、整理、统计、分析、归类、反馈、汇报；3、负责网络平台点赞评论回复；4、公司安排的临时性工作事宜；5、工作内容简单，入职培训，上手快，接受小白，不要求工作经验；6、提供丰富技能培训，可转岗至更有发展前景的岗位 例如运营岗；7、服从领导管理，较高的薪酬绩效体系，完善的培训体系，有专门培训人员进行培训； 任职要求： ...,专用设备制造,http://jobs.zhaopin.com/CCL1507155770J40850790703.htm,100-299人,2026-01-12 01:06:06
