职位,城市,公司,学历,经验,技能,薪资,工作描述,行业,职位URL,公司规模,发布时间
数据分析专员,郑州,河南泛锐复合材料研究院有限公司,本科,3-5年,SPSS,8000-10000元,岗位描述;1、公司销售数据的统计、分析呈现、系统数据核查校验等，确保数据的准确性和完整性;2、运营成效的过程监测，周度检视，并进行数据挖掘，洞察问题与机会，数据产出;“3、通过数据监控、数据报表、数据分析等方法，对战略客户及重要客户经营指标、异常数据进行监控、对业务异常指标进行预警和解读辅助业务部门进行运营策略优化;4、业务部岗位绩效指标核算、月度及季度绩效考核5、运用数据分析工具，基于客户信息和...,船舶/航空/航天/火车制造,http://jobs.zhaopin.com/CC265710580J40677262514.htm,500-999人,2025-12-14 00:25:01
数据分析工程师,郑州,重庆青山工业有限责任公司郑州分公司,本科,1-3年,数据治理,5000-10000元,"岗位职责：1、负责公司服务器、网络设备及操作系统的日常维护及故障处置，保障系统稳定运行；2、负责业务数据的采集、清洗与整理，通过统计分析方法挖掘数据规律，结合业务场景（如运营、营销、质量）形成分析结论；3、协助团队通过数据优化业务流程，提供决策建议；5、领导安排的其他工作。基本要求：1、1年以上系统维护经验，熟悉Windows系统及网络基础知识,动手能力强，能独立解决常见故障，有应急处理经验更佳；...",汽车研发/制造,http://jobs.zhaopin.com/CCL1285404330J40797453012.htm,100-299人,2025-12-13 18:00:00
数据治理工程师,郑州,河南景信信息技术有限公司,大专,3-5年,数据治理,8000-10000元,岗位职责：1、数据治理落地推进：主导数据治理项目全流程实施，涵盖需求调研、方案设计、执行落地与效果复盘，协调技术、教务、行政等跨部门资源，解决项目卡点，确保治理目标高效达成。2、数据体系规范搭建：参与数据全生命周期管理制度、技术规范及操作流程制定，设计数据标准（如编码、格式、口径）与数据模型，优化数据架构，为数据资产化奠定基础。3、数据质量管控：构建多维度数据质量监控体系（完整性、准确性、一致性等...,计算机软件,http://jobs.zhaopin.com/CCL1469729100J40801007301.htm,20-99人,2025-10-28 10:55:45
数据分析工程师,郑州,郑州英高克通信技术有限公司,本科,1-3年,"数据治理,数据挖掘,数据建模,Sql,Python,Matlab",6000-10000元,职位描述1、需求沟通转化阶段：与数据需求方进行需求调研和分析，精准理解业务需求，转化为分析或建模问题并提供技术解决方案。2、电网业务数据分析：结合多源异构数据对电网用电行为、电量、设备数据进行分析，剖析业务问题。3、电网模型开发与优化：结合建模方法论、特征工程及算法能力，构建数据分析挖掘的电网数据模型。4、数据验证阶段：结合业务系统数据完成数据准确性、业务合理性等方面验证工作。5、日常数据运营：配...,IT服务,http://jobs.zhaopin.com/CC434451310J40845880503.htm,20-99人,2025-10-20 10:51:53
数据分析师,郑州,郑州视群市场调查有限公司,本科,1-3年,"数据挖掘,数据建模,机器学习,Python,R语言,SPSS",7000-10000元,岗位职责：1.参与市场研究项目沟通，准确、全面理解客户需求；2.根据客户需求制定调查内容、抽样方法和数据分析模型；3.负责项目过程中的数据清洗，运用分类和回归算法进行数据分析，撰写市场研究报告；4.研究大数据前沿的数据挖掘技术，并应用于工作实践。任职要求：1.统计学、应用数学、计算机等相关专业毕业，本科及以上学历，1-2年以上数据挖掘工作经验;2.扎实的机器学习和数据挖掘的理论基础，熟练掌握R、S...,咨询服务,http://jobs.zhaopin.com/CC401615414J00438122106.htm,20-99人,2025-04-30 00:23:03
大数据开发工程师,郑州,上海克娜蒂科技有限公司,本科,无经验,大数据,6000-9000元,任职要求1、对大数据分析与开发有一定的技术基础，数据库 Python 等技术有一定的了解；有计算机Linux 数据库MySQL和Oracle数据库基础操2、具备良好的逻辑思维能力和问题解决能力，能够独立完成数据分析任务；3、能够与团队成员有效沟通，共同推进项目的进展。4、要求专业为计算机科学 软件工程 大数据等相关专业。本科及以上学历，公司新项目，急招，可接受应届本科毕业生。5、高底薪项目奖金、年...,计算机软件,http://jobs.zhaopin.com/CCL1515029620J40832989405.htm,20-99人,2026-01-11 01:12:31
BI数据工程师,郑州,河南乐享微生活贸易有限公司,大专,1-3年,,7000-9000元,岗位职责：1. 数据仓库开发与维护负责电商业务数据仓库建设，包括模型设计、数据清洗、指标加工、任务调度，确保数据的准确性、稳定性与时效性。2. 多源数据集成与治理对接 ERP、OMS、WMS、客服系统、投放系统、平台 API（淘宝/京东/拼多多/快手/抖音）等多源数据，完成采集、清洗、规范与标准化建设。3. BI 报表与可视化搭建使用 FineBI、Power BI、QuickBI、Tableau...,互联网,http://jobs.zhaopin.com/CC289456680J40782197516.htm,300-499人,2025-12-31 01:45:55
大数据分析师,郑州,北京外企人力资源服务河南有限公司,本科,1-3年,"数据挖掘,数据治理,数据建模,Python,R语言,Matlab",7000-9000元,岗位内容：1. 分析和挖掘大量的数据源，为业务发展和决策提供支持。2. 负责开发、维护和优化各类数据仓库和数据报表，保证数据质量和准确性。3. 与业务团队紧密合作，深入了解业务需求，提供全面的数据分析解决方案。4. 执行并监督指标和KPI体系，跟踪业务进展和成效。任职要求：1. 具备统计学、数学、计算机科学或相关领域的本科及以上学历，并拥有至少两年相关工作经验。2. 精通SQL语言和常用的数据分析...,人力资源服务,http://jobs.zhaopin.com/CC329281210J40817564501.htm,100-299人,2025-12-30 11:21:59
数据分析师,郑州,郑州天璇新材料有限公司,本科,1-3年,,6000-9000元,岗位职责：1.承担车间生产数据的采集、整合及统计工作，目的是保证数据的准确性与全面性。2.依据车间的生产安排，及时更新和保持生产数据的时效性，涵盖生产量、生产周期和产量等关键指标。3.对车间生产数据进行深入分析、汇总并向上级报告，为生产管理层的决策提供数据支撑。4.周期性地对车间生产数据进行分析与评估，识别存在的问题并提出相应的优化建议。5.协助车间经理进行生产计划的编排与调度工作，以保障生产任务...,电子/半导体/集成电路,http://jobs.zhaopin.com/CCL1466379940J40816485111.htm,300-499人,2025-12-24 16:14:50
电商数据分析师,郑州,河南弥玥泉化妆品销售有限公司,本科,3-5年,"报表开发,数据仓库,Sql,Python",6000-9000元,【岗位职责】1.统筹全平台店铺经营数据（GSV、转化率、客单价、流量结构等）收集与分析，识别异常波动并预警，并提供月报、半年报、年报等数据报表支持；2.针对数据环节中的问题、薄弱环节和漏洞，提出可落地方案，对分析结果进行整理和呈现，编制报告，为决策提供数据支持。3.协同财务部门建立利润模型，测算毛利、净利、活动roi等重要数据，输出数据结论，支持高层决策：定期输出经营分析报告，预测季度/年度业绩达...,零售/批发,http://jobs.zhaopin.com/CCL1500389180J40769152205.htm,100-299人,2025-12-23 11:40:16
数据分析员,郑州,河南中油电力设计工程有限公司,本科,经验不限,,5000-9000元,岗位职责:1.负责搜集电力市场交易、结算的相关国家政策;跟踪、整理、分析市场的交易规则和相关政策; 2.负责电力市场的日常交易操作，包括购电、售电及合同管理等; 3.日常交易数据整理、分类、参与进行购电价格策略研究、售电报价与分析、收益分析; 4.维护电力交易系统中相关数据、合同、客户信息(包括注册资料、合同、用电数据等)，定期出具经营数据分析; 5.跟踪、预判天气状况，收集跟踪各电力市场供需形势...,电力/水利/热力/燃气,http://jobs.zhaopin.com/CC347889680J40812989701.htm,20-99人,2025-12-09 10:33:53
数据分析师（潮玩、IP类经验）,郑州,定成(郑州)商贸有限公司,本科,1-3年,"数据治理,BI工具,Sql,Power BI,FineBI",6000-8000元·13薪,1.日常数据处理与分析负责商品部日常数据的清洗、整理与深度分析，聚焦潮玩盲盒业务的销售表现、库存周转、价格波动、隐藏款/热门系列追踪等，确保业务数据的高质量与可用性。熟练运用Excel、SQL等工具，定期生成商品采购、促销策略、系列规划等业务所需的标准化及定制化分析报表。2.供应链指标体系搭建与优化针对潮玩行业特点，梳理并构建贴合盲盒业务的供应链核心指标体系（如系列生命周期库存周转、爆款缺货率、新...,零售/批发,http://jobs.zhaopin.com/CCL1391083050J40819734711.htm,1000-9999人,2026-01-08 14:25:25
电商数据分析专员,郑州,南京优越健康科技有限公司,本科,1-3年,"数据挖掘,数据建模,数据仓库",5000-8000元·13薪,岗位职责：1：负责电商平台的数据收集、整理和分析。2：利用数据分析工具监控电商运营状态，为决策提供数据支持。3：定期输出数据分析报告，对销售策略和产品优化提出建议。岗位要求：1：1-3年电商数据分析工作经验。2：熟练使用数据分析必备的软件工具。3：有互联网电商大厂工作经验者优先考虑。公司福利： 1、年终十三薪制；五险（养老、失业、工伤、医疗、生育）+商业险； 2、休班假期：带薪年假、婚假、产假以及...,电子商务,http://jobs.zhaopin.com/CC341460610J40883815104.htm,500-999人,2025-12-31 17:47:22
数据治理专员,郑州,贵州朋航科技有限公司,本科,经验不限,"数据库开发,数据建模,数据治理",4000-8000元,"、构建和优化企业数据治理体系，提升数据管理能力；2、制定和实施数据标准化、元数据管理、数据安全等策略；3、设计并推动数据共享交换机制，完善数据架构与数据目录；4、协助业务部门理解数据需求，促进数据驱动的业务决策；5、监控数据质量，确保数据的准确性、完整性和一致性；6、公司安排老带新，积累经验可晋升专业技术人员。任职要求：1、20-30岁，大专及以上学历，计算机相关专业优先；2、熟练GDPR,CCP...",IT服务,http://jobs.zhaopin.com/CCL1456263840J40805348907.htm,20-99人,2025-12-23 01:18:03
数据分析师助理,郑州,郑州越皓网络科技有限公司,本科,无经验,Java,5000-8000元,任职要求：1、统计学、应用数学、信息与计算科学、数学等相关专业本科及以上学历；2、熟悉常用的数据挖掘算法，包括分类、聚类、时间序列预测等； 岗位描述：1. 深入理解业务相关数据分析，管理公司全域数据资产，提升数据的易用性；2. 分析用户需求，基于数据资源，通过聚类，回归，关联规则挖掘等数据分析算法，为用户提供各类数据分析服务；3、为公司项目提供数据分析技术支撑。,人工智能,http://jobs.zhaopin.com/CCL1411727170J40526495715.htm,20-99人,2025-12-23 00:00:01
大数据分析（蒸汽热）,郑州,河南百川畅银环保能源股份有限公司,本科,3-5年,"数据挖掘,报表开发,数据治理,Sql,Python,蒸汽热、锅炉,能源与动力工程",6000-8000元,工作职责：1、负责搭建数据分析体系，整合和管理移动储热等业务全链路数据。2、监控设备运行数据，进行能效评估、故障预警及优化分析，支持产品研发与运营。3、建立热源供给与用户需求的预测模型，支持业务调度与供需匹配。4、开发数据看板与报告，实时监控业务状态，支持管理决策。5、规划大数据分析逻辑，支持智慧能源平台的发展与优化。6、基于数据探索新业务模式，如碳资产核算、金融服务等。任职要求：1、本科及以上学...,新能源,http://jobs.zhaopin.com/CC365634130J40857298302.htm,1000-9999人,2025-11-12 16:34:28
双休+数据分析,郑州,河南烽烟商贸有限公司,高中,经验不限,"数据建模,R语言,Python",6000-8000元,岗位内容：1. 协助经理收集和整理大量的数据，设计并实施数据分析模型和算法。侧重用算法（如机器学习）处理大规模数据，预测趋势（如用户流失预测、销量预测）。 2. 评估现有的数据库，并根据需要进行清理、转换和预处理。 对数据结果进行解释和汇报，向相关部门提供数据分析技术支持。 3.具备清晰的分析思路，能从复杂数据中定位关键问题，推导合理结论。 薪资待遇： 底薪4500起➕奖金，综合6000+ 上班时...,零售/批发,http://jobs.zhaopin.com/CCL1501808920J40749724316.htm,20-99人,2025-10-22 09:56:59
软件测试工程师课程/培训招生(ZZ）,郑州,51Testing,大专,经验不限,"软件测试,测试,游戏软件,工业软件,物流软件",6000-8000元,岗位条件： 1、年龄20-32周岁，超龄勿扰； 2、学历大专及以上，理工科专业毕业优先录用； 3、对互联网行业感兴趣（非销售、非保险岗位）； 4、工作认真、细致、敬业，责任心强； 5、想获得一份有长远发展、稳定、有晋升空间的工作。 待遇： 1、基本工资，另有项目奖金和提成； 2、五险一金，双休、法定节假日，正常休息； 3、公司工作环境优雅、氛围好，同事关系融洽，生日派对、聚餐等活动丰富； 4、给予...,计算机软件,http://jobs.zhaopin.com/CC145362720J40257618902.htm,100-299人,2025-09-05 09:56:03
大数据开发实习生,郑州,滑县巨旺商贸有限公司,大专,经验不限,"数据治理,Sql",6000-8000元,岗位内容：1. 参与设计、实现和维护数据管道和 ETL 流程。2. 进行数据处理和分析，确保数据质量和完整性。3. 支持用户在数据仓库中制定与需求相符的报表或 Dashboard。4. 协助其他团队成员处理数据相关问题并解决疑难杂症。任职要求：1. 熟悉至少一种主流数据库及SQL 语言。2. 了解基础的数据结构和算法，具备简单的编程知识。3. 具备数据挖掘、数据清洗和数据处理的基本能力。4. 具备...,电子商务,http://jobs.zhaopin.com/CCL1486365070J40811999013.htm,20-99人,2025-08-12 16:31:50
BI实施工程师,郑州,河南启智信息科技有限公司,本科,3-5年,,5000-7000元,【福利待遇】 1、整层办公，冬暖夏凉； 2、法定假期、单双轮休； 3、交通便利，地铁2号线东风路站，紧挨正弘城； 4、员工生日会、节假日福利、户外团建、公费旅游、多种补贴； 5、日常配备：冰箱、微波炉，可自行带饭&加热，减少生活开支。 【 岗位职责】1、沟通和整理客户的业务流程及需求；2、负责bi项目的报表设计及开发；3、负责项目整体的推进和验收工作。【任职要求】1、熟悉进销存、ERP、MRP管理...,计算机软件,http://jobs.zhaopin.com/CC308868010J40540400904.htm,100-299人,2026-01-12 01:07:36
环境监测数据工程师（工作地：河南省生态环境厅）,郑州,福州福光水务科技有限公司,硕士,经验不限,"水生态,水资源,报告,平台,水质",6000-7000元,岗位职责：1. 负责省环境监测中心数据监控平台的管理工作；2. 对水质监测数据进行分析和研究；3. 编制水质相关的报告；岗位要求：1. 硕士学历，环境或化工相关专业，经验不限；2. 熟练掌握办公软件，工作细心、认真；3. 有相关工作经验者优先。 福利：◆在职培训教育机会 ，完善的员工培训制度及职业生涯规划。◆提供六险一金（养老保险、失业保险、工伤保险、生育保险、医疗保险、住房公积金、商业意外险）。...,仪器仪表制造,http://jobs.zhaopin.com/CC138229170J40837781805.htm,500-999人,2026-01-09 13:34:25
数据分析员,郑州,河南海一云商实业集团有限公司,本科,1-3年,"BI工具,数据挖掘,数据建模",5000-7000元,"职位描述：1. 负责集团内外部数据的整理、分析,建立和深度挖掘相关的分析统计模型;2. 建立重要的数据监控流程,周期性的提供运营分析报告;3. 负责专项数据分析,完成部门分配的其他数据分析任务。 职位要求：(1) 本科以上学历、计算机专业优先考虑;(2) 熟练使用PPT,EXCEL,MYSQL,帆软BI等工具，具有丰富的数据分析和数据挖掘经验。(3) 对数据具有高度的敏感度和警觉性,较强的逻辑分析...",零售/批发,http://jobs.zhaopin.com/CC673304930J40773420208.htm,1000-9999人,2025-12-31 11:33:04
数据分析师/双休/五险,郑州,郑州艾科申网络科技有限公司,大专,经验不限,"数据挖掘,数据治理,数据仓库,Python,R语言,Sql",5000-7000元,岗位内容:1.收集和整理大量的数据，设计并实施数据分析模型和算法。2.评估现有的数据集，并根据需要进行清理、转换和预处理。3.对数据结果进行解释和汇报，向相关部门提供数据分析技术支持。任职要求:1.专科及以上学历。2.具备较强的服务意识和专业技能，能够快速响应客户需求。3.具有较强的沟通协调能力和团队合作精神。薪资待遇：朝九晚六，周末双休，法定节假日正常休，入职缴纳五险，固定薪资➕绩效，综合7k➕...,电子商务,http://jobs.zhaopin.com/CCL1496023650J40776570707.htm,20-99人,2025-12-26 18:22:58
数据分析专员,郑州,河南大河速递有限公司,本科,3-5年,"SPSS,SAS,R语言",4000-7000元,岗位描述：1.熟悉数据库技术，能高效地与业务、技术团队沟通，对业务数据进行收集、整理、对系统数据进行整合分析；建立各类数据分析报表。2.配合管理要求，提供各个维度的数据分析与预测，以提高业务可持续性；完善数据支撑平台。3.参与公司数据分析模型的规划和建设；参与数据系统模型的建立，并对数据模型进行适配和优化4.具备良好的数据敏感度，市场洞察力，能从大量数据提炼核心结果，并用简洁清晰的方式呈现数据分析...,货运/物流/仓储,http://jobs.zhaopin.com/CCL1461598230J40795222214.htm,100-299人,2025-09-05 17:40:26
数据分析师,郑州,上海澄美信息服务有限公司郑州分公司,本科,1-3年,"报表开发,数据仓库,数据挖掘,Sql",5000-7000元,1、负责对接业务部门，协同优化业务发展指标，开展业务跟踪与分析，推动问题解决。2、报表开发，处理数据相关业务的日常数据分析，并将数据可视化展示。3、建立多维分析体系，针对业务需求进行业务数据提取、监控、清洗、更新、统计，日报月报的出具及通报，开展运营情况分析并输出分析材料。4、基于统计分析项目的运营支撑工作，协同项目交付工作，保障项目运营5、大数据、数据科学、数学、统计学或相关专业，熟练掌握(SQ...,运营商/增值服务,http://jobs.zhaopin.com/CC288833110J40741588301.htm,1000-9999人,2025-08-19 00:01:01
高薪诚聘！数据分析师+双休(不加班！不加班！）,郑州,河南隆凯信息科技有限公司,学历不限,经验不限,,4000-7000元,岗位内容： 1. 协助经理收集和整理大量的数据，设计并实施数据分析模型和算法。 2. 评估现有的数据集，并根据需要进行清理、转换和预处理。 3. 对数据结果进行解释和汇报，向相关部门提供数据分析技术支持。 薪资待遇： 底薪4500➕奖金，综合6000+ 上班时间： 早九晚六，中午休息一个半小时，周末双休！,专业技术服务,http://jobs.zhaopin.com/CCL1499498480J40733649810.htm,20-99人,2025-08-13 10:21:24
兼职数据清洗,郑州,河南宇斯数据科技有限公司,大专,经验不限,,150-300元/天,1：在校大学生，校内完成即可，需要有电脑（数据需保密）2：数据内容主要为视频采集工具生成的图片3：计算机应用或大数据处理等相关专业，会使用专业工具进行预处理、精准去重、质量赛选、去冗余等操作。,人工智能,http://jobs.zhaopin.com/CCL1506328790J40900775508.htm,20-99人,2025-12-15 01:21:58
数据加工实习生,郑州,濮阳市鹿特科技有限公司,学历不限,经验不限,"数据爬虫,数据埋点,数据抽取,Python,SQL,Java,Heritrix,Nutch",5000-6000元·13薪,数据爬虫数据埋点数据抽取PythonSQLJavaHeritrixNutch云计算/大数据计算机软件人工智能岗位职责： 1.负责完成数据采集需求，完成采集站点分析、数据采集、数据结构化，数据质量保障以及外部数据维护工作。 2.负责对数据清洗治理等数据治理工作。 3.完成项目组安排的其他工作。 任职要求： 1.学历不限，专业不限。 2.工作认知细致，责任心强。 3.熟练使用常用办公软件、MySQL等...,互联网,http://jobs.zhaopin.com/CCL1503725100J40790734913.htm,300-499人,2026-01-10 01:38:17
数据采集与分析,郑州,郑州恩思特企业管理咨询有限公司,本科,经验不限,,3000-6000元,岗位职责： 1.协助项目经理制定与完成调研项目计划与方案； 2参与公司所开展调研项目的实地走访，对已采集数据进行整理、汇总、分析，并结合数据走势与分布，撰写数据报告； 3.对所参与项目涉及的各项数据资料做好管理、保密的工作； 4.认真完成参与市场调研项目的数据采集工作，与客户保持良好沟通； 5.完成领导交办的相关工作。 任职要求： 1.本科以上学历，统计学/金融学/财务专业/工商管理/市场营销/经...,广告/营销,http://jobs.zhaopin.com/CC272188680J40405453412.htm,20人以下,2026-01-09 01:31:46
数据采集员 单人宿舍+五险+餐补+福利,郑州,郑州中平电子商务有限公司,大专,1-3年,SQL,4000-6000元,工作内容：1、负责对公司相关文章视频进行各个网络平台转发；2、负责网络平台相关信息搜集、整理、统计、分析、归类、反馈、汇报；3、负责网络平台点赞评论回复；4、公司安排的临时性工作事宜；5、工作内容简单，入职培训，上手快，接受小白，不要求工作经验；6、提供丰富技能培训，可转岗至更有发展前景的岗位 例如运营岗；7、服从领导管理，较高的薪酬绩效体系，完善的培训体系，有专门培训人员进行培训；8、认真负责的...,电子商务,http://jobs.zhaopin.com/CCL1505278020J40776427314.htm,500-999人,2026-01-04 01:35:52
数据库工程师,郑州,濮阳市鹿特科技有限公司,学历不限,经验不限,"Java,C语言,C++,SQL Server,PostgreSQL,MySQL",5000-6000元·13薪,JavaScalaPythonOracleMySQLPostgreSQL JavaPythonScala 1、负责项目内检察院业务系统日常的运行维护（部署更新、数据库维护、数据备份、应急恢复、故障处理等）； 2、负责售后技术支持； 3、负责用户使用培训，解决用户使用问题； 任职要求： 1、计算机相关专业； 2、具有良好的沟通、表达能力； 3、熟练掌握Oracle、MySQL、达梦、人大金仓等主流数...,互联网,http://jobs.zhaopin.com/CCL1503725100J40790723213.htm,300-499人,2026-01-10 01:38:17
诚聘--数据分析主管006,郑州,郑州恩思特企业管理咨询有限公司,本科,1-3年,数据采集 数据分析 市场调研,4000-6000元,岗位职责：1、起草项目建议书、参与项目前期客户沟通；2、搜集项目相关信息，进行项目前期准备工作；3、制定研究方案，制作调研问卷；4、适时与客户沟通，并负责培训督导项目执行；5、根据项目要求，撰写项目报告和讲解演示。岗位要求：1、本科以上学历，统计学、心理学、社会学、经济学、管理学、市场营销等相关专业；2、良好的写作能力和沟通技巧，较强的执行力，善于学习；3、熟练操作Excel、PPT、SPSS等统...,广告/营销,http://jobs.zhaopin.com/CC272188680J40660480812.htm,20人以下,2025-10-17 00:18:20
数据采集,郑州,河南云数大数据科技有限公司,本科,经验不限,,3000-5000元,岗位职责：1、负责数据的收集、整理和统计分析；2、执行数据预处理操作，确保数据质量和格式符合要求；任职要求：1、具备良好的数据分析能力和统计学知识；2、良好的团队合作精神和沟通能力，能够高效协作；,互联网,http://jobs.zhaopin.com/CCL1413242990J40780877510.htm,20-99人,2026-01-12 01:26:09
