职位,城市,公司,学历,经验,技能,薪资,工作描述,行业,职位URL,公司规模,发布时间,薪资_最小值,薪资_最大值,年薪月数
算法开发工程师（OCR）,深圳,欣旺达电子,硕士,经验不限,"深度学习,机器学习,图像算法,自然语言处理,PyTorch",25000-50000,岗位职责：1、算法研发：负责文本检测（如CTPN算法、文字识别、版面分析等核心算法的开发与优化，需结合深度学习框架（如PyTorch、TensorFlow）实现模型训练与部署；2、技术落地：将算法集成到实际业务场景（如证件识别、文档自动化处理），解决图像预处理、去噪、矫正等工程问题；3、前沿跟踪：持续跟进OCR领域最新技术（如大模型时序数据预测，推动算法性能提升。技能要求：1、本科及以上学历；计算...,电子/半导体/集成电路,http://jobs.zhaopin.com/CC135947830J40814679611.htm,1000-9999人,2025-12-15 18:52:05,25000.0,50000.0,12.0
驻场大模型工程师,深圳,北京可利邦信息技术股份有限公司,本科,5-10年,"大模型算法,阿里百炼,PAI",30000-50000,PS：驻场佛山，工作地点在佛山。职位描述：1、为企业级客户AI智算大模型项目，提供服务支撑，包括但不限于工程方案设计、模型训练与调优、模型效果评估、code review、模型部署与运维、Prompt工程等工作；2、负责 PAI、PAI灵骏以及百炼等大模型训练平台的企业级客户技术支持，对接云上客户的多元化场景问题，聚焦大模型训练、部署环境、推理效率以及定制化链路集成等技术深度，负责疑难问题的快速定...,互联网,http://jobs.zhaopin.com/CC378282510J40825330410.htm,100-299人,2025-12-11 16:34:45,30000.0,50000.0,12.0
软件算法工程师,深圳,广州耐普新能源有限公司,硕士,1-3年,"C++,储能,逆变器,仿真软件",30000-50000,【岗位要求】1、协同团队完成级联型储能算法的编程、调试与测试工作，参与软件算法需求调研与制定，保障算法的可行性与落地性；2、独立负责储能 BMS 核心算法开发，涵盖电池状态估算、均衡控制、保护策略等关键模块，优化电池使用效率与安全性；3、主导上位机通信算法开发，适配 I2C、SPI、UART、CAN、RS485、Ethernet 等常用通讯总线协议，确保设备与上位机的稳定高效通信；4、与硬件、机构...,新能源,http://jobs.zhaopin.com/CCL1413788340J40857259712.htm,1000-9999人,2025-12-08 15:28:06,30000.0,50000.0,13.0
AI for Science 算法工程师,深圳,深圳市中科探云智能科技有限公司,博士,经验不限,"大模型算法,多模态算法,搜索/推荐算法,Python,C++,PyTorch,C#,图像算法,知识图谱,通信算法",40000-50000,岗位职责： 1、负责人工智能与生物等基础科学结合领域的算法开发、代码编写和文档撰写； 2、参与技术落地的应用开发与部署； 3、跟进 “AI + 基础科学” 前沿进展，验证技术并出具分析报告； 4、协助完成项目相关的算法调试、测试等工作。 岗位要求： 1、博士及以上学历，仪器设备应用、仪器科学与技术、法学、知识产权专业。 2、扎实掌握深度学习算法基础，熟悉 C++、Python 等编程语言及 PyT...,人工智能,http://jobs.zhaopin.com/CCL1495130400J40825804210.htm,20-99人,2025-12-06 00:00:03,40000.0,50000.0,12.0
感知算法工程师,深圳,劢微机器人科技(深圳)有限公司,硕士,1-3年,"机器人,C++,Python,深度学习",25000-50000,岗位职责：1、负责机器人车载感知算法开发与工程化部署，实现机器人在室内或室外环境中的感知能力;任职要求：2、必备C++工程能力，有linux使用经验，熟悉ros，了解python;3、熟悉深度学习，熟悉目标检测、目标跟踪、语义分割等常用算法；4、熟悉图像处理与点云处理；会使用Opencv、pcl等基础库。优先考虑：1、数学基础扎实。2、有无人叉车或AGV机器人同行业工作经验优先；3、发表过CVPR...,人工智能,http://jobs.zhaopin.com/CC871508020J40247166504.htm,100-299人,2025-12-05 14:44:53,25000.0,50000.0,12.0
视觉目标检测算法工程师（无人机）,深圳,深圳市塞防科技有限公司,本科,3-5年,,30000-50000,岗位职责：1.针对发反无业务场景，设计和实现多传感器融合感知、多目标跟踪、多传感器标定、目标存在置信度估计等方案；2.负责雷达、视觉、无线电频谱侦测、协议解析等多个不同传感器的数据融合，实现多目标长时序下稳定跟踪算法开发、维护和项目问题解决；3.负责多传感器观测数据的时间同步和传感器标定；4.负责多传感器融合中目标类别融合估计、目标存在置信度估计等。任职要求：1.硕士及以上学历，计算机、电子信息类...,智能硬件,http://jobs.zhaopin.com/CCL1474860650J40804016312.htm,100-299人,2025-12-03 11:14:28,30000.0,50000.0,15.0
AI模型工程师,深圳,卡莱特云科技股份有限公司,本科,经验不限,"强化学习 ,大模型算法,多模态算法,C语言,Python,机器视觉,自然语言处理,搜索/推荐算法,TensorFlow,PyTorch",25000-50000,工作职责1.模型训练与微调落地：负责 CV/NLP/ 多模态等 AI 模型(边缘/端侧)的训练、微调与迭代优化，针对广告显示、教育、工业、安防监控等边缘场景需求，定制模型效果优化方案，保障模型精度与业务指标达标。2.推理全流程优化：基于RK3588或同类边缘芯片的 NPU 算力特性，设计模型轻量化与推理适配方案，通过量化、剪枝、稀疏化等技术实现模型压缩，提升推理性能。3.软硬件协同优化：深入理解边...,电子/半导体/集成电路,http://jobs.zhaopin.com/CC462571410J40809613511.htm,1000-9999人,2025-11-26 17:27:40,25000.0,50000.0,16.0
控制算法工程师,深圳,劢微机器人科技(深圳)有限公司,硕士,1-3年,"控制算法,运动控制,C++,机器人,MATLAB",25000-50000,岗位职责：1、 负责单舵轮、双舵轮、差分轮、AMR的轨迹跟踪控制算法开发与维护; 2、建立各种工业无人车辆的正/逆运动学模型构建; 3、车辆运动控制离线仿真系统开发； 4、车辆控制参数自学习算法开发。 任职要求： 1、熟练使用C++，熟悉机器人操作系统ROS优先； 2、 有机器人控制算法开发经验，熟悉经典PID控制及其变种，熟悉现代控制理论； 3、硕士及以上学历，数学功底良好。 4、有基于MATL...,人工智能,http://jobs.zhaopin.com/CC871508020J40243119104.htm,100-299人,2025-12-05 14:34:43,25000.0,50000.0,12.0
ai大模型算法工程师,深圳,灵宝黄金,本科,3-5年,,35000-50000,岗位职责：1.基于场景，能够应用AI模型结合工具设计一个解决方案2.基于主流的训练和部署框架进行模型的微调，以及部署模型3.对现有的数据进行清洗，确保模型训练质量4.进行agent的开发，实现产品功能岗位要求：1.统招本科及以上学历，计算机相关专业背景；熟练使用python语言，以及 pytorch， tensorflow，sklearn等AI开发仓库2.熟悉各种深度学习人工智能框架以及背后原理，...,矿产/采掘,http://jobs.zhaopin.com/CCL1214984790J40900729108.htm,1000-9999人,2025-11-24 11:04:41,35000.0,50000.0,12.0
研发总监（高薪急聘）,深圳,启力联动信息科技(深圳)有限公司,本科,10年以上,"嵌入式硬件开发,嵌入式软件开发,摄像头,家用摄像头",30000-50000,岗位职责：1、根据公司发展战略，洞察用户需求和市场趋势，研究新技术发展方向，制定研发工作规划，参与制定年度发展战略、年度经营计划和预算方案，通过技术的实现推动公司战略目标的实现。2、负责研发中心的整体工作规划，制定团队目标和工作规划并监督执行。3、组织制定和执行研发中心重大技术决策和技术方案，包括公司应用架构的规划、代码标准的建立，核心业务的沉淀及可复用性。4、负责建立研发质量体系，组织制定技术开...,企业服务,http://jobs.zhaopin.com/CCL1499557920J40748722705.htm,20-99人,2025-11-18 09:51:25,30000.0,50000.0,12.0
硬件研发中心总监,深圳,竞业达,本科,5-10年,,35000-50000,岗位职责：1、负责组建深圳研发中心，重点面向智慧教学、智慧校园、实验设备、物联网传感器、嵌入式视音频设备等相关智能硬件的产品研发；2、负责研发中心团队的管理，包括招聘、培训、绩效评估和项目分配等工作。3、参与智能硬件的产品规划，跟踪行业动态与需求，及时引进新技术，持续优化现有设计方案。4、负责组织执行硬件架构设计、原理图设计、芯片选型、结构设计、嵌入式软件开发、硬件调试和测试等工作。5、负责硬件成...,计算机硬件,http://jobs.zhaopin.com/CC000563930J40798589503.htm,500-999人,2025-11-13 10:14:44,35000.0,50000.0,12.0
雷达信号处理算法工程师,深圳,深圳市塞防科技有限公司,本科,3-5年,"导航算法,信号处理,目标检查,目标跟踪,C语言,毫米波雷达",25000-50000,岗位描述：1.负责雷达系统算法设计与开发，完成算法仿真、验证及性能评估；2.负责与软硬件工程师协调，指导完成算法移植、问题分析、算法优化；3.配合完成系统集成、联调联试、外场试验以及技术支持工作，分析并解决项目开发中出现的信号处理相关问题；4.负责相关算法知识产权工作，撰写相关设计文档岗位要求：1.电子工程、通信、信号处理、自动化等相关专业方向，硕士及以上学历；2.精通信号处理的基本理论和算法，包...,智能硬件,http://jobs.zhaopin.com/CCL1474860650J40559585812.htm,100-299人,2025-11-19 14:50:53,25000.0,50000.0,15.0
研发部技术负责人,深圳,青岛罗博飞海洋技术有限公司,硕士,5-10年,算法基础,35000-50000,岗位职责：1、技术战略与架构把控：负责制定公司鱼类识别软件的技术发展战略和路线图，结合行业前沿技术（如视觉识别、大模型、数据库优化等），规划软件的整体技术架构，确保技术方向的先进性和可行性，为公司产品的长期竞争力提供技术支撑。2、团队管理与技术攻坚：领导前端、后端、AI 算法、数据库等技术团队，合理分配工作任务，搭建高效的技术研发体系。组织攻克鱼类识别领域的关键技术难题，如复杂场景下的鱼类精准识别...,专用设备制造,http://jobs.zhaopin.com/CC596552420J40869173508.htm,20-99人,2025-11-12 09:10:26,35000.0,50000.0,12.0
电机控制算法工程师,深圳,大族数控,本科,5-10年,,30000-50000,1、负责电机控制、滤波器、状态观测器、系统参数辨识等核心算法建模-仿真-嵌入式落地；2、负责前瞻Look-ahead，微小线段连续插补、自适应速度规划、振动抑制、轨迹规划等核心算法建模-仿真-嵌入式落地；3、与软件/硬件/团队成员协同合作解决项目研发的技术问题；4、编写高质量技术文档，包括算法设计文档、控制策略说明、测试报告与设计规范等，保障项目技术可追溯性与知识传承；5、持续跟踪运动控制领域的前...,电气机械/电力设备,http://jobs.zhaopin.com/CC334402310J40851011302.htm,1000-9999人,2025-11-03 15:33:33,30000.0,50000.0,12.0
AI模型工程师(J10188),深圳,卡莱特云科技股份有限公司,本科,1-3年,"强化学习 ,大模型算法,PyTorch,C++,TensorFlow,自然语言处理,搜索/推荐算法,机器视觉,C语言,Python,多模态算法",25000-50000,岗位职责:1.模型训练与微调落地：负责 CV/NLP/ 多模态等 AI 模型(边缘/端侧)的训练、微调与迭代优化，针对广告显示、教育、工业、安防监控等边缘场景需求，定制模型效果优化方案，保障模型精度与业务指标达标。2.推理全流程优化：基于RK3588或同类边缘芯片的 NPU 算力特性，设计模型轻量化与推理适配方案，通过量化、剪枝、稀疏化等技术实现模型压缩，提升推理性能。3.软硬件协同优化：深入理解...,电子/半导体/集成电路,http://jobs.zhaopin.com/CC462571410J40797725911.htm,1000-9999人,2025-10-23 16:38:12,25000.0,50000.0,16.0
EDA算法工程师,深圳,深圳市新凯来技术有限公司,本科,经验不限,"图像算法,C++,Python,EDA,优化算法",25000-50000,岗位职责：1、负责EDA软件相关算法设计开发；2、设计和实现矢量图，位图等相关优化算法；3、设计和实现版图文件快速读写，图素操作，性能优化等相关算法；4、结合上游需求开发和实现软件新接口，参与需求收集、方案设计、功能实现。岗位要求：满足以下3-4条即可1、熟悉C、C++或Python中的一种或多种编程语言，熟悉数据结构和算法，并掌握Linux操作系统的基本操作。2、熟悉至少一种测试框架，如GTes...,电子/半导体/集成电路,http://jobs.zhaopin.com/CCL1362239030J40769478515.htm,1000-9999人,2025-10-22 12:13:51,25000.0,50000.0,15.0
机器人c++软件开发工程师(A178436),深圳,小鹏汽车,本科,3-5年,,25000-50000,职位描述：职位描述您将与顶尖的机器学习团队密切合作，将最前沿的 AI 技术部署于人形机器人系统中。如果您对推动机器人技术的未来充满激情，并希望参与解决复杂的技术挑战，这将是一个激动人心的机会主要职责- 与机器学习工程师紧密协作，负责将端到端模仿学习、强化学习和大语言模型等最新技术部署于人形机器人中，开发并优化深度学习的 C++ 推理管道。- 设计并实现通信、数据采集、监控等中间件，优化机器人算力，...,汽车研发/制造,http://jobs.zhaopin.com/CC405839980J40895977915.htm,10000人以上,2025-10-16 16:38:59,25000.0,50000.0,15.0
技术经理/总监,深圳,大族数控,本科,10年以上,"光刻,光学系统,精密机械",25000-50000,岗位职责：1、主导我司核心设备技术研发，统筹光、机、电、软、算等多学科交叉技术攻关。2、整合多学科技术，优化精密光学系统、精密机械、光电系统、工业软件等关键技术。3、构建及领导跨学科研发团队，建设技术标准体系、专利策略等。4、了解前沿技术方向，推动技术转化，应用前沿技术提升产品的核心竞争力。 任职要求：1、本科及以上学历，光学、机械、电子、自动化、计算机、数学、物理等相关专业（光/机/电/软/算学...,电气机械/电力设备,http://jobs.zhaopin.com/CC334402310J40703836402.htm,1000-9999人,2025-10-13 14:54:24,25000.0,50000.0,12.0
大语言模型方向科研人员,深圳,人工智能与数字经济广东省实验室(深圳),博士,经验不限,"PyTorch,文本分析,语义分析,文本分类,文本挖掘,AGENT,知识记忆,LLM,昇腾",26000-50000,岗位职责:参与端侧大语言模型、大模型推理时计算研发工作，包括但不限于：1.研究端侧大语言模型针对端侧场景的重点能力增强，包括知识记忆和运用、逻辑与数理推理、指令理解与规划决策、代码和工具使用等方面的能力。2.开展复杂环境下端侧大模型轻量化知识迁移与持续学习研发工作。3.聚焦大模型推理的强化学习算法优化研发，基于预训练流程优化的模型推理能力增强，基于知识蒸馏的推理增强，任务难度自适应的推理研发。任职...,人工智能,http://jobs.zhaopin.com/CCL1392292510J40958083604.htm,20-99人,2025-10-12 13:41:43,26000.0,50000.0,15.0
研发总监,深圳,深圳市麦驰智慧技术有限公司,本科,5-10年,,40000-50000,1、有安防、康养、智能化行业5-10年同岗位工作经验；至少带过60人研发团队； 2、对软件、硬件都熟悉，偏软件擅长； 3、思路敏捷，逻辑性强，擅长沟通、管理；,电子/半导体/集成电路,http://jobs.zhaopin.com/CC354352310J40637562716.htm,100-299人,2025-09-29 15:53:17,40000.0,50000.0,12.0
研发总监（安防摄像头）,深圳,启力联动信息科技(深圳)有限公司,本科,5-10年,"嵌入式技术,研发总监,嵌入式软件开发,APP平台开发管理,技术决策,团队管理",30000-50000,岗位职责：1、根据公司发展战略，洞察用户需求和市场趋势，研究新技术发展方向，制定研发工作规划，参与制定年度发展战略、年度经营计划和预算方案，通过技术的实现推动公司战略目标的实现。2、负责研发中心的整体工作规划，制定团队目标和工作规划并监督执行。3、组织制定和执行研发中心重大技术决策和技术方案，包括公司应用架构的规划、代码标准的建立，核心业务的沉淀及可复用性。4、负责建立研发质量体系，组织制定技术开...,企业服务,http://jobs.zhaopin.com/CCL1499557920J40766823705.htm,20-99人,2025-08-18 11:30:46,30000.0,50000.0,12.0
高级计算机视觉算法工程师（多模态大模型）,深圳,进迭时空(杭州)科技有限公司,本科,3-5年,机器人,25000-50000,岗位职责1. 主导泛机器人的多模态融合算法设计，实现环境感知、交互控制等核心功能；2. 负责构建VLM/VLA体系能力，完成软件栈搭建；3. 开展跨模块沟通，主导相关智能功能系统方案的设计、研发与交付； 岗位要求1. 硕士及以上学历，具备计算机科学、信息工程、电子工程、机器人学等相关专业背景；2. 对深度学习、计算机图形学、计算机视觉等领域的有深入认识，并了解各个算法的条件和瓶颈；3. 有模型优化...,电子/半导体/集成电路,http://jobs.zhaopin.com/CCL1378359190J40778305607.htm,100-299人,2025-07-29 17:34:06,25000.0,50000.0,12.0
研发总监,深圳,深圳市麦驰智慧技术有限公司,本科,10年以上,电子产品,30000-50000,1、战略规划与执行：制定并且执行研发战略，推动新技术、新产品的研发与应用，确保研发方向与公司战略一致。2、项目管理：负责研发项目的整体方案设计负责研发方案设计、工艺步骤开发及优化，指导、审核项目技术方案并监督实施。3、开发及优化，指导、审核项目技术方案并监督实施。4、技术研究与创新：组织核心技术研究和攻关，主导新工艺和新技术的项目整体方案设计、工艺步骤开发及优化。5、技术研究与创新：组织核心技术研...,电子/半导体/集成电路,http://jobs.zhaopin.com/CC354352310J40750338616.htm,100-299人,2025-08-28 14:56:39,30000.0,50000.0,12.0
控制算法工程师（机器人）G03487,深圳,深圳市雨禾伟业实业有限公司,硕士,1-3年,"导航算法,智能驾驶,运动控制",25000-50000,职责1. 负责产品执行器性能摸底和验收，组织开展机器人动力学相关标定实验；2. 负责整机控制算法调试，包括控制方案设计、仿真验证、控制器参数整定等；3. 负责控制相关测试问题的修复以及控制性能的优化迭代；4. 负责新技术的预研和技术难点的攻关。要求1. 自动化、车辆工程、计算机、电子信息工程、机械工程等硕士及以上学历，具有1年以上的运动控制领域内的工程开发经验；2. 扎实的控制理论基础，熟悉掌握经...,玩具/礼品,http://jobs.zhaopin.com/CC320689630J40747811901.htm,1000-9999人,2025-06-20 18:07:40,25000.0,50000.0,12.0
控制算法工程师,深圳,深圳市新凯来技术有限公司,本科,无经验,"机器学习,深度学习,图像算法,机器视觉,TensorFlow,PyTorch,Python,C++,控制算法",25000-50000,岗位职责：1.面向产品化，负责控制系统架构设计和解决方案设计，负责控制算法的设计、开发和优化改进，负责控制系统功能定义与指标分解。岗位要求：1、计算机、统计、自动化、控制、电子、通信、应用数学等专业；2、掌握 python、matlab，能够使用仿真工具进行全链路仿真和数据分析；3、掌握图像处理算法和图像分析相关理论，了解基于机器学习或深度学习的算法开发；或者了解并掌握主流控制算法 PID/LQR...,电子/半导体/集成电路,http://jobs.zhaopin.com/CCL1362239030J40685097715.htm,1000-9999人,2025-05-12 15:10:42,25000.0,50000.0,14.0
UWB工程师（CPD方向/钥匙）,深圳,深圳市豪恩科技集团股份有限公司,本科,3-5年,"数字钥匙,CPD,呼吸检测",25000-50000,需求岗位：算法、软件、硬件、天线、射频、系统等岗位岗位职责：1、负责UWB项目的CPD应用解决方案分析和设计，特别是应用层客户体验的算法优化，保证产品在各种环境下都能有稳定、可靠的优异性能；2、负责UWB项目CPD的应用/相关产品功能定义、输出需求设计文档；3、负责UWB项目Demo演示开发以及应用优化，提高响应速度和增强抗干扰能力；4、负责产品线团队的搭建及管理；5、针对客户项目提供算法方面的技...,电子设备制造,http://jobs.zhaopin.com/CC354764110J40737270412.htm,1000-9999人,2025-04-23 08:45:40,25000.0,50000.0,12.0
高级算法工程师（图像声呐/多波束方向）,深圳,云南保利天同水下装备科技有限公司,硕士,10年以上,信号处理,30000-50000,一、算法工程师（图像声呐/多波束方向）职责描述：1、负责相控阵多波束声呐的算法研究，包括信号预处理、波束形成、波束数据处理；任职要求：1. 研究生及以上学历；2. 具有阵列信号处理相关专业知识，熟悉多种波束形成方法、匹配滤波算法、宽带信号处理方法等；3. 具备雷达或声呐阵列信号处理经验者优先；4. 对算法研究工作有兴趣，能够独立解决问题，具有良好的团队合作能力。常驻工作地点：昆明,专用设备制造,http://jobs.zhaopin.com/CCL1245768670J40216394808.htm,300-499人,2025-04-08 10:05:51,30000.0,50000.0,12.0
java/c/c++/python/js/go-线上面试,深圳,外企德科数字技术有限公司,本科,1-3年,"C语言,C#,Java",25000-45000,"1、参与数据治理产品的建设，理解客户需求和痛点，负责产品特性设计开发、测试任务；2、参与产品特性的设计和架构优化任务；3、支持应用服务的运营、用户支持及运维。４、负责SaaS产品的前端功能实现，独立完成产品设计好的交互功能和产品需求。５、配合需求负责人提升产品界面体验和优化""岗位要求：1、通信设备软件开发测试，熟悉软件开发流程；2、熟练掌握汇编/C/C＋＋、Java、python等编程语言，对CP...",专业技术服务,http://jobs.zhaopin.com/CCL1480117890J40832084005.htm,10000人以上,2026-01-11 00:26:43,25000.0,45000.0,16.0
研发总监,深圳,深圳市乐凡信息科技有限公司,本科,10年以上,,30000-45000,1. 战略与规划：制定并执行公司技术发展战略和路线图，前瞻性布局关键硬件技术。主导硬件平台化、模块化设计，提升研发效率，降低成本和风险。深入分析行业技术趋势、竞争对手产品及供应链动态，为产品决策提供关键技术输入。2. 研发管理：全面负责从概念到量产的全流程硬件研发工作，包括方案设计、原理图、PCB Layout、仿真2、调试、测试验证、认证、试产及量产支持。领导研发团队，确保项目按计划、高质量交付...,网络/信息安全,http://jobs.zhaopin.com/CC303843030J40866204903.htm,20-99人,2026-01-10 00:00:01,30000.0,45000.0,12.0
技术总监（博士）,深圳,上海弘盛芯微电子有限公司,博士,3-5年,"传感器,MEMS",25000-45000,岗位职责：1，大客户需求对接与技术交流：作为前端技术接口，与客户进行深度技术交流，精准理解和挖掘客户在冷媒/压力/人工智能传感器，MEMS芯片应用上的需求、痛点及系统集成要求。2，解决方案设计与支持：基于客户需求，主导或参与设计传感器、芯片应用方案，进行传感器选型、性能评估和系统适配性分析，为客户提供优质的技术解决方案。3，技术支持与问题解决：为客户的传感器集成、测试和应用提供全程技术支持，快速响...,电子/半导体/集成电路,http://jobs.zhaopin.com/CCL1504716920J40867889812.htm,20-99人,2026-01-08 18:50:43,25000.0,45000.0,12.0
深度学习算法工程师,深圳,深圳市普渡科技股份有限公司,硕士,5-10年,"Python,C++,TensorFlow",25000-45000,工作职责1.负责研发基于视觉传感器的物体检测与追踪、关键点检测、语义分割等算法；2.负责研发基于深度学习的机器人轨迹预测、行人意图推断等算法；3.负责研发深度学习模型量化和加速、分布式训练等基础技术；4.负责与嵌入式工程师协作，针对产品平台进行算法优化和部署。任职资格1.计算机科学、信息工程、电子工程、机器人等专业硕士及以上学历；2.5年以上同岗位经验，具备扎实的编程能力，熟练使用C++/Pyth...,互联网,http://jobs.zhaopin.com/CCL1318355140J40819249203.htm,500-999人,2026-01-06 01:04:46,25000.0,45000.0,12.0
