职位,城市,公司,学历,经验,技能,薪资,工作描述,行业,职位URL,公司规模,发布时间,薪资_最小值,薪资_最大值,年薪月数
无人车业务部-车辆动力学工程师,深圳,北京三快在线科技有限公司,硕士,3-5年,,,美团自动配送以自研L4级自动驾驶软硬件技术为核心，与美团即时零售业务结合，形成满足公开道路、校园、社区、工业园区等室外全场景下的自动配送整体解决方案。美团无人车团队成立于2016年，团队成员来自于Waymo、Cruise、Pony.ai、泛亚等自动驾驶行业头部公司，自动驾驶技术团队博士占比高达30%，依靠视觉、激光等传感器，实时感知预测周围环境，通过高精地图定位和智能决策规划，保证自动配送车全场景...,互联网,http://jobs.zhaopin.com/CC383625320J40820120309.htm,10000人以上,2026-01-11 08:30:57,,,
硬件高级/资深工程师（英语）,深圳,欣旺达电子,本科,10年以上,"设计,3C消费类",30000-45000,工作职责:1、负责主动式电容笔产品硬件研发；2、参与制定主动笔研发技术方案；3、实施硬件部分技术方案，原理图设计，指导PCB Layout；4、制定并参与产品的调试、测试流程，严格产品质量控制；5、制定生产用规范化的技术文档，并提供技术支持；任职资格:1、本科及以上学历，电子类相关专业等，2、10年以上电子行业工作经验，有较强的电子产品设计开发、调试能力；3、具备英语口语能力，英语可作为工作语言；...,电子/半导体/集成电路,http://jobs.zhaopin.com/CC135947830J40677914111.htm,1000-9999人,2025-12-25 15:18:00,30000.0,45000.0,12.0
高级/资深硬件工程师（汽车电源）,深圳,麦格米特,本科,5-10年,"硬件设计,DCDC,OBC",25000-45000,职责描述:1、负责完成汽车电源产品的硬件开发工作2、解决产品开发过程中的产品问题3、负责产品从开发到量产的相关问题解决任职要求:1、本科及以上学历，电气自动化、电力电子等相关专业2、5年以上电源行业经验，3年以上汽车电源产品开发经验，能独立完成产品开发调试工作3、熟悉开关电源拓扑、磁性元件及功率器件知识4、熟悉汽车电源相关标准及测试要求,电子/半导体/集成电路,http://jobs.zhaopin.com/CC154405010J40731809405.htm,1000-9999人,2025-12-22 18:07:34,25000.0,45000.0,12.0
高级AI硬件设计开发工程师（深圳）,深圳,柏美智慧科技(上海)股份有限公司,硕士,5-10年,硬件,30000-45000,a) 基础背景l 学历：电子工程/计算机/微电子相关专业硕士及以上学历（顶尖本科+突出项目经验可放宽）l 年限：5-10年AI硬件开发经验，至少3年Jetson平台实战经验b) 硬性技术能力l 主导过至少2个Jetson Xavier/TX2/Orin系列核心板开发项目l 精通NVIDIA JetPack SDK、CUDA加速、TensorRT部署优化l 精通核心板电路设计（PMIC选型、高速PC...,人工智能,http://jobs.zhaopin.com/CC850829750J40811922413.htm,100-299人,2025-12-19 14:42:33,30000.0,45000.0,13.0
光伏逆变器高级硬件工程师,深圳,深圳市紫光照明技术股份有限公司,本科,5-10年,设计,30000-45000,"工作职责:1、负责部分120kw光伏逆变器的硬件电路设计及磁性元件参数计算；2、负责光伏逆变器硬件的制作和调试及指导Layout进行PCB设计；3、负责追踪生产中，现场出现的硬件问题，优化硬件设计，弥补硬件缺陷。任职资格:1、电气自动化、电力电子技术、电气工程等相关专业本科以上学历；优秀者可以放宽到专科2、熟悉电力电子功率变化拓扑的工作原理，对BOOST，BUCK，FLYBACK,全桥等拓扑的调试...",电子/半导体/集成电路,http://jobs.zhaopin.com/CC215456710J40766834316.htm,1000-9999人,2025-12-17 09:52:41,30000.0,45000.0,15.0
电子元器件备货采购总监,深圳,深圳市猎芯科技有限公司,大专,5-10年,"电子元器件,计算机硬件,采购管理,库存管理,备货采购",25000-45000,岗位职责：1.根据电子元器件行业特性及销售情况，制定完善采购备货计划；2.分析销售情况和市场动态，及时调整备货策略；3.负责管理相关产品价格、订单，备货、分货和库存等；4.处理好与原厂关系，充分了解原厂的市场定位及发展方向，得到原厂的有力支持；5.结合市场需要进行资源调配，做好备货计划和库存管理，产品成本及定价管理，管控利润率。任职要求：1.英语四级及以上，具备数据敏感性，对数据分析有兴趣；2.逻...,电子/半导体/集成电路,http://jobs.zhaopin.com/CC347226980J40825594610.htm,300-499人,2025-12-04 14:03:03,25000.0,45000.0,12.0
双向电气设计工程师,深圳,石斯(上海)贸易有限公司,本科,5-10年,充电桩,28000-45000,双向电气设计工程师工作职责：1. 负责双向电源转换产品的电气原理图设计，包括拓扑结构选择、关键元器件选择、参数计算以及系统级设计优化，以提高性能、效率和可靠性。2. 主导V2G（车网互动）、V2H（车家互动）和V2X应用场景的电气架构设计和控制策略协调，确保有效管理双向能量流。3. 执行核心电路设计（例如，高压/低压AC/DC、DC/DC转换器），包括原理图绘制，并为PCB布局和BOM编制提供指导...,汽车零部件,http://jobs.zhaopin.com/CCL1381617410J40811073701.htm,20-99人,2025-12-01 17:18:34,28000.0,45000.0,12.0
汽车电子硬件专家/产品经理,深圳,深圳艾为电气技术股份有限公司,本科,10年以上,"控制器,汽车空调,硬件开发,电路设计,压缩机控制器,IGBT,SIC",25000-45000,岗位职责1.负责车载高压控制器需求分析、电路设计、器件选型及可靠性验证等开发工作；2.整合并优化项目开发所需的资源；3.分析项目具体问题，提供项目所需的硬件解决方案；4.承担项目中硬件技术的研究和攻关；5.项目中其他同事的技术赋能； 任职要求 1.本科5年/硕士3年以上汽车电子硬件开发经验，至少主导过1款量产高压产品。 2.精通大功率拓扑设计，熟悉碳化硅驱动设计、车规级EMC设计优先。 3.工作认...,汽车零部件,http://jobs.zhaopin.com/CC812858520J40792354210.htm,300-499人,2025-11-20 09:57:49,25000.0,45000.0,14.0
嵌入式硬件工程师-人形机器人,深圳,广东天机智能系统有限公司,本科,5-10年,,25000-45000,任职要求：1、本科及以上学历，电力电子、电气自动化等相关专业。2、五年以上电路设计，有伺服驱动器、直流无刷电机驱动控制的研发设计工作经验者优先。 3、熟练掌握硬件研发流程、各种电子元件的识别和使用方法；熟练使用各种仪器仪表和设备；基本掌握组装辅料的识别和使用方法。 4、扎实的电力电子技术基础知识，较强的多种电子电路设计能力，熟练准确设计计算电路参数。熟练使用PCB板图绘制等工作相关软件。 5、能熟...,机器人,http://jobs.zhaopin.com/CC334452030J40967668804.htm,100-299人,2025-11-19 10:46:09,25000.0,45000.0,12.0
硬件研发总监,深圳,上海音特电子有限公司,本科,5-10年,"设计,硬件,PCB设计,EMC设计,DSP研发,研发管理",25000-45000,岗位职责：1. 根据公司产品规划路线，统筹公司新产品、新技术开发、成果转化工作；2. 对硬件的技术路线（方案）有自己思路见解，并结合市场规划产品发展方向，能够带领初创团队完成从0到1的产业化拓展工作，对拓展结果负责；3. 主导立项产品的项目开发，管理研发团队，推动关键技术攻关，确保研发成果的高质量交付，对研发结果负责；4.收集国内外相关领域政策、行业发展信息，根据公司发展战略制定部门短期、中期技术...,电子/半导体/集成电路,http://jobs.zhaopin.com/CC239732510J40516646804.htm,20-99人,2025-07-23 10:49:00,25000.0,45000.0,12.0
图像（电子数据）司法鉴定人,深圳,广东龙城司法鉴定所,本科,5-10年,"图像识别产品,人脸识别产品,智慧交通",,图像（电子数据）司法鉴定鉴定人。岗位要求： 1、计算机、自动化、电子信息、物理学相关专业本科及以上学历； 2.五年以上相关图像行业工作经验； 3..良好的沟通能力和团队协作精神。,网络/信息安全,http://jobs.zhaopin.com/CCL1491942540J40746074306.htm,20-99人,2026-01-09 00:19:02,,,
无人车业务部-整车域控应用软件开发工程师,深圳,北京三快在线科技有限公司,本科,1-3年,,,美团自动配送以自研L4级自动驾驶软硬件技术为核心，与美团即时零售业务结合，形成满足公开道路、校园、社区、工业园区等室外全场景下的自动配送整体解决方案。美团无人车团队成立于2016年，团队成员来自于Waymo、Cruise、Pony.ai、泛亚等自动驾驶行业头部公司，自动驾驶技术团队博士占比高达30%，依靠视觉、激光等传感器，实时感知预测周围环境，通过高精地图定位和智能决策规划，保证自动配送车全场景...,互联网,http://jobs.zhaopin.com/CC383625320J40805170109.htm,10000人以上,2026-01-11 10:05:10,,,
硬件电子工程师(J10049),深圳,深圳市朗恒照明技术股份有限公司,本科,5-10年,"智能硬件,蓝牙,双休",20000-40000,岗位职责 1.硬件系统与研发： 独立负责智能硬件产品的系统方案设计、原理图、PCB Layout及核心器件选型。 2.IoT方案集成： 作为技术总接口，主导与第三方IoT平台的硬件、固件联调与集成。 3.供应商管理： 负责管理外部的软件设计、工业设计和结构设计供应商，输出技术需求，并评审其方案。 4.NPI与量产： 主导新产品NPI全流程，制定测试标准，并与代工厂协作解决量产中的工程问题。 任职要...,电子/半导体/集成电路,http://jobs.zhaopin.com/CC225675710J40801791311.htm,300-499人,2026-01-11 00:40:20,20000.0,40000.0,12.0
中/高级IE工程师（整机-消费电子）-知名大厂,深圳,北京外企德科人力资源服务深圳有限公司,本科,5-10年,,25000-40000,工作职责1. 运用IE/精益手法，挖掘产品改善机会；2. 制定标准工时，管控效率达成，不断提升制造水平，为达成有竞争力的工时目标负责；3. 系统评估物流与线体布局，优化线体layout设计，并完成试、量产线体交付任务，为线体方案的竞争力负责；4. 跟进新产品导入，助力新产品快速达成UPH和成本目标。任职要求1. 七年以上IE工作经验，熟悉精益思维和IE手法，对成本管控和线体规划有独到见解；2. 本...,人力资源服务,http://jobs.zhaopin.com/CC157144120J40910056108.htm,10000人以上,2026-01-11 00:35:12,25000.0,40000.0,15.0
无人车业务部-货箱工程师,深圳,北京三快在线科技有限公司,硕士,3-5年,,,美团自动配送以自研L4级自动驾驶软硬件技术为核心，与美团即时零售业务结合，形成满足公开道路、校园、社区、工业园区等室外全场景下的自动配送整体解决方案。美团无人车团队成立于2016年，团队成员来自于Waymo、Cruise、Pony.ai、泛亚等自动驾驶行业头部公司，自动驾驶技术团队博士占比高达30%，依靠视觉、激光等传感器，实时感知预测周围环境，通过高精地图定位和智能决策规划，保证自动配送车全场景...,互联网,http://jobs.zhaopin.com/CC383625320J40805133109.htm,10000人以上,2026-01-11 08:42:29,,,
高级电气工程师(J10293),深圳,深圳英飞源技术有限公司,本科,5-10年,工商储,25000-40000,岗位职责: 1、负责工商储系统电气件选型及验证； 2、负责工商储系统原理图设计及优化升级； 3、负责工商储系统BOM编制、归档及维护； 4、负责工商储系统认证资料编制及优化； 5、负责工商储系统自测验证及问题解决； 5、负责工商储系统项目管理。 任职要求: 1、电气相关专业本科及以上学历； 2、5年以上电气相关行业工作经验； 3、3年以上储能电气相关经验者优先。,新能源,http://jobs.zhaopin.com/CC395922680J40751626902.htm,1000-9999人,2026-01-10 09:57:44,25000.0,40000.0,14.0
中/高级组装工艺工程师（整机）-知名大厂,深圳,北京外企德科人力资源服务深圳有限公司,本科,5-10年,,25000-40000,必须做过前端工艺方案设计，从设计开始介入。必须做整机组装，非单模块（如PCBA）从核心消费电子到机器人、家电、汽车等多个行业均有覆盖，开源思路明确。工作职责1. 负责新产品DFM评审，以工艺实现角度识别风险点，输出设计优化建议，提升产品质量和可量产性；2. 负责工艺方案设计和验证优化，输出工艺规程文件；统筹工站交付和验收，将工艺详细方案和要求落地到实体工站中；3. 跟进项目试产，分析和解决制程装配...,人力资源服务,http://jobs.zhaopin.com/CC157144120J40910057108.htm,10000人以上,2026-01-11 00:35:12,25000.0,40000.0,15.0
电气工程师,深圳,江苏职接说人才服务有限公司,学历不限,5-10年,"设计,倍福T3",30000-40000,倍福T3，3C行业，深圳，工期2-3个月，时薪120，必须精通倍福,人力资源服务,http://jobs.zhaopin.com/CCL1478612040J40979210404.htm,100-299人,2026-01-09 13:36:50,30000.0,40000.0,12.0
电力电子软件工程师,深圳,爱维达电子,本科,3-5年,"电源,变频器",25000-40000,【工作职责】1、负责光伏逆变器、UPS、储能PCS等产品的控制软件总体方案设计2、负责光伏逆变器、UPS、储能PCS等产品的控制软件部分控制功能的实现。 【任职资格】1、三年以上电源或电机控制算法的开发经验；2、熟悉电力电子产品的软件开发流程和软件质量控制方法； 3、具有电力电子产品控制建模、仿真能力。4、熟悉CAN、SPI、UART、IIc等通信的实现5、熟悉三电平逆变器、VIENNA整流器、L...,专用设备制造,http://jobs.zhaopin.com/CC203849010J40531007809.htm,300-499人,2026-01-09 01:22:28,25000.0,40000.0,13.0
电源电子工程师-深圳,深圳,龙口东立电线电缆有限公司,本科,5-10年,"电源系统开发,电路设计,驱动开发,电源,LLC,PFC,FLYBACK,Altium Designer,Cadence allegro,快充协议（PD/QC/AFC),USB TYPE-C规范",20000-40000,研发高效、安全、可靠的电源产品。负责LED驱动电源、插排USB模块及手机充电头的研发与优化。职责： 1. LED灯具AC/DC电源设计 - 负责LED驱动电源（恒流/恒压）的电路设计、仿真及优化，确保高效率、高PF值及低THD。 - 熟悉隔离/非隔离拓扑（如Flyback、LLC、Buck-Boost），优化热设计及可靠性。 - 解决LED电源的EMC/EMI问题，确保符合安规认证（UL、CE、C...,电气机械/电力设备,http://jobs.zhaopin.com/CC261252910J40958416704.htm,100-299人,2026-01-09 01:09:29,20000.0,40000.0,12.0
电子硬件工程师,深圳,深圳市星禾宏泰自动化设备有限公司,大专,3-5年,消费电子产品,20000-40000,岗位职责与要求：1、负责公司项目原理图设计，PCB layout，会STM32单片机。2、能够应用各类仪器进行电路调试，FPC测试治具、气密测试治具、测试治具。3、产品调试，与软件，结构，项目工程师配合进行调试工作。4、进行产品的硬件测试及验证；物料选型和测试认证；新技术的引进与实施。5、各相关部门沟通配合，保证项目的顺利实施，客户端的工程技术支持，售后服务支持。6、动手能力强，熟悉使用热风枪，电...,电气机械/电力设备,http://jobs.zhaopin.com/CC295729230J40570880701.htm,100-299人,2026-01-09 00:30:20,20000.0,40000.0,13.0
电力电子硬件工程师,深圳,深圳市泰昂能源科技股份有限公司,博士,无经验,"硬件开发,电力电子,电源开发",30000-40000,"岗位职责：1、参与电力电子主电路、控制电路、电气、磁性元件设计工作和器件选型；2、协助解决电力电子产品项目研发过程中的问题；3、协助完成新产品的调测工作；4、技术文档编写和记录；5、作为项目成员完成项目任务.任职要求：1、专业方向：电力电子\电气工程\电力系统\控制工程\自动化\电力传动等；2、有做过相关电力电子硬件项目课题研究，模拟、数字电路基本功扎实；3、熟悉原理图,PCB设计软件(mento...",电力/水利/热力/燃气,http://jobs.zhaopin.com/CC144393050J40816327209.htm,500-999人,2026-01-08 01:24:10,30000.0,40000.0,14.0
硬件工程师,深圳,南方新华,本科,5-10年,"LED,灯,照明",20000-40000,岗位职责1.负责LED硬件的方案设计、原理图设计、PCB LAYOUT、BOM制作、测试、BUG解决等；2.负责解决单板测试、整机测试过程中出现的问题；3.负责解决生产加工过程中出现的问题；4.完成上级领导安排的其他任务。任职资格1.本科及以上学历，电子信息、计算机、通信、自动化等相关专业优先；；2.5年以上嵌入式硬件开发工作经验；3.熟练掌握STM32、ARM、SOC等处理器的硬件设计，能独立完...,人力资源服务,http://jobs.zhaopin.com/CC346219280J40819423211.htm,100-299人,2026-01-07 11:34:17,20000.0,40000.0,12.0
营销经理（数据中心和电子厂房）,深圳,中国机房设施工程有限公司,本科,3-5年,"市场拓展,市场策划,市场推广,整合营销,品牌营销,公关营销",20000-40000,岗位职责：1、负责公司本地及周边省份区域市场开拓、市场分析与规划；2、根据公司年度目标，制定工程项目年度销售计划，并带领销售团队实现目标；3.、负责公司客户关系的维护与管理，负责公司大客户的开发与维护4.、负责工程项目前期沟通、谈判，后期商务、技术沟通对接、合同的拟定；5.、负责工程项目销售回款、预决算跟踪；6.、负责市场营销渠道建设与维护；工作要求：1、本科及以上学历。3年以上工程建设、咨询、设...,建筑设备安装,http://jobs.zhaopin.com/CC637990620J40745916606.htm,100-299人,2026-01-07 10:29:15,20000.0,40000.0,12.0
嵌入式硬件主管,深圳,苏州中辉激光科技有限公司,本科,5-10年,"单片机,ARM处理器,FPGA,嵌入式硬件开发",25000-40000,中辉激光，是亚洲唯一、全球唯二掌握碟片激光放大核心技术的中国厂商，聚焦碟片放大的高功率激光应用，致力于为客户提供世界领先的碟片激光器与解决方案；参与科技部“十四五”国家重点研发项目；同时获评苏州吴江重点项目，入选苏州市独角兽培育企业。任职要求：1、电子工程、自动化、通信工程或相关专业本科及以上学历；2、精通模拟电路设计，熟练使用AD软件，有低噪声/恒流源/TIA等电路设计经验者优先；3、熟悉嵌入式...,通用设备制造,http://jobs.zhaopin.com/CCL1314447410J40914619615.htm,100-299人,2026-01-07 00:00:01,25000.0,40000.0,12.0
TPM（消费电子/英语熟练）,深圳,欧浮瑞(武汉)人力资源有限公司,学历不限,3-5年,"3C数码产品,手机产品,电脑产品,音箱产品,TPM,工艺,英语流利",25000-40000,任职要求：1. 学历不限，性别不限；2. 熟悉消费电子行业、智能家居等产品设计开发流程，有电子制造类2年以上项目管理经验；3. 能引导和安排团队人员在NPI阶段，改善产品工艺，测试等工程性工作，熟悉生产动作流程以 及项目管理流程；4. 对自动化设备设计原理/制造流程具备项目管理的专业知识和技能；5. 有良好的沟通能力，计划和执行能力及较强的责任心和团队精神；6. 英文6级以上，英语优先商务沟通，说...,人力资源服务,http://jobs.zhaopin.com/CC372186830J40831993810.htm,20-99人,2026-01-06 17:01:30,25000.0,40000.0,14.0
空调电源研发工程师,深圳,深圳市皓文电子股份有限公司,本科,3-5年,,20000-40000,岗位职责：1、主导空调驱动电源的硬件全生命周期开发，包括需求分析、原理图设计、PCB布局、调试及量产支持。 2、设计高可靠性电力电子电路，负责变频驱动电路（IPM/IGBT模块驱动、三相逆变拓扑）、开关电源（AC-DC、DC-DC）及保护电路（OVP/OCP/OTP）。3、解决EMC、安规问题（辐射/传导干扰、绝缘耐压等），确保通过GB/T 4343、IEC 61000等认证。 4、协同软件团队实...,电子/半导体/集成电路,http://jobs.zhaopin.com/CC576507420J40750199011.htm,100-299人,2026-01-06 01:29:17,20000.0,40000.0,12.0
硬件开发工程师,深圳,超聚变数字技术股份有限公司,本科,3-5年,服务器,20000-40000,岗位职责：1、主导服务器产品硬件全流程交付，包含硬件方案设计，规格分析，器件选型，原理图设计，PCB审查，小批量试制和生产导入。2、负责单板调试，负责研发过程中、生产和现网早期硬件类问题定位，并反馈到产品设计中，持续提升单板硬件设计质量。3、负责单板上小规模控制逻辑的设计、开发、仿真，及软硬件接口设计。4、参与服务器产品规划和产品竞争力构建，支撑产品大规模生产和发货。专业知识：1、精通X86硬件系...,计算机硬件,http://jobs.zhaopin.com/CCL1367103620J40904522915.htm,1000-9999人,2026-01-05 14:57:02,20000.0,40000.0,14.0
销售总监（电子元器件销售经验）,深圳,河南诚猎人力资源有限公司,大专,5-10年,"电容,电阻,电感,KA大客户	,企业客户",30000-40000,1、负责拟定公司整体营销策略、营销计划，对公司销售业绩目标的实现负责；2、负责市场重要客户的开拓及关系维护，参与重大合同谈判签订，及时处理客情投诉；3、负责检视客户信用评级、账期、逾期、接单、出货、库存等工作，发现问题及时处理；4、负责销售数据分析监控，搜集行业及竞争对手信息，含：型号、价格、客户、市场占用率等，并采取应对措施；5、负责建立完善合作紧密、高效能、积极向上的业务销售团队，不断提升人才...,人力资源服务,http://jobs.zhaopin.com/CCL1483514250J40831677110.htm,20-99人,2026-01-05 14:48:36,30000.0,40000.0,12.0
测试工艺工程师（正编/薪资面议）,深圳,北京外企德科人力资源服务深圳有限公司,本科,5-10年,消费电子,20000-40000,岗位要求：1. 本科及以上学历，电子/通信/电气/自动化等相关专业优先；2. 五年以上消费电子类新产品试产量产经验，有整机产测相关工作经验者优先；3. 熟练某类传感器或硬件模块原理（IMU、Camera、射频音频、电池等），能熟练运用工具进行信号量测与不良分析；4. 逻辑清晰，沟通协调能力强，做事认真负责，抗压能力优；5. 熟悉生产制造工艺与研发设计流程，有独立设计及调试单板经验者优先。工作职责：...,人力资源服务,http://jobs.zhaopin.com/CC157144120J40909957008.htm,10000人以上,2026-01-05 14:09:53,20000.0,40000.0,12.0
BMS系统资深工程师-EVB(J19024),深圳,欣旺达动力科技股份有限公司,本科,3-5年,"嵌入式软件研发,控制器,三电系统,动力电池",20000-40000,岗位职责：1、负责客户软件/系统需求的分析，并与客户达成一致;2、负责将客户需求及其它内部需求转换为内部软件需求，并有效的传递给后端研发部门；3、负责软件FEMA分析，识别潜在的失效模式、原因及其可能的影响，并传递给后端部门；4、参与产品设计评审、风险管控，为设计团队提供降低失效风险的建议，支持组织内相关流程的持续；5、负责内外部问题的分析定位及跟进、统筹软件FTA的编写；6、负责输出成熟度计划及...,新能源汽车,http://jobs.zhaopin.com/CCL1280979310J40845486603.htm,10000人以上,2026-01-05 01:06:13,20000.0,40000.0,14.0
销售总监（电子元器件）,深圳,淮安市纳杰云服技术服务有限责任公司,大专,5-10年,"华东大区,华南大区,西南大区,KA大客户,企业客户",20000-40000,工作职责1、负责拟定公司整体营销策略、营销计划，对公司销售业绩目标的实现负责；2、负责市场重要客户的开拓及关系维护，参与重大合同谈判签订，及时处理客情投诉；3、负责检视客户信用评级、账期、逾期、接单、出货、库存等工作，发现问题及时处理；4、负责销售数据分析监控，搜集行业及竞争对手信息，含：型号、价格、客户、市场占用率等，并采取应对措施；5、负责建立完善合作紧密、高效能、积极向上的业务销售团队，不断...,互联网,http://jobs.zhaopin.com/CCL1479851850J40818653911.htm,100-299人,2026-01-04 16:19:35,20000.0,40000.0,12.0
