职位,城市,公司,学历,经验,技能,薪资,工作描述,行业,职位URL,公司规模,发布时间,薪资_最小值,薪资_最大值,年薪月数
逆变器软件算法工程师（储能/光伏）,深圳,合肥乾芯科技有限公司,本科,5-10年,"储能逆变器,算法控制",23000-45000,职位描述1. 负责公司产品产品软件方面例程开发、调试、优化升级等；2. 负责/参与软件控制算法和软件开发；3.负责电源、或逆变器等方向的解决方案开发；4.协助解决市场应用方面的软件问题，参与技术支持工作。任职要求：1.电子/电控/自动化等相关专业本科以上学历；2.五年以上UPS、逆变器、充电桩、DC/DC等电源类产品的控制软件开发经验，从事过新能源相关电源产品控制软件开发、OBC优先；3.熟悉各类...,电子/半导体/集成电路,http://jobs.zhaopin.com/CCL1319830900J40741539106.htm,20-99人,2025-12-15 13:37:02,23000.0,45000.0,14.0
强化学习算法工程师,深圳,广东瑞德智能科技股份有限公司,硕士,1-3年,"机器视觉,图像算法,C++",30000-45000,"岗位职责：1、负责将强化学习（RL）应用于机器人的运动控制，如步态自适应学习、高难度动作生成等；2、在先进的物理仿真环境（如Isaac Gym, RaiSim）中，设计和训练用于机器人控制的RL模型；3、研究和解决Sim-to-Real（从仿真到现实）的迁移问题，确保在仿真中训练的策略能成功部署到真实机器狗上；4、将大型语言模型（LLM）或视觉语言模型（VLM）与机器人控制相结合，探索“指令->行...",电子/半导体/集成电路,http://jobs.zhaopin.com/CC627576020J40903303408.htm,1000-9999人,2025-11-28 14:33:14,30000.0,45000.0,13.0
软件开发工程师-社招,深圳,深圳市新凯来技术有限公司,本科,3-5年,"Python,Qt",25000-45000,岗位职责1、负责半导体装备软件的需求分析、方案设计、代码开发、集成测试、问题定位、资料开发等工作，持续开展代码架构优化、性能优化等工作，打造高实时、高精密、高可靠性的系统软件，看护软件模块架构演进，构筑核心竞争力;2、负责半导体装备软件平台建设，探索并研究领域最前沿的技术，主导高复杂精密装备系统等核心能力的研究与开发实现，构建业界领先的半导体装备软件能力；3、负责不同开发环境持续集成搭建、优化及维...,电子/半导体/集成电路,http://jobs.zhaopin.com/CCL1362239030J40899306315.htm,1000-9999人,2025-11-24 16:58:12,25000.0,45000.0,16.0
高级电控算法工程师（技术管理） (MJ000217),深圳,维海德,本科,5-10年,"电机控制,电控算法,传动",30000-45000,岗位职责：1.制定电机控制系统整体方案（电机选型、控制架构、算法策略）；2.承担核心传动产品结构、电机算法的研究与攻坚工作，解决最复杂的技术难题，为团队提供技术标杆；3.设计电机安装结构和传动系统、优化机械结构以降低噪音和振动，解决机电一体化集成问题；4.开发电机控制上层应用接口，开发电机控制上层应用接口；5.负责传动科部门管理与运营，以及其他临时工作。任职要求：1.本科及以上学历，信号处理、电子...,电子/半导体/集成电路,http://jobs.zhaopin.com/CC532198730J40734018506.htm,500-999人,2025-11-24 14:20:08,30000.0,45000.0,12.0
研发技术总监,深圳,中消云科技股份有限公司,硕士,5-10年,"Java,C语言,C#,嵌入式技术,前后端开发,后端开发,嵌入式硬件开发,嵌入式软件开发",30000-45000,岗位内容：1. 负责管理和领导一支高效的技术团队，为企业的IT战略提供支持。2. 负责建筑安全产品设计和实现各种软硬件解决方案，包括前后端开发、数据库管理和系统集成等。3. 确保技术产品的质量和稳定性，并参与重大事务的决策和管理。4. 掌握最新的技术趋势并更新公司的IT战略和目标。任职要求：1. 具备8年以上的IT技术/研发经验，4年以上的管理经验。2. 精通多种编程语言和技术平台，对软件开发有深...,电子/半导体/集成电路,http://jobs.zhaopin.com/CCL1301504640J40759784816.htm,500-999人,2025-09-23 15:05:22,30000.0,45000.0,12.0
算法工程师,深圳,深圳市新凯来技术有限公司,硕士,3-5年,"图像算法,Python,C++,C语言",25000-45000,岗位职责1、负责光学算法、热相关算法、位置测量算法、误差控制算法、测校算法、故障诊断算法的设计，完成数学建模、算法设计、系统仿真、算法开发和系统调试；2、构建高性能算法库，结合算法和CPU/GPU特点开展定制优化，发挥硬件算力极致；3、负责业务数据体系搭建，包括数据埋点、数据采集、数据同步、数据库快速写入等；4、端到端项目交付，包括算法需求澄清、算法总体方案设计、代码编写调试、自验证、问题跟踪、版...,电子/半导体/集成电路,http://jobs.zhaopin.com/CCL1362239030J40899303115.htm,1000-9999人,2025-10-30 10:11:33,25000.0,45000.0,15.0
高级运动控制工程师,深圳,大族数控,本科,3-5年,"图像算法,控制算法,控制,闭环控制",27000-45000,偏向运动控制算法应用，控制器算法开发的不一致1、负责精密运动控制系统的设计、开发和测试，包括但不限于运动控制算法、电机控制、传感器集成等；2、与跨职能团队合作，包括光机电设计、软件开发、产品管理等：3、参与系统级的性能评估和优化，确保系统满足性能和可靠性要求；4、编写技术文档，包括设计规范、测试报告、用户手册等：5、对新的技术趋势和行业标准保持关注，以便在项目中应用最新的技术和方法。任职要求：1、...,电气机械/电力设备,http://jobs.zhaopin.com/CC334402310J40820077702.htm,1000-9999人,2025-09-12 15:47:00,27000.0,45000.0,12.0
图像（电子数据）司法鉴定人,深圳,广东龙城司法鉴定所,本科,5-10年,"图像识别产品,人脸识别产品,智慧交通",,图像（电子数据）司法鉴定鉴定人。岗位要求： 1、计算机、自动化、电子信息、物理学相关专业本科及以上学历； 2.五年以上相关图像行业工作经验； 3..良好的沟通能力和团队协作精神。,网络/信息安全,http://jobs.zhaopin.com/CCL1491942540J40746074306.htm,20-99人,2026-01-09 00:19:02,,,
算法技术工程师,深圳,深圳市新凯来技术有限公司,本科,无经验,"Python,光学,C++",25000-45000,岗位职责1、负责光学算法、热相关算法、位置测量算法、误差控制算法、测校算法、故障诊断算法的设计，完成数学建模、算法设计、系统仿真、算法开发和系统调试；2、构建高性能算法库，结合算法和CPU/GPU特点开展定制优化，发挥硬件算力极致；3、负责业务数据体系搭建，包括数据埋点、数据采集、数据同步、数据库快速写入等；4、端到端项目交付，包括算法需求澄清、算法总体方案设计、代码编写调试、自验证、问题跟踪、版...,电子/半导体/集成电路,http://jobs.zhaopin.com/CCL1362239030J40874256915.htm,1000-9999人,2025-10-30 10:09:09,25000.0,45000.0,14.0
java/Python/C/C++/JS/AI算法/软件测试,深圳,外企德科数字技术有限公司,本科,经验不限,"深度学习,机器学习,图像算法,VGGNet",20000-40000,1、本科及以上学历；2、熟悉Java，C/C++，Python等任意一种后端开发技术；3、编写概要设计能力要强；4、沟通表达能力较好，逻辑思维清晰；5、资深导师专业带教，六险一金，法定节假日福利，内部知识论坛；6、薪资架构：薪资薪资+绩效工资+年终奖，周末加班双倍。岗位要求岗位要求 1、计算机、软件、通信等相关专业，统招本科及以上学历； 2、基础扎实，熟悉掌握但不限于Python/JAVA/C++...,专业技术服务,http://jobs.zhaopin.com/CCL1480117890J40837670005.htm,10000人以上,2026-01-11 00:27:06,20000.0,40000.0,14.0
ISP（图像信号处理）算法工程师,深圳,大连恒馨科技有限公司,硕士,1-3年,"Xcode,Python,MATLAB/PERL/RUBY",25000-40000,"Job Description, Roles & Responsibilities： MS in CE/EE/Imaging/Physics or other engineering/scientific majors 3+ years of professional experience with at least 1 year in the Image sensing Industry Exp...",计算机软件,http://jobs.zhaopin.com/CC852820150J40979379104.htm,20-99人,2026-01-10 10:56:25,25000.0,40000.0,13.0
AI中高级算法工程师,深圳,深圳某通信上市公司,硕士,1-3年,"图像算法,机器视觉,自然语言处理",20000-40000,岗位职责1) 算法研究与创新:跟踪AI领域最新技术（如大模型、生成式AI、多模态等），探索其在业务场景中的应用潜力。设计并优化核心算法（如深度学习、强化学习、图神经网络等），提升模型精度与效率。2) 模型开发与部署：使用TensorFlow、PyTorch等框架开发高性能模型，支持端侧（移动端/嵌入式）与云端部署。优化模型推理速度与资源占用，适配大规模数据场景下的分布式训练。3) 数据处理与分析：...,互联网,http://jobs.zhaopin.com/CCL1318355140J40837442903.htm,500-999人,2026-01-10 01:06:30,20000.0,40000.0,14.0
软件开发工程师（可接受24届+无经验同学）,深圳,外企德科数字技术有限公司,本科,经验不限,"C语言,Java,Python,Web开发,嵌入式开发,Linux开发,Qt,MySQL,Oracle",20000-40000,1、熟悉linux命令常用操作，熟悉C/C++/java/python/JS语言的自动化开发，2、热爱测试工作，有责任心，有耐心，愿意接触新知识和业务，熟悉流行的测试方法和理论。3、本科及以上学历，学信网可查，毕业证，学位证齐全,专业技术服务,http://jobs.zhaopin.com/CCL1480117890J40757971405.htm,10000人以上,2026-01-11 00:24:28,20000.0,40000.0,14.0
画质IQ调试工程师,深圳,深圳市辰松科技有限公司,本科,1-3年,"图像识别产品,智能硬件,C++,C语言",20000-40000,"工作职责1、负责摄像头模组的画质调优，包括色彩还原、降噪锐化、影调曲线等图像参数调节；2、综合运用ai方法，针对多场景（人像、夜景、逆光、运动等）优化成像表现，包括ae, awb, af等参数调节；3、设计和开发产线画质标定工具，优化产线效率；4、调研和跟进用户偏好和产品画质问题。学历要求：本科及以上学历，计算机、自动化、电子工程、物理和数学等相关专业技术要求：1、了解图像处理算法；2、能使用c/...",计算机硬件,http://jobs.zhaopin.com/CCL1341471130J40915292315.htm,20-99人,2026-01-09 10:20:14,20000.0,40000.0,12.0
数字算法高级研发工程师（算法和硬件）,深圳,中兴通讯股份有限公司,本科,5-10年,,22000-40000,1、负责新能源/储能数控算法设计；2、负责绝缘检测、拉弧检测等算法建模和方案实现；3、牵头开展AI深度学习技术的研究，增强模型的泛化能力和算法的通用性；4、牵头新技术或标准攻关或预研。1、有算法模型构建经验，熟悉智能预测性维护、故障诊断与预测、智能控制等领域；（*）2、精通FPGA开发，精通傅里叶分析、小波变换、CNN等算法；（*）3、有光伏、储能产品有弧光分析经验的优先；（*）4、自动化、电气工...,互联网,http://jobs.zhaopin.com/CCL1318355140J40641820703.htm,500-999人,2026-01-10 01:05:27,22000.0,40000.0,12.0
算法工程师,深圳,外企德科数字技术有限公司,本科,经验不限,"深度学习,机器学习,图像算法,机器视觉,自然语言处理,通信算法,Python,Java,C++",20000-40000,软件/算法/AI等各类方向都有，欢迎详聊。 1、负责产品/平台的软件需求分析、架构设计、代码开发、单元测试、集成测试、静态检查、本地构成、测试环境搭建、问题定位、资料开发等工作。负责相关系统/模块的代码看护及重构，持续优化提升代码质量; 2、负责面向各类场景的机器学习算法、数据挖掘深度学习、NLP等算法的研究和设计 3、负责AI领域的软件工程化和产品开发;负责AI算法及系统的设计和实现，包括但不限...,专业技术服务,http://jobs.zhaopin.com/CCL1480117890J40726159905.htm,10000人以上,2026-01-11 00:24:26,20000.0,40000.0,15.0
电机控制算法工程师,深圳,菲亚兰德,本科,3-5年,电机控制算法,25000-40000,一、岗位职责1、负责轮毂电机、减速电机、BLDC、PMSM 等控制算法开发，包含仿真、数据分析、实现、验证；2、基本了解电机控制理论和自动控制原理，掌握方波驱动、SVPWM、FOC 开关霍尔、FOC 无感驱动技术原理等相关算法；3、懂得对 BLDC 有感、无感程序做出死区补偿、窄脉冲抑制、相位延迟补偿、负载扰动抑制、转子温度补偿、谐波注入控制、电机参数辨识和谐波抑制控制等技术的实现；4、负责电机的...,智能硬件,http://jobs.zhaopin.com/CC136425280J40663579309.htm,1000-9999人,2026-01-08 16:06:57,25000.0,40000.0,13.0
算法-只要26年毕业的应届生,深圳,南方新华,硕士,经验不限,算法,20000-40000,岗位职责1. 参与系统控制算法从架构级到方案级的分析与设计，包括系统辨识、模型建立、算法优化、控制策略开发、实时控制实现、鲁棒性分析等；2. 参与产品开发全流程，从立项、竞品分析到方案设计、测试验证等环节，确保控制算法的有效性，满足产品核心指标；3. 与机械、硬件、嵌入式和测试团队等跨领域团队合作，集成并优化系统，提升产品性能及稳定性；4. 编写设计开发过程中的技术文件；5. 解决在产品测试、生产...,人力资源服务,http://jobs.zhaopin.com/CC346219280J40819767211.htm,100-299人,2026-01-08 15:30:45,20000.0,40000.0,14.0
大模型研发负责人,深圳,深圳市人工智能行业协会,硕士,5-10年,"大模型算法,RLHF,DPO,PPO,机器视觉,自然语言处理",20000-40000,关键职责1. 企业级大模型应用研发与优化- 探索和应用最新的模型压缩、量化、蒸馏技术，并主导设计企业级大模型的开发及应用落地2. 场景化算法设计- 深度研究和拆解货拉拉业务，构建端到端的AI智能体系统，实现复杂任务自动化，特别是在客服、营销场景3. 数据工程与飞轮建设- 设计高质量训练数据的合成和标注方案- 建立线上数据收集和模型迭代的飞轮机制- 构建多模态数据处理能力（文本、语音、图像）能力要求...,社团/组织/社会保障,http://jobs.zhaopin.com/CC555057480J40819418101.htm,20-99人,2026-01-08 13:52:17,20000.0,40000.0,12.0
雷达数据处理算法工程师,深圳,河南承方人力资源服务有限公司,本科,3-5年,雷达算法,20000-40000,岗位职责：1. 负麦汽车雷达多目标轨迹跟踪、预测算法的开发与调试:2. 负麦解决汽车雷达实际应用中的多目标跟踪问题;3. 负麦汽车雷达大量路试数据的后处理，优化目标跟踪算法；4. 负责汽车雷达多目标轨迹跟踪算法的相关技术文档撰写;5. 协助汽车雷达测试、数据采集及分析；6. 协助汽车雷达多目标轨迹跟踪算法的嵌入式软件实现。任职要求：1. 学历要求:电子、信号处理、计算机等相关专业，本科及以上学历;...,人力资源服务,http://jobs.zhaopin.com/CCL1484302980J40825609314.htm,100-299人,2026-01-08 09:25:49,20000.0,40000.0,13.0
算法工程师（应届985硕士/博士）,深圳,南方新华,硕士,经验不限,"Python,MATLAB,算法,控制",25000-40000,岗位职责1. 参与系统控制算法从架构级到方案级的分析与设计，包括系统辨识、模型建立、算法优化、控制策略开发、实时控制实现、鲁棒性分析等；2. 参与产品开发全流程，从立项、竞品分析到方案设计、测试验证等环节，确保控制算法的有效性，满足产品核心指标；3. 与机械、硬件、嵌入式和测试团队等跨领域团队合作，集成并优化系统，提升产品性能及稳定性；4. 编写设计开发过程中的技术文件；5. 解决在产品测试、生产...,人力资源服务,http://jobs.zhaopin.com/CC346219280J40819759611.htm,100-299人,2026-01-08 15:19:02,25000.0,40000.0,14.0
多模态算法工程师,深圳,光启技术股份有限公司,硕士,1-3年,"多模态算法,ALIGN,自然语言处理,PyTorch,TensorFlow,OpenCV,Python",26000-40000,岗位职责： 1. 负责目标检测、跟踪等计算机视觉算法的研究与开发 2. 负责多模态大模型的优化和落地，涵盖视觉-语言理解、决策规划等场景 3. 探索具身智能领域前沿多模态大模型算法，掌握最新的科技趋势；推动多模态大模型在业务场景的机器人应用落地。 任职要求： 1. 计算机科学、人工智能、统计学、数据科学、控制工程等相关专业，硕士及以上学历。2. 有较强的编程能力，精通python/C++等主流编程...,船舶/航空/航天/火车制造,http://jobs.zhaopin.com/CC526342880J40745991706.htm,1000-9999人,2026-01-07 14:47:32,26000.0,40000.0,12.0
信号处理算法工程师,深圳,河南承方人力资源服务有限公司,硕士,3-5年,雷达算法,20000-40000,岗位职责1、负责毫米波雷达的信号处理算法方案设计与仿真;2、负责和参与项目中外场试验与测试数据的采集、处理、分析与问题排查;3、负麦对民用毫米波雷达领域前沿算法技术的调研与仿真开发;4、配合软件工程师共同完成嵌入式代码编写:5、整理编写、整理与算法相关的设计文档、试验报告等:任职要求1、电子信息、雷达、信号处理相关专业硕士及以上学历，3年以上相关工作经验;2、掌握常见的雷达信号处理算法，包括:FM...,人力资源服务,http://jobs.zhaopin.com/CCL1484302980J40825608614.htm,100-299人,2026-01-08 09:25:42,20000.0,40000.0,12.0
算法工程师-应届,深圳,南方新华,硕士,经验不限,,25000-40000,岗位职责 1. 参与系统控制算法从架构级到方案级的分析与设计，包括系统辨识、模型建立、算法优化、控制策略开发、实时控制实现、鲁棒性分析等； 2. 参与产品开发全流程，从立项、竞品分析到方案设计、测试验证等环节，确保控制算法的有效性，满足产品核心指标； 3. 与机械、硬件、嵌入式和测试团队等跨领域团队合作，集成并优化系统，提升产品性能及稳定性； 4. 编写设计开发过程中的技术文件； 5. 解决在产品...,人力资源服务,http://jobs.zhaopin.com/CC346219280J40819628011.htm,100-299人,2026-01-08 15:11:01,25000.0,40000.0,14.0
大模型Agent算法工程师,深圳,光启技术股份有限公司,硕士,1-3年,"大模型算法,GPT,自然语言处理,机器视觉,搜索/推荐算法,PyTorch,TensorFlow,OpenCV,Python",26000-40000,base深圳或顺德岗位职责： 1. 基于大模型技术（如Qwen、DeepSeek、GPT、LLAMA等），主导Agent、RAG（Retrieval- Augmented Generation）及知识库系统的架构设计与开发，推动AI产品在业务场景中的高效落地 2. 负责大模型Agent的全流程工作，包括但不限数据处理、模型训练、优化和部署 3. 集成和部署AI模型服务API，确保高性能和可扩展性 ...,船舶/航空/航天/火车制造,http://jobs.zhaopin.com/CC526342880J40745991106.htm,1000-9999人,2026-01-07 14:46:40,26000.0,40000.0,12.0
算法工程师,深圳,牧原股份,本科,无经验,"深度学习,图像算法,大模型算法",25000-40000,一、岗位职责1、负责2D/3D视觉识别、关键点检测、机器人轨迹规划生成等算法研发；2、负责相关技术文档编写和技术专利申请；3、与工程师协作算法现场实施并优化；4、提供技术支持或产品的算法咨询二、任职要求1、本科及以上学历，计算机、电子信息、自动化等相关专业；2、熟悉计算机视觉基本算法，扎实的机器视觉理论基础、熟练掌握3D点云处理、2D目标识别、语义分割技术；3、熟练掌握C/C++、Python等编...,农/林/牧/渔,http://jobs.zhaopin.com/CC495147320J40819332011.htm,10000人以上,2026-01-06 21:14:31,25000.0,40000.0,12.0
AI算法工程师（全球化工作机会）,深圳,江苏省精创电气股份有限公司,本科,3-5年,大模型算法,26000-40000,岗位职责：1、AI技术架构全周期设计：主导工业AI制冷产品从技术需求拆解、架构方案设计到落地交付的全流程技术规划，包括结合一线现场调研明确技术需求，设计“算法 - 硬件 - 边缘 - 云端”协同架构，制定技术roadmap并跟踪核心架构指标（如模型部署效率、系统稳定性、能耗优化效果）。2、多技术融合与落地支撑：统筹强化学习、联邦学习算法与嵌入式硬件（ARM 工控板等）、边缘计算、工业协议（OPC ...,仪器仪表制造,http://jobs.zhaopin.com/CC143355760J40819158511.htm,500-999人,2026-01-06 13:55:53,26000.0,40000.0,12.0
C++图像处理算法工程师,深圳,深圳市新凯来技术有限公司,本科,3-5年,"C++,图像算法",20000-40000,岗位职责：1. 负责半导体设备相关的图像处理算法设计、开发、优化与验证。2. 基于C++语言完成图像处理算法的工程化实现、模块集成及性能调优，保障算法在设备控制系统中的高效、精准运行。任职要求：1. 具备扎实的数学基础（线性代数、矩阵运算、几何变换、数字信号处理等），有较强的图像处理算法设计与实现能力。2. 熟练掌握物理光学、传统图像处理核心算法（如滤波、分割、特征提取、模板匹配、目标检测、形态学...,电子/半导体/集成电路,http://jobs.zhaopin.com/CCL1362239030J40880936415.htm,1000-9999人,2026-01-06 09:56:45,20000.0,40000.0,15.0
AI业务规划师（零售方向）,深圳,天虹股份,硕士,无经验,搜索/推荐算法,25000-40000,AI业务规划师（博士专项，AI零售方向）期待你：既能深耕AI技术的“深度”，又能洞察零售业务的“广度”，成为连接技术创新与商业价值的桥梁稀缺”AI+零售”战略博士专项岗，深度探索行业前沿，推动和影响万亿级零售市场AI规模化应用进程，定义下一代零售行业AI产品形态主要职责：1、负责AI前沿技术以及零售行业数智化转型趋势的分析与研究，深度调研零售场景痛点，挖掘AI技术与业务场景的结合，定义创新应用场景...,零售/批发,http://jobs.zhaopin.com/CCL1269512880J40869181008.htm,10000人以上,2026-01-04 17:22:28,25000.0,40000.0,12.0
agv调度算法工程师,深圳,深圳市创者自动化科技有限公司,本科,3-5年,"深度学习,图像算法,机器视觉,导航算法,C++,C#,AGV调度系统",20000-40000,岗位职责：负责多AGV/AMR调度策略及算法的开发及实现，具体工作职责包含：1、根据不同场景的生产调度需求，设计并实现多订单与多AGV/AMR的动态实时组合优化；2、负责多AGV/AMR的时效预估、静态/动态路径规划、交通管制、拥堵疏导、任务调度算法的研究和开发，并完成相关算法的仿真测试、编程实现；3、能持续为团队引入和尝试新的算法思想、理念及技术；4、能够对多AGV/AMR不同的调度策略及算法进...,工业自动化,http://jobs.zhaopin.com/CCL1386838010J40734134106.htm,20-99人,2026-01-04 08:26:40,20000.0,40000.0,12.0
c++高级软件工程师,深圳,大族数控,本科,1-3年,"C++,上位机",20000-40000,任职要求（一）技术能力编程语言：精通 C#或C++ ，熟练使用.NET Framework/Core、Qt 或 PyQt 等开发框架，具备多线程、串口（RS232/485）、网口（TCP/IP、UDP）通信开发经验。系统集成：了解工业自动化协议（如 Modbus、OPC UA），具备 PLC（西门子、三菱等）、运动控制卡（如 Galil、ACS）集成开发经验，熟悉实时操作系统（RTOS）原理。数据...,电气机械/电力设备,http://jobs.zhaopin.com/CC334402310J40728467702.htm,1000-9999人,2025-12-28 16:36:42,20000.0,40000.0,12.0
软件开发工程师,深圳,深圳市新凯来技术有限公司,本科,无经验,"Python,Linux开发,QT开发,C++,Java",20000-40000,岗位职责1、负责半导体装备软件的需求分析、方案设计、代码开发、集成测试、问题定位、资料开发等工作，持续开展代码架构优化、性能优化等工作，打造高实时、高精密、高可靠性的系统软件，看护软件模块架构演进，构筑核心竞争力;2、负责半导体装备软件平台建设，探索并研究领域最前沿的技术，主导高复杂精密装备系统等核心能力的研究与开发实现，构建业界领先的半导体装备软件能力；3、负责不同开发环境持续集成搭建、优化及维...,电子/半导体/集成电路,http://jobs.zhaopin.com/CCL1362239030J40875459915.htm,1000-9999人,2025-12-27 14:33:18,20000.0,40000.0,14.0
