职位,城市,公司,学历,经验,技能,薪资,工作描述,行业,职位URL,公司规模,发布时间,薪资_最小值,薪资_最大值,年薪月数
OBC-开关电源硬件工程师,重庆,重庆力华科技有限责任公司,本科,5-10年,"电源,研发,电源设计,逆变器,OBC,PFC",30000-60000,工作职责概述 ：1.需求分析与系统设计：参与产品需求评审，将系统需求转化为详细的硬件设计规格（如效率、功率因数、THD、纹波、EMC、安规等）。负责主功率拓扑的选型和设计（如三相PFC整流、LLC谐振变换器、DAB、CLLC等），并进行系统级架构设计和功率预算计算。2.详细电路设计与仿真：负责三相PFC、DC/DC等主功率电路、驱动电路、采样调理电路的设计与元器件选型（IGBT/SiC MOSFE...,电子商务,http://jobs.zhaopin.com/CC555545820J40815813509.htm,20-99人,2026-01-09 01:24:39,30000.0,60000.0,13.0
拔尖计划-生活物联网智能硬件开发技术专家,重庆,中移物联网,硕士,无经验,,30000-50000,工作职责1、负责洞察智能硬件行业趋势，协助揭榜团队制定 3-5 年硬件产品技术路线图与生活物联网硬件技术方向选型与架构标准化。2、 负责部门硬件产品核心架构设计与技术攻坚。主导复杂硬件系统的全流程架构设计，解决技术难点，推动硬件与算法协同优化。3、负责部门硬件产品全生命周期管理。从需求分析到量产交付全流程把控，主导原理图设计评审、PCB Layout 优化、EMC/EMI 测试，确保产品良率达到业...,物联网,http://jobs.zhaopin.com/CC545530120J40831928510.htm,1000-9999人,2026-01-06 14:57:16,30000.0,50000.0,16.0
控制系统硬件工程师,重庆,宗申集团,本科,3-5年,,20000-40000,岗位职责：1、根据控制系统需求，参与航空发动机 ECU 系统需求分析与硬件需求分解，同步完善硬件设计文档，确保文档的完整性与规范性。2、设计硬件架构，负责航空发动机 ECU硬件的方案设计与详细设计，包括元器件选型、原理图绘制、PCB 布局布线，确保硬件设计符合航空行业相关标准（及产品性能指标；3、绘制原理图，规划PCB板层、尺寸与布局，主导 ECU 硬件原型机的制作与调试工作，解决原型机研发过程中...,汽车研发/制造,http://jobs.zhaopin.com/CC203112410J40617625508.htm,10000人以上,2026-01-07 15:20:34,20000.0,40000.0,12.0
硬件工程师-逆变器,重庆,重庆力华自动化技术有限责任公司,本科,5-10年,"硬件开发,光伏逆变器",20000-40000,一、岗位职责1、硬件设计与开发负责单相/三相户储逆变器（1kW-15kW）的硬件开发，涵盖离网、并网及混合拓扑，主导功率变换单元设计（如双向DC/DC、DC/AC）、磁性器件选型、热设计及EMC优化。精通主流拓扑架构（如PSFB/DAB/Heric/H6/T-NPC），独立完成原理图设计、PCB布局指导、关键器件选型及损耗仿真。2、测试与问题解决主导样机调试与性能验证，使用示波器、功率分析仪等工具...,汽车零部件,http://jobs.zhaopin.com/CC270553110J40801488909.htm,1000-9999人,2025-11-27 16:59:51,20000.0,40000.0,12.0
硬件开发部经理,重庆,重庆天如生物科技有限公司,本科,5-10年,胃肠镜,20000-40000,岗位职责1. 负责团队完成公司硬件开发部项目的整体规划、管理与监督；设定团队目标和绩效标准，激励团队成员，提升团队士气和凝聚力；提供技术指导和支持，解决团队在开发过程中遇到的技术难题；2. 产品需求的收集，制定项目开发计划，牵头对产品的系统、架构进行设计；3. 负责系统方案、子系统详细设计的评审和把关； 4. 负责参与产品的功能、稳定性和可靠性测试、EMC测试、安规测试；5. 负责产品开发及过程文...,医疗设备/器械,http://jobs.zhaopin.com/CC501908020J40923770404.htm,20-99人,2025-06-19 11:38:11,20000.0,40000.0,12.0
高级硬件工程师,重庆,重庆赛特制冷设备有限公司,本科,3-5年,"设计,PCB设计,EMC设计,硬件测试",18000-35000,岗位内容：1. 独立设计和开发嵌入式系统的硬件电路和原理图；2. 独立进行器件选型和布局，设计PCB板并进行调试和验证；3. 独立责硬件功能测试、故障分析和解决方案的制定；4. 独立参与产品的设计评审和技术讨论，提出优化方案； 5.能管理团队，做好项目开发。 任职要求： 1. 本科及以上学历，电子工程等相关专业，3年及以上硬件开发经验； 2. 熟悉嵌入式系统、模拟电路、数字电路的设计方法和器件选型...,电气机械/电力设备,http://jobs.zhaopin.com/CC332669610J40804826313.htm,500-999人,2025-12-31 08:58:55,18000.0,35000.0,12.0
硬件产品规划专员,重庆,天津尘时科技有限责任公司,本科,5-10年,,24000-30000,1.负麦底盘、平台及座椅等产品及技术趋势洞察、竞争及行业趋势分析，为公司新技术产品发展提供战略性建议。2.负麦结合用户需求、市场发展趋势、产品策略等维度，制定新技术和硬件产品的应用搭载规划。3.负麦底盘及平台产品的定义(品类/品种、产品路标、功能配置带宽等)、产品组合策略制走及功能/技术领先性挖掘。4.定期跟踪市场趋势和行业动态，负表平台产品的全生命周期产品跟踪，及时调整需求路标和产品的搭载策略。...,IT服务,http://jobs.zhaopin.com/CCL1252029180J40854068013.htm,500-999人,2026-01-07 13:19:57,24000.0,30000.0,12.0
硬件工程师（重庆）,重庆,深圳芯珑电子技术有限公司,本科,3-5年,,15000-30000,一、产品开发:1.设计开发:根据研发计划，完成产品硬件的需求分解、硬件平台搭建、原理图设计、物料选型、样机性能自测、产品BOM制作等硬件开发工作;2.技术评审:参与产品研发各阶段的技术评审，包括方案评审、原理及PCB评审、产品用料及BOM评审:生产工艺评审等事项3.资料归档:按计划输出各阶段硬件相关技术文档并提交审核归档;二、产品维护1.招投标:根据招投标技术要求，输出详细技术类资料，配合完成招投...,电子/半导体/集成电路,http://jobs.zhaopin.com/CC405654510J40743836106.htm,20-99人,2025-12-26 09:59:20,15000.0,30000.0,12.0
开关电源OBC硬件工程师,重庆,重庆力华自动化技术有限责任公司,大专,3-5年,,15000-30000,工作职责概述 ：1.需求分析与系统设计：参与产品需求评审，将系统需求转化为详细的硬件设计规格（如效率、功率因数、THD、纹波、EMC、安规等）。负责主功率拓扑的选型和设计（如三相PFC整流、LLC谐振变换器、DAB、CLLC等），并进行系统级架构设计和功率预算计算。2.详细电路设计与仿真：负责三相PFC、DC/DC等主功率电路、驱动电路、采样调理电路的设计与元器件选型（IGBT/SiC MOSFE...,汽车零部件,http://jobs.zhaopin.com/CC270553110J40815856109.htm,1000-9999人,2025-12-03 09:31:18,15000.0,30000.0,12.0
硬件工程师,重庆,重庆美顺电子科技有限公司,本科,3-5年,,20000-30000,1、电子产品硬件设计，包括：控制电路设计、组件选用、布局分析；2、编写详尽的设计方案、计划及产品测试；3、设备的电气调试及现场技术处理；4、设计技术文件资料的编写和测试数据记录。5、对产品提供技术支持；岗位要求：1、三年以上硬件开发工作经验；2、熟练使用PCB开发工具；3、具有较强的模拟/数字电路分析能力；4、具有较强的电路设计和PCB布板能力；5、有功率器件开发经验者优先。乘车线路：轻轨6号线至...,电子设备制造,http://jobs.zhaopin.com/CC583052920J40749666212.htm,100-299人,2025-11-28 09:27:55,20000.0,30000.0,12.0
控制器硬件工程师,重庆,重庆力华科技有限责任公司,大专,经验不限,"设计,PCB设计",15000-30000,1.负责产品电路板的原理图、PCB设计，硬件调试；2.独立开发设计各种BLDC控制器PCBA，从画图到制样，熟悉电机控制电路以及BLDC控制原理，开关电源和电路处理；3.跟踪PCB制板及SMT过程并解决相关技术问题、原理图、BOM、规格书等相关资料制定，解决生产异常问题。根据公司要求设计制作，，独立完成开发项目积极响应客户需求，处理客户投诉不良问题。任职资格：1本科以上学历，电子设计相关专业；2....,电子商务,http://jobs.zhaopin.com/CC555545820J40802544909.htm,20-99人,2025-11-06 16:10:52,15000.0,30000.0,13.0
嵌入式硬件工程师,重庆,七腾机器人有限公司,本科,3-5年,,15000-30000,岗位职责：1、能承担硬件电路开发任务，能根据需求进行方案评估，器件选型，原理设计，PCB设计，调试和优化；2、负责电路系统的硬件测试、性能测试，验证可靠性；负责产品组装和调试；3、负责产品的PCB的EMC设计及整改工作；4、负责产品相关文档（如硬件规格书、原理图、BOM）的拟制以及相关研发过程产生的技术文档的编制。任职资格：1、电子、自动化、机电一体化等相关专业，本科及以上学历优先；有机器人相关开...,专用设备制造,http://jobs.zhaopin.com/CC387441310J40803563501.htm,500-999人,2025-11-04 10:59:28,15000.0,30000.0,12.0
高级无人设备硬件开发工程师,重庆,重庆软江图灵人工智能科技有限公司,本科,3-5年,"设计,无人机设备",20000-30000,一、主板设计阶段要求1. 需求分析与器件选型 明确无人设备用途（航拍、竞速、测绘等），确定性能边界（功耗、算力、体积、重量）。 选择合适主控芯片（如 STM32、ESP32、NXP i.MX、TI Sitara），兼顾处理能力、接口丰富度与功耗控制。2. 原理图与PCB设计 熟练运用EDA工具：Altium Designer、Cadence Allegro、KiCad 等。 掌握电源管理设计（DC...,人工智能,http://jobs.zhaopin.com/CCL1264708430J40962531204.htm,20-99人,2025-10-29 18:03:19,20000.0,30000.0,12.0
硬件经理/硬件主管,重庆,重庆中科摇橹船信息科技有限公司,本科,5-10年,"设计,PCB设计",18000-28000,岗位职责：全面负责视觉产品/项目硬件电路板块的研发和管理工作；根据中分解的产品开发计划，分解项目开发任务到人，并负责组织硬件工程师按时、保质、保量完成项目开发任务；基于产品规格要求，提炼硬件电路设计需求，负责产品硬件电路方案设计、主控芯片选型；解决产品全生命周期的硬件电路及电磁安全等问题，持续迭代并提升产品的电气性能；负责硬件团队的招聘及建设，建立研发人才梯队，制定并实施硬件工程师的培训...,人工智能,http://jobs.zhaopin.com/CCL1310684380J40799104112.htm,100-299人,2025-12-03 15:53:56,18000.0,28000.0,12.0
嵌入式硬件电气设计工程师,重庆,成都尚澧科技有限公司,本科,经验不限,"电气设计,电路设计",14000-28000,岗位职责1、负责嵌入式硬件设计，熟悉ZYNQ/FPGA/ARM等常用系统及其外设电路设计，熟悉模拟/数字/传感器、功率驱动电路，熟悉片上及板间通信/开入开出接口设计。2、熟悉电路原理绘制流程，能熟练使用电路硬件设计软件，具备PCB绘制以及检查核对能力。3、进行BOM器件校对、硬件焊装、系统样机调试任务。4、与软件、系统开发人员保持良好沟通，能快速理解各方需求，配合完成各项工作。5、按照要求完成相关...,船舶/航空/航天/火车制造,http://jobs.zhaopin.com/CCL1282262330J40729662706.htm,20-99人,2025-10-29 23:10:07,14000.0,28000.0,13.0
GAN研发测试高级工程师,重庆,华润微电子有限公司,本科,5-10年,"软件测试,硬件测试,Python,Java,PCB",,工作内容：1.器件电性/CP/FT/可靠性测试2.规格书测试3.测试软件编程4.据自动化处理任职资格：1.具有本科学历，专业领域为电子信息相关，且拥有5年以上工作经验。2.精通电子元器件的基本特性和失效机制；熟悉可靠性理论，及电子元器件的可靠性分析和测试方法。3.熟练操作并运用联动/华峰等ATE自动测试设备。4.熟练操作探针台、示波器、源表等测试仪器。5.精通Python、Java等编程语言，并能...,电子/半导体/集成电路,http://jobs.zhaopin.com/CC433725510J40852653713.htm,10000人以上,2025-12-30 09:53:02,,,
低压硬件开发（国央企）,重庆,南方新华,本科,3-5年,"电路原理设计,元器件选型,PCB LAYOUT",20000-26000,岗位职责：1) 负责EPS控制器硬件设计，包含电路原理设计、元器件选型、PCB Layout2) 负责散热方案设计及验证。3) 编写硬件设计规范、FMEA、硬件电路测试用例、试验规范等技术资料4) 负责EPS控制器硬件试制、验证及开发过程中出现问题进行改进5）负责电路测试、散热测试、试验整改及试验跟踪任职要求：1）具有3年以上电子产品设计经验；2）熟悉单片机的软、硬件结构，熟悉嵌入式系统架构； 3...,人力资源服务,http://jobs.zhaopin.com/CC346219280J40816365411.htm,100-299人,2025-12-23 09:53:03,20000.0,26000.0,12.0
硬件工程师,重庆,重庆天如生物科技有限公司,本科,5-10年,"设计,PCB设计,EMC设计",13000-26000,1、负责根据项目任务需求及部门分配的设计开发任务，按照硬件设计开发流程开展硬件设计 需求分析、硬件概要设计、硬件详细设计、硬件调试、功能验证，组织设计评审。2、负责产品验证、发布及生命周期内硬件相关的缺陷整改及优化设计。3、负责硬件设计加工样品的验证评估、确认。4、负责产品硬件部分的样机组装及调试。 5、负责硬件设计文档的开发，并配合项目组开发检验、注册相关的技术文档。6、负责硬件开发过程中外协加...,医疗设备/器械,http://jobs.zhaopin.com/CC501908020J40952554404.htm,20-99人,2025-11-12 16:19:08,13000.0,26000.0,12.0
电机控制器硬件工程师（汽车）,重庆,重庆九洲智造科技有限公司,本科,3-5年,"三电系统,控制器,MCU",15000-25000,岗位职责1.负责汽车电机控制器需求分析，汽车电机控制器项目单板硬件开发；2.负责整机测试环境搭建、测试操作&数据记录（热、效率、黑白盒等等）3.参与搭建车载器件平台，参与编码认证过程中的交叉料替代测试。岗位要求1.三年以上相关工作经验；2.熟悉汽车电机控制器工作原理，具具备EMC测试和问题整改能力。,新能源汽车,http://jobs.zhaopin.com/CCL1481532990J40856020712.htm,500-999人,2026-01-10 01:36:38,15000.0,25000.0,13.0
硬件工程师,重庆,东方鑫源集团有限公司,本科,5-10年,"新能源车,摩托车,辅助驾驶系统设计",20000-25000,岗位职责：1、分析车联网系统需求，制定网联系统硬件平台化方案2、负责控制电器的硬件设计开发、原理图设计、PCB设计3、负责整车硬件电路需求分析4、负责器件选型、供应商硬件方案评审5、配合搭建车联网测试台架、单板功能电路调试测试及验证6、完成上级领导交办的其他临时工作任职要求：1、统招本科及以上学历，电子信息、软件开发等相关专业优先；2、5年以上电子产品开发设计经验，有车联网开发经验优先；精通基础电...,汽车研发/制造,http://jobs.zhaopin.com/CC880859730J40811993111.htm,10000人以上,2026-01-10 01:33:49,20000.0,25000.0,13.0
硬件电路设计工程师,重庆,重庆沃科诚达汽车电子有限公司,本科,5-10年,"设计,电路设计,PCB设计,EMC设计,模拟电路,数字电路",15000-25000,岗位职责： 1、承担硬件方案与计划的制定，完成原理图设计、PCB设计，电器部件图纸转化工作，以及编写相关技术文档；2、参与产品试制、测试并输出文档记录；3、负责编制产品作业指导书等过程文件；4、参与产品改进、提升工作；5、完成领导安排的临时任务。岗位要求：1、本科及以上学历，电气工程、自动化、电子电路专业，有较成熟的硬件设计经验；2、熟悉电路图纸绘制，能熟练掌握主流绘图软件，包括原理图，PCB板图...,汽车零部件,http://jobs.zhaopin.com/CC333754180J40380860310.htm,20-99人,2026-01-08 01:25:26,15000.0,25000.0,12.0
硬件开发工程师（车载充电机）,重庆,重庆九洲智造科技有限公司,本科,3-5年,电源,15000-25000,岗位职责1.负责车载电源产品的单板硬件电路原理图设计、测试、优化；2.负责元器件和关键零组件的选型与评估；3.负责产品电气试验及EMC试验和整改；4.制定测试方案，完成已经功能测试。 岗位职责1.三年以上相关工作经验，2.熟悉 OBC工作原理，具备扎实的硬件设计能力。3.根据模块/组件需求规格，独立按照方案要求完成电路参数计算书、原理图绘制、电路细化仿真，联合layout工程师完成PCB绘制。4....,新能源汽车,http://jobs.zhaopin.com/CCL1481532990J40856018812.htm,500-999人,2026-01-10 01:36:38,15000.0,25000.0,13.0
电源硬件设计师,重庆,北京星空建腾电子科技有限公司,本科,3-5年,"设计,硬件测试,技术支持,PCB设计,DSP研发,单片机开发",15000-25000,1、电子信息/电气自动化相关专业，负责项目的研发方案、按时间节点完成项目的研发；2、编写产品从实施方案到定型各阶段的项目相关技术文档等；3、较强动手能力，完成电源类产品从设计、调试、测试、批产支持等各阶段工作；4、负责产品研制过程中的质量排故、失效分析；5、产品售前、售后技术支持等工作；任职要求:1、本科以上学历，电力电子、自动控制、电气工程、通信工程、计算机等相关专业优先。2、有相关项目研发经历...,电子/半导体/集成电路,http://jobs.zhaopin.com/CC521238220J40609731806.htm,20-99人,2026-01-04 11:17:02,15000.0,25000.0,12.0
hill测试工程师,重庆,南方新华,本科,5-10年,"硬件测试,软件测试,硬件在环测试,HILL测试,CANoe,周立功,CANAPE,CAPL,制动系统,IBCU",15000-25000,特点：央企、零部件企业、制动系统、底盘、hill测试、IBCU、EPB工作内容：1、负责IBCU/EPB项目HIL测试;2、负责IBCU/EPB项目测试用例搭建，测试用例库维护3、负责IBCU/EPB项目HIL项目台架集成、测试工程搭建、自动化测试脚本搭建、测试报告出具；任职要求：1.本科及以上学历，5年及以上底盘领域HIL测试工作经验、有NI系统及ECU_Test软件使用经验优先2、掌握CANa...,人力资源服务,http://jobs.zhaopin.com/CC346219280J40814515011.htm,100-299人,2025-12-15 11:42:50,15000.0,25000.0,13.0
电机控制器硬件工程师,重庆,重庆润通科技有限公司,本科,5-10年,,15000-25000,本岗位主要负责高速电动摩托车的开发。主要职责：1、参与并主导电机控制器的系统架构设计和技术方案评审。2、将整车和系统需求（如功率、扭矩、效率、EMC、功能安全等）转化为具体的硬件设计规格书。3、功率电路设计： 主导大电流、高电压（如72V/96V及以上）的功率回路设计，包括IGBT/MOSFET选型、栅极驱动电路、母线电容、采样电阻、预充/泄放电路等。4、控制电路设计： 负责基于ARM/Corte...,通用设备制造,http://jobs.zhaopin.com/CC434354980J40877525602.htm,1000-9999人,2025-12-09 13:13:45,15000.0,25000.0,14.0
电源硬件工程师,重庆,重庆瑜欣平瑞电子股份有限公司,本科,3-5年,研发,15000-25000,【岗位职责】1. 大功率电源产品方案设计、硬件设计开发，1.5KW以上大功率；2. 绘制电气原理图和PCB图； 3. 器件选型、电磁设计、编制设计产品元器件需求清单；4. 样机制作、调试、测试并记录数据；5. 设计产品的技术标准、检验标准及其它转产工作。 【岗位要求】 1，电子类相关专业毕业，4年以上电源开发经验，开关电源、数字电源； 2，精通正激、反激、半桥、全桥、推挽、LLC等拓扑的工作原理设...,通用设备制造,http://jobs.zhaopin.com/CC145218010J40475240602.htm,500-999人,2025-09-16 00:00:42,15000.0,25000.0,13.0
AI测试工程师,重庆,重庆通用人工智能研究院,本科,1-3年,软件测试,12000-24000,行业智能体中心：1、参与智能体评测平台的功能开发与测试，保障平台部署与使用；2、协助构建测试数据集，参与模型的训练与优化；3、负责AI产品功能测试、性能测试，设计专项测试用例；4、参与自动化评测流水线开发，提升评测效率；5、整理评测报告，推动问题闭环与评测流程优化。要求：1、本科及以上学历，计算机相关专业；2、2年以上测试/算法研发经验，有AI产品测试或数据生成经验者优先；3、熟悉Python，了...,学术/科研,http://jobs.zhaopin.com/CCL1514232650J40908925308.htm,20-99人,2025-12-29 10:57:09,12000.0,24000.0,12.0
硬件工程师,重庆,重庆冷元科技有限公司,本科,3-5年,"设计,硬件测试,智能穿戴",12000-24000,核心职责： 1. 负责智能手环/手表等产品的硬件系统方案设计、关键元器件（主控、传感器、电池等）选型和评估。 2. 独立完成原理图设计、PCB Layout检查和评审，确保信号完整性、电源完整性和电磁兼容性。 3. 主导硬件原型板的调试、测试和故障分析，解决开发过程中遇到的各种技术难题。 4. 负责传感器（如心率和血氧）的驱动、调试和性能优化，确保数据采集的准确性与稳定性。 5. 与结构工程师紧密...,人工智能,http://jobs.zhaopin.com/CCL1511931740J40807774011.htm,20-99人,2025-12-11 14:57:37,12000.0,24000.0,12.0
硬件工程师项目负责人（待遇好）,重庆,重庆中电天时精密装备技术有限公司,本科,5-10年,"硬件项目管理,硬件研发",15000-24000,岗位内容：1. 制定硬件项目计划，安排资源，监督项目进展。2. 对项目中出现的各种问题及时跟进处理，保证项目顺利并按时交付。3. 协调技术团队、采购团队、供应商等外部合作伙伴，确保项目质量。任职要求：1. 本科及以上学历，在计算机、电子工程或相关专业有扎实的基础。211和9852. 具备5年以上硬件项目管理经验，精通项目管理工具和流程。3. 具备领导能力和团队管理经验，善于沟通和协调，敢于面对压力...,仪器仪表制造,http://jobs.zhaopin.com/CC397374830J40795504314.htm,20-99人,2025-11-19 15:33:32,15000.0,24000.0,12.0
硬件设计工程师,重庆,重庆长江电工工业集团有限公司,本科,3-5年,"设计,PCB设计",12000-24000,一、工作职责1、负责智能无人系统智控系统硬件架构论证、设计。2、负责智能无人系统智控系统硬件原理图设计、验证、调试。3、根据产品设计要求，进行硬件设计选型，设计及实现。4、协助软件开发共测试完成软件测试及相关硬件验证工作。二、技能要求1、熟悉数字电路、模拟电路、信号测量以及硬件调试。2、熟练使用硬件开发工具完成SOC、MCU等核心板、扩展板的原理图设计及PCB layout。3、熟练使用电烙铁等工...,船舶/航空/航天/火车制造,http://jobs.zhaopin.com/CC203234910J40795811402.htm,1000-9999人,2025-08-19 15:06:18,12000.0,24000.0,12.0
电源硬件开发工程师-CQ,重庆,联合汽车电子有限公司（UAES）,硕士,3-5年,,12000-24000,岗位职责:1、支持客户需求分析，负责硬件需求分析和子模块需求分解；2、硬件系统架构设计，主功率拓扑选择，设计，分析和优化；3、硬件模块电路WCA计算，设计分析和仿真评估；4、电路原理图集成，与CAD工程师一起进行layout设计，电子物料受控与维护；5、项目硬件域批产受控（FMEA、特殊特性定义，供应商评审），支持物料管理以及样品生产等活动。6、产线生产以及客户应用问题定位、原因分析和措施实施。 ...,金属制品业,http://jobs.zhaopin.com/CC000260640J40925875704.htm,1000-9999人,2025-06-26 14:34:41,12000.0,24000.0,17.0
硬件工程师（重庆）,重庆,上海简仪科技有限公司,硕士,无经验,技术支持,16000-24000,工作职责负责产品硬件方案设计，硬件设计开发，产品维护；编写设计文档，BOM制作及生产工艺文件编写，输出规范化的产品技术文档；负责产品硬件质量问题定位、查明根源制定解决措施及计划； 岗位要求电子信息或通讯相关专业，硕士及以上学历；有从立项到生产导入的全程经历者优先；具备扎实的数字，模拟电子及电路分析专业基础知识及技能；能熟练使用Cadence软件进行原理图和PCB设计，熟悉模拟电路和高速数字信号设计...,仪器仪表制造,http://jobs.zhaopin.com/CC403205130J40516002305.htm,20-99人,2025-04-16 12:26:45,16000.0,24000.0,12.0
