职位,城市,公司,学历,经验,技能,薪资,工作描述,行业,职位URL,公司规模,发布时间,薪资_最小值,薪资_最大值,年薪月数
后端开发工程师,重庆,重庆中电自能科技有限公司,本科,5-10年,"Java,SQL",10000-20000,任职要求 1.教育背景及工作经验：第一学历为本科及以上学历，985高校、211高校本科及以上学历优先，专业领域包括但不限于大数据、计算机、统计学、管理科学、电子信息工程或相关与数字化/算法类相关的专业。工作年限5年（含）以上，具备数字化企业、能源行业或国有企业等相关企业3年以上工作经历。对于特别优秀或公司紧缺的特殊人才，上述基本条件可适当放宽 2.技术能力 ①Java基础扎实，熟悉大数据平台数据仓...,IT服务,http://jobs.zhaopin.com/CC383364020J40978474004.htm,20-99人,2026-01-09 17:40:59,10000.0,20000.0,16.0
php开发工程师,重庆,爱奥尼科技,本科,3-5年,"Python,node.js,负载均衡技术,分布式技术,微服务架构,架构师,后端开发,APP后台开发,Linux",15000-20000,重庆爱奥尼科技有限公司（Ionitech）是一家专注于国际市场的移动应用开发企业，致力于为全球用户提供创新的数字化解决方案。我们的产品涵盖多媒体娱乐、效率工具、生产力提升等多个领域，凭借卓越的用户体验和技术优势，已在全球范围内赢得广泛认可与信赖。 我们以“成为国际市场用户信赖的移动应用创新企业”为愿景，始终关注用户需求与技术前沿，通过全球化的视野与专业的团队协作，打造能够真正影响世界的应用产品。加...,计算机软件,http://jobs.zhaopin.com/CC621153620J40709476801.htm,20人以下,2026-01-05 01:00:23,15000.0,20000.0,13.0
前端开发工程（重庆）,重庆,普联软件股份有限公司,本科,3-5年,"ERP项目,JavaScript,HTML5,TypeScript,Vue,Ant Design,Node.js",10000-15000,岗位职责: 1. 负责公司前端项目的开发和维护 2. 参与产品需求分析，制定技术实现方案 3. 编写高质量、可维护的前端代码 4. 与UI设计师、后端开发工程师协作完成项目开发 5. 参与代码审查，保证代码质量 6. 持续优化前端性能，提升用户体验 7. 参与技术选型和架构设计讨论 任职要求: 1、基本要求 - **工作经验**：3年以上前端开发经验 - **学历要求**：本科及以上学历，计算机相...,计算机软件,http://jobs.zhaopin.com/CC153424410J40769709616.htm,1000-9999人,2026-01-09 00:33:21,10000.0,15000.0,12.0
移动web前端开发工程师,重庆,软通动力信息技术(集团)股份有限公司,本科,3-5年,"TypeScript,Vue,Node.js,Echarts,WebGL",11000-14000,1.统招大专及以上学历，计算机相关专业；2.熟练掌握Vue3开发框架，并理解其核心原理；3.熟悉前端工程化工具，如Webpack、Babel、Npm等；4.熟练掌握HTML、CSS3和JavaScript（ES6+），熟悉W3C标准、浏览器渲染原理、兼容性及性能问题；5.有良好的代码规范和文档编写习惯，注重代码质量和可维护性；（加分项）6.有webRTC相关音视频开发经验者优先；（加分项）7.有跨...,互联网,http://jobs.zhaopin.com/CC000544460J40785755416.htm,10000人以上,2026-01-06 17:56:57,11000.0,14000.0,12.0
前端开发（驻点成都、可提供住宿）,重庆,安徽屹通信息科技发展有限公司,本科,1-3年,"金融项目,银行项目,证券项目,支付项目,CSS,HTML5,Vue,Node.js",,岗位内容：1. 设计和开发适用于不同设备的易于使用的网站2. 参与产品原型设计和产品需求分析3. 跟进技术趋势及前端开发最佳实践，不断提升团队的技术水平任职要求：1. 统招本科理工科专业，一年以上前端开发经验，有银行经验优先，掌握HTML5/CSS/JavaScript等前端技术和常用框架2. 具备良好的学习能力和解决问题的思维能力，能够配合其他团队成员完成项目工作3. 对新技术有好奇心，并愿意持...,IT服务,http://jobs.zhaopin.com/CC640126480J40835818814.htm,1000-9999人,2026-01-08 11:26:16,,,
前端开发-小程序和APP经验,重庆,深圳市法本信息技术股份有限公司,本科,5-10年,"ERP项目,大屏/可视化项目,GIS/地图项目,Vue,React,uni-app,Node.js,WebGL,HTML5,CSS,JavaScript",11000-13000,1、参与产品的前端架构设计、开发编码、单元测试等工作；2、参与产品改善、维护和优化相关产品的质量、性能，提升用户体验，确保Web用户界面在多浏览器环境中正常工作。 要求 1、有实际的软件前端开发经验；掌握W3C技术标准，精通HTML、Javascript、Ajax、DOM、HTML5、CSS3等前端开发技术； 2、熟练掌握Vue、jequry、webpack等前端框架和相关技术并了解其实现原理，熟...,计算机软件,http://jobs.zhaopin.com/CC385622410J40742426806.htm,1000-9999人,2025-12-19 10:22:48,11000.0,13000.0,12.0
前端开发（光电园）,重庆,软通动力信息技术(集团)股份有限公司,本科,5-10年,"CSS,大屏/可视化项目,GIS/地图项目,JavaScript,Vue,Node.js,Three.js,Cesium",11000-14000,岗位职责: 1. 负责前端页面的开发与优化，保障页面在不同设备和浏览器上的兼容性； 2. 根据产品需求与设计稿，完成高质量的前端编码与实现； 3. 参与前端技术的调研与选型，推动技术方案的落地与优化； 4. 配合后端开发人员完成系统联调，确保项目按时交付； 5. 持续改进前端性能，提升用户体验。 任职要求: 1. 熟悉HTML/CSS/JavaScript等前端核心技术，具备扎实的编程能力； 2....,互联网,http://jobs.zhaopin.com/CC000544460J40784558116.htm,10000人以上,2025-12-30 17:23:31,11000.0,14000.0,12.0
前端开发工程师,重庆,聚慧食品科技(重庆)有限公司,本科,3-5年,"CSS,JavaScript,HTML5,Vue,大屏/可视化项目,GIS/地图项目,ERP项目,uni-app,Node.js",,岗位职责：1.主导公司产品Web端、移动端（H5/App）及小程序的架构设计、开发与全生命周期维2.后端团队深度协作完成接口联调，解决前端性能优化、兼容性等复杂技术问题3.封装高复用性前端组件库与工具链，提升团队开发效率与代码质量4.制定并推动前端技术规范、代码审查流程，保障系统可维护性与扩展性5.主导项目迭代计划，高效完成版本发布与灰度管理，支撑业务快速演进技能要求：1.精通HTML5/CSS3...,快速消费品,http://jobs.zhaopin.com/CC843819990J40819875911.htm,1000-9999人,2026-01-09 09:24:58,,,
前端开发工程师,重庆,云测数联(重庆)科技有限公司,本科,3-5年,"JavaScript,React,Node.js,CSS,环保,Flutter",,岗位职责1、参与公司核心产品的自研，负责产品前端功能模块、软件交互、动效等前端开发工作。2、协助梳理业务需求，提供技术方案，根据方案驱动上下游团队执行落地。3、与团队协作攻克技术难题，提升用户体验。任职要求:1、统招本科及以上学历，计算机相关专业，3年及以上Web前端开发经验。2、前端基础扎实，熟悉HTML、JavaScript、CSS、TypeScript、ES6规范。3、熟悉React、Vue...,互联网,http://jobs.zhaopin.com/CCL1394599500J40783987107.htm,100-299人,2025-11-26 15:52:15,,,
前端开发（星网）,重庆,软通动力信息技术(集团)股份有限公司,本科,3-5年,"通信项目,JavaScript,HTML5,CSS,Vue,webpack,Node.js,NPM,WEBRTC音视频,跨平台开发,卫星,可视化大屏",,1.统招本科及以上学历，计算机相关专业；2.熟练掌握Vue开发框架，并理解其核心原理；3.熟悉前端工程化工具，如Webpack、Babel、Npm等；4.熟练掌握HTML、CSS3和JavaScript（ES6+），熟悉W3C标准、浏览器渲染原理、兼容性及性能问题；5.有良好的代码规范和文档编写习惯，注重代码质量和可维护性；6.有webRTC相关音视频开发经验者优先；7.有跨平台开发经验者优先、有...,互联网,http://jobs.zhaopin.com/CC000544460J40770822616.htm,10000人以上,2026-01-07 16:36:37,,,
前端开发（政务科技）,重庆,新讯数字科技(杭州)有限公司北京分公司,大专,3-5年,"CSS,HTML5,JavaScript,Vue,Node.js",,岗位职责：1.大专以及上学历，有3-5年相关工作经验2.有实际的软件前端开发经验；3.掌握HTML、Javascript、Ajax、DOM、HTML5、CSS3等前端开发技术；4.掌握Vue、jequry、webpack、nginx、nodejs等前端框架和相关技术；5.良好的编程习惯，对前端模块化、组件化、工程化有基本的理解,运营商/增值服务,http://jobs.zhaopin.com/CC120409680J40815284509.htm,1000-9999人,2025-12-03 16:16:23,,,
前端工程师,重庆,重庆英泰帝克科技有限公司,本科,经验不限,"CSS,JavaScript,HTML5,Vue,Node.js,Three.js",,工作内容:1. 根据项目具体要求，承担开发任务，按计划完成任务目标；2. 负责对现有医学影像及3D数据库管理平台的整改优化、新增功能、产品融合；3. 精通原生js面向对象编程思想，有项目开发经验。4. 完成软件全生命周期文档的编写，配合其他部门编制相关技术文档;5. 领导安排的其他工作。 任职要求:1.30岁以下，本科以上学历，HTML5、CSS3、Javascript基础扎实，有较强的web界面...,医疗设备/器械,http://jobs.zhaopin.com/CC818552370J40897992308.htm,20-99人,2025-11-04 15:40:33,,,
高级前端开发工程师,重庆,软通动力信息技术(集团)股份有限公司,本科,5-10年,"CSS,JavaScript,HTML5,Vue,React,Node.js,GIS/地图项目,大屏/可视化项目,UI设计",10000-13000,岗位要求1、计算机相关专业本科毕业，熟悉 HTML/CSS/JavaScript 等核心技术；2、熟悉主流前端框架，如 React、Vue、Angular 等；3、熟练 Redis、Kafka 等中间件，mysql、达梦等数据库；4、熟悉 HTTP/HTTPS协议，熟悉基本的网络原理；5、有大型项目、商业项目开发经验者优先录取；6、善于思考，有较强学习能力、沟通能力，有责任心。7、要求会开发会ui...,互联网,http://jobs.zhaopin.com/CC000544460J40774725616.htm,10000人以上,2025-11-19 11:03:51,10000.0,13000.0,12.0
后端开发,重庆,好活(重庆)网络科技有限公司,学历不限,经验不限,Java,,职位名称：后端开发 岗位职责： - 负责公司核心系统的后端开发与维护工作，保障系统稳定运行与高效性能； - 参与产品需求分析与技术方案设计，推动项目高质量交付； - 编写规范、可维护的代码，持续优化系统架构与模块设计； - 与前端、测试、产品等团队协作，确保项目顺利推进与良好用户体验。 任职要求： - 计算机相关专业本科及以上学历，具备扎实的编程基础与算法能力； - 熟悉一种或多种后端开发语言（如...,云计算/大数据,http://jobs.zhaopin.com/CCL1405717820J40837496705.htm,20-99人,2026-01-08 10:54:59,,,
前端开发工程师,重庆,重庆唯哲科技有限公司,本科,经验不限,"CSS,HTML,JavaScript,Golang",,【岗位职责】1.负责 WebReal2.0 图形化编程平台的前后端功能开发与迭代；2.使用 Vue2.0 + ElementUI 实现界面与交互功能，确保用户体验一致性；3.使用 JavaScript 与 Go 语言开发图形化编程组件及函数图元；4.使用 Node.js 进行后端逻辑与数据交互开发；5.参与产品需求讨论与技术方案设计，保障项目高效交付；6.遵循 Sprint+AI 工作模式，进行敏...,互联网,http://jobs.zhaopin.com/CC607156180J40918701104.htm,20-99人,2026-01-09 01:08:06,,,
前端开发（会UI设计）,重庆,软通动力信息技术(集团)股份有限公司,大专,5-10年,"GIS/地图项目,大屏/可视化项目,JavaScript,Vue,uni-app,Node.js,Echarts,UI",11000-13000,岗位职责：1. 负责前端页面的开发与维护，确保兼容各种浏览器；2. 根据产品需求，与团队合作，完成高质量的编码工作；3. 参与前端技术研究，推动前端技术的创新与优化；4. 负责UI设计，确保设计质量和用户体验；5. 解决各种浏览器的兼容性问题。任职要求：1. 具备良好的前端开发技能，熟悉HTML/CSS/JavaScript等前端开发技术；2. 能够独立完成UI设计工作，具有良好的审美观和创新能力...,互联网,http://jobs.zhaopin.com/CC000544460J40774519016.htm,10000人以上,2025-11-18 14:27:02,11000.0,13000.0,12.0
移动web前端开发工程师,重庆,重庆中九科技发展有限公司,大专,3-5年,"web前端,前端架构,数据可视化,大屏/可视化项目,电商项目,ERP项目,React,Vue,uni-app,Node.js,Echarts,Canvas,HTML5,JavaScript,TypeScript",,一、岗位名称：前端开发工程师二、岗位职责：1.独立完成项目开发，具备开发和调试能力，保证良好的性能，独⽴完成业务逻辑、能对现有工作方法，所用系统和工具在流程、使用方法等层面提出建设性意见。2.技术生态协作：协同设计师、产品经理及后端团队，完成高质量的功能开发与优化；实现柜端功能动态管理（如柜子状态实时监控与维护）、数据同步和性能优化，确保“智能柜—中台—分润链”无缝衔接。3.负责公司核心产品的前端...,新零售,http://jobs.zhaopin.com/CCL1281939020J40822068003.htm,100-299人,2025-11-04 16:21:55,,,
web前端工程师,重庆,软通动力信息技术(集团)股份有限公司,大专,经验不限,"Vue,Angular,Node.js,音视频相关经验,悉前端打包与加载优化,服务器部署经验,有IM开发经验,有音视频开发经验",,1.统招大专及以上学历，计算机相关专业；2.熟练掌握Vue开发框架，并理解其核心原理；3.熟悉前端工程化工具，如Webpack、Babel、Npm等；4.熟练掌握HTML、CSS3和JavaScript（ES6+），熟悉W3C标准、浏览器渲染原理、兼容性及性能问题；5.有良好的代码规范和文档编写习惯，注重代码质量和可维护性；6.有webRTC相关音视频开发经验者优先；7.有跨平台开发经验者优先、有...,互联网,http://jobs.zhaopin.com/CC000544460J40770922816.htm,10000人以上,2026-01-05 11:01:00,,,
