职位,城市,公司,学历,经验,技能,薪资,工作描述,行业,职位URL,公司规模,发布时间,薪资_最小值,薪资_最大值,年薪月数
camera tuning,重庆,润芯微科技(江苏)有限公司,本科,3-5年,"HALCON,C++,图像识别产品,CAMERA 调试",18000-26000,、负责影像效果亮度（AE）相关的新技术、新功能、新平台预研和开发，直到功能完成； 2、负责影像效果亮度方向相关开发和交付，对影像交付亮度的结果负责；1、3年以上工作经验，熟悉光学原理，熟悉常见SOC平台（例如高通的sm8650、sm8550、MTK的DX3、DX2等）ISP pipeline流程，熟悉pipeline模块中的效果相互影响关系；2、精通平台效果参数调试（亮度相关），有常见影像功能（超...,计算机软件,http://jobs.zhaopin.com/CCL1278001380J40670097901.htm,1000-9999人,2026-01-07 01:00:24,18000.0,26000.0,12.0
AI 算法工程师（粉体/流体混合配料设备及产线）,重庆,重庆中承利璟环保机械设备有限公司,本科,经验不限,"深度学习,机器学习,多模态算法,机器视觉,自然语言处理,知识图谱",15000-25000,岗位职责1. 负责粉体/流体混合配料设备及产线的 AI 算法体系搭建，聚焦混合配料工艺优化（如混合均匀度预测、配料精度动态校准、能耗优化），提升设备核心性能指标；2. 研发设备智能控制算法，包括 PLC 与 AI 融合控制、多变量耦合控制、配方自适应调整算法，实现设备全自动、高精度运行；3. 设计设备故障诊断与预测性维护算法，基于振动、温度、运行参数等数据，精准识别轴承磨损、电机异常、密封件老化等...,专用设备制造,http://jobs.zhaopin.com/CCL1487088090J40786847816.htm,20-99人,2026-01-12 09:14:21,15000.0,25000.0,12.0
算法主管（重庆）,重庆,重庆天如生物科技有限公司,本科,5-10年,"深度学习,图像算法,OpenCV,PyTorch,Python,C++",20000-28000,岗位职责：1.负责带领团队完成公司项目的整体规划、管理与监督；设定团队目标和绩效标准，激励团队成员，提升团队士气和凝聚力；提供技术指导和支持，解决团队在开发过程中遇到的技术难题；2.负责公司产品的软件技术方案编制、软件技术架构设计和系统优化，确保产品的稳定性和可靠性，实现项目软件经验库的建立与维护；3.负责带领团队实现软件需求、设计、编码、集成、测试和发布，制定并执行医疗器械软件的质量管理体系，确...,医疗设备/器械,http://jobs.zhaopin.com/CC501908020J40918202004.htm,20-99人,2025-06-09 17:09:20,20000.0,28000.0,12.0
机器视觉算法工程师,重庆,隆鑫通用动力股份有限公司,本科,5-10年,图像识别产品,15000-25000,岗位职责：1.负责图像分类、 目标检测、语义分割、行为分析等深度学习模型的研发、优化与应用；2.参与硬件选型与调试（如工业相机、3D 传感器、光源等）；3.将模型部署至云端/边缘端 ，根据应用场景设计轻量化、高性能的算法方案；4.负责视觉检验模型现场应用的监控、改善、优化、迭代；5.跟踪前沿技术 ，探索创新性解决方案并推动落地；6. 负责算法评估以及算法相关的代码库封装和发布。任职资格：1. ...,通用设备制造,http://jobs.zhaopin.com/CC270234010J40829541010.htm,10000人以上,2026-01-06 01:28:42,15000.0,25000.0,13.0
视觉算法工程师,重庆,摩西智能工业股份有限公司,本科,1-3年,"机器人,OpenCV,C++,Python,Java,双目检测,深度学习,TensorFlow,PyTorch",14000-25000,工作地址可选择：东莞、昆山、重庆1.负责基于RGBD相机的空间目标检测、三维定位与实时追踪算法设计与实现；2.搭建并优化目标识别、配准、位姿估计等视觉模块，支持机器人/AR/工业等实际应用；3.实现多帧融合与滤波跟踪策略，提升定位鲁棒性与跟踪稳定性；4.与硬件团队协作，完成RGBD设备标定、数据采集及系统集成；5.参与开源算法调研、改进与落地。任职要求：1.本科及以上学历，有相关项目经验者优先，三...,仪器仪表制造,http://jobs.zhaopin.com/CC671288420J40903720408.htm,100-299人,2026-01-05 01:20:33,14000.0,25000.0,12.0
小康动力-视觉专家(J18490),重庆,赛力斯集团股份有限公司,本科,5-10年,"机器人,图像识别产品,智能硬件",15000-25000,"岗位职责:负责AI视觉产线质检方案设计及前沿技术验证；开发优化图像处理与检测模型（如YOLO/ResNet），集成硬件并部署模型至边缘设备及系统；运维优化已上线系统，提升检测性能与稳定性。任职要求:""1、统招硕士及以上学历，计算机/人工智能/自动化相关专业；2、5年以上AI视觉经验，有工业质检项目经验；精通Python/C++，熟练使用OpenCV、TensorFlow/ PyTorch；3、掌握...",汽车研发/制造,http://jobs.zhaopin.com/CC465219810J40837543703.htm,10000人以上,2025-12-27 01:06:14,15000.0,25000.0,13.0
通用算法工程师（重庆）,重庆,知来具身智能科技(苏州)有限公司,本科,经验不限,"PyTorch,深度学习,RCNN,Transformer,大模型算法,TensorFlow,Python,C++,大模型优化",15000-25000,岗位职责： 1、 负责用机器学习技术解决具体业务问题。 2、 独立完成数据收集，打标与模型训练与评估。 3、 针对具体问题调优模型，提升效果。 任职要求： 1、 本科及以上学历，人工智能相关专业优先。 2、 熟悉机器学习基本原理。 3、 熟悉pytorch，能够用其实现主流模型，并进行模型训练与评估。 4、 熟悉主流的深度学习模型架构，包括CNN，Transformer，RNN，Resnet等。 ...,人工智能,http://jobs.zhaopin.com/CCL1492934150J40687306806.htm,20-99人,2025-12-21 00:31:01,15000.0,25000.0,12.0
算法工程师,重庆,重庆鑫源智造科技股份有限公司,硕士,5-10年,智能驾驶,20000-25000,岗位定位：核心算法模块技术负责人（主任工程师） 主要职责： （一）独立负责“感知与定位”或“规划与控制”其中一大核心模块的全流程技术工作，包括方案细化、任务分解、技术攻关与实车交付。 1、负责点云数据处理与分析，开发高效的感知算法，用于障碍物识别及环境建模。 2、参与多传感器数据融合（激光雷达、IMU、编码器等），提升机器人对复杂环境的感知鲁棒性。 3、设计并优化基RTK的路径规划算法，确保机器人...,通用设备制造,http://jobs.zhaopin.com/CCL1511491920J40860868503.htm,500-999人,2025-12-03 16:41:57,20000.0,25000.0,13.0
集团总部-AI开发工程师(J16520),重庆,赛力斯集团股份有限公司,本科,3-5年,大模型算法,15000-25000,岗位职责:1、AI服务开发与优化：基于开源知识库、Agent框架进行二次开发，优化大模型应用性能及功能扩展。构建大模型服务化（MaaS），提供模型推理、微调、Prompt工程等核心能力，支持企业级业务场景接入。设计高可用、低延迟的分布式服务架构，解决模型部署、资源调度、负载均衡等工程问题；2、开源技术二次开发：基于主流开源知识库（如FAISS、Milvus）、Agent框架（如LangChain）...,汽车研发/制造,http://jobs.zhaopin.com/CC465219810J40834375703.htm,10000人以上,2025-12-17 09:05:32,15000.0,25000.0,12.0
CAE数值算法研发工程师,重庆,重庆数字赛道研究院,硕士,3-5年,"C++,有限元,有限体积",15000-25000,岗位职责：1.负责CAE数值算法前沿技术的研发。2.负责调研跟踪国内/国外相关前沿算法，进行分析与复现。3.负责调研跟踪国内/国外商软相关算法的应用情况。4.负责解决研发部门算法相关核心技术难题，并对开发团队进行技术指导和培训。5.负责对相关算法发展方向进行提前规划布局。任职要求：1.力学、航空航天、数学、人工智能、计算机、土木水利、等离子体等相关专业，硕士及以上学历。2.具有3年及以上数值算法相...,政府/公共事业,http://jobs.zhaopin.com/CCL1376365390J40800088813.htm,20-99人,2025-08-29 10:03:52,15000.0,25000.0,12.0
C++开发工程师（人工智能方向）,重庆,重庆软江图灵人工智能科技有限公司,本科,3-5年,"图形图像处理,人脸识别,STL,PyTorch,TensorFlow,C++",18000-25000,岗位职责：1. 负责基于YOLOv系列算法的计算机视觉项目的开发与优化，包括目标检测、图像分类等任务。2. 深入研究和实现神经网络模型，优化模型性能，提升推理速度和准确性。3. 参与人脸识别系统的开发，包括人脸检测、特征提取、识别算法的实现与优化。4. 探索和应用大模型技术，结合C++进行高效的模型部署和推理。5. 与团队合作，完成相关项目的开发任务，包括需求分析、设计、编码、测试和文档撰写。6....,人工智能,http://jobs.zhaopin.com/CCL1264708430J40879826704.htm,20-99人,2025-08-27 17:24:54,18000.0,25000.0,12.0
机器视觉工程师,重庆,重庆远创光电科技有限公司,本科,5-10年,"深度学习,图像识别产品,智能硬件,C++,C#,HALCON",12000-24000,岗位职责：1、对公司客户进行售前技术沟通与支持，包括需求分析、项目评估调研等，参与制定项目方案；2.负责自动化设备的视觉软件开发工作；3.负责视觉硬件选型、调试、测试；4.AI深度学习模型训练与应用任职要求：1.5年以上视觉开发经验，熟悉主流品牌视觉产品，能独立完成选型；2.有独立开发过视觉定位，外观检测类视觉项目；3.有深度学习AI智能算法等视觉项目经验；4.能熟练使用视觉和视觉和机器人进行通讯...,工业自动化,http://jobs.zhaopin.com/CC319028130J40977893504.htm,20-99人,2026-01-04 16:42:33,12000.0,24000.0,12.0
高性能计算研发高级工程师,重庆,重庆数字赛道研究院,硕士,5-10年,"CAE仿真高性能计算,并行计算方法,并行算法设计,MPI,OPENMP,CUDA,PETSC,LSF,Docker,METIS",18000-25000,岗位职责：1.高性能计算模块架构设计、程序开发与优化。2.负责基于MPI/OpenMP/CUDA/OpenCL/OpenAcc等协议工具，设计不同粒度数据的并行算法。3.负责核心求解器效率提升和内存优化。任职要求：1.计算机、人工智能、力学、航空航天、数学、机械、土木水利等与高性能计算相关专业，硕士及以上学历。2.具有5年及以上高性能计算开发经验，熟练使用C++开发语言。3.熟悉主流高性能计算硬件...,政府/公共事业,http://jobs.zhaopin.com/CCL1376365390J40800131313.htm,20-99人,2025-08-11 11:36:01,18000.0,25000.0,12.0
AI加速构架研究工程师（重大联合招聘））,重庆,重庆御芯微信息技术有限公司,硕士,经验不限,,12000-24000,岗位职责：1、研究开发大规模AI、张量计算加速IP核心。2、开发AI、张量计算加速核心的功能模型并进行性能评估。3、开发神经网络模型、张量计算模型的加速核心硬件编译器4、采用FPGA开发、验证AI、张量计算加速IP核心任职要求：1、研究生及以上学历，计算机科学、电子工程、微电子等相关专业。2、精通计算机体系结构，熟悉CPU/GPU/NPU/DSP/FPGA任意一种构架。3、具备深厚的处理器、加速器...,物联网,http://jobs.zhaopin.com/CC864531450J40857372703.htm,100-299人,2025-11-19 12:18:01,12000.0,24000.0,12.0
算法工程师,重庆,外企德科数字技术有限公司,本科,经验不限,"深度学习,图像算法,大模型算法,GPT,XLNet,RoBERTa,CLIP,VGGNet,GoogLeNet,Transformer,LSTM,RCNN,机器视觉,导航算法,智能驾驶,PyTorch,TensorFlow,OpenCV,Python,C++,Java",11000-22000,岗位内容：1. 为公司的产品或项目开发和改进算法模型，提高业务效率和用户体验。2. 协助团队进行大规模数据挖掘和分析，提供关键洞察和解决方案。3. 根据产品或项目需求，设计和实现复杂的算法和数据结构。4. 追踪最新的技术趋势和研究成果，持续推动算法创新和优化。任职要求：1. 具备较强的算法设计和实现能力，以及数据分析和挖掘经验。2. 精通至少一种主流编程语言（如Python、Java等），熟悉相关...,专业技术服务,http://jobs.zhaopin.com/CCL1480117890J40828405405.htm,10000人以上,2026-01-12 00:26:29,11000.0,22000.0,12.0
大模型算法工程师,重庆,沪渝人工智能研究院,硕士,3-5年,"大模型算法,TensorFlow,PyTorch",18000-22000,岗位职责：1.参与大模型的全生命周期开发：包括数据构建、预训练、指令微调（SFT）、人类反馈强化学习（RLHF）、模型评估与部署等环节。2.探索大模型在垂直行业（如金融、医疗、教育等）的应用场景，设计领域适配方案，提升模型的专业性与实用性。3.优化模型推理效率与部署成本，包括模型压缩、量化、蒸馏、推理加速等工程化技术。4.跟踪前沿大模型技术进展（如MoE架构、多模态融合、Agent框架等），推动技...,人工智能,http://jobs.zhaopin.com/CCL1445374270J40835689414.htm,20-99人,2026-01-12 00:06:21,18000.0,22000.0,14.0
图像算法工程师（机器算法工程师),重庆,重庆创信智能科技有限公司,本科,3-5年,图像处理,15000-22000,岗位职责：1. 负责图像处理和识别算法的研究与开发。2. 优化现有算法，提升图像处理速度和准确度。3. 跟进前沿技术动态，进行技术预研和项目规划。4. 与团队成员协作，完成算法的集成和部署。任职1. 计算机视觉、图像处理等相关专业背景，本科及以上学历。2. 熟悉机器学习和深度学习算法，有相关项目经验。3. 熟练掌握Python/C++等编程语言，有良好的编程习惯。4. 至少掌握一种深度学习框架（如...,计算机软件,http://jobs.zhaopin.com/CCL1313563890J40477831111.htm,20-99人,2026-01-05 01:29:00,15000.0,22000.0,12.0
机器视觉算法工程师,重庆,重庆软江图灵人工智能科技有限公司,本科,3-5年,"C++,人脸识别",16000-22000,岗位职责：1. 负责图像算法的研发和优化，包括但不限于图像处理、图像识别、图像分割等领域；2. 设计和实现图像算法模型，并进行模型调优和性能优化；3. 负责图像算法的应用和落地，为业务提供技术支持和解决方案；4. 参与团队技术交流和分享，推动团队技术水平的提升。任职要求：1、本科及以上学历，计算机相关专业背景;2、熟练掌握C++语言和Python语言，具备丰富的开发经验;3、熟悉计算机视觉算法，对...,人工智能,http://jobs.zhaopin.com/CCL1264708430J40560330504.htm,20-99人,2025-08-27 17:42:04,16000.0,22000.0,12.0
网格生成与优化算法工程师,重庆,重庆数字赛道研究院,硕士,经验不限,"C++,STL,CAD,CAE",16000-21000,岗位职责1、开发和完善电磁场仿真软件中的网格剖分； 2、从事几何模型的网格生成与优化算法实现与软件开发； 3、从事新型网格生成算法研究。 任职要求： 1、具有数学、电子工程、计算图形学相关专业，硕士及以上； 2、具有扎实的数学基础，熟悉解析几何，计算几何，微分几何，网格处理 和网格剖分算法； 3、熟练掌握 C/C++语言，熟悉 STL、模板等； 4、有网格剖分软件开发经历、或者熟悉 CAD、CAE...,政府/公共事业,http://jobs.zhaopin.com/CCL1376365390J40835700213.htm,20-99人,2025-10-28 15:20:00,16000.0,21000.0,12.0
基于CPU/GPU软件算法设计,重庆,重庆航天火箭电子技术有限公司,硕士,3-5年,"雷达,CPU,GPU",20000-21000,1.硕士研究生及以上学历，通信、雷达、电子信息、计算机等相关专业。2.具有3年以上GPU软件算法相关工作经验。3.具备通信、雷达等数字信号处理开发经验。4.熟悉CUDA等GPU并行算法设计及实现。,船舶/航空/航天/火车制造,http://jobs.zhaopin.com/CC399395110J40713860703.htm,500-999人,2025-02-07 22:32:15,20000.0,21000.0,12.0
医疗器械注册（人工智能）,重庆,重庆天如生物科技有限公司,本科,3-5年,人工智能,11000-20000,岗位职责：1、负责医疗器械制定及执行产品注册计划，跟进产品研发和注册进程，确保注册申报审批的顺利进行；组织产品注册申报资料的撰写、整理、审核，依据法定程序办理注册申报；2、负责注册证的核发、延续和变更、负责生产许可证的延续、变更；3、负责公司三类医疗器械或软件的创新申报及注册；4、负责国内法规和与产品相关的新的行标、指导原则的收集。5、协调和跟进临床研究/GCP临床试验项目情况；任职要求：1、本科...,医疗设备/器械,http://jobs.zhaopin.com/CC501908020J40961335404.htm,20-99人,2026-01-12 01:09:13,11000.0,20000.0,12.0
电磁算法研究员,重庆,重庆数字赛道研究院,硕士,经验不限,"图像算法,C++,CAE,EDA",15000-21000,岗位职责： 1. 负责电磁场算法的底层架构和核心算法设计； 2. 负责电磁软件产品电磁辐射、散射等模型建立、算法开发； 3.负责电磁算法模块化开发，集成形成智能软件设计平台； 4.负责前瞻性技术跟踪与研究、产品改进升级、技术文档撰写、专利申请等， 并参与相关项目技术可行性分析及项目开发等。 任职要求： 1.计算电磁学、物理学等相关专业硕士及以上学历； 2.物理基础扎实，具有较好的推导能力和分析物理...,政府/公共事业,http://jobs.zhaopin.com/CCL1376365390J40831237513.htm,20-99人,2025-10-11 00:00:01,15000.0,21000.0,12.0
人工智能新风口~少儿编程,重庆,作业帮,本科,经验不限,"助教,线上授课",15000-20000,只有一轮面试!当天出结果!无试岗!!正常工作9000+，努力点1.2-1.5w，上不封顶 过年正常放假!!!带薪年假!!!【岗位要求】1.提醒家长按时带孩子上课;2.做好开课提醒，课中维护好课堂纪律，课后及时与家长微信或电话沟通学习情况;3.课程快到期的时候引导家长续费【工作时间】1.八小时工作制2.节假日带薪休假3.每天下班免费打车直接使用企业支付无需个人支付【福利待遇】1.试用期和转正薪资一样...,互联网,http://jobs.zhaopin.com/CC287198080J40834873314.htm,10000人以上,2026-01-11 01:36:54,15000.0,20000.0,12.0
算法工程师（重庆）,重庆,重庆天如生物科技有限公司,本科,5-10年,图像算法,11000-20000,岗位职责：1．负责图像类算法研发，包括图像分类、目标检测、语义分割、大模型等；2．负责算法测试、分析、验证，输出实验报告；3．负责深度学习算法在特定硬件平台上的部署；4．负责相应方向技术难点攻关、解决技术难题、前瞻研究；5．进行技术分享、专利申请和学术文章发表，提升公司的技术影响力。任职资格：1．本科及以上学历，生物医学工程、计算机、模式识别、信号处理、自动化等相关专业，数学基础好，211/985...,医疗设备/器械,http://jobs.zhaopin.com/CC501908020J40881838504.htm,20-99人,2026-01-12 00:08:20,11000.0,20000.0,12.0
机器视觉工程师,重庆,重庆金锋特科技有限公司,本科,3-5年,图像识别产品,10000-20000,职位描述：1. 参与机器视觉的硬件选型，包括：镜头、相机、光源等，以及软件设计；2. 维护、升级已有机器视觉软件；3. 按照项目开发流程和部门工作制度，撰写相关技术文档并提交审核；职位要求：1.电子、自动化、计算机相关专业，本科及以上学历，具有2年以上工作经验；２.熟悉图像处理方法，熟悉C++语法，熟悉ｏｐｅｎｃｖ＼ｈａｌｃｏｎ等图像库；3. 有机器视觉行业工作经验者优先；工作地点：重庆璧山、成都...,人工智能,http://jobs.zhaopin.com/CCL1500026320J40726926110.htm,20-99人,2026-01-10 13:27:15,10000.0,20000.0,12.0
模型开发工程师,重庆,中电智安科技有限公司,本科,3-5年,"PyTorch,大模型",10000-20000,一、职位描述1. 通用基础模型服务开发：依据业务优先级，负责通用OCR、通用语音识别、通用多模态大模型等核心基础能力的技术调研、开发与落地；设计并输出标准化API接口及服务文档，确保服务的高可用性与易用性。2. 垂类场景小模型研发：深入理解各行业业务需求，针对工业、政务、医疗、司法等特定领域场景，开展定制化小模型的研发工作，包括数据处理、模型训练、优化与部署，确保模型精准适配业务实际应用场景。3....,通信/网络设备,http://jobs.zhaopin.com/CC269568510J40742707316.htm,500-999人,2026-01-10 01:47:15,10000.0,20000.0,12.0
算法工程师,重庆,重庆中电自能科技有限公司,硕士,5-10年,,10000-20000,岗位职责1、硕士研究生及以上学历，计算机、人工智能、统计学或相关专业，具备扎实的数据结构与算法基础。2、工作年限5年（含）以上，具备数字化企业、能源行业或国有企业等相关企业3年以上工作经历。3、精通Python，熟悉PyTorch/TensorFlow等主流深度学习框架。深入掌握分类、回归、时序分析等机器学习算法，具备出色的数据建模与调优能力。熟悉数据预处理、特征工程及模型评估的全流程。4、在光伏...,IT服务,http://jobs.zhaopin.com/CC383364020J40978459504.htm,20-99人,2026-01-09 18:02:16,10000.0,20000.0,16.0
pack—机器视觉资深/工程师,重庆,重庆赣锋锂电科技有限公司,本科,3-5年,图像识别产品,10000-20000,岗位职责： 1、负责PACK产线机器视觉系统的开发与优化； 2、进行图像处理算法的研究与实现，提高系统识别精度； 3、参与产品的需求分析，制定视觉解决方案； 4、编写相关技术文档，确保项目顺利进行。 岗位要求： 1、计算机科学、电子工程或相关专业本科及以上学历； 2、熟悉机器视觉原理及图像处理技术，有实际项目经验者优先，电池行业有限； 3、精通C/C++或其他编程语言，具备良好的编程习惯； 4、能...,新能源,http://jobs.zhaopin.com/CCL1407140800J40977831104.htm,100-299人,2026-01-09 01:10:30,10000.0,20000.0,13.0
算法工程师,重庆,重庆埃库特科技有限责任公司,本科,1-3年,音频算法,10000-20000,岗位职责1. 研究算法原理；2. 使用MATLAB、SIMULINK等工具开发算法模型；3. 配合软件工程师，将算法转换为C语言代码；4. 配合软件工程师，在DSP芯片中实现算法；5. 利用公司自研控制器，验证算法，并对算法做必要更改和优化；6. 优化公司已有算法；7. 算法相关文档整理；8. 公司内部算法发布（与公司必要岗位介绍算法）；9. 专利、软著申请。任职要求1.声学、音频信号处理、电子工...,汽车零部件,http://jobs.zhaopin.com/CC578667580J40773452311.htm,20-99人,2026-01-08 17:15:04,10000.0,20000.0,12.0
人工智能产品经理,重庆,重庆中电自能科技有限公司,硕士,5-10年,,10000-20000,任职要求1、硕士研究生及以上学历，计算机科学、软件工程、数据科学、统计学、心理学、市场营销等相关专业优先。2、工作年限5年（含）以上，具备数字化企业、能源行业或国有企业等相关企业3年以上工作经历，3年及以上产品经理相关经验，有AI产品（如大模型应用、NLP、计算机视觉、语音识别、推荐系统等）相关落地经验者优先；应届生需具备AI相关项目实习经历或校园实践成果。3、熟练使用产品经理基础工具（Axure...,IT服务,http://jobs.zhaopin.com/CC383364020J40978461704.htm,20-99人,2026-01-09 16:46:05,10000.0,20000.0,16.0
大模型知识计算工程师,重庆,中电智安科技有限公司,本科,3-5年,"PyTorch,TensorFlow",10000-20000,一、职位描述1. 知识图谱架构搭建与标准制定：主导知识图谱通用架构设计，涵盖实体定义、关系类型梳理、属性规范制定及图数据库选型等核心环节；输出可复用、标准化的知识建模规范，为跨行业知识体系建设提供底层框架。2. 知识构建工具研发：负责知识图谱构建全流程工具开发，重点突破多源数据的自动化知识抽取（实体、关系、事件等）技术，设计高效的人工校验与迭代流程，形成“自动化+人工优化”的闭环工具链，支撑多行业...,通信/网络设备,http://jobs.zhaopin.com/CC269568510J40780343516.htm,500-999人,2026-01-08 01:44:35,10000.0,20000.0,12.0
视觉算法工程师,重庆,重庆柏楠科技有限公司,本科,1-3年,,10000-20000,主要职责：1. 设计、实现和优化机器人视觉算法，包括目标检测、跟踪、识别、3D SLAM等。研究和开发基于深度学习的视觉算法，提升机器人在复杂环境中的感知能力。2. 熟悉opencv 等视觉开发库，开发数据预处理和后处理算法，提高数据质量和算法精度。3. 对算法进行性能评估和优化，提高算法的准确性和鲁棒性，满足机器人在各种复杂环境下的运行需求二、任职要求：1、学历要求：硕士研究生及以上学历2、专业...,人工智能,http://jobs.zhaopin.com/CC558227530J40843715403.htm,20-99人,2026-01-08 01:06:40,10000.0,20000.0,14.0
