职位,城市,公司,学历,经验,技能,薪资,工作描述,行业,职位URL,公司规模,发布时间,薪资_最小值,薪资_最大值,年薪月数
电控硬件工程师,重庆,重庆雷玛科技有限公司,本科,5-10年,,14000-23000,岗位职责1、负责公司研发产品及项目的硬件设计，参与产品需求评估及硬件方案设计，对产品开发的成本质量负责;2、负责设计相关的技术储备，积极推动技术创新；负责与软件开发人员配合完成产品的功能验证与设计优化；3、能独立完成项目的硬件开发设计工作，并完成相关开发测试验证工作。任职要求1、本科及以上学历，从事5年以上电源开发工作，熟悉DC-AC\\\\AD-DC相关电路拓扑，有3KW以上逆变器或者交直流电源...,专业技术服务,http://jobs.zhaopin.com/CCL1486991830J40897360715.htm,20-99人,2025-10-22 14:36:23,14000.0,23000.0,12.0
硬件/汽车车灯/外企年假15天,重庆,新拓尼克科技研发中心 / Syntronic Beijing R&D Center,本科,3-5年,"汽车车灯,硬件开发",11000-22000,工作内容：以项目开发计划为指导，遵从项目主管工程师的安排，按时完成相关工作内容；包括但不限 于： 0. 接受相关工作技能的培训，深入学习并进行实践。 1. 按照设计图纸和物料表制作并调试工程样件。 2. 按照硬件测试计划，执行电路模块测试/热测试，并编写测试报告。 3. 协助软件开发人员，进行软硬件联合调试工作。 4. 在主机厂试装阶段出现质量缺陷或产品失效后，应 OEM 要求到指定现场进行数据采...,运营商/增值服务,http://jobs.zhaopin.com/CC134310320J40743242306.htm,500-999人,2025-12-23 14:46:02,11000.0,22000.0,12.0
硬件工程师,重庆,重庆御芯微信息技术有限公司,本科,3-5年,"设计,硬件测试,功率电子",12000-22000,"岗位职责：1.根据项目需求，设计产品研发方案，设计符合项目需求和质量标准的硬件产品；2.负责完成产品硬件设计和调测，包括原理图设计和PCB layout，单板和整机的调测; 3.负责完成元器件的选型、认证和成本控制，对不良产品做失效分析；4.参与制定硬件测试方案,完成硬件调试、产品自测，输出测试报告；5.配合软件、结构工程师完成系统联调和问题分析。6.参与新产品硬件相关预研工作和技术积累；7.输出...",物联网,http://jobs.zhaopin.com/CC864531450J40851979903.htm,100-299人,2025-11-19 10:55:08,12000.0,22000.0,12.0
嵌入式工程师,重庆,重庆朗威仪器仪表有限公司,硕士,5-10年,单片机,11000-22000,岗位职责：1.负责现有产品维护和升级。2.独立或配合技术部其他同事完成新产品研发，包括软件和硬件的设计开发。3.把控和探索行业技术前沿，对行业技术方向精准把脉，精准开发，运用整合技术资源的能力设计行业领先的产品。4.负责技术归档，以及对销售同事的一些技术培训工作或部分售后技术支持。5.完成领导安排的其他工作。任职要求：1、电子、通信、自动化、物联网等相关专业，研究生及以上学历（优秀者可放宽学历要求...,仪器仪表制造,http://jobs.zhaopin.com/CC230594380J40819569002.htm,20-99人,2025-11-04 00:05:01,11000.0,22000.0,12.0
高级硬件工程师（医疗行业）,重庆,重庆山外山血液净化技术股份有限公司,本科,5-10年,,15000-22000,岗位职责：1、参与医疗设备系统与模块（电机、电源、传感器、信号处理等）的项目需求分析、风险分析、编制设计方案，原理图和PCB绘制； 2、负责组织模块硬件的试验和测试；3、负责分析产品和硬件有关的质量问题。任职要求：1、本科及以上学历，自动化、通信、生物医学工程等相关专业；2、8年以上电子产品设计开发经验，具有扎实的模拟电路和数字电路的理论功底和应用经验，动手能力强，分析能力强、文档编写能力强；3、...,医疗设备/器械,http://jobs.zhaopin.com/CC343078780J40689715206.htm,1000-9999人,2025-07-02 17:08:35,15000.0,22000.0,13.0
测试工程师,重庆,重庆中电自能科技有限公司,本科,5-10年,"软件测试,性能测试",10000-20000,任职要求1. 本科及以上学历，计算机、软件工程相关专业，5年以上软件测试经验。2. 熟练掌握软件测试理论、方法和流程，具备较强的测试用例设计与缺陷分析能力。3. 熟悉至少一种自动化测试框架（如Selenium、Pytest）和性能测试工具（如JMeter），有实际应用经验者优先。4. 了解数据库基本操作（SQL），熟悉Linux命令，具备基础的日志分析与问题定位能力。5. 工作细致负责，逻辑清晰，...,IT服务,http://jobs.zhaopin.com/CC383364020J40978466804.htm,20-99人,2026-01-09 17:10:08,10000.0,20000.0,16.0
硬件工程师,重庆,重庆奇派电子有限公司,本科,3-5年,"PCB设计,电路设计",16000-20000,岗位职责1. 电子产品方案设计、硬件电路设计、原理图绘制、元件选型、样机调测、配合客户设备（系统）联调等；2. 负责与客户开展技术需求对接沟通；3. 负责组织技术文件的编写、归档。4. 负责公司交付产品的售后技术支持；职位要求1. 本科及以上学历，电子信息、计算机、自动化、通信类等相关专业毕业；2. 有扎实的电路分析、模电数电基础；3. 熟悉AD等电路图软件；4. 具备较强的自学能力、创新能力、沟...,电子/半导体/集成电路,http://jobs.zhaopin.com/CC323963210J40436634011.htm,10000人以上,2026-01-08 09:03:00,16000.0,20000.0,12.0
高级硬件工程师,重庆,梅安森,大专,5-10年,,15000-20000,工作内容： 1、负责公司矿用监测监控、数据传输、调度通信、广播等产品维护和新产品硬件设计； 2、负责配合售后解决老产品技术问题； 3、负责配合售前进行现场调研和简单技术方案的编写。 岗位要求： 1、具有3年以上工业电子产品研发工作经验，至少主导或作为骨干人员参与过1个产品研发，了解基本传感器检测原理（流量监测、压力监测、温度监测、气体浓度值监测等）； 2、熟悉硬件产品研发流程，具有良好的研发习惯、...,物联网,http://jobs.zhaopin.com/CC151965510J40460585113.htm,500-999人,2026-01-04 10:00:17,15000.0,20000.0,12.0
硬件设计工程师,重庆,重庆天如生物科技有限公司,本科,5-10年,,10000-20000,岗位职责：1、负责根据项目任务需求及部门分配的设计开发任务，按照硬件设计开发流程开展硬件设计 需求分析、硬件概要设计、硬件详细设计、硬件调试、功能验证，组织设计评审。2、负责产品验证、发布及生命周期内硬件相关的缺陷整改及优化设计。3、负责硬件设计加工样品的验证评估、确认。4、负责产品硬件部分的样机组装及调试。 5、负责硬件设计文档的开发，并配合项目组开发检验、注册相关的技术文档。6、负责硬件开发过...,医疗设备/器械,http://jobs.zhaopin.com/CC501908020J40869985404.htm,20-99人,2025-12-28 00:48:02,10000.0,20000.0,12.0
硬件工程师（外资车企-车身域-灯控）,重庆,新拓尼克科技研发中心 / Syntronic Beijing R&D Center,本科,3-5年,"硬件,硬件测试,技术支持,车身域,大灯,灯控",12000-20000,工作内容 以项目开发计划为指导，遵从项目主管工程师的安排，按时完成相关工作内容；包括但不限于： 0. 接受相关工作技能的培训，深入学习并进行实践。1. 按照设计图纸和物料表制作并调试工程样件。2. 按照硬件测试计划，执行电路模块测试/热测试，并编写测试报告。 3. 协助软件开发人员，进行软硬件联合调试工作。4. 在主机厂试装阶段出现质量缺陷或产品失效后，应 OEM 要求到指定现场进行数据采集，故 ...,运营商/增值服务,http://jobs.zhaopin.com/CC134310320J40743427006.htm,500-999人,2025-12-24 10:33:43,12000.0,20000.0,12.0
软硬件实习工程师（重大、重邮、电子科大应届生）,重庆,重庆力华自动化技术有限责任公司,本科,无经验,,10000-20000,任职要求：1、电子信息、计算机、电气工程等电子/软件相关专业，本硕博均可；1、在学校有和导师参与项目经验的优先考虑；2、在学校参与电子类竞赛并且有获奖经验者。3、专业成绩排名靠前者优先考虑。4、能展示自己动手制作和调试过的项目是最大的亮点。5、大三以上或研究生在读，至少可以出来实习3个月。,汽车零部件,http://jobs.zhaopin.com/CC270553110J40784617809.htm,1000-9999人,2025-12-24 09:13:53,10000.0,20000.0,12.0
数字电路设计,重庆,重庆航天火箭电子技术有限公司,硕士,经验不限,"电路设计,EDA,FPGA,数字电路,EMC设计,DSP,ARM",10000-20000,1.硕士及以上学历，电子信息工程、电子科学与技术、通信工程、电子测量技术与仪器、电子信息类其他等相关专业。2.具备扎实的电子技术理论基础知识和良好的电路设计能力、调试能力、问题解决能力；熟练掌握数字电路、模拟电路、电力电子、生产工艺、信号完整性、电源完整性、电磁兼容性等相关知识。3.熟悉单片机、MCU、FPGA/CPLD、DSP，MOS管、DC-DC等常用器件的性能原理及测试内容和要求。4.至少掌...,船舶/航空/航天/火车制造,http://jobs.zhaopin.com/CC399395110J40268429203.htm,500-999人,2025-12-23 14:40:06,10000.0,20000.0,12.0
硬件开发/车灯控制/六险一金15天年假,重庆,新拓尼克科技研发中心 / Syntronic Beijing R&D Center,本科,3-5年,车灯,14000-20000,工作内容 以项目开发计划为指导，遵从项目主管工程师的安排，按时完成相关工作内容；包括但不限 于： 0. 接受相关工作技能的培训，深入学习并进行实践。 1. 按照设计图纸和物料表制作并调试工程样件。 2. 按照硬件测试计划，执行电路模块测试/热测试，并编写测试报告。 3. 协助软件开发人员，进行软硬件联合调试工作。 4. 在主机厂试装阶段出现质量缺陷或产品失效后，应 OEM 要求到指定现场进行数据采...,运营商/增值服务,http://jobs.zhaopin.com/CC134310320J40743216906.htm,500-999人,2025-12-23 13:38:40,14000.0,20000.0,12.0
电子工程师,重庆,联芯致康生物科技,本科,5-10年,医疗电子产品,15000-20000,岗位职责：1、负责三类医药器械内电子设备的研发与设计，确保产品符合行业标准；2、参与电子系统的集成与调试，优化系统性能，解决技术问题；3、协调跨部门团队合作，推动项目进展，确保按时完成研发目标；4、跟踪电子行业前沿技术，结合生物科技应用，提出创新方案；5、撰写相关技术文档，维护技术资料库的完整性和准确性。任职要求：1、电子工程、生物医学工程或相关专业背景；2、具备扎实的电子电路设计知识，熟悉相关开...,医疗设备/器械,http://jobs.zhaopin.com/CCL1364201670J40820701709.htm,20-99人,2025-12-18 17:53:14,15000.0,20000.0,12.0
电子助理工程师,重庆,赛力斯集团股份有限公司,本科,3-5年,,10000-20000,岗位职责：1、 负责电子系统零部件开发工作，并对进度、成本、质量进行把控 2 、协助参与电子系统各零部件质量问题分析、整改 3 、负责电子系统技术资料的完善与维护 4 、负责电子系统方面新技术、新材料、新工艺探索，并在工作中落地实施 5 、负责电子系统方面标准法规解析，并落实优化整改 6 、负责供应商开发能力评估，技术交流 7、 总结提炼工作经验，提出工作流程优化建议，输出专利申请等 8 、负责完...,汽车研发/制造,http://jobs.zhaopin.com/CC465219810J40863242003.htm,10000人以上,2025-12-18 01:07:05,10000.0,20000.0,13.0
HIL测试工程师（大型国有车企、全额五险一金）,重庆,南方新华,本科,5-10年,"软件测试,Java,C,C++,HIL,EPB,ECU",15000-20000,岗位职责：1、负责IBCU/EPB项目HIL测试;2、负责IBCU/EPB项目测试用例搭建，测试用例库维护3、负责IBCU/EPB项目HIL项目台架集成、测试工程搭建、自动化测试脚本搭建、测试报告出具；任职要求：1.统招本科及以上学历，5年及以上底盘领域HIL测试工作经验、有NI系统及ECU_Test软件使用经验优先2、掌握CANape、CANoe、周立功等测试设备的使用能力3、掌握Python、...,人力资源服务,http://jobs.zhaopin.com/CC346219280J40814811611.htm,300-499人,2025-12-16 13:33:03,15000.0,20000.0,15.0
系统测试/汽车/VCU/外企年假15天,重庆,新拓尼克科技研发中心 / Syntronic Beijing R&D Center,本科,1-3年,"C,Python,CAPL,ISO14229,ISO15765",10000-20000,初级系统测试工程师• 电子、通信、计算机、自动化等相关专业。 • ≥ 2 年嵌入式产品测试经验。 • ≥ 2 年 CAN 总线测试经验。 • ≥ 2 年客户诊断（ISO14229、ISO15765 原理）测试经验。 • ≥ 2 年 Flash Bootloader 相关经验。 • 具备使用 CANoe 软件以及 CAN、LIN、FlexRay 等汽车通信协议的实际经验。 • 熟悉 HEP（硬件工程...,运营商/增值服务,http://jobs.zhaopin.com/CC134310320J40738498006.htm,500-999人,2025-12-08 11:34:15,10000.0,20000.0,12.0
硬件开发工程师,重庆,重庆巅慧科技有限公司,本科,3-5年,"设计,PCB设计",12000-20000,岗位职责：1、负责电路系统的设计、开发和出图；2、负责电子元器件的选型，评估和使用；3、负责电路板、控制器的焊装、测试和功能实现；4、配合客户进行产品电路控制的联合设计和调试；5、负责设计图纸的归档、编写设计规范；6、负责硬件部门员工的培训与指导； 任职要求：1、电子科学与技术、机械电子、电力电子、电气工程、测控技术及仪器等专业；2、3年及以上硬件相关工作经验；3、熟悉使用软件进行电子原理仿真，能...,光电子行业,http://jobs.zhaopin.com/CC705645320J40491353513.htm,100-299人,2025-12-03 20:13:02,12000.0,20000.0,13.0
硬件开发工程师,重庆,芯带科技(无锡)有限公司,本科,3-5年,"硬件测试,PCB设计,ARM研发,DSP研发",10000-20000,职责描述：1、负责公司硬件产品的方案设计、原理图/PCB设计、BOM制作、调试测试、BUG解决、工厂对接等；2、负责解决单板测试、整机测试过程中出现的问题；3、负责解决生产加工过程中出现的问题；4、负责新物料验证承认，新设计方案评估和验证；5、完成上级安排的其他工作。 任职要求： 1、本科学历，通信、电子、自动化等相关专业毕业，3年以上相关经验； 2、熟练掌握RISC-V、ARM、DSP等处理器的...,电子/半导体/集成电路,http://jobs.zhaopin.com/CCL1366216120J40887716508.htm,20-99人,2025-11-28 00:35:41,10000.0,20000.0,13.0
硬件工程师（大型国企、全额五险一金）,重庆,南方新华,本科,3-5年,"PCB设计,EMC设计,Layout设计,汽车控制器",15000-20000,做汽车控制器相关的硬件设计均可！ 岗位职责：1) 负责EPS控制器硬件设计，包含电路原理设计、元器件选型、PCB Layout；2) 负责散热方案设计及验证；3) 编写硬件设计规范、FMEA、硬件电路测试用例、试验规范等技术资料；4) 负责EPS控制器硬件试制、验证及开发过程中出现问题进行改进；5）负责电路测试、散热测试、试验整改及试验跟踪。 任职要求： 1）具有3年以上电子产品设计经验； 2）熟...,人力资源服务,http://jobs.zhaopin.com/CC346219280J40810071111.htm,100-299人,2025-11-27 11:02:38,15000.0,20000.0,15.0
硬件电路设计,重庆,重庆航天机电设计院,硕士,经验不限,"设计,研发,电路设计,硬件电路",10000-20000,【此岗位长期招聘】学历要求：1、硕士及以上学历，特别优秀者可适当放宽条件； 2、可接受应届毕业生 3、可接受有3年以内工作经验 需求专业： 通信工程、电子信息工程、电子科学与技术、自动化等电子信息大类相关专业。 岗位职责： 1、根据客户需求开展产品硬件架构设计和详细方案设计，负责产品的硬件电路设计及开发工作， 2、负责硬件设计所需元器件资料收集及选型、制作元器件封装、绘制电路原理图、绘制PCB板图...,船舶/航空/航天/火车制造,http://jobs.zhaopin.com/CC148431760J40187709115.htm,100-299人,2025-11-14 15:50:43,10000.0,20000.0,12.0
硬件工程师,重庆,重庆天如生物科技有限公司,本科,5-10年,,10000-20000,岗位职责：1、负责根据项目任务需求及部门分配的设计开发任务，按照硬件设计开发流程开展硬件设计 需求分析、硬件概要设计、硬件详细设计、硬件调试、功能验证，组织设计评审。2、负责产品验证、发布及生命周期内硬件相关的缺陷整改及优化设计。3、负责硬件设计加工样品的验证评估、确认。4、负责产品硬件部分的样机组装及调试。 5、负责硬件设计文档的开发，并配合项目组开发检验、注册相关的技术文档。6、负责硬件开发过...,医疗设备/器械,http://jobs.zhaopin.com/CC501908020J40869976904.htm,20-99人,2025-11-12 16:22:16,10000.0,20000.0,12.0
仪控电子产品软硬件工程师,重庆,机械工业仪器仪表综合技术经济研究所,本科,3-5年,"评测认证,设计审查",10000-20000,职务描述：作为专职检查员，在了解仪控电子产品设计和技术实现基础上，负责功能安全相关产品、系统软硬件设计的评测认证，包括硬件设计/软件设计分析、测试见证和工厂检查等；配合完成国家级科研项目的申请、研究，相关测试验证平台研制和标准编制等工作。经验及能力：1、具有嵌入式测控设备、仪器仪表等相关产品系统硬件或软件开发经验3年以上，熟悉电路原理、芯片或嵌入式软件开发（硬件或软件方向均可），可考虑无工作经验的...,学术/科研,http://jobs.zhaopin.com/CC120523140J40707680411.htm,100-299人,2025-11-10 13:12:20,10000.0,20000.0,12.0
硬件工程师,重庆,航中天启(重庆)微电子股份有限公司,本科,5-10年,,15000-20000,岗位职责1、独立主导HPLC载波通讯模组的原理图设计、PCB设计、生产资料输出等硬件工作；2、独立主导HPLC载波通讯模组的相关硬件测试调试，问题分析、性能优化等工作；3、按项目计划保质保量完成硬件开发工作，编写相关技术文档；任职要求1、4年以上电子产品硬件设计经验，精通电子电路分析和设计能力，熟悉元器件选型，有较强的调试和问题解决能力。2、Layout能力强 ，经验丰富，精通4层板设计，电路设计...,通信/网络设备,http://jobs.zhaopin.com/CCL1389486650J40807332414.htm,100-299人,2025-11-07 00:06:22,15000.0,20000.0,12.0
嵌入式硬件工程师,重庆,七腾机器人有限公司,本科,3-5年,,12000-20000,岗位职责：1.负责公司项目硬件的原理图与PCB设计。2.编写、维护BOM表、物料清单、电气原理图等。3.协助软件工程师处理调试过程发现的硬件问题。4.电子、电气相关器件选型与评估。5.处理公司产品量产过程中的硬件相关问题。任职资格：1.学历要求：电子、通信、电气、机电、计算机等相关专业本科及以上学历。2.工作经验：具备3年以上硬件设计经验，有电源、电驱、SoC主板等设计经验优先，具有本安电路设计经...,专用设备制造,http://jobs.zhaopin.com/CC387441310J40803560301.htm,500-999人,2025-11-04 09:49:19,12000.0,20000.0,12.0
电源硬件高级工程师,重庆,重庆大全泰来电气有限公司,硕士,3-5年,电源控保,16000-20000,核心职责：1、电源控保架构设计负责电源控保架构设计：DSP /FPGA 外围电路设计，包含电源、通讯接口、采样电路、高速SFP 等。负责电路板、芯片和系统等硬件组件的设计与开发，确保其功能和性能满足项目需求。绘制硬件原理图和 PCB 布局设计，确保电路的正确性和可靠性。2、主导功率电路设计MOSFET/IGBT 选型及驱动电路设计（隔离驱动、栅极电阻优化）。保护测控电路（电流/电压采样、比较器、快...,电力/水利/热力/燃气,http://jobs.zhaopin.com/CC611936520J40742854216.htm,100-299人,2025-10-23 00:00:00,16000.0,20000.0,12.0
硬件工程师,重庆,重庆浠濂智能技术有限公司,本科,3-5年,硬件测试,10000-20000,岗位内容：1. 负责嵌入式系统和智能硬件的硬件设计、调试和验证；2. 解决硬件故障并提出改进措施，确保产品的稳定性和可靠性；3. 参与产品需求分析、架构设计、评审和优化；4. 跟踪市场变化和前沿技术，提供合理化建议。任职要求：1. 本科及以上学历，电子工程、自动化或计算机等相关专业背景；2. 3年及以上硬件开发经验，至少参与过一个完整产品的设计和开发；3. 熟悉常见的微处理器/嵌入式芯片的设计和应...,仪器仪表制造,http://jobs.zhaopin.com/CCL1478326390J40625443106.htm,20-99人,2025-10-12 00:33:01,10000.0,20000.0,12.0
产品测试工程师,重庆,中信科智联科技有限公司,本科,3-5年,"自动化测试,功能测试,性能测试,接口测试,系统测试,接口自动化测试",10000-20000,岗位职责： 1、负责C-V2X车联网路侧设备RSU/车载终端OBU/PC5通信模组/V2X应用软件等产品功能、性能、可靠性、稳定性以及外场测试。 2、负责产品测试全流程中BUG的跟踪/推动/验证/关闭/改进建议，周期性输出产品质量报告。 3、输出各类测试文档，如测试策略、测试方案、测试用例规范、测试报告、BUG定位分析复盘等。 4、依据测试结果，评估产品质量，为不断改善测试方案和优化产品设计开发提...,物联网,http://jobs.zhaopin.com/CCL1382511140J40303720415.htm,300-499人,2025-09-23 14:47:25,10000.0,20000.0,15.0
嵌入式硬件工程师,重庆,西安羚控电子科技有限公司,本科,3-5年,"ARM处理器,MCU,MPU,硬件开发",10000-20000,岗位职责：1) 主导无人机硬件系统论证、设计、开发、调试工作，负责为硬件产品的提供优秀的硬件技术方案。2) 负责嵌入式硬件系统的需求分析、方案设计、原理图设计、PCB Layout及硬件调试；3) 参与设计产品自动化测试方案，支持产品量产过程中的硬件问题分析与改进；4) 编写技术文档（设计规范、测试报告等），确保开发过程标准化；5) 负责项目制定产品硬件方案，设计开发符合功能、性能要求和质量目标的...,船舶/航空/航天/火车制造,http://jobs.zhaopin.com/CC660309720J40731024705.htm,300-499人,2025-09-22 10:37:02,10000.0,20000.0,12.0
硬件设计工程师,重庆,重庆国飞通用航空设备制造有限公司,大专,经验不限,"设计,PCB设计,EMC设计,ARM研发",10000-20000,岗位职责：- 主导无人机（多旋翼/固定翼）、移动机器人（轮式/履带式）核心控制板设计，包括飞控/主控单元（STM32H7/LPC55S69等高性能MCU）、电源管理模块、传感器接口的原理图与PCB布局，重点保障高速信号完整性与抗振动可靠性。- 负责动力系统硬件设计：无刷电机驱动电路（、电调接口匹配、舵机/步进电机控制模块。- 设计抗干扰通信链路：集成数传电台、图传模块，优化射频电路匹配。- 开发智...,船舶/航空/航天/火车制造,http://jobs.zhaopin.com/CC622579930J40835019203.htm,20-99人,2025-09-07 09:38:36,10000.0,20000.0,12.0
硬件工程师(J10207),重庆,大博医疗,本科,5-10年,"PCB设计,3c电子产品",15000-20000,工作职责：1、根据产品需求进行方案设计，负责元器件的选型与评估，设计详细的原理图和PCB；2、负责相关产品的技术文档编写和维护；3、制定硬件测试方案，负责硬件调试，并与软件工程师进行系统总体联调；4、负责产品样品、试产、量产问题分析与解决；任职资格：1、具有5年以上的硬件设计经验；本科及以上学历，电子、通信，电气工程、自动化或相关专业；2、熟练使用电路设计软件等进行原理图及PCB设计；3、扎实的的...,医疗设备/器械,http://jobs.zhaopin.com/CC203711210J40847236715.htm,1000-9999人,2025-08-04 09:07:11,15000.0,20000.0,14.0
嵌入式硬件工程师,重庆,重庆泰乐威科技有限公司,本科,3-5年,"MENTOR VX,Cadence,AD",10000-20000,岗位职责：1. 按照系统总体设计规格，进行器件选型论证和硬件实施；2. 编写系统开发规格说明书等相应的文档；3. 对系统硬件设备进行集成测试和性能优化；任职要求:1. 掌握嵌入式系统硬件知识，相关专业本科及以上学历，三年以上设计经验；2. 熟悉嵌入式系统分析方法和测试方法；3. 熟悉硬件开发工具Mentor VX、Cadence、AD；4. 有BLE，WiFi，Lora，4G/5G，NFC，UWB...,汽车研发/制造,http://jobs.zhaopin.com/CCL1367631570J40841776815.htm,100-299人,2025-05-07 10:04:29,10000.0,20000.0,12.0
