职位,城市,公司,学历,经验,技能,薪资,工作描述,行业,职位URL,公司规模,发布时间
平面设计师,武汉,湖北福特隆商贸有限公司,大专,1-3年,"PS,AI,CAD,VI设计,广告设计,包装设计",5000-8000元,岗位职责： 一、 门店日常基础物料及品宣物料设计，包括不限于门店开业围档、店内灯箱广告、门头、门帘、海报、吊旗、单页、价签及配合门店所在商业体宣传物料设计等； 二、 品牌VI系统搭建、海报、包装设计、数据媒体素材制作（社交媒体、网页等）； 三、 负责各品牌相关的线下宣传物料、促销品、门头、广告等的视觉设计。 四、 与团队成员紧密合作，参与创意讨论，提供设计方案，提升整体项目质量； 五、 对优秀品牌...,餐饮服务,http://jobs.zhaopin.com/CCL1490982170J40708936106.htm,20-99人,2025-12-30 11:29:17
平面设计,武汉,武汉布展家文化传媒有限公司,大专,3-5年,"宣传物料设计,导视系统设计,字体设计,包装设计,商标设计,VI设计,插图设计,品牌设计",6000-8000元,我们希望你1、有独立完成整个设计的工作能力，有海报，H5，包装。活动Ⅵ等设计实际工作经验，有与知名品牌合作经验者优先。2、能熟练运用Ps、A、 CORELDRAW等相关专业软件，了解使用办公软件。3、熟悉广告制作工艺及材质，能够与供应商高效沟通，把控出品质量。4、具备团队合作精神，有很强的上进心态，能承受工作带来的较大压力。5、对色彩把握敏锐，具有掌握不同风格的能力。6、应聘时请提供案例作品。大薪...,广播/影视,http://jobs.zhaopin.com/CC533036580J40230967312.htm,20-99人,2025-12-30 00:56:43
ui设计师助理,武汉,武汉玄慈网络科技有限公司,大专,经验不限,"3D设计,动画动效设计,动画设计",5000-8000元,一、岗位内容：根据设计师提供的设计概念和方向，协助完成各类平面设计和产品设计；使用设计软件进行创意设计、制图、排版等工作；协助处理设计文件并跟踪更新版本，与其它部门协作，提供所需的设计支持；记录和整理设计文档，维护设计资源库。二、任职要求：熟练掌握Photoshop、Illustrator等主流设计软件，以及Skecth、Figma等辅助设计工具；创新思维，能够理解和发挥设计师的设计意图，方便有效...,游戏,http://jobs.zhaopin.com/CCL1473916040J40846391512.htm,20-99人,2025-12-29 11:38:30
文创平面设计（社保包食宿）,武汉,洲明蓝普科技(湖北)有限公司,大专,1-3年,"广告设计,文创产品",6000-8000元,1.设计开发公司相关年画类文创产品；2.设计公司宣传画册，ppt，活动物料等；3.设计公司产品包装盒，帆布袋等；4.完成上级交代的其他设计任务；5.年龄在25周岁至40周岁，一年以上平面设计经验；6.具备良好的美术基础和创新思维能力，思维活跃；7.有一定的抗压能力。,电子/半导体/集成电路,http://jobs.zhaopin.com/CC850129990J40812841401.htm,100-299人,2025-12-28 11:19:09
平面设计师,武汉,湖北天下汇通医药有限公司,大专,1年以下,"包装设计,PS,VI设计,AI,CDR,平面设计,视频剪辑",5000-8000元,公司较为重视企划部的发展，所以非常希望可以找到长期合作的伙伴。公司目前团队100＋，主要是做连锁药店及直营药店的，做的是自己品牌的中西药，有自己的工厂，电商团队以及各省的稳定合作商。目前做的软件也已经到测试阶段准备上架，处于一个稳步上升的阶段。 岗位职责“（一）品牌视觉呈现 1. 负责品牌相关平面物料设计，涵盖邀请函、海报、宣传册、活动物料、品牌VI 延展等，精准传递品牌价值与理念，适配线上线下传...,医药批发/零售,http://jobs.zhaopin.com/CC880863240J40897124315.htm,100-299人,2025-12-25 11:08:47
电商设计,武汉,睿瀛科技(武汉)有限责任公司,学历不限,1-3年,"电商设计,PS,AI",6000-8000元,1.负责小程序电商平台维护（界面设计、图标设计和视觉元素创作2.创建各类营销素材，包括但不限于 banner、活动页面、商品详情页和推广图片3.设计与品牌调性一致的视觉内容，保持跨平台设计语言的一致性4.配合产品经理和开发团队，确保设计方案的可行性和高质量实现5.基于用户反馈和数据分析，持续优化视觉设计和用户体验6.跟踪设计趋势，研究竞争对手设计策略，提出创新设计方案任职要求1.美术、设计相关专业...,电子商务,http://jobs.zhaopin.com/CC396139830J40787161511.htm,20-99人,2025-12-23 15:51:02
医美设计平面设计,武汉,武汉市丽妍星医疗美容诊所有限公司,大专,1-3年,"VI设计,广告设计,电商设计,PS,AI",6000-8000元,岗位内容：1. 根据机构品牌定位和市场需求，进行平面设计、VI设计、海报设计、产品包装设计等相关工作；2. 设计并制作企业形象宣传资料，包括公司画册、产品样本、宣传册、广告海报、DM单页、PPT、视频等；3. 参与APP界面设计、微信公众号运营和活动策划，提高公司品牌知名度。任职要求：1. 大专及以上学历，平面设计或相关专业毕业;2. 熟练使用Ai、Ps、Id等设计软件，可以独立完成各类设计任务；...,医美/健康服务,http://jobs.zhaopin.com/CCL1472114620J40880099502.htm,20-99人,2025-12-13 10:08:26
平面设计,武汉,武汉空境企业管理有限责任公司,大专,1-3年,"PS,VI设计,包装设计",6000-8000元·13薪,【岗位职责】#负责公司门店宣传物料、产品图等平面设计#配合团队完成项目视觉呈现，包括品牌VI延展、海报、社交媒体图片、宣传册、包装设计等#根据活动主题设计平面视觉内容【职位要求】#大专及以上学历，1-2年相关工作经验#年龄28-35岁#熟练PS、AI、cdr等设计软件，会C4D/AE/剪辑优先#思维活跃，创意十足，具备良好美术功底和审美能力#责任心强，善于沟通，有团队合作精神,休闲/娱乐,http://jobs.zhaopin.com/CCL1485535010J40905815015.htm,100-299人,2025-12-12 17:08:57
平面设计师,武汉,湖北东沃文化发展有限公司,本科,1-3年,平面设计,6000-8000元,平面设计师岗位职责：1.负责公司品牌及业务相关的全品类视觉设计工作，包括但不限于平面广告、品牌 LOGO、宣传手册、书籍刊物、产品包装、活动物料、线上配图等；2.独立完成从需求沟通、创意构思、设计初稿到最终定稿的全流程工作；3.积极与团队成员合作，完成项目要求并满足客户需求。任职要求：1.本科及以上学历，设计专业优先，视觉设计、平面设计、艺术设计等相关专业优先，具备 1-3 年以上相关平面设计工作...,文化艺术/娱乐,http://jobs.zhaopin.com/CCL1507344630J40771756616.htm,20人以下,2025-12-09 13:00:51
设计专员,武汉,武汉科德中医医院有限公司,大专,1-3年,,7000-8000元,岗位职责：负责医院活动物料（海报、宣传单页、展架等）、日常宣传素材（公众号头图、小红书配图等）的版面设计与视觉规划，确保设计风格贴合品牌调性。学历要求：大专及以上学历，视觉设计、平面设计等相关专业优先；经验要求：1-2 年以上平面设计工作经验，有健康医疗、生活服务类行业设计经验者加分，需提供个人设计作品集；技能要求：精通 PS、AI、CDR 等设计软件，具备独立完成物料设计、视觉优化的能力，熟悉印...,医院,http://jobs.zhaopin.com/CCL1458941570J40844529113.htm,100-299人,2025-12-03 16:22:28
平面设计师,武汉,武汉世纪锦龙广告装饰有限公司,高中,经验不限,"CDR,AI,广告设计,标志设计,画册设计,展板设计,设计师,PhotoShop",4000-8000元,1、熟练掌握CoreIDRAW X4、Ai、Photoshop等设计软件；2、能独立设计完成每个项目的设计任务；3、主要工作是设计海报广告画面、印刷排版、处理图片和效果图。 3、有一定的服务意识，对待客户的咨询要耐心细致，并给与专业的回复； 4、热爱设计、抗压能力强，能吃苦耐劳； 5、具有较强的理解、领悟能力、工作协调能力以及应变能力。,广告/营销,http://jobs.zhaopin.com/CZ638984420J00082107003.htm,20人以下,2025-11-26 16:09:20
IP衍生品视觉设计或艺人周边视觉设计师,武汉,武汉必火音乐文化有限公司,本科,1-3年,"方案设计,广告设计,包装设计,PS,AI,AE",6000-8000元,岗位职责：1.负责艺人线下周边产品及IP衍生品的设计开发，包括纸制品、亚克力、毛绒玩具等产品、包装、商品宣发物料设计等2.全程跟进产品开发流程，包括打样、生产等环节，确保按时交付。3.通过市场调研和粉丝调研，为不同的艺人和主题定制有竞争力的产品设计方案。4.与团队协作搭建线上周边商城。岗位要求：1.本科及以上学历，视觉传达、产品设计、美术相关专业。熟悉各类材质工艺特性。2.精通Photoshop、...,新媒体,http://jobs.zhaopin.com/CCL1499352640J40901629808.htm,20-99人,2025-11-20 15:17:33
平面设计师,武汉,武汉众用汽车维修服务有限公司,大专,1-3年,"PS,AI,排版设计,方案设计,VI设计",5000-8000元,工作内容：我们的公司正在寻找一位平面设计师，负责公司品牌形象设计、平面广告设计和网络设计等。该职位需要有创意和良好的设计技能，能够独立工作或团队合作。主要职责：- 负责公司品牌形象设计，包括设计标志、海报、名片等；- 负责平面广告设计和网络设计，包括设计广告牌、宣传页、网站等；- 与团队或客户沟通，了解其需求并将其转化为具体的设计方案；- 负责对设计方案进行跟进，确保设计符合客户要求；- 保持对行...,汽车后市场,http://jobs.zhaopin.com/CCL1505201860J40800693301.htm,20-99人,2025-10-27 13:55:46
平面设计师（广告行业有工作经验）,武汉,武汉牌洲湾广告科技有限公司,大专,1-3年,排版设计,6000-8000元,工作内容：1、负责文化建设或展厅的平面类设计；2、负责公司的形象设计，产品宣传的设计，公司对外宣传活动的设计；3、了解客户对各类宣传资料、广告的设计制作要求，配合协助市场推广专员、广告商和媒体按时完成设计制作；4、根据广告内容，进行构思、策划和平面与立体形象设计； 5、专业广告知识，熟悉广告物料名称、物料价格、生产工艺，懂广告下单制作者优先：工作要求：1、专科及以上学历；2、熟练运用Photosh...,广告/营销,http://jobs.zhaopin.com/CC295960030J40890959308.htm,100-299人,2025-10-14 14:56:00
设计师,武汉,青眼网络科技(武汉)有限公司,大专,1-3年,"海报设计,手绘,字体设计,包装设计,画册设计,界面设计",6000-8000元,岗位职责：负责公司与设计相关的工作。 任职要求：动漫设计、艺术设计专业毕业，工作经验三年左右，手绘扎实。,广播/影视,http://jobs.zhaopin.com/CC311590183J90250013000.htm,20-99人,2025-10-14 11:41:50
平面设计,武汉,湖北华天国际旅行社有限公司,本科,1-3年,"广告设计,AE,PS,AI",5000-8000元,岗位职责视觉设计与制作负责线上线下全渠道旅游产品视觉设计，包括但不限于海报、宣传册、DM 单、H5 页面、电商详情页等，确保设计符合品牌调性及市场需求。优化官网、社交媒体平台（微信、抖音、小红书）的视觉呈现，定期更新内容以保持品牌活跃度。产品视觉优化对旅游目的地图片、视频素材进行精修、调色及特效处理，突出产品卖点（如自然风光、文化特色、高端服务等）。设计旅游线路包装方案，结合季节、节日等元素打造差...,旅游服务,http://jobs.zhaopin.com/CC465936210J40728714516.htm,20-99人,2025-09-02 09:19:10
UI设计师 WEB网页设计 网站美工,武汉,武汉加布里埃尔科技有限公司,本科,1-3年,"AI软件,PS,UE设计,交互设计,移动端设计,平面设计",6000-8000元,岗位职责 1. 需求分析：与产品经理、开发人员等团队成员沟通，了解产品需求和目标用户，明确设计目标和范围。 2. 设计规划：参与制定产品的界面设计规范、风格和原则，确保设计的一致性和统一性。 3. 原型设计：创建交互设计原型（如线框图、流程图等），根据原型图进行web端和移动端的UI界面设计，展示用户界面的基本结构和功能布局。 4. 视觉设计：根据原型设计，进行界面的视觉优化，（包括主次界面风格化...,计算机软件,http://jobs.zhaopin.com/CZ664702830J00241388304.htm,20-99人,2025-08-16 00:00:03
平面设计师,武汉,武汉坎伯韦尔科技有限公司,学历不限,1-3年,"电商设计,PS,CAD,AI",6000-8000元,"专注电商15年,跨境电商天花板,私域生态领航者!自家店铺稳居 湖北TOP1,全国TOP10！加入我们，让你成为更好的自己！ 工作职责: 1.负责公司的平面设计工作，根据市场需求，完成创意设计及视觉表达，配合公司完成宣传材料设计制作 2.负责产品详情和主图设计 3.负责商品上架 4.完成上级安排的其他工作 5.负责部分商品实拍收集与拍摄 岗位要求 1.具有良好的审美观和创意能力，能够独立完成设计任务...",电子商务,http://jobs.zhaopin.com/CCL1433649550J40699577001.htm,20-99人,2025-07-21 11:01:46
平面设计师,武汉,广研博峰集团有限公司,大专,1-3年,"AI,手绘,宣传物料设计",6000-8000元,岗位职责：1、根据项目的整体设计要求与目标受众定位，准确把握广告的整体风格及视觉效果，负责广告的整体形象、线上、线下宣传物料等整体设计； 2、通过了解项目情况、公司意图和要求，负责设计图的修改、确认及完善工作； 3、按照公司需求完成对内对外宣传广告、资料的平面设计制作任务，配合其他部门相关工作； 4、根据需求进行正稿制作、输出。任职要求：1、 艺术、设计类科班出生，或者有艺术设计功底； 2、 爱天...,运营商/增值服务,http://jobs.zhaopin.com/CC593861720J40227847005.htm,100-299人,2025-05-06 09:56:36
初级游戏ui设计师,武汉,武汉映游网络科技有限公司,大专,经验不限,"端游,页游,手游,独立游戏,云游戏,暗黑系,仙侠风,写实,二次元,Q版,国风",4000-7000元,一、福利待遇：1、薪资结构：基本工资+项目提成+餐费补贴；2、工作时间：周一至周五，早9:00-12:00晚14:00-18:00，周末双休，国家法定节假日；3、五险（养老、失业、工伤、医疗、生育）一金（公积金）；4、带薪休假（年假，婚假，丧假，病假等）；5、公司注重员工培养，给予晋升机会，管理员主要员工中培养、提拔；6、公司环境舒适、团队氛围佳，生日派对、团队聚餐、集体出游等等。职位亮点：游戏爱...,游戏,http://jobs.zhaopin.com/CCL1451008810J40771563416.htm,20-99人,2026-01-11 01:42:03
平面设计,武汉,武汉君绿森木业有限公司,大专,1-3年,"CAD,3DMAX",5000-7000元,岗位职责 1、负责公司品牌形象和产品形象规划设计，公司日常宣传、策划设计制作与展会活动物质设计； 2、线上线下平面设计、制作及其它图文处理；企业宣传资料的设计、制作与创新。 3、协助其他部门人员对设计及美学方面的工作顺利完成； 4、与协作方沟通，保证各类平面项目的质量极其时间的把握，成功的验收； 5、完善品牌形象标准，并提出合理化建议，提升公司整体宣传形象； 6、协助经理完成公司广告等宣传文件的审...,贸易/进出口,http://jobs.zhaopin.com/CC853734770J40427827806.htm,20-99人,2025-12-02 16:10:23
平面设计,武汉,武汉绮丽创意文化传播有限公司,本科,1-3年,"手绘,PS,AI",5000-7000元,岗位职责：1. 根据策划需求或客户喜好进行婚礼整体布置设计； 2. 对接平面制作商，尺寸，颜色，数量等要求的协调沟通；3.完成婚礼场景设计平面图及相关婚礼logo，广告。任职要求：1.热爱婚礼行业，设计相关专业，有一定审美；2.婚礼手绘功底扎实，至少会使用2种以上绘图软件。 职位福利：五险、全勤奖、绩效奖金、交通补助、节日福利、定期团建 工作时间：9:30-12:00，14:00-18:00,广告/营销,http://jobs.zhaopin.com/CC574768530J00214052106.htm,20-99人,2025-11-19 00:10:22
ui交互设计师,武汉,中泰信达环保科技（武汉）有限公司,学历不限,1-3年,"界面设计,交互设计,移动端,客户端,网页端,PS,AI,Axure",6000-7000元,岗位职责：负责公司产品（Web端、移动端）的UI界面设计，并通过蓝湖交付高保真设计稿及标注；完成品牌宣传物料更新设计（PPT、产品手册、展会海报、公众号等）；独立完成新媒体视频创意策划、剪辑及动态视觉设计（短视频、产品演示动画等）；协同产品经理与开发团队，确保设计落地与用户体验一致性。岗位要求：熟练使用 mastergo 等软件进行高保真设计交付与协作；精通剪映进行视频剪辑、音频处理与特效包装，能...,环保,http://jobs.zhaopin.com/CC568436620J40963916904.htm,20-99人,2025-11-04 17:56:13
平面设计师,武汉,互猜众娱(湖北)网络科技有限公司,大专,1-3年,"广告设计,包装设计,排版设计,PS,CDR",5000-7000元,岗位职责1. 负责品牌线上线下设计，如海报、长图、宣传单页、展架、包装等，精准把握品牌风格与需求，确保设计稿适配线下打印制作，有效规避色差等问题 。2. 参与项目前期沟通，与客户、策划团队协同，理解创意方向与设计需求，输出高质量视觉方案。3. 跟进设计物料的线下制作流程，与合作供应商对接，把控印刷、制作工艺，保障最终成品与设计稿高度契合。4. 定期梳理设计案例，参与团队创意分享，提升团队整体设计水...,旅游服务,http://jobs.zhaopin.com/CCL1499923440J40829992603.htm,20-99人,2025-10-28 10:55:45
平面设计师,武汉,武汉四维文化传播有限公司,大专,3-5年,"广告设计,海报设计,延展设计,设计师",6000-7000元,1、参与项目设计创意沟通，根据公司项目整体需求，独立设计出符合要求的主kv设计，及物料延展、线上传播H5画面等；2、以及少量车展和活动现场物料的设计；3、完成领导安排的工作和协助其他部门设计。岗位要求：1、25-40岁，男女不限，从事过汽车行业者优先，面试时请附上个人设计作品；2、 精通Adobe Photoshop、Illustrator、CorelDraw等设计软件者优先；3、 对色彩把握敏锐...,广告/营销,http://jobs.zhaopin.com/CC232477810J40337170913.htm,100-299人,2025-09-11 09:51:53
UI设计产品助理,武汉,中泰信达环保科技（武汉）有限公司,学历不限,经验不限,"软件产品,AI产品,商业化产品,智能问答产品,知识图谱产品,MES系统,ERP系统,CRM系统,产品运营,新媒体运营",5000-7000元,岗位职责：1.与团队成员合作，负责公司产品UI设计和Ux交互设计；做好日常产品宣传资料设计，产品运营的视频制作和参与产品运营工作。2.从需求出发的同时结合使用场景，提出创造性的设计解决思路和方案；3.绘制完整的用户操作流程、界面结构和可交互高保真原型；4.按时与高品质的完成交付，并进行设计落地的闭环跟踪，推进方案的实现；5.参与竞品研究、用户调研反馈分析、设计工作等，保障产品生命周期中的用户体验；...,环保,http://jobs.zhaopin.com/CC568436620J40963535604.htm,20-99人,2025-11-03 14:47:28
平面设计师,武汉,武汉林凤家居装饰有限公司,大专,1-3年,"广告设计,包装设计,PS",5000-6000元,1、负责公司各类宣传、装饰的创意设计及日常平面制作工作2、负责每月活动宣导系统的制作与维护工作3、负责室内外灯箱、橱窗、展板设计与制作工作4、配合活动策划主管，作好公司大型活动的包装及制作工作5、及时关注行业发展潮流，根据公司具体情况进行不断吸收与优化6、对既定的企划、设计案的实施进度和效果负责7、完成公司安排的各项工作任务能力要求：1、熟悉设计方案后期执行的实施和控制2、具有扎实的美术基础，思维...,装饰装修,http://jobs.zhaopin.com/CCL1471206490J40721800306.htm,1000-9999人,2026-01-10 15:26:49
平面设计,武汉,湖北万维科技发展有限责任公司,大专,1-3年,"PS,AI,CorelDraw",5000-6000元,岗位职责：1、根据产品需求，对产品的整体美术风格、交互设计、界面结构、操作流程等做出设计；2、负责项目中各种交互界面、图标、按钮、H5等相关元素的设计与制作；3、负责软件界面的美术设计、创意、制作和APP规范制定工作；在充分理解产品交互文档基础上，进行界面UI设计，把握整体风格设计，处理元素设计细节；4、根据各种相关软件的用户群，提出构思新颖、有高度吸引力的创意设计。任职资格：1、大专及以上学历，...,计算机软件,http://jobs.zhaopin.com/CC214063610J40910648815.htm,100-299人,2026-01-07 00:27:23
平面设计师/美工,武汉,武汉市海盛洁科技有限公司,大专,无经验,"VI设计,广告设计,包装设计,PS,AI,CDR,设计师,美工",4000-6000元,网页设计、平面设计、UI、美工岗位职责1、负责公司平面和网页设计工作，包括网页设计、平面广告、宣传册、海报等2、根据广告创意内容，进行文字、色彩、图片、图案的设计与排版3、对公司及客户网站界面进行设计修改，协助进行网站更新及维护工作4、负责公司及客户广告宣传等美术设计制作等5、线上店铺的装修及排版任职条件1、有相关专业者，或1年工作经验即可，美术，平面设计，广告相关专业。抠图，修图，基本功扎实。2...,家政服务,http://jobs.zhaopin.com/CCL1503972360J40969722904.htm,20-99人,2025-12-16 20:21:26
平面设计师,武汉,武汉林凤家居装饰有限公司,大专,3-5年,"包装设计,排版设计,方案设计,平面设计",5000-6000元,岗位职责：1. 负责公司各类宣传、装饰的创意设计及日常平面制作工作；2. 活动时宣导系统的制作与维护；3. 室内外灯箱、橱窗、展板设计与制作工作；4. 负责公司大型活动的包装及制作工作，配合执行策划方案，作好活动的平面设计工作；5. 及时关注行业发展潮流，根据公司具体情况进行不断吸收与优化；6. 对既定的企划、设计案的实施进度和效果负责；7. 对设计内容的校对工作负责；8. 完成部门经理临时交办的...,装饰装修,http://jobs.zhaopin.com/CCL1471206490J40645184206.htm,1000-9999人,2025-12-23 11:12:06
平面设计师,武汉,武汉必火音乐文化有限公司,本科,1-3年,"VI设计,方案设计,广告设计,PS,AE,AI",4000-6000元,岗位要求：平面设计/艺术设计等相关专业优秀的专业基础 良好的审美意识岗位职责：负责公司艺人、音乐项目的平面物料设计，人像修图配合艺人宣传节点(如综艺播出、新歌发布等)，参与物料设计与修改配合团队完成简单的视觉优化工作，（如修改Banner尺寸，确保符合各平台发布规范，公司艺人PPT优化调整）加分项：字体设计能力优秀者优先,新媒体,http://jobs.zhaopin.com/CCL1499352640J40900048008.htm,20-99人,2025-11-14 17:22:20
平面设计,武汉,湖北和祥汇实业有限责任公司,本科,1-3年,"包装设计,排版设计,电商设计,PS,AI,CAD",4000-6000元,岗位职责：1.负责公司品牌视觉形象的设计与维护，包括LOGO、VI系统、宣传物料等；2.独立完成线上线下宣传素材的设计，如海报、画册、社交媒体配图等；3.配合市场、产品等部门完成活动推广相关的视觉设计工作；4.参与创意构思，提供符合品牌调性的设计建议；5.管理设计素材归档，确保文件规范可追溯。任职要求：1.本科及以上学历，平面设计、视觉传达或相关专业优先；2.熟练掌握Photoshop、Illus...,快速消费品,http://jobs.zhaopin.com/CC868586010J40817009110.htm,20-99人,2025-10-31 16:04:41
平面设计,武汉,亦品空间设计(武汉)有限公司,大专,3-5年,品牌设计,4000-6000元,技能要求： 品牌设计 1、 学历要求：美术设计类、广告学及相关专业，大专以上学历；  2、 经验要求：有1年以上从事设计经验，具有较好的色彩、造型感觉；有品牌设计经验，熟悉设计流程。   3、 熟练掌,装饰装修,http://jobs.zhaopin.com/CC558974020J40022210314.htm,20-99人,2025-10-13 14:58:10
平面设计师,武汉,朗美药业(武汉)有限公司,大专,1-3年,"PS,AI,CDR,包装设计",4000-6000元,岗位职责： 1、各类广告设计的工作，设计制作如标志、版面、构图、包装、画册等工作； 2、负责公司的形象设计，产品宣传的设计； 3、负责产品包装样盒设计，能独立完成设计工作； 岗位要求：1、精通 Photoshop，Dreamweaver，Flash 等图形软件，优秀的审美能力，独特 的创意，有较强的平面设计创意能力 ；2、应届毕生生亦可,医药批发/零售,http://jobs.zhaopin.com/CCL1389619210J40802378703.htm,20-99人,2025-07-25 09:23:40
