职位,城市,公司,学历,经验,技能,薪资,工作描述,行业,职位URL,公司规模,发布时间
高级UI设计师,武汉,武汉慧猎达网络科技有限公司,本科,3-5年,,2.5-4万·13薪,岗位职责设计执行：依据产品需求和用户研究，运用专业设计软件（如Adobe Photoshop、Sketch等），进行高质量界面设计，涵盖移动应用、网页等多平台，确保设计风格统一、界面布局合理、元素协调，像电商APP的商品展示页，需突出商品且操作便捷。• 用户体验优化：深入研究用户行为与心理，通过可用性测试、竞品分析，挖掘用户需求，优化界面交互流程，提升易用性与用户满意度，比如简化社交APP的注册流...,电子商务,http://jobs.zhaopin.com/CCL1278039650J40818526907.htm,20-99人,2025-12-22 11:51:12
U//UX工程师-奕派科技,武汉,东风汽车,本科,5-10年,交互设计,1.5-2.5万,岗位职责:1、有车企工作经验或者项目经验，熟悉车企营销类业务;2、负责用户研究全流程，挖掘用户痛点，输出用户画像、旅程图、需求优先级报告，3、依据品牌调性设计UI规范，能够输出符合多终端适配要求的高保真稿与标注文件;4、响应 Web、iOS、Android、H5 等多终端设计需求，保障不同场景下的体验统一性:5、较强沟通能力，与前端开发工程师对齐设计细节，解释交互逻辑与视觉标准，跟进开发落地过程，...,汽车研发/制造,http://jobs.zhaopin.com/CC679989880J40831892205.htm,10000人以上,2025-12-29 10:20:09
UI/UE 设计师,武汉,武汉绛芸科技有限公司,大专,3-5年,"界面设计,交互设计,动画动效设计,移动端",1.4-2万,岗位内容： 负责UI/UE设计 任职要求： 3年以上 UI/UE 设计经验，有仿真产品、工业模拟、虚拟实验等相关设计案例； 熟练使用 Figma、Adobe XD 等设计工具，熟悉 C4D、Unity 或 Unreal Engine 等 3D 建模与开发工具者优先； 具备出色的空间思维与逻辑分析能力，擅长将复杂仿真数据转化为可视化界面；,计算机软件,http://jobs.zhaopin.com/CCL1501862500J40669757206.htm,20-99人,2025-11-10 15:36:33
ui设计工程师,武汉,超星集团有限公司,本科,1-3年,"界面设计,网页端",1.3-2万,岗位职责：1.负责负责各大高校/图书馆等门户官网的整体视觉设计美化，及动效设计，并使用公司建站平台搭建双端页面上线；2.负责不同业务类型的可视化大数据屏的设计、美化、搭建；3.负责iOS、Android等移动端和PC端产品的视觉设计；4.负责参与各平台的UI规范、交互规范制定；5.熟练使用公司的微服务平台为业务提供支持，持续优化公司的产品和服务；6.和研发团队紧密配合，协助达成最终产品目标。岗位要...,在线教育,http://jobs.zhaopin.com/CCL1219635220J40807175603.htm,1000-9999人,2025-10-31 00:06:21
场景体验定义专业工程师-奕派科技,武汉,东风汽车,本科,1-3年,"交互设计,界面设计",1.5-2.5万,岗位职责:1. 场景体验定义与设计 负责各车型 USP 场景需求定义与达成检核，确保产品的核心场景体验能够满足用户需求 进行场景切片分解、详细体验需求和目标定义与点检评价，确保场景体验的可实现性和可评估性 设计场景的人机交互定义，确保用户在不同场景下的交互体验流畅自然 制定场景体验定义的实践模板 PEA，为团队提供统一的场景体验定义方法论2. 用户体验分析与研究 分析用户：明确为谁服务，...,汽车研发/制造,http://jobs.zhaopin.com/CC679989880J40834792105.htm,10000人以上,2025-12-24 09:16:18
平面设计总监,武汉,亦品空间设计(武汉)有限公司,本科,5-10年,"美工,设计师",1-2万,"岗位职责：1、 负责平面设计部项目的组织实施，执行项目设计的规划、分配工作及规则制定；2、 负责对本部门下属培训，协调下属之间工作上的问题,充分调动下属专业方面的最大创意能力及创意效率；3、 能独立做出概念设计方案；同时负责与客户进行谈判，精准地向客户阐述出设计理念，并让客户信服；4、 建立设计部产品规划文档及部门开发过程中的各种规定；5、 考核部门内部员工的业绩、态度和潜力；6、 部门财务预算制...",装饰装修,http://jobs.zhaopin.com/CC558974022J90250054000.htm,20-99人,2025-10-13 14:58:18
资深UED工程师/用户体验（UE/UX）设计师（英语流利）,武汉,融捷科技(武汉)有限公司,本科,5-10年,"交互设计,英语听说流利,网页端,客户端,Axure,会CSS编辑,UI/UX",1.5-2万·13薪,"岗位职责：1. 从用户体验的角度出发，为产品提出交互设计方案, 与视觉设计师合作参与具体设计工作;2. 根据需求和用户研究的结果，完成界面的信息架构、流程设计和原型设计，提高产品的易用性;3. 负责网页/界面设计标准和规范, 监督规范实施效果;4. 参与用户研究及产品需求制定的整个过程能给出有效的交互解决方案，并推动方案的落地;5. 对现有产品的可用性测试和评估，提出改进方案，持续优化产品的用户体...",计算机软件,http://jobs.zhaopin.com/CC388737810J40719779601.htm,100-299人,2025-07-28 16:48:43
U//UX工程师,武汉,东风汽车,本科,经验不限,"界面设计,UI设计,UX设计",1.3-2.3万·13薪,岗位职责：1.有车企工作经验或者项目经验，熟悉车企营销类业务; 2.负责用户研究全流程，挖掘用户痛点，输出用户画像、旅程图、需求优先级报告， 3.依据品牌调性设计UI规范，能够输出符合多终端适配要求的高保真稿与标注文件; 4.响应 Web、iOS、Android、H5 等多终端设计需求，保障不同场景下的体验统一性 5.较强沟通能力，与前端开发工程师对齐设计细节，解释交互逻辑与视觉标准，跟进开发落地...,汽车研发/制造,http://jobs.zhaopin.com/CC679989880J40833612905.htm,10000人以上,2026-01-04 14:30:40
UX 设计师,武汉,武汉新创云图科技有限公司,大专,5-10年,B端项目的产品界面设计,1.2-1.8万,岗位职责：1. 负责B端项目的产品界面设计工作，包括功能迭代、竞品分析、交互设计、视觉设计，能够将产品细节和视觉打磨并打造优秀的多端联动体验；2. 参与产品规划和讨论，与产品经理和其他交互设计师协作，产出高保真设计图稿。跟进从需求到设计、研发到走查的全流程，保证最终设计质量；3. 良好的时间管理和项目管理能力，合理安排自己当下的设计任务；4. 良好的沟通能力，可以清晰有效的与其他设计师、产品经理和...,计算机软件,http://jobs.zhaopin.com/CC373771530J40720632011.htm,20-99人,2025-10-21 09:48:57
ui界面设计师,武汉,武汉小嘀科技有限公司,本科,5-10年,"界面设计,交互设计,移动端,客户端",1.3-1.8万,"岗位描述:1.负责部门产品UI设计，含web端，app端,小程序端等，把控界面视觉一致性和用户体验2.根据领导及用户反馈提升产品设计和交互体验。3.拥有良好专业能力的同时，善于分享，乐于学习业务能力和创新能力岗位要求:1.5-8年及以上互联网UI从业经验，深入理解移动端和web端，前后台产品设计规范。2.具有扎实的视觉设计功底，美术，设计及相关专业优先3.独立设计或负责至少1款上线并经过版本迭代的...",互联网,http://jobs.zhaopin.com/CC830814150J40721950314.htm,20-99人,2025-08-03 00:00:01
UI设计师,武汉,桑万(上海)人工智能科技有限公司,本科,3-5年,"UI设计,视觉设计,SKetch,Sketch,Adobe XD,Photoshop",1.2-1.7万,职位描述：· 负责公司产品（Web/App）的界面视觉设计，让产品既好看又好用。· 制作高保真设计稿和原型，与开发团队协作，确保设计完美落地。· 参与设计规范的制定，维护产品视觉风格的一致性。任职要求：1. 本科及以上学历2. 有3年以上UI设计经验，有完整的线上作品集。3. 熟练使用Figma，具备良好的审美和视觉表现力。4. 注重细节，有责任心，善于沟通和团队合作。5. 对用户体验有热情，乐于...,计算机软件,http://jobs.zhaopin.com/CC538835130J40842101903.htm,100-299人,2025-10-30 17:18:23
游戏ui设计师,武汉,中软国际,大专,1-3年,"二次元,欧美风,多风格擅长",面议,岗位职责：主要负责游戏运营活动类的视觉设计岗位要求（附加）：1、扎实的美术绘画功底；2、2年以上互联网行业相关设计工作经验，擅长运营类活动界面设计；3、较强的审美和视觉设计水平，能够独立完成设计作品；4、熟练掌握PS/Figma/AE/Blender或C4D等相关设计软件；5、有强烈的Owner意识，积极主动，具有高度责任心和良好的团队合作精神；以下为加分项：1、擅长游戏活动设计经验；2、会使用A...,计算机软件,http://jobs.zhaopin.com/CC508620120J40866557312.htm,10000人以上,2026-01-10 01:37:15
高级平面设计师,武汉,武汉乐薇电子商务有限公司,本科,1-3年,"电商美工,电商设计,平面设计,淘宝设计,设计,亚马逊,平面,电商",1-1.5万·15薪,岗位概述：我们正在寻找一位具有电商转化思维与海外审美能力的平面设计师，加入我们的多平台跨境销售团队。你将围绕产品核心卖点，创作适配于 Amazon、独立站、Walmart 等平台的产品主图、详情页、A+页面、促销素材与品牌传播图，推动我们的产品在全球市场持续赢得消费者的关注与信任。岗位职能：1、负责 Amazon、独立站等平台的产品图片设计，包括主图、详情页、A+内容、品牌故事页等；2、针对不同平...,互联网,http://jobs.zhaopin.com/CC413115810J40095479911.htm,100-299人,2026-01-07 09:52:58
UI工程师(005496),武汉,中国移动,本科,3-5年,"界面设计,交互设计,动画动效设计,移动端,网页端,客户端",面议,岗位描述: 1、针对产品/项目需求，设计不同风格的页面，参与评审并提出有效的修改方案。 2、负责产品的用户习惯分析、可用性分析、参与功能设计等，可根据竞品进行UI、操作方式与流程对比和分析。 3、站在用户角度思考、优化设计。 4、主动有效的与团队成员沟通合作，保证产品高质量按时上线。 5、负责公司产品的视觉设计，包括软件产品页面、图表、logo设计等；并可把握web设计的流行趋势，提出好的创意策略...,运营商/增值服务,http://jobs.zhaopin.com/CC000413680J40841156213.htm,10000人以上,2025-12-11 09:44:03
设计师,武汉,武汉锂钠氪锶科技有限公司,本科,3-5年,"界面设计,交互设计,平面设计,移动端,网页端,客户端,Sketch,PS,AI,手绘,软件",8000-15000元,岗位职责：岗位职责： 1、负责公司主营产品的UI设计，包括PC端、移动端、平板 2、负责公司网站的UI设计 3、负责公司产品的图标设计 4、负责品牌、运营、电商、活动宣传线上和线下的视觉设计 5、能独立制作界面相关的动效、动画设计 6、参与头脑风暴、规范、创意等产品设计环节，提出建设性方案 7、制定和遵守设计规范，维护控件库 任职要求： 1、美术、设计相关专业毕业，3年以上产品设计经验 2、熟练运...,计算机软件,http://jobs.zhaopin.com/CCL1215721370J40639305609.htm,20-99人,2025-08-21 00:00:03
UI设计师（需求开发培养方向）,武汉,无锡融卡科技有限公司,本科,1-3年,"交互设计,移动端,客户端,Sketch",1-1.5万·13薪,岗位职责：1. 负责公司移动端（iOS/Android）及Web端产品的UI设计、交互设计及视觉优化，输出高保真原型、设计规范及设计文档；2. 深度参与产品需求讨论，理解业务逻辑与用户需求，将抽象需求转化为直观的视觉解决方案；3. 与产品经理、开发团队紧密协作，跟进设计落地，确保设计效果的实现与一致性；4. 长期培养方向：逐步参与需求分析、用户调研及产品规划，向“设计+需求开发”复合型人才发展；5...,物联网,http://jobs.zhaopin.com/CCL1309919890J40812559515.htm,20-99人,2025-08-19 11:07:46
UI工程师,武汉,武汉凡迅科技有限公司,本科,1-3年,"界面设计,交互设计",1-1.4万,岗位职责：1.负责公司核心产品(包括但不限于后台系统、APP、小程序、网页等)的全流程视觉设计，涵盖界面布局、色彩体系搭建、图标设计、字体规范、视觉风格定义等，确保多端设计风格统一且质感卓越。2.制定并迭代视觉设计规范，统筹各类设计物料的视觉输出，为产品全生命周期提供稳定的视觉支撑，保障用户视觉体验的一致性。3.深度参与需求评审环节，精准拆解产品目标与业务逻辑，将抽象需求转化为具象化的视觉方案，主...,计算机软件,http://jobs.zhaopin.com/CC879490140J40855536002.htm,20-99人,2025-12-23 10:08:25
UI设计师,武汉,武汉研锶信息科技有限公司,本科,1-3年,"PS,网页端,界面设计,CSS,HTLM,DIV,AI",7000-14000元,一、岗位职责1. 负责网站设计的需求沟通，确定网页设计的视觉标准；2. 负责网站静态页面的制作，参与页面的策划创新工作；3. 负责网站的改版、更新，优化用户视觉体验，完善页面设计流程；4. 负责banner、各类海报、平面宣传物料的设计制作。二、任职要求1. 本科及以上学历，视觉传达、工业设计、美术、计算机等相关专业，具有一年以上网页设计工作经验；2. 熟练使用Photoshop、Illustra...,互联网,http://jobs.zhaopin.com/CC648080130J40696092116.htm,20-99人,2025-11-28 15:47:21
UI/UE开发工程师-武汉东风,武汉,中软国际,本科,3-5年,交互设计,面议,1、精通Figma、Sketch等设计工具，能独立输出高保真原型与设计规范或熟悉Axure、Principle等交互原型工具；2、本科及以上学历，视觉传达设计、交互设计、工业设计等相关专业；3、3年以上的UE设计经验，具备智能座舱或车载软件项目UI/UE设计经验者优先；4、工作地：武汉；,计算机软件,http://jobs.zhaopin.com/CC508620120J40765174712.htm,10000人以上,2026-01-09 10:15:12
ui视觉设计师,武汉,外企德科数字技术有限公司,本科,3-5年,"界面设计,交互设计,AI,PS,Axure,移动端,网页端,客户端,AIGC",1.1-1.2万,岗位职责及要求：1. 负责出版行业小程序、H5、Web、APP等UI界面设计工作2.具备手绘能力，审美在线，视觉表现能力强，有上线产品的UI设计经验及作品集呈现3.深入理解业务目标与用户需求，对现有视觉设计进行持续优化，确保设计方案有清晰客观的设计思路，满足业务目标诉求4.把控设计项目全流程，从概念设计到最终视觉呈现能独立对接产品需求，跟进UI设计方案的落地实现;确保按时、高质量交付设计成果，并跟...,专业技术服务,http://jobs.zhaopin.com/CCL1480117890J40830190405.htm,1000-9999人,2026-01-11 00:26:36
资深平面设计师,武汉,合顺进出口贸易(武汉)有限公司,本科,3-5年,"VI设计,广告设计,包装设计,PS,AI,C4D,宠物用品",8000-12000元·13薪,岗位职责：1、负责京东、天猫电商平台店铺的视觉设计，包括产品主图、详情页、活动页设计，并根据销售数据持续优化视觉效果，提升转化率；2、维护并升级线上店铺整体视觉形象，确保品牌调性统一，定期更新店铺主页、产品页面等模块；3、参与品牌视觉体系的搭建与优化，独立完成品牌相关设计项目（如品牌活动页、IP形象延展、营销活动素材等）；4、主导或协助产品包装设计（含结构图、材质工艺提案、品牌元素整合），确保设计...,互联网,http://jobs.zhaopin.com/CC811355680J40713258311.htm,20-99人,2025-11-28 16:26:15
平面设计,武汉,武汉红袖文化科技有限公司,大专,1-3年,"方案设计,包装设计,PS,AI,CDR,五险",6000-12000元·13薪,1. 负责公司各类会务会展项目的创意设计工作，包括但不限于主视觉设计及延展等物料的设计，大专及以上学历，具有2年以上平面设计工作经验，有会务会展行业设计经验者优先考虑。2. 负责公司日常宣传物料设计，.熟练掌握 Adobe Photoshop、Illustrator、CorelDRAW 等设计软件，具备扎实的设计功底对设计作品进行不断优化和完善，提升设计质量，增强视觉效果。拥有丰富的创意灵感。3....,会议/展览,http://jobs.zhaopin.com/CCL1462752680J40591493616.htm,20-99人,2025-09-09 00:00:00
ui设计工程师,武汉,外企德科数字技术有限公司,本科,3-5年,"交互设计,客户端,网页端,移动端,AI,AI产品",1-1.2万,岗位职责及要求：1. 负责出版行业小程序、H5、Web、APP等UI界面设计工作2.具备手绘能力，审美在线，视觉表现能力强，有上线产品的UI设计经验及作品集呈现3.深入理解业务目标与用户需求，对现有视觉设计进行持续优化，确保设计方案有清晰客观的设计思路，满足业务目标诉求4.把控设计项目全流程，从概念设计到最终视觉呈现能独立对接产品需求，跟进UI设计方案的落地实现;确保按时、高质量交付设计成果，并跟...,专业技术服务,http://jobs.zhaopin.com/CCL1480117890J40830157705.htm,100-299人,2026-01-11 00:26:36
ui交互设计师,武汉,镭德杰标识科技武汉有限公司,本科,3-5年,移动端,8000-12000元·13薪,岗位内容：1. 设计软件、喷码机应用程序、UV喷码机等交互界面，提供具体设计方案；2. 与产品经理、开发人员、测试人员等团队密切协作，推进项目进程；3. 控制并优化用户体验，规划和描述用户路径和操作流程。任职要求：1. 精通Photoshop、Illustrator、Sketch、Axure RP等相关工具；2. 具备良好的沟通协调能力，有强烈的团队合作意识；3. 较强的时间管理能力和紧急情况下的...,通用设备制造,http://jobs.zhaopin.com/CC565019720J40740415211.htm,100-299人,2025-05-27 09:43:28
高级平面设计师,武汉,广研博峰集团有限公司,大专,1年以下,"AI,手绘,广告设计,海报设计",7000-12000元,技能要求： 广告设计，海报设计，画册设计，品牌设计岗位职责：1、根据项目的整体设计要求与目标受众定位，准确把握广告的整体风格及视觉效果，负责广告的整体形象、线上、线下宣传物料等整体设计； 2、通过了解项目情况、公司意图和要求，负责设计图的修改、确认及完善工作； 3、根据需求进行正稿制作、输出。任职要求：1、 艺术、设计类科班出生，或者有艺术设计功底； 2、 爱天马星空，爱创意，爱观察生活； 3、 ...,运营商/增值服务,http://jobs.zhaopin.com/CC593861720J40228251905.htm,100-299人,2025-05-06 09:56:37
UI设计,武汉,外企德科数字技术有限公司,本科,3-5年,"界面设计,交互设计,动画动效设计,移动端,网页端,客户端,AI,PS,Axure",1-1.2万,岗位职责及要求：1. 负责出版行业小程序、H5、Web、APP等UI界面设计工作2.具备手绘能力，审美在线，视觉表现能力强，有上线产品的UI设计经验及作品集呈现3.深入理解业务目标与用户需求，对现有视觉设计进行持续优化，确保设计方案有清晰客观的设计思路，满足业务目标诉求4.把控设计项目全流程，从概念设计到最终视觉呈现能独立对接产品需求，跟进UI设计方案的落地实现;确保按时、高质量交付设计成果，并跟...,专业技术服务,http://jobs.zhaopin.com/CCL1480117890J40830159305.htm,1000-9999人,2026-01-11 00:26:36
ppt美化设计师,武汉,武汉青怡文化传播有限公司,大专,1-3年,"设计师,方案设计,UI设计,广告设计,PS,AI,CDR",6000-12000元·13薪,PPT美化设计制作，教案整理，背景设计，标题设计，颜色搭配，布局排版,文化艺术/娱乐,http://jobs.zhaopin.com/CC610849980J40556750001.htm,20-99人,2025-04-01 14:58:10
品牌平面设计师,武汉,湖北黑格建材有限公司,大专,5-10年,"方案设计,排版设计,广告设计,CAD,3D MAX,AI",8000-12000元,岗位内容：1. 制定公司品牌视觉标识体系，提升企业品牌形象；2. 负责各种平面设计、包装设计、POP设计、互动新媒体设计等工作；3. 参与公司宣传渠道的规划、策划及实施、通过创新的设计语言，为产品及公司形象塑造建立更具竞争力的视觉形象。任职要求：1. 本科及以上学历，平面设计或者相关专业，5年以上品牌设计工作经验；2. 对于品牌推广，视觉形象设计以及与用户交互体验有很深的理解；3. 具备出色的平面...,建材,http://jobs.zhaopin.com/CCL1232996650J40561097604.htm,20-99人,2025-03-29 14:30:54
ppt设计师,武汉,张店区祈旭电子商务工作室(个体工商户),本科,1-3年,"方案设计,排版设计,AI,PS,AE,ppt,平面设计,英语四六级",6000-12000元,1.掌握各类型PPT风格的设计能力，能够独立完成方案版式风格设计和整体布局2.具备良好的沟通能力，能与客户进行高效的沟设计3.能够独立完成PPT策划、PPT设计、PPT美化工作工作内容负责根据所给到的资料来进行PPT的设计与制作，工作时间、工作地点不限，在家就可办公，一月两结，应聘发两到三个ppt作品（截图或者图片就行）可兼职也可全职，欢迎各位，期待你的加入,互联网,http://jobs.zhaopin.com/CCL1485482900J40727817310.htm,20-99人,2025-03-19 23:32:11
中级平面设计 （武汉驻场）,武汉,正邦创意(北京)品牌科技股份有限公司,大专,3-5年,排版设计,1-1.1万,工作职责： 1、主要负责电商平台的主图详情页面设计 ，以及海外平台电商设计；2、排版规范类的页面设计、集中于主图详情这样的排版、店铺装修 、促销活动或者做过小米产品的相关设计经验； 任职资格：1.有过主导大型电商视觉设计项目经验，或独立负责业务线视觉设计经验；2.出色的视觉表现力、审美，善于思考和熟悉视觉设计系统化方法；3.有极强学习能力和自驱力，善于沟通，能够主动推进项目落地和良好的团队精神和责...,广告/营销,http://jobs.zhaopin.com/CC120092650J40852551212.htm,500-999人,2025-11-24 15:24:45
高级交互设计师（UE）,武汉,博彦科技承德有限公司,本科,1-3年,"Web端,交互体验设计,SKetch,FIGMA,交互设计",1-1.1万,【岗位职责】 1. 负责企业协同效率相关产品的交互设计。 2. 能够与业务线PM/高工通力配合，高效开展竞品分析/用户调研，熟练梳理业务逻辑、需求、用户路径。 3. 熟悉web端交互设计方法，根据需求与交互设计规范，产出交互设计文稿，撰写交互设计文档。 4. 与开发和视觉同学合作，解决产品研发过程中的问题，保证设计落地。 5. 熟悉交互设计走查方式，研发提测后及时进行设计走查，保证页面较高的设计还...,IT服务,http://jobs.zhaopin.com/CC637366030J40421266206.htm,1000-9999人,2025-05-27 09:45:02
游戏ui视觉设计师,武汉,武汉映游网络科技有限公司,大专,经验不限,"端游,页游,手游,手绘经验,写实,二次元,Q版,国风,暗黑系,仙侠风,多风格擅长",5000-10000元,一、福利待遇：1、薪资结构：基本工资+项目提成+餐费补贴；2、工作时间：周一至周五，早9:00-12:00晚14:00-18:00，周末双休，国家法定节假日；3、五险（养老、失业、工伤、医疗、生育）一金（公积金）；4、带薪休假（年假，婚假，丧假，病假等）；5、公司注重员工培养，给予晋升机会，管理员主要员工中培养、提拔；6、公司环境舒适、团队氛围佳，生日派对、团队聚餐、集体出游等等。职位亮点：游戏爱...,游戏,http://jobs.zhaopin.com/CCL1451008810J40715575716.htm,20-99人,2026-01-11 01:40:47
平面设计（五险一金、周末双休、餐补、年底双薪）,武汉,武汉天一视觉文化传媒有限公司,本科,1-3年,"广告设计,排版设计,UI设计",6000-10000元,岗位职责：1、品牌视觉体系搭建：主导品牌 logo全案设计，明确标准色彩、专属字体、核心图形元素等视觉规范，构建完整品牌视觉识别系统（VI)，确保品牌在海报、宣传册等各类宣传渠道中视觉呈现高度统一，强化品牌辨识度;2、商业广告设计创作：聚焦品牌推广与产品宣传需求，独立完成海报、宣传册页、宣传单页、户外广告等各类平面广告素材设计，精准提炼产品核心优势与品牌理念，通过视觉语言吸引目标受众关注，助力品牌...,广播/影视,http://jobs.zhaopin.com/CC282583036J00471320708.htm,20-99人,2026-01-05 12:51:25
