职位,城市,公司,学历,经验,技能,薪资,工作描述,行业,职位URL,公司规模,发布时间
UI设计工程师（武汉）,武汉,青岛兴辰智海科技有限公司,本科,5-10年,"UI设计,SKetch,界面设计",8000-10000元,岗位职责：1、主要负责软件系统的UI设计，包括web和移动端应用的界面设计；2、根据用户需求和产品功能，设计高质量的UI方案，确保用户体验的流畅和一致性；3、参与产品设计讨论，提供创意和解决方案，确保设计符合用户体验原则；4、制作详细的设计规范和设计文档，指导开发团队实现设计方案；5、收集和分析用户反馈，不断优化和改进设计；6、关注设计趋势和行业动态，持续提升设计水平；7、与跨部门团队紧密合作，确...,计算机软件,http://jobs.zhaopin.com/CCL1502335410J40911006915.htm,20-99人,2026-01-04 17:44:43
用户界面ui设计师,武汉,武汉北山网络科技有限公司,大专,1-3年,"PS,Axure,墨刀,移动端,网页端,客户端,界面设计,交互设计",6000-10000元,岗位内容：1. 负责设计各种类型的UI界面，包括但不限于Web、App、PC等界面的设计；2. 研究最新用户体验设计趋势和技术，持续推进产品设计优化，提升用户满意度；3. 制定企业视觉设计规范，并对现有设计进行改进和完善。任职要求： 1. 大专及以上学历，具有平面设计、交互设计、视觉传达等相关专业背景； 2. 精通Sketch、Photoshop、Illustrator等设计软件，具有深厚的设计功...,科学技术推广,http://jobs.zhaopin.com/CCL1309461950J40831097805.htm,20-99人,2025-12-30 11:01:21
ui设计师,武汉,武汉中楚创世软件有限公司,大专,1-3年,"交互设计,界面设计,动画动效设计,移动端,网页端,客户端,PS,墨刀,C4D",5000-10000元,岗位职责：1.根据产品的定位和业务需求，负责公司各项UI相关设计工作，能够从用户视觉、用户体验为出发点进行整体把控；2.参与策划对软件界面的功能分析和讨论，能独立完成界面视觉创意和风格设计； 3.完成相关大屏、标志、图标、图素的静态与动态设计与绘制；4.与团队沟通，善于理解、讲述和调整方案，最终实现项目开发需求； 招聘要求： 1.设计/美术或艺术相关专业专科、本科学历，2年以上UI设计相关工作经验...,计算机软件,http://jobs.zhaopin.com/CC345589010J40832933005.htm,20人以下,2025-12-19 00:13:41
平面设计师,武汉,武汉一洋装饰设计工程有限公司,本科,1-3年,"排版设计,PS,AI",5000-10000元,"岗位职责：1. 协助设计总监完成公司日常任务安排。2. 清晰的逻辑思维,做事认真、负责，协助团队完善设计。3. 能根据设计的需要，将构思转化成平面设计作品。4. 对色彩感觉敏锐,具有把握不同风格的能力。5. 有良好的处事心态,对工作充满热情。任职要求：1、美术、设计相关专业本科及以上毕业，敏锐的视觉表达能力，一定的艺术修养。2、能独立完成一个案例，对设计有自己独到想法。3、熟练操作各种设计软件（C...",装饰装修,http://jobs.zhaopin.com/CC417653910J40760055605.htm,20-99人,2025-12-08 10:53:59
中级平面设计（武汉驻场）,武汉,正邦创意(北京)品牌科技股份有限公司,大专,5-10年,排版设计,8000-10000元,推荐要求:1、做过电商平台的主图详情页面设计、有海外电商设计经验;2、倾向于排版规范类的页面设计、集中于主图详情这样的排版、店铺装修促销活动或者做过小米产品的相关设计经验;3、费用:10500/月(平台结算5%税费需要自付)4、工作地点:武汉光谷大道77号金融后台服务中心基地5、工作时间:早9:30到晚19:30，午休两小时，周末双休，根据项目情况会有加班需要配合，周末如果加班有调休工作职麦:主要...,广告/营销,http://jobs.zhaopin.com/CC120092650J40853489212.htm,500-999人,2025-11-26 19:48:38
平面设计,武汉,武汉新鸿业印务有限公司,大专,1-3年,"AI,CDR,PS,广告设计,排版设计",6000-10000元,岗位职责1.设计公司产品（文创类、立体书、纸品、贺卡、红包等）岗位要求1.需1年以上产品设计创意经验，有优秀的视觉把控及传达能力，有丰富独立创作项目案例2.视觉、平面、美术设计等专业优先3.熟悉使用平面软件包食宿上班时间：09-18:00，单休,印刷/包装/造纸,http://jobs.zhaopin.com/CC121132640J40851557312.htm,300-499人,2025-11-20 16:45:19
平面设计师/美工,武汉,武汉科闻传感技术有限公司,本科,1年以下,"动画设计,建模设计,PS,BLENDER,Rhino,Vray",6000-10000元·13薪,岗位内容：1. 产品视觉呈现： →负责产品3D建模与渲染，输出高质量效果图，辅助产品开发与宣传； →制作产品演示动画（如功能演示、交互效果等），需掌握基础动画逻辑； 2.文档与视觉设计： →编写与设计产品说明书、操作指南，确保内容清晰、排版美观； →协助整理项目文件、资料归档，优化内部文档体系； →制作产品宣传PPT，提炼文案重点，提升视觉传达效果。 任职要求： 1. 2025年应届本科毕业生，产...,仪器仪表制造,http://jobs.zhaopin.com/CC362270330J40763928714.htm,20人以下,2025-11-11 00:03:41
平面设计,武汉,湖北天屿湖生态文旅有限公司,大专,3-5年,"视觉设计,UI设计",7000-10000元,1、负责完成项目运营活动海报平面的设计（包括广告视觉等）；2、负责产品线下印刷品设计（名片、宣传单、宣传册、海报、易拉宝等）；3、参与运营活动的创意思考，配合完成各项运营活动的物料设计；4、了解印刷流程及熟练各类广告物料，保证公司宣传品的制作无误；5、完成上级领导交办的其他事务；,房地产开发,http://jobs.zhaopin.com/CC859232850J40770966216.htm,1000-9999人,2025-11-03 16:33:37
文创设计,武汉,武汉新鸿业印务有限公司,大专,1-3年,"广告设计,包装设计,PS,AI,CDR",5000-10000元,岗位职责1.设计公司产品（文创类、立体书、纸品、贺卡、红包等）岗位要求1.需1年以上产品设计创意经验，有优秀的视觉把控及传达能力，有丰富独立创作项目案例2.视觉、平面、美术设计等专业优先3.熟悉使用平面软件包食宿上班时间：09-18:00，单休,印刷/包装/造纸,http://jobs.zhaopin.com/CC121132640J40842103812.htm,300-499人,2025-10-23 11:25:38
ui设计工程师,武汉,湖北万维科技发展有限责任公司,本科,5-10年,"UI设计,设计师,界面设计,移动端,网页端,PS,墨刀,Axure",8000-10000元,- 业务理解能力：具备一定业务理解能力，能配合项目经理或产品经理将功能需求转换设计，在设计时可根据不同用户和界面需求，运用视觉手段凸出业务重点，提高用户使用体验。- 设计软件精通：熟练使用主流设计工具，如Photoshop（主要设计工具)，熟悉辅助工具Sketch、Adobe XD、Illustrator、Principle（动效）等。- 视觉设计能力：具备优秀的审美，能独立完成界面视觉设计，包括...,计算机软件,http://jobs.zhaopin.com/CC214063610J40884506615.htm,100-299人,2025-10-22 00:00:02
平面设计师,武汉,心喜阅,大专,1-3年,"电商设计,方案设计,排版设计,PS,AI,AE",6000-10000元,工作内容：1、负责公司童书及儿童智能硬件产品的线上及线下宣传资料，线上如电商详情页主图、商城专题页、海报等平面设计，线下如专台陈列设计方案、手册、传单等物料的设计工作；2、根据公司需求，提供创意设计方案，完成设计任务；3、配合团队完成新品项目的设计工作；4、统筹及管理部门设计排期，对接外发设计师，把关设计质量，保证部门设计工作有序开展。任职资格： 1、2年以上设计工作经验，专科及以上学历，美术设计...,新闻/出版,http://jobs.zhaopin.com/CC367963010J40793804911.htm,100-299人,2025-10-14 10:56:52
兼职UI设计,武汉,大渊科技(武汉)有限公司,本科,3-5年,"界面设计,网页端,移动端,Sketch,FIGMA",5000-10000元,岗位内容：1. 负责设计各种类型的UI界面，包括但不限于Web、App、PC等界面的设计；2. 研究最新用户体验设计趋势和技术，持续推进产品设计优化，提升用户满意度；3. 制定企业视觉设计规范，并对现有设计进行改进和完善。任职要求：1. 本科及以上学历，具有平面设计、交互设计、视觉传达等相关专业背景；2. 精通Sketch、Photoshop、等设计软件，具有深厚的设计功底，熟悉最新的UI设计规范...,人工智能,http://jobs.zhaopin.com/CCL1493693520J40827623213.htm,20-99人,2025-09-22 14:02:30
UI设计,武汉,博彦科技承德有限公司,大专,1-3年,"移动端,网页端",9000-10000元,工作职责：1.负责AI方向产品运营设计工作；2.参与项目需求、设计、上线的整个过程，能独立完成项目设计；3.把控产品的整体视觉风格、相关规范的制定，保证产品的品质；4.与其他对接设计师、产品经理紧密沟通协作，共同达成目标。职位要求：1. 专科及以上学历，设计、美术或相关专业；2. 有一定的Web端、B端后台、移动端等项目经验（如俱备3D等经验者优先）；3. 具备良好合作态度及团队精神，并富有工作激...,IT服务,http://jobs.zhaopin.com/CC637366030J40713553006.htm,1000-9999人,2025-09-08 09:54:40
资深平面设计师,武汉,湖北杨立文展工程有限公司,大专,3-5年,"方案设计,广告设计,排版设计",6000-10000元,"岗位职责：1、收集和研究客户项目资料，参与项目方案讨论，对设计文档、素材、图片资料的整理工作。2、对材质有一定把握及认知，对设计有较好的理解力和热情； 3、设计美观，版式新颖，符合设计方案创意要求；4、完成公司日常任务安排, 各展馆展厅等项目的创意表达、方案排版、平面制作及其他图文处理；5、与策划、文案配合，完成策划主题的视觉执行工作；6、配合完成投标文件的设计、排版及制作；7、与策划、商务配合进...",工程施工,http://jobs.zhaopin.com/CC879300870J40503237004.htm,20-99人,2025-08-10 10:10:59
UI设计师,武汉,武汉敬思亭信息技术有限公司,本科,1-3年,"UI设计,平面设计,视觉设计,AI,AE,C4D,PhotoShop,SKetch",8000-10000元·13薪,岗位职责： 1、 负责公司网页端、移动端产品的体验、效率提高； 2、 与产品经理紧密结合，连接业务、技术、提供行之有效的设计解决方案； 3、 负责产品页面，色彩布局，视觉优化，提升产品的易用，参与视觉规范的构建； 4、 对现有的产品进行可用性测试和评估，持续的提出改进方案并推动落地。 任职要去： 1、扎实的美术功底，视觉传达设计相关专业；2、熟悉互联网产品设计流程，熟悉不同平台产品设计规范及设计趋...,互联网,http://jobs.zhaopin.com/CC242690380J40273275302.htm,20-99人,2025-07-03 11:05:40
学术期刊图像助理设计师,武汉,曼迪匹艾（武汉）科技服务有限公司,本科,经验不限,"AI,PS,INDESIGN,英语六级",6000-10000元,一、工作职责1. 编辑与制作学术文章中的图表，确保符合期刊规范，图表清晰、美观；2. 根据专家学者需求，设计科研插图与图像摘要，准确、清晰地呈现学术成果；3. 负责学术文章的格式排版，确保格式符合期刊要求。二、 职位要求1. 本科及以上学历，英语六级；2. 视觉传达设计、数字媒体技术等平面设计相关专业；3. 熟练使用Photoshop、Illustrator、InDesign等相关设计软件；4. ...,新闻/出版,http://jobs.zhaopin.com/CC588665420J40746715109.htm,1000-9999人,2025-06-17 15:35:17
资深平面设计师,武汉,湖北枫叶企业发展股份有限公司,大专,5-10年,"设计主管,方案设计,广告设计,标识导视设计",6000-10000元,岗位职责： 1.负责复杂设计项目，指导初级设计师2.具备品牌策略思维，熟悉多类型设计风格，能解决技术难点3.能主导项目创意策略的研讨和执行。4.具备独立完成各类项目创意和方案设计相关工作的能力 任职要求: 1.熟练使用photoshop、Coreldraw、illustrator等平面设计软件，5年以上相关行业经验。2.具备良好的沟通、理解能力，善于学习，有理想，有明确的职业目标。3.热爱创意设计...,广告/营销,http://jobs.zhaopin.com/CC255050180J40374707310.htm,20-99人,2025-06-11 14:17:31
平面设计师,武汉,武汉盛世聚鑫演艺发展有限公司,学历不限,1-3年,"PS,AI,CDR,方案设计,广告设计,UI设计",5000-10000元,完善的薪资体系 基本工资+岗位+技能+工龄工资+五险+绩效+补助（话费补助+流量补助）+年底奖金+年休假。包工作餐、包住。有展会 舞美 灯光渲染设计活动相关经验者优先录取熟练掌握 PS CAD CorelDRAW AI CDR等软件优先录取工作内容：1、负责舞美、会展等项目的平面设计工作，包括舞台背景、布局、灯光的设 计等；2、参与项目创意策划讨论会，准确理解设计的风格和定位； 3、配合项目及设计...,租赁服务,http://jobs.zhaopin.com/CC276804530J40611366304.htm,20-99人,2025-04-18 00:00:07
学术期刊图像助理设计师,武汉,曼迪匹艾（武汉）科技服务有限公司,本科,经验不限,"排版设计,PS,英语六级,illustrator,INDESIGN",6000-10000元,一、工作职责1. 编辑与制作学术文章中的图表，确保符合期刊规范，图表清晰、美观；2. 根据专家学者需求，设计科研插图与图像摘要，准确、清晰地呈现学术成果；3. 负责学术文章的格式排版，确保格式符合期刊要求。二、 职位要求1. 本科及以上学历，英语六级；2. 视觉传达设计、数字媒体技术等平面设计相关专业；3. 熟练使用Photoshop、Illustrator、InDesign等相关设计软件；4. ...,新闻/出版,http://jobs.zhaopin.com/CC588665420J40741310309.htm,1000-9999人,2025-06-04 11:04:37
平面设计师,武汉,武汉青怡文化传播有限公司,大专,1-3年,"展板设计,广告设计,网页设计,PPT美化设计,排版设计,UI设计,PS,CDR,AI",5000-10000元·13薪,职位描述1、 多媒体课件制作，PPT美化制作2、 海报、展板设计3、平面图形绘制4、领导交代的其他任务。任职资格1、大专及以上学历，艺术院校或广告设计相关专业毕业有工作经验者优先， 也欢迎优秀应届毕业生2、热爱设计，有较高的艺术设计能力和审美以及平面设计经验；3、熟练运用 photoshop、 CoreldraW、等平面相关设计软件；4、独特创意、对视觉艺术有较深认识，具备较强的平面设计能力5、独...,文化艺术/娱乐,http://jobs.zhaopin.com/CC610849980J40204586701.htm,20-99人,2025-04-01 15:00:11
品牌设计师,武汉,武汉市维元动力机械设备有限公司,大专,3-5年,"C4D,AE,PS,UI设计",7000-9000元,"工作职责；1、互联网营销策划和品牌推广2、网页UI和Banner设计，AE，C4D视频和宣传片制作.3、产品照片和视频拍摄和客户专访4、网站更新迭代和广告，展会等营销设计和输出5、企业形象和文化类产品设计和制作6、产品包装设计基本要求： 1、设计与视觉传达专业，熟练应用Ps, Ae,C4D，有一定的西方审美观 ； 2、学习能力和责任心3、熟练掌握一门外语，英语，俄语，西语4、有品牌营销和客户服务意...",新能源,http://jobs.zhaopin.com/CCL1226519410J40272927907.htm,20-99人,2025-12-24 22:36:44
平面设计师,武汉,武汉雅思创意文化传播有限公司,大专,1-3年,"广告设计,标识导视设计,文旅美陈视觉设计,PS,AI,CDR",7000-9000元,1 配合策划和设计师完成活动方案的视觉部分:主kv、海报、延展物料，氛围合成等2 完成领导布置的设计相关工作。3有活动公司经验的优先工作要求:1有1年工作经验及以上;2 大专及以上学历，设计类专业优先:3 熟练使用各类设计所需软件，如AI、PS、CAD等;4 扎实的设计功底、审美品位及创意能力;5 优秀的沟通协作、执行能力、团队合作意识;6 热爱设计工作，拥有强烈的责任心和自我驱动力。,广告/营销,http://jobs.zhaopin.com/CC216013220J40769948313.htm,20-99人,2025-04-22 10:49:14
平面设计,武汉,湖北斯拓教育管理集团有限公司,本科,1-3年,"广告设计,UI设计,PS,CDR,AE",5000-8000元,岗位职责：1. 根据公司品牌定位和市场需求，进行平面设计、海报设计、产品包装设计等相关工作；2. 设计并制作企业形象宣传资料，包括公司画册、产品样本、宣传册、广告海报、DM单页、PPT、视频等；3. 参与网站界面设计、微信公众号运营和活动策划，提高公司品牌知名度；4.负责公司日常宣传、策划设计制作，针对推广策划，设计广告宣传图。任职要求：1. 本科及以上学历，广告、设计类相关专业，有1-3年以上平...,培训/辅导服务,http://jobs.zhaopin.com/CCL1371060630J40698708104.htm,100-299人,2026-01-10 14:21:14
平面设计,武汉,国创高科实业集团有限公司,本科,5-10年,"VI设计,方案设计,广告设计",6000-8000元,1．品牌与视觉规范：负责公司VI系统的建立、导入与维护，统一商场/项目视觉形象；制定并监督执行商户视觉呈现标准，提升整体氛围与形象。 2.物料设计与制作：完成招商手册、导购手册、VIP手册、海报、招贴、卡券、报纸广告等从创意到落地的全流程设计与提报/制作/安装/验收；统筹活动美陈装饰方案与执行。 3.线上线下传播：参与线上页面与微信公众号/小红书等平台的图文排版与视觉输出；部分岗位需配合短视频的策...,房地产开发,http://jobs.zhaopin.com/CC194253810J40854595713.htm,500-999人,2026-01-09 15:15:30
游戏UI设计师双休,武汉,武汉玄慈网络科技有限公司,大专,经验不限,"端游,页游,手游,独立游戏,云游戏,暗黑系,仙侠风,写实,二次元,Q版,多风格擅长",5000-8000元,一、岗位要求：1、了解游戏行业，对信息流有一定认知；2、负责游戏中所有界面、按键、图标、道具、字体的相关设计；3、热爱创作与设计，喜欢游戏与动漫想获得一份有长远发展、稳定、有晋升空间的工作；4、思维活跃，具有良好的团队合作能力，沟通能力和学习能力；5、学习能力强，工作热情高，富有责任感，工作认真、细致、敬业、责任心；6、对设计有自己独到的见解，敢于创新。二、工作职责：1、协助设计师完成游戏界面（U...,游戏,http://jobs.zhaopin.com/CCL1473916040J40519506112.htm,20-99人,2026-01-09 01:31:48
UI设计师,武汉,武汉亦创智联信息技术有限公司,大专,1-3年,"移动端,网页端,客户端,界面设计",6000-8000元,一、岗位职责1、负责公司形象视觉、PC端网站及移动端APP的全流程UI设计，含布局、色彩、图标设计及交互优化，保障风格统一适配产品定位；2、协同产品、研发团队，精准转化需求为视觉方案，跟进设计落地还原，把控输出质量；3、结合客户需求、用户反馈及行业趋势，优化产品视觉与交互，提升用户体验；4、负责市场活动宣传物料（海报、画册等）的设计工作；5、承担官网、公众号日常运营维护，助力知识产权体系建设；6、...,计算机软件,http://jobs.zhaopin.com/CC456457530J40825815909.htm,100-299人,2026-01-08 12:00:56
平面设计,武汉,湖北文泰文化传媒有限公司,学历不限,经验不限,"排版设计,包装设计,图书排版,美编设计,ID,PS,方正",4000-8000元,岗位职责：1、根据要求，完成杂志、书籍等出版物的版式设计；2、能熟练运用视觉元素，对图片有较强的审美能力，能根据刊物定位创新版面风格；3、熟练使用PS、ID、AI、方正飞腾等设计排版软件；4、根据要求完成校样修改和版面调整；5、熟悉InDesign软件优先录用 工作时间： 8：30-12：00；13：30-17：30；周末双休，法定节假日同步放假。 职位福利：绩效奖金、带薪年假、员工旅游、节日福利...,新闻/出版,http://jobs.zhaopin.com/CCL1222518830J40734416806.htm,20-99人,2026-01-06 17:58:49
新媒体设计师,武汉,湖北机场文化产业发展有限公司,大专,1-3年,,6000-8000元,一、岗位概述负责天河机场全平台新媒体视觉内容创作与优化，输出符合品牌调性、适配用户喜好的图文及短视频素材，助力提升账号曝光、用户互动与品牌辨识度，适配多平台内容快节奏产出需求。二、岗位职责1．主导微信公众号、抖音、小红书等新媒体平台视觉设计，独立完成海报、封面图、动效素材、H5等内容创作，保障输出质量与品牌风格统一；2．参与新媒体内容策划，结合平台热点、用户需求及产品卖点，提供创意视觉方案，提升内...,会议/展览,http://jobs.zhaopin.com/CCL1478145330J40818757101.htm,20-99人,2026-01-06 12:02:23
全案视觉支持岗,武汉,武汉曜华激光科技有限公司,大专,1-3年,,5000-8000元,岗位核心价值：负责公司全维度视觉与文案输出，涵盖光伏生产线、检测设备等核心产品的品牌宣传物料打造，助力市场推广、展会展示及产品营销，是品牌形象输出的关键岗位！工作内容：视觉设计：负责品牌平面物料设计（海报、宣传单页、产品手册等）、企业画册全案设计、展会相关视觉设计（展台布局规划、背景板、展会宣传品等）；影音创作：承担公司产品及品牌活动的照片 / 视频拍摄，完成视频后期剪辑（宣传片、短视频、展会视频...,仪器仪表制造,http://jobs.zhaopin.com/CC676210920J40895547902.htm,20-99人,2026-01-05 17:22:24
平面设计师！！企划部设计师岗位~！！,武汉,湖北天下汇通医药有限公司,大专,1-3年,"广告设计,包装设计,PS,AI,平面设计",5000-8000元,公司较为重视企划部的发展，所以非常希望可以找到长期合作的伙伴。公司目前团队100＋，主要是做连锁药店及直营药店的，做的是自己品牌的中西药，有自己的工厂，电商团队以及各省的稳定合作商。目前做的软件也已经到测试阶段准备上架，处于一个稳步上升的阶段。 （一）品牌视觉呈现 1. 负责品牌相关平面物料设计，涵盖邀请函、海报、宣传册、活动物料、品牌VI 延展等，精准传递品牌价值与理念，适配线上线下传播场景。 ...,医药批发/零售,http://jobs.zhaopin.com/CC880863240J40914023115.htm,100-299人,2026-01-04 14:37:29
美工平面设计,武汉,武汉颢添实业有限公司,大专,1-3年,"PS,AI,美工",5000-8000元,岗位职责1. 跟进公司直播全流程，提炼核心卖点与视觉元素，独立完成直播相关宣传海报的创意设计与制作。2. 根据直播内容及营销需求，剪辑制作短视频、直播切片等物料，适配各平台推广传播。3. 配合文案及营销团队，完成海报文案排版、短视频字幕制作等工作，确保宣传物料风格统一。4. 参与直播前后的营销推广执行，协助完成物料投放与效果跟踪，根据数据反馈优化设计及剪辑内容。5. 负责设计、剪辑素材的分类归档，...,日化,http://jobs.zhaopin.com/CC567427930J40867091603.htm,20-99人,2025-12-31 16:20:09
游戏ui界面设计【腾讯外派+双休+五险一金】,武汉,软通动力信息技术(集团)股份有限公司,学历不限,3-5年,游戏模型经验,7000-8000元,职责：1，负责游戏系统界面设计，能够高效产出符合项目美术风格的设计效果图，对设计规范和规则有较强的意识；2，负责游戏的运营活动界面设计，能够驾驭不同的风格包装设计；3，具备出众的审美能力，能迅速分析视觉中的优缺点并给出精准的优化反馈。4，与策划、交互、还原、开发、测试人员等上下游职位密切配合，实现界面设计效果，跟进界面还原，对开发节点和界面设计品质负责。5，具备全局设计思维和信息同步意识，善于沟通...,互联网,http://jobs.zhaopin.com/CC000544460J40771271016.htm,10000人以上,2025-12-31 01:45:13
UI设计师,武汉,武汉又又科技有限公司,大专,1-3年,,5000-8000元,【工作内容】1、负责公司各项目APP移动端界面设计（ios、安卓、兼容pad端）2、完成产品原型到高保真界面设计，熟练输出切图3、配合开发同事完成设计稿对齐及适配验收4、持续优化产品交互ui体验，提升用户可用性 【岗位要求】1、1-3 年 UI 设计经验，社交类、游戏直播类、AI教育相关产品经验者优先；2、大专及以上学历，艺术设计、美术、视觉传达等相关专业；3、熟练使用 Figma / Sketc...,在线教育,http://jobs.zhaopin.com/CCL1466017010J40817699501.htm,300-499人,2025-12-30 17:57:35
