职位,城市,公司,学历,经验,技能,薪资,工作描述,行业,职位URL,公司规模,发布时间,薪资_最小值,薪资_最大值,年薪月数
电商运营专员,武汉,东风汽车,本科,3-5年,,15000-25000,岗位职责:1.负责官方商城商品上下架、推广、营销等日常运作，有汽车精品衍生品商城运营经验。2.按照商城业务流程，负责日常交易订单的维护、审核、发运及售后工单处理；协调相关配合部门确保按照规定完成订单处理工作。3.完成月度销售任务和目标，制定相应活动玩法方案确保任务达成。4.分析运营数据（营销数据、交易数据、客户数据、商品数据、库存数据等），并及时提出营销改进措施和执行方案。5.与开发同事对接，对上...,汽车研发/制造,http://jobs.zhaopin.com/CC679989880J40827300505.htm,10000人以上,2025-11-18 16:10:12,15000.0,25000.0,12.0
商场营运经理,武汉,武汉大陆桥物业经营管理有限公司,本科,3-5年,"销售运营,新媒体运营,活动运营",12000-20000,1、负责商场定位和条件制定运营管理相关工作；2、负责公司员工、商场从业人员的业务培训，不断强化和提高员工和从业人员的素质；3、负责对各项业务的洽谈、签约工作进行管理，协调、指导、监督、审核各项业务合同；4、负责现场执行标准的体系化建设，带动服务升级；参与商场装修提档升级等重点工作；5、做好情报收集和经营分析工作，掌握行业发展等相关信息，及时呈报领导。任职要求1、35岁以内，本科以上学历，具有3年以...,物业管理,http://jobs.zhaopin.com/CC408849910J40782763201.htm,300-499人,2026-01-08 00:00:02,12000.0,20000.0,12.0
企微运营主管,武汉,泰康在线,大专,1-3年,,11000-20000,公司介绍： 加入泰康在线，与我们共筑健康未来 在这个时代，我们都是追梦人，为了理想，为了生活，不断前行。泰康在线，作为互联网健康保障的领航者，我们不仅提供专业的保险服务，更是致力于为每一位员工打造一个实现自我价值的舞台。 我们在这里，真诚地邀请你加入我们的团队。无论你是资深的行业专家，还是充满活力的新鲜血液，泰康在线都期待你的加入。我们相信，每一位员工的成长与进步，都是公司发展的基石。 在泰康在线...,互联网,http://jobs.zhaopin.com/CC219857230J40793525501.htm,500-999人,2026-01-03 00:08:01,11000.0,20000.0,12.0
运营管理,武汉,东风汽车,本科,5-10年,运营管理,15000-25000,岗位职责:1、负责开展事业环境分析，编制政治经济，政策法规，技术趋势，市场用户，竞争格局分析报告；2、参与客户洞察活动，根据事业环境分析，组织设定公司中期发展远景及战略目标；3、负责组织公司MTP及年度事业计划方针系统图、方针书、课题解释等具体编制工作；4、负责根据战略目标，组织拟定各业务领域事业目标，统筹事业计划、预算、绩效一体化管理，推动绩效结果运用；5、负责导入方针管理方法论，拟定事业计划管...,汽车研发/制造,http://jobs.zhaopin.com/CC679989880J40806043605.htm,10000人以上,2025-08-25 10:56:30,15000.0,25000.0,12.0
智车联门店运营顾问--华中 Auto Expert Consultant,武汉,马石油国际润滑油(中国)有限公司,本科,3-5年,,10000-20000,Workplace：Homebase 主要岗位职责:1) 智车联门店评估与部署按照智车联项目标准，完成潜在智车联门店的选择、评估和申请的整体流程。完成区域网络发展目标的达成。（准确正确地传达项目标准和信息）2) 智车联操作标准化确保区域智车联门店执行智车联项目团队提供的标准化项目促进和演示3) 智车联门店的参观和管理定期门店拜访，准备定期业务审核及相关优化方案制定，以及后续跟踪。4) 门店商业方案...,石油/石化,http://jobs.zhaopin.com/CCL1378351150J40905524015.htm,300-499人,2025-12-23 14:22:54,10000.0,20000.0,13.0
运营经理（B2C）,武汉,安徽省先锋制药有限公司,本科,5-10年,"淘宝/天猫,京东,抖音小店,经理",15000-20000,【岗位职责】1、负责天猫、京东平台医药电商项目的整体运营（含O2O业务），对运营数据负责(GMV、转化率、客单价等），确保各项业务指标达成； 2、结合市场整体行情和行业数据，对标竞品输出产品策路、促销策略、营销策略、推广策略组合分析研究，通过有效措施，有效整合内外部资源，根据平台特点和政策从营销和消费者心理入手，制定短中长期增长策略； 3、优化产品在平台的管理，通过拉新、促活、召回等手段提升用户价...,医药制造,http://jobs.zhaopin.com/CC157827110J40865486203.htm,300-499人,2025-12-23 10:56:42,15000.0,20000.0,12.0
运营管理,武汉,东风汽车,本科,3-5年,运营管理,12000-22000,岗位职责：1.负责提出公司KPI指标/指标值开发方案2.负责制定各部门年度经营目标（KPI），并组织发布年度经营计划；3.负责运营过程管理及监控，编制运营报告，召开经营工作会，并督办落实；4.负责各部门月度/年度绩效（KPI）绩效辅导及评价；5.负责组织运营周度、月度、年度会议；6.负责政府/集团等调研报告、企业年报编制；7.负责组织绩效管理标准的运行及完善。岗位要求：1.行业经历：3年以上2.项...,汽车研发/制造,http://jobs.zhaopin.com/CC679989880J40834352305.htm,10000人以上,2026-01-04 11:20:23,12000.0,22000.0,13.0
京东电商运营,武汉,武汉知易而行商贸有限公司,大专,3-5年,"京东,经理,店长",10000-20000,工作内容：1、负责公司京东店铺的整体运营计划、营销、推广等2、负责制定店铺的销售、运营工作计划，并且根据计划完成销售目标3、 负责店铺日常数据整理、分析，根据数据情况调整运营、推广计划4、根据京东官方的营销节点及及假日策划店铺营销活动，及整体活动的跟进、效果分析。5、能根据网络市场不定期策划商城营销活动及相应的活动广告。任职资格：1、有京东3年以上经验，饰品类，文创类目优先；2、需要有实际操作运营...,电子商务,http://jobs.zhaopin.com/CCL1373949400J40846022113.htm,20-99人,2025-12-22 10:09:25,10000.0,20000.0,12.0
高德商家运维 早九晚六 固定双休,武汉,上海藕荷信息科技有限公司,大专,1-3年,"商家BD,休闲娱乐",10000-20000,1. 监控商家GMV数据，通过活动推送、流量扶持等动作助力商家达成目标；结合美食、休娱等行业特性设计团购组合，优化门店货架展示，提升CTR与CVR。2. 指导商家完成门店装修、团购产品上线与优化，结合平台用户习惯策划高转化活动，推动商家参与周末特惠、城市榜单等营销活动。3. 分析商家曝光、点击、转化等运营数据，制定改进方案；针对高潜力商家定制个性化运营计划，参与平台新功能测试并优化商家端使用体验。...,IT服务,http://jobs.zhaopin.com/CC810733640J40849975313.htm,1000-9999人,2025-12-21 21:55:55,10000.0,20000.0,13.0
运营管理-奕派科技,武汉,东风汽车,本科,经验不限,,12000-22000,工作职责1.负责提出公司KPI指标/指标值开发方案 2.负责制定各部门年度经营目标(KPI)，并组织发布年度经营计划; 3.负责运营过程管理及监控，编制运营报告，召开经营工作会，并督办落实; 4.负责各部门月度/年度绩效(KPI)绩效辅导及评价; 5.负责组织运营周度、月度、年度会议； 6.负责政府/集团等调研报告、企业年报编制; 7.负责组织绩效管理标准的运行及完善。 任职要求 1.行业经历:3...,汽车研发/制造,http://jobs.zhaopin.com/CC679989880J40831946305.htm,10000人以上,2025-12-29 15:28:20,12000.0,22000.0,13.0
运营部负责人,武汉,武汉市硚口区人民政府国有资产监督管理局,本科,5-10年,产业园区运营,10000-20000,（武汉硚口区市属国企平台，底薪+提成）岗位职责：全面负责产业园运营管理工作，包括招商推广、企业服务、资产运营、安全管理等。制定并实施园区运营发展规划和年度工作计划。建立和完善园区运营管理体系和服务标准。拓展招商渠道，维护政府关系和客户关系。负责园区运营成本控制和效益提升。任职资格：年龄32-45周岁，统招本科及以上学历，工商管理、市场营销、产业经济、工程管理、园区运营等相关专业优先。具有5年及以上...,互联网,http://jobs.zhaopin.com/CCL1318355140J40863126903.htm,500-999人,2025-12-18 18:44:11,10000.0,20000.0,12.0
商管运营高级总监,武汉,火凤(湖北)集团有限公司,大专,10年以上,"用户运营,社群运营,销售运营,toB",12000-20000,一、岗位职责1、全面制定并执行公司写字楼资产的商业运营战略与年度经营目标。2、主导市场分析、租金策略及全渠道招商，确保高出租率与租金收益。3、建立高标准运营与物业管理体系，并对现场服务品质、安全及设施进行督导。4、建立核心租户深度服务机制，通过运营优化与增值服务提升资产价值。5、搭建并领导专业团队，负责全面的预算管理、成本控制与财务分析。6、建立应急预案体系，主导处理重大运营危机，确保业务合法合规...,企业服务,http://jobs.zhaopin.com/CCL1475497420J40820574009.htm,300-499人,2025-12-18 13:58:22,12000.0,20000.0,12.0
国内目的地/商家运营（武汉）,武汉,去哪儿网（Qunar.com）,本科,1-3年,,10000-20000,岗位职责：1、根据目的地业务特点进行商家运营体系的搭建，制定平台与商户合作的高质策略并落地执行；2、定期统计和分析商家运营数据（GMV、订单量、流量、转化、商品结构等），寻找问题点，输出优化运营方案，对结果负责；3、建立运营数据分析机制，分析商户行为（服务质量/资源优劣势等），保证运营效果，实现与产品、研发部门的良好互动；4、有一定渠道拓展经验，可以帮助平台招募新的高质量合作商家。 任职要求：1、...,互联网,http://jobs.zhaopin.com/CC143301290J40830195505.htm,10000人以上,2025-12-18 09:55:00,10000.0,20000.0,13.0
商品经理,武汉,武汉乔万成商贸有限公司,大专,5-10年,,10000-20000,岗位职责1、拟定商品运营计划，实现销售及存货目标；2、规划各季商品结构，并制定各区域商品上市计划；3、根据产品上市销售量追单、调配，并组织实施促销方案；4、跟踪、分析销售数据，对现货、期货的销售提出建议、库存状况、货品促销计划提出建议；5、制定公司整体及终端单店货品管理要求并落地。任职资格1、大专及以上学历，5年以上相关工作经验；2、擅长商品结构规划，熟悉进销存测算与数据分析；3、熟悉电脑操作，能...,零售/批发,http://jobs.zhaopin.com/CCL1310726310J40553660106.htm,300-499人,2025-12-16 09:54:50,10000.0,20000.0,12.0
跨境电商运营主管,武汉,武汉瀛笙电子商务有限公司,大专,1-3年,"亚马逊,速卖通,TEMU",15000-20000,1.指导跨境电商所负责平台专员工作、对运营团队进行定期培训；2.负责管理跨境营销团队，统筹开展在跨境各站点的运营工作，包括各类营销方案的策划及实施；3.针对不同的推广渠道，开展营销活动，协调各方面资源配合执行，对推广商品具备有效的判断，根据推广效果提出调整建议；4.负责制定营销计划并领导团队进行高效运作，包括客户需求分析、listing优化、流量分析等，带领整个团队实现业绩目标；5.负责速卖通营销...,电子商务,http://jobs.zhaopin.com/CC871350700J40673447006.htm,1000-9999人,2025-12-11 16:25:26,15000.0,20000.0,12.0
医药电商经理(J10174),武汉,湖北红珊瑚医药有限公司,本科,经验不限,"店长,淘宝/天猫,京东,拼多多,经理",15000-20000,岗位职责: 1、协助事业部总经理对各电商平台进行运营管理、推广工作； 2、负责医药电商平台（B2C）店铺的整体运营，制定年度/季度销售目标、利润目标及用户增长策略，并推动落地执行。 3、分析行业趋势、竞品动态及用户需求，优化商品结构、定价策略及营销方案，提升市场竞争力。 4、统筹线上线下（O2O）业务协同，优化服务体验。 5、根据店铺整体规划，制定营销活动策划，并对效果负责。 6、管理运营团队，制...,医药制造,http://jobs.zhaopin.com/CC398648430J40905303808.htm,1000-9999人,2025-12-09 11:26:41,15000.0,20000.0,12.0
旅游康养旅居运营经理,武汉,湖北佰穗养老科技有限公司,大专,5-10年,"toC,连锁酒店管理经验",10000-20000,岗位职责：1、负责旅居项目的整体规划与执行，能负责中长期项目周期的详细工作计划及目标。2、统筹项目运营管理，包括住宿安排、客房管理、在地活动策划、客户服务标准制定及优化，具有建立服务标准和体系的能力（重要）。3、协调内外部资源，对接公司各部门及酒店、景区等合作方，确保项目顺利推进。4、监控项目进度与预算，及时调整策略以应对突发问题，确保项目按期高质量交付。5、收集客户反馈，分析运营数据，形成结项报...,居民服务,http://jobs.zhaopin.com/CCL1318275110J40861420903.htm,300-499人,2025-12-05 10:17:43,10000.0,20000.0,12.0
武汉青年连锁公寓运营总监,武汉,武汉市天辰资产经营管理有限公司,本科,1-3年,"销售运营,产品运营,用户运营",15000-20000,一、基础任职要求 学历背景：本科及以上学历，酒店管理、房地产经营、工商管理等相关专业优先。 工作经验：5 年以上公寓 / 酒店 / 长租公寓运营管理经验，其中至少 2 年以上同岗位（运营经理 / 总监）管理经验。 行业认知：熟悉公寓行业政策法规（如租赁政策、消防安全）、市场动态及竞争对手情况，了解公寓选址、装修、招租全流程。二、核心能力要求 这是判断候选人能否胜任管理职责的关键，直接关联业务成果。...,物业管理,http://jobs.zhaopin.com/CC330481630J40804037301.htm,20-99人,2025-12-02 15:14:24,15000.0,20000.0,12.0
电商负责人（医药赛道）,武汉,湖北润民运营管理有限公司,本科,3-5年,"淘宝/天猫,抖音小店",10000-20000,核心职责1. 统筹公司医药产品线上销售全链路，制定电商平台（天猫、京东、拼多多、抖音健康等）运营策略与销售目标并落地达成；2. 负责电商平台入驻、店铺搭建、产品上架优化（含合规宣传、详情页打磨）、活动策划（大促、日常营销）及流量转化管理；3. 监控电商数据（销量、流量、转化率、客单价等），分析市场趋势与竞品动态，及时调整运营策略；4. 对接平台合规审核、医药资质备案等相关工作，确保线上销售符合《药...,医药制造,http://jobs.zhaopin.com/CCL1460030400J40825592914.htm,20-99人,2025-11-27 15:23:17,10000.0,20000.0,13.0
亚马逊运营主管/经理,武汉,武汉博为欣宇科技有限公司,本科,3-5年,"亚马逊,亚马逊运营,跨境电商",10000-20000,1、销售目标：结合公司战略目标，确定本团队年/季/月度销售目标，制定销售计划并落地完成。2、团队管理：优化团队管理流程，负责战队成员专业技能和运营手段的培养，结合跨境电商的特性、并根据公司实际情况与相关部门一起制定培训计划、规范和流程。培养优秀梯队人才，控制团队核心员工流失率不超过20%，打造一支有战斗力、有凝聚力的团队。3、带领运营团队制定品牌推广计划以及推广活动，并实施执行。4、及时掌握并获取...,电子商务,http://jobs.zhaopin.com/CCL1475153070J40803752501.htm,20-99人,2025-11-26 00:00:01,10000.0,20000.0,13.0
亚马逊运营主管,武汉,南阳唯时贸易有限公司,大专,3-5年,"亚马逊,精品运营,英语",15000-20000,"工作内容：1、负责部门运营管理制度建设，并对运营团队进行业务培训、制定清晰的销售策略和目标，并带领团队积极执行，确保达成月度、季度及年度销售任务。2、负责运营跨境电商平台，关注平台规则变化，管理和把控账号风险，处理突发事件3、协助运营团队和进行跨部门沟通，确保运营工作的顺利开展。4、完善运营团队的工作流程，提高工作效率,任职资格：1、需要300人以上或大型上市公司工作背景，4-5年以上亚马逊平台运...",电子商务,http://jobs.zhaopin.com/CC382757180J40816394305.htm,100-299人,2025-11-18 16:08:02,15000.0,20000.0,12.0
类目运营（base长沙）,武汉,拼多多,本科,3-5年,"品类结构搭建经验,电商品类",10000-20000,岗位职责1. 负责平台标品或非标品品类规划和商品企划，优化供给侧；2. 梳理相关行业商品的特征，实现商品结构层次的优化提升和商品丰富度提升，持续优化货品结构、sku效率，促进爆品、潜爆品开发；3. 熟悉平台玩法，对接各业务场景进行资源整合，通过商品沉淀提升用户关系和用户粘性，对品类各项运营指标进行监控和分析，对大盘的流量转化效能及货品交易规模负责；4. 根据业务策略，并结合行业特点及商家能力，在卖...,互联网,http://jobs.zhaopin.com/CC625242220J40820839310.htm,1000-9999人,2025-11-14 13:59:35,10000.0,20000.0,12.0
商家运营,武汉,深圳市法本信息技术股份有限公司,大专,1-3年,电话销售,10000-20000,福利待遇 入职购买社保公积金，试用期薪资不打折。 上班时间：9:30-19:00；双休。 薪资： 无责4310底薪+餐补20/天+400交通补助+开单奖金（平均薪资13K-30K） 1、通过电话方式负责拓展及维护全国美食商家入驻地图APP，帮助商家做好经营，助力消费者发现好店和提升消费者生活服务体验； 2、协调和整合内外部资源，针对不同行业商家制定推广营销方案及运营策略，达成公司下达的销售目标 3...,计算机软件,http://jobs.zhaopin.com/CC385622410J40730697206.htm,1000-9999人,2025-11-07 10:18:35,10000.0,20000.0,12.0
电商运营总监,武汉,武汉市山水印象文化传播有限公司,大专,5-10年,"淘宝/天猫,拼多多,抖音小店,经理",10000-20000,岗位职责： 1、负责线上各平台(淘宝、天猫、京东、拼多多等)的运营管理； 2、制定店铺整体运营及推广策略，提高店铺点击率、浏览量和转化率； 3、完成店铺销售目标，提供分析意见及相关解决方案； 4、熟练运用各种推广工具制定推广方案并完成团队业绩目标； 5、分析流量数据，协调美工对店铺页面进行调整改版等； 6、熟悉平台各个岗位职责，统筹安排好各岗位人员工作； 7、有效激励团队，完成公司制定的各项业务指...,游戏,http://jobs.zhaopin.com/CCL1494183520J40774743207.htm,20-99人,2025-10-24 15:45:38,10000.0,20000.0,12.0
商家运营副总监（美团口腔）,武汉,咿呀英博(湖北)控股集团有限公司,大专,5-10年,"美团,经理,口腔",15000-20000,一、基础资质要求学历与专业：大专及以上学历，市场营销、计算机、医疗管理或相关专业优先。行业经验：需 2 年以上美团/大众点评等平台运营经验，口腔医疗行业背景为硬性要求，1- 3 年以上连锁医疗运营管理经验。二、核心能力要求平台运营能力：精通美团店铺管理（产品上架、价格策略、活动策划）及平台规则；熟练运用推广工具提升曝光率与转化率，对 GMV、复购率等关键指标负责。数据分析能力：需通过数据诊断店铺问...,医院,http://jobs.zhaopin.com/CCL1465558090J40726272106.htm,1000-9999人,2025-10-20 14:50:24,15000.0,20000.0,12.0
招商运营总监（商业运营公司）,武汉,武汉日上建设工程有限公司,本科,10年以上,商业运营,12000-20000,岗位职责：1. 负责招商的整体项目工作的定位、调研和商业策划；2.根据项目情况， 制定招商策略、项目年度租金预算目标，并及时根据预算完成情况调整招商策略方案；3. 拟定项目招商品牌落位及租赁政策，推动团队实现招商目标，完成招商各项指标；4. 开发并维护好项目品牌资源，维护与客户长期良好的合作关系，提升公司品牌形象；5. 组织市场调研，拓展招商团队工作思路及视野，并进行业务创新，提升项目招商竞争力；...,工程施工,http://jobs.zhaopin.com/CC859276460J40826673212.htm,100-299人,2025-09-22 00:00:21,12000.0,20000.0,12.0
运营管理主管,武汉,武汉泽润欣盈商贸有限公司,大专,3-5年,"电商运营,用户运营,社群运营,淘宝,京东,toC,抖音,小红书,微信公众号",10000-20000,岗位内容：1. 负责店铺日常运营的维护和管理，策划店铺的促销活动及推广，有效提升店铺及产品的访问量；2. 负责爆款运营策略的制定和规划；3. 优化广告 流量的投放，提升投放ROI；4. 通过数据分析发现新的增长点和优化点，提出优化建议，拆解KPI指标，提升团队专业度和协作率。任职要求：1. 具有优秀的领导力和团队管理能力，能够激励和引导下属开展工作；2. 具备三年以上电商运营团队管理经验；3. 精...,电子商务,http://jobs.zhaopin.com/CCL1460070510J40707849906.htm,20-99人,2025-09-11 00:28:20,10000.0,20000.0,12.0
金融运营经理,武汉,光谷信息,本科,5-10年,"销售运营,商家运营,活动运营,toB",15000-20000,岗位职责：1、定期进行政策研究及行业优势挖掘，结合业务目标及解决方案，制定有效的市场营销策略2、负责执行支付宝微信及其他第三方支付生态服务商政策，整合内外部资源，确保支付业务产品和平台营销推广方案落地，并对活动效果进行评估复盘，优化后续活动方案。3、能够设计支付商业模型（如SaaS化服务、分润机制），能独立完成创新业务孵化及落地。4、协助部门负责人拆解业务目标并跨部门协调资源保障部门任务目标达成。...,计算机软件,http://jobs.zhaopin.com/CC260398620J40801418814.htm,500-999人,2025-09-10 11:44:12,15000.0,20000.0,16.0
新媒体运营总监,武汉,武汉市尚学爱童教育咨询有限公司,学历不限,1-3年,"新媒体运营,toC,用户运营",10000-20000,岗位名称：新媒体运营总监（中小学教培方向）薪资范围：10000-20000（具体面议）福利待遇：寒暑假、五险、餐补、定期团建、年终分红、通讯补贴等工作地点：武汉市硚口区武胜路江山如画三期岗位职责：1. 战略规划- 制定机构全年线上线下运营策略，统筹校区活动、招生推广及品牌传播计划- 关注K12教育政策动态，针对性调整运营方向（如双减政策下的合规创新）2. 活动策划与执行- 策划节日促销、家长会等获...,培训/辅导服务,http://jobs.zhaopin.com/CCL1409287230J40786670007.htm,20-99人,2025-08-22 18:04:04,10000.0,20000.0,12.0
电商运营主管/总监【淘系/拼多多/抖音】,武汉,武汉火蝠电子商务有限公司,高中,3-5年,电商运营,15000-20000,岗位职责：1、负责线上各平台(淘宝、天猫、京东、苏宁易购，拼多多等)的运营管理；2、制定店铺整体运营及推广策略，提高店铺点击率、浏览量和转化率；3、完成店铺销售目标，提供分析意见及相关解决方案；4、熟练运用各种推广工具制定推广方案并完成团队业绩目标；5、分析流量数据，协调美工对店铺页面进行调整改版等； 6、熟悉平台各个岗位职责，统筹安排好各岗位人员工作；7、有效激励团队，完成公司制定的各项业务指标...,电子商务,http://jobs.zhaopin.com/CC698947920J40761115803.htm,500-999人,2025-06-23 18:02:33,15000.0,20000.0,12.0
银行支付业务运营经理,武汉,光谷信息,本科,5-10年,"商家运营,toB,toG",15000-20000,岗位职责：1、定期进行政策研究及行业优势挖掘，结合业务目标及解决方案，制定有效的市场营销策略2、负责执行支付宝微信及其他第三方支付生态服务商政策，整合内外部资源，确保支付业务产品和平台营销推广方案落地，并对活动效果进行评估复盘，优化后续活动方案。3、能够设计支付商业模型（如SaaS化服务、分润机制），能独立完成创新业务孵化及落地。4、协助部门负责人拆解业务目标并跨部门协调资源保障部门任务目标达成。...,计算机软件,http://jobs.zhaopin.com/CC260398620J40793847814.htm,500-999人,2025-08-21 11:12:05,15000.0,20000.0,16.0
