职位,城市,公司,学历,经验,技能,薪资,工作描述,行业,职位URL,公司规模,发布时间
财务共享中心总经理助理,南京,中燃宏盈南京商务服务有限公司,本科,5-10年,"上市企业,集团公司",1.8-3万,岗位职责：1、承接集团财务的发展战略，参与制定共享服务中心整体的工作目标和实施规划，制定管辖部室的年度工作计划，并管理目标落地；2、按照业务需要参与确定财务共享服务中心的组织结构和各岗位人选，规划管辖部室人员的组织建设包括招聘、团建等工作；3、指导和监督管辖部室人员的日常工作，对各岗位业绩考核提出评价意见；4、参与组织和规划财务共享服务中心人员的培训、激励和发展工作，不断提升团队竞争力；5、负责管...,电力/水利/热力/燃气,http://jobs.zhaopin.com/CCL1464765820J40779536313.htm,300-499人,2025-05-19 15:06:47
大健康产品经理,南京,南京亿科光医学研究院有限公司,本科,5-10年,,1.6-3万,包装全流程管理主导化妆品包装策略制定，结合品牌调性、用户需求及市场趋势，完成包装概念设计、材质选择、工艺优化及落地生产全周期管理。分析竞品包装设计逻辑与成本结构，建立差异化包装方案，提升产品货架竞争力。跨部门协同创新联动工业设计师、结构工程师、供应链团队，确保包装设计兼具美学价值与功能性（如密封性、便携性、环保性）。协同市场部策划包装卖点，将设计语言转化为消费者可感知的营销话术（如环保材质、开箱仪...,医疗设备/器械,http://jobs.zhaopin.com/CCL1218095690J40804963515.htm,100-299人,2025-05-06 14:36:32
证券智能运营岗（需通过证从和基金从业考试）,南京,广发证券股份有限公司南京泰山路证券营业部,硕士,1-3年,"产品迭代,用户增长,活动策划",2-3万,1、负责智能运营和数据分析工作，包括需求规划、业务策划与运营管理、数据跟踪分析与用户增长等服务运营工作。2、资产包体系建设与分析工作，通过数据建模开展资产包分析和效果评估，撰写分析报告。任职要求1、硕士及以上学历，计算机、信息系统管理、金融、统计分析等相关专业；。2、具备商业数据分析或统计分析专业为主，能够熟练掌握建模及数据分析工具使用，具有一定行业经验或在金融、银行或保险等金融机构有相关运营经验...,证券/期货,http://jobs.zhaopin.com/CCL1487963640J40682393011.htm,10000人以上,2024-12-26 10:36:56
储能产品经理,南京,江苏安时商用储能系统有限公司,本科,5-10年,"商业化产品,储能系统集成,储能柜",1.5-3万,一、岗位职责： 1、分析市场需求和竞争对手，为产品的定位和规划提供数据与方案支持。 2、 制定储能产品的整体规划和发展战略，包括产品定位、特性和功能等。 3、与研发团队合作，参与产品设计和开发过程，确保产品满足市场与公司需求。 4、制定储能产品的定价策略，结合成本、市场需求和竞争情况进行定价。 5、策划和执行储能产品的推广活动，包括广告、展会和促销活动等。 6、管理产品销售渠道，与合作伙伴合作，拓...,通用设备制造,http://jobs.zhaopin.com/CCL1416879130J40636694915.htm,20-99人,2024-06-15 01:31:13
PDA产品销售,南京,东集技术股份有限公司,大专,5-10年,"区域销售,渠道销售",1.5-2.9万,岗位内容：1. 开展销售活动，完成销售任务，实现销售目标；2. 建立健全客户档案、维护老客户及发掘新客户；3. 组织制定整个销售过程（销售计划、销售方案、销售数据分析等）；4. 编制产品报价、合同和各类商务文件，协助客户完成合同签订。任职要求：1. 具备良好的沟通表达能力，擅长与人交往，有亲和力；2. 有较强的学习能力，敢于挑战自我；3. 工作态度认真负责，能承受一定的工作压力；4. 关注职业发展...,物联网,http://jobs.zhaopin.com/CC120918330J40746384106.htm,500-999人,2026-01-08 18:35:44
产品负责人-1,南京,江苏鑫玉安传感技术有限公司,本科,5-10年,,2-2.9万,薪资：25万-35万工作地：江苏-南京-玄武区-苜蓿园岗位描述：1、负责相关项目总体论证、方案设计，协助总指挥对接用户需求等； 2、确定相关项目技术实现路线、技术架构等，指导具体实现； 3、负责设备相关项目技术攻关及实现。岗位要求1、本科及以上学历； 2、通信、电子、计算机等相关专业； 3、工作年限5年及以上,计算机软件,http://jobs.zhaopin.com/CCL1285062370J40736452006.htm,20人以下,2025-12-16 01:16:01
AI产品经理（电力）,南京,东华软件股份公司,本科,3-5年,,面议,岗位职责1、负责电力行业大数据挖掘、人工智能相关产品整体规划、需求分析、产品设计；2、掌握常见的算法模型，能熟练运用回归、分类、神经网络等模型解决业务场景问题；3、与技术、业务方沟通协作，推动产品开发、发布与运营；4、能充分利用数据，分析数据特征，提炼应用场景，对产品进行持续优化和改进；5、负责产品售前支持、需求调研和竞品分析；跟踪业界最新进展，持续提升算法和模型竞争力。任职要求1、数学、统计学、...,计算机软件,http://jobs.zhaopin.com/CC193399810J40545477407.htm,1000-9999人,2026-01-11 00:46:41
产品经理,南京,软通动力信息技术(集团)股份有限公司,本科,1-3年,"产品规划,数据分析,软件产品",1.4-2.8万,岗位1【用户产品方向】1. 负责短视频SDK-双列场景的用户产品工作，有数据分析能力，熟练AB测试，做过产品版本迭代规划及发布工作2.负责双列SDK自身的功能优化和性能提升，不断拓展和完善 SDK 的功能模块；3. 能独立完成产品需求梳理、产品功能和交互设计，并推进产品开发、测试、发布；4. 收集用户反馈与需求，并能合理分析，基于数据提出对于业务线的产品建议；5. 定时输出业务线市场分析、产品分析...,互联网,http://jobs.zhaopin.com/CC000544460J40750238216.htm,10000人以上,2026-01-09 15:18:59
BBU代谢疼痛-产品经理-南京 (MJ015981),南京,江苏恒瑞医药股份有限公司,本科,经验不限,"化学药,特药,处方药,心血管科,内分泌科",2.4-2.8万,岗位职责：管理代谢疼痛产品的区域市场策略，包括制定年度销售目标和推广计划。开发并执行产品上市活动，确保与全国策略一致。协调销售团队和医疗专业人士，推动产品教育和临床合作。分析市场数据和竞争动态，提供定期报告以优化决策。确保所有市场活动符合行业法规和合规要求。支持关键客户关系管理，提升产品在区域内的市场份额。职位要求：本科及以上学历，专业为药学、医学或相关专业。优秀的沟通、演讲和人际交往能力，能有效...,医药制造,http://jobs.zhaopin.com/CC120989510J40854387913.htm,10000人以上,2026-01-08 15:45:17
总经理助理,南京,国轩高科股份有限公司,博士,无经验,英语,1.6-2.8万,工作职责1.负责科技类项目申报和项目执行，负责前沿技术规划和落地执行；2.负责锂离子电池核心材料及其关键技术研发，制定实验方案，撰写技术报告，专利工作总结；3、内部协调：作为总经理与公司各部门之间的沟通桥梁，传达指令、收集反馈、促进跨部门协作，确保信息流畅4、外部联络：负责与重要客户、合作伙伴、政府机构、媒体等外部联系的日常联络与维护，树立良好的企业形象；5、负责重要来宾的接待工作；6、协助总经理...,新能源,http://jobs.zhaopin.com/CC344684980J40866543112.htm,10000人以上,2026-01-06 16:15:30
产品经理—多式联运（TMS）,南京,中储智运,本科,无经验,,1.4-2.8万,工作职责【行业经验】深入了解大宗物流运输业务全流程。【产品设计】能够对运输管理系统进行产品设计，包括物流中台设计、智慧组网与路由、智能调度等产品设计，不断沉淀产品能力，打磨客户体验。【项目落地】能够独立承担项目，协调各个部门，基于业务目标，高质量完成项目落地，协助运营推广，并达到业务预期目标。【产品规划】能够对运输管理系统进行产品架构设计，产品规划设计，并对现有系统提出改进建议，并基于自身思考推动...,货运/物流/仓储,http://jobs.zhaopin.com/CC673786820J40737991410.htm,1000-9999人,2026-01-05 15:42:50
热能工程师/产品经理,南京,中圣清洁能源投资(江苏)集团有限公司,硕士,经验不限,,1.4-2.8万,岗位职责：1、负责客户对接，根据客户设备监控、优化运行、故障诊断、环保控制等方面的需求进行产品设计；2、负责客户需求转译，从热能专业角度和数学角度分析客户数据，评估数据的可用性，进行产品需求文档和原型设计，明确性能指标及标准；3、负责组织AI人员和生产技术人员进行产品开发，确保技术方案与需求的匹配实现，完成产品交付；4、负责建立健全产品效果追踪与评估体系，评估AI产品应用核心指标落地实施情况，如运...,电力/水利/热力/燃气,http://jobs.zhaopin.com/CC336521980J40781240909.htm,1000-9999人,2025-10-09 13:39:14
高级项目经理 - 心电产品开发,南京,善时医疗研究院(南京)有限公司,本科,3-5年,"医药研发项目,生物药",1.8-2.8万,"职位概述： 您将负责从概念到上市的全生命周期管理，确保项目按时、按预算、高质量地交付，并符合医疗器械法规要求。您需要协调跨职能团队（硬件、软件、算法、测试、法规注册、生产、质量） 主要职责：1. 项目全生命周期管理： 主导心电产品的规划、启动、执行、监控和收尾，制定详细项目计划（WBS, 甘特图），管理项目范围、时间、成本、质量、风险和资源。2. 跨职能团队领导： 高效领导并激励由硬件、软件、嵌入...",医疗设备/器械,http://jobs.zhaopin.com/CCL1511086350J40802894114.htm,20人以下,2025-09-17 15:00:09
数据产品经理,南京,江苏金智教育,本科,3-5年,"TO B,Axure,墨刀",2-2.8万·14薪,方向：数据应用（工具/内容），数据平台产品工作职责：1、负责公司高校领域数据产品的需求调研与分析，规划产品整体功能架构，输出产品开发需求、提炼产品价值;2、能够形成高质量的产品需求文档与产品设计，确保技术及业务部门准确理解；3、制定合理的产品迭代计划，推动研发、测试团队高质量完成产品迭代与上线工作；4、为营销、市场、解决方案、工程实施等上下游团队赋能，确保其对产品充分理解；岗位要求：1、本科及以上...,计算机软件,http://jobs.zhaopin.com/CC243869610J40821789613.htm,500-999人,2025-09-03 13:57:00
产品经理-大厂项目base南京,南京,软通动力信息技术(集团)股份有限公司,本科,5-10年,"软件产品,增长产品,策略产品,搜索产品,浏览器",1.8-2.7万,外包大厂 长期项目 稳定 氛围好base 南京雨花台区岗位一大厂经验，有审核产品经验，base可选南京或者北京岗位二大厂经验，有交互设计经验加分 岗位一：岗位职责：1、挖掘Origin OS系统核心场景需求、洞察用户痛点、完成用户行为分析；2、辅助梳理海内外用户认知，负责产品规划、功能定义、概念设计，并完成产品需求文档；3、负责协调三方、研发、交互、UI、测试和运营人员完成产品需求从开发、测试到发...,互联网,http://jobs.zhaopin.com/CC000544460J40759358716.htm,10000人以上,2025-11-11 18:13:57
CAE约束系统产品开发工程师,南京,恩永(北京)科技股份有限公司,大专,5-10年,"汽车安全仿真,汽车碰撞仿真,强度耐久仿真,乘用车,新能源车,气囊,安全带,方向盘,约束系统",1.3-2.6万·13薪,1、负责约束系统产品开发，，包括气囊、安全带、方向盘零件等2、负责根据整车项目目标，完成约束系统产品的设计选型、成本分析、设计方案确定、制定试验方案并跟踪验证，并按项目要求完成相应交付物3、负责约束系统数据设计及发布，断面绘制，匹配边界设计定义，设计优化和减重降4、负责约束系统零件的前瞻技术研究，技术路线制定，创新技术落地5、作为设计发布工程师，编写SOR/SOW，牵头制定产品开发计划，管理零部件...,汽车研发/制造,http://jobs.zhaopin.com/CC362753420J40713815101.htm,300-499人,2026-01-09 11:16:16
产品经理（银行/CRM/信贷/英语口语）,南京,润和软件,本科,5-10年,"CRM,CRM系统,英语口语",1.7-2.6万,海外项目需要出差5年工作经验及以上 必须有银行工作经验 有过crm或营销管理经验优先 有信贷经验优先 有英语口语交流能力优先,计算机软件,http://jobs.zhaopin.com/CC171774410J40835866714.htm,1000-9999人,2026-01-08 14:12:56
商业化广告产品及运营,南京,软通动力信息技术(集团)股份有限公司,本科,3-5年,"广告产品,商业化,广告调优,广告投放,变现",1.8-2.6万,外包大厂 长期稳定 氛围好base南京 雨花台区该岗位为商业化产品经理位 ！！！但是具备商业化运营及广告调优广告变现等经验均可名校毕业或大厂经验加分~~！！具备智能终端手机厂商经验优先【商业化变现产品】1、负责视频行业双列和沉浸式消费场景的广告产品设计，针对当前业务现状及目标，产出有效的产品解决方案；2、数据分析和问题排查，能通过数据漏斗拆解找出产品可优化的提升点，并针对异常数据找出问题产生原因；...,互联网,http://jobs.zhaopin.com/CC000544460J40775549516.htm,10000人以上,2026-01-05 01:43:49
产品经理（TMS）,南京,中储智运,本科,5-10年,"软件产品,物流系统",1.6-2.6万,岗位职责:【行业经验】深入了解大宗物流运输业务全流程。【产品设计】能够对运输管理系统进行产品设计，包括物流中台设计、智慧组网与路由、智能调度等产品设计，不断沉淀产品能力，打磨客户体验。【项目落地】能够独立承担项目，协调各个部门，基于业务目标，高质量完成项目落地，协助运营推广，并达到业务预期目标。【产品规划】能够对运输管理系统进行产品架构设计，产品规划设计，并对现有系统提出改进建议，并基于自身思考推...,货运/物流/仓储,http://jobs.zhaopin.com/CC673786820J40626535110.htm,1000-9999人,2026-01-04 10:32:03
整车系统产品经理(J10302),南京,南京北路智控科技股份有限公司,本科,5-10年,"线束,三电系统,控制器,嵌入式硬件研发,电控系统,驱动电机,整车控制,VCU,整车设计",1.8-2.6万·14薪,岗位职责:1、负责智驾电气硬件系统架构设计，满足硬件性能、成本、EMC、功耗等多方面需求2、负责硬件单机产品的选型与评估：产品硬件报价支持，根据产品需求，参与关键元器件供应商的选择与评估。3、参与硬件产品的设计评审，如原理图评审、PCB评审，确保电路的正确性和可靠性、符合安标、EMC标准。4、负责硬件产品方案的编制，具备优秀的文档撰写能力，文档编写负责硬件产品规范。5、负责与整车电气、整车结构、整...,物联网,http://jobs.zhaopin.com/CC204378620J40829570710.htm,1000-9999人,2025-12-23 12:46:27
产品经理-用户/商业化/审核平台-多岗位招聘,南京,软通动力信息技术(集团)股份有限公司,本科,3-5年,"增长产品,商业化产品,数据产品,大数据产品,策略,内容审核",1.6-2.6万,外包大厂 长期项目 稳定 氛围好base南京雨花台区岗位一：内容平台产品经理-内容安全产品经理/内容策略产品经理/审核平台产品经理 岗位二：用户产品经理-做过用户模块产品经验，对数据敏感具备数据分析能力，有数据产品经验也可岗位三：商业化变现产品经理-具备广告变现、商业化变现产品及运营经验均可岗位一【内容安全产品】职责：1.产品能力建设-主导内容安全审核产品的生命周期管理，包括审核策略制定、流程优化...,互联网,http://jobs.zhaopin.com/CC000544460J40781807616.htm,10000人以上,2025-12-17 19:14:34
驻场产品经理,南京,北京思创贯宇科技开发有限公司,本科,经验不限,,1.3-2.6万,岗位职责：1、深入医院现场，熟悉业务流程，对系统问题进行诊断和故障排除，提供技术支持。制定并执行免维护质控改进计划，优化产品应用模型，提升应用质量及数据产出。2、挖掘与实现临床新价值方案基于现场情况，观察、挖掘产品优化方向或新项目机会，协同研发团队推动产品功能迭代，提升用户体验和市场竞争力。3、场地管理与标杆打造能与项目场地内客户、第三方保持良好的关系，为演示参观做好前期铺垫工作。 构建区域标杆案...,医疗设备/器械,http://jobs.zhaopin.com/CC120550810J40705122906.htm,100-299人,2025-12-02 14:46:55
产品经理（泌尿）,南京,伟思医疗,硕士,1-3年,"钬激光,医学,临床",1.8-2.6万·13薪,岗位职责：1.对产品市场、竞品、前沿技术领域、临床需求等进行全面剖析；2.负责产品设计和产品定位，完成产品功能需求定义；3.协调研发、医学等资源，保证产品能按照既定目标上市；4.持续跟踪市场及用户反馈，持续调整和优化产品定义，始终维持产品的竞争力和用户体验。任职要求：1.临床医学等相关专业，硕士，本科优秀者可放开；2.具备泌尿外科临床经验，有钬激光操作经验优先，具有产品设计思维；3..能够敏锐深入...,医疗设备/器械,http://jobs.zhaopin.com/CC133369130J40810080609.htm,500-999人,2025-12-02 00:22:02
医药产品经理,南京,吉林省博大制药股份有限公司,大专,3-5年,医药产品,1.4-2.6万,岗位职责： 1、负责公司若干在销产品。及时了解医药行业相关政策以及产品信息的收集； 2、参与制定全年销售策略，制作各类宣传资料、产品资料和培训资料； 3、负责产品学术信息、产品市场调研及竞品资料的收集、整理，并进行全方位比较分析，协助制定统一的对外宣传方案； 4、负责学术杂志社的联络，协助医生发表与本公司产品相关的论文； 5、负责产品相关专家网络建设、临床学术研究实施 任职要求： 大专及以上学历，...,医药制造,http://jobs.zhaopin.com/CC182743010J40559388507.htm,100-299人,2025-10-16 00:00:42
电源产品版本经理,南京,思源电气,本科,3-5年,"电源系统开发,PCB设计,电源,逆变器,继电器,变流器,控制器,UPS",1.5-2.5万·15薪,岗位职责：1、主导UPS、模块电源等电源类产品需求开发、需求分解、方案设计及功能验证，确保产品竞争力；2、组织技术方案、用户手册等编制，牵头标准及行业技术趋势解读；3、组织实施和持续优化产品、技术及平台迭代，组织系统性问题分析处理。任职要求：1、具备3年及以上UPS、模块电源等电源类产品开发经验2、电源类系统工程师、硬件或控制软件人员优先3、电力电子、电气工程、自动化等相关专业,电气机械/电力设备,http://jobs.zhaopin.com/CC000635070J40812738911.htm,1000-9999人,2026-01-11 01:28:10
移动端产品经理,南京,京东集团,本科,3-5年,"客户端产品,小程序产品,产品设计,Axure,墨刀,Xmind,Visio,TO C",1.5-2.5万·15薪,工作职责：1、方案设计及产品规划管理：负责公司门店运营管理类相关产品规划、设计和需求执行，研究市场动态、分析竞争对手，持续推动方案和产品的优化迭代； 2、业务需求分析：受理业务需求，提供业务分析支持，需求可行性分析，协助第三方合作的相关工作；输出PRD，规划详细的系统功能实现方案，分析需求影响范围并协调IT各部门资源； 3、需求交付保证：跟踪系统开发进度，配合开发方准确理解需求，确保系统开发按计划...,互联网,http://jobs.zhaopin.com/CC192921310J40609952109.htm,10000人以上,2026-01-11 01:21:00
疾控产品经理,南京,北京先声祥瑞生物制品股份有限公司,硕士,3-5年,"生物药,处方药,呼吸科,儿科,疾控领域,公共卫生",1.5-2.5万,职责描述：1.分析产品在疾控领域的推广进展和需求，结合相关产品进行差异化分析，梳理和定位产品价值，制订相应市场策略和营销计划，牵头组织各项全国、区域性学术研讨会、沙龙等活动；2.建立和健全国内结核、儿科、呼吸科等领域KOL关系网，推动各类文件、规范、指南的建立和完善；3.设计制作产品在公司内外的推广工具及宣传宣讲材料，对代表区域学术经理，进行培训。任职要求：1.医学、药学、公共卫生等相关专业硕士以...,医药制造,http://jobs.zhaopin.com/CC315649110J40795090901.htm,100-299人,2026-01-11 00:05:21
产品经理（智能运维）,南京,思源电气,本科,3-5年,,1.5-2.5万·16薪,主要职责：1.收集、分析和理解电力、电气与工业行业智能运维技术变化情况; 2.根据市场或用户的需求规划相关的产品或解决方案，确保商业成功; 3.参与本业务领域的战略规划和年度商业规划; 4.参与产品上市营销计划及材料编制。任职要求： 学历：本科及以上，电力、电气、自动化相关专业工作经验：3年及以上工作经验，辅助监控、机器人巡逻等智能运维相关研发经验者优先。熟悉运维技术发展状况及特点，熟悉产品的应用...,电气机械/电力设备,http://jobs.zhaopin.com/CC000635070J40707706811.htm,1000-9999人,2026-01-11 01:26:45
（南京）妇骨-产品经理(J10745),南京,江苏康缘药业股份有限公司,本科,3-5年,"中药,新药,生物药,妇产科,骨科",1.5-2.5万,岗位职责:1 负责产品线规划及各产品发展方向的整体把握和工作部署2 根据产品线各产品市场情况，把控产品线国家级重点学术活动推广重点，审批并监控相关产品的学术推广活动3 分析产品线整体及各产品内部外表现，撰写产品运营分析报告，提出改进或加强的意见，不断完善产品线各产品营销策略4 监管产品线各产品推广工具的制作5 根据产品市场情况，与临床相关部门沟通，确定产品临床研究方向6 管理带教下级产品经理及相关...,医药制造,http://jobs.zhaopin.com/CC120914180J40898897502.htm,1000-9999人,2026-01-10 16:21:35
产品经理-AI方向,南京,中储发展股份有限公司,本科,5-10年,"大模型,AIGC,物流",1.5-2.5万,工作职责1、需求分析与规划：结合业务目标与AI行业发展趋势，深入理解用户需求，规划AI产品的短期及长期迭代计划，提升产品智能化水平。2、策略设计与内容产出：搭建包括但不限于企业级知识库，设计机器人对话策略，优化话术逻辑；设计AI自动化收发单、AI自动化建单、智能化审批、OCR场景应用、智慧组网路由、智能匹配、智能调度、数据异常监控等智能化场景解决。3、跨部门协作：与业务部门、算法部门、工程部门紧密...,客运服务,http://jobs.zhaopin.com/CC212379010J40748592111.htm,1000-9999人,2026-01-10 01:32:03
电源高级产品经理,南京,思源电气,本科,5-10年,电源,1.5-2.5万·15薪,工作职责1.收集和分析电源行业或产品的技术变化，理解用户需求；2.规划电源产品和解决方案的新产品或改进版本，提升技术竞争力和成本竞争力，确保商业成功；3.参与本业务领域战略规划和年度商业规划编制。4.参与产品上市营销计划及材料编制任职要求：1.5年以上工作经验，本科及以上学历，电气、自动化、电力电子等相关专业2.熟悉电源行业发展状况及特点，熟悉电源产品的应用场景及整体解决方案3.了解工业用户电能质...,电气机械/电力设备,http://jobs.zhaopin.com/CC000635070J40540448611.htm,1000-9999人,2026-01-11 01:26:38
机械产品认证工程师,南京,SGS,本科,3-5年,"检测认证,机械设备检测,制造设备",1.5-2.5万,"职位描述：1.依据机械产品相关标准独立完成机械产品相关设备的检测和认证工作；2.分析测试数据并完成测试报告；3.与客户紧密联系，帮助客户分析解决技术问题；4.完成上级主管安排的其它工作。职位要求：1.本科或以上学历,电气自动化、自动控制或者机电一体化专业；2.3年以上机械产品设计，制造，认证等相关经验；3.熟练掌握MD相关标准：EN 60204-1, EN ISO 12100, EN ISO 13...",检测/认证,http://jobs.zhaopin.com/CC466953210J40761350709.htm,10000人以上,2026-01-10 01:25:03
