职位,城市,公司,学历,经验,技能,薪资,工作描述,行业,职位URL,公司规模,发布时间
兼职客服电话销售,南京,中国平安人寿保险股份有限公司江苏分公司第一营销服务部,高中,经验不限,"电话销售,保险行业,银行,投资/理财,网络销售,渠道销售",4500-8000元/时,老客户资料维护保单检视保单理赔保单保全银行，证券，投资，信托，贷款，理财，买车，信用卡等综合金融服务,保险,http://jobs.zhaopin.com/CC227971620J40383966303.htm,1000-9999人,2025-02-20 14:23:32
银行续期专员,南京,泰康人寿保险有限责任公司,本科,1-3年,,2-4万,岗位内容：1. 负责已在银行购买过本公司产品的客户续期服务，再次洽谈、协调和推进，完成业绩目标。（带参观养老社区，医院等服务）2. 根据客户需求，进行方案定制和产品推荐，提升客户满意度和忠诚度。3. 负责处理客户反馈问题，及时解决并跟进相关事宜。任职要求：1. 具有优秀的销售能力和洽谈技巧，至少2年以上销售或客户管理工作经验。2. 熟悉金融保险等行业，了解客户需求和市场动态。3. 具备高度的责任心...,保险,http://jobs.zhaopin.com/CC229745320J40719230301.htm,10000人以上,2025-05-26 18:06:29
银行保险续期经理,南京,泰康人寿保险有限责任公司江苏分公司,大专,1-3年,"现场客服,VIP客服,电话客服",1.5-3万·13薪,岗位内容： 1. 负责客户续期过程中的洽谈、协调和推进，完成业绩目标。2. 分析竞争对手和市场趋势，及时调整销售策略。3. 根据客户需求，进行方案定制和产品推荐，提升客户满意度和忠诚度。4. 负责处理客户反馈问题，及时解决并跟进相关事宜。任职要求： 1. 具有优秀的销售能力和洽谈技巧，至少2年以上销售或客户管理工作经验。2. 熟悉金融保险等行业，了解客户需求和市场动态。3. 具备高度的责任心和团队...,保险,http://jobs.zhaopin.com/CC131944300J40883796608.htm,10000人以上,2026-01-11 17:26:15
电话销售/招商客服/销售代表,南京,南京澳洁企业管理有限公司,中专/中技,1-3年,"个人客户,销售,电销",1.3-2.5万·13薪,我们的销售模式：公司提供优质客户资源，分给销售顾问名单资源，不用像其他快速消费品等业务员那样上门推销，工作环境舒适，不用外出陌生拜访，不用出差！一、岗位职责：1、电话与意向客户（公司公司分配的有效优质资源）进行加盟流程沟通；2、电话邀约意向客户来公司参观考察；3、来访客户全程协助接待、销售洽谈与谈判、意向合同、正式合同的签订。4、签约客户的后续执行沟通服务。二、岗位要求：1、中专及以上学历，年龄2...,耐用消费品,http://jobs.zhaopin.com/CC500537120J40405411809.htm,100-299人,2025-12-26 10:07:26
网络在线客服,南京,南京可优米网络科技有限公司,大专,1-3年,售后客服,1.3-2.5万,1、及时接听电话，商务通，微信等线上咨询者，专业、准确解答咨询客人的需求以及咨询者提出的各种疑问，能快速准确的对咨询需求做出有效回应；2、回复网站后台客户的留言，做好跟踪服务工作，及时处理后台预约客户信息，与现场咨询做好对接工作；3、把每日的咨询量、预约量、客户资料等内容及时录入系统，及时为预约客户在4、做好客户的回访工作及引导工作；系统上建立档案；任职资格：1、有做过客服或者销售，商务通、电话经...,通信/网络设备,http://jobs.zhaopin.com/CC456265680J40659773709.htm,100-299人,2025-07-17 16:59:33
老客户售后服务客户经理,南京,中国人寿保险股份有限公司南京市分公司收展营销服务部,大专,1-3年,"全白班,双休不加班,时间自由",1.2-2.4万,工作内容:1、联系并完善存量客户资料，如手机号、身份证有效期及家庭住址……；（不需要自行去开拓！！！）2、协助客户理赔资料提交;3、客户的定期权益活动通知，如缴费提醒、节日礼发放、星级礼品领取等；4、邀约老客户参与回馈活动，告知最新资讯，实现二次开发要求:1.年龄25 周岁~45周岁，大专及以上学历2.熟悉办公软件3.做事细心谨慎4.有上进心工作时间:上午 8:30-11:30午休2小时下午 13...,保险,http://jobs.zhaopin.com/CC606591220J40872051715.htm,10000人以上,2025-10-15 14:32:29
销售客服,南京,华乾万清科技,学历不限,无经验,"企业客户,个人客户,电话销售,渠道销售, 面销/陌拜,KA大客户",1.1-2.2万,财商钱道(江苏)科技有限公司→债务处置调处【使命】通过提供专业、同理心和高效的债务调解服务，帮助债务人摆脱财务困境，重建财务健康【公司主营】债务调解，综合法律服务。国家政策，合法合规!全国首批律所+司法调解中心的专业债务债权调解服务机构【工作内容】1.正规法务服务工作主要提供债务规划，债务延期，停息挂账，延期保房，债务减免追息等业务。2.了解客户需求，给客户进行债务知识普法宣传，根据客户收支情况，...,法律服务,http://jobs.zhaopin.com/CCL1495199390J40906880415.htm,100-299人,2026-01-06 16:26:32
满帮平台账号风控专员,南京,极牛控股集团有限公司,学历不限,经验不限,"投诉客服,VIP客服,满帮客服,满帮处理账号客服,货车帮",1.3-2.1万,工作职责：客诉处理与账号救赎： 全面负责处理公司名下所有“运满满司机端”及“货车帮司机端”账号的异常、处罚、封禁等客诉问题。沟通与谈判： 作为公司与满帮官方客服沟通的主要桥梁，通过电话、工单、邮件等多种方式，进行专业、高效的沟通与谈判，力争撤销处罚、降低罚款金额或缩短封禁时间。人脉资源运用： 充分利用您在满帮集团的内部人脉资源（特别是客服部门），快速定位问题关键人物，推动客诉案件优先、高效处理，争...,专用设备制造,http://jobs.zhaopin.com/CCL1495734450J40723272206.htm,20-99人,2025-10-11 10:18:58
下班不考勤的国企高薪岗,南京,中国人寿保险股份有限公司南京市分公司收展营销服务部,大专,1-3年,"双休不加班,时间自由,90 后/00 后",1.2-2.4万,工作内容:1、联系并完善存量客户资料，如手机号、身份证有效期及家庭住址……；（不需要自行去开拓！！！）2、协助客户理赔资料提交;3、客户的定期权益活动通知，如缴费提醒、节日礼发放、星级礼品领取等；4、邀约老客户参与回馈活动，告知最新资讯，实现二次开发要求:1.年龄25 周岁~45周岁，大专及以上学历2.熟悉办公软件3.做事细心谨慎4.有上进心工作时间:上午 8:30-11:30午休2小时下午 13...,保险,http://jobs.zhaopin.com/CC606591220J40871847515.htm,10000人以上,2025-10-15 14:32:24
销售客服（不需自己找客户，1.5W，休6天）,南京,南京阿余好饿科技有限公司,学历不限,经验不限,网络销售,1-2万,岗位职责：1.对接公司后台分配的精准客户资源，为客户提供专业的减脂指导，定制个性化课程与产品推荐；2.完成课程及产品的成单，达成每月销售目标；3.持续跟进客户减脂进展，提升客户满意度和复购率。岗位要求：1.年龄20-30岁，大专及以上学历，有线上成单或续费经验者优先；2.沟通表达清晰，具备一定的抗压能力和团队协作精神；3.热爱大健康行业，有相关经验或知识背景优先录用。福利待遇：薪资结构：底薪500...,互联网,http://jobs.zhaopin.com/CCL1510281440J40778058709.htm,300-499人,2026-01-09 10:53:06
客服总监,南京,煜美天熙(南京)化妆品贸易有限公司,大专,5-10年,"大客户管理,二次开发",1.5-2万,岗位职责：1.大客户关系管理：负责定期与大客户进行沟通对接，精准把握客户需求，及时响应客户诉求，提升客户满意度与忠诚度。2.服务团队管理：搭建高效的客服团队，制定客服工作流程与服务标准，提升团队整体服务水平。3.客户问题解决：妥善处理客户的投诉与疑难问题，协调公司内部各部门资源，制定解决方案并跟踪执行情况，保障问题得到妥善解决，降低客户流失风险。4.数据统计与分析：负责客户服务相关数据的收集、整理...,美发/美容/保健,http://jobs.zhaopin.com/CC871537800J40811543201.htm,500-999人,2026-01-08 01:01:58
双休不需要自拓客户的售后服务岗,南京,中国人寿保险股份有限公司南京市分公司收展营销服务部,大专,1-3年,"全白班,新街口双休,时间自由,双休不加班",1.2-2.4万,工作内容:1、联系并完善存量客户资料，如手机号、身份证有效期及家庭住址……；（不需要自行去开拓！！！）2、协助客户理赔资料提交;3、客户的定期权益活动通知，如缴费提醒、节日礼发放、星级礼品领取等；4、邀约老客户参与回馈活动，告知最新资讯，实现二次开发要求:1.年龄25 周岁~45周岁，大专及以上学历2.熟悉办公软件3.做事细心谨慎4.有上进心工作时间:上午 8:30-11:30午休2小时下午 13...,保险,http://jobs.zhaopin.com/CC606591220J40871841415.htm,10000人以上,2025-10-15 14:32:18
负责在读学员续费-客服主管/校长岗,南京,南京大雁艺术培训有限公司,大专,1-3年,"转介绍,课消,家校沟通,学员管理,续费工作",1-2万,【关于我司】我司专做中高考文化课，线下一对一为主。岗位主要负责在读学员维护工作，续费转介绍等。【薪资构成】无责底薪6-8k+续费+转介绍+课消 【工作地址】河西、大行宫、仙林 【工作时间】早班8-6点，晚班1-9点半，白班10-8点。周一休息 【岗位描述】 1、对所带在读学员提供高水平的服务，促使学员继续购买课时； 2、对所带在读学员提供高水平的服务，促使学员推荐他人购买课时； 3、安排好学生每一...,培训/辅导服务,http://jobs.zhaopin.com/CCL1235071660J40872151015.htm,100-299人,2026-01-05 10:36:24
客户服务经理,南京,东集技术股份有限公司,本科,5-10年,"售后管理,产品售后管理",1.6-2万·13薪,岗位主要职责1.建立和完善客户服务体系，制定服务各项管理制度与规范；2.负责本部门人员的培训发展计划及绩效考核制度的制定、监督与实施；3.负责监督、指导相关服务工作的开展，提高本部门服务技术水平，及时解决客户的各种产品相关问题，提高客户满意度；4.组织制定各项客户关系维护策略，实施相关服务优惠政策和激励策略，并监督、检查落实效果；5.组织开展部门客户服务成本核算分析工作，并根据分析结果，组织制订相...,物联网,http://jobs.zhaopin.com/CC120918330J40744554406.htm,500-999人,2025-12-30 15:05:24
银保续期客户经理,南京,泰康人寿保险有限责任公司,大专,1-3年,"售后客服,电话客服,VIP客服",1-2万,嘿，我们正在寻找一个充满活力、善于沟通的客户续期管理小伙伴！你的工作将是与我们的超级客户们保持联系，确保他们的合作关系持续稳固。如果你满足以下条件，就快来加入我们吧！1.大专及以上学历，金融、市场营销等相关专业优先；2.有相关经验最好，但不是必须；3.热爱与人打交道，善于倾听和解决问题；4.对金融市场和产品有一定了解；5.有责任心，注重细节，喜欢团队合作。期待你的加入，一起成为客户关系的守护者！薪...,保险,http://jobs.zhaopin.com/CC229745320J40722060701.htm,10000人以上,2025-12-09 18:47:47
国企车险客服/双休包餐+五险一金,南京,上海田明商务信息咨询有限公司,高中,经验不限,"电话客服,网络客服,售前客服,全白班,电话销售,车险续费,销售",1-2万,[公司介绍]中国人民财产保险有限公司，是亚洲最大的车险公司，国内最早的车险品牌，世界500强，也是国企，市场占有率最高。招聘岗位:车险续保专员产品优势:有车必买，每年需要续保一次， 国家强制性产品，一个电话就能成交。一、工作内容:1.公司提供即将到期的客户，通过电话和企业微信等方式联系客户进行续约和维护跟踪。二、职位要求：1. 20-38周岁，大专及以上学历(有经验者可适当放宽至中专或高中)2.工...,咨询服务,http://jobs.zhaopin.com/CC586340620J40965702804.htm,500-999人,2025-12-05 17:01:33
销售客服（南站双休五险一金）,南京,宁沪同伴(上海)网络科技有限公司,大专,1-3年,"企业客户,电话销售,网络销售",1-2万,岗位职责：1、利用公司提供的客户资源及渠道，挖掘客户需求，提升客户有效转化率。2、负责意向客户的开发、洽谈、跟进及转化，完成个人既定业绩目标。3、协助销售总监完成销售任务，执行销售管理制度。4、完成部门领导交代的其他安排。任职要求：1、大专及以上学历，有1-2年以上销售经验，接受优秀应届生。2、做过企服行业优先，有过b端客户对接经验。3、对销售充满兴趣，性格积极乐观，善于交际沟通，有一定的耐挫力和...,IT服务,http://jobs.zhaopin.com/CCL1486758120J40736225306.htm,20-99人,2025-11-29 00:03:02
双休好工作+稳定福利好+呼出客服,南京,江苏华夏电力有限公司,大专,经验不限,"政府客户,企业客户",1-2万,岗位职责： 1、通过电话沟通公司分配的潜在客户，传递政策，促成新客户合作。 2、电话沟通老客户，促成续签合作。记录与客户电话沟通信息，跟部门负责人沟通，根据所属区域结合一线销售情况，派单给合适的人员，保障签单率及时效性； 2、电力交易系统操作：根据业务需求完成电力交易系统操作； 3、完成领导交办的其他任务。 任职要求： 1.爱党爱国、遵纪守法、人品贵重、德才优良； 2.具备丰富的销售经验和管理能力...,电力/水利/热力/燃气,http://jobs.zhaopin.com/CCL1343262550J40781547414.htm,500-999人,2025-11-04 18:41:49
国企车险客服/双休包餐+五险一金,南京,上海田明商务信息咨询有限公司,高中,经验不限,"电话客服,网络客服,售前客服,全白班,电话销售,车险续费,销售",1-2万,[公司介绍]中国人民财产保险有限公司，是亚洲最大的车险公司，国内最早的车险品牌，世界500强，也是国企，市场占有率最高。招聘岗位:车险续保专员产品优势:有车必买，每年需要续保一次， 国家强制性产品，一个电话就能成交。一、工作内容:1.公司提供即将到期的客户，通过电话和企业微信等方式联系客户进行续约和维护跟踪。二、职位要求：1. 20-38周岁，大专及以上学历(有经验者可适当放宽至中专或高中)2.工...,咨询服务,http://jobs.zhaopin.com/CC586340620J40965702504.htm,500-999人,2025-12-05 17:01:29
准点下班（9:00-17:00)周末双休/运营客服,南京,中国平安,大专,经验不限,周末双休拒绝加班,面议,●岗位急招 招满即停。非业务员。非电销●企业文化:我们固定早九晚六周末双休我们绝对不加班，下班就走，我们适合喜欢做服务，而又不想有太多工作压力的人同时对于有晋升欲望、有赚钱欲望的人，我们也给予充足的空间。人性化工作时间+周末双休不加班!●福利待遇：工资构成:1、基础无责底薪+岗位津贴+绩效奖+季度奖+新人津贴(有金融从业经验者薪资面议)，入职半年以上收入8k+，一年以上15k+(上不封顶)2、缴纳...,银行,http://jobs.zhaopin.com/CC000204810J40844434512.htm,10000人以上,2025-10-30 15:45:15
双休五险+售前客服,南京,江苏华夏电力有限公司,大专,经验不限,"售后客服,售前客服,电话客服,全白班",1-2万,岗位职责： 1、通过电话沟通公司分配的潜在客户，传递政策，促成新客户合作。 2、电话沟通老客户，促成续签合作。2、电力交易系统操作：根据业务需求完成电力交易系统操作； 3、完成领导交办的其他任务。 任职要求： 1.爱党爱国、遵纪守法、人品贵重、德才优良； 2.具备丰富的销售经验和管理能力； 3.具有强烈的事业心及责任心； 4.具备学习能力和吃苦耐劳创业精神； 5.大专以上学历，专业不限； 6.年龄...,电力/水利/热力/燃气,http://jobs.zhaopin.com/CCL1343262550J40781611314.htm,500-999人,2025-11-04 18:41:12
车险续费客服/双休包吃+社保,南京,上海田明商务信息咨询有限公司,高中,经验不限,"个人客户,销售,电话客服,五险一金",1-2万,[公司介绍]中国人民财产保险有限公司，是亚洲最大的车险公司，国内最早的车险品牌，世界500强，也是国企，市场占有率最高。招聘岗位:车险续保专员产品优势:有车必买，每年需要续保一次， 国家强制性产品，一个电话就能成交。一、工作内容:1.公司提供即将到期的客户，通过电话和企业微信等方式联系客户进行续约和维护跟踪。二、职位要求：1. 20-38周岁，大专及以上学历(有经验者可适当放宽至中专或高中)2.工...,咨询服务,http://jobs.zhaopin.com/CC586340620J40889395704.htm,500-999人,2025-12-05 17:01:12
用户体验经理,南京,孩子王儿童用品股份有限公司,本科,5-10年,,1.5-2万·14薪,岗位职责: 1、负责制定产品客户服务目标体系，并对产品的用户体验KPI指标负责；2、负责建立客服业务的日常运营系统、质量、流程、培训、报表等体系，确保客服中心高效运转；3、负责搭建培训和客服学习知识体系，不断提升部门所有员工的技能和技巧；4、负责撰写用户体验分析报告，包括数据分析结果，重点案例、合理建议等，完善服务体系，提升客户体验；5、负责客服中心业务系统功能的不断升级和完善。任职要求: 1、本...,互联网,http://jobs.zhaopin.com/CC265894110J40721168406.htm,10000人以上,2025-10-09 11:23:06
无任务量回访电话客服+底薪7000,南京,南京灵祝融顶科技有限公司,学历不限,经验不限,"售前客服,电话客服",1.2-2万,底薪7000+额外奖金，无任何考核。提供转正机会，基本在两个月转正。带薪培训，一带一带教。提供手机，电脑，电话卡。岗位职责:1.提供客户支持服务，确保客户满意度2.处理客户咨询，解答相关问题任职要求：1.具备良好的沟通技巧和服务意识2.能够有效处理客户需求，保证服务质量3.积极主动，能够适应快节奏的工作环境,投资/融资,http://jobs.zhaopin.com/CCL1497694870J40747134814.htm,20-99人,2025-04-23 16:32:44
国企车险客服/双休包餐+五险一金,南京,上海田明商务信息咨询有限公司,高中,经验不限,"电话客服,网络客服,售前客服,全白班,电话销售,车险续费,销售",1-2万,[公司介绍]中国人民财产保险有限公司，是亚洲最大的车险公司，国内最早的车险品牌，世界500强，也是国企，市场占有率最高。招聘岗位:车险续保专员产品优势:有车必买，每年需要续保一次， 国家强制性产品，一个电话就能成交。一、工作内容:1.公司提供即将到期的客户，通过电话和企业微信等方式联系客户进行续约和维护跟踪。二、职位要求：1. 20-38周岁，大专及以上学历(有经验者可适当放宽至中专或高中)2.工...,咨询服务,http://jobs.zhaopin.com/CC586340620J40965702604.htm,500-999人,2025-12-05 17:01:05
保底5K/双休/管吃/线上续期坐席,南京,河南骏威大数据科技有限公司,学历不限,经验不限,"周末双休,管吃,带薪培训",9000-18000元,"优势亮点：可小白 ，入职即缴纳五险一金！开车出行必买、室内办公无需外出！双休！内部晋升空间大、办公环境舒适、年轻化团队！一、福利待遇:1、高稳定薪资：无责底薪+高稳定绩效+新人补贴+全勤奖=综合薪资 10k-20k+,3年以上人力50k+2、劳动合同：签订正式劳动合同，缴纳五险一金+商业保障。3、工作时间：上班时间9:00-12:00,13:30-18:30，中午休息1个半小时，法定节假日固定放假...",云计算/大数据,http://jobs.zhaopin.com/CCL1355367630J40787870007.htm,300-499人,2026-01-09 01:17:49
你的梦中情岗+无考核无指标底薪7000,南京,南京灵祝融顶科技有限公司,学历不限,无经验,"售前客服,售后客服,质检客服,全白班",9000-18000元,岗位职责:1、根据公司提供的准意向客户，电话+网络沟通。没有电话量要求和考核2、办公室坐班公司每天有足够的客户资源，不必自己寻找客户名单。任职要求:1、接受无经验，有一对一带教。2、公司氛围好3、年龄18-33上班时间：早九晚六，不加班，到点走人工资待遇:1、底薪7000+高额提成+(3万-10万)年终奖，平均月薪1.5万-3万左右，踏实努力的月薪在4-5万以上。2、办公环境舒适，并有蛋糕、水果、...,投资/融资,http://jobs.zhaopin.com/CCL1497694870J40752504214.htm,20-99人,2025-11-21 00:03:21
国企车险客服/双休包餐+五险一金,南京,上海田明商务信息咨询有限公司,高中,经验不限,"电话客服,网络客服,售前客服,全白班,电话销售,车险续费,销售",1-2万,[公司介绍]中国人民财产保险有限公司，是亚洲最大的车险公司，国内最早的车险品牌，世界500强，也是国企，市场占有率最高。招聘岗位:车险续保专员产品优势:有车必买，每年需要续保一次， 国家强制性产品，一个电话就能成交。一、工作内容:1.公司提供即将到期的客户，通过电话和企业微信等方式联系客户进行续约和维护跟踪。二、职位要求：1. 20-38周岁，大专及以上学历(有经验者可适当放宽至中专或高中)2.工...,咨询服务,http://jobs.zhaopin.com/CC586340620J40965703104.htm,500-999人,2025-12-05 16:30:15
信用卡逾期/网贷逾期/债务优化师/可兼职包吃住,南京,胜华道(广东)咨询服务有限公司,学历不限,无经验,"售前客服,网络客服,全白班",1.2-1.8万·14薪,行业概况：个人债务领域一站式解决债务问题，给予债务人一个重新履约的机会，具备绝对的市场竞争力，万亿级的蓝海市场，业务范围覆盖全国主营业务：1、个人债务优化：针对有各大银行信用卡、信用贷逾期，互联网金融/网货平台逾期的负债人，帮助其停息挂账、避免催收困扰、避免诉讼、停止罚息、违约金等费用；3、房地产一站式解债综合服务：断供保房、担保剥离、工资卡解冻服务、法拍房权益救济帮扶制度：1、多维度培训系统：从...,咨询服务,http://jobs.zhaopin.com/CCL1471837290J40825635913.htm,1000-9999人,2025-09-15 14:55:45
银行续期专员,南京,泰康人寿保险有限责任公司,大专,3-5年,"现场客服,电话客服,售后客服,英语,销售",1-1.8万,岗位内容：1. 负责已在银行购买过本公司产品的客户续期服务，再次洽谈、协调和推进，完成业绩目标。（带参观养老社区，医院等服务）2. 根据客户需求，进行方案定制和产品推荐，提升客户满意度和忠诚度。3. 负责处理客户反馈问题，及时解决并跟进相关事宜。任职要求：1. 具有优秀的销售能力和洽谈技巧，至少2年以上销售或客户管理工作经验。2. 熟悉金融保险等行业，了解客户需求和市场动态。3. 具备高度的责任心...,保险,http://jobs.zhaopin.com/CC229745320J40720506501.htm,10000人以上,2025-04-19 16:32:10
国企车险客服/双休包餐+五险一金,南京,上海田明商务信息咨询有限公司,高中,经验不限,"电话客服,网络客服,售前客服,全白班,电话销售,车险续费,销售",1-2万,[公司介绍]中国人民财产保险有限公司，是亚洲最大的车险公司，国内最早的车险品牌，世界500强，也是国企，市场占有率最高。招聘岗位:车险续保专员产品优势:有车必买，每年需要续保一次， 国家强制性产品，一个电话就能成交。一、工作内容:1.公司提供即将到期的客户，通过电话和企业微信等方式联系客户进行续约和维护跟踪。二、职位要求：1. 20-38周岁，大专及以上学历(有经验者可适当放宽至中专或高中)2.工...,咨询服务,http://jobs.zhaopin.com/CC586340620J40965703004.htm,500-999人,2025-12-05 16:30:12
00后初创公司/包吃/老板不在轻松客服,南京,江苏有信企业服务有限公司,学历不限,经验不限,,9000-17000元·14薪,告别“打工天花板”!销售精英专属财富共享计划启动诚邀您成为事业合伙人!你都能与老板直接平分利润，彻底摆脱“底薪+固定提成”的桎梏。你的努力与回报成正比，能力越强，收益越惊人!轻装上阵闯市场:无需承担创业资金、场地租赁、人员管理等压力，公司提供全流程扶持--精准客户线索、专业产品培训、高效售后团队，让你专注销售，无后顾之忧!深度参与决策:不仅是“打工人”，更是事业合伙人!你的销售策略、市场洞察将直接...,互联网金融/小额贷款,http://jobs.zhaopin.com/CCL1492542120J40785916014.htm,100-299人,2025-08-01 15:29:24
