职位,城市,公司,学历,经验,技能,薪资,工作描述,行业,职位URL,公司规模,发布时间
产品经理(J10025),南京,南京北路智控科技股份有限公司,本科,经验不限,"硬件产品,软件产品",2-3万·13薪,岗位职责:1、担任公司软件产品的研发、运营的管理者，从前期技术调研、产品的创意、产品研发、产品发布等产品生命全周期。2、带领软件开发团队完成产品的需求分析确认，进行开发管理，负责产品开发各环节把控：系统设计、质量和进度把控、部署上线等工作；3、负责每个阶段的需求沟通及确认，包括项目需求讨论、项目进度汇报、问题和风险反馈、后期需求规划等工作；4、管控项目过程的关键环节，比如各类评审、测试、上线；5、...,物联网,http://jobs.zhaopin.com/CC204378620J40536815410.htm,1000-9999人,2025-12-24 21:50:55
数据中心风冷产品经理,南京,天加环境,本科,经验不限,暖通,2.5-3万,岗位职责:1.产品规划：负责数据中心行业空调风冷产品竞品、竞争分析，客户需求收敛，形成产品规划书；追踪、推动产品开发进度以达成规划要求；2.产品生命期管理: 检讨产品经营状况，提出相关改进建议；持续推动产品标准化、降本等措施；3.销售支持工具管理：数据中心产品介绍PPT、选型软件、标书模板及资料库及各类内外培训资料、售后服务手册等制定、管理等；4.产品认证管理：根据不同国家市场需求，制定产品认证需...,通用设备制造,http://jobs.zhaopin.com/CC245117310J40851477813.htm,1000-9999人,2025-12-23 15:44:37
b端产品经理,南京,北京谷粒快乐文化有限公司,本科,5-10年,虚拟电厂,1.8-3万·15薪,1、产品规划与全生命周期管理：负责虚拟电厂平台、交易辅助决策系统或相关能源数字化产品的战略规划、路线图制定及全流程管理。2、市场与需求洞察：深入研究电力现货市场、辅助服务市场、需求响应等政策与规则，跟踪行业动态与竞品，挖掘发电企业、售电公司及终端用户的深层需求。3、客户需求梳理： 深入发电集团、售电公司及工商业用户一线，通过调研访谈，挖掘并定义其在电力交易、负荷管理等场景下的原始需求与痛点，通过系...,新媒体,http://jobs.zhaopin.com/CCL1273038900J40831675314.htm,20-99人,2025-12-19 14:13:22
硬件工程师（穿戴产品）(J12172),南京,江苏鱼跃医疗设备股份有限公司,本科,5-10年,"穿戴式,EMC,AD/CADENCE",2-3万·15薪,岗位职责:1、负责穿戴产品的元器件选型、原理图设计、PCB Layout设计、布局及布线、硬件测试； 2、负责与软件工程师的对接及联调； 3、负责解决产品的预研、设计、样机、试产中遇到的硬件设计问题； 4、负责硬件设计文档归档，和硬件生产资料输出。任职要求:1、电子工程、信息与信号处理、电子信息专业，本科及以上学历； 2、5年以上硬件开发经验，能独立设计数字及模拟电路，具有穿戴产品硬件开发经验优先...,医疗设备/器械,http://jobs.zhaopin.com/CC199971310J40864869003.htm,10000人以上,2025-12-19 13:44:55
数据中心风冷/液冷产品经理（暖通）,南京,天加环境,本科,经验不限,"空调设计,空气处理系统,制冷系统,通风系统,办公建筑,高级暖通工程师职称",2.5-3万,岗位职责:1.产品规划：负责数据中心行业空调风冷产品竞品、竞争分析，客户需求收敛，形成产品规划书；追踪、推动产品开发进度以达成规划要求；2.产品生命期管理: 检讨产品经营状况，提出相关改进建议；持续推动产品标准化、降本等措施；3.销售支持工具管理：数据中心产品介绍PPT、选型软件、标书模板及资料库及各类内外培训资料、售后服务手册等制定、管理等；4.产品认证管理：根据不同国家市场需求，制定产品认证需...,通用设备制造,http://jobs.zhaopin.com/CC245117310J40851424913.htm,1000-9999人,2025-12-23 13:56:36
区域产品经理-储能,南京,阳光电源股份有限公司,本科,3-5年,软件产品,1.5-3万·15薪,岗位职责：1、负责用户需求收集、业务需求分析，负责产品规划与市场洞察，协助开发团队理解和掌握需求，对产品经营结果负责；2、与客户进行技术、需求交流并提供解决方案，协助系统的业务推广；3、负责产品的规划与业务计划的制定，参与产品开发关键点的评审活动，负责相关产品开发项目周期和进度把控，确保对产品开发至最终上线运营，对进度质量负责；4、协调产品上线前的产品文档整理，系统培训，商务推广，市场宣传等配合工...,新能源,http://jobs.zhaopin.com/CC120598170J40732861806.htm,1000-9999人,2025-12-16 11:03:05
Global Product Manager-Peptide Direction,南京,金斯瑞生物科技,硕士,1-3年,"产品经理,市场推广,多肽,生物化学",面议,"Key Responsibilities1. Market & Customer Insight (VOC & Competitive Analysis)Lead market research, Voice of Customer (VOC) collection, and 5-dimension analysis (Market/Competitor/User/Internal/Technol...",医药制造,http://jobs.zhaopin.com/CC143982550J40827863314.htm,1000-9999人,2025-12-12 09:57:00
产品推广总监/经理,南京,北京爱思益普生物科技股份有限公司,本科,1-3年,"实验动物模型,药效药理测评",1.5-3万,岗位职责：1.市场推广：协助资深产品经理进行市场调研，收集、分析GLP领域的行业趋势、竞争对手动态和客户反馈。2.内外部支持与培训：协助制作产品宣传材料，如技术白皮书、演示文稿、案例研究等，为内部的商务开发团队和科学团队提供必要的产品知识培训和支持。3.对内产品报价：针对公司产品模型以及客户要求，按公司价格体系，快速精准反馈产品报价。 任职要求： 1.学历背景： 本科学士及以上学历，动物医学、细胞...,医药制造,http://jobs.zhaopin.com/CC382068510J40951131204.htm,300-499人,2025-12-09 17:13:26
IT产品经理,南京,江苏鑫玉安传感技术有限公司,硕士,1-3年,CRM系统,1.6-3万,【主要职责】：1.信息系统全生命周期管理： 负责参与及协调JBFL信息系统的需求分析、架构设计、开发、测试与部署上线全流程管理。2.需求管理与迭代规划：负责管理JBFL产品团队，负责收集业务部门的原始需求、需求分析、产品设计，输出产品原型设计与需求文档。3.系统研发与交付推进：完成需求优先级排序，协同开发、测试、运维团队，推动需求落地实施，跟踪项目进度，解决需求变更、业务与技术衔接等问题。4. 负...,计算机软件,http://jobs.zhaopin.com/CCL1285062370J40738156206.htm,20人以下,2025-12-05 14:57:53
产品研发高级设计师,南京,德力股份,大专,10年以上,"结构设计,工艺设计,造型设计,3D MAX,CAD,SolidWorks",2-3万,负责公司新品创新研发和设计，并达到提升销售指标和市场开发的目标1、具有不低于10年产品经理或产品设计岗位经验；2、产品设计等专业；3、英语能力：CET-6及以上,金属制品业,http://jobs.zhaopin.com/CC398866820J40869285502.htm,1000-9999人,2025-11-28 10:01:49
技术工艺岗/技术经理助理,南京,南京万佛莱精密机械有限公司,本科,5-10年,"工艺设计,模块化设计,设计计算书,电气设计",1.5-3万,岗位要求：1、年龄在35岁左右；2、8-10年工作经验； 3、毕业院校：西安交通大学/华南理工大学/天津商业大学/南京工业大学/上海理工大学等--能动/机械学院---制冷与低温专业；4、能模块化设计产品，能系统性设计方案与解决客户问题；5、有能出设计计算书，并验证、指导、编制工艺文件；6、熟练运用CAXA软件进行绘图，整理和审核BOM、图纸，并提出改进意见和方向；7、有电气（PLC或单片机）设计能...,电气机械/电力设备,http://jobs.zhaopin.com/CC399751010J40812482907.htm,20-99人,2025-11-27 13:54:55
终端安全产品经理,南京,北京亚信网络安全技术有限公司,本科,5-10年,"网络安全,终端安全,EDR",2-3万,岗位内容：1. 负责安全产品的设计和实施，并持续优化产品结构和功能；2. 分析和评估公司现有的安全风险，提出防范措施和解决方案；3. 负责组织安全漏洞评估、渗透测试等安全检测工作；4. 研究并跟踪最新的安全技术和趋势，不断更新安全知识；5. 与其他部门密切协作，提供安全支持和咨询服务。任职要求：1. 计算机相关专业本科及以上学历；2. 具备扎实的网络安全基础，对Web和移动端常见漏洞有较深入的了解...,网络/信息安全,http://jobs.zhaopin.com/CC535968630J40775874816.htm,1000-9999人,2025-11-24 13:34:24
首批新能源产品专家＆汽车主播（直营直招）,南京,深圳南区人瑞人力资源服务有限公司,大专,1年以下,"新车,豪华品牌,新势力品牌,门店销售,车展销售,汽贸城销售",1.5-3万,全国上千家门店~~可详细沟通咨询位置薪资20000+面试定薪（畅销车系销售）无需汽车销售经验！！！！！房产销售经验也可以~新人两个月绩效保护，入职上五险一金，门店就近分配岗位职责：1.负责新能源汽车的销售工作，为客户提供专业咨询2.维护客户关系，确保服务质量满足客户需求3.积极参与团队合作，共同完成销售目标任职要求：1.具备良好的沟通技巧，能够有效地与客户进行互动2.能够独立完成销售任务，具备较强...,企业服务,http://jobs.zhaopin.com/CCL1289361510J40807871001.htm,10000人以上,2025-11-19 10:45:09
产品会销讲师,南京,江苏益管家健康产业有限公司,大专,1-3年,"健康管理,健康管理相关证书",1.5-3万,1、线上线下产品方案落地销售2、参与完善产品营销方案3、提供健康咨询服务4、参与公司营销活动，产品方案讲解5、其他与市场活动相关的工作职位要求：1、拥有健康管理师等行业相关资质2、精通食药同源类产品销讲（虫草/灵芝/青钱柳等）岗位待遇：1.全职无责底薪5000，兼职面谈；2.正式录用保障市场会期；3.绩效提成：高讲课费+补助/低讲课费+提成+补助；4.全职可以安排住宿；综合年薪＞20W，不封顶，具...,零售/批发,http://jobs.zhaopin.com/CC844794040J40682637110.htm,20-99人,2025-11-17 15:30:26
烘干产品经理,南京,天加环境,本科,3-5年,"硬件产品,商业化产品",2-3万,岗位内容：1. 确定产品策略及产品规划，开展市场调研和竞品分析。2. 阐述产品功能设计，撰写产品需求文档，对产品流程、原型进行优化提升。3. 跟进产品研发过程，制定项目计划，与研发团队沟通协作，保证产品质量和交付进度。任职要求：1. 3年以上产品经理相关工作经验；2. 具备良好的团队合作精神和沟通表达能力；3. 有较强的数据分析和解决问题的能力。,通用设备制造,http://jobs.zhaopin.com/CC245117310J40840784513.htm,1000-9999人,2025-11-10 18:19:31
产品经理（电力方向）,南京,南京软核科技有限公司,本科,1-3年,"功能产品,推荐产品,商业化产品",1.6-3万·14薪,岗位职责： 充分与客户沟通，获取客户需求，开展需求调研，将业务需求转化为功能需求； 根据功能规范，制定相应技术指标、功能实现规则； 编制项目/产品需求分析报告，传递需求至开发工程师； 协助测试组完成项目中模块测试； 任职要求： 电力系统自动化或电力、电气工程等相关专业，本科及以上学历； 具备扎实的强电方向专业知识，电力行业工作经验一年以上； 熟练使用word，excel，powerpoint相关办...,计算机软件,http://jobs.zhaopin.com/CC253151010J40622852015.htm,20-99人,2025-10-31 00:06:01
saas产品销售/7k底薪/五险一金,南京,江苏兔酱网络科技有限公司,大专,1-3年,"渠道销售,面销/陌拜,区域销售",1.5-3万,公司简介江苏兔酱网络科技有限公司2016年开创业务，设立南京总部、上海分部、徐州分部，致力于为全球企业提供优质的IP代理解决方案，我们的产品和服务广泛应用于网络安全、数据采集、广告验证、市场调研、旅游聚合、跨境电商等多个领域，帮助客户应对互联网环境中的各种挑战。目前全球客户10000+9000w+高质量代理公司提供网站平台，提供注册网站精准客户，目前一个网站配置一个销售，每月续费客户稳定!!!!岗...,互联网,http://jobs.zhaopin.com/CCL1417977260J40768277709.htm,100-299人,2025-10-29 09:46:36
（26届校招）有机合成研究员/专员/助理,南京,药石科技,博士,经验不限,有机合成,2-3万,岗位职责： 1、安全熟练地操作常规有机反应和特殊有机反应；2、合理安排自己的日常工作和项目进度；3、对实验过程中发生的问题积极查阅文献，或和有经验的同事讨论找出解决方案；4、在指导下操作常用分析仪器和解析图谱；5、详细、准确地记录实验过程和撰写实验项目报告；6、完成上级安排的其他工作。 任职资格： 1、化学、药学及相关专业，博士及以上学历，有合成相关实习经验者优先；2、热爱化学，学习意愿强；3、有...,化学原料/化学制品,http://jobs.zhaopin.com/CC218331910J40788487811.htm,1000-9999人,2025-10-28 13:50:23
摄影器材产品经理,南京,南京腾博信息科技有限公司,本科,1-3年,"硬件产品,英语,摄影器材",1.5-3万,岗位职责：1. 依据公司产品战略和品牌战略进行产品规划、开发、生命周期管理;2、调研分析相关产品的市场环境、竞争环境、用户需求、技术现状与趋势等，关注市场趋势和动态，洞察用户需求和商业机会，规划发有竞争力和创新力的产品3、内外部沟通，参与推动公司其它部门和供应商协作，保证产品发上市;4、关注用户体验和反馈，结合品牌建设，不断优化迭代打磨产品;5、撰写产品相关材料，包括产品规划路线图、过会立项文件、...,贸易/进出口,http://jobs.zhaopin.com/CCL1386204160J40712151712.htm,100-299人,2025-10-28 00:33:01
产品经理,南京,艾欧史密斯(中国)水系统有限公司,本科,3-5年,"策略产品,商业化产品",1.5-3万,职位职责：1.市场洞察：深入研究中国各区域市场趋势、竞争格局、技术发展，通过用户调研、竞品分析等方式，挖掘用户需求与机会点；2.产品企划：制定产品规划及路线图，主导新品定义，包括产品概念、核心价值、功能卖点、用户体验、盈利目标。3.产品开发：与研发、供应链、制造等团队紧密协作，推动产品开发按计划进行，协调解决开发过程中的问题。4.产品上市：协同市场、销售、服务等部门，制定产品上市策略、定价策略、营...,电气机械/电力设备,http://jobs.zhaopin.com/CC443041310J40760814001.htm,1000-9999人,2025-10-21 00:00:01
产品经理（生化方向）,南京,基蛋生物科技股份有限公司,本科,3-5年,"IVD,体外诊断,生化",2-3万,工作职责: 1、 负责IVD生化领域市场的调研及信息反馈，及时反馈市场环境、竞品、活动以及客户的意见建议等；2、 负责针对重点产品制定市场推广策略，从方案制定到入院使用全过程策划；3、 与销售团队紧密合作，根据市场策略制定有针对性的区域市场计划；4、 负责市场推广资料的制作及区域学术会议的策划、组织、跟踪反馈；5、 负责市场销售人员及客户的技术支持及培训推广工作；6、 负责产线的发展规划，包括新研...,医药制造,http://jobs.zhaopin.com/CC139576410J40697841908.htm,1000-9999人,2025-10-10 10:04:39
智慧物业产品解决方案经理,南京,南京金鹰国际集团有限公司,本科,5-10年,"智慧产品,智慧物业",2-3万,1、市场调研与需求分析：深入分析智慧物业行业趋势，识别目标客户的需求与痛点，进行竞品分析，为产品规划提供数据支持。2、产品规划与设计：根据市场需求和公司战略，负责产品线的整体规划，包括功能定义、用户体验设计、技术选型等，确保产品符合市场定位且具有竞争力。3、项目管理：协调跨部门资源（研发、设计、市场、销售等），制定详细的产品开发计划，监控项目进度，确保按时按质完成产品开发。4、用户研究与反馈循环：...,房地产开发,http://jobs.zhaopin.com/CC189920810J40617093916.htm,1000-9999人,2025-09-09 11:58:32
区域产品经理 -江苏县域 (MJ013314),南京,江苏恒瑞医药股份有限公司,本科,3-5年,"化学药,处方药,内分泌科,骨科,心血管科,皮肤科,眼科",2-3万·14薪,职责描述：1、基于市场部的策略和市场计划，结合区域实际情况，落实中央市场部产品推广项目的实施及预算控制；2、制定区域市场业务发展目标和策略，并推进、组织、协调、执行并定期反馈；3、建立维护专家网络并与当地KOL专家建立长期学术合作关系，助力目标市场准入、重点区域的市场开发和销售增长；4、组织参与有效的学术推广活动，把控区域学术活动质量；5、了解市场竞争情况，及时反馈市场部和销售，及时调整区域市场计...,医药制造,http://jobs.zhaopin.com/CC120989510J40821896913.htm,10000人以上,2025-09-03 16:44:19
营业部总经理助理,南京,国泰海通证券股份有限公司江苏分公司,本科,3-5年,,1.5-3万,1、协助负责营业部经营管理工作，根据公司战略要求负责所辖地区经纪业务、机构投行业务、综合创新业务的拓展，完成经营指标；2、协助负责营业部团队建设和培养；3、负责营业部其它内部经营管理工作。职位福利：五险一金、绩效奖金、房补、餐补、通讯补助、采暖补贴、带薪年假、补充医疗保险,证券/期货,http://jobs.zhaopin.com/CC146536580J40860689708.htm,500-999人,2025-09-03 15:10:40
董事长助理,南京,江苏肯达建设工程有限公司南京分公司,本科,经验不限,"工程管理,商务管理,英语,阿拉伯语",1.5-3万·14薪,岗位职责：1.协助CEO处理日常行程安排、会议筹备、文件起草及跨部门协调，确保高效沟通与执行；2.陪同参与国内外商务谈判、高层会议及社交活动，担任中英文双语记录及翻译工作。3.参与海外项目前期调研、合作方对接及执行落地，协助制定海外业务拓展策略；4.负责跨国团队沟通协调，跟进项目进度并输出报告（英文）；5.收集全球行业动态、政策法规及竞品信息，提炼核心洞察供管理层参考；6.协助CEO处理国际差旅、...,工程施工,http://jobs.zhaopin.com/CCL1360134300J40667239706.htm,300-499人,2025-08-18 09:10:34
产品运营经理,南京,汇通达,大专,5-10年,C端用户,1.5-3万,岗位职责：1、负责品牌、产品类目的开发引进及全生命周期管理，包括渠道开发、营销、销售等规划与落地执行；2、研判市场发展及趋势，挖掘新产品的潜在机会，设计相关产品整体解决方案；3、对行业相关产品进行持续的跟踪和分析，积极主动探索未来发展方向；4、建立体系化相关产品矩阵，提升商业竞争力。任职要求：1、大专及以上学历，8年以上相关工作经验，有资深3C数码、泛智能行业项目管理经验者优先；2、逻辑性强，对复...,互联网,http://jobs.zhaopin.com/CC393677210J40741654913.htm,1000-9999人,2025-08-13 15:23:31
产品设计总监,南京,国机数字科技有限公司,硕士,5-10年,"软件产品,AI产品,数据产品",面议,岗位职责:1、产品战略规划与布局：制定公司产品线的中长期战略规划，结合市场趋势、技术发展及用户需求，明确产品定位与发展方向，主导产品roadmap的制定与落地，确保产品布局的前瞻性和市场竞争力。2、跨团队团队管理与协同：协助领导产品管理团队（涵盖软件、硬件产品方向），负责团队人才培养与梯队建设；协调研发、设计、市场、销售等跨团队资源，推动各环节高效协作，确保产品全生命周期目标达成。3、大型产品设计...,计算机软件,http://jobs.zhaopin.com/CCL1472344680J40830164608.htm,300-499人,2025-08-07 13:44:26
医药产品经理,南京,扬子江药业集团,本科,3-5年,"化学药,中药,呼吸科,内分泌科,儿科,肿瘤科,消化科,精神科,皮肤科,心血管科,神经科",1.5-3万,1、按治疗领域（呼吸、皮肤、消化、精神神经等）进行产品线的全景分析（包括疾病基础、市场环境、产品评估等），为集团已上市产品提供策略支持，为公司新品开发提供市场前景研判支持；2、参与相关产品领域布局的市场规划工作；3、集团重点考核品种的市场策略与推广支持；包括但不限于产品年度营销计划的制定、推广工具的制作、相关文献汇编等；4、产品线专家体系和平台的搭建；5、产品线市场活动的规划、整合和执行等相关工作...,医药制造,http://jobs.zhaopin.com/CC131937030J40490544101.htm,10000人以上,2025-07-15 17:41:54
高级产品经理,南京,江苏零浩网络科技有限公司,本科,5-10年,"MES系统,B端产品,SaaS",2-3万·13薪,"1.主导物流/供应链SaaS产品全生命周期管理:独立负责核心物流数字化产品(如TMS/WIS/OMS)从规划、设计、开发、上线到迭代优化的全过程。2.设计复杂业务流程的标准化产品方案:运用企业级SaaS方法论，将物流/供应链领域的复杂业务流程进行抽象化、模块化设计，确保产品扩展性与可配置性。3.驱动技术可行性与高效落地;深度理解微服务、数据中台、API等技术逻辑，与技术团队紧密协作,确保产品设计合...",互联网,http://jobs.zhaopin.com/CC293273230J40749168609.htm,500-999人,2025-06-24 11:20:57
产品经理,南京,南京南自华盾数字技术有限公司,本科,经验不限,"软件产品,AI产品,智慧服务,智慧办公,NLP产品,知识图谱产品,智能问答产品",1.5-3万,岗位职责行业业务深度洞察：深入研究发电行业业务逻辑，包括火电、水电、新能源发电的生产流程、调度管理、设备运维等核心环节，精准挖掘业务痛点与信息化升级需求，输出贴合行业特性的产品规划。信息化全流程把控：主导发电行业信息化项目全生命周期管理，从需求分析、方案设计、开发测试到上线运维，协同技术、开发、测试等多部门，确保项目高效推进，实现产品按时交付与稳定运行。产品全链路管理：负责产品从概念到落地的全流程...,IT服务,http://jobs.zhaopin.com/CC587279520J40853624615.htm,100-299人,2025-06-13 12:25:39
高级硬件产品经理,南京,南京军理科技股份有限公司,中专/中技,5-10年,"生产,工艺,智能硬件产品,物联网产品,B端产品",2.2-3万,岗位内容：1. 统筹机械结构、硬件产品的规划和开发的全生命周期管理以及产品交付；2. 定义硬件产品的功能、规格与设计文档，对产品进行日常跟进并协调解决问题；3. 协同多部门团队（研发、结构、模具、电路、软件、测试、生产、市场等），把控进度，化解问题与风险；4. 跟踪市场趋势和竞争对手情况，制定相应的产品策略和计划。任职要求：1. 电子信息、通信、机械等机电一体化相关专业；2. 需有硬件产品开发经验...,智能硬件,http://jobs.zhaopin.com/CC554862720J40702244014.htm,20-99人,2025-06-09 00:08:22
综合助理,南京,江苏四新科技应用研究所股份有限公司,本科,5-10年,"行政管理,商务管理,销售管理,英语",1.5-3万,工作性质：全职工作地点：俄勒冈州波特兰；需要偶尔出差南卡格林维尔汇报上级：北美四新总经理岗位职责：1、负责公司对外商务接待安排等； 2、负责协助领导协调日常管理事务、会议安排、会议纪要、PPT制作、会议事项跟进； 3、负责领导安排的其他临时工作；4、领导行程安排、报销等；5、负责销售人员的日常工作汇报；6、协助销售人员的客户开发的发样、订单执行、出货等；7、负责对接工厂的人员及工作情况跟进、汇报等...,石油/石化,http://jobs.zhaopin.com/CC289819980J40744187511.htm,100-299人,2025-06-06 15:05:58
售前产品经理,南京,江苏方之得自动化科技有限公司,本科,5-10年,,1.5-3万,岗位职责： 1、充分与客户沟通，获取客户需求，开展需求调研，将业务需求转化为功能需求； 2、根据功能规范，制定相应技术指标、功能实现规则； 3、编制项目/产品需求分析报告，传递需求至开发工程师。 任职要求： 1、电力系统自动化或电力、电气工程等相关专业，本科及以上学历； 2、具备扎实的电力二次专业知识，电力行业工作经验五年以上； 3、熟练使用word，excel，powerpoint相关办公软件，...,电力/水利/热力/燃气,http://jobs.zhaopin.com/CC514614430J40519447706.htm,20-99人,2025-05-22 15:50:00
