职位,城市,公司,学历,经验,技能,薪资,工作描述,行业,职位URL,公司规模,发布时间
新媒体运营/网络推广,南京,南京海豚教育咨询有限公司,本科,1-3年,新媒体运营,8000-15000元,"岗位职责1.负责线上渠道(微信公众号、美团大众点评投流运营，抖音/视频号、小红书、社群等)的日常运营及用户增长,策划并执行内容营销活动;2.结合课程产品特性制定线上推广策略，提升品牌曝光度及用户转化率;3.监测运营数据(阅读量、互动率、转化率等)，定期输出分析报告并优化运营方案;4.协同市场、教研团队策划线上活动(直播、打卡、裂变等)，推动招生目标达成;5.跟踪教育行业趋势，挖掘新兴流量平台运营机...",互联网,http://jobs.zhaopin.com/CCL1318355140J40857013503.htm,500-999人,2025-11-18 10:31:57
生物科学类 英文学术期刊助理编辑,南京,曼迪匹艾(南京)科技服务有限公司,硕士,经验不限,英语六级,1.2-2.4万,一、工作职责1. 负责联系专家学者，组织稿件的同行评审，确保稿件的同行评审及时完成；2. 编排和处理稿件，确保稿件格式正确，及时发表；3. 与期刊主编，编委成员，作者及审稿人建立良好沟通，确保期刊正常运作，稿件顺利及时发表；4. 关注期刊学科领域内的研究进展，协助期刊责任编辑完成期刊发展目标。 二、职位要求1.硕士博士优先，优秀的本科生亦可考虑；2.生物科学，生物技术，生物信息学，生态学，基因工程...,科学技术推广,http://jobs.zhaopin.com/CCL1327109300J40763284305.htm,1000-9999人,2025-04-08 14:23:25
新媒体运营,南京,南京旺居房地产销售有限公司,大专,3-5年,,8000-15000元,"岗位职责1.负责公司的线上运营工作，完成社媒账号(微信、小红书、抖音等)视频内容制作及发布引流3.选题策划、编导、视频拍摄、剪辑及运营4.各平台内容制作与更新，维护粉丝群,提升账号粉丝量、互动率、转化率等相关运营指标5.能独立开发和维护平台达人并合作。了解并能落地短视频生产的全流程，包括但不限于脚本创作、文案编写、内容分发、爆款结构、视频制作. 任职要求 1.大专及以上学历，平面设计、影视编导、新...",房地产开发,http://jobs.zhaopin.com/CC138110420J40730905814.htm,20-99人,2025-11-11 14:29:46
内容运营（SEO优化方向）,南京,北京指南者前程教育科技有限公司,本科,1-3年,"文本类,抖音,微信公众号",1.1-1.5万·14薪,【岗位职责】1、搜索行为分析： 持续监测和分析主流搜索引擎的内容收录逻辑，总结其偏好的内容类型、结构等，为内容创作提供方向；2、策略性内容创作： 基于分析报告，负责规划并撰写能被搜索引擎优先引用的内容；3、效果评估与迭代： 关注已发布内容在搜索引擎中的收录情况，并基于数据持续优化内容策略，提升内容被搜索引擎推荐的概率；4、行业动态追踪： 持续关注AIGC技术的最新发展，把新发现快速用到内容策略里，...,科学技术推广,http://jobs.zhaopin.com/CC632690830J40855521602.htm,100-299人,2025-11-10 13:34:55
植物生产类英文学术期刊助理编辑,南京,曼迪匹艾(南京)科技服务有限公司,本科,经验不限,,9000-18000元,一、工作职责1. 负责联系专家学者，组织稿件的同行评审，确保稿件的同行评审及时完成；2. 编排和处理稿件，确保稿件格式正确，及时发表；3. 与期刊主编，编委成员，作者及审稿人建立良好沟通，确保期刊正常运作，稿件顺利及时发表；4. 关注期刊学科领域内的研究进展，协助期刊责任编辑完成期刊发展目标。 二、职位要求1. 硕士博士优先，优秀的本科生亦可考虑；2. 农学，园艺，植物保护，植物科学与技术学，园艺...,科学技术推广,http://jobs.zhaopin.com/CCL1327109300J40777615905.htm,1000-9999人,2025-05-20 14:10:29
高底薪新媒体运营（房地产）,南京,南京旺居房地产销售有限公司,大专,1-3年,"社群运营,房地产/建筑,公众号/朋友圈运营,短视频运营,专业脚本,微信10万+阅读,策划热点事件",8000-15000元,岗位职责： 1、根据账号的内容定位确定优质短视频选题。 2、根据公司的项目定位，编写有创意及能突出项目特点的文案脚本。 3、基于品牌宣传、项目定位推广等需求，产出具有丰富想象力和市场竞争里的内容策略及创意，并落地实现。 4、协助团队完成短视频制作全流程，协调、沟通与短视频制作相关的各环节，保证成片效果。 5、负责视频账号日常运营及维护。 6、根据公司推广需求和项目需求，提高账号的粉丝量和转化率。 ...,房地产开发,http://jobs.zhaopin.com/CC138110420J40526856114.htm,20-99人,2025-11-11 14:29:09
期刊管理编辑,南京,南京泰克赛思信息科技有限公司,本科,3-5年,"编辑,英文编辑,医药编辑",1-1.5万,职责描述： 1.杂志相关的组稿、选稿、审稿、编辑加工、校对、后期制作等 2.负责编辑部的对外交流，包括国内外发行、组稿及专家联络接待等 3.关注期刊学科领域内的研究进展，参加国内外相关领域的学术会议，保持同科研人员的联系，加强期刊宣传，完成期刊发展目标任职要求：1.具有本科及以上学历，有编辑工作经验者优先； 2.英语书面表达能力和沟通能力熟练； 3.对数学、力学等相关知识具有浓厚兴趣； 4.具备一...,新闻/出版,http://jobs.zhaopin.com/CC623460930J40063433504.htm,100-299人,2025-11-03 16:20:10
新媒体运营专员,南京,南京远帆生涯科技有限公司,大专,1-3年,"抖音,短视频平台,直播运营",8000-15000元,岗位职责：1.社群运营与用户维护： ①维护社群，保持日常互动。 ②通过社群的运营回复激活社群粉丝以及社群裂变，老带新，增加客户人数，从而实现拓客&品牌推广的目的。 ③搜集与整理干货信息，提升社群内品牌专业形象与用户信任感。 ④及时回应用户回复及私信，处理投诉与建议，收集用户需求与反馈。 ⑤跟踪多平台数据（上门量、活动报名数等），分析用户行为与内容效果；根据数据结果调整内容发布时间、类型及活动策略，...,咨询服务,http://jobs.zhaopin.com/CCL1497935920J40850380315.htm,20-99人,2025-09-26 16:35:30
医美小红书运营,南京,南京蒂泓生物科技有限公司,学历不限,3-5年,"内容运营,小红书,新媒体运营,医美",1.1-1.5万,岗位职责：1、负责抖音，小红书，视频号等平台，账号日常运营工作；2、制定推广计划，优化聚光平台投放规则；3、熟悉投流机制。任职要求:1、2年以上经验，做过医疗相关优先，做过IP人设；2、善于分析用户心理，思维活跃对平台规则调整有前瞻性;3、对新媒体、自媒体平台规则熟悉，对新媒体、自媒体推广有自己独到的见解;4、有医疗美容行业同岗位工作经验优先。,美发/美容/保健,http://jobs.zhaopin.com/CCL1294430790J40708714114.htm,20-99人,2025-09-10 17:55:42
IP运营（知识付费赛道+双休）,南京,江苏德锐管理科技有限公司,本科,3-5年,"抖音,视频类",1-1.5万,"【工作职责】1、内容策划：负责公司视频脚本撰写、文案为视频整体的曝光度负责；2、账号运营：运营公司重点IP视频账号，打造优质的粉丝心智。3、渠道推广：熟悉平台投放规则，做好周期性投流计划。4、数据分析：对数据敏感，具有较强的成本意识。（整体希望对于内容创作或投流数据方面有一项相对熟练）【任职资格】1、本科及以上学历，专业不限；2、至少操作过一个以上平台,微博、抖音、快手、小红书等3、有较强的文字功...",企业服务,http://jobs.zhaopin.com/CCL1486304580J40721761016.htm,100-299人,2025-09-09 11:51:18
高级新媒体运营（小红书平台+留学+双休14薪）,南京,北京指南者前程教育科技有限公司,本科,经验不限,教育类,1-1.5万·14薪,【公司简介】指南者留学成立于2012年，是一家专注于海外名校研究生申请的留学咨询机构。成立十三年来，公司在南京设立了总部，同时在北京、上海、广州、厦门、常州、香港等地设有分公司，全职人员规模300+，2024全年营业收入破1亿。【岗位职责】1、负责小红书平台的市场推广及运营工作，制定推广计划并实施执行；2、了解小红书运营模式、流程及规则，熟悉平台的运营操作规范，掌握各种营销工具的应用方法；3、结合...,科学技术推广,http://jobs.zhaopin.com/CC632690830J40796883902.htm,100-299人,2025-08-20 21:47:35
文案策划主管+品牌策划主管,南京,南京四季物语生物科技有限公司,本科,1-3年,"种草类,电商类",1-1.5万,"岗位职责：1、 负责新品推广策划及落地,围绕目标市场和用户,挖掘产品卖点,独立策划上市传播方案并落地；2、 负责品牌系列产品上市,与渠道、产品,规划产品定位、策划新品创意概 念、制定传播策略；3、 负责大促节点(双十一、618、CNY等)新媒体营销方案制定、内容规划与投放(小红书、抖音、知乎、B站)；4、 负责产品媒介种草，结合小红书/抖音/知乎等平台特性，制定阶段性传播计划，借助 KOL 短视频...",电子商务,http://jobs.zhaopin.com/CCL1201334490J40581124906.htm,500-999人,2025-07-17 15:41:35
小红书运营,南京,服诺教育,大专,经验不限,"图文平台,小红书,知乎,微信公众号,教育类,内容运营,短视频运营",8000-15000元,岗位职责：1、负责小红书/抖音等新媒体平台整体经营策略，推动新媒体矩阵账号的IP打造、粉丝增长、流量变现2、负责新媒体平台投放账户运营（小红书聚光/抖音巨量），投放数据复盘，账户调整，达成业绩目标及成本要求3、策划、制作和传播优质且具有传播性的内容（包括深度稿、图文、海报、视频等）4、调研市场动态及竞品动态，了解用户需求，优化推广策略和创意方案，根据公司产品特性，孵化小红书及抖音IP，为考研项目招...,培训/辅导服务,http://jobs.zhaopin.com/CC384889910J40602769609.htm,100-299人,2025-06-25 17:59:04
生物科学类 英文学术期刊助理编辑,南京,曼迪匹艾(南京)科技服务有限公司,硕士,经验不限,"细胞培养技术,微生物工程,酶工程,蛋白纯化工艺,疫苗,细胞药物,生物药,发酵工艺,质粒纯化工艺",1.2-1.5万,一、工作职责1. 负责联系专家学者，组织稿件的同行评审，确保稿件的同行评审及时完成；2. 编排和处理稿件，确保稿件格式正确，及时发表；3. 与期刊主编，编委成员，作者及审稿人建立良好沟通，确保期刊正常运作，稿件顺利及时发表；4. 关注期刊学科领域内的研究进展，协助期刊责任编辑完成期刊发展目标。二、职位要求1.硕士博士优先；2.生物科学，生物技术，生物信息学，生态学，基因工程等相关专业；3.英语六级...,科学技术推广,http://jobs.zhaopin.com/CCL1327109300J40761194505.htm,1000-9999人,2025-06-10 08:12:54
资深新媒体运营,南京,南京苏宁工程咨询有限公司,本科,1-3年,"短视频平台,图文平台,小红书,微信公众号,今日头条,抖音,哔哩哔哩,快手,数码类,家装类,新闻类,短视频运营,内容运营,电商运营",8000-15000元·13薪,1. 内容策划与编辑：- 负责制定新媒体内容策划方案，包括选题、撰写、编辑和发布；- 撰写具有传播性的优质内容，提升品牌知名度和用户粘性；- 定期分析内容数据，优化内容策略。2. 社交媒体管理：- 负责企业官方社交媒体账号的日常运营，如微信公众号、抖音、快手等；- 维护与粉丝的互动，提高粉丝活跃度和忠诚度；- 跟踪社交媒体发展趋势，探索新兴平台和玩法。3. 活动策划与执行：- 策划线上线下活动，提...,房地产开发,http://jobs.zhaopin.com/CC302077710J40634373613.htm,500-999人,2025-06-02 17:18:24
内容运营,南京,服诺教育,大专,1-3年,"小红书,微信公众号,微博",8000-15000元,【工作职责】1、负责公司小红书公众平台的日常运营维护，包括内容策划、文案撰写、排版发布等；2、根据公司营销推广方向创作或者改编出高质量的营销内容；3、完成上级安排的其他新媒体推广及品牌宣传相关的任务。【任职要求】1、大专及以上学历，需一年左右相关工作经验；2、思维活跃创新，具备一定的文字功底；3、认真负责，积极学习，善于沟通，具备团队协作精神；4、能进行简单图片处理。 【福利待遇】 1、薪资构成：...,培训/辅导服务,http://jobs.zhaopin.com/CC384889910J40578317209.htm,100-299人,2025-05-13 09:32:03
化学类 英文学术期刊助理编辑,南京,曼迪匹艾(南京)科技服务有限公司,硕士,经验不限,"高分子材料,化工产品,化学品",1.2-1.5万,Molecules 专注于化学学科的最新进展，涵盖有机化学、天然产物化学、药物化学、理论化学、纳米化学等研究领域，是MDPI创办最早的开放获取期刊，目前被SCIE等重要数据库收录。一、工作职责1. 负责联系专家学者，组织稿件的同行评审，确保稿件的同行评审及时完成；2. 编排和处理稿件，确保稿件格式正确，及时发表；3. 与期刊主编，编委成员，作者及审稿人建立良好沟通，确保期刊正常运作，稿件顺利及时发...,科学技术推广,http://jobs.zhaopin.com/CCL1327109300J40761193205.htm,1000-9999人,2025-06-10 08:12:39
新媒体运营专员,南京,南京光速教育科技有限公司,本科,1-3年,"教育类,图文平台,小红书,内容运营,用户运营",8000-15000元·13薪,本岗位为项目子公司招聘，主要从事中小学生编辑、机器人及其竞赛、高中综评培训辅导、中小学生AI学科教育辅导业务。【职位发展】专员——主管——经理——总监岗位职责：1.策划相关爆款内容，包括备考干货分享、能力提升、功利目的等，精准吸引目标用户2.设计引流路径，通过评论区运营、置顶导流实现私域转化3.负责账号日更及数据优化，结合热点快速产出图文/短视频，提升粉丝活跃度4.监控竞品动态，针对性调整内容策略...,培训/辅导服务,http://jobs.zhaopin.com/CC704919680J40710606407.htm,20-99人,2025-04-25 15:20:28
小红书运营主管,南京,南京乐韬生物科技有限公司,大专,3-5年,医疗类,1-1.5万,岗位职责：1、负责公司品牌及重点产品在小红书平台种草；2、负责小红书平台的推广策略制定及落地实施；3、对品牌在小红书站内的声量及品牌GMV产出负责；任职要求：1、三年以上小红书，知乎，微博等平台运营经验；2、有自营团队运营经验；3、对小红书站内营销有完成的逻辑体系；4、对测评类笔记、好物分享类笔记有极强的把控能力；5、有从0-1的品牌或者爆款打造经验者优先；6、有矩阵账号运营经验着优先；7、有成人...,生物工程,http://jobs.zhaopin.com/CC890268230J40733111912.htm,100-299人,2025-03-05 00:08:02
细胞生物类 英文学术期刊助理编辑,南京,曼迪匹艾(南京)科技服务有限公司,硕士,经验不限,"细胞培养技术,微生物工程,酶工程,生物药,细胞药物",1.2-1.5万,一、工作职责1. 负责联系专家学者，组织稿件的同行评审，确保稿件的同行评审及时完成；2. 编排和处理稿件，确保稿件格式正确，及时发表；3. 与期刊主编，编委成员，作者及审稿人建立良好沟通，确保期刊正常运作，稿件顺利及时发表；4. 关注期刊学科领域内的研究进展，协助期刊责任编辑完成期刊发展目标。二、职位要求1. 硕士博士优先；2. 生物学，分子生物学，生物统计学，细胞工程，基因工程，生物化学或相关专...,科学技术推广,http://jobs.zhaopin.com/CCL1327109300J40761192905.htm,1000-9999人,2025-06-10 08:12:11
医学编辑,南京,南京冉鑫医疗科技有限公司,本科,1-3年,"临床医学编辑,原创撰稿,内科编辑,麻醉科编辑,外科编辑,骨科编辑,消化内科编辑,眼科编辑,口腔科编辑,肿瘤科编辑,呼吸内科编辑",7000-14000元,岗位职责：1.内部产品分析调研和竞品的信息分析，公司合作产品的关键卖点以及匹配的学术材料制作和宣传；2.公司产品的培训（含科室会、药店及公司内部）；3.与生产厂家沟通对接，达成双方合作任职资格：1.药学相关专业本科以上学历；2.1-3年医学编辑经验或医学培训机构的培训师经验；3.熟练掌握办公自动化等办公软件，有一定的培训能力；4.能适应一周2天左右的出差（省内）。,医药制造,http://jobs.zhaopin.com/CC308805110J40824588105.htm,20-99人,2026-01-11 00:47:01
小红书公众号运营-房补餐补-老带新,南京,南京江上渔者科技有限公司,大专,经验不限,"公众号运营,小红书运营,医疗类",7000-14000元,岗位职责：1.负责通过小红书平台，做推广、引流、转化2.负责搭建新账号、图文内容的排版编辑、视频的剪辑3 通过有效手段提升粉丝数、用户黏度及活跃度4 定期分析传播途径和方式，总结经验，优化运营方案任职要求：教育背景：大专及以上学历工作经验：有小红书运营经验专业能力：会基本的剪映（电脑版）运营，较强的文字功底职业素养：责任心强，性格活泼，有良好沟通及执行能力工作时间：白班:8:30-17:30 上六...,新媒体,http://jobs.zhaopin.com/CCL1494716350J40857908712.htm,20-99人,2026-01-11 00:28:42
食品科学及营养类 英文学术期刊助理编辑,南京,曼迪匹艾(南京)科技服务有限公司,硕士,经验不限,技术研发,1.2-1.5万,一、工作职责1. 负责联系专家学者，组织稿件的同行评审，确保稿件的同行评审及时完成；2. 编排和处理稿件，确保稿件格式正确，及时发表；3. 与期刊主编，编委成员，作者及审稿人建立良好沟通，确保期刊正常运作，稿件顺利及时发表；4. 关注期刊学科领域内的研究进展，协助期刊责任编辑完成期刊发展目标。二、职位要求1. 硕士博士优先；2. 营养学，食品科学与工程，食品质量与安全，食品安全，葡萄与葡萄酒工程，...,科学技术推广,http://jobs.zhaopin.com/CCL1327109300J40761192505.htm,1000-9999人,2025-06-10 08:11:59
医学编辑,南京,南京宁伽信息管理有限公司,本科,经验不限,"生物医学编辑,临床医学编辑,组稿,页面排版,内容审核,审稿改稿,风湿免疫科编辑",7000-14000元,1、收集并编辑最新医学研究热点，最新医学会议等2、英文文献翻译及编辑3、医学市场活动策划及执行,企业服务,http://jobs.zhaopin.com/CCL1216972970J40863308812.htm,20-99人,2026-01-08 01:33:15
新媒体运营经理,南京,南京康雁医疗器械有限公司,本科,5-10年,"短视频平台,抖音,快手,微信视频号,内容运营,短视频运营,电商运营",9000-14000元,岗位职责：1.AI驱动的全域内容运营熟练运用AI内容生成工具(如Runway、HeyGen、 Kimi、通义万相、剪映等)批量产出短视频、图文、 直播脚本，打造门店IP人设(如“社区循环生活官”); 搭建AI Agent智能体矩阵，实现*******i/小红书/ 抖音/微信视频号等平台的自动化内容分发、评论互动与热点追踪； 策划“二手好物故事化”内容系列(如“一件LV包的10年旅程”“离职杭漂的断,医疗设备/器械,http://jobs.zhaopin.com/CCL1502000140J40785434216.htm,20人以下,2026-01-05 16:47:15
Molecules 期刊助理编辑,南京,曼迪匹艾(南京)科技服务有限公司,硕士,无经验,,1.2-1.5万,一、工作职责1. 负责联系专家学者，组织稿件的同行评审，确保稿件的同行评审及时完成；2. 编排和处理稿件，确保稿件格式正确，及时发表；3. 与期刊主编，编委成员，作者及审稿人建立良好沟通，确保期刊正常运作，稿件顺利及时发表；4. 关注期刊学科领域内的研究进展，协助期刊责任编辑完成期刊发展目标。二、职位要求1. 硕士博士优先；2. 化学、材料、药学、生物等理工科相关专业；英语相关专业；3. 英语六级...,科学技术推广,http://jobs.zhaopin.com/CCL1327109300J40761192105.htm,1000-9999人,2025-06-10 08:11:45
工业地产-新媒体运营,南京,南京寻仓网络科技有限公司,大专,1-3年,"短视频平台,图文平台,微信公众号,抖音,微信视频号,工业地产",7000-14000元,【岗位职责】1、负责新媒体平台搭建和维护工作2、运营抖音 快手 小红书等各新媒体平台账号 小白号引流3、建立粉丝粘性 涨粉 提升活跃度4、有经验者。2年及以上。内容包括不限于：视频/抖音号1，成交视频2，厂房推荐视频3，品牌视频4，段子视频公众号1，市场分析2，节点海报3，月终总结（喜报总结）4，公司事件等任职要求:1、专业不限，了解新媒体运营方式，对新媒体产品有浓厚兴趣，对用户增长有认知2、工业...,租赁服务,http://jobs.zhaopin.com/CCL1448653410J40755887913.htm,20-99人,2025-12-12 11:38:59
小红书自媒体运营专员,南京,新视云,本科,1-3年,,7000-14000元,岗位职责：平台日常运营管理、用户增长策略制定、活动策划执行、数据分析与资源整合。岗位要求：1.有2年以上抖音、小红书、知乎等平台运作经验。2.了解公众号内容制作排版发布，抖音小红书知乎视频脚本写作、剪辑发布，关注账号数据账号成长。3.法学背景优先，理解法律服务行业特性。4.具备数据驱动决策能力，能通过数据优化运营策略。,互联网,http://jobs.zhaopin.com/CC440596310J40973051704.htm,100-299人,2025-12-11 10:27:13
新媒体运营主管,南京,南京普瑞泰格安全设备工程有限公司,本科,5-10年,"图文平台,小红书,短视频平台,抖音,微信视频号,哔哩哔哩,医疗类,内容运营,产品运营,用户运营",8000-14000元,岗位职责:1.负责品牌传播内容的策划、审核与把控，确保品牌形象对外的一致。2.编写品牌战略与策划方案，包括品牌长期战略目标与方向规划、传播推广计划等。3.负责企业对外展会活动的策划和运营。4.与公司品牌发展相关的各事项统筹协调，协同公司各部门推进业务各环节的完善闭环。5.负责公司官方公众平台的内容输出，与运营团队同事合作，为公司打造私域流量池，构建新媒体。任职要求：1.具有较强的品牌战略规划和社交...,环保,http://jobs.zhaopin.com/CC668870680J40691188806.htm,100-299人,2025-12-03 09:16:16
海外社媒运营专员,南京,南京陆奥贸易有限公司,本科,1-3年,,7000-14000元,岗位职责：1、在facebook，lingkedin等社交媒体上发布，管理公司及产品信息；2、在海外论坛等平台上，发布产品文案；3、在youtube等视频网站上，发布管理产品视频；4、撰写相关产品文案；5、策划视频拍摄内容；6、管理平台账号，积极和客户进行互动；岗位要求1、有相关工作经验1-3年；2、本科及以上学历，英语6级及以上；3、性格外向活泼，有良好的的沟通表达能力，思维活跃；4、会拍照片，...,汽车零部件,http://jobs.zhaopin.com/CC658582720J40734512306.htm,100-299人,2025-11-18 17:31:05
留学文书全案,南京,青岛凯琛教育咨询有限公司,本科,3-5年,"申请文书,申诉文书",7000-14000元,岗位职责：1、负责为学生提供英国院校申请各类文案规划服务2、负责撰写上诉文案，回复学生邮箱上诉相关邮件，并且定期检查，学生文案服务全流程把控，确保学生文案按时输出0为3、及时和英国留学顾问老师沟通，积极反馈各项目的进展情况4、积极跟进学生英国大学的申请进度5、定期参与部门内部培训，不断学习，更新业务知识6、与英籍文案老师沟通学生申请，匠心打造学生申请文案7、解答学生关于上诉相关的问题，定时向公司领...,在线教育,http://jobs.zhaopin.com/CCL1501514930J40817275310.htm,100-299人,2025-11-03 09:38:43
医学编辑撰稿+医学核心写作员+医学审核编辑+医学核心期刊编辑,南京,四川录智达文化传媒有限公司,硕士,经验不限,"中药编辑,西药编辑,生物医学编辑,临床医学编辑,内科编辑,外科编辑,儿科编辑,骨科编辑,妇产科编辑,麻醉科编辑,消化内科编辑",7000-14000元,"医学编辑撰稿+医学核心写作员+医学审核编辑+医学核心期刊编辑1．从选题到医学论文设计撰写能独立出色完成，文章有较高的质量水平（在公司做过医学编辑的优先合作，优先合作）。2．独立指导从立题到文章发表的所有环节,能够组织学科组进行相关疑难事项进行讨论交流。3。审核编辑老师；要有丰富经验，杂志社编辑为主（欢迎联系，洽谈）职位要求:1、具有丰富的写作及发表医学论文的经验；2、硕士以上学历 ，有从事相关经验...",科学技术推广,http://jobs.zhaopin.com/CCL1479869640J40504536113.htm,20-99人,2025-10-09 15:32:21
