职位,城市,公司,学历,经验,技能,薪资,工作描述,行业,职位URL,公司规模,发布时间
plc电气工程师,南京,山东航福智能装备科技有限公司,本科,5-10年,"PLC,控制系统",1.2-2.4万·13薪,嘿，我们正在寻找一位充满激情、有才华的PLC工程师，一起参与工业自动化控制系统的冒险！你的工作将是设计、编写、测试与调试PLC程序，参与方案设计与评审，让机器和设备在我们的掌控下灵活舞动。如果你具备以下条件，就赶快加入我们吧！本科及以上学历，电气自动化、机电一体化等相关专业；5年以上PLC工程师工作经验，热爱工业自动化控制领域；熟练掌握PLC编程软件，如Siemens、Omron、Mitsubis...,智能硬件,http://jobs.zhaopin.com/CCL1492656500J40725323716.htm,100-299人,2025-06-22 12:43:34
电气设计师,南京,中通服设计院,本科,5-10年,,面议,岗位职责：从事各类公共、民用建筑电气设计或机房工程电气设计工作，或担任大型项目电气专业负责人。任职资格：建筑电气相关专业本科及以上学历。5年以上大型设计院建筑电气专业设计经验，有较强的高低压供配电设计、建筑工程及其它强弱电设计能力，熟悉国家现行的低压供配电及建筑电气设计安装规范，有市场工作经验者优先考虑。有高级职称或注册电气工程师证书者优先考虑。能够适应出差。,通信/网络设备,http://jobs.zhaopin.com/CC132104120J40784825408.htm,1000-9999人,2025-03-12 18:54:50
高级电气工程师（南京）,南京,上海美诺福科技有限公司,本科,5-10年,,1.7-2.3万,岗位职责：1.对营销、工厂生产、现场的技术支持；2.完成设备、系统的电气设计，配合生产调试、项目调试、优化消缺；3.设备操作说明书的编制，部分项目的硬件设计，程序标准化的设计；4.大型、复杂系统的设计、调试、技术支持与培训。5.专业技术培训，培养技术人才；6.售前售后技术支持；7.对调试中的电气技术问题给予支持和分析处理、优化、消缺；8.负责设备的电气硬件设计（硬件选型、采购单、BOM、电气图纸设...,工业自动化,http://jobs.zhaopin.com/CC144891620J40819000611.htm,300-499人,2026-01-06 09:09:48
高级电气设计工程师,南京,江苏高仕人力资源有限公司,本科,5-10年,"设计,PLC设计,自动化设计,西门子,倍福,CODESY,施耐德",1.8-2.3万,岗位职责：1、设计电气控制方案、评审及风险评估；2、绘制电气原理图、选型；3、研发编制及调试程序；4、协助解决现场故障；岗位要求：1、本科及以上学历，自动化、电气或仪表相关专业，5年自动化设备研发工作经验；2、精通Codesy常用电气软件及常用的通信协议；3、熟练掌握电气标准、电气工程规范，电气制图；4、熟练掌握常见的 PLC 品牌（西门子/倍福/施耐德）编程与相关硬件（变频器/触摸屏/伺服电机控...,人力资源服务,http://jobs.zhaopin.com/CCL1479572200J40959666304.htm,20人以下,2025-12-29 10:19:10
电气工程师--伺服机器人,南京,南京尔顺科技发展有限公司,本科,3-5年,西门子,1.5-2.3万,岗位职责：负责以伺服机器人系统为重点的自动化项目电气硬件设计，包括伺服驱动器、电机及相关控制元器件的选型，绘制电气控制原理图、接线图、控制柜布局图等；负责伺服机器人控制系统的电气软件设计与开发，重点进行PLC程序编写、伺服运动控制逻辑实现、HMI/上位机界面组态与调试；主导伺服机器人系统的现场调试，负责电气安装指导、参数整定、运动精度调试、多轴协调控制调试及系统故障诊断与处理；编写伺服机器人设备操...,电气机械/电力设备,http://jobs.zhaopin.com/CC394348110J40862140812.htm,100-299人,2025-12-22 14:47:46
高级电气工程师,南京,华章物流,本科,5-10年,"设计,编程,PLC设计,自动化设计,智能仓储,机械臂,四项车,西门子,施耐德,倍福,ST/SCL",1.8-2.3万,岗位职责：1、研发产品项目方向，设计电气控制方案、评审及风险评估；2、绘制电气原理图、选型；3、研发编制及产品验证调试程序；4、协助解决现场故障（项目现场有电气调试工程师）。岗位要求：1、本科及以上学历，自动化、电气或仪表相关专业，5年自动化设备研发工作经验；2、精通Codesys常用电气软件及常用的通信协议；熟悉ST/SCL语言3、熟练掌握电气标准、电气工程规范，电气制图；4、有自动化行业工作经...,人工智能,http://jobs.zhaopin.com/CC233222510J40742043206.htm,100-299人,2025-12-17 11:17:48
电子工程师,南京,南京博兰得电子科技有限公司,本科,1-3年,电源,1.6-2.3万·13薪,"【岗位职责】1. 扎实的电力电子专业知识及较强的动手能力，熟练掌握电力电子常用拓扑电路：如buck,boost, 反激，半桥，全桥移相，forward ， LLC等电路结构和工作原理等； 2. 具有独立设计和调试能力；3. 有成本控制概念，了解安规、EMC等方面的要求。 4. 10kw以上的电源调试经验。【任职要求】1. 本科及以上，电子工程相关科系毕业； 2. 有2年以上开关电源开发工作经验，掌...",电子/半导体/集成电路,http://jobs.zhaopin.com/CC256910910J40533026614.htm,500-999人,2025-12-03 17:54:06
电气二次工程师（新能源电力设计院）,南京,瑞科科技,本科,3-5年,电力设计,1.5-2.3万·13薪,岗位职责： 1.参与风电、光伏及储能等新能源项目的电气二次工作，并对项目前期和现场施工提供专业技术支持； 2.负责本专业设计管控，能对设计方案和图纸提出优化建议，并及时与相关部门和单位沟通，达成优化； 3.负责风电、光伏及储能等新能源项目的保护、监控、通信等可研、初步设计、施工图设计，参加设计各阶段设计审查及设计联络会议； 4.能及时解决、指导、协调工程项目中出现的技术问题； 5.负责本专业的设计...,新能源,http://jobs.zhaopin.com/CC564180020J40966111604.htm,300-499人,2025-11-13 14:01:27
电气工程师,南京,江苏海外集团国际技术工程有限公司,本科,5-10年,"设计,低压,中压,高压,西门子,施耐德,ABB,电路设计,线路设计,电力设计,变压器,配电柜,开关柜",1.7-2.3万,1、职责描述① 化工工程项目电气专业的基础设计、施工图设计。包括装置变配电所布置、供配电系统、负荷计算、桥架布置、电缆布线、防雷接地、照明等；② 向相关下游专业提出设计条件；③ 化工工程项目电信专业的基础设计、施工图设计。包括电话/网络、火灾报警、闭路电视监控、公共/应急广播、门禁、周界入侵报警等综合布线系统；④ 编制电气/电信专业设备及材料请购技术文件；⑤ 承担在本专业领域与业主及供应商的沟通，...,专业技术服务,http://jobs.zhaopin.com/CC255317610J40810030805.htm,100-299人,2025-10-28 00:06:41
变电站二次设计,南京,成都腾惠工程设计有限公司南京分公司,本科,3-5年,"电力设计,输变电工程",1.2-2.3万,岗位职责:1、独立完成220kV及以下电压等级变电站的变电二次可研、初步设计、施工图设计等各阶段设计工作;同步完成设计文件送审、评审、出图及归档；2、收集项目的基础资料，勘察现场，参加协调会及方案比选工作;参加设计交底，配合施工、竣工验收，并处理施工现场技术问题;负责与业主方的协调配合，项目前期的技术支持；3、完成与土建、电气一次等专业相互提资等技术配合工作；4、有较强的自学能力，着重光伏储能、风...,电力/水利/热力/燃气,http://jobs.zhaopin.com/CCL1490739020J40771308103.htm,20-99人,2025-05-27 00:00:03
高级电气工程师（电磁）,南京,思源电气,硕士,3-5年,"永磁同步电机,开关柜,油浸式变压器,干式变压器",1.5-2.2万·15薪,主要职责：1)承接与参与电力电子电磁/线圈电磁/电磁铁电磁仿真能力的提升、技术平台的开发，如大功率电力电子器件、储能产品电磁兼容仿真能力提升与技术平台开发、设备级过电压仿真、变电站VFTO仿真、线圈类设备波过程仿真、多物理场耦合仿真，制定仿真流程和规范，建立电磁仿真平台；2)与子公司产线合作，促进电磁仿真技术平台的规划、开发、推广与迁移，承接和参与集团新领域产品的预研与开发，提供专业技术服务支持，...,电气机械/电力设备,http://jobs.zhaopin.com/CC000635070J40811081411.htm,1000-9999人,2026-01-11 01:28:05
数据中心电气工程师,南京,中电变压器股份有限公司,大专,5-10年,"数据中心,电力模块,电气设计",1.5-2.2万,岗位职责：1、负责数据中心一体化电力模块的技术交底，报价，调试交付等工作;2、负责绘制一次系统图、二次原理图、平面布置图等;3、负责设备选型和编制BOM，包括变压器、配电柜、UPS等。岗位要求：1、电气工程及其自动化，机电一体化等相关专业；2、有数据中心一体化电力模块设计，报价和调试经验；3、接受出差，具备良好的沟通能力和团队合作精神。,电气机械/电力设备,http://jobs.zhaopin.com/CC210821880J40837315005.htm,500-999人,2026-01-07 15:04:46
电气调试工程师,南京,江苏美加图电力设备有限公司,本科,3-5年,"安装/调试,高压,超高压,特高压,二次保护调试",1.1-2.2万,主要职责：1、掌握电力系统一次主接线、二次回路，熟悉电厂相关运行规程和国网25项反措要求；2、熟悉220kV及以上电压等级电厂的继电保护设备(南瑞、南自、四方、许继）；3、依据技术协议、设计图纸及设备调试大纲编制调试试验方案，并完成调试报告；4、调试过程中发现设计图有错误时，协调设计人员修改图纸；5、配合施工单位完成二次回路接线、校线；6、完成二次回路通流通压，传动试验、启机以及倒送电。任职要求：...,电力/水利/热力/燃气,http://jobs.zhaopin.com/CCL1355528560J40865447608.htm,20-99人,2025-12-31 16:32:14
高级电气工程师（绝缘）,南京,思源电气,硕士,3-5年,"高压,超高压,特高压",1.5-2.2万·15薪,主要职责：1)承接参与用于一次电力设备的绝缘材料的绝缘特性研究和选型，如环保绝缘气体特性、电接触件插接件通用技术规范开发；2)承接与参与一次电力设备绝缘系统的设计导则和相关判据规范的制定，基于设备机构绝缘系统机理、绝缘材料、绝缘验证试验的研究制定相关规范，设备包括变压器、互感器、电抗器、中压开关、水冷SVG产品等；3)承接与参与电磁场仿真技术等共用技术的能力建设、提升，为产线提供电磁场以及该专业方...,电气机械/电力设备,http://jobs.zhaopin.com/CC000635070J40811081911.htm,1000-9999人,2026-01-11 00:36:40
电子工程师,南京,南京汉悠电子有限责任公司,大专,3-5年,"设计,测试,技术支持",1.1-2.2万,职位职责： 1.分析客户需求和竞争对手硬件产品功能 2.硬件方案开发和可靠性分析，器件选型 3.输出产品设计文档，报告设计计算，原理图，LAYOUT，DFMEA等 4.硬件成本评估和控制 5.制定硬件BOM和支持采购寻找器件供应商 器件通用化 6.制定硬件测试方案 7.负责测试失效分析，生产失效分析，客户退件分析 8.支持硬件生产工艺，如器件焊接，分板等 职位要求： 1.有传感器或类似电子产品的开...,仪器仪表制造,http://jobs.zhaopin.com/CCL1470011050J40487680711.htm,20-99人,2025-12-30 17:50:58
数字化工程师,南京,南京国博电子股份有限公司,本科,1-3年,,1.5-2.2万,岗位职责：1.负责数字化车间整体架构的搭建和系统平台的建设及优化；2.负责数字化软件工具的开发；3.负责生产执行系统各子模块维护和定制化开发；4.负责半导体设备协议的测机、验证以及日常维护工作；5.负责产品及工艺、设备、工位数字化建模；6.整理并输出详细的实施过程文档，包括不限于技术说明、调试报告等；7.完成领导交办的其他事项。招聘要求：1、本科及以上学历，通信工程、计算机、工业工程等相关专业；2...,电子/半导体/集成电路,http://jobs.zhaopin.com/CC537943920J40776506307.htm,1000-9999人,2025-12-29 14:15:23
高级方案设计工程师,南京,思源电气,大专,5-10年,"电力设计,输变电工程",1.1-2.2万·13薪,"1.海外EPC工程项目执行管理2海外EPC工程项目设计3海外EPC工程项目投标4工程设计/技术管理体系流程建立与完善5平台支持相关数据库维护任职资格要求：教育与专业资格 本科及以上学历，电力类专业。电气工程及其自动化专业优先具备年及以上及以下变电站电气设计及现场技术指导经验有海外变电工作经验及年限：具备6年及以上330kV及以下变电站电气设计及现场技术指导经验,有海外变电站设计及现场技术指导经验者...",电气机械/电力设备,http://jobs.zhaopin.com/CC000635070J40797783711.htm,1000-9999人,2026-01-11 00:26:23
plc电气工程师,南京,南京泽润发智能科技有限公司,大专,3-5年,"PLC,Labview,自动化设备,非标设备,检测设备,PLC设计,技术支持,测试,西门子,三菱,欧姆龙,运动控制",1.5-2.2万·13薪,岗位内容：1. 制定PLC控制系统的设计方案，完成PLC编程及调试工作；2. 负责生产线设备的电气自动化控制系统的维护、升级和优化；3. 与其他部门配合，解决生产过程中出现的技术问题，并给出改进意见；4. 按项目计划安排，编写相关技术文档和报告。任职要求：1. 大专及本科以上学历，电气自动化、机械电子等相关专业；2. 有4年以上PLC编程开发经验，熟练掌握西门子、三菱或Allen-Bradley ...,工业自动化,http://jobs.zhaopin.com/CCL1501173710J40774193305.htm,20-99人,2025-12-26 14:46:52
厂务电力工程师-- 常驻土耳其,南京,江苏协航能源科技有限公司,大专,5-10年,"电力运维,电力调度,电力施工",1.5-2.2万,1、负责电力系统的运维管理、隐患排查与优化改造 2、负责电力系统的能耗管理与经济运行 3、电力相关的改造工作的技术方案审核 根据车间需求，提出车间技改时，提出电力相关技改初步方案。 车间技改实施过程中，对承包商提供的电力相关方案进行审核。 负责厂商施工阶段，电力相关分项工程接入电力主系统的审查与批准。 5、负责电力相关维修包的发包与管理 要求： 1、光伏电池厂务电力工程师工作经验、建厂经验 2、有...,电力/水利/热力/燃气,http://jobs.zhaopin.com/CCL1432843750J40816207411.htm,500-999人,2025-12-22 13:53:55
电气工程师,南京,江苏博克斯科技股份有限公司大连分公司,本科,3-5年,"设计,测试,电路设计,PLC设计,变频器,控制柜,电机,自动化设计,安装/调试",1.1-2.2万·13薪,"岗位职责： 1、磁悬浮鼓风机、压缩机、热泵等设备电气设计； 2、控制程序开发，编写相应的PLC和屏程序;；为产品经理或者客户提供专业电控解决方案;3、绘制电气原理图和接线图,选择合适电气元器件并列出组件BOM清单,构建程序框架并编写 PLC 和屏程序;4、指导电气装配,安装完毕后上电调试,使机组电路达到正常状态。5、协助系统工程师进行机组的性能测试,测试过程中对暴露出的控制问题及时改进; 任职资格...",金属制品业,http://jobs.zhaopin.com/CC847868430J40861926012.htm,300-499人,2025-12-22 09:33:43
电力工程设计,南京,中冶华天南京,本科,5-10年,注册电气工程师（发输变电）,面议,岗位职责：1）负责项目前期现场勘查、技术交流、技术方案（初步设计、详细设计、技术协议）的编制等。2）从事钢铁冶金企业全流程各工艺电气、仪表、自动化的施工图设计。3）从事钢铁冶金企业全流程各工艺控制系统的编程、调试工作。4）从事钢铁冶金企业全流程各工艺控制系统的技术、科研开发工作。5）及时处理工程上的各类技术问题，做好质量信息反馈工作。6）所负责工作的内部协调、及时向公司汇报项目情况。7）带领或协助...,工程技术与设计服务,http://jobs.zhaopin.com/CC438038610J40274981506.htm,1000-9999人,2025-12-19 11:00:58
柱上开关技术负责人,南京,迅风电子股份有限公司,本科,10年以上,"一二次融合柱上开关,一二次融合环网柜",1.1-2.2万·15薪,学历要求：本科及以上学历专业要求：电气工程、电力系统及其自动化、机械设计制造及其自动化、机电一体化、高电压与绝缘技术等相关专业经验要求：a) 有配电一次开关10年以上研发、生产管理等相关经验；b) 具有良好的沟通和表达能力，善于解决问题；c) 最好有一次产线工艺管理、流程管理经验者；d) 最好有一次开关或一二次融合技术标准参与修订经验；e) 精通GB3906、IEC 62271、GB1984、GB...,电力/水利/热力/燃气,http://jobs.zhaopin.com/CC589638820J40706158906.htm,100-299人,2025-12-18 11:44:52
南京 电控产品研发工程师,南京,深圳克莱蒙特科技有限公司,本科,5-10年,"设计,研发,MCU,TCU,DCU,电控 逆变器",1.2-2.2万,本岗位负责主驱电机控制器产品- 作为研发窗口与客户沟通互动，梳理客户的技术需求，分解安排到相关工程师团队，并完成相应的技术设计；- 领导（系统、结构、硬件、软件PM、软件设计、开发质量、工程、标定）等工程师对一切技术相关及痛点问题负责处理，确保开发技术质量，满足客户要求；- 统筹产品立项和可行性分析、开发、测试，验证，试产到量产的整个过程，分配资源、控制进度，协调处理项目各方遇到的问题，满足客户质...,工程技术与设计服务,http://jobs.zhaopin.com/CCL1229659270J40815385011.htm,100-299人,2025-12-18 11:26:23
电气工程师（传动）,南京,中冶华天南京,本科,5-10年,,面议,岗位职责：1）负责项目前期现场勘查、技术交流、技术方案（初步设计、详细设计、技术协议）的编制等。2）从事钢铁冶金企业全流程各工艺电气（供配电）、传动、控制系统的施工图设计。3）从事钢铁冶金企业全流程各工艺电气、传动、控制系统的调试工作。4）从事钢铁冶金企业全流程各工艺电气、传动的技术、科研开发工作。5）及时处理工程上的各类技术问题，做好质量信息反馈工作。6）所负责工作的内部协调、及时向公司汇报项目...,工程技术与设计服务,http://jobs.zhaopin.com/CC438038610J40740626606.htm,1000-9999人,2025-12-19 10:58:19
整车电气工程师,南京,开沃新能源汽车集团股份有限公司,本科,1-3年,CAD、CATIA,1.5-2.2万,岗位职责描述: 1. 零部件设计：完成常规电器件(喇叭、扬声器、收音机、开关部件、雨刮部件等)的匹配及验证，三维数模的布置及验证，并出具校验报告； 2. 整车原理图绘制：各子系统原理及功率参数确定和整车电气原理图设计； 3. 线束三维绘制：绘制整车三维线束布置图； 4. 线束二维绘制：二维图纸设计及后期图纸优化； 5. 整车搭载与调试：完成样车的搭载与整车低压调试，并对相关部件进行优化； 6. 技...,新能源,http://jobs.zhaopin.com/CCL1260856330J40203801608.htm,1000-9999人,2025-09-24 08:15:33
南京 电控硬件工程师,南京,深圳克莱蒙特科技有限公司,本科,3-5年,"设计,研发,硬件研发,MCU",1.3-2.2万,- 与团队密切合作实现控制单元硬件开发。- 主导电机控制器和功率变换器控制器的模拟电路应用，特别是高精度、高电压、大电流的测量。- 功率级/功率板设计，电力电子子系统开发，专注于开关电源设计、IGBT 应用和栅极驱动器设计- 全面负责从系统级到硬件实现的模拟电路设计。- 根据功能安全 （ISO26262） 要求设计硬件电路。- 电路仿真、WCA 和功能分析，热设计、可靠性设计和静态数据分析。- P...,工程技术与设计服务,http://jobs.zhaopin.com/CCL1229659270J40815355011.htm,100-299人,2025-12-18 10:41:04
新能源电气工程师,南京,南京易琥科技有限公司,硕士,3-5年,新能源，风电、电气工程师,1.1-2.2万,岗位职责： 1. 承担电气工程相关实验装置的研发、调试与维护工作；2. 参与科技项目辅助工作。岗位要求：1. 具备电机控制、电力系统控制等软硬件开发经验；2. 优先考虑有相关领域工作经验者。,新能源,http://jobs.zhaopin.com/CCL1351940350J40953455504.htm,20人以下,2025-09-18 18:10:13
变电一次设计师,南京,苏文电能科技股份有限公司,本科,5-10年,电力设计,1.2-2.2万,岗位内容：1. 设计、开发和维护电力系统的各种组件和设备。2. 分析电力系统中的问题，并提出解决方案，以确保其可靠性和安全性。3. 参与电力系统的现场调试和故障处理。4. 负责编写相关的技术文档和报告。任职要求：1. 具有电力工程或相关专业背景。2. 了解电力系统设计和运行原理，具备基础的电力知识。3. 熟悉 CAD 或其他电力设计软件。4. 具备良好的沟通和团队合作能力。5. 具备较强的学习和解...,电力/水利/热力/燃气,http://jobs.zhaopin.com/CCL1239149560J40820905713.htm,500-999人,2025-09-01 17:12:05
电气结构设计工程师,南京,南京智睿能源互联网研究院有限公司,本科,3-5年,AutoCAD,1.5-2.2万,岗位职责：1、负责产品线机柜及机箱的结构设计以及运输包装设计；2、负责产品线机柜及机箱的成本预估核算；3、负责产品线新老产品整个生命周期的维护工作；4、负责产品线研发样机生产装配指导及跟进工作；5、对新产品的散热方面做一定的评估。岗位要求：1、本科及以上学历，机械、自动化、电气相关专业，优秀者可放宽至大专；2、3年及以上电源及开关配电柜类机柜机箱结构设计经验；3、熟悉钣金机箱及机柜的结构设计，了解...,学术/科研,http://jobs.zhaopin.com/CC580857730J40729966109.htm,20-99人,2025-07-31 00:00:01
新能源系统工程师、电力系统分析工工程师,南京,南京易琥科技有限公司,硕士,3-5年,"新能源系统研发,电力系统分析",1.5-2.2万,1. 主要承担电气工程相关实验装置研发、调试和维护、科技项目辅助等工作；2. 具有电机控制、电力系统控制等软硬件开发经验者优先； 3.有3年以上的工作经验。,新能源,http://jobs.zhaopin.com/CCL1351940350J40952561104.htm,20人以下,2025-09-16 13:40:32
电气仪表工程师,南京,南京华电节能环保股份有限公司,本科,5-10年,"设计,技术支持,安装/调试,流量计,压力表,液位计,自动化仪表,热工仪表,电气仪表,锅炉,压力容器,西门子",1.1-2.2万·13薪,岗位要求：余热烟气处理系统中的电气、仪表设计及现场技术支持。任职要求：1、大学本科以上毕业，工作责任心强，有良好的团队协作能力；2、5年以上电气、仪表工程项目设计经验，熟练使用CAD等相关制图软件；3、具备独立完成工程系统中电气、仪表专业施工图设计的能力；4、具备较强的现场问题分析处理能力；5、具备指导工程施工现场进行电气、仪表安装、系统调试运行的能力；6、配合采购部完成设备采购工作；7、有团队领...,专用设备制造,http://jobs.zhaopin.com/CCL1309888240J40691535416.htm,100-299人,2025-06-25 10:32:20
高级电气工程师,南京,南京泰普森自动化设备有限公司,大专,5-10年,"西门子,三菱",1.1-2.2万·13薪,岗位职责1、负责非标自动化设备及生产线项目的电气程序标准和模版的设计工作；2、负责项目现场电气工作的计划安排、人员管理、交流对接；3、负责组织和管理项目现场的电气团队的设计、联调、验收等工作；4、负责组织和管理项目现场的第三方设备及MES信息化系统的对接和联调工作；岗位要求1、专科及以上学历，电气、机电一体化、自动化等相关专业。5年以上自动化设备设计和调试经验。具有较强的自动化设备及生产线电气调试...,专用设备制造,http://jobs.zhaopin.com/CC428087080J40670722107.htm,300-499人,2025-04-20 00:00:02
高级电气工程师（激光3D打印设备/数控机床/集成机器人）,南京,南京中科煜宸激光技术有限公司,大专,5-10年,"西门子,ABB,发那科,PLC设计",1.3-2.2万,岗位职责：1、独立完成生产线或工作站的电气方案开发与设计2、 电气主设备及外围设备的选型开发；3、设计PLC离线程序，参与标准程序模块的设计与维护；4、跟进项目进度，并及时处理项目的疑难问题。任职要求：1、自动化相关专业，5年及以上工作经验；2、熟悉西门子1500F系列PLC，熟悉博途的使用，了解UDT的设计以及使用方式；3、有一定C语言基础或了解SCL语言，了解KUKA、ABB机器人至少一种。4...,专用设备制造,http://jobs.zhaopin.com/CC563075920J40748057003.htm,300-499人,2025-04-14 00:06:41
