职位,城市,公司,学历,经验,技能,薪资,工作描述,行业,职位URL,公司规模,发布时间
电力工程师（系统运维、平台开发）,南京,江苏苏源建设咨询有限公司,大专,5-10年,"电力运维,电力设计",1.5-2.5万,岗位内容：1. 电力信息系统设计、开发和运维；任职要求：1、根据详细设计负责公司后端的开发。2、解决项目中的关键架构问题和技术难题，需要熟悉使用SpringCloud、SpringBoot、MyBaits等主流框架。3、熟悉至少一种关系型数据库（Mysql、Oracle、SQL Server等）5、掌握Tomcat、Nginx、Docker、自动化部署技术的优先。6、熟悉开源社区，为开源社区贡献过...,新能源,http://jobs.zhaopin.com/CCL1460905320J40818513609.htm,20-99人,2025-12-18 10:16:38
注册电气工程师(发输变电),南京,中冶华天南京,本科,10年以上,注册电气工程师（发输变电）,面议,资质要求：注册电气工程师(发输变电) 职称和学历要求：高级工程师/本科及以上(经验和综合能力突出者可适当放宽) 工作地点：南京 工程经验或技能： 1) 十年以上输变电工程设计经验； 2) 曾主持220kV及以上变电站和输电线路设计； 3) 熟悉并能够带领团队完成新能源发电工程并网、送出工程的设计规划工作。 4）能接受项目地出差。,工程技术与设计服务,http://jobs.zhaopin.com/CC438038610J40316036306.htm,1000-9999人,2025-12-11 00:00:03
蛋白自动化开发科学家,南京,金斯瑞生物科技,硕士,3-5年,"非标设备,自动化,数字化",面议,岗位职责：1) 负责本部门自动化设备的维修与维护，保障交付设备的使用效果并优化提高设备的使用效率。2) 参与在搭建项目的机械设计，软件设计方案评估。对于自动化规划项目有独立见解并给出合理意见并从而加速推进建设进度。3) 积极与内外部供应商磨合项目方案，打磨设备最大程度降低交付风险。4) 有能力主导一些设备的研发定制和项目管理。5) 结合工艺进行定制开发，可进行相关的可行性验证和基本的生物学实验。6...,医药制造,http://jobs.zhaopin.com/CC143982550J40773181814.htm,1000-9999人,2025-12-04 11:29:58
炼铁自动化项目经理,南京,江苏金恒信息科技股份有限公司,本科,5-10年,"非标设备,电气设备,PLC,炼铁工艺",1.5-2.5万·14薪,"岗位职责：1.负责部门项目需求分析、方案设计、交流汇报、项目交付推进；2.负责按照流程及规范要求进行项目方案、图纸设计、设备制造、软件开发、现场调试，上线及验收工作；3.负责部门项目售前、交付全生命周期输出资料的编制、归档；4.参与部门技术培训、团队人员梯队建设。任职要求1.电气、自动化等专业统招一本以上学历，至少5年以上冶金行业自动化工作经验,熟悉炼铁、焦化工艺优先；2.精通主流品牌低压电器、仪...",IT服务,http://jobs.zhaopin.com/CC201489330J40594505501.htm,500-999人,2025-12-04 08:31:39
电气设计工程师,南京,中圣科技(江苏)集团股份有限公司,学历不限,5-10年,"发电工程,输变电工程",1.5-2.5万,主要招聘火力发电、生物质发电的图纸设计；岗位职责：1、完成发电厂供配电一次系统及二次电气系统设计，包括方案，规范书，图纸设计。2、发电厂防雷接地照明和图审。3、变电站一二次设计。3、解决现场施工过程中出现的电气方面的问题。3、配合其他专业完成项目的提资及施工配合。任职要求：1、有发电厂及电力设计院电气设计岗位工作经验5年以上。2、熟悉发电厂及变电站一次系统及二次电气系统设计。3、熟练使用岗位所需要...,专用设备制造,http://jobs.zhaopin.com/CC233275830J40641273211.htm,1000-9999人,2025-11-11 10:08:17
变电二次设计师,南京,南京广能电力工程设计有限公司,本科,经验不限,"电力设计,输变电工程,电气工程",1.5-2.5万,岗位职责 1、电气工程、输变电工程及其自动化或相关专业，本科及以上学历。 2、从事220kV及以下变电站电气二次专业可研、初设、施工图及竣工图编制等工作。 3、负责设计过程中的现场勘察，收集资料，内、外部协调，协报物资，参加设计联络会、设计交底，配合施工、竣工验收等。 任职要求 1、变电电气二次设计工作经验，有电力系统内技改、大修设计经验或能独立完成变电二次设计工作者优先考虑。 2、熟悉相关专业设...,电力/水利/热力/燃气,http://jobs.zhaopin.com/CC558199920J40725756007.htm,20-99人,2025-11-07 00:00:02
自动化项目经理（炼钢、轧钢）,南京,江苏金恒信息科技股份有限公司,本科,5-10年,"炼钢,轧钢",1.5-2.5万·14薪,"岗位职责：1.负责部门项目需求分析、方案设计、交流汇报、项目交付推进；2.负责按照流程及规范要求进行项目方案、图纸设计、设备制造、软件开发、现场调试，上线及验收工作；3.负责部门项目售前、交付全生命周期输出资料的编制、归档；4.参与部门技术培训、团队人员梯队建设。任职要求1.电气、自动化等专业统招一本以上学历，至少5年以上冶金行业自动化工作经验,熟悉炼钢、轧钢工艺优先；2.精通主流品牌低压电器、仪...",IT服务,http://jobs.zhaopin.com/CC201489330J40594507001.htm,500-999人,2025-12-04 08:31:38
电气工程师,南京,浙江超威动力能源有限公司,本科,3-5年,电气工程师,1.5-2.5万,岗位职责： 1.对售前储能/光伏项目技术支持进行必要配合及技术方案制定、评审； 2.根据储能/光伏项目输入与产品规划，负责系统层面的一次拓扑、包括储能变流器（PCS）、逆变器、EMS、电池簇、汇流柜、配电柜、变压器等核心电气设备的选型与参数匹配，结合项目容量、应用场景、光照条件等确定技术路线； 3.负责根据项目输入信息，参与项目可行性研究，支撑项目可行性研究与投资决策，技术协议评审及签订； 4.负...,新能源,http://jobs.zhaopin.com/CC425387920J40801866111.htm,10000人以上,2025-11-04 17:09:16
变电一次设计师,南京,南京广能电力工程设计有限公司,本科,经验不限,电气工程,1.5-2.5万,岗位职责 1、电气工程、输变电工程及其自动化或相关专业，本科及以上学历。 2、从事220kV及以下变电站电气一次专业可研、初设、施工图及竣工图编制等工作。 3、负责设计过程中的现场勘察，收集资料，内、外部协调，协报物资，参加设计联络会、设计交底，配合施工、竣工验收等。 任职要求 1、变电电气一次设计工作经验，有电力系统内技改、大修设计经验或能独立完成变电一次设计工作者优先考虑。 2、熟悉相关专业设...,电力/水利/热力/燃气,http://jobs.zhaopin.com/CC558199920J40630606807.htm,20-99人,2025-11-07 00:00:02
暖通自控工程师（自动化专业背景）,南京,上海朗绿建筑科技股份有限公司,本科,经验不限,"控制编程,自控系统,非标设备",1.5-2.5万,岗位职责:（1）能独立承担暖通自动化项目前期方案设计及技术支持工作等；（2）熟悉暖通自动化项目的仪表、阀门等产品选型，熟练掌握强弱电一体化电气柜图纸设计、元器件选型、清单编制等工作；（3）能熟练进行暖通自动化项目的自控程序开发以及常用组态软件开发设计等工作；（4）具有独立完成项目现场技术指导、安装指导及调试工作；（5）利用所学控制理论和策略优化产品。任职要求:（1）本科以上学历，自动化、电气自动化...,,http://jobs.zhaopin.com/CC282778580J40815840610.htm,1000-9999人,2025-10-31 09:20:29
光伏电气工程师（江浙沪）,南京,江苏洁诚智慧能源科技有限公司,本科,5-10年,"高压,低压,光伏",1.3-2.5万·13薪,岗位职责：1.负责公司所有光伏、风电项目的电气专业技术工作。2.负责电气专业的作业指导书或施工方案编制及交底等技术工作，能够独立完成电气专业重要技术方案的编制及执行工作；3.负责制订电气专业施工方案，进行施工技术交底；4.负责与业主、设计、监理等参建单位的施工协调及组织工作；5.负责对来料、设备质量检查、工程质量评定、工程调试、试运行和竣工验收工作；6.负责项目电气工程工作，协调解决现场的电气安装...,新能源,http://jobs.zhaopin.com/CCL1352371520J40675825503.htm,20-99人,2025-10-28 14:55:41
高级电气工程师,南京,华章物流,本科,5-10年,设计,1.8-2.5万,1、设计电气控制方案、评审及风险评估；2、绘制电气原理图、选型；3、研发编制及调试程序；4、协助解决现场故障；岗位要求：1、本科及以上学历，自动化、电气或仪表相关专业，5年自动化设备研发工作经验；2、精通Codesys、Twincat、TIA、EPLAN等常用电气软件及常用的通信协议；3、熟练掌握电气标准、电气工程规范，电气制图；4、熟练掌握常见的 PLC 品牌（西门子/倍福/施耐德）编程与相关硬...,人工智能,http://jobs.zhaopin.com/CC233222510J40728773906.htm,100-299人,2025-10-27 11:07:55
电气工程师,南京,合肥质冠企业管理有限公司,中专/中技,3-5年,"电机,中级工程师",1.5-2.5万,岗位内容： 1. 设计、开发和测试电气系统和设备，如电机控制器、传感器、驱动器等。 2. 进行电气原理图设计，包括回路图和板级布局图。3. 确保产品符合安全规范和标准，并需要进行必要的认证和测试。4. 协助团队解决现场问题并提供售后技术支持。任职要求： 1. 中专及以上学历，尽量有中级职称或相关专业背景。2. 熟悉电气原理图设计软件，如AltiumDesigner等。3. 精通C/C++编程语言，...,企业服务,http://jobs.zhaopin.com/CCL1486598080J40726760606.htm,20人以下,2025-10-21 16:48:44
电气工程师（研发设计不出差）,南京,江苏高仕人力资源有限公司,本科,5-10年,"5年自动化设备电气设计研发经验,精通CODESY常用电气软件,精通常用的通信协议",2-2.5万,电气自动化行业岗位职责：1、设计电气控制方案、评审及风险评估；2、绘制电气原理图、选型；3、研发编制及调试程序；4、协助解决现场故障； 岗位要求：1、本科及以上学历，自动化、电气或仪表相关专业，5年自动化设备研发工作经验；2、精通Codesy常用电气软件及常用的通信协议（必须精通）；3、熟练掌握电气标准、电气工程规范，电气制图；4、熟练掌握常见的 PLC 品牌（西门子/倍福/施耐德）编程与相关硬件...,人力资源服务,http://jobs.zhaopin.com/CCL1479572200J40956372104.htm,20人以下,2025-10-17 11:25:02
电网技术部长（配电网方向）,南京,北京国力电气科技有限公司,本科,5-10年,"国家电网,配网售前技术支持,配电自动化产品经验",2.2-2.5万,岗位职责：（1）负责电网业务的技术支持工作，包括：公司演示系统展示、技术交流、PPT汇报、市场调研分析、客户接待、配合销售维护并开拓市场等相关工作；（2）负责电网业务的技术文件编写，包括：技术方案、技术协议、科研报告、投标技术文件、项目配置清单、验收材料等文件编写工作；（3）负责电网业务的项目调研、项目实施、售后服务等工作；（4）负责设备抽/送检、全检、监造、到货检测工作，获取检测需求、检测方案等...,电气机械/电力设备,http://jobs.zhaopin.com/CCL1431098680J40811384110.htm,100-299人,2025-10-13 11:51:59
电气工程师,南京,南京磨洁自动化科技有限公司,本科,10年以上,"传感器,电气自动化设计,伺服系统,PLC系统,变频器,西门子,威纶通,发那科,设计,自动化设计",1.5-2.5万,"负责公司电气相关的工作。本公司属于工业自动化行业，偏机械的运动控制方向。要求1、本科及以上学历，专业对口，自动化、电气方向专业；2、10年以上工作经验，有自动化行业经验优先；3、能够使用EPLAN画电气图纸，出图，与客户沟通非标的电气设计需求；4、能够熟练的调试西门子PLC1200，市面常见的PLC最好都有接触；5、对常见的通讯协议熟悉，比如MODBUS,TCP/IP等，能够解答客户的通讯协议问题...",工业自动化,http://jobs.zhaopin.com/CC876215450J40241785507.htm,20-99人,2025-10-10 17:29:58
电气工程师（海外发输变电）,南京,江苏苏美达集团有限公司,本科,经验不限,,1.5-2.5万,岗位职责:主要职责：1. 设计管理： 负责或参与海外变电站或电厂EPC项目的电气初步设计、详细设计审核与优化，确保设计方案符合项目所在国标准、国际标准（IEC/IEEE等）及合同技术要求。2. 技术沟通： 作为电气专业技术接口人，与业主、咨询工程师、分包商及内部团队进行高效、专业的技术沟通与协调。3.设备选型与技术评审： 负责主变压器、GIS/HGIS开关设备、继电保护系统、监控系统（SCADA）...,贸易/进出口,http://jobs.zhaopin.com/CC131549440J40827105113.htm,10000人以上,2025-09-19 16:20:39
自控管理岗,南京,南京干部测评与高层人才服务中心,硕士,3-5年,"自控系统,DCS系统,SCADA系统",面议,南京水务集团有限公司招聘公告 招聘程序 （一）报名和网上资格审查（只接受网上报名，投递渠道已官网投递链接：https://www.njgcrc.gov.cn/ 此链接为准。） 1. 时间：2025年8月11日-2025年9月7日 2. 报名路径：在电脑端搜索网址：www.njgcrc.gov.cn（南京水务集团有限公司招聘公告），使用“我的南京”app扫码认证登录后，如实填写个人信息及完善简历，浏...,社团/组织/社会保障,http://jobs.zhaopin.com/CC145910930J40705296106.htm,20-99人,2025-09-07 00:26:23
变电一次主设,南京,成都腾惠工程设计有限公司南京分公司,本科,5-10年,电力设计,1.5-2.5万,1、负责完成变电工程可研系统一次、用户站接入系统、电力系统专题研究、电力规划等相关工作。负 2、负责参与220KV、110kV及以下变电电力一次范围设计工作。3、负责并参与项目实施阶段的可研、初步设计、施工图设计及相关技术支持。4、负责并参与项目专业设计协调与确认，参加设计阶段各种设计审查与联络会议；不断优化工程设工作。5、负责与建设单位、施工、监理等部门密切配合，做好工地的现场服务、图纸会审、技...,电力/水利/热力/燃气,http://jobs.zhaopin.com/CCL1490739020J40834033603.htm,20-99人,2025-09-04 13:57:34
电气设计工程师,南京,江苏绿森工程科技有限公司,本科,10年以上,"低压,高压",1.5-2.5万,岗位职责：1、可独立负责完成水泥厂等工业生产线电气设计：包括电气图纸绘制、电气部件选型等；2、负责电气技术方面的技术支持及项目管理工作；3、负责完成电气及自动化报价等工作；4、负责施工现场与甲方和施工方的对接工作；5、完成领导交办的其它工作。任职要求：1、电气工程及自动化相关专业，本科以上学历；2、熟悉相关办公软件和设计软件，如AUTOCAD、OFFICE等；3、工作严谨，善于沟通，具备良好的团队...,房地产开发,http://jobs.zhaopin.com/CC478369680J40770677301.htm,100-299人,2025-08-21 15:34:49
电驱电控系统开发工程师,南京,智联猎头,本科,5-10年,"MCU,TCU",1.8-2.5万,岗位职责：负责新能源汽车电驱、电控、AMT、等总成产品选型、方案设计评审、测试验证以及高压架构，高压系统集成及高压安全策略，电控及电力电子系统零件软、硬件、结构设计开发等相关工作，满足整车电控功能和性能需求。负责MCU、TCU功能定义及测试、换挡策略及map制定、三高标定管理、ICD及通讯协议管理、标定数据评审及发布；负责制定建立高压安全规范，整车高压安全测试及认可；负责电控及电力电子系统产品需求...,互联网,http://jobs.zhaopin.com/CCL1318355140J40818969303.htm,10000人以上,2025-07-29 09:59:33
继电保护调试,南京,东枫源电力有限公司,大专,3-5年,电力试验,1.5-2.5万,岗位职责：1、负责110kV及以上变电站工程继电保护调试、电气试验；2、熟练使用有关检测调试仪器；完成继电保护调试和有关电气试验工作 ；3、负责工程调试报告编写、建档工作；4、参与企业标准制定，制定调试和试验作业指导书及相应流程。任职要求：1、大学专科以上，电气工程及其自动化、机电一体化等相关专业；2、具有敬业精神和责任心；3、持有继电保护调试工程经验和相应职业资格证书优先。薪酬及福利：1、公司具...,电力/水利/热力/燃气,http://jobs.zhaopin.com/CC566709420J40378445805.htm,20-99人,2025-07-29 00:47:01
电气仪表工程师,南京,长江三星能源科技股份有限公司,本科,5-10年,,2-2.5万,任职要求：1、5年以上油、气及化工行业相关项目中作为仪表设计工程师的工作经验； 2、根据PID图和工艺逻辑说明编制仪表控制方案及控制逻辑图； 3、熟悉不同类型的仪表和控制系统，包括：分析仪表、温压流等现场检测仪表，控制系统包括PLC控制系统、DCS分散控制和ESD控制系统，FGS控制系统。 4、精通仪表设计软件，如InTools、Microstation、Office、Autocad、PDMS等等...,石油/石化,http://jobs.zhaopin.com/CC428005680J40704462705.htm,100-299人,2025-07-03 14:14:09
电气设计总工程师（PLC、KUKA、ABB机器人）,南京,南京中科煜宸激光技术有限公司,本科,10年以上,"西门子,ABB,发那科,PLC设计",1.8-2.5万·13薪,岗位职责：1、独立完成生产线或工作站的电气方案开发与设计2、 电气主设备及外围设备的选型开发；3、设计PLC离线程序，参与标准程序模块的设计与维护；4、跟进项目进度，并及时处理项目的疑难问题。任职要求：1、自动化相关专业，5年及以上工作经验；2、熟悉西门子1500F系列PLC，熟悉博途的使用，了解UDT的设计以及使用方式；3、有一定C语言基础或了解SCL语言，了解KUKA、ABB机器人至少一种。4...,专用设备制造,http://jobs.zhaopin.com/CC563075920J40802597703.htm,300-499人,2025-06-19 17:50:03
电自工程师,南京,江苏苏美达集团有限公司,本科,5-10年,"低压,设计",1.5-2.5万,岗位职责:1、负责配合完成环保/市政工程EPC/PC工程项目投标阶段本专业方案编制、修订、审核，工程及设备成本测算等工作；2、负责项目实施阶段电气自控专业图纸的审核，二次深化及优化；3、 熟练掌握国内电控设计规范、设备的技术指标、性能参数，能够独立与业主、设计院、制造商沟通，进行投标方案的技术经济比较。熟悉国内主流的设备品牌，能独立完成电控专业的方案设计和图纸设计；4、负责项目实施阶段与电控制造商...,贸易/进出口,http://jobs.zhaopin.com/CC131549440J40746129613.htm,10000人以上,2025-06-19 00:26:44
机器人机电系统研发工程师,南京,南京应用数学中心,硕士,1-3年,设计,1.5-2.5万,职位描述：1、有良好的软硬件技能，能够胜任无人系统，包括：飞行类、地面类、水面类机器人系统的机电和嵌入式系统研发工作，有自主开展相关研发工作的能力；2、完成中心安排的电控系统设计和调试任务，进行必要的机电性能分析；3、工程项资料的编制、更改、整理、更新、归档；4、完成设备样机机电联调、定型及质量控制工作。职位要求：1、机电一体化（偏电）、机器人工程、自动化（嵌入式）等相关专业，研究生及以上学历，有...,学术/科研,http://jobs.zhaopin.com/CCL1268158400J40743013514.htm,20-99人,2025-04-16 00:03:01
电气工程师,南京,南京中汯半导体技术有限公司,本科,3-5年,"西门子,三菱,欧姆龙",1.2-2.4万,岗位内容： 1. 负责电气系统和设备的设计、测试、验证和维护工作； 2. 根据市场需求或客户要求，制定电气方面的产品开发计划和需求分析； 3. 解决现场所涉及的电气问题和提供售后技术支持； 4. 进行电气原理图设计，包括回路图和板级布局图； 5. 并需要进行必要的认证和测试； 6. 支持和推进新技术、新材料的应用，并根据市场反馈持续改进产品的电气性能。 任职要求： 1.本科以上学历，机电一体化、电...,电子/半导体/集成电路,http://jobs.zhaopin.com/CCL1514581510J40835756005.htm,20-99人,2026-01-06 20:00:35
电气工程师,南京,中国化学工程第十四建设有限公司,本科,5-10年,"电气设计,AutoCAD,电气自动化设计,电力电气",1.2-2.4万,任职要求：1.本科及以上学历，电气工程及其自动化相关专业。2.具备5年及以上化工行业设计院工作经验，至少5年专注于化工电气设计领域。拥有石油化工、医药、新能源、精细化工等行业大型项目电气主项或负责人经验者优先。3.能独立完成负荷计算、短路电流计算、继电保护整定计算、无功补偿方案设计，能熟练运用与工作相关的专业软件。4.诚实守信，具有较强的团队合作精神和沟通协调能力，积极完成公司交办的各项工作。,工程施工,http://jobs.zhaopin.com/CC165945110J40317290509.htm,1000-9999人,2026-01-04 10:33:08
机器人电控系统工程师,南京,南京应用数学中心,硕士,1-3年,"研发,机器人",1.5-2.5万,职位描述：1、有良好的软硬件技能，能够胜任无人系统，包括：飞行类、地面类、水面类机器人系统的机电和嵌入式系统研发工作，有自主开展相关研发工作的能力；2、完成中心安排的电控系统设计和调试任务，进行必要的机电性能分析；3、工程项资料的编制、更改、整理、更新、归档；4、完成设备样机机电联调、定型及质量控制工作。职位要求：1、机电一体化（偏电）、机器人工程、自动化（嵌入式）等相关专业，研究生及以上学历，有...,学术/科研,http://jobs.zhaopin.com/CCL1268158400J40728879314.htm,20-99人,2025-04-14 00:23:42
电气plc自动化工程师,南京,南京托特智能装备有限公司,大专,3-5年,"PLC设计,西门子,三菱,欧姆龙,自动化设备,非标设备",1.2-2.4万·14薪,岗位职责：1.负责项目前期调研需求分析、整体解决方案的编制；2.负责工程项目图纸设计及装配安装指导，出厂调试；3.负责项目执行中PLC及HMI程序设计及代码编写、测试；4.负责工程项目执行期间与业主方沟通协调工作；5.负责工程项目完成后验收、竣工资料以及售后等工作；任职要求：1.设计自动化非标设备的控制系统（电气原理图、电路图、控制程序等）；2.熟悉2种及以上主流PLC和HMI的使用，如三菱，西门...,汽车零部件,http://jobs.zhaopin.com/CCL1338258250J40690730502.htm,20-99人,2025-11-14 17:10:28
电气工程师,南京,永贵新能源,本科,1-3年,设计,1.2-2.4万,岗位职责: 1. 根据产品需求及电池规格，设计电池配置参数，编制产品电气设计方案的，绘制电气原理图，器件选型及编制BOM清单； 2. 负责电气类文件编制，编制试验大纲、维护技术文档等； 3. 对产品、行业标准体系解读和内部规范制定； 4. 负责电气零部件选型、新供应商产品拓展考核； 5. 负责研发项目技术管理及产品施工设计组织； 岗位要求： 1.本科及以上学历，电气、机电、电子等相关专业； 2.熟...,电子/半导体/集成电路,http://jobs.zhaopin.com/CC365351380J40231270307.htm,500-999人,2025-11-14 00:08:02
高级电气设计工程师（数控系统方向/西门子数控系统）,南京,南京中科煜宸激光技术有限公司,大专,3-5年,"设计,PLC设计,自动化设计,电路设计",1.2-2.4万·13薪,岗位职责：1、激光加工机床设备的电气系统设计、选型；2、承担电气控制系统设计、安装、调试、更新、故障处理及售后技术支持；3、激光类数控机床产品的设计、开发、迭代工作；任职要求：1、自动化控制、机电一体化专业，3年以上自动化设备设计经验；2、具备西门子、华中、力士乐、台达等常见数控系统中两种以上品牌系统的设计调试能力；3、具备非标设备界面开发经验及激光设备使用经验者优先；4、有激光增材数控产品开发经...,专用设备制造,http://jobs.zhaopin.com/CC563075920J40778571803.htm,300-499人,2025-07-01 00:17:23
