职位,城市,公司,学历,经验,技能,薪资,工作描述,行业,职位URL,公司规模,发布时间
中高级后端开发工程师,南京,外企德科数字技术有限公司,本科,经验不限,"Java,Python",1.5-3万·14薪,15-16薪因为部门比较多，但是boss岗位数量有限制，所以很多岗位没有上，其他岗位可以细聊；岗位职责：1、负责创新项目系统设计与研发工作；2、负责相关子系统及业务流程的优化重构，研发过程优化工作；3、负责项目重点、难点的技术攻坚；4、负责后端系统核心代码编写和按时交付，保证交付质量和负责版本维护；岗位要求：1、 本科以上学历2、扎实的编程能力，熟悉算法和数据结构；熟悉计算机的基础理论；3、扎实的...,专业技术服务,http://jobs.zhaopin.com/CCL1480117890J40831706205.htm,10000人以上,2026-01-09 01:13:21
前端开发工程师,南京,南京高泰科技有限公司,本科,3-5年,"Vue,React,Node.js,JavaScript",1.5-3万,岗位职责1、根据项目及产品需求及技术文档，开发H5平台应用产品；2、完成移动端模块代码编写、单元测试、代码维护等工作，并编写相关文档；3、根据业务需要，为客户提供技术支持；岗位要求： 1、熟练使用各种Web前端技术，精通HTML5及CSS2、CSS3，熟练W3C网页标准能快速处理主流浏览器的兼容问题，能编写代码并熟练掌握代码分析和代码调试； 2、精通Javascript，熟练使用JQuery等JS...,计算机软件,http://jobs.zhaopin.com/CC157555820J40584256103.htm,300-499人,2025-09-18 15:57:44
高级前端工程师,南京,思源电气,本科,5-10年,Node.js,1.8-2.5万·16薪,岗位职责：1.负责公司核心产品和项目业务相关前端开发工作；2.负责前端基础设施搭建，推动前端技术落地实施；3.负责复杂业务问题攻坚，优化提升产品性能和体验；任职要求：1.本科及以上学历，计算机相关专业，5年及以上相关工作经验；2.熟练掌握前端开发主流技术栈，对前端工程化有深入理解；3.熟练掌握Nodejs开发主流技术栈，具备后台中间件开发经验；4.熟悉前端跨平台开发技术和主流框架，能够快速上手开发...,电气机械/电力设备,http://jobs.zhaopin.com/CC000635070J40685221211.htm,1000-9999人,2026-01-11 00:17:01
高级前端开发工程师,南京,上海虹云信息技术有限公司,本科,5-10年,"大屏/可视化项目,GIS/地图项目,JavaScript,TypeScript,Vue,ElementUI,uni-app,VUE3,Node.js,Echarts,WebGL,气象项目",2-2.3万·13薪,工作职责:1、主导前端架构与核心组件体系设计：构建高复用、易维护、可扩展的 Web 前端基础设施，支撑多产品线高效交付；2、推动现有系统现代化演进：通过重构、性能调优、兼容适配等手段，持续提升系统稳定性、加载速度与交互流畅度；3、高质量实现复杂业务界面：精准还原 UI/UX 设计，兼顾功能完整性、可访问性与跨端一致性；4、以用户为中心优化体验：从首屏加载、交互响应到动效细节，系统性提升产品可用性与...,计算机软件,http://jobs.zhaopin.com/CC165938910J40878373902.htm,20-99人,2025-12-10 15:39:35
前端开发工程师,南京,北京信普达系统工程有限公司,本科,3-5年,"Vue,Javascript,Web前端,jQuery,Node.js,AngularJS",1-2万,岗位职责：1.参与公司相关软件产品的研发与维护；2.根据项目进度要求，完成子系统和模块开发、单元测试和系统联调；3.系统业务功能编码实现，重构、功能升级和解决bug；4.负责系统设计和代码阶段的复杂缺陷和技术问题的研究和分析，并提出创新性的解决方案； 技能要求：1、大学本科及以上学历，2年以上前端工作经验；2、熟练使用HTML5+CSS3+JS编程，熟悉响应式web开发、JS性能优化；3、熟练掌握...,计算机软件,http://jobs.zhaopin.com/CC150983810J40631207507.htm,100-299人,2026-01-11 00:03:40
前端开发（南京 汉中门附近）,南京,南京迈特望科技股份有限公司,本科,5-10年,"HTML5,CSS,JavaScript,jQuery,Node.js",1.2-2万,职责：1、参与平台需求分析、负责完成平台部分模块前台的概要和详细设计；2、按计划和设计方案完成所负责平台模块前台的编码功能实现，持续性能优化以及测试bug修改。3、负责配合后台人员进行模块前后台数据对接，以及功能整合测试完善； 要求：1、非常熟悉前端开发技术基础，HTML5、CSS、JS；2、熟悉ES6，TypeScript、Sass、webpack等目前常用开发技术及工具链；3、熟悉jQuery...,计算机软件,http://jobs.zhaopin.com/CC142971790J40819021811.htm,1000-9999人,2026-01-06 09:41:47
高级web前端工程师,南京,诚迈科技股份有限公司,本科,5-10年,"大屏/可视化项目,CSS,Vue,Node.js",1.5-2万,1、计算机或相关专业本科毕业，9年及以上Web开发经验，至少有1个以上大型前端项目的架构经验。2、熟练使用Vue前端框架或类库、了解Web前端组件化、模块化开发模式；3、具备快速学习能力，能够在短时间内掌握并应用一种新框架；4、具备较好的代码解读和编写能力，能够完成客服平台的代码理；5、能够按照产品的要求在新平台上完成前端代码编写。,运营商/增值服务,http://jobs.zhaopin.com/CC144543200J40906509615.htm,1000-9999人,2025-11-27 10:52:42
Web 前端开发工程师,南京,南京云高融智科技有限公司,本科,3-5年,"GIS/地图项目,大屏/可视化项目,Vue,React,Node.js,WebSocket,RESTFUL API,HTML5,CSS,JavaScript",1-2万,岗位职责负责业务系统Web前端的架构设计与开发，基于Vue/React技术栈构建高性能三维可视化应用；实现Web前端与Unity/UE5三维引擎的无缝集成，支持模型渲染、交互事件传递与实时数据联动；通过WebSocket/RESTful API与Node.js后端通信，保障三维场景数据与业务逻辑的高效协同；优化前端与三维引擎的跨技术栈协作性能，解决内存管理、渲染效率等关键问题；参与项目组件库建设，...,计算机软件,http://jobs.zhaopin.com/CCL1505274920J40779353810.htm,20人以下,2025-08-25 10:36:38
前端开发工程师,南京,南京迈特望科技股份有限公司,本科,5-10年,"JavaScript,HTML5,Vue,Node.js,智慧政务,AI智能,运营商",1.3-2万,岗位职责：1、参与平台需求分析、负责完成平台部分模块前台的概要和详细设计；2、按计划和设计方案完成所负责平台模块前台的编码功能实现，持续性能优化以及测试bug修改。3、负责配合后台人员进行模块前后台数据对接，以及功能整合测试完善； 任职要求：1、非常熟悉前端开发技术基础，HTML5、CSS、JS；2、熟悉ES6，TypeScript、Sass、webpack等目前常用开发技术及工具链；3、熟悉jQ...,计算机软件,http://jobs.zhaopin.com/CC142971790J40442041211.htm,1000-9999人,2025-11-29 00:00:01
低代码前端开发工程师,南京,南京绛门信息科技有限公司,本科,3-5年,"ERP项目,大屏/可视化项目,CSS,JavaScript,HTML5,Vue,Node.js,低代码开发认证",1.3-2万,【学历及专业】计算机、自动化、电力等相关理工科专业统招本科及以上学历【工作经验】2年以上电力相关工作经验【工作内容】1、基于云产品（明道云/简道云）业务场景快速搭建，能独立完成实施过程中需求的二次开发，包括但不限于：表单、自动化工作流、数据分析仪表盘等模块设计；第三方系统集成（通过API/Webhook对接ERP、CRM、钉钉/企业微信等）。2、能够与业务部门进行有效沟通，确保项目需求的准确理解和...,计算机软件,http://jobs.zhaopin.com/CC426773320J40793831105.htm,1000-9999人,2025-07-28 10:15:35
web前端工程师,南京,南京南自华盾数字技术有限公司,硕士,3-5年,"大屏/可视化项目,电力,JavaScript,CSS,HTML5,Vue,React,uni-app,Echarts,webpack,Node.js",1-2万·13薪,岗位职责1.负责开发web、H5、App、微信小程序，依据原型交互与UI设计文档，完成开发工作。2.根据业务需求，构建灵活、可扩展的前端架构，确保系统稳定性、扩展性和高性能。3.与后端开发团队、UI设计师紧密合作，确保开发进度同步，共同解决项目中问题。4.编写高质量、易于维护的移动前端代码，确保页面的的安全性、稳定性和性能。5.参与需求设计评审，充分理解项目的需求和设计方案，评估项目的技术难点，给...,IT服务,http://jobs.zhaopin.com/CC587279520J40868390515.htm,100-299人,2025-07-25 10:34:37
前端,南京,湖南拓维云创科技有限责任公司,本科,1-3年,"React,jQuery,Vue,Node.js",1.3-1.8万,职位描述：1、负责项目前端的模块设计工作，完成模块的前端界面及核心交互逻辑设计；2、指导开发成员完成模块内前端界面和交互逻辑开发工作，负责模块的开发交付；3、拉通前后端，进行项目功能端到端调测；4、参与部分前端技术预研，输出相关预研结果；任职要求： 1、统招本科、统招专升本及以上学历，计算机相关专业；2、1年以上Web前端开发经验，有独立的前端模块开发经验；3、熟练掌握jQuery，有中大型项目前...,互联网,http://jobs.zhaopin.com/CC889005020J40473230513.htm,1000-9999人,2025-12-26 11:19:09
前端开发工程师,南京,南京蓝昊智能科技有限公司,本科,3-5年,"Vue,JavaScript,Node.js,原生组件开发,前端开发经验",1-1.8万,岗位职责：1.负责常用框架组件的二次开发、复杂原生组件的开发2.负责前端框架的设计与实现3.负责构建平台的WEB核心模块开发4.为前后端技术改进、网站性能优化、技术选型提供解决方案5.持续优化前端开发模式和规范任职要求:1、精通ES6/HTML5/CSS3，熟练使用vue，需要具备原生组价开发经验或开源组件的深度二次开发经验2、具备Electron、nodejs、视频流（如WebRTC）等框架和业...,工业自动化,http://jobs.zhaopin.com/CC629532880J40861341412.htm,100-299人,2025-12-24 09:16:50
前端开发现场面试（ERP项目开发经验 学信网可查学历）,南京,南京博锐星润软件科技有限公司,大专,3-5年,"ERP项目,Vue,CSS,Node.js,ERP,Angular",1.1-1.8万,有ERP项目经验的前端开发 年限大概是3-5年 学历得是学信网可查到的，南京现场面试,计算机软件,http://jobs.zhaopin.com/CC272316530J40845769212.htm,100-299人,2025-11-06 17:28:58
南京前端XTGS202601080007-0001,南京,北京朗杰科技有限公司,本科,3-5年,"CSS,JavaScript,HTML5,Vue,Node.js",1.1-1.6万,岗位职责：1. 负责系统的前端开发与维护。2. 与产品经理及UI和后端工程师协作，确保产品功能界面和交互的实现与体验流畅。3. 优化前端性能，保障页面的加载速度和浏览器兼容性。5. 改进现有模块功能，提高系统的健壮性，稳定性以及综合性能；任职要求：1、本科及以上，计算机专业，3年以上前端开发经验；有大型网站前端，电网项目开发经验者优先；2、精通 vue2，vue3；3、熟悉 typescript ...,IT服务,http://jobs.zhaopin.com/CC544052720J40979234704.htm,500-999人,2026-01-09 14:47:07
web前端工程师,南京,医智云信息科技(南京)有限公司,本科,1-3年,"CSS,JavaScript,HTML5,Vue,React,ElementUI,Node.js,Three.js",8000-16000元,岗位职责：1、参与前端的框架设计、程序开发和开发文档编写工作；2、分析，优化前端性能，为用户提供更好的体验;3、协助测试，分析并解决开发过程中的各种问题；4、参与进行软件系统的需求对接分析工作，完成相应文档及PPT的编写。岗位要求：1、2年及以上前端开发经验，精通HTML5、CSS3、JavaScript、Ajax等前端技术、熟悉页面架构和布局。2、熟练掌握Vue3、React、若依框架的使用，对...,人工智能,http://jobs.zhaopin.com/CCL1485707780J40804003211.htm,20人以下,2025-12-25 14:05:07
web前端工程师,南京,青岛易联万家科技有限公司南京分公司,本科,3-5年,"Vue,Node.js,JavaScript",1.3-1.6万,岗位要求: 1、 计算机、软件工程、电子电气、信息工程等相关专业本科以上学历，3年以上经验，有电商平台、医疗医药C端平台、B2B服务平台、推荐系统、大数据，其中之一经验者优先；2、有 vue2/3+小程序开发经验；具有node.js服务端开发经验优先；3、精通Ajax、Javascript、DOM等前端技术，至少了解一种JS库；4、了解前端工程化，熟练使用前端包管理工具（npm），掌握构建工具gu...,计算机软件,http://jobs.zhaopin.com/CC554551630J40773085407.htm,100-299人,2025-12-19 09:30:09
前端开发XTGS202511050010-0001-南京,南京,北京朗杰科技有限公司,本科,3-5年,"React,CSS,HTML5,JavaScript,Node.js",9000-16000元,岗位职责：1、开展java前端开发，定制开发湖北调度自动化运行方式管理，主要包括机房平面图、设备屏位图、供电路径图、网络拓扑图、运行方式报告、运行风险分析、承载力分析等；2、及时响应并处理问题，开展自动化运行方式管理处缺及功能完善；3、保质保量的完成项目经理分配的其他任务。任职要求：1、本科及以上学历，3年以上前端开发经验；2、前端基础知识扎实，熟练掌握HTML、CSS、JavaScript等前端...,IT服务,http://jobs.zhaopin.com/CC544052720J40971483604.htm,500-999人,2025-12-16 15:48:17
shopify前端开发工程师（双休/自有品牌）,南京,青岛简沐电商运营管理有限公司,本科,3-5年,"电商项目,JavaScript,React,Vue,TypeScript,Node.js",1.2-1.6万,"公司 12 年成立，近 400 人规模，双休+入职五险一金，近五号线大学城地铁口，每年两次双通道晋升，公司以人为本团队氛围好岗位职责：1. 负责海外品牌官网基于Shopify平台的前端开发;2. 从品牌宏观角度为网站设计提供专业的优化建议;3. 参与网站需求及设计评审,确定前端开发技术方案;4. 配合运营实现SEO需求,不断完善以保持良好的推广效果;5. 使用ShopifyAPl接口,完成Shop...",电子商务,http://jobs.zhaopin.com/CCL1479548900J40846867312.htm,300-499人,2025-11-06 17:43:03
南京 前端,南京,南京迈特望科技股份有限公司,本科,3-5年,"金融项目,银行项目,证券项目,保险项目,CSS,JavaScript,HTML5,Vue,React,Node.js,webpack,ES6",1.1-1.5万,1、从事网银/财资相关系统的开发、设计工作； 2、根据计划和要求，完成系统的研发和业务交付；3、疑难问题的解决，撰写技术方案；4、能为团队引入新的技术及解决方案；5、根据工作安排高效、高质地完成代码编写，确保符合规范的前端代码开发规范； 1. 3-5年（中级）、6年以上（高级）前端开发经验，有银行项目开发经验优先，若有网银/现管/财资产品开发经验更好。 2. 扎实的JavaScript基础知识，能...,计算机软件,http://jobs.zhaopin.com/CC142971790J40812923711.htm,1000-9999人,2026-01-06 18:19:21
vue前端开发工程师,南京,江苏迪肯工业科技股份有限公司,本科,3-5年,"大屏/可视化项目,GIS/地图项目,Vue,React,jQuery,Node.js,Echarts,Three.js",1-1.5万,岗位描述/岗位职责：1、负责公司产品web前端模块功能的设计、实现以及后续维护工作；2、持续优化前端交互和页面响应速度，配合团队研究并改善用户体验；3、关注及研究相关领域前沿技术，并提出合理化建议；4、沟通能力强，有良好的团队合作精神和责任心，性格开朗； 任职要求： 1、本科及以上学历，机械、自动化、计算机相关专业； 2、熟练掌握Web前端技术，对前端流行框架有深刻理解和实践经验； 3、熟练掌握至...,工业自动化,http://jobs.zhaopin.com/CCL1464235390J40717833111.htm,20-99人,2025-12-11 09:39:32
平台前端开发工程师,南京,奥为科技(南京)有限公司,本科,1-3年,"JavaScript,GIS/地图项目,CSS,HTML5,ElementUI,Node.js,Echarts,WebGL",9000-15000元,工作内容：1.负责公司工业互联网平台、SCADA组态、数据可视化大屏等前端系统开发；2.使用Vue/React等框架开发高性能、可维护的前端应用；3.与UI/UE、后端工程师协作，实现产品交互与视觉需求；4.优化前端性能与用户体验，确保跨平台、跨浏览器兼容性。技能要求：1.计算机、软件工程等相关专业本科及以上学历，2年以上前端开发经验；2.熟练掌握HTML5/CSS3/JavaScript/Typ...,电子/半导体/集成电路,http://jobs.zhaopin.com/CCL1246382650J40817786414.htm,20-99人,2025-11-04 15:21:16
高级web前端工程师,南京,南京大秋信息科技有限公司,本科,5-10年,"CSS,JavaScript,HTML5,Vue,ElementUI,Node.js",1.3-1.5万,"岗位内容： 1. 设计和开发适用于不同设备的易于使用的网站 2. 参与产品原型设计和产品需求分析 3. 跟进技术趋势及前端开发最佳实践，不断提升团队的技术水平 任职要求：1、3年以上前端实际开发工作经验；2、精通Javascript/HTML5/CSS3，熟练使用sass, less编写样式；3、熟练掌握Vue3前端框架, *********;4、熟练掌握微信小程序原生开发;5、熟练掌握mpvue...",网络/信息安全,http://jobs.zhaopin.com/CCL1509846210J40705090206.htm,20-99人,2025-08-21 09:31:13
前端开发工程师,南京,软通动力信息技术(集团)股份有限公司,本科,1-3年,"HTML,Vue,TS,JS,Node.js,CSS",9000-15000元,1、熟练掌握HTMLJ SCSS等前端相关技术；2、对主流前端框架(Vue ReactAngular等)能熟练操作；3、熟悉或使用过Antdesign，并能根据需求做定制化工作；4、熟悉node.js、CLI技术；职位福利：五险一金、带薪年假、定期体检、节日福利、周末双休、周末双倍工资,互联网,http://jobs.zhaopin.com/CC000544460J40281779616.htm,10000人以上,2025-05-30 18:20:39
前端开发工程师——自研 AI+互联网产品,南京,南京智睿云互联科技有限公司,本科,3-5年,"CSS,JavaScript,HTML5,Vue,React,jQuery,Node.js",1-1.4万,岗位职责：1.负责WEB端及移动端的前端应用开发；2.利用JS.CSS或HTML5等技术，完成切图，页面重构开发制作；3.设计及实现前后端的数据交互，对代码质量及进度负责；4.配合产品经理和UI设计师，研究并改善用户体验。 岗位要求： 1.本科计算机相关专业毕业，有3年及以上互联网行业实际开发经验； 2.熟练使用vscode或cursor等ai编程工具，实际工作中，有参与过LLM等AI大模型相关应...,计算机软件,http://jobs.zhaopin.com/CCL1339031010J40804701307.htm,20-99人,2026-01-06 11:21:40
前端工程师,南京,深圳市紫川软件有限公司,本科,3-5年,"React,Vue,Node.js",1.1-1.4万,工作描述： 1.负责前端业务编写，，能解决前端技术难题； 2.负责封装前端常用组件，并不断优化和完善； 3.负责一定程度的项目跟进工作，负责与甲方沟通和协调，参与需求分析； 4.负责统筹与支持业务进行项目实施； 5，有金融相关的项目开发，计算机相关专业优先考虑 任职要求： 1.前端开发经验3年以上。 2.精通react vue、JavaScript（含ES6）、协议、安全等技术、熟悉函数式、性能优...,计算机软件,http://jobs.zhaopin.com/CC143806550J40794152314.htm,500-999人,2025-09-11 10:09:54
前端开发工程师,南京,软通动力信息技术(集团)股份有限公司,本科,3-5年,"Vue,ElementUI,JavaScript,TypeScript,HTML5,大屏/可视化项目,GIS/地图项目,直播视频项目,React,Node.js,Echarts",9000-14000元,【岗位职责】：1、参与PC、H5、小程序、Hybird等混合开发系统、平台前端工作；2、参与改进开发、构建、发布等前端工程化体系和组件化框架，持续提升研发效率;3、参与项目的需求分析、概要设计和详细设计，撰写相关技术文档；4、具有良好的协调、沟通能力，根据业务方需求制定相关技术解决方案；【岗位要求】：1、统招本科及以上学历，3年及以上Web前端开发经验；2、良好的设计和编码习惯，热爱写代码能产出高...,互联网,http://jobs.zhaopin.com/CC000544460J40783730416.htm,10000人以上,2025-12-26 10:44:15
前端开发工程师（统本 电力 大屏 数据可视化 地图 中台 物联网）,南京,南京思美软件系统有限公司,本科,3-5年,"大屏/可视化项目,GIS/地图项目,电力,Vue,ElementUI,uni-app,HTML5,Echarts,Node.js,大屏,地图,大数据,Three.js,3D,TypeScript",1-1.3万,前端开发工程师岗位要求：1. 编程语言和布局：精通JavaScript和HTML5/CSS3/ES6前端开发语言，熟练使用DIV+CSS、Flex和Grid布局进行页面设计和开发，能够高效实现各种网页布局和响应式设计。2. 前端框架：熟悉前端Vue3或React框架设计模式，使用过Element-UI、Element-Plus等前端组件库，能够开发高效、可维护的前端应用。3. 前端插件：熟悉axi...,计算机软件,http://jobs.zhaopin.com/CC256879110J40832609415.htm,100-299人,2025-12-04 00:00:03
前端工程师,南京,深圳市紫川软件有限公司,本科,3-5年,"Vue,React,Angular,Node.js",1.1-1.3万·13薪,"1、参与业务模块编码工作 2、参与维护现有系统, 解决用户问题 3、技术提升，打造良好技术氛围职责描述：1，热爱技术，对前端领域有持续深入的探索 2，具备较强的沟通协调能力，能主动 push 工作进展 3，前端基础知识扎实，熟练掌握HTML5、ES6、CSS3等 4，掌握VUE、React、Angular 中的一种框架，并有丰富的项目经验 5，有中大型办公产品类开发经验 6，熟悉HTTP、TCP/...",计算机软件,http://jobs.zhaopin.com/CC143806550J40477639914.htm,500-999人,2025-09-11 15:38:18
web前端开发,南京,软通动力信息技术(集团)股份有限公司,本科,经验不限,"Vue,React,HTML5,Node.js",8000-13000元,1、精通HTML/CSS/LESS/JavaScript/jQuery等Web开发技术，熟练运用Bootstrap，熟练json和xml的数据处理，熟悉Webpack构建；2、熟悉前端主流框架，对MVC/MVVM有一定理解，至少精通Angular/Vue/React其中一种；3、掌握前端工程化与模块化开发，有大型单页应用实践者为佳； 4、熟悉主流应用服务器的架构体系、缓存以及常见中间件技术，如Ng...,互联网,http://jobs.zhaopin.com/CC000544460J40757389416.htm,10000人以上,2025-12-31 16:44:08
web前端开发,南京,江苏万众企业管理服务集团有限公司,本科,3-5年,"CSS,Vue,Node.js",9000-12000元,岗位职责:1、负责前端组件和框架设计、开发工作；2、负责业务平台和运营后台的开发工作，参与项目技术方案制定；3、负责同产品设计沟通交互、视觉设计的相关问题；4、负责同后端开发紧密配合，制定技术实现方案、服务接口等，确保代码有效对接；5、优化web前端性能，对具体的产品进行性能优化，解决前端遇到的各种技术、性能、跨终端兼容问题；6、持续的优化前端体验和页面响应速度，并保证兼容性和执行效率，提升产品的...,财务/审计/税务,http://jobs.zhaopin.com/CCL1389623150J40806689707.htm,1000-9999人,2025-12-16 01:18:48
WEB前端开发工程师,南京,江苏基久网络科技有限公司南京分公司,本科,3-5年,"Vue,Node.js",面议,职位职责1、核心开发： 负责项目前端页面的开发、迭代和维护工作。2、数据可视化： 使用 ECharts 等图表库，实现复杂、高性能的大屏数据图表、3、仪表盘等可视化组件的开发与优化。4、UI实现： 与 UI 设计师紧密合作，精准还原设计稿，精通 CSS 及预处理器，实现精美的界面效果和流畅的交互动效。5、多端适配： 负责实现前端页面在 PC 大屏、平板电脑及移动端等多种设备上的完美适配与响应式布局...,通信/网络设备,http://jobs.zhaopin.com/CC369282180J40738425802.htm,1000-9999人,2025-12-04 17:24:29
前端开发工程师,南京,软通动力信息技术(集团)股份有限公司,本科,1-3年,"HTML,CSS3,VueX,Vue,Javascript,AngularJS,Web前端,Node.js",9000-13000元,本科学历，理工专业，学信网可查，至少1年以上工作经验职位福利：五险一金、绩效奖金、带薪年假、弹性工作、交通补助、餐补、定期体检职位亮点：双休，五险一金，薪资open，晋升方便,互联网,http://jobs.zhaopin.com/CC000544460J40218015016.htm,10000人以上,2024-07-05 01:32:59
前端开发工程师（地图/大屏/物联网/电商优先）,南京,南京思美软件系统有限公司,大专,3-5年,"大屏/可视化项目,GIS/地图项目,电商项目,CSS,Vue,React,uni-app,Node.js,Echarts,CRM,交通",1.1-1.2万,前端工程师【岗位职责】：1、负责web前端功能模块的开发，根据需求完成指定模块、业务的开发任务，保证系统功能可靠性与扩展。2、负责相关技术文档编写；3、根据公司产品的版本管理规范，完成所负责项目的前端代码的版本归档、版本变更、版本发布工作；【任职条件】：1、专科及以上学历，计算机相关专业；2、两年以上计算机前端代码编写、分析经验；热爱前端开发，喜欢深入研究。3、有扎实的Web前端基础，熟练掌握HT...,计算机软件,http://jobs.zhaopin.com/CC256879110J40879906115.htm,100-299人,2025-09-24 11:42:18
