职位,城市,公司,学历,经验,技能,薪资,工作描述,行业,职位URL,公司规模,发布时间
遗传科学类 英文学术期刊助理编辑,南京,曼迪匹艾(南京)科技服务有限公司,硕士,经验不限,"生物学,遗传学,动物学",1.2-2.4万,一、工作职责 1. 负责联系专家学者，组织稿件的同行评审，确保稿件的同行评审及时完成； 2. 编排和处理稿件，确保稿件格式正确，及时发表； 3. 与期刊主编，编委成员，作者及审稿人建立良好沟通，确保期刊正常运作，稿件顺利及时发表； 4. 关注期刊学科领域内的研究进展，协助期刊责任编辑完成期刊发展目标。 二、职位要求 1. 细胞生物学，遗传学等专业背景； 2. 硕士博士优先，优秀的本科生亦可考虑； ...,科学技术推广,http://jobs.zhaopin.com/CCL1327109300J40496880505.htm,1000-9999人,2025-04-14 17:45:42
新媒体运营主管+小红书运营主管,南京,南京四季物语生物科技有限公司,本科,1-3年,,1.2-1.6万,岗位职责：1、对品牌定位有清晰的认知。熟悉各渠道的媒体宣传的特性（如：淘宝、小红书、抖音、微信、微博、百度等），能结合各渠道特性及品牌定位，确定各渠道的执行方案；2、善于挖掘产品卖点，根据产品卖点，用户群体，制定落地执行的推广计划，具有统筹能力，策划能力，复盘总结能力，分析数据能力。3、建立商务合作机制，搭建流程与模式，带领团队开发达人、博主、kol资源，进行判断筛选，择优合作，并对内容把控；4、...,电子商务,http://jobs.zhaopin.com/CCL1201334490J40500558406.htm,500-999人,2025-07-07 10:40:25
新媒体运营经理,南京,江苏广通迪控股集团有限公司,大专,3-5年,"短视频平台,抖音,快手,哔哩哔哩,新闻类,旅游类",8000-16000元,职位信息岗位职责:1. 制定新媒体矩阵发展路线和营销策划，策划专题活动、热点借势、创意营销，提升用户粘性。跟踪热点提升账号活跃度:跟踪热点，并结合公司业务，针对性产生内容、策划活动，提升账号阅读量、粉丝量和活跃度2. 负责视频号、抖音、公众号等平台的内容搭建，对选题方向、内容质量进行把控，策划具有传播力的优质内容3. 负责新媒体整体运营和推广，制定新媒体运营策略，提高品牌知名度和美誉度4. 新媒体...,新能源,http://jobs.zhaopin.com/CCL1473643840J40511016511.htm,20-99人,2025-05-10 10:33:16
化工与制药类 英文学术期刊助理编辑,南京,曼迪匹艾(南京)科技服务有限公司,硕士,经验不限,"化学工程与工艺,制药工程,化学工程与生物工业工程,化学药",1.2-2.4万,一、工作职责 1. 负责联系专家学者，组织稿件的同行评审，确保稿件的同行评审及时完成； 2. 编排和处理稿件，确保稿件格式正确，及时发表； 3. 与期刊主编，编委成员，作者及审稿人建立良好沟通，确保期刊正常运作，稿件顺利及时发表； 4. 关注期刊学科领域内的研究进展，协助期刊责任编辑完成期刊发展目标。 二、职位要求 1. 化学工程与工艺，制药工程，化学工程与生物工业工程等专业背景； 2. 硕士博士...,科学技术推广,http://jobs.zhaopin.com/CCL1327109300J40496880805.htm,1000-9999人,2025-04-14 17:45:26
高级新媒体运营主管,南京,南京佰邦信息技术有限公司,本科,5-10年,"内容运营,短视频运营,品牌运营,小红书,知乎,微博,抖音,微信视频号,哔哩哔哩,新闻类,家装类,科普类,短视频平台,图文平台",8000-16000元,岗位职责：1、各类平台架构搭建2、运营流程设计3、组织项目运营岗位任职要求：1、本科及以上学历2、3年以上相关工作经验3、工作认真负责寻求真正做事的优秀人才加入我们这个团队。待遇：薪资面议+五险一金！+带薪度假,互联网,http://jobs.zhaopin.com/CCL1483593760J40575057309.htm,20-99人,2025-05-01 11:33:00
内容运营,南京,久大产业投资集团有限公司,本科,3-5年,,面议,一、岗位职责：1、内容种草：生产高专业度的“园林资产管理白皮书”、“行业避坑指南”等硬核内容，在B端的知乎、领英等；C端的抖音、小红书、公众号、朋友圈等垂直及专业行业媒体进行精准投放。2、私域孵化：搭建并运营甲方物业/行政经理人的垂直社群，通过直播课、短剧、线下沙龙等形式维持活跃，完成从MQL（市场线索）到SQL（销售线索）的清洗。3、品牌势能：打造久智科技作为“懂科技的园林专家”的品牌人设，讲述...,工程施工,http://jobs.zhaopin.com/CC463728710J40786743116.htm,1000-9999人,2026-01-10 15:33:50
动物昆虫类 英文学术期刊助理编辑,南京,曼迪匹艾(南京)科技服务有限公司,硕士,经验不限,,1.2-2.4万,Animals 专注于动物科学进展，涵盖动物生理学，动物行为学及动物福利等研究领域。 详情请查看：http://www.mdpi.com/journal/animals。 Insects专注于昆虫学进展，涵盖昆虫生物学，昆虫生理学，昆虫生态学，昆虫分类学，昆虫和节肢动物的行为及病虫害管理等研究领域。详情请查看: http://www.mdpi.com/journal/insects 一、工作职责 ...,科学技术推广,http://jobs.zhaopin.com/CCL1327109300J40496880905.htm,1000-9999人,2025-04-14 17:45:02
新媒体运营,南京,新视云,本科,3-5年,"短视频平台,抖音,快手,微信视频号,教育类,母婴类,科普类,内容运营,短视频运营",8000-15000元,岗位职责:1.负责公司新媒体平台的内容策划、制作与发布，包括但不限于社交媒体、视频平台等。2.策划并执行线上活动，确保内容的创新性和吸引力。3.制定内容日历，保证内容的持续更新和优化。4.分析新媒体平台的数据指标，根据数据反馈调整内容策略。任职要求：1.具备出色的内容策划能力，能够独立完成内容创作。2.熟悉新媒体平台的运营规则和用户喜好。3.具有良好的数据分析能力，能够根据数据调整内容策略。4.优...,互联网,http://jobs.zhaopin.com/CC440596310J40979306504.htm,100-299人,2026-01-09 17:18:13
内容运营-电商,南京,南京益同药业有限公司,本科,1-3年,"短视频平台,抖音,小红书",9000-15000元,岗位职责一、 内容运营1. 负责品牌小红书/抖音账号的内容规划，结合品牌调性、产品卖点及平台热点，制定周度/月度内容选题计划。2. 独立完成小红书笔记创作，包括文案撰写、图片/视频素材筛选与优化、排版设计，打造符合小红书用户喜好的优质内容。3. 开展小红书/抖音达人合作，包括达人筛选（匹配品牌调性、粉丝画像）、合作洽谈（佣金/置换模式）、合作方案制定、内容审核及推广效果跟踪，提升品牌曝光与产品转化...,医药批发/零售,http://jobs.zhaopin.com/CC131516470J40864498612.htm,300-499人,2026-01-09 10:08:25
机械类 英文学术期刊助理编辑,南京,曼迪匹艾(南京)科技服务有限公司,硕士,经验不限,"机械设计,机械制图,机械设备,机械工艺,动力传动系统,气压系统,液压系统,轻工机械",1.2-2.4万,一、工作职责 1. 负责联系专家学者，组织稿件的同行评审，确保稿件的同行评审及时完成； 2. 编排和处理稿件，确保稿件格式正确，及时发表； 3. 与期刊主编，编委成员，作者及审稿人建立良好沟通，确保期刊正常运作，稿件顺利及时发表； 4. 关注期刊学科领域内的研究进展，协助期刊责任编辑完成期刊发展目标。 二、职位要求 1. 机械工程，机械设计制造及其自动化，材料成型及控制工程，机械电子工程，过程装备...,科学技术推广,http://jobs.zhaopin.com/CCL1327109300J40759844205.htm,1000-9999人,2025-04-14 17:44:45
AI漫剧编辑,南京,江苏天舟数字科技有限公司,本科,3-5年,"短视频编剧,电影编剧,剧本编剧,漫画编剧,戏剧编剧,动漫编剧",1-1.5万,岗位概述：负责将小说文本转化为视觉分镜脚本，设计镜头语言与节奏，为后续AI生成与剪辑提供清晰的画面指导。 岗位职责** 1. 根据小说/剧本内容，独立完成分镜脚本绘制，设计镜头构图、转场与节奏。 2. 配合导演或编剧，进行分镜动态预演（可结合AE/Blender等工具）。 3. 运用AI绘图工具（如Midjourney、Stable Diffusion）辅助生成分镜草图或场景设定。 4. 确保分镜...,培训/辅导服务,http://jobs.zhaopin.com/CCL1488402430J40884734202.htm,20-99人,2026-01-08 01:03:50
媒体高级采编,南京,佑赛科技,本科,3-5年,"新媒体运营,公众号运营",1-1.5万,岗位职责1、负责公司重大活动、品牌故事、人物专访、技术成果等专题的策划、采访与深度撰稿2、独立完成对内（高管、员工）与对外（客户、合作伙伴）的深度访谈，挖掘故事、提炼观点3、输出高质量内容：深度稿件、人物故事、案例、短视频脚本、活动素材文案等4、建立并维护“内容素材库”，形成可复用的文字、图片、视频资料体系5、配合市场、品牌、公关、技术团队，提升公司整体内容表达质量6、参与公司品牌项目的内容审核、...,电力/水利/热力/燃气,http://jobs.zhaopin.com/CC415887220J40912746815.htm,300-499人,2026-01-06 01:43:14
遥感测绘类 英文学术期刊助理编辑,南京,曼迪匹艾(南京)科技服务有限公司,硕士,经验不限,,1.2-2.4万,Remote Sensing 专注于遥感技术与应用进展，涵盖高光谱遥感，微波遥感，激光雷达，遥感模型，图像处理与数据融合，卫星产品，校正与验证等研究领域。 详情请查看：http://www.mdpi.com/journal/remotesensing。 一、工作职责 1. 负责联系专家学者，组织稿件的同行评审，确保稿件的同行评审及时完成； 2. 编排和处理稿件，确保稿件格式正确，及时发表； 3. ...,科学技术推广,http://jobs.zhaopin.com/CCL1327109300J40759844805.htm,1000-9999人,2025-04-14 17:44:17
新媒体运营,南京,南京华企新瑞企业管理咨询有限公司,本科,5-10年,"短视频平台,图文平台,微信公众号,今日头条,微信视频号,抖音,用户运营,TO B",1-1.5万·14薪,一、岗位职责：1、依据 To B 目标用户画像（企业决策层、业务负责人、HR等）制定获客与激活策略，聚焦微信、抖音、小红书等新媒体矩阵，通过内容营销、社群裂变等引流手段，扩大精准粉丝池。2、搭建用户分层运营体系，针对不同层级用户策划留存活动，收集用户反馈联动优化体验；设计推荐激励机制与裂变活动，推动内容传播扩大影响力。3、结合用户分层结果，针对高潜力用户联动咨询顾问开展1v1需求深挖，完成从“粉丝...,咨询服务,http://jobs.zhaopin.com/CCL1499316330J40969833604.htm,20-99人,2026-01-05 18:24:29
海外社媒运营,南京,南京鹏图电源有限公司,本科,3-5年,"短视频平台,海外平台,Facebook,LinkedIn,WhatsApp",8000-15000元,岗位内容：1. 按照公司的新媒体运营战略，负责品牌社交媒体账号的日常管理和内容撰写；2. 根据公司营销计划，策划并执行各种类别的线上活动和推广；3. 追踪分析数据，不断优化社交媒体运营结果；4. 与其他部门合作，按需求完成其他任务。任职要求：1. 本科及以上学历，市场营销、新闻传媒或相关专业优先考虑；2. 具有3年以上新媒体运营相关经验，有成功案例者优先考虑；3. 熟悉社交媒体平台操作规则，具有优...,农/林/牧/渔,http://jobs.zhaopin.com/CC241756810J40865484612.htm,20-99人,2026-01-03 10:06:46
计算机类 英文学术期刊助理编辑,南京,曼迪匹艾(南京)科技服务有限公司,硕士,经验不限,,1.2-2.4万,一、工作职责 1. 负责联系专家学者，组织稿件的同行评审，确保稿件的同行评审及时完成； 2. 编排和处理稿件，确保稿件格式正确，及时发表； 3. 与期刊主编，编委成员，作者及审稿人建立良好沟通，确保期刊正常运作，稿件顺利及时发表； 4. 关注期刊学科领域内的研究进展，协助期刊责任编辑完成期刊发展目标。 二、职位要求 1. 计算机科学与技术，软件工程，网络工程，信息安全，物联网工程，数字媒体技术，空...,科学技术推广,http://jobs.zhaopin.com/CCL1327109300J40759852005.htm,1000-9999人,2025-04-14 17:43:23
新媒体运营,南京,新视云,本科,3-5年,"短视频平台,图文平台,小红书,抖音,微信视频号,教育类,医疗类,旅游类,内容运营,短视频运营",8000-15000元,岗位职责：负责品牌全域新媒体矩阵（小红书、公众号、视频号、抖音等）战略运营，搭建私域流量池，实现粉丝量级与用户活跃度双重增长；策划并落地 UGC 话题活动与 KOC 培育体系，打造垂直领域社群，提升用户互动与品牌粘性，产出爆款内容（笔记 / 推文）；打造场景化内容 IP，结合热点与品牌定位输出创意推广内容，涵盖推文、短视频、视觉素材等，扩大品牌影响力；搭建 KOL 资源库与媒体合作体系，完成从 B...,互联网,http://jobs.zhaopin.com/CC440596310J40972589704.htm,100-299人,2025-12-30 11:58:22
新媒体运营,南京,信煜达信息科技(南京)有限公司,大专,3-5年,"短视频运营,品牌运营",8000-15000元,工作职责1，内容策划：挖掘用户喜好，策划有传播力的内容，独立或协同完成拍摄、剪辑与后期；2，账号运营：运营公司重点IP视频账号，打造优质的粉丝心智；3，渠道推广：熟悉平台投放规则，做好周期性投流计划；4，数据分析：对数据敏感，具有较强的成本意识。(整体希望对于内容创作或投流数据方面有一项相对熟练； 5.日常的运营维护：回复评论、私信，维护粉丝关系，提升粘性等。 工作时间：朝九晚六、周末双休 薪资待...,投资/融资,http://jobs.zhaopin.com/CCL1505348710J40976962104.htm,20-99人,2025-12-30 11:34:35
地理信息类 英文学术期刊助理编辑,南京,曼迪匹艾(南京)科技服务有限公司,硕士,经验不限,文字编辑,1.2-2.4万,IJGI 涵盖地理空间数据获取、空间分析、数据挖掘和决策支持系统、制图学、地理信息系统的应用等领域。详情请查看：http://www.mdpi.com/journal/ijgi。 一、工作职责 1. 负责联系专家学者，组织稿件的同行评审，确保稿件的同行评审及时完成； 2. 编排和处理稿件，确保稿件格式正确，及时发表； 3. 与期刊主编，编委成员，作者及审稿人建立良好沟通，确保期刊正常运作，稿件顺利...,科学技术推广,http://jobs.zhaopin.com/CCL1327109300J40759853605.htm,1000-9999人,2025-04-14 17:43:04
新媒体运营专员,南京,南京澳洁企业管理有限公司,学历不限,1-3年,"短视频平台,抖音,快手,微信视频号,内容运营,短视频运营",8000-15000元,岗位职责：1. 负责公司新媒体平台（抖音、快手、小红书、视频号等）的内容策划与运营工作2. 独立完成文案撰写、拍摄、剪辑及账号运营3. 根据平台特性制定内容策略，进行有效的新媒体推广4. 跟踪分析运营数据，优化运营效果岗位要求：1. 1年以上新媒体运营经验，有成功起号经验2. 熟练掌握文案撰写、拍摄、剪辑及各新媒体平台的运营技巧3. 具备良好的创意策划能力，善于捕捉热点4. 如果能力出色，可带领团...,耐用消费品,http://jobs.zhaopin.com/CC500537120J40723829809.htm,100-299人,2025-12-26 10:05:05
线上法律内容运营专员,南京,新视云,本科,1-3年,,8000-15000元,岗位职责：1.内容策划与创作：根据推广策略，独立负责小红书、抖音、视频号、知乎等平台的法律垂类图文、短视频、直播脚本等内容创作。2.日常运营与互动：执行各平台账号的日常内容发布、粉丝互动、评论维护，及时响应热点，维护账号活跃度与健康度。3.内容数据追踪：监控所负责内容的核心数据（阅读量、互动率、分享量等），进行基础分析，为内容优化提供数据支持。4.素材与资料库建设：协助建立并维护法律内容素材库、案...,互联网,http://jobs.zhaopin.com/CC440596310J40975296604.htm,100-299人,2025-12-22 10:01:51
光学 电子信息类 英文学术期刊助理编辑,南京,曼迪匹艾(南京)科技服务有限公司,硕士,经验不限,,1.2-2.4万,一、工作职责 1. 负责联系专家学者，组织稿件的同行评审，确保稿件的同行评审及时完成； 2. 编排和处理稿件，确保稿件格式正确，及时发表； 3. 与期刊主编，编委成员，作者及审稿人建立良好沟通，确保期刊正常运作，稿件顺利及时发表； 4. 关注期刊学科领域内的研究进展，协助期刊责任编辑完成期刊发展目标。 二、职位要求 1. 电子信息工程，电子科学与技术，通信工程，微电子科学与工程，光电信息科学与工程...,科学技术推广,http://jobs.zhaopin.com/CCL1327109300J40759860105.htm,1000-9999人,2025-04-14 17:42:43
自媒体运营+包餐,南京,南京可优米网络科技有限公司,大专,经验不限,"短视频平台,快手,抖音,医疗类,短视频运营",1-1.5万,1.运营维护新媒体账号，包括但不限于微信公众号，微博账号，百家号，搜狐号，抖音号，头条号等2.负责上述新媒体账号的推广内容编辑，推送3.结合公司活动，新产品上线等策划内容推送及互动活动3.向全网推广该运营的新媒体号，联合平台内，外资源进行推广要求：有文字编辑的基础和视频剪辑上班时间；10.00-20.00，固定单休薪资：4000——7000具体面议鸽子党勿扰，不冲KPI！！！,通信/网络设备,http://jobs.zhaopin.com/CC456265680J40710868209.htm,100-299人,2025-12-21 00:00:01
新媒体运营主管,南京,同曦集团有限公司,本科,1-3年,"短视频平台,图文平台,企业官网,微信公众号,小红书",1-1.5万,岗位内容：1. 负责公司所有新媒体账号的管理和更新，包括但不限于微信公众号、官网、小程序等；2. 根据公司整体营销方向，制定并执行线上营销策略，提升品牌知名度和销售转化率；3. 维护客户关系，并负责新媒体平台的数据分析和报告撰写；4. 不断跟进行业和社交媒体趋势，为新媒体运营提供第一手资讯和创意点子。任职要求：1. 本科及以上学历，市场营销、新闻传媒或相关专业优先考虑；2. 熟悉运用各种社交媒体平...,房地产开发,http://jobs.zhaopin.com/CC120918970J40653233706.htm,1000-9999人,2025-12-18 17:02:25
细胞生物类 英文学术期刊助理编辑,南京,曼迪匹艾(南京)科技服务有限公司,硕士,经验不限,,1.2-2.4万,一、工作职责 1. 负责联系专家学者，组织稿件的同行评审，确保稿件的同行评审及时完成； 2. 编排和处理稿件，确保稿件格式正确，及时发表； 3. 与期刊主编，编委成员，作者及审稿人建立良好沟通，确保期刊正常运作，稿件顺利及时发表； 4. 关注期刊学科领域内的研究进展，协助期刊责任编辑完成期刊发展目标。 二、职位要求 1. 生物学相关专业背景； 2. 硕士博士优先，优秀的本科生亦可考虑； 3. 英语...,科学技术推广,http://jobs.zhaopin.com/CCL1327109300J40760737905.htm,1000-9999人,2025-04-14 17:42:06
新媒体运营,南京,江苏驰美汽车服务有限公司,本科,3-5年,"短视频平台,微信视频号,抖音,短视频运营,内容运营,品牌运营",8000-15000元,岗位职责:1. 负责新媒体平台的内容策划与短视频制作2. 管理和优化短视频项目，提升内容质量和用户互动3. 跟踪分析数据反馈，调整运营策略以满足市场趋势任职要求:1. 具备出色的沟通能力和团队协作精神2. 能够独立完成任务，对工作细节有高度的关注3. 具有创新思维，能够适应快节奏的工作环境,汽车研发/制造,http://jobs.zhaopin.com/CC316622410J40812959814.htm,500-999人,2025-12-18 10:05:26
新媒体运营,南京,南京闳之美,本科,3-5年,"小红书,短视频平台,抖音,微信公众号,微博",8000-15000元,任职要求： 本科及以上学历，市场营销、新闻传播、数字媒体等相关专业优先; 2、3年以上新媒体平台运营经验，有快消品行业，美妆类背景者优先; 3、具备出色的内容创意能力，网感好脑洞大； 4、精通主流社交媒体平台运营规则(小红书/抖音/微博/公众号等)，具备平台数据运营分析能力； 5、对流行热点趋势敏感，能快速捕捉热点并转化为账号内容； 6、优秀的跨团队沟通能力。 岗位职责： 1.新媒体平台内容策略制...,日化,http://jobs.zhaopin.com/CC281019080J40814106511.htm,20-99人,2025-12-12 14:41:08
材料类 英文学术期刊助理编辑,南京,曼迪匹艾(南京)科技服务有限公司,硕士,经验不限,,1.2-2.4万,一、工作职责 1. 负责联系专家学者，组织稿件的同行评审，确保稿件的同行评审及时完成； 2. 编排和处理稿件，确保稿件格式正确，及时发表； 3. 与期刊主编，编委成员，作者及审稿人建立良好沟通，确保期刊正常运作，稿件顺利及时发表； 4. 关注期刊学科领域内的研究进展，协助期刊责任编辑完成期刊发展目标。 二、职位要求 1. 材料科学与工程，材料物理，材料化学，冶金工程，金属材料工程，无机非金属材料工...,科学技术推广,http://jobs.zhaopin.com/CCL1327109300J40760815605.htm,1000-9999人,2025-04-14 17:41:45
全案策划（展厅）,南京,南京思德展示科技股份有限公司,本科,5-10年,,1-1.5万,岗位职责：1、为各类展馆（科技馆、博物馆、规划馆、企业馆等各类不同主题与领域的场馆）编写策划创意方案；2、具备与客户接洽并准确的梳理好项目需求，且能够主导项目方向和进度的能力；2、有较强的艺术审美能力，能完成专业的提案，思路清晰，表达准确生动；3、熟悉项目执行过程中的技术流程，了解各种制作手段的技术路径以及技术障碍。任职要求：1、展陈相关领域5年以上工作经验；2、对待负责的项目与作品有自己的严格要...,广告/营销,http://jobs.zhaopin.com/CC407267780J40857763303.htm,300-499人,2025-12-03 12:48:07
新媒体运营,南京,汇通达,大专,3-5年,"短视频平台,图文平台,内容运营,品牌运营",1-1.5万,岗位职责：1、招商加盟信息 & 店铺平台流量投放：1-1负责品牌加盟招商相关流量投放，涵盖抖音、快手、小红书、微信视频号、百度信息流等主流平台，制定投放策略、筛选精准人群、优化投放素材，提升加盟咨询量与转化率；1-2统筹终端店铺线上流量运营，包括美团、大众点评、地图类平台等，优化店铺线上展示信息、投放店铺推广广告，提升到店客流与线上成交率，监控投放数据（曝光量、点击量、咨询量、转化成本等），定期复...,互联网,http://jobs.zhaopin.com/CC393677210J40844145113.htm,1000-9999人,2025-11-22 10:55:20
环境科学 环境工程类 英文学术期刊助理编辑,南京,曼迪匹艾(南京)科技服务有限公司,硕士,经验不限,,1.2-2.4万,一、工作职责 1. 负责联系专家学者，组织稿件的同行评审，确保稿件的同行评审及时完成； 2. 编排和处理稿件，确保稿件格式正确，及时发表； 3. 与期刊主编，编委成员，作者及审稿人建立良好沟通，确保期刊正常运作，稿件顺利及时发表； 4. 关注期刊学科领域内的研究进展，协助期刊责任编辑完成期刊发展目标。 二、职位要求 1. 环境科学与应用，医学，遗传学，生物化学，生态学，公共卫生等专业背景； 2. ...,科学技术推广,http://jobs.zhaopin.com/CCL1327109300J40760816405.htm,1000-9999人,2025-04-14 17:41:24
新媒体推广主管,南京,南京道奇科技有限公司,本科,1-3年,"美妆类,品牌运营,市场营销",8000-15000元,岗位职责： 1.负责电商平台（天猫/京东/抖音等）新媒体矩阵的运营策略制定与执行，提升品牌曝光及转化率； 2.结合行业趋势与用户画像，策划热点营销活动（如直播、短视频、社群裂变等）； 3.主导社交媒体（微信、微博、小红书、抖音等）的内容创作与投放，优化选题、文案及视觉呈现； 4.监控内容数据（阅读量、互动率、ROI等），持续迭代运营方案； 5.通过付费推广（信息流广告、KOL合作等）与自然流量运营...,生物工程,http://jobs.zhaopin.com/CC142915790J40848546403.htm,100-299人,2025-11-19 00:12:42
