职位,城市,公司,学历,经验,技能,薪资,工作描述,行业,职位URL,公司规模,发布时间
非标自动化电气工程师,南京,南京星霸科技有限公司,本科,3-5年,"设计,自动化设计,西门子,ABB,控制柜,电机,配电柜,低压,中压,高压,双休  五险一金,机械/机电设备技术支持经验",1.1-2.2万·13薪,岗位职责：1、负责SOLIDWORKS Electrical软件的售前技术支持，技术方案撰写与产品演示工作；2、 负责SOLIDWORKS Electrical软件的售后技术支持：如客户培训，技术回访等；3、 负责SOLIDWORKS Electrical付费项目实施工作：如电气研发标准化体系落地等；岗位要求：1、 专科或以上学历，电气或机电一体化相关专业；2、 具有专业电气背景知识与工作经验。须...,计算机软件,http://jobs.zhaopin.com/CC293802230J40711672710.htm,20-99人,2025-02-24 15:22:43
高级电气方案工程师,南京,南京泰普森自动化设备有限公司,大专,5-10年,"西门子,三菱,设计",1.1-2.2万,岗位职责1、负责非标自动化设备及生产线项目的前期工艺、机械、标准等方面的技术交流，并进行电气方案规划、程序设计规划工作；2、负责项目设计过程中电气元器件选型、BOM清单输出、电气图纸设计以及电气装配技术指导；3、负责项目第三方设备、MES信息化系统等电气方案、技术协议交流和编写；4、负责项目设计过程中技术文件的更新、输出、维护；5、有效做到方案成本控制；岗位要求1、专科及以上学历，电气、机电一体化...,专用设备制造,http://jobs.zhaopin.com/CC428087080J40670725707.htm,300-499人,2024-12-09 17:13:50
Electric Designer 电气设计员,南京,中船麦基嘉船舶装备有限公司,本科,经验不限,控制柜,1.4-2.1万,1、根据现行规章制度进行电气系统设计。Perform electrical system design according to current rules and regulations.2、在图纸修订系统中存储和维护电气系统图纸及组件数据表。Store and maintain electric system drawings and component data sheets in the ...,船舶/航空/航天/火车制造,http://jobs.zhaopin.com/CCL1311363370J40205705303.htm,100-299人,2026-01-09 00:00:01
高压电气工程师,南京,南京立臻信息科技有限公司,本科,5-10年,,1.4-2.1万,高压电气技术人员1. 职责：负责高压电气系统的规划设计、设备选型、现场施工监督与验收；定期巡检高压电气设备，及时排除故障，确保系统安全稳定运行；对接当地电力部门，确保项目电气合规。2. 任职要求：电气相关专业本科及以上学历；5年以上高压电气工作经验，持有高压电气相关资格证书；熟悉乌兹别克斯坦当地电气规范及安全标准；具备良好的跨文化沟通能力，能独立处理高压电气技术问题；可适应长期海外工作。3. 薪资...,通用设备制造,http://jobs.zhaopin.com/CC435857230J40818896701.htm,20-99人,2026-01-06 16:51:42
电子工程师南京,南京,上海至信信息科技有限公司,大专,经验不限,"研发,维修/保养,测试,嵌入式软件研发,嵌入式硬件研发,电力电子产品,汽车电子产品,消费电子产品",1.3-2.1万·13薪,岗位内容：1. 协助工程师设计和开发电子硬件和软件；2. 维护和更新现有的电子产品，并解决相关的技术问题；3. 编写和执行测试计划，确保产品符合质量标准；4. 协调内部和外部团队，推进项目进程；任职要求：1. 电子工程或相关领域的学士学位；大专学历优秀也可2. 了解PCB设计和仿真工具，如Protel、Eagle、Pspice等；3. 良好的逻辑思维能力和团队合作精神。,计算机硬件,http://jobs.zhaopin.com/CC242181210J40805059605.htm,20-99人,2025-08-21 10:09:15
高级电子设计工程师 (MJ001288),南京,南京菲尼克斯电气有限公司,本科,5-10年,"电力电子产品,设计,研发,工业电源产品设计",1.5-2.1万·16薪,岗位要求：1.掌握电子电路设计知识2.掌握电子电器元器件的关键参数能够根据设计需求选择合适的电子器件（如MOSFET、IGBT）和磁性器件（如变压器、电感），确保电路的稳定性和可靠性。熟悉功率器件，磁性器件（如变压器、电感）和常见电气器件的特性，能够根据产品工况选择合适的器件型号，并进行仿真验证以确保兼容性和效率3.熟练使用仪器仪表如示波器.万用表等4.熟悉电子研发以及产品生产工艺知识5.掌握设计...,工业自动化,http://jobs.zhaopin.com/CC405548310J40789884112.htm,1000-9999人,2025-07-02 15:41:33
高级电气工程师,南京,思源电气,本科,5-10年,,1.5-2万·16薪,岗位职责：1、负责储能以及SVG、SSC等电力电子产品电气一次工程标准化设计、元器件选型以、负责产品配置化功能规划及实现；2、负责梳理工程外购件，优化规格型号配置，持续提升工程设计工作效率和质量；3、负责制定和优化各业务机会工程设计典型配置方案；任职要求：1、熟练使用常用二维绘图软件、熟练使用办公软件。2、掌握电力行业相关设计规范、国家标准。3、具有丰富的电气工程、电路基础。4、熟悉SVG或储能等...,电气机械/电力设备,http://jobs.zhaopin.com/CC000635070J40813428611.htm,1000-9999人,2026-01-11 00:47:00
应用测试（PLC+数控应用/伺服驱动应用）,南京,瞬联软件科技(北京)有限公司,本科,3-5年,"PLC设计,测试,西门子,三菱,欧姆龙,电气设备,自动化设备,数控,伺服驱动",1.1-2万,工作职责参与目标项目的需求与设计文档评审工作；根据产品需求规格说明书、功能规格说明书及其他相关要求，编制应用测试用例；依据测试计划，在真机或测试台架上执行既定测试用例；基于数据分析结果生成测试报告；搭建实验室测试环境。任职要求学历：电气工程、机电一体化、自动化相关专业本科及以上学历；具备驱动与电机系统调试技能；拥有 3 年及以上 MTS/GMC 机床设备制造相关工作经验；精通伺服驱动器或数控系统应...,计算机软件,http://jobs.zhaopin.com/CC000276520J40978079004.htm,1000-9999人,2026-01-11 00:45:01
非标自动化机械工程师,南京,江苏勒迪科智能装备有限公司,大专,1-3年,"安装/调试,机械设备,机械设计,结构设计,非标自动化,结构工程师,机械工程师",1.2-2万,"职位描述1.负责非标自动化设备的机械设计；2. 提供符合客户要求的解决方案；3. 严格执行项目的进度安排和质量要求；4. 根据项目需要进行细节设计和标准件采购；5. 主动向项目经理汇报项目的进度；6.进行项目组装，调试，安装和售后服务；7.完成上级安排的其他工作。任职要求：1. 大专以上学历，机械设计及其自动化相关专业；2. 有非标自动化设备机械设计5年以上工作经验,熟悉机械加工工艺；3. 能够熟...",通用设备制造,http://jobs.zhaopin.com/CCL1486361910J40608112809.htm,20-99人,2026-01-11 00:13:03
高级结构工程师,南京,思源电气,本科,5-10年,,1.5-2万·16薪,1、负责SVG SSC项目结构设计工作，通过工程布置方案优化、配置优化，降低成本，提升产品竞争力；2、负责工程设计结构领域的平台建设，推进工程设计通用结构部件的建立，建立工程标准化平台，提升工作效率和交付质量；3、按业务流程推进工程布置方案及结构设计工作，持续改进计划管理，确保设计质量及及时率。1、熟练使用三维绘图软件、熟练使用办公软件；2、熟悉电力行业相关设计规范、国家标准。,电气机械/电力设备,http://jobs.zhaopin.com/CC000635070J40813444411.htm,1000-9999人,2026-01-11 00:45:01
电气工程师,南京,南京恒标斯瑞冷冻机械制造有限公司,本科,3-5年,"PLC程序设计,电气自动化设计,西门子PLC",1.5-2万,岗位职责：1.关注行业的技术发展动态，根据实际市场情况，进行技术产品规划；2.按照《设计开发控制程序》完成新产品设计、元器件选型、系统控制逻辑编程设计、样机逻辑测试、验证和交付。3.参与新产品设计过程中的控制改进和优化。4.负责标准系列产品的电气配置和控制程序等改进和优化工作。5.负责日常订单项目的元器件选型、电气原理图和布局图绘制、电气BOM制作、程序编写，以及电气生产工艺指导文件。6.完成上级...,电气机械/电力设备,http://jobs.zhaopin.com/CC361294410J40450701314.htm,100-299人,2026-01-09 11:39:14
电控系统工程师,南京,南京东华智能转向系统有限公司,硕士,1-3年,,1-2万·16薪,岗位职责：1: 参与新项目开发，输出项目前期报价相关的设计方案等文件2: 负责实施EPS产品技术开发计划及执行，按开发节点推动并完成各阶段目标3: 负责产品图纸技术分析，客户需求分析，设计评审，主导编制DFMEA文件4: 负责EPS项目的问题管理和风险控制并支持项目内外部审计5：负责向客户、供应商、其他相关部门提供技术支持6：负责开发阶段整车问题调查及汇报，协调并推动问题解决7：参与台架试验和整车...,汽车研发/制造,http://jobs.zhaopin.com/CC542661580J40499507805.htm,100-299人,2026-01-08 10:52:02
2026思源电气校招岗位研发岗-电气,南京,思源电气,硕士,无经验,"电气工程,电力系统",1.2-2万·15薪,2026思源电气校招岗位-研发岗岗位类型：电气工程师、嵌入式软件工程师、算法工程师、电力应用软件工程师、通用软件工程师、图像算法工程师、人工智能算法工程师专业：1、电气工程及其自动化、电力系统及其自动化、电力电子与电力传动、高电压与绝缘技术、电机与电器、电机电器智能化、电力系统继电保护与自动化、电气工程与智能控制、电工理论与新技术、控制理论与控制工程、自动化；2.计算机应用技术、软件工程、人工智能...,电气机械/电力设备,http://jobs.zhaopin.com/CC000635070J40794634611.htm,1000-9999人,2026-01-11 00:16:41
招聘电工 月入20000,南京,江苏中矿大正表面工程技术有限公司,大专,3-5年,"特种作业操作证 （低压电工）,西门子PLC,高空作业,售后维修",1-2万,岗位职责： 1. 设备维护与检修 负责公司生产设备、电气系统的日常维护、保养和检修工作，确保设备正常运行，保障生产的连续性。包括但不限于对电机、配电柜、变压器、照明系统、自动化控制系统等进行定期检查和故障排除。 根据设备运行状况和维护计划，制定合理的维修方案，对设备进行预防性维护，降低设备故障率，延长设备使用寿命。 2. 故障诊断与修复 当设备出现故障时，迅速响应并准确判断故障原因，运用专业知识和...,工程施工,http://jobs.zhaopin.com/CC230821230J40768894705.htm,100-299人,2026-01-07 00:48:41
电气自动化工程师,南京,南京永基自动化工程有限公司,本科,经验不限,"安装/调试,设计,维修/保养,自动化设计,电气设计,PLC设计",1-2万,工作内容：1.仪控专业技改方案编制、设备选型、组织施工和调试；2.负责PLC、触摸屏的编程、调试工作，成套柜的PLC、变频器及低压电器的成套选型、清单配置、图纸设计；3.负责施工现场管理工作，能够对施工现场仪器仪表设备的保养维护，能够对客户遇到的问题进行远程技术支持任职要求：1、自动化/计算机等相关专业毕业2、3年以上相关工作经验3、西门子400系列/1500/1200系统设计选型组态调试经验4、...,工业自动化,http://jobs.zhaopin.com/CC508073120J40788131509.htm,20-99人,2026-01-06 00:00:02
变电一次设计,南京,江苏东方宏达电力发展有限公司,本科,1-3年,"电气工程,强电工程,输变电工程,电力设计",1.5-2万,岗位职责：1、负责220kV及以下电压等级变电一次可研、初设、施工图设计各阶段工作；2、负责工程项目实施过程中的内、外部协调和技术交流，完善项目后期服务。 任职要求1、本科及以上学历，电气工程及其自动化相关专业：2、两年以上变电一次设计经验，独立完成220kV及以下电压等级变电设计；3、具备省电力设计院或大型甲/乙级设计院工作经验者优先。,电力/水利/热力/燃气,http://jobs.zhaopin.com/CC705554120J40439887602.htm,100-299人,2026-01-05 16:16:40
软硬件产品研发工程师,南京,江苏中实电子有限公司,本科,3-5年,"研发,嵌入式软件研发,嵌入式硬件研发,电力电子产品",1-2万,岗位职责：1.负责产品硬件电路的设计与开发；2.负责单片机产品的开发与调试 ；3.能完成总体方案、器件选型、原理图设计、调试、测试、维护、优化等工作；4.能独立完成产品开发及相应过程文档的编写；5.负责向生产部和售后部提供技术支持；6.负责或参与专利和技术文件的撰写。能力要求：1.具有较强的模拟与数字电路设计能力，熟悉单片机(STM32 M3 M4 )等外围电路的设计 ；2.熟练使用 Altium...,电子/半导体/集成电路,http://jobs.zhaopin.com/CC200840280J40178724308.htm,20-99人,2026-01-05 08:50:43
电子工程师,南京,连云港杰瑞电子有限公司,硕士,经验不限,"电路设计,电机,控制器",1.5-2万·14薪,岗位职责：1.电机控制器设计开发及优化调试；2.硬件测试方案的设计与实施，功率主回路、模拟采样电路、和数字电路设计；3.驱动器单板功能调试和整机测试；4.按照计划完成符合功能性的要求和质量标准的硬件产品；5.编制新产品的详细开发计划，推进产品开发的进程；任职要求：1.硕士及以上学历，电机与电器、自动化、微电子等相关专业；2.具有电机控制器开发设计经验和开发应用工作经验；3.熟悉电力电子元件的应用，...,电子/半导体/集成电路,http://jobs.zhaopin.com/CC272132510J40977838004.htm,500-999人,2026-01-04 14:41:40
电子工程师-电容料位开关开发,南京,南京汉悠电子有限责任公司,大专,1-3年,"设计,研发,测试,嵌入式软件研发,嵌入式硬件研发,消费电子产品,电力电子产品,汽车电子产品,电路设计,PCB设计,结构设计",1-2万,此岗位单休:1.分析客户需求和竞争对手硬件产品功能 2.硬件方案开发和可靠性分析，器件选型 3.输出产品设计文档，报告设计计算，原理图，LAYOUT，DFMEA等 4.硬件成本评估和控制 5.制定硬件BOM和支持采购寻找器件供应商 器件通用化 6.制定硬件测试方案 7.负责测试失效分析，生产失效分析，客户退件分析 8.支持硬件生产工艺，如器件焊接，分板等任职要求： 1.有传感器或类似电子产品的开发...,仪器仪表制造,http://jobs.zhaopin.com/CCL1470011050J40740374311.htm,20-99人,2025-12-30 17:51:13
电气研发工程师,南京,南京晶升装备股份有限公司,本科,3-5年,"非标设备,倍福,CODESYS平台,PID",1.5-2万·13薪,岗位职责： 1、设备研发：包括电气图纸绘制、电气部件选型、软件开发等； 2、电气外包部分供应商评估，以及外包部分技术的引进和转化； 3、解决技术问题并估算成本和时间； 4、样机试制，参加现场试验调试并处理电气故障，提出产品改进措施； 5、确定最终产品或系统，并准备生产文件、使用手册等相关文件资料； 任职要求： 1、本科及以上学历，自动化、电气等相关专业，3年及以上相关工作经验。 2、熟悉电气图纸设...,电子/半导体/集成电路,http://jobs.zhaopin.com/CC461185820J40601317501.htm,100-299人,2025-12-30 00:00:03
电气工程师,南京,连云港杰瑞电子有限公司,硕士,无经验,"电路设计,电力电气",1.5-2万·14薪,岗位职责：1、根据产品任务书要求独立完成课题研究及产品开发，包括原理样机、电路仿真、技术文件编制、设计电路调试等工作；2、协助产品负责人对产品研发过程中出现的质量问题进行排查，提出改进意见；3、组织或协调项目团队，把握时间进度，完成产品开发任务；4、协助产品负责人进行项目的策划工作；5、负责产品推广应用的培训工作。任职要求：1、硕士及以上学历，电子电力、电子信息、电气工程及自动化相关专业；2、熟悉...,电子/半导体/集成电路,http://jobs.zhaopin.com/CC272132510J40257997404.htm,500-999人,2026-01-04 14:40:23
工业自动化项目经理,南京,中润华谷(南京)科技有限公司,本科,3-5年,"DCS系统,自控系统",1-2万,工作内容：1.参与公司项目的前期工作，包括项目可行性研究报告，项目初步设计；2.负责项目实施时间规划，把控项目实施时间节点，按时保质保量完成项目实施；3.负责项目团队管理，工作分配，对项目组员工工作结果进行考核；4.负责自动化系统的承接、组态及组织实施；软件、硬件的调试、系统测试；5.负责现场DCS、PLC等系统的组态、安装、调试、运行以及维护；6. 负责系统安装及调试；用户培训；技术咨询；编写技...,工业自动化,http://jobs.zhaopin.com/CCL1384952000J40907471308.htm,20-99人,2025-12-24 00:02:21
储能电气工程师,南京,南京芷铭企业管理咨询有限公司,本科,3-5年,"设计,PCS",1.5-2万,岗位职责：1、参与电力储能产品（大功率、中功率储能变流器，电池集装箱预制舱、变流升压一体机、分布式储能一体机、电池插箱等）项目立项可行性调研，参与系统方案设计；2、拟制电气设计方案和项目计划，承担电力储能产品电气原理设计、电气元器件选型；3、参与样机的研制、测试（如EMI、ESD、安全性可靠性、型式试验等）并提供相关技术支持；4、电气原理图纸的绘制与管理；5、BOM清单、产品说明书、装配指导书文件...,企业服务,http://jobs.zhaopin.com/CC526450220J40882974802.htm,20-99人,2025-12-23 18:31:52
高级电气自动化工程师,南京,江苏海胜智能装备科技有限公司,本科,5-10年,"电气自动化设计,PLC程序设计,电气技术支持,PLC系统,西门子PLC",1.1-2万,工作职责:1、仓储自动化设备研发设计工作；2、自动化仓储项目电气设计工作。任职资格:1、本科及以上学历，电气工程或自动化相关专业 ；2、具有5年以上电气设计或设备调试相关工作经验；3、能够熟练使用AUTO CAD或EPLAN等专业软件进行电气图纸设计；4、熟练掌握西门子/施耐德系列PLC编程和西门子/施耐德及丹佛斯系列变频器控制，伺服电机控制；5、具有仓储自动化行业经验者优先。 职位福利：五险一金...,货运/物流/仓储,http://jobs.zhaopin.com/CC328296780J40402208908.htm,20-99人,2025-12-22 09:26:16
研发兼职（建筑设备和餐饮自动化设备）,南京,宁波优造建筑科技有限公司,本科,10年以上,非标设备,1-2万,岗位职责：主要研发合作，我司有建筑工业化设备和餐饮工业化设备，较多非标自动化设备，还有焊接设备，起重设备，中央厨房设备等等1、负责产品机械结构、机械部件的设计；2、负责技术交底和生产技术支持工作；3、收集生产及终端使用反馈情况，并针对性地作出设计改进及更新；任职要求：1、本科及以上学历，机械类相关专业；2、非标自动化经验丰富，熟练使用设计相关软件及办公软件。,建材,http://jobs.zhaopin.com/CC827017640J40809044709.htm,100-299人,2025-12-18 00:14:41
供配电工程师,南京,中冶华天南京,硕士,3-5年,电力设计,面议,岗位职责：负责钢铁冶金、节能减排（煤气发电、余热发电、煤气储存和输配、空分等）、大气治理（烟气治理、环境除尘、超净排放等）等领域工厂供配电设计及工程管理、自备电站及区域变电站设计及管理，市政民用设施及水环境治理、城市道路电气设计等。任职要求：1）硕士研究生学历，电气工程及其自动化相关专业，熟悉供配电(发输变电)相关的理论专业知识；2）熟悉CAD制图，注册电气工程师优先；具有良好职业道德，忠于岗位、...,工程技术与设计服务,http://jobs.zhaopin.com/CC438038610J40338208706.htm,1000-9999人,2025-12-18 00:00:01
电子电气工程师/硬件工程师,南京,南京芷铭企业管理咨询有限公司,本科,3-5年,"设计,安装/调试,测试,自动化设计,PLC设计,电路设计,控制柜,电机,变频器",1.1-2万,"""岗位职责：1、参与电力储能产品（大功率、中功率储能变流器，电池集装箱预制舱、变流升压一体机、分布式储能一体机、电池插箱等）项目立项可行性调研，参与系统方案设计；2、拟制电气设计方案和项目计划，承担电力储能产品电气原理设计、电气元器件选型；3、参与样机的研制、测试（如EMI、ESD、安全性可靠性、型式试验等）并提供相关技术支持；4、电气原理图纸的绘制与管理；5、BOM清单、产品说明书、装配指导书文...",企业服务,http://jobs.zhaopin.com/CC526450220J40838843202.htm,20-99人,2025-12-17 16:29:21
高级电气工程师,南京,南京泰普森自动化设备有限公司,大专,3-5年,"电气设计,电气工程师,BOM表制作",1-2万,工作职能1、工业自动化设备及生产线项目的电气方案规划、程序设计与调试2、工业自动化设备及生产线项目的电气设计工作的管理和安排岗位要求1、专科及以上学历，电气、机电一体化、自动化等相关专业。3年以上自动化设备设计和调试经验，具有一定的方案规划和设计能力。具有汽车行业非标设备设计调试工作经验者优先。2、熟练使用西门子或三菱或GE等品牌的PLC及触摸屏编程调试。3、熟练使用常规变频器，伺服电机，工业相机...,专用设备制造,http://jobs.zhaopin.com/CC428087080J40064701607.htm,300-499人,2025-12-11 09:46:10
电气二次设计师,南京,江苏东投科技有限公司,本科,3-5年,"设计,电力设计,自动化设计",1-2万,岗位职责：1、能独立完成相关设计任务，编制相关技术规范书、可研、初设、施工图、竣工图等；2、协助项目编制投标技术文件、工程的招标采购工作。3、独立进行220kV及以下电气二次可研、初设、施工图设计及校对、审核工作。4、具有良好的沟通及表达能力，责任心强，有敬业精神；5、能够适应短期出差，完成领导要求的其他工作。任职要求：1、电力系统及其电气自动化相关专业本科以上学历；2、2-3年电气二次设计工作或...,电力/水利/热力/燃气,http://jobs.zhaopin.com/CCL1453399070J40628831707.htm,20人以下,2025-12-07 17:55:26
高级plc电气工程师,南京,乔锋智能装备股份有限公司,本科,5-10年,"PLC设计,西门子,三菱,数控机床",1.5-2万·13薪,岗位职责: ：1、对公司产品做出电气方案设计、完成电气图纸设绘电气元件选型、PLC编程、电气BOM等技术资料的编制；2、完成样机试制的电气设计调试，参加现场试验并处理电气故障，提出产品改进措施；3、负责量产机型电气部分的持续优化改善；岗位要求：1、本科及以上学历，25-40岁，自动化、电气类相关专；2、5年以上五轴机床电气设计工作经验，熟练掌握制图软件、电气设计软件；3、能够独立设计机床电气原理图...,专用设备制造,http://jobs.zhaopin.com/CCL1237895980J40639067707.htm,1000-9999人,2025-12-05 16:32:01
电气自动化工程师,南京,江苏科恒水处理工程有限公司,大专,1-3年,"AutoCAD,PLC",1.2-2万,1．负责工程项目的电气一次 二次原理图及自控仪表选型设计，施工图纸设计；2．负责项目的控制柜及plc编程，能独立操作编写程序，并负责现场电气调试；3．熟练使用西门子、施耐德等主流PLC软件，熟悉INTOUCH、IFIX、WINCC等组态软件；4．负责完成领导交代的其他工作；5．电气专业以及自控仪表专业知识扎实，具有良好的设计理念，具有良好的组织协调能力、管理能力、分析能力及业务创新能力；6．具备中...,环保,http://jobs.zhaopin.com/CC815583370J40362255415.htm,20-99人,2025-12-05 14:57:01
变电一次设计师,南京,江苏东投科技有限公司,本科,3-5年,"输变电工程,电网工程,发电工程,电力设计",1.2-2万,一、职位描述1、能独立完成220kV及以下电压等级变电站电气一次设计。2、负责主网基建工程及技改工程变电一次专业设计及校审工作。3、了解各类电力工程设计的经济指标4、对接设计院、审图机构，控制好电力工程电气设计相关评审会及相关设计的变更。掌握电力工程电气设计各阶段的条件，对于施工重难点能通过专家会审提出最优解决方案5、身体健康，个人素质良好，品行端正，有较强的沟通能力和团队协作能力。二、岗位要求1...,电力/水利/热力/燃气,http://jobs.zhaopin.com/CCL1453399070J40628832107.htm,20人以下,2025-12-07 17:55:23
