职位,城市,公司,学历,经验,技能,薪资,工作描述,行业,职位URL,公司规模,发布时间
前端-深圳,深圳,北京南天信息工程有限公司,本科,5-10年,"Vue,CSS,JavaScript,HTML5",1.1-2.2万,任职要求：1、熟练掌握 Vue 3.0 及周边生态（Pinia/Vuex、Vue Router、Vite等）；2、熟练使用 Node.js 进行前端工程化构建和工具链开发；3、有完整的项目前端开发经验。4、掌握node express架构，了解python语言5、具备良好的沟通能力和学习能力。6、具备前端性能优化及跨浏览器兼容性处理经验。7、有个人信贷银行经验优先,计算机软件,http://jobs.zhaopin.com/CC190963110J40630763103.htm,500-999人,2025-12-26 10:14:58
前端工程师（线上面试＋稳定）,深圳,深圳市法本信息技术股份有限公司,大专,10年以上,Vue,1.7-2.2万,. 高级前端工程师岗位职责：1.负责公司核心、复杂业务产品的前端架构设计、技术选型和开发工作。2.主导复杂组件和公共模块的开发，构建高复用、可维护的前端技术体系。3.深入理解业务，将业务需求转化为合理的技术方案，并能主导技术方案的落地。4.优化前端性能，解决各种浏览器兼容性和安全性问题，保障用户体验。5.指导和培养中级及初级工程师，进行代码审查，带领团队完成技术攻坚。6.探索前端新技术，推动低代码...,计算机软件,http://jobs.zhaopin.com/CC385622410J40724919706.htm,1000-9999人,2025-10-15 16:00:51
前端开发工程师,深圳,华赢东方科技(深圳)有限公司,本科,3-5年,"JavaScript,HTML5,前端开发经验,React,Node.js,WEB3,智能合约",1.5-2.2万,重点：react比较熟练！！！！ 职位名称：前端开发工程师（有web3经验优先，要会听和阅读英文，因为有时候会跟国外技术团队交接） 工作地点：深圳福田区卓越世纪中心 公司运营着一套支付基础设施，将传统银行业务与区块链技术无缝连接。通过机构级托管钱包和多链安全技术， 帮助企业实现稳定币支付的发送与接收、货币兑换，并将加密货币支付集成至其系统中，同时确保合规运营。此外，提供代币化技术解决方案，可实现现...,投资/融资,http://jobs.zhaopin.com/CCL1451665190J40766994201.htm,20-99人,2025-09-05 15:15:29
.net C# web bs高级软件工程师,深圳,深圳市海德泰格软件技术有限公司,大专,5-10年,"C#,多线程,高级软件工程师,ASP.NET,.NET Core,MySQL",1.6-2.2万,岗位职责：1、负责系统需求分析与设计；根据业务确定实现方案；对现有系统缺陷提出优化方案；2、负责系统关键功能开发及维护，保障系统的正常运行；3、带领指导团队开发成员完成开发工作，解决开发过程遇到的问题；4、参与项目的代码质量管理和控制，保证项目的高质量；任职要求：1、计算机相关专业，大专及以上学历，5年及以上软件开发经验，参与过系统框架设计；2、精通 Asp.Net Core Mvc、WebApi...,计算机软件,http://jobs.zhaopin.com/CC238017410J40703415601.htm,20-99人,2025-09-05 00:36:42
高级前端开发工程师,深圳,亮中科技(深圳)有限公司,本科,5-10年,"Vue,React,uni-app,GIS/地图项目,直播视频项目,电商项目,Node.js,Three.js,Canvas,CSS,JavaScript,HTML5",1.8-2.2万,前端开发工程师（高级）招聘一、岗位职责1.负责公司APP前端界面的设计与开发，使用Vue 3.0框架构建高性能、高可用性的用户界面，确保良好的用户体验。2.深入理解并熟练运用MQTT协议，实现APP与后端服务器之间的高效、可靠通信，保障数据的实时传输与交互。3.参与项目需求分析，根据业务需求制定合理的前端技术方案，优化前端架构，提升代码的可维护性和可扩展性。4.跟踪前端技术发展趋势，引入新的技术和...,仪器仪表制造,http://jobs.zhaopin.com/CC842911170J40762246215.htm,20-99人,2025-08-12 00:00:01
高级web前端工程师,深圳,西安笃定信息技术有限公司,大专,3-5年,"互联网,CSS,JavaScript,HTML5,Vue,React",1.7-2.1万,岗位职责：1、参与互联网业务的web/app前端的开发工作，包括需求沟通、功能设计与开发等2、参与前端业务的体验、性能提升，持续改进前端应用架构3、参与前端业务的线上维护，问题排查和修复任职要求： 1、3年以上的前端开发工作经验，计算机相关专业2、熟练掌握前端开发技术和主流前端框架，掌握移动端UI开发原理，了解跨端框架技术3、能确保基本的体验和性能4、具备良好的沟通能力和团队协作能力 5、有OTA...,计算机软件,http://jobs.zhaopin.com/CC631548230J40866826212.htm,20-99人,2026-01-08 14:19:11
JavaaScript后台开发本部月休息八,深圳,广州一滴水企业管理服务有限公司,学历不限,经验不限,金融项目,1.9-2.1万·13薪,嘿，朋友！我们正在寻找一位充满激情的JavaScript开发工程师，一起打造超酷的Web应用！你的工作将是： 和我们一起研发前端系统； 设计并编写代码； 找找bug，修复它们； 不断添加新功能，让系统更强大、更安全； 和其他团队成员一起参加代码评审，让代码更完美。如果你： 热爱编程，对JavaScript有浓厚兴趣； 有较强的责任心和团队精神； 熟练掌握HTML/CSS/JavaScript。那么...,人力资源服务,http://jobs.zhaopin.com/CCL1511076520J40977238304.htm,100-299人,2026-01-07 01:10:22
vue前端开发工程师,深圳,亮中科技(深圳)有限公司,本科,10年以上,"前端架构,Webpack,Vue,GIS/地图项目,直播视频项目,电商项目,TypeScript",1.8-2.2万,【岗位职责】1）负责公司直播业务多端（iOS / Android / H5 / 小程序）的前端架构设计与核心功能开发，基于 UniApp + Vue 3 技术栈；2）深度参与直播 SDK 的接入与二次封装（推流、拉流、连麦、美颜、弹幕、礼物等），持续优化首帧、卡顿、功耗等核心指标；3）负责直播业务原生云（阿里云 / 腾讯云）能力的对接与调优，包括云函数、云数据库、云存储、CDN 回源、边缘加速等；...,仪器仪表制造,http://jobs.zhaopin.com/CC842911170J40874164315.htm,20-99人,2025-08-10 11:35:21
前端开发工程师,深圳,西安笃定信息技术有限公司,本科,3-5年,"Vue,React,ElementUI",1.8-2.1万,前端开发工程师 （base 深圳）岗位职责：1、参与互联网业务的web/app前端的开发工作，包括需求沟通、功能设计与开发等2、参与前端业务的体验、性能提升，持续改进前端应用架构3、参与前端业务的线上维护，问题排查和修复任职要求： 1、3年以上的前端开发工作经验，计算机相关专业2、熟练掌握前端开发技术和主流前端框架，掌握移动端UI开发原理，了解跨端框架技术3、能确保基本的体验和性能4、具备良好的沟...,计算机软件,http://jobs.zhaopin.com/CC631548230J40866625312.htm,20-99人,2026-01-07 09:12:03
前端开发工程师,深圳,深圳市睿服科技有限公司,本科,5-10年,"Web前端,移动端,前端架构",1.5-2.1万,5年以上前端开发经验 有扎实的JavaScript、CSS、HTML基础，熟练使用 ES6 熟悉 React/Vue 等主流前端框架 了解 webpack 前端构建工具和 web 性能优化 有责任心，良好的沟通能力 有 React Native 开发经验者优先 职位福利：五险一金、交通补助、加班补助、带薪年假、节日福利,IT服务,http://jobs.zhaopin.com/CC603465980J40094343409.htm,1000-9999人,2025-03-18 18:02:32
软件测试/软件开发（C/C++、Java、Scala、Python、go，JS/前端/测试等）,深圳,外企德科数字技术有限公司,本科,经验不限,C/C++,1.2-2万·14薪,岗位职责：1、负责软件开发工作。2、负责管理自身项目和需求的优先级、按时高质量交付；根据工作安排高效、高质地完成代码编写，确保符合规范的前端代码规范。3、对应用最终效果负责，最终实现极致软件体验。岗位要求：1、大学本科及以上学历。2、熟练掌握C/C++、Java、Scala、Python、go，JS 等开发语言一种或多种3、强烈的责任心、良好的沟通、推动能力和服务意识。4、较强的沟通表达能力和推动...,专业技术服务,http://jobs.zhaopin.com/CCL1480117890J40836993705.htm,10000人以上,2026-01-11 00:27:04
前端H5开发,深圳,广州一滴水企业管理服务有限公司,高中,经验不限,大屏/可视化项目,1.8-2万,招聘HTML5工程师负责Web应用的开发和优化要求精通HTML5、CSS3和JavaScript有3年以上相关工作经验注重代码质量和用户体验善于沟通和团队协作对新的Web技术有持续的学习热情,人力资源服务,http://jobs.zhaopin.com/CCL1511076520J40977236704.htm,100-299人,2026-01-09 01:10:29
前端开发 react,深圳,深圳市法本信息技术股份有限公司,大专,3-5年,"电商项目,TypeScript,React,Node.js",1.5-2万,1、负责公司自研发产品的前端开发迭代;2、高效高质按期交付需求并具备自测意识和能力;3、在理解业务的前提下，合理地做出解决方案相关工作;4、能够根据项目或者需求目标理解用户场景，合理地安排开发计划，并持续跟进执行进度;5、积极面对需求开发中的问题，提供合理化建议并推动问题解决。任职要求 1、3年以上的前端开发工作经验，计算机软件相关专业优先;2、熟悉Git工作流，具备良好的代码规范和调试能力;3、...,计算机软件,http://jobs.zhaopin.com/CC385622410J40746163606.htm,1000-9999人,2026-01-08 10:46:09
全国均有岗位(开发/测试/前端/算法/运维),深圳,外企德科数字技术有限公司,本科,经验不限,"双休,周六上班双倍工资,试用期薪资全额发",1-2万·14薪,华为OD招聘【招聘岗位】开发（不限编程语言）、测试、前端、算法-、数开、运维等工程师岗位，全国均可安排；【岗位要求】1. 统全本科及以上学历均可，可接受应届、考研断档、 0 经验；2. 掌握任意一种 或多种 编程语言，能通过机考和技术面试即可；【福利待遇】1、5天8小时，双休制，偶尔加班（根据项目进度来定）；2、全额五险一金++周末加班2倍工资（周末加班不强制，看个人意愿）+年终奖(由部门/个人绩...,专业技术服务,http://jobs.zhaopin.com/CCL1480117890J40819727405.htm,10000人以上,2026-01-11 00:25:55
工程师H5html5初级,深圳,广州一滴水企业管理服务有限公司,中专/中技,经验不限,电商项目,1.8-2万·13薪,岗位内容：1. 开发基于HTML5技术的Web应用程序。2. 解决跨浏览器兼容性问题，确保产品能够在各种不同的设备上运行顺畅。3. 实现动态页面效果和交互功能，提高用户体验。任职要求：1. 熟悉HTML5标准，具有相关开发经验。2. 熟练掌握JavaScript、CSS等前端开发技术，并具备良好的编码习惯。3. 熟悉Web开发中的常用设计模式和架构，如MVVM、MVC等。,人力资源服务,http://jobs.zhaopin.com/CCL1511076520J40977232904.htm,100-299人,2026-01-09 01:10:29
前端工程师,深圳,蕾奥规划,本科,3-5年,"Vue,GIS/地图项目,CSS,JavaScript,HTML5",1.5-2万,岗位职责：负责空间数据计算平台、智慧规建平台、空间资产管理平台、产业大脑、大模型应用等开发工作。 任职要求： 1、本科及以上学历，计算机、地理信息科学等相关专业，3年以上前端开发经验。 2、精通 Vue3 核心原理与生态，熟练使用 Pinia 进行状态管理，能够基于 Wind UI 快速构建高质量业务组件。 3、精通 HTML5/CSS3/JavaScript 原生语法，熟悉 ES6+ 新特性，掌...,专业技术服务,http://jobs.zhaopin.com/CC547527880J40821028607.htm,500-999人,2026-01-06 11:00:09
C++/Java/C/python/前端/后端开发/测试,深圳,外企德科数字技术有限公司,本科,经验不限,"C语言,Java,Python,C++,双休+六险一金",1-2万·14薪,"岗位要求：1：熟悉C++/Java/C/python编程语言的一种；2: 有较好的编程习惯；3: 1年以上开发经验，优秀者可接受25届，具备团队协作能力；薪资待遇：基本薪资（10000-30000）+绩效+年终奖（14薪）加班双倍工资， 其他福利:六险一金，周末双休，下午茶，夜宵,班车",专业技术服务,http://jobs.zhaopin.com/CCL1480117890J40798371305.htm,10000人以上,2026-01-11 00:24:49
Electron 桌面客户端工程师,深圳,深圳市一泓微电子有限公司,本科,3-5年,"React,Vue,Node.js,CSS,JavaScript,HTML5,大屏/可视化项目,直播视频项目,Electron",1.2-2万,岗位职责本岗位是桌面客户端核心工程角色，负责 Electron桌面应用与公司原生能力的产品化集成，不要求编写底层算法，但需要理解接口。1、负责 Electron 桌面应用（Windows / macOS） 的架构设计与开发；2、基于 React / Vue + TypeScript 实现核心 UI，包括：主界面 / 桌面工作台状态面板功能控制界面3、对接并集成公司内部提供的后端原生插件本地服务进程...,电子设备制造,http://jobs.zhaopin.com/CC680044330J40862913312.htm,20-99人,2026-01-05 21:11:21
web前端工程师,深圳,音王电声股份有限公司,本科,3-5年,"Vue,React,音视频相关工作经验",1.5-2万,1.熟练掌握Vue、React前端开发框架，能够熟练的进行组件化开发2.能够熟练掌握canvas常用API，并进行图形绘制3.良好的问题分析和解决能力，能够快速定位并解决技术问题4.具有良好的团队协作精神和沟通能力，能够与同事通力合作完成工作任务对主流浏览器性能提升有一定的经验，针对高消耗性能的页面能够极致降低1.学历要求：本科及以上学历，计算机类相关专业。项目要求：对组件开发有丰富经验，能够阅读...,电子/半导体/集成电路,http://jobs.zhaopin.com/CC436632810J40904955008.htm,1000-9999人,2026-01-04 09:38:06
0282B1-前端开发工程师,深圳,中国平安人寿保险股份有限公司,本科,1-3年,,面议,工作职责要求：1.负责基于Vue.js + Android 原生 WebView + JSBridge 为核心技术栈，构建统一、稳定、高性能的跨端开发平台，支撑寿险网格渠道专员展业系统全链路稳定运营。2.设计并实现 模块化、组件化、可插拔的 Hybrid 框架体系，支持动态加载、热更新、灰度发布，满足金融类系统对高可用性、安全性与可运维性的严苛要求。3.参与业务需求分析，协助技术评审与方案选型，从...,保险,http://jobs.zhaopin.com/CC171014420J40744849006.htm,10000人以上,2025-12-31 17:34:05
全栈工程师（偏前端 + Electron）,深圳,深圳市一泓微电子有限公司,本科,经验不限,"前端开发,Electron,桌面客户端",1.2-2万,岗位职责对接原生能力插件 / SDK / 服务进程，负责 Electron UI 与桌面应用架构：1、负责 Electron 桌面应用（Windows / macOS） 的架构设计与开发；2、基于 React / Vue + TypeScript 实现核心 UI：主界面 、状态面板、功能控制界面3、对接并集成公司内部提供的原生能力插件 / SDK / 本地服务进程，包括：无线音视频相关、USB H...,电子设备制造,http://jobs.zhaopin.com/CC680044330J40862077512.htm,20-99人,2026-01-04 23:16:14
深圳高级前端开发工程师（线上面试）,深圳,深圳市法本信息技术股份有限公司,大专,5-10年,"自动化任务平台,资源管理,AI,Vue,JavaScript,TypeScript,git,React",1.5-2万,1. 高级前端工程师有自动化任务平台，AI方向，资源管理方向等经验优先岗位职责：1.负责公司核心、复杂业务产品的前端架构设计、技术选型和开发工作。2.主导复杂组件和公共模块的开发，构建高复用、可维护的前端技术体系。3.深入理解业务，将业务需求转化为合理的技术方案，并能主导技术方案的落地。4.优化前端性能，解决各种浏览器兼容性和安全性问题，保障用户体验。5.指导和培养中级及初级工程师，进行代码审查，...,计算机软件,http://jobs.zhaopin.com/CC385622410J40743738306.htm,1000-9999人,2025-12-25 16:04:54
WEB开发工程师,深圳,科士达,本科,3-5年,"大屏/可视化项目,官网开发项目,HTML5,JavaScript,SEO",1.2-2万·14薪,岗位职责:1、官网建设与维护：负责公司官网的前端与后端开发，确保网站功能完善、性能优异且用户体验良好。设计和实施响应式网站，确保其在各种设备上均能正常显示和运行。定期更新网站内容，修复漏洞，优化网站速度，确保网站安全性和稳定性。2、海内外SEO优化：制定并执行针对海内外市场（如欧美、东南亚等）的SEO策略，提升公司官网在Google、Bing等国际搜索引擎中的排名。进行关键词研究、竞争分析，优化网...,电子/半导体/集成电路,http://jobs.zhaopin.com/CC120731350J40816830211.htm,1000-9999人,2025-12-24 16:27:03
前端开发工程师,深圳,深圳市工匠行科技有限公司,本科,3-5年,"JavaScript,CSS,Vue,Redux",1.5-2万,【岗位职责】1. 根据产品需求，负责前端界面设计和开发工作，实现产品页面交互；2. 与后端开发紧密配合，确保系统功能的实现，独立撰写前端接口文档；3. 负责公司核心产品或业务平台的前端开发、维护及迭代工作，基于 Vue.js 技术栈，高质量完成产品需求的开发与交付；4. 持续优化前端交互体验，并保持良好的兼容性，提高界面的易用度。 对产品交互和视觉有自己的见解，能够从前端和用户角度出发，主动提出优...,人工智能,http://jobs.zhaopin.com/CCL1501449320J40820877909.htm,20-99人,2025-12-19 13:32:20
高级前端开发工程师,深圳,南京鼐云科技股份有限公司,本科,5-10年,"运营商,HTML5,TypeScript,Vue,工程化与架构设计,强大的业务抽象能力,前端架构",1.8-2万,负责前端开发工作 岗位要求： 1、对交互和视觉设计有基本的素养和能力 2、注重代码质量，具有良好的代码风格、接口设计与程序架构设计能力； 3、业务理解能力强，具备良好的业务领域建模设计能力，能够较好的抽象业务需求 4、有框架开发经验、平台搭建经验 5、熟练掌握Vue框架开发体系，能够独立完成框架搭建、模块开发 6、熟悉TypeScript 7、熟悉elementUi、ViewDesign、Vant...,计算机软件,http://jobs.zhaopin.com/CC712063080J40909802615.htm,100-299人,2025-12-17 16:09:15
Web前端开发工程师,深圳,深圳市深鹏达电网科技有限公司,本科,3-5年,"HTML5,CSS",1-2万,岗位职责：1、负责公司平台前端开发工作；2、负责产品的web前端总体架构设计，规范、标准制定，研发等；3、负责B/S产品性能和代码优化的实施；4、与后端开发团队紧密配合，确保代码有效对接。岗位要求：1、计算机相关专业，本科及以上学历2、精通前端开发技术（HTML5、CSS3、JS、Ajax等），熟悉各种浏览器的兼容性调试技术；3、至少熟悉一门javascript框架，比如jquery、vuejs；...,电力/水利/热力/燃气,http://jobs.zhaopin.com/CC656513120J40815013501.htm,1000-9999人,2025-12-17 14:50:48
前端开发【TOP大厂外包-线上面试-尽快到岗】,深圳,深圳南区人瑞人力资源服务有限公司,大专,3-5年,"大屏/可视化项目,Vue,React,电商项目,存储、运维、监控、云计算等,C++ 和鸿蒙经验,C++、HARMONYOS,ANDROID、IOS,TypeScript,JavaScript,B端项目经验",1.5-2万,岗位职责：1. 参与大模型后台系统的前端研发工作，保障产品需求按时、高质量交付，助力业务目标达成；2. 参与大模型后台系统的架构设计与优化，打造高扩展性高可用性的架构，持续提升研发效率和代码可维护性；3. 根据大模型相关产品需求，开发和维护前端功能模块，确保良好的用户体验;岗位基本需求：1.有至少 3 年以上前端开发经验，B端业务开发经验，参与过高复杂度项目；2. 精通JS，熟练使用TS，熟悉W3...,企业服务,http://jobs.zhaopin.com/CCL1289361510J40810153301.htm,500-999人,2025-12-12 11:41:32
前端开发工程师（银行项目react）,深圳,中电金信软件有限公司,本科,3-5年,"金融项目,银行项目,证券项目,支付项目,React,Vue,HTML5",1.4-2万,1. 岗位名称：前端开发岗2. 岗位职责： 1）负责财富W+零售客户经理作业平台的前端开发工作； 2）重点参与RM小助的前端开发，支持月度业务排期迭代建设； 3）参与财富W+的微前端改造建设。 3.任职要求： （1）本科学历，理工科专业，计算机相关专业优先。 （2）具备3年以上前端开发工作经验，负责或参与过金融业、银行业的中大型项目，具备前端开发独立交付的能力。 （3）熟练掌握React前端开发框...,计算机软件,http://jobs.zhaopin.com/CC443657520J40736080809.htm,10000人以上,2025-12-11 23:51:29
前端开发工程师,深圳,海外商旅,大专,经验不限,"前端,IT,后端,Vue,React,Angular,WebGL,Echarts,Node.js,CSS,JavaScript,HTML5",1.3-2万,工作职责：1、负责公司产品或项目Web前端的研发，并配合后端的开发；2、根据UI设计和原型设计实现页面交互效果；3、基于VUE框架和HTML5/CSS3等开发经验参与项目研发和技术研究工作；4、负责小程序开发。任职条件：1、统招计算机本科及以上相关专业，5年以上前端开发工作经验；2、精通VUE开发框架；3、熟悉HTML5/CSS3，JavaScript，Ajax等Web开发技术；4、熟悉其他前端开...,旅游服务,http://jobs.zhaopin.com/CC321560080J40661519408.htm,20-99人,2025-12-11 00:34:21
产品前端销售经理,深圳,深圳市优越节能发展有限公司,本科,5-10年,"企业客户,政府客户",1-2万·13薪,一、岗位职责1. 客户开发与关系维护：聚焦电力电气行业目标客户，制定客户开发策略，通过市场调研、行业展会、客户拜访等方式挖掘潜在客户，建立并维护高质量客户资源库；定期与核心客户沟通，了解其业务需求、项目规划及合作痛点，打造长期稳定的战略合作伙伴关系。2. 产品销售与业绩达成：深度理解公司电力电气产品的技术优势、应用场景及市场定位，结合客户需求制定个性化销售方案；负责销售全流程推进，包括需求对接、方...,专业技术服务,http://jobs.zhaopin.com/CCL1504886780J40711075806.htm,20人以下,2025-12-04 16:41:47
web前端开发工程师（Angular/年终+餐补）,深圳,科锐尔人力资源服务(苏州)有限公司,本科,3-5年,"Angular,CSS,JavaScript,HTML5",1.5-2万,"1.4年以上前端开发经验，精通HTML5、(X)HTML、xml、Css、javascript开发和规划，有大型成功案例优先2.精通javascript语言核心技术DOM、BOM、Ajax、JSON;3熟练掌握各种前端技术javascript、Ajax、jquery等，熟悉Web/RIA开发模式,熟悉前端开发的主流框架，VUE/Angular/React/echarts;45.项目实际使用的就是A...",咨询服务,http://jobs.zhaopin.com/CC453635220J40859573703.htm,10000人以上,2025-11-28 09:41:50
前端开发工程师（ Vue3/Uni-app 方向）,深圳,星辰飞行(深圳)跨境电商有限公司,大专,经验不限,"Vue,ElementUI,HTML5,CSS",1.2-2万,岗位职责：1. 负责公司 PC Web 端、移动端 H5 及小程序产品的需求分析、技术方案设计和编码实现，确保高质量交付。2. 使用 Vue3 + Pinia + Element Plus 进行中后台管理系统及前端模块的开发，并封装高复用性业务组件。3. 基于 Uni-app 框架开发并维护跨端应用，处理多端兼容性问题，实现一致的用户体验。4. 持续优化前端应用性能，关注首屏加载速度、路由切换、资...,电子商务,http://jobs.zhaopin.com/CCL1493312070J40776692616.htm,20-99人,2025-11-27 10:48:19
React软件开发工程师,深圳,微特科技(山西)有限公司,本科,3-5年,CSS,1.5-2万,岗位职责：1. 负责公司产品的前端开发，使用React进行页面构建和功能实现。2. 参与项目需求分析与设计，提供技术方案，协助团队完成项目开发。3. 优化现有产品的性能和用户体验，持续提升产品品质。岗位要求：1. 熟悉React框架，有5年左右的React开发经验。2. 精通JavaScript、HTML5、CSS3等前端技术，了解Web开发相关标准。3. 对前端工程化和模块化开发有深入理解，熟练...,咨询服务,http://jobs.zhaopin.com/CCL1363521370J40809186401.htm,20-99人,2025-11-24 11:52:34
Web前端开发工程师,深圳,深圳市合力思科技有限公司,本科,1-3年,"HTML5,移动端,AngularJS,web前端,Vue,小程序",1-2万,职位描述1、熟悉HTML5特性，了解HTML5最新规范，能够熟练运用HTML5特性构建PC端和移动端页面；2、对业务有很强的领悟能力，能快速准确的将业务需求拆分；3、能够独立完成详细设计及编码、进行代码审查，编程风格良好；4、熟悉Web前端的性能优化技巧，了解浏览器兼容以及自适应布局；5、熟悉Vuejs等HTML5框架中的至少一种，有成熟的微信小程序项目经验者优先；6、熟练使用Vue3、TypeS...,计算机软件,http://jobs.zhaopin.com/CC577316120J40831649304.htm,20-99人,2025-11-19 13:38:51
