职位,城市,公司,学历,经验,技能,薪资,工作描述,行业,职位URL,公司规模,发布时间
高级算法专家（大模型方向）,深圳,牧原股份,硕士,5-10年,大模型算法,8-16万,岗位职责：负责集团行业大模型的建设与落地：1、主导业务需求分析与技术方案设计，规划行业大模型的整体技术架构与发展路线。2、负责构建行业大模型所需的数据体系，包括制定数据采集、清洗、标注规范，构建行业知识库（如文档库、向量库）。3、主导大模型的训练、微调（如SFT）、对齐优化（如RLHF/DPO）及性能评估全流程。4、推动大模型能力在具体业务场景（如智能问答、分析决策、内容生成）的应用集成与方案落地...,农/林/牧/渔,http://jobs.zhaopin.com/CC495147320J40820141311.htm,10000人以上,2026-01-10 10:16:03
网络大模 型研发专 家,深圳,某大型央企,博士,5-10年,大模型算法,6-10万,1.牵头跟踪和评估网络大模型及网络人工智能相关领域的最新进展与技术趋势，制定和实施网络大模型的战略规划。2.带领团队开展网络大模型及网络人工智能相关领域的技术研究与产品创新，包括不限于大模型的架构、训练推理、工程化落地等方向。3.带领团队推进大模型技术（语言大模型、时序大模型、多模态大模型等）在信息通信相关领域的落地应用，并解决落地过程中的技术难题。4.组建具有前瞻性思维和创新能力的团队，明确团队...,互联网,http://jobs.zhaopin.com/CCL1318355140J40756817303.htm,500-999人,2025-12-24 01:05:14
大疆--中/高级SLAM算法工程师（深圳）,深圳,天津尘时科技有限责任公司,硕士,5-10年,"机器视觉,智能驾驶,导航算法",5-10万·15薪,工作职责1. 研发基于视觉、LiDAR、GNSS等多传感器的GVIO、LGVIO等紧组合算法，并落地产品；2. 研发基于视觉、LiDAR等多传感器的SLAM建图与重定位算法，并落地产品；3. 研发基于视觉、LiDAR等多传感器的语义SLAM，并落地产品；4. 推进机器学习技术在无人机建图定位功能中的应用，比3DGS、MASt3R等。任职要求1. SLAM相关方向硕士或以上学历，在相关行业有4年以上...,IT服务,http://jobs.zhaopin.com/CCL1252029180J40842914713.htm,500-999人,2025-11-18 11:07:29
高级算法专家,深圳,牧原股份,硕士,5-10年,"深度学习,Caffe,TensorFlow,PyTorch,图像算法,机器视觉",6-12万,一、岗位职责1、核心算法研发 【1】主导机器学习/深度学习算法在业务场景的端到端落地（如边缘端视觉检测系统落地、集团大模型应用等）。 【2】设计高鲁棒性算法，解决数据稀疏、噪声等实际问题。【3】探索前沿技术（如大模型、多模态融合等）并推动业务适配，平衡创新性与工程成本。2、业务落地 【1】基于集团业务流程，梳理AI重点工作及对应实施落地方案 【2】构建通用算法部署落地方案，包括但不限于算力方案、数...,农/林/牧/渔,http://jobs.zhaopin.com/CC495147320J40815351811.htm,10000人以上,2025-12-18 10:35:30
日语AI培训讲师,深圳,深圳市璟润科技有限公司,大专,3-5年,"课程策划,项目实训,深度学习,搜索算法,推荐算法,语音算法,导航算法,日语N1,AI培训,课程教授,模式识别",300-500元/时,岗位内容：1. 负责人工智能课程的开发和讲授，帮助学员全面掌握人工智能领域的相关知识和技能。2. 定期更新和完善课程内容，提高课程实用性和针对性。3. 参与教材编写和课程改革等工作，提升教学质量。任职要求：1. 熟悉人工智能领域各类技术和算法，具备扎实的理论功底和实践能力。2. 具备较强的演讲和表达能力，能够将复杂的技术概念转化为易于理解的语言。3. 具备良好的团队合作和管理能力，能够有效组织和协...,货运/物流/仓储,http://jobs.zhaopin.com/CCL1488054090J40733674606.htm,20人以下,2025-12-30 01:17:02
高级广告算法工程师（广告推荐算法）,深圳,道一(天津)企业管理咨询有限公司,本科,5-10年,"Java,广告算法,推荐算法,TensorFlow,PyTorch,Hadoop,Python,C++",4-8万·13薪,工作职责1. 负责广告排序算法、oCPX 产品能力建设及流量效率挖掘与提升；2. 参与广告投放核心算法的研发与优化，包括 CTR/CVR 预估、RTA、流量预估等；3. 跟踪计算广告领域前沿技术，结合多模态学习（文本、图像、音视频等）优化广告推荐机制，挖掘用户兴趣与意图，提升广告推荐精准度；4. 通过数据驱动的方式持续迭代模型和策略，提升广告系统整体变现效率和用户体验。任职要求﻿1. 学历背景：计...,人力资源服务,http://jobs.zhaopin.com/CCL1447804550J40866794512.htm,100-299人,2026-01-09 01:34:31
高级算法专家,深圳,牧原股份,硕士,5-10年,"机器学习,深度学习,大模型算法,Python,C++",8-12万,岗位职责：1、核心算法研发【1】主导机器学习/深度学习算法在业务场景的端到端落地（如推荐系统、CV/NLP、时序预测、运筹优化等）。【2】设计高鲁棒性算法，解决数据稀疏（如冷启动）、噪声（如工业传感器数据）等实际问题。【3】探索前沿技术（如大模型蒸馏、多模态融合）并推动业务适配，平衡创新性与工程成本。2、系统工程化【1】构建高性能推理框架，优化算法在高并发/低延迟场景的表现（如实时风控、自动驾驶决...,农/林/牧/渔,http://jobs.zhaopin.com/CC495147320J40773283711.htm,10000人以上,2025-08-20 11:38:01
决策规划算法,深圳,武汉景行英才人力资源服务有限公司,硕士,3-5年,"C++,PyTorch",5-8万·14薪,岗位职责1.开发优化自动驾驶决策模型，模型训练与数据自动化挖掘标注；2.解决优化实车测试问题，支持主线研发与量产项目交付任务。3.与团队合作，集成和测试端到端模型在自动驾驶重卡中的表现；任职资格1.计算机、自动化、数学等相关专业，硕士及以上学历或有自动驾驶决策规划相关方面实际工作经验；2.良好的C++编程基础，代码习惯良好；3.对以下至少一个方面有实际经验：在端到端自动驾驶、强化学习、模仿学习、D...,咨询服务,http://jobs.zhaopin.com/CC692528030J40784561416.htm,10000人以上,2025-12-30 17:30:10
Agent 算法工程师（通用）,深圳,南方新华,本科,1-3年,"强化学习 ,大模型算法,GPT,自然语言处理,PyTorch,TensorFlow,Python,AGENT,多智能体",4-8万,职位描述1. 负责多智能体 vibe coding 产品 https://mgx.dev的效果优化工作，聚焦编程场景，全面提升 Agent 的网页开发能力，使 Agent 能根据用户一句话，产出生产级应用2. 通过多智能体架构的设计、开发、优化，提升 Agent 在规划、工具使用、指令遵循、需求理解、多 Agent 协同方面的能力；构建相关 benchmark 科学评估各方面性能3. 落地前沿技术...,人力资源服务,http://jobs.zhaopin.com/CC346219280J40815434011.htm,100-299人,2025-12-18 14:37:11
大模型算法工程师,深圳,牧原股份,硕士,3-5年,"深度学习,大模型算法,强化学习 ",4-8万,岗位职责：1、负责大模型（预训练、微调、对齐等）关键技术的研发、实现与调优，主导解决模型训练与推理中的性能瓶颈问题。2、参与或主导面向垂直领域的行业大模型从0到1的构建，包括技术方案设计、领域数据处理、模型训练及业务场景的集成落地。3、参与大模型技术栈与工具链的选型、搭建及优化，确保模型的高效、稳定部署，并支持相关产品的工程化实现。4、跟踪前沿技术动态，进行技术验证与储备；协助指导初级工程师，推动...,农/林/牧/渔,http://jobs.zhaopin.com/CC495147320J40820140911.htm,10000人以上,2026-01-10 10:11:13
电机控制算法工程师,深圳,厦门雅迅智联科技股份有限公司,硕士,3-5年,"FOC/SVPWM,嵌入式实现,参数标定,诊断保护,台架测试",5-8万,岗位职责：1.负责两轮电动车用永磁同步电机控制算法的设计、仿真与实现，包括FOC、弱磁控制等，确保电机动态响应、效率及平顺性达到最优。2.负责算法在嵌入式平台上的代码实现、优化与调试，完成参数整定，解决电机运行中的振动、噪声等实际问题。3.设计与开发电机控制相关的诊断与保护功能，如过流、过压、过热、缺相等，提升系统鲁棒性与安全性。4.搭建电机台架测试环境，与硬件、测试工程师协同完成算法性能的验证与...,物联网,http://jobs.zhaopin.com/CC138128960J40776401216.htm,1000-9999人,2025-11-26 10:24:04
AI视觉高级工程师-博士,深圳,恩斯迈电子（深圳）有限公司,博士,经验不限,,4-8万,职位描述1. 智能制造领域核心视觉算法优化和创新研究，包括但不限于：检测分类，分割，OCR等；2. 大规模深度学习/机器学习相关的核心算法研究，包括但不限于：网络结构设计、大规模分布式训练、持续学习、无/自/半监督学习、部署量化等；3. 针对智能制造领域的实际需求，进行算法设计、实现、迭代优化等工作，将算法功能交付下游团队；职位要求1. 博士学历，计算机相关专业毕业；2. 具有计算机视觉，机器学习...,计算机硬件,http://jobs.zhaopin.com/CC120200310J40583459408.htm,1000-9999人,2025-11-06 20:56:28
图像算法工程师--深圳 (MJ015096),深圳,牧原股份,本科,1-3年,"TensorFlow,PyTorch,Python,C++,Caffe",4-8万,岗位职责：1、负责基于深度学习的计算机视觉算法开发和优化，涉及到的领域包括但不限于：目标检测、目标跟踪、行为识别、图像分类、关键点检测等；2、优化模型和算法在数据集上的表现，持续提升产品的算法落地效果；3、负责常用工具库的封装，训练集、测试集的持续维护等；4、负责算法开发质量保障，提升团队的算法研发质量和效率。任职要求：1、本科及以上学历，计算机科学、应用数学、模式识别等相关专业，2年以上算法工作...,农/林/牧/渔,http://jobs.zhaopin.com/CC495147320J40677562611.htm,10000人以上,2026-01-10 09:59:01
大模型算法工程师（研发总监）,深圳,深圳市先创数字技术有限公司,硕士,5-10年,"大模型算法,深度学习,GPT,Transformer,导航算法,搜索/推荐算法,PyTorch,TensorFlow,Python,云原生云架构,大模型",4-8万,学历要求：计算机科学、人工智能或相关领域的硕士及以上学历，博士学历优先。工作经验：需要具备5年及以上的大模型研发或人工智能相关领域的工作经验，在大规模分布式训练、深度学习、NLP/NLU领域算法有丰富的经验和架构能力。专业技能：掌握业界领先大模型的基本原理和训练以及微调方法，如GPT系列、LLaMA、ChatGLM等的RLHF三阶段训练及LoRA微调等。熟练掌握TensorFlow、PyTorch...,计算机软件,http://jobs.zhaopin.com/CC130455220J40615624007.htm,100-299人,2025-06-27 13:55:24
无人车业务部-自动驾驶决策规划算法工程师,深圳,北京三快在线科技有限公司,本科,3-5年,,面议,美团自动配送以自研L4级自动驾驶软硬件技术为核心，与美团即时零售业务结合，形成满足公开道路、校园、社区、工业园区等室外全场景下的自动配送整体解决方案。美团无人车团队成立于2016年，团队成员来自于Waymo、Cruise、Pony.ai、泛亚等自动驾驶行业头部公司，自动驾驶技术团队博士占比高达30%，依靠视觉、激光等传感器，实时感知预测周围环境，通过高精地图定位和智能决策规划，保证自动配送车全场景...,互联网,http://jobs.zhaopin.com/CC383625320J40778606509.htm,10000人以上,2026-01-11 10:00:36
无人机算法专家-E8924F,深圳,京东集团,硕士,5-10年,"PX4,无人机,航空航天,飞控系统,C/C++",3.5-7万·16薪,工作内容： 职位描述 1、主导无人机飞控系统总体设计，定义导航、控制、传感等子系统的技术需求与接口规范。 2、统筹飞控软硬件架构，确保多模块（状态估计、路径规划等）高效协同，解决系统级兼容性问题。 3、推动技术攻关（如冗余设计、时延优化），跟踪AI飞控等趋势，主导系统联调测试与适航认证支持。 任职资格： 任职要求 1、本科及以上学历，控制科学、航空航天、自动化等相关专业。 2、5年以上飞控系统开发...,互联网,http://jobs.zhaopin.com/CC192921310J40785452509.htm,10000人以上,2026-01-11 00:24:02
AI研发工程师,深圳,某知名上市公司,硕士,3-5年,大模型算法,5-6.5万,1、参与AI项目的需求分析、设计和开发，确保项目按时完成并满足客户需求；2、深入研究机器学习、自然语言处理、大语言模型等领域的最新技术和方法，构建及训练模型；3、负责前沿技术研究和应用场景探索；4、负责撰写项目相关技术文档和研究报告；5、参与团队内部技术交流和分享，提高团队整体技术水平。6、 完成领导交办的其他工作。一、教育：计算机科学与技术、通信工程、人工智能、自动化、数学等理工科相关专业硕士研...,互联网,http://jobs.zhaopin.com/CCL1318355140J40788066803.htm,500-999人,2026-01-06 01:04:38
无人车业务部-自动驾驶场景重建算法工程师,深圳,北京三快在线科技有限公司,本科,1-3年,,面议,美团自动配送以自研L4级自动驾驶软硬件技术为核心，与美团即时零售业务结合，形成满足公开道路、校园、社区、工业园区等室外全场景下的自动配送整体解决方案。美团无人车团队成立于2016年，团队成员来自于Waymo、Cruise、Pony.ai、泛亚等自动驾驶行业头部公司，自动驾驶技术团队博士占比高达30%，依靠视觉、激光等传感器，实时感知预测周围环境，通过高精地图定位和智能决策规划，保证自动配送车全场景...,互联网,http://jobs.zhaopin.com/CC383625320J40816286209.htm,10000人以上,2026-01-11 08:46:51
软件和算法应用工程师（SLAM方向）,深圳,伟视登企业管理咨询(上海)有限公司,本科,3-5年,"机器人算法,导航算法,定位算法,导航定位,传感器融合,C#,C/C++,Python,智能机器人",4-6.5万,学历：本科及以上 年纪35岁以下base 地南京/深圳/北京工作职责1、负责基于双目相机、轮速计/编码器、IMU等多传感器融合的视觉SLAM算法的开发和优化；2、基于开源SLAM框架，在嵌入式平台上优化算法在室内不同场景下（例如若纹理、光照变化、暗光）的定位精度和效率。任职要求1、计算机视觉、自动化、数学等相关领域专业，本科及以上学历；2、具备良好的工程能力，熟练使用C++开发嵌入式Linux应用...,培训/辅导服务,http://jobs.zhaopin.com/CC598580720J40976338104.htm,20人以下,2025-12-25 13:58:48
无人机导航算法工程师,深圳,京东集团,本科,3-5年,"导航算法,自动驾驶,导航系统",3-6万·16薪,岗位职责：1.负责经典惯性/卫星组合导航算法，基于多旋翼/复合翼机型实施优化；2.研发多传感器融合导航算法（IMU/GPS/视觉/LiDAR），提升复杂环境定位精度，解决GPS拒止场景（如室内、隧道）的自主定位问题；3.集成算法至无人机飞控系统，优化嵌入式平台（ARM/FPGA）性能，完成实机测试与验证。岗位要求：1.本科及以上学历，导航制导、自动化、计算机、航空航天等相关专业。2.精通组合导航算...,互联网,http://jobs.zhaopin.com/CC192921310J40823521909.htm,10000人以上,2026-01-11 01:23:31
无人车业务部-高精地图算法工程师,深圳,北京三快在线科技有限公司,硕士,1-3年,,面议,美团自动配送以自研L4级自动驾驶软硬件技术为核心，与美团即时零售业务结合，形成满足公开道路、校园、社区、工业园区等室外全场景下的自动配送整体解决方案。美团无人车团队成立于2016年，团队成员来自于Waymo、Cruise、Pony.ai、泛亚等自动驾驶行业头部公司，自动驾驶技术团队博士占比高达30%，依靠视觉、激光等传感器，实时感知预测周围环境，通过高精地图定位和智能决策规划，保证自动配送车全场景...,互联网,http://jobs.zhaopin.com/CC383625320J40796873909.htm,10000人以上,2026-01-11 08:37:37
SLAM 算法开发工程师,深圳,伟视登企业管理咨询(上海)有限公司,硕士,3-5年,"导航算法,机器人算法,Python,C/C++,Shell,自动驾驶,智能机器人,导航系统,定位算法,模式识别,视觉SLAM算法开发",4-6.5万,工作职责1、负责基于激光/视觉SLAM算法开发和优化，提升算法鲁棒性、精度和效率；2、支持各类型机器人项目开发和量产，解决场景长尾问题。任职要求1、计算机科学、电子工程、数学相关专业，硕士学历，3年及以上工作经历；2、在SLAM算法开发方面具有丰富的经验，精通常用的SLAM算法框架和工具；3、熟悉经典深度学习算法（CNN/Transformer）及框架（PyTorch）4、熟练掌握C++/Pyth...,培训/辅导服务,http://jobs.zhaopin.com/CC598580720J40976303204.htm,20人以下,2025-12-25 11:53:46
无人机定位算法（视觉SLAM方向）,深圳,京东集团,本科,3-5年,SLAM,3-6万·16薪,岗位职责：1. 负责研发以视觉为主的多传感器的无人机融合定位算法（多Camera+IMU+GNSS等）；2. 负责传感器选型，研发校准算法、故障诊断与隔离算法和自动化测试系统；3. 负责算法在真实场景的部署，优化算法鲁棒性和实时性，实现产品化；4. 负责撰写技术文档，包括设计报告、分析报告、验证报告等，协助适航取证。岗位要求：1. 传感器融合方向硕士或以上学历，在相关行业工作经验，2年以上视觉融合...,互联网,http://jobs.zhaopin.com/CC192921310J40824000609.htm,10000人以上,2026-01-11 00:28:21
大模型算法专家-AI Agent,深圳,字节跳动,本科,3-5年,,3-6万,岗位职责：1、探索前沿的LLM、MLLM、StableDiffusion等在端侧的落地和应用；2、设计、调试并训练端侧某领域的大模型；3、负责相关领域的数据收集、清洗、送标、微调、效果评估工作；4、持续跟踪行业进展，提升团队在该领域的技术能力。任职要求：1、熟悉Transformers、大模型、Langchain等最新技术，有相关项目经验优先；2、熟悉PyTorch、TensorFlow等深度学习...,互联网,http://jobs.zhaopin.com/CC469217510J40676013301.htm,10000人以上,2026-01-09 18:19:56
算法工程师（大模型）,深圳,牧原股份,本科,5-10年,,3-6万,岗位职责： 1、承接集团大模型训练和应用相关需求，包括不限于chatbi，rag，ai agent，LLM微调等相关技术实现； 2、为集团业务需求构建相关业务的知识库及定制化自动问答功能的开发；3、负责搭建相关的rag&chatbi&agent平台； 4、负责搭建机器学习&大数据计算平台； 5、负责数据和业务的紧密集合。任职要求：1、本科及以上学历，计算机或数学相关专业，熟练掌握使用java或py...,农/林/牧/渔,http://jobs.zhaopin.com/CC495147320J40819790111.htm,10000人以上,2026-01-08 16:22:03
无人机定位算法工程师,深圳,京东集团,硕士,1-3年,SLAM,3-6万·16薪,工作职责：1. 负责研发以视觉为主的多传感器的无人机融合定位算法（多Camera+IMU+GNSS等）；2. 负责传感器选型，研发校准算法、故障诊断与隔离算法和自动化测试系统；3. 负责算法在真实场景的部署，优化算法鲁棒性和实时性，实现产品化；4. 负责撰写技术文档，包括设计报告、分析报告、验证报告等，协助适航取证。任职要求：1. 传感器融合方向硕士或以上学历，在相关行业工作经验，2年以上视觉融合...,互联网,http://jobs.zhaopin.com/CC192921310J40823522509.htm,10000人以上,2026-01-11 00:23:02
感知模型优化算法工程师（北上广深）,深圳,文远知行,硕士,经验不限,"图像算法,强化学习 ,大模型算法,智能驾驶,导航算法,自然语言处理,交通灯识别,红绿灯,障碍物识别",3-6万·15薪,关于公司文远知行成立于 2017 年，是全球领先的 L4 级自动驾驶科技公司，致力于“以无人驾驶改变人类出行”，已在全球超过 25 个城市开展自动驾驶研发、测试及运营，累积自动驾驶里程超1600万公里，应用场景覆盖智慧出行、智慧货运和智慧环卫，形成自动驾驶出租车、自动驾驶小巴、自动驾驶货运车、自动驾驶环卫车、高阶智能驾驶等五大产品矩阵，提供网约车、随需公交、同城货运、智能环卫、高阶智能驾驶解决方案...,人工智能,http://jobs.zhaopin.com/CC841207690J40821278307.htm,300-499人,2026-01-07 10:01:34
无人机制导控制算法工程师(A177987),深圳,深圳市塞防科技有限公司,本科,1-3年,"飞控算法,制导控制算法",3-6万·15薪,岗位职责：1.主导无人机制导算法开发，设计飞行控制策略（如姿态控制、轨迹跟踪）2.熟悉高机动目标的运动估计与预测算法；3.结合无人机动力学模型与场景需求，优化轨迹规划算法（如基于采样的运动规划、探索式规划），提升算法实时性与鲁棒性4.负责算法仿真与测试，优化飞控系统动态响应与稳定性5.参与飞控系统与硬件平台（瑞芯微3588、英伟达NX）的集成调试，解决复杂工况下的控制问题；6.制定飞控制导算法开发...,智能硬件,http://jobs.zhaopin.com/CCL1474860650J40865174412.htm,100-299人,2025-12-31 16:31:45
无人机算法工程师-B2026D,深圳,京东集团,学历不限,经验不限,"DSP,PX4,自动化,实飞测试,航空航天",3.5-6万·16薪,工作内容：职位描述1、设计无人机飞行控制算法（如PID、LQR），优化姿态、轨迹跟踪及抗扰动能力。2、将算法嵌入飞控系统，适配嵌入式平台（STM32/DSP），完成硬件闭环调试。3、搭建仿真环境（如Simulink/HIL）并主导实飞测试，迭代优化控制性能。任职资格：1、本科及以上学历，控制科学、自动化、航空航天等相关专业。2、精通控制理论及无人机动力学建模，熟练使用C/C++，有嵌入式开发经验。...,互联网,http://jobs.zhaopin.com/CC192921310J40785460709.htm,10000人以上,2026-01-11 00:13:02
感知算法工程师-- 机器学习/视觉算法（L4）,深圳,文远知行,硕士,经验不限,"机器学习,深度学习,图像算法,机器视觉,智能驾驶,通信算法,红绿灯,交通灯,交通手势",3-6万·15薪,关于公司文远知行成立于 2017 年，是全球领先的 L4 级自动驾驶科技公司，致力于“以无人驾驶改变人类出行”，已在全球超过 25 个城市开展自动驾驶研发、测试及运营，累积自动驾驶里程超1600万公里，应用场景覆盖智慧出行、智慧货运和智慧环卫，形成自动驾驶出租车、自动驾驶小巴、自动驾驶货运车、自动驾驶环卫车、高阶智能驾驶等五大产品矩阵，提供网约车、随需公交、同城货运、智能环卫、高阶智能驾驶解决方案...,人工智能,http://jobs.zhaopin.com/CC841207690J40821278107.htm,300-499人,2026-01-07 10:01:04
slam算法工程师,深圳,阜时科技有限公司,本科,1-3年,"导航算法,导航定位,滤波算法,卡尔曼滤波,粒子滤波,自动驾驶,导航系统,智能机器人,机器人算法",3-6万,岗位职责：1. 负责激光雷达算法开发，包括测距、校准、去噪等基础算法，以及膨胀、拉丝、鬼影处理等点云算法；2. 负责激光雷达应用端算法开发，例如SLAM算法；3. 负责对算法进行验证及接口适配，配合产品工程师实现产品落地；4. 负责编写算法技术文档。岗位要求：1. 985院校硕士研究生以上学历，数学、物理、微电子、电子信息、计算机等相关专业毕业；2. 至少熟练掌握一种数值仿真工具(matlab、p...,电子/半导体/集成电路,http://jobs.zhaopin.com/CC864217180J40803413209.htm,100-299人,2025-12-24 01:24:50
具身模型分布式训练师,深圳,合肥零次方机器人有限公司,本科,3-5年,,3-6万·14薪,职位概述 我们正在寻找一位资深具身模型分布式训练师，负责领导大规模具身智能模型的分布式训练工作。您将参与构建业界领先的机器人智能系统，推动具身智能技术的边界。 核心职责 1、技术研发与实现 设计并实施大规模具身模型的分布式训练架构，包括数据并行、模型并行、流水线并行等策略 开发和优化多机多卡环境下的训练框架，提升训练效率和系统稳定性 构建高效的分布式仿真环境，支持大规模并行数据收集和策略评估 实现...,人工智能,http://jobs.zhaopin.com/CCL1494131450J40851813503.htm,100-299人,2025-12-18 10:14:45
