职位,城市,公司,学历,经验,技能,薪资,工作描述,行业,职位URL,公司规模,发布时间
驻场大模型工程师,深圳,北京可利邦信息技术股份有限公司,本科,5-10年,"大模型算法,阿里百炼,PAI",3-5万,PS：驻场佛山，工作地点在佛山。职位描述：1、为企业级客户AI智算大模型项目，提供服务支撑，包括但不限于工程方案设计、模型训练与调优、模型效果评估、code review、模型部署与运维、Prompt工程等工作；2、负责 PAI、PAI灵骏以及百炼等大模型训练平台的企业级客户技术支持，对接云上客户的多元化场景问题，聚焦大模型训练、部署环境、推理效率以及定制化链路集成等技术深度，负责疑难问题的快速定...,互联网,http://jobs.zhaopin.com/CC378282510J40825330410.htm,100-299人,2025-12-11 16:34:45
软件算法工程师,深圳,广州耐普新能源有限公司,硕士,1-3年,"C++,储能,逆变器,仿真软件",3-5万·13薪,【岗位要求】1、协同团队完成级联型储能算法的编程、调试与测试工作，参与软件算法需求调研与制定，保障算法的可行性与落地性；2、独立负责储能 BMS 核心算法开发，涵盖电池状态估算、均衡控制、保护策略等关键模块，优化电池使用效率与安全性；3、主导上位机通信算法开发，适配 I2C、SPI、UART、CAN、RS485、Ethernet 等常用通讯总线协议，确保设备与上位机的稳定高效通信；4、与硬件、机构...,新能源,http://jobs.zhaopin.com/CCL1413788340J40857259712.htm,1000-9999人,2025-12-08 15:28:06
算法开发工程师（OCR）,深圳,欣旺达电子,硕士,经验不限,"深度学习,机器学习,图像算法,自然语言处理,PyTorch",2.5-5万,岗位职责：1、算法研发：负责文本检测（如CTPN算法、文字识别、版面分析等核心算法的开发与优化，需结合深度学习框架（如PyTorch、TensorFlow）实现模型训练与部署；2、技术落地：将算法集成到实际业务场景（如证件识别、文档自动化处理），解决图像预处理、去噪、矫正等工程问题；3、前沿跟踪：持续跟进OCR领域最新技术（如大模型时序数据预测，推动算法性能提升。技能要求：1、本科及以上学历；计算...,电子/半导体/集成电路,http://jobs.zhaopin.com/CC135947830J40814679611.htm,1000-9999人,2025-12-15 18:52:05
AI for Science 算法工程师,深圳,深圳市中科探云智能科技有限公司,博士,经验不限,"大模型算法,多模态算法,搜索/推荐算法,Python,C++,PyTorch,C#,图像算法,知识图谱,通信算法",4-5万,岗位职责： 1、负责人工智能与生物等基础科学结合领域的算法开发、代码编写和文档撰写； 2、参与技术落地的应用开发与部署； 3、跟进 “AI + 基础科学” 前沿进展，验证技术并出具分析报告； 4、协助完成项目相关的算法调试、测试等工作。 岗位要求： 1、博士及以上学历，仪器设备应用、仪器科学与技术、法学、知识产权专业。 2、扎实掌握深度学习算法基础，熟悉 C++、Python 等编程语言及 PyT...,人工智能,http://jobs.zhaopin.com/CCL1495130400J40825804210.htm,20-99人,2025-12-06 00:00:03
感知算法工程师,深圳,劢微机器人科技(深圳)有限公司,硕士,1-3年,"机器人,C++,Python,深度学习",2.5-5万,岗位职责：1、负责机器人车载感知算法开发与工程化部署，实现机器人在室内或室外环境中的感知能力;任职要求：2、必备C++工程能力，有linux使用经验，熟悉ros，了解python;3、熟悉深度学习，熟悉目标检测、目标跟踪、语义分割等常用算法；4、熟悉图像处理与点云处理；会使用Opencv、pcl等基础库。优先考虑：1、数学基础扎实。2、有无人叉车或AGV机器人同行业工作经验优先；3、发表过CVPR...,人工智能,http://jobs.zhaopin.com/CC871508020J40247166504.htm,100-299人,2025-12-05 14:44:53
机器人研究员,深圳,玉禾田集团,本科,5-10年,"人形机器人,服务机器人,移动机器人,工业机器人",2.5-5万,岗位职责1. 研究与开发人工智能、机器人及相关软硬件技术，推动技术在实际场景中的应用。2. 跟踪全球机器人、智能硬件、大数据、区块链等领域的技术趋势，提出创新解决方案。3. 主导或深度参与工程项目，从技术论证到落地实现，确保项目的技术可行性与工程质量。4. 协同产品、工程团队，参与产品规划与系统架构设计，推动技术向产品转化。5. 持续学习并快速掌握新兴技术，为团队提供技术洞察与前瞻性建议。任职要求...,环保,http://jobs.zhaopin.com/CC343277810J40846999113.htm,10000人以上,2025-12-03 17:44:08
飞控算法工程师（无人机）(A178772),深圳,深圳市塞防科技有限公司,硕士,经验不限,"无人机飞控系统,无人机控制算法",2.5-5万·15薪,职位描述：1.主导无人机制导算法开发，设计飞行控制策略（如姿态控制、轨迹跟踪）2.熟悉高机动目标的运动估计与预测算法；3.结合无人机动力学模型与场景需求，优化轨迹规划算法（如基于采样的运动规划、探索式规划），提升算法实时性与鲁棒性4.负责算法仿真与测试，优化飞控系统动态响应与稳定性5.参与飞控系统与硬件平台（瑞芯微3588、英伟达NX）的集成调试，解决复杂工况下的控制问题；6.制定飞控制导算法开发...,智能硬件,http://jobs.zhaopin.com/CCL1474860650J40824388312.htm,100-299人,2025-12-03 11:14:47
控制算法工程师,深圳,劢微机器人科技(深圳)有限公司,硕士,1-3年,"控制算法,运动控制,C++,机器人,MATLAB",2.5-5万,岗位职责：1、 负责单舵轮、双舵轮、差分轮、AMR的轨迹跟踪控制算法开发与维护; 2、建立各种工业无人车辆的正/逆运动学模型构建; 3、车辆运动控制离线仿真系统开发； 4、车辆控制参数自学习算法开发。 任职要求： 1、熟练使用C++，熟悉机器人操作系统ROS优先； 2、 有机器人控制算法开发经验，熟悉经典PID控制及其变种，熟悉现代控制理论； 3、硕士及以上学历，数学功底良好。 4、有基于MATL...,人工智能,http://jobs.zhaopin.com/CC871508020J40243119104.htm,100-299人,2025-12-05 14:34:43
AI模型工程师,深圳,卡莱特云科技股份有限公司,本科,经验不限,"强化学习 ,大模型算法,多模态算法,C语言,Python,机器视觉,自然语言处理,搜索/推荐算法,TensorFlow,PyTorch",2.5-5万·16薪,工作职责1.模型训练与微调落地：负责 CV/NLP/ 多模态等 AI 模型(边缘/端侧)的训练、微调与迭代优化，针对广告显示、教育、工业、安防监控等边缘场景需求，定制模型效果优化方案，保障模型精度与业务指标达标。2.推理全流程优化：基于RK3588或同类边缘芯片的 NPU 算力特性，设计模型轻量化与推理适配方案，通过量化、剪枝、稀疏化等技术实现模型压缩，提升推理性能。3.软硬件协同优化：深入理解边...,电子/半导体/集成电路,http://jobs.zhaopin.com/CC462571410J40809613511.htm,1000-9999人,2025-11-26 17:27:40
视觉目标检测算法工程师（无人机）,深圳,深圳市塞防科技有限公司,本科,3-5年,,3-5万·15薪,岗位职责：1.针对发反无业务场景，设计和实现多传感器融合感知、多目标跟踪、多传感器标定、目标存在置信度估计等方案；2.负责雷达、视觉、无线电频谱侦测、协议解析等多个不同传感器的数据融合，实现多目标长时序下稳定跟踪算法开发、维护和项目问题解决；3.负责多传感器观测数据的时间同步和传感器标定；4.负责多传感器融合中目标类别融合估计、目标存在置信度估计等。任职要求：1.硕士及以上学历，计算机、电子信息类...,智能硬件,http://jobs.zhaopin.com/CCL1474860650J40804016312.htm,100-299人,2025-12-03 11:14:28
高级嵌入式软件工程师（算法移植）,深圳,智洋创新科技股份有限公司,本科,3-5年,,3-5万,职责：1、核心算法移植：负责将已在其他平台（如ARM/x86/GPU/PC）上验证的算法，高效地移植到目标ARM嵌入式平台。2、性能极致优化：对移植后的算法进行深度性能优化，包括但不限于计算速度、内存占用、功耗 等关键指标，确保其在资源受限环境下稳定运行。3、协同调试与集成：与算法研发团队紧密协作，理解算法原理，解决移植过程中的精度和性能问题；与底层驱动工程师协作，完成系统集成与联调。4、负责无人...,人工智能,http://jobs.zhaopin.com/CC324628210J40966284504.htm,500-999人,2025-11-26 00:04:01
ai大模型算法工程师,深圳,灵宝黄金,本科,3-5年,,3.5-5万,岗位职责：1.基于场景，能够应用AI模型结合工具设计一个解决方案2.基于主流的训练和部署框架进行模型的微调，以及部署模型3.对现有的数据进行清洗，确保模型训练质量4.进行agent的开发，实现产品功能岗位要求：1.统招本科及以上学历，计算机相关专业背景；熟练使用python语言，以及 pytorch， tensorflow，sklearn等AI开发仓库2.熟悉各种深度学习人工智能框架以及背后原理，...,矿产/采掘,http://jobs.zhaopin.com/CCL1214984790J40900729108.htm,1000-9999人,2025-11-24 11:04:41
无人机制导控制算法工程师(A177987),深圳,深圳市塞防科技有限公司,本科,1-3年,"飞控算法,制导控制算法",2.5-5万·15薪,岗位职责：1.主导无人机制导算法开发，设计飞行控制策略（如姿态控制、轨迹跟踪）2.熟悉高机动目标的运动估计与预测算法；3.结合无人机动力学模型与场景需求，优化轨迹规划算法（如基于采样的运动规划、探索式规划），提升算法实时性与鲁棒性4.负责算法仿真与测试，优化飞控系统动态响应与稳定性5.参与飞控系统与硬件平台（瑞芯微3588、英伟达NX）的集成调试，解决复杂工况下的控制问题；6.制定飞控制导算法开发...,智能硬件,http://jobs.zhaopin.com/CCL1474860650J40806445812.htm,100-299人,2025-11-19 14:50:59
灵巧操作算法工程师（具身智能方向）,深圳,智联猎头,硕士,经验不限,"机器人算法,运动控制算法,PyTorch,TensorFlow,Caffe,OpenCV,DNN,CNN,C/C++,Python",2.5-5万,岗位职责1. 灵巧操作算法研发：◦ 负责灵巧手/机械臂的抓取规划、操作控制、手眼协同等核心算法研发，包括但不限于：基于模仿学习（如ACT、Diffusion Policy）、强化学习（如SAC、PPO）的操作技能学习，基于视觉-力觉融合的精准操作，以及复杂场景（如柔性物体、小物体、动态环境）的泛化操作。◦ 设计并优化操作任务库（如装配、搬运、分拣、精密操作），支持多场景（工业制造、服务）的应用需求...,互联网,http://jobs.zhaopin.com/CCL1318355140J40857284403.htm,10000人以上,2025-11-19 09:36:46
电机控制算法工程师,深圳,大族数控,本科,5-10年,,3-5万,1、负责电机控制、滤波器、状态观测器、系统参数辨识等核心算法建模-仿真-嵌入式落地；2、负责前瞻Look-ahead，微小线段连续插补、自适应速度规划、振动抑制、轨迹规划等核心算法建模-仿真-嵌入式落地；3、与软件/硬件/团队成员协同合作解决项目研发的技术问题；4、编写高质量技术文档，包括算法设计文档、控制策略说明、测试报告与设计规范等，保障项目技术可追溯性与知识传承；5、持续跟踪运动控制领域的前...,电气机械/电力设备,http://jobs.zhaopin.com/CC334402310J40851011302.htm,1000-9999人,2025-11-03 15:33:33
雷达信号处理算法工程师,深圳,深圳市塞防科技有限公司,本科,3-5年,"导航算法,信号处理,目标检查,目标跟踪,C语言,毫米波雷达",2.5-5万·15薪,岗位描述：1.负责雷达系统算法设计与开发，完成算法仿真、验证及性能评估；2.负责与软硬件工程师协调，指导完成算法移植、问题分析、算法优化；3.配合完成系统集成、联调联试、外场试验以及技术支持工作，分析并解决项目开发中出现的信号处理相关问题；4.负责相关算法知识产权工作，撰写相关设计文档岗位要求：1.电子工程、通信、信号处理、自动化等相关专业方向，硕士及以上学历；2.精通信号处理的基本理论和算法，包...,智能硬件,http://jobs.zhaopin.com/CCL1474860650J40559585812.htm,100-299人,2025-11-19 14:50:53
AI模型工程师(J10188),深圳,卡莱特云科技股份有限公司,本科,1-3年,"强化学习 ,大模型算法,PyTorch,C++,TensorFlow,自然语言处理,搜索/推荐算法,机器视觉,C语言,Python,多模态算法",2.5-5万·16薪,岗位职责:1.模型训练与微调落地：负责 CV/NLP/ 多模态等 AI 模型(边缘/端侧)的训练、微调与迭代优化，针对广告显示、教育、工业、安防监控等边缘场景需求，定制模型效果优化方案，保障模型精度与业务指标达标。2.推理全流程优化：基于RK3588或同类边缘芯片的 NPU 算力特性，设计模型轻量化与推理适配方案，通过量化、剪枝、稀疏化等技术实现模型压缩，提升推理性能。3.软硬件协同优化：深入理解...,电子/半导体/集成电路,http://jobs.zhaopin.com/CC462571410J40797725911.htm,1000-9999人,2025-10-23 16:38:12
EDA算法工程师,深圳,深圳市新凯来技术有限公司,本科,经验不限,"图像算法,C++,Python,EDA,优化算法",2.5-5万·15薪,岗位职责：1、负责EDA软件相关算法设计开发；2、设计和实现矢量图，位图等相关优化算法；3、设计和实现版图文件快速读写，图素操作，性能优化等相关算法；4、结合上游需求开发和实现软件新接口，参与需求收集、方案设计、功能实现。岗位要求：满足以下3-4条即可1、熟悉C、C++或Python中的一种或多种编程语言，熟悉数据结构和算法，并掌握Linux操作系统的基本操作。2、熟悉至少一种测试框架，如GTes...,电子/半导体/集成电路,http://jobs.zhaopin.com/CCL1362239030J40769478515.htm,1000-9999人,2025-10-22 12:13:51
运动控制算法工程师,深圳,丹阳合十智能科技有限公司,硕士,3-5年,"运动控制算法,运动规划,动力控制,CNN,C/C++,3D打印机,激光切割机",3-5万,核心职责1、负责整机运动控制算法架构设计；2、运控系统核心算法设计：包括多轴联动插补、样条轨迹规划、速度前瞻控制（Look-ahead）、动态误差补偿等；3、 专用算法设计：振镜协同控制、热变形实时补偿、非线性摩擦建模、轨迹拟合等;4、解决高速运动中的振动抑制（输入整形、陷波滤波）、多轴同步精度控制等工程难题；5、负责运控算法在嵌入式平台(ARM-cotex、MCU)上落地(在平台上的编译、调试以...,工业自动化,http://jobs.zhaopin.com/CCL1381570050J40843277902.htm,20-99人,2025-10-21 17:27:17
运动控制算法工程师,深圳,大族数控,硕士,5-10年,"运动控制算法,机器避障,运动规划,动力控制,C/C++",2.5-5万,岗位职责：1、负责精密运动控制系统的设计、开发和测试。包括但不限于运动控制算法、电机控制、传感器集成等；2、与跨职能团队合作，包括光机电设计、软件开发、产品管理等：3、参与系统级的性能评估和优化，确保系统满足性能和可靠性要求；4、编写技术文档，包括设计规范、测试报告、用户手册等：5、对新的技术趋势和行业标准保持关注，以便在项目中应用最新的技术和方法。任职要求：1、本科及以上学历（博士优先），电气工...,电气机械/电力设备,http://jobs.zhaopin.com/CC334402310J40775098702.htm,1000-9999人,2025-10-16 00:37:03
大语言模型方向科研人员,深圳,人工智能与数字经济广东省实验室(深圳),博士,经验不限,"PyTorch,文本分析,语义分析,文本分类,文本挖掘,AGENT,知识记忆,LLM,昇腾",2.6-5万·15薪,岗位职责:参与端侧大语言模型、大模型推理时计算研发工作，包括但不限于：1.研究端侧大语言模型针对端侧场景的重点能力增强，包括知识记忆和运用、逻辑与数理推理、指令理解与规划决策、代码和工具使用等方面的能力。2.开展复杂环境下端侧大模型轻量化知识迁移与持续学习研发工作。3.聚焦大模型推理的强化学习算法优化研发，基于预训练流程优化的模型推理能力增强，基于知识蒸馏的推理增强，任务难度自适应的推理研发。任职...,人工智能,http://jobs.zhaopin.com/CCL1392292510J40958083604.htm,20-99人,2025-10-12 13:41:43
嵌入式软件算法高级工程师（能源管理控制盒/工业物联网网关方向）,深圳,TCL实业控股股份有限公司,本科,5-10年,"光伏户储,海外项目经验,英语工作语言",3-5万·13薪,岗位职责：1.主导开发能源管理控制盒、备电盒的嵌入式固件，实现光伏、储能、电网、负载（包含充电桩和热泵）的能量流实时监控与控制策略（削峰填谷、自发自用、备电模式、经济性储热充电等），开发能源调度实时算法；2.负责嵌入式产品功能需求分析和设计工作，主导嵌入式智能屏应用程序开发，确保其⾼效运⾏和稳定性，优化产品的实时性能，确保系统在实时应用场景中的高效和可靠运行3.编写和维护优化相关的技术文档，包括详...,通用设备制造,http://jobs.zhaopin.com/CC830981590J40813953205.htm,10000人以上,2025-09-19 10:04:33
机器人运动控制算法工程师,深圳,四川天链机器人股份有限公司,硕士,3-5年,"视觉图像算法,运动规划,动力控制,路径规划,机器避障,PyTorch,卡尔曼滤波,C/C++,Python,Java",2.5-5万·13薪,岗位内容：1. 开发和实现机器人算法和控制策略。2. 设计和实验基于传感器反馈的运动控制算法。3. 与硬件/软件开发团队紧密协作，优化系统性能和稳定性。4. 研究机器人启发式规划、路径规划和调度算法。任职要求：1. 计算机科学、机械工程、应用数学或相关领域的博士学位。2. 3年以上算法设计和开发经验。3. 熟悉机器人运动学、动力学、传感器和控制技术。4. 精通各种语言编程和运控操作系统。,机器人,http://jobs.zhaopin.com/CC514394020J40712613110.htm,100-299人,2025-09-16 15:42:28
高级计算机视觉算法工程师（多模态大模型）,深圳,进迭时空(杭州)科技有限公司,本科,3-5年,机器人,2.5-5万,岗位职责1. 主导泛机器人的多模态融合算法设计，实现环境感知、交互控制等核心功能；2. 负责构建VLM/VLA体系能力，完成软件栈搭建；3. 开展跨模块沟通，主导相关智能功能系统方案的设计、研发与交付； 岗位要求1. 硕士及以上学历，具备计算机科学、信息工程、电子工程、机器人学等相关专业背景；2. 对深度学习、计算机图形学、计算机视觉等领域的有深入认识，并了解各个算法的条件和瓶颈；3. 有模型优化...,电子/半导体/集成电路,http://jobs.zhaopin.com/CCL1378359190J40778305607.htm,100-299人,2025-07-29 17:34:06
具身智能机器人算法工程师,深圳,深圳高新奇战略新兴产业园区管理有限公司,本科,3-5年,"导航算法,机器人算法,导航定位,路径规划",3.5-5万,岗位职责：1. 负责具身智能机器人算法的设计、开发与优化；2. 参与机器人系统的整体架构设计，确保算法的稳定性和效率；3. 与团队合作，共同解决技术难题，提升产品性能。任职要求：1. 对具身智能机器人领域有浓厚兴趣，有具身智能机器人算法实战经验；2. 掌握空中导航、路径规划、视觉识别等算法，能解决机器人研发算法问题；3. 具有创新思维，能够在算法和系统设计中提出新的想法和解决方案。上班时间：9:0...,互联网,http://jobs.zhaopin.com/CC535372920J40788079512.htm,20-99人,2025-07-07 09:27:47
控制算法工程师（机器人）G03487,深圳,深圳市雨禾伟业实业有限公司,硕士,1-3年,"导航算法,智能驾驶,运动控制",2.5-5万,职责1. 负责产品执行器性能摸底和验收，组织开展机器人动力学相关标定实验；2. 负责整机控制算法调试，包括控制方案设计、仿真验证、控制器参数整定等；3. 负责控制相关测试问题的修复以及控制性能的优化迭代；4. 负责新技术的预研和技术难点的攻关。要求1. 自动化、车辆工程、计算机、电子信息工程、机械工程等硕士及以上学历，具有1年以上的运动控制领域内的工程开发经验；2. 扎实的控制理论基础，熟悉掌握经...,玩具/礼品,http://jobs.zhaopin.com/CC320689630J40747811901.htm,1000-9999人,2025-06-20 18:07:40
精密运动控制工程师,深圳,深圳市新凯来技术有限公司,本科,3-5年,"机器人算法,运动控制算法,运动规划,动力控制,卡尔曼滤波",2.5-5万·15薪,岗位职责1、负责精密设备运动控制方案设计，基于系统规格需求及应用场景，快速完成运控架构设计、实现及应用；2、负责运动轨迹规划、系统辨识、扰动补偿与控制器参数整定，达成高实时、高精度的性能指标；3、利用时频域信号分析、处理和优化理论，结合多物理场优化设计方法，优化高速高精运动系统的各项性能指标。 岗位要求1、控制工程，控制科学，自动化，机电一体，机器人，电气自动化等相关专业；2、拥有3年以上相关研发...,电子/半导体/集成电路,http://jobs.zhaopin.com/CCL1362239030J40844380915.htm,1000-9999人,2025-05-14 15:55:33
UWB工程师（CPD方向/钥匙）,深圳,深圳市豪恩科技集团股份有限公司,本科,3-5年,"数字钥匙,CPD,呼吸检测",2.5-5万,需求岗位：算法、软件、硬件、天线、射频、系统等岗位岗位职责：1、负责UWB项目的CPD应用解决方案分析和设计，特别是应用层客户体验的算法优化，保证产品在各种环境下都能有稳定、可靠的优异性能；2、负责UWB项目CPD的应用/相关产品功能定义、输出需求设计文档；3、负责UWB项目Demo演示开发以及应用优化，提高响应速度和增强抗干扰能力；4、负责产品线团队的搭建及管理；5、针对客户项目提供算法方面的技...,电子设备制造,http://jobs.zhaopin.com/CC354764110J40737270412.htm,1000-9999人,2025-04-23 08:45:40
高级算法工程师（图像声呐/多波束方向）,深圳,云南保利天同水下装备科技有限公司,硕士,10年以上,信号处理,3-5万,一、算法工程师（图像声呐/多波束方向）职责描述：1、负责相控阵多波束声呐的算法研究，包括信号预处理、波束形成、波束数据处理；任职要求：1. 研究生及以上学历；2. 具有阵列信号处理相关专业知识，熟悉多种波束形成方法、匹配滤波算法、宽带信号处理方法等；3. 具备雷达或声呐阵列信号处理经验者优先；4. 对算法研究工作有兴趣，能够独立解决问题，具有良好的团队合作能力。常驻工作地点：昆明,专用设备制造,http://jobs.zhaopin.com/CCL1245768670J40216394808.htm,300-499人,2025-04-08 10:05:51
控制算法工程师,深圳,深圳市新凯来技术有限公司,本科,无经验,"机器学习,深度学习,图像算法,机器视觉,TensorFlow,PyTorch,Python,C++,控制算法",2.5-5万·14薪,岗位职责：1.面向产品化，负责控制系统架构设计和解决方案设计，负责控制算法的设计、开发和优化改进，负责控制系统功能定义与指标分解。岗位要求：1、计算机、统计、自动化、控制、电子、通信、应用数学等专业；2、掌握 python、matlab，能够使用仿真工具进行全链路仿真和数据分析；3、掌握图像处理算法和图像分析相关理论，了解基于机器学习或深度学习的算法开发；或者了解并掌握主流控制算法 PID/LQR...,电子/半导体/集成电路,http://jobs.zhaopin.com/CCL1362239030J40685097715.htm,1000-9999人,2025-05-12 15:10:42
推荐算法工程师,深圳,元征科技,本科,3-5年,"搜索引擎技术,算法基础,自然语言处理,深度学习算法,机器学习算法",3-5万,工作职责1、基于大数据、用户标签，制定推荐算法模型，为用户提供各种精准推荐和决策分析；2、负责公司智慧营销相关算法落地，根据历史数据和市场需求，制定动态价格算法，销售预测，收入利润预测等；3、与产品、运营等团队设计和制定算法策略，持续跟踪用户反馈，不断提高产品性能、用户体验和业务效果。任职资格1、计算机、人工智能或相关专业本科及以上学历； 2、具备优秀的编码能力，熟悉至少一种主流深度学习框架（te...,云计算/大数据,http://jobs.zhaopin.com/CC120341230J40761319905.htm,500-999人,2025-04-02 15:32:25
