职位,城市,公司,学历,经验,技能,薪资,工作描述,行业,职位URL,公司规模,发布时间
前端开发工程师,深圳,紫金支点,本科,5-10年,"CSS,Vue",1.5-2.5万,岗位要求：1、与业务需求部门进行沟通、需求分析与确认；2、负责应用前端相关需求开发及运维；3、负责应用前端公共组件抽离实现及配合业务部门测试；4、负责对变动代码规范检查及代码评审；5、完善相关项目技术文档、手册编制。任职要求1、全日制本科及以上学历，计算机相关专业2、熟悉JS、CSS3、HTML5语言，拥有扎实的前端技术，熟练掌握主流开发框架，如：Vue、ElementUI、echart、load...,计算机软件,http://jobs.zhaopin.com/CC134171900J40810244511.htm,1000-9999人,2025-12-31 00:47:21
前端开发高级工程师,深圳,中南国际科技发展(深圳)有限公司,本科,5-10年,"CSS,HTML5,Vue,React,Angular,Node.js",1.8-2.5万,【岗位描述】1. 五年以上前端工作经验，至少参加过一个完整中型前端项目开发；2. 掌握W3C规范，熟悉HTML4/HTML5、CSS2/CSS3、ES5/ES6等前端开发技术；3. 熟练掌握JS/CSS、浏览器原理、HTTP协议、网络安全等前端必要的基础知识；4. 能够独立进行前端页面代码开发及调试，能够充分理解设计需求并落地；5. 有React/Vue/Angular等类似MV*框架项目使用经验...,咨询服务,http://jobs.zhaopin.com/CC635829180J40834394705.htm,10000人以上,2025-12-22 13:54:13
Java/Python/C/C++/数开/测试/算法/前端岗,深圳,外企德科数字技术有限公司,本科,经验不限,"Python,JavaScript,C++,Spring,Hibernate,Struts,MySQL,PostgreSQL,Oracle",1.5-3万·14薪,Java/C/C++/Python/嵌入式/驱动开发/前端/测试/算法/数据开发等 均有岗位！不卡地域，不卡部门，面试成绩通用~ 地域：北京/上海/深圳/杭州/成都/西安/东莞/南京/武汉等地域，根据个人意愿选择； 亮点：年轻团队，核心业务，根据技术能力定级定薪无固定上限，入职即交五险一金，享有年终14-16薪，项目奖金等，享受带薪年假病假等福利，长期稳定晋升发展~ 能力要求： 1.熟悉Java/...,专业技术服务,http://jobs.zhaopin.com/CCL1480117890J40603123105.htm,10000人以上,2026-01-11 00:24:23
UI设计与前端工程师,深圳,深圳市联壹胜实业有限公司,大专,3-5年,AI,1.5-2.5万,岗位责任：1、负责Web、App、小程序等产品的UI设计，输出高保真视觉稿，制定设计规范（如色彩、字体、间距、组件库等），确保设计一致性；2、参与用户研究，分析用户需求，优化交互流程和视觉体验，与UX设计师、产品经理协作，提升产品的易用性和美观性；3、输出切图、标注文档，与开发团队高效对接，确保设计还原度；4、参与设计评审，根据反馈调整优化方案；5、品牌视觉设计（部分公司要求）：参与品牌VI设计，...,船舶/航空/航天/火车制造,http://jobs.zhaopin.com/CC874525950J40794267913.htm,100-299人,2025-12-22 09:56:19
安卓前端开发工程师,深圳,深圳市嘉诚天森科技有限公司,本科,3-5年,"Kotlin,安卓,前端,支付",2-2.5万,【职位概述】 1. 独立负责公司 Android 客户端的开发、维护与持续优化； 2. 推动产品技术方案选型与架构演进，参与核心功能的预研与实现； 3. 和产品、设计、测试、数据等多团队协作，保障交付质量与效率； 4. 持续关注 Android 前沿技术，推动技术革新和团队能力提升； 5. 参与高 DAU 应用的性能调优与稳定性保障，打造极致用户体验 【任职要求】 1. 本科及以上学历，计算机相关...,信托,http://jobs.zhaopin.com/CCL1248600680J40906531008.htm,20-99人,2025-12-17 00:00:02
前端开发/后端开发/全栈工程师,深圳,外企德科数字技术有限公司,本科,经验不限,"Python,Java,C,前端开发,后端开发,软件测试,MySQL",1.4-2.8万·15薪,岗位要求：1、扎实的编程能力，熟悉算法和数据结构；熟悉计算机的基础理论；2、熟练使用java/c/c++/python/js其中一种语言，掌握Spring相关生态开源框架，熟悉MySql、MQ、Redis、SpringCloud等，熟悉事务、缓存、消息、负载均衡等；3、熟悉Linux开发环境；4、具有大规模高并发云服务设计和开发经验优先；5、有微服务、容器相关开发经验优先。任职要求：1、扎实的编程...,专业技术服务,http://jobs.zhaopin.com/CCL1480117890J40832211105.htm,10000人以上,2026-01-11 00:26:44
前端开发工程师 （vue ts）,深圳,苏州人瑞普惠人力资源服务有限公司,本科,3-5年,"ES6,TypeScript,Node.js,Vue,HTML5",1.5-2.5万,岗位职责：1、负责分析、设计、搭建系统应用的前端架构；2、负责核心架构的技术选型、组件与服务的设计、核心代码的编写；3、从架构设计上保障应用交互流畅、高性能、高稳定性，对系统质量负责；4、负责技术难点攻关和系统持续优化，解决系统瓶颈问题；5、负责对技术团队的指导与培训，Code Review，提升团队技术素养；任职要求：1、计算机相关专业本科及以上学历，8年以上技术开发经验，其中2年以上架构设计经...,互联网,http://jobs.zhaopin.com/CC427775130J40909536315.htm,20-99人,2025-12-10 18:20:25
React前端（线上约面快+有加班费+要20人）,深圳,长亮科技,本科,5-10年,"React,银行,金融项目",1.3-2.5万,本科及以上学历，计算机相关专业毕业；1、熟练掌握ES5/ES6、HTML5、TypeScript等基础语言知识，编码功底扎实。2、熟练掌握React框架以及相关生态技术，具备实际开发经验。3、熟练掌握React渲染以及其他性能优化相关知识技巧。4、其他技术要求：Ant Design、ahooks、recoil、webpack、eslint、git（按重要程度排序，匹配度高优先）5、责任心强，主动性...,计算机软件,http://jobs.zhaopin.com/CC120564550J40889862204.htm,1000-9999人,2025-12-10 17:46:52
测试/前端/后端开发工程师Java/C/C++/JS/Python,深圳,外企德科数字技术有限公司,本科,经验不限,"前端开发,后端开发,测试,JavaScript,C,Python,Java",1.4-2.8万·14薪,岗位要求1、本科及以上学历;2、掌握C++/Java/Go/Web(Vue、React、js前端开发、前端框架...)/python/H5一种或多种编程语言，有良好的编程习惯、热爱编程;3、对基本数据结构和算法有一定了解，熟悉Linux、 Android、iOS、Windows其中一种或多种系统知识;4、具备良好的解决问题能力、善于沟通、乐于合作;5、熟练使用ldea/Maven/SVN(git)...,专业技术服务,http://jobs.zhaopin.com/CCL1480117890J40815772305.htm,10000人以上,2026-01-11 00:25:41
react前端开发工程师,深圳,软通动力信息技术(集团)股份有限公司,本科,3-5年,"React,React Native",1.8-2.5万,"● ● Minimum 2+ years of proven work experience in web software development● Experience in front-end development using ReactJS ● Proficient in ES6, HTML5 and CSS3.● Familiarity with RESTful APIs integr...",互联网,http://jobs.zhaopin.com/CC000544460J40779466616.htm,10000人以上,2025-12-08 15:16:46
前端开发(J12269),深圳,华安财产保险股份有限公司,本科,3-5年,"Vue,React,JS",1.3-2.5万,岗位职责: 1.负责系统架构设计、参与重要或高风险的需求分析和设计，把控设计质量； 2.分析现有前端架构，对系统核心模块和架构框架进行编码工作，保证系统扩展性，可靠性和高性能； 3.参与团队编码和质量规范制定，积极对团队进行技术输出、培训； 4.负责协调团队内部的开发、疑难问题解决，确保项目能够在技术层面平稳推进； 5.创新技术研究，根据市场变化及趋势，结合公司现状规划、建设IT系统； 6.向开发...,保险,http://jobs.zhaopin.com/CC000582300J40651549606.htm,10000人以上,2025-11-24 10:28:14
Java/Python/C/C++/Web/测试工程师,深圳,外企德科数字技术有限公司,本科,经验不限,"JavaScript,C++,Spring,C,Mybatis,MySQL,Redis,PostgreSQL,健身房,年终奖,下午茶零食",1.4-2.8万·16薪,不受限岗位、年限、地域，专业，健身房，年终奖，下午茶蛋糕零食奶茶~职位描述1、熟练掌握Java、python等主流开发语言的一种，掌握常见的数据结构、了解软件工程、敏捷开发等知识，熟悉常用设计模式；2、了解主流数据库技术，至少精通mysql、postgresql等主流数据库技术中的一种；有SQL语句调优经验，并在中大型项目中实际应用者优先；3、熟悉spring boot，mybatis或flask...,专业技术服务,http://jobs.zhaopin.com/CCL1480117890J40775572705.htm,10000人以上,2026-01-11 00:24:30
前端开发工程师,深圳,深圳市中迈致远建设集团有限公司,本科,5-10年,电商项目,1.5-2.5万,硬性要求：统招本科，谢谢！ 公司自研项目岗位职责:1、负责Web前端页面以和小程序的开发、维护和优化工作。2、负责PC端、移动端H5页面、微信小程序的前端开发。3、依照业务提出的需求和UI设计完成产品业务模块开发，负责前端框架的搭建，公共组件的开发和维护。4、根据产品需求和项目计划，按时提交完成架构和模块设计、编码、单元测试工作。5、负责并参与系统开发的整体流程，包括架构、概要设计、编码、Code...,房地产开发,http://jobs.zhaopin.com/CC262148410J40935843904.htm,100-299人,2025-11-21 16:38:40
web前端开发工程师,深圳,深圳市创者自动化科技有限公司,本科,3-5年,"ERP项目,GIS/地图项目,JavaScript,NET FRAMEWORK,熟练操作SQL SERVER",1.5-2.5万,岗位职责：1. 负责 Web 前端应用的设计与开发，参与产品需求评审，独立实现高质量业务功能2. 使用 React / Vue 等前端框架构建高性能、可维护的前端项目3.参与跨平台桌面端应用开发，基于 Electron 实现客户端能力集成与性能优化4.参与移动端应用开发，使用 React Native 构建高质量移动应用5。与后端工程师协作，基于 Node.js 进行接口联调、业务逻辑集成及部分中...,工业自动化,http://jobs.zhaopin.com/CCL1386838010J40734976906.htm,20-99人,2025-11-20 14:57:18
Java/ Web/ C开发/ 测试/算法/数据开发,深圳,外企德科数字技术有限公司,本科,经验不限,"Python,C,JavaScript,Spring,Hibernate,Struts,MySQL,PostgreSQL",1.3-2.6万·16薪,Java开发工程师岗位职责：1、基于云系统，采用微服务架构，负责aPaaS平台子系统（模块）方案设计，核心代码开发，DT测试设计和用例开发，保证版本高质量交付和运行2、持续看护所负责子系统（模块）代码，不断开展重构优化，确保代码质量满足可用，可靠，安全等可信要求；3、负责子系统（模块）的DevOps能力提升，持续提升运维能力.C++开发工程师岗位职责：1、 负责自动驾驶网络 C/C++后端云服务业...,专业技术服务,http://jobs.zhaopin.com/CCL1480117890J40836786405.htm,10000人以上,2026-01-11 00:27:03
AI前端开发,深圳,北京芳彤智数科技有限公司,本科,5-10年,"React,Node.js,前端架构",1.6-2.5万,岗位职责1、负责公司AI相关产品Web和移动端的前端开发工作2、负责前端架构设计、关键技术预研、技术难点突破和选型3、对产品用户体验、前端性能、安全、工程化等方面持续优化和提升任职要求1、本科及以上学历，计算机相关专业，8 年以上前端开发经验2、熟练掌握JavaScript、CSS、HTML、DOM、动画、协议、安全、网络、性能优化等前端技术3、熟练掌握 React 与 Next.js，具备良好的...,咨询服务,http://jobs.zhaopin.com/CCL1462212180J40966332904.htm,20-99人,2025-11-13 16:11:23
前端软件工程师,深圳,方大集团,本科,3-5年,"大屏/可视化项目,CSS,JavaScript,HTML5,Vue,英语流利",1.5-2.5万,"任职要求：1、设计原型,和客户确认软件风格及功能；2、编写前端软件设计过程文档等；3、前端软件开发及测试；4、软件部署与联机调试。任职资格：1、计算机科学与技术或软件工程软件专业本科及以上学历；2、3年及以上软件开发工作经验，能独立承担项目软件开发；3、具有windows、linux等主流平台工程经验；4、精通HTML, CSS和JavaScript/Typescript，有良好的编程习惯和严苛的...",房地产开发,http://jobs.zhaopin.com/CC000257950J40805783501.htm,1000-9999人,2025-11-12 09:36:26
前端/后端/全栈开发工程师,深圳,外企德科数字技术有限公司,本科,经验不限,"JavaScript,C++,Java,后端开发,前端开发",1.3-2.5万·14薪,岗位要求1、本科及以上学历;24/25届可投2、掌握C++/Java/Go/Web(Vue、React、js前端开发、前端框架...)/python/H5一种或多种编程语言，有良好的编程习惯、热爱编程;3、对基本数据结构和算法有一定了解，熟悉Linux、 Android、iOS、Windows其中一种或多种系统知识;4、具备良好的解决问题能力、善于沟通、乐于合作;5、熟练使用ldea/Maven/...,专业技术服务,http://jobs.zhaopin.com/CCL1480117890J40815763305.htm,10000人以上,2026-01-11 00:25:40
web前端工程师（自研）,深圳,深圳市博研微科技有限公司,本科,5-10年,"Vue,uni-app,金融项目,电商项目,C端项目",1.6-2.5万·13薪,1、UI设计转化大师：作为前端开发的专家，你将负责将精美的UI设计图精准转化为高质量的Web页面，确保每一个细节都完美呈现，为用户提供极致的视觉体验。你将运用这些技术打造高性能、高兼容性的移动Web页面，为用户提供流畅且精美的移动体验，你的工作将直接决定产品的第一印象，让你成为产品成功的起点。2、跨浏览器兼容先锋：凭借卓越的技术实力，确保Web页面在各版本的浏览器上都能良好显示和运行，无论是主流的...,计算机软件,http://jobs.zhaopin.com/CCL1284485020J40770500105.htm,20-99人,2025-10-11 11:01:31
VUE前端工程师,深圳,艾特孚科技(深圳)有限公司,本科,3-5年,"Vue,ElementUI,Node.js,Ant Design",1.5-2.5万·13薪,岗位职责： 1、配合后端完成系统开发工作； 2、负责系统页面的开发工作； 3、负责系统功能日常维护和升级工作； 4、参与前端的优化改进，提升系统的稳定性、可用性与扩展性； 5、负责前端新技术的研究应用； 6、编写技术文档、需求说明、功能设计文档等。 7、上级领导交代的其他工作。 任职要求：1、能熟练使用英语沟通。2、3年及以上相关工作经验，掌握html/html5、xml、JavaScript、C...,IT服务,http://jobs.zhaopin.com/CCL1481747010J40542834403.htm,20-99人,2025-08-28 12:48:52
前端开发工程师,深圳,方大集团,本科,3-5年,"大屏/可视化项目,CSS,HTML5,Vue,React,英语流利",1.5-2.5万,"岗位职责：1、设计原型,和客户确认软件风格及功能2、编写前端软件设计过程文档等；3、前端软件开发及测试；4、软件部署与联机调试。5、领导交办的其他工作。任职要求：1、本科及以上学历，计算机科学与技术、软件工程等专业；2、3年及以上软件开发工作经验，能独立承担项目软件开发；3、具有windows、linux等主流平台工程经验；4、熟悉HTML, CSS和JavaScript/Typescript，有...",房地产开发,http://jobs.zhaopin.com/CC000257950J40758882501.htm,1000-9999人,2025-08-12 10:05:01
前端开发工程师,深圳,深圳市钐烽科技有限公司,本科,1-3年,"Vue,金融项目,融资租赁项目,JavaScript",1.5-2.5万,岗位职责：1、负责PC端和移动端业务开发和维护。2、新技术前沿技术探索与应用。3、页面性能优化。 4、用户体验优化。 任职要求： 1、本科及以上学历，2年以上Web前端开发经验 2、熟练使用Vue。 3、熟悉HTML5，CSS3，ES6+语法规范。 4、熟悉至少一种css预处理器：scss、less。 5、熟悉webpack或vite配置及构建优化。 6、工作主动积极、认真负责，沟通交流清晰流畅，...,计算机软件,http://jobs.zhaopin.com/CCL1499788970J40754640212.htm,100-299人,2025-07-25 19:57:00
原生安卓前端开发工程师(疗愈类APP）,深圳,深圳华章智慧文化传播有限公司,本科,5-10年,"原生‌KOTLIN实际开发经验,前端VUE和REACT的实际经验",1.5-2.5万,该岗位1、需要8年以上经验，其中3年及以上原生Kotlin实际开发经验和2年以上前端vue和react的实际经验。2、加分项：全栈开发经验。一、薪酬与福利1、薪资open底薪+绩效，综合薪资15-25K。2、入职购买五险一金。3、法定节假日正常休息。4、带薪年假。5、旅游/团建。二、作息时间1、上班时间9:00-6:00，中午休息1.5个小时2、法定节假日正常休息3、单双休三、办公地址深圳市南山区...,文化艺术/娱乐,http://jobs.zhaopin.com/CCL1486652000J40769640812.htm,20-99人,2025-07-08 09:34:31
前端开发岗,深圳,和泰人寿,本科,1-3年,"JavaScript,HTML5",面议,岗位职责：1、负责前端架构设计、技术选型和性能优化、保证系统稳定可靠；2、参与需求讨论，任务评估和项目规划，与团队合作完成项目开发；3、持续优化现有代码结构，提高系统整体质量和开发效率，升级现有前端基础框架；4、跟踪前段技术发展动态，推进前段工程体系建设和分享；5、负责测试、生产环境的维护和发布，并能快速且有效的处理运营反馈的生产环境的前端问题；6、团队管理，团队人才梯队建设和管理。任职要求：1、...,保险,http://jobs.zhaopin.com/CC308000730J40725723916.htm,100-299人,2025-06-23 17:23:12
软件工程师（底软/后端/嵌入式开发为主，前端开发/算法/测试少量）,深圳,外企德科数字技术有限公司,本科,1-3年,"C语言,C++,Python,嵌入式,底软,安卓",1.2-2.4万·15薪,岗位职责1、负责公司某一项目中（云计算、智能终端、自动驾驶网络、SaaS、人工智能等），相关软件版本的架构设计、软件代码编写、测试等；2、对现有工具性能和体验优化提升；3、对标业界标杆，工程工具，共同实现关键技术的引进、研究与突破；任职要求1、计算机、软件工程、网络、通信、电子等相关专业优秀本科及以上学历，有半年及以上项目开发经验优先；2、熟练掌握Java/C++/C/Python/JS/GO中至...,专业技术服务,http://jobs.zhaopin.com/CCL1480117890J40815154005.htm,10000人以上,2026-01-11 00:25:39
前端开发工程师（疗愈APP自研）,深圳,深圳华章智慧文化传播有限公司,本科,5-10年,"React,Vue,uni-app",1.5-2.5万,一、薪酬与福利1、薪资open底薪+绩效，综合15-25K。2、入职购买五险一金。3、带薪年假。4、旅游、团建与下午茶。二、作息时间1、上班时间9:00-6:00，中午休息1.5h。2、单双休。三、工作氛围 1、团队年轻、踏实、结果导向。2、扁平化的管理方式氛围宽松/开放/有爱/互助人际关系简单。四、企业文化谦逊、责任、高效五、总部地址深圳市南山区华海金融创新中心A座12层1205-1206室（5...,文化艺术/娱乐,http://jobs.zhaopin.com/CCL1486652000J40790742512.htm,20-99人,2025-07-04 16:59:12
web前端开发工程师,深圳,胜通和科技有限公司广州分公司,本科,1-3年,"大屏/可视化项目,ERP项目,JavaScript,Vue",1.4-2.4万,"岗位职责： 1、负责前端web页面、小程序、可视化大屏需求开发，高度还原UI设计及可视化方面的交互效果与特效。 2、持续关注前端技术发展趋势，不断迭代优化前端页面性能与用户体验。 任职要求 1、2年以上前端开发工作经验，统招本科及以上学历，计算机或相关专业。 2、熟悉HTML5/CSS3,至少熟悉一种主流框架（Vue/React/JQuery），能解决多浏览器兼容性、屏幕自适应的问题。 3、熟悉可...",咨询服务,http://jobs.zhaopin.com/CC702648730J40813148808.htm,500-999人,2025-12-19 15:46:56
深圳-Java/C++/Go/Python/前端,深圳,外企德科数字技术有限公司,本科,经验不限,"Python,C++,Java,Spring,Hibernate,Struts,MySQL,PostgreSQL,Oracle",1.2-2.4万·14薪,岗位职责：1、负责应用软件开发和维护工作。2、负责软件模块需求分析、系核心模块代码编写和单元测试，完成概要设计文档、详细设计文档。3、积极主动的与项目相关人员沟通交流，持续改善产品体验。业务技能要求：1、熟练掌握常用数据结构。2、熟悉计算机组成原理、操作系统、网络等。岗位要求：1.本科以上学历，双证学信网可查（不要求专业） 2.热爱编程，基础扎实，熟悉掌握但不限于Java、C/C++、GO、Pyt...,专业技术服务,http://jobs.zhaopin.com/CCL1480117890J40707567805.htm,10000人以上,2026-01-11 00:24:26
前端开发工程师 （react）,深圳,苏州人瑞普惠人力资源服务有限公司,本科,3-5年,"HTML5,TypeScript,Vue,React,CSS,webpack,Babel,VITE",1.8-2.4万,岗位职责：1. 主导公司前端组件库的设计与开发，构建高可用、可复用的组件体系，提升前端开发效率与代码质量；2. 负责组件库文档的规划、撰写与维护，确保文档内容清晰、准确、详尽；3. 深入研究前端技术发展趋势，结合公司业务需求，推动组件库的技术升级与优化；4. 参与前端项目的全流程开发，与产品、测试等团队紧密协作，保障项目高效落地；任职要求：1. 本科及以上学历，计算机相关专业优先，3 年以上 We...,互联网,http://jobs.zhaopin.com/CC427775130J40909539515.htm,1000-9999人,2025-12-10 18:35:21
shopify前端开发工程师,深圳,青岛简沐电商运营管理有限公司,本科,3-5年,"电商项目,JavaScript,HTML5,CSS,Vue,React Native,Canvas,SHOPIFY前端开发经验",1.5-2.4万,"公司 12 年成立，近 400 人规模，双休+入职五险一金，近五号线大学城地铁口，每年两次双通道晋升，公司以人为本团队氛围好岗位职责：1. 负责海外品牌官网基于Shopify平台的前端开发;2. 从品牌宏观角度为网站设计提供专业的优化建议;3. 参与网站需求及设计评审,确定前端开发技术方案;4. 配合运营实现SEO需求,不断完善以保持良好的推广效果;5. 使用ShopifyAPl接口,完成Shop...",电子商务,http://jobs.zhaopin.com/CCL1479548900J40840056012.htm,300-499人,2025-10-16 19:40:13
高级前端工程师,深圳,深圳市星闪悦动科技有限公司,本科,3-5年,"JavaScript,技术博客/开源项目有所贡献,Vue,React,Node.js,Echarts,百万用户经验",1.5-2.3万·13薪,面试有算法题噢。会AI也是加分项！能力好薪资可谈！【不在深圳的不考虑！大小周不考虑的也勿投！】岗位要求：1、本科及以上学历， 计算机及相关专业，5年以上专职前端开发工作经验；2、了解nodejs，了解主流框架动向，精通Vue、React之一；3、深入了解ES6/7/8/9、CSS3、HTML5，精通Vue3+TypeScript（组合式API、Pinia、Vite生态）；4、熟悉前端工程化，熟悉工...,电子/半导体/集成电路,http://jobs.zhaopin.com/CCL1497492020J40978860104.htm,20-99人,2026-01-08 10:18:17
高级前端开发工程师,深圳,中电金信软件有限公司,本科,5-10年,"金融项目,银行项目,证券项目,保险项目,React",2-2.3万,"1、本科及以上学历；2、自取得全日制本科学历起5年及以上工作经验；3、扎实的计算机知识，有较强的逻辑能力和学习能力。熟练掌握React, JavaScript, HTML和CSS；4、前端工程化经验，包括但不限于构建和CICD等，熟悉Webpack、Vite等至少一种构建工具；5、责任心强，有较强的学习能力，有强烈的求知欲，具有良好的团队沟通与协作能力。6。信用风险开发团队 批发融资基础服务",计算机软件,http://jobs.zhaopin.com/CC443657520J40646474709.htm,10000人以上,2025-05-14 10:46:38
flutter前端开发工程师,深圳,深圳市法本信息技术股份有限公司,大专,3-5年,Kotlin,1.4-2.2万,1.丰富的futter开发经验和相机底层能力开发经验，鸿蒙移动应用开发半年及以上2.有鸿蒙创新特性开发经验3.可以接受出差,计算机软件,http://jobs.zhaopin.com/CC385622410J40741050906.htm,1000-9999人,2026-01-10 01:17:14
javaScript开发负责人月休息八,深圳,广州一滴水企业管理服务有限公司,中专/中技,经验不限,电商项目,1.9-2.2万·13薪,我们正在寻找一位专业的JavaScript开发工程师，负责维护和开发公司Web应用。工作内容： 负责前端系统的研发工作； 根据开发规范与流程独立完成模块的设计、编码； 定位并修改系统暴露出的bug； 不断迭代新功能并保持系统的稳定、健壮、安全； 参加代码评审，持续优化代码结构和性能； 完成软件系统相关文档的编写工作。岗位要求： 计算机相关专业本科及以上学历； 3年以上JavaScript开发经验；...,人力资源服务,http://jobs.zhaopin.com/CCL1511076520J40977240004.htm,100-299人,2026-01-07 01:10:22
