职位,城市,公司,学历,经验,技能,薪资,工作描述,行业,职位URL,公司规模,发布时间
抖音直播运营(储备组长),厦门,厦门斯辰传媒有限公司,本科,1-3年,"抖音,电商类,美妆类",9000-15000元·13薪,【集团介绍】关于我们：顾诺集团，成立于2016年，总部位于厦门湖里区独栋6层办公大厦，专注为家庭日化品牌提供「自营+代运营」一体化解决方案，深度布局抖音、天猫、京东、拼多多等核心渠道，产品矩阵覆盖：家庭清洁、环境净化、个人护理等系列，满足家庭全场景清洁需求。我们的成绩：1、自主研发沫檬、康思嘉等日化品牌，其中地板清洁剂、洗衣机槽清洁剂成为全网爆款，2022年一跃成为抖音家清品类市TOP1，并持续高...,电子商务,http://jobs.zhaopin.com/CCL1281702680J40730943406.htm,1000-9999人,2026-01-08 16:09:37
海外社媒运营经理,厦门,厦门联合物流有限公司,本科,3-5年,海外社媒推广,8000-15000元·13薪,岗位职责一、客户线索与关系管理1. 制定并执行针对CRM客户（沉睡客户及新增线索）的月度/年度线上激活与开发计划；2. 构建客户分层体系，设计差异化生命周期沟通与邮件营销策略，提升交叉销售与复购率。 二、海外数字渠道与搜索引擎营销 1.全面负责集团及子公司在Google（SEO与SEM）、LinkedIn、Facebook、Instagram等海外核心渠道的流量获取与内容运营； 2.制定并执行Go...,货运/物流/仓储,http://jobs.zhaopin.com/CC218898310J40738933802.htm,100-299人,2026-01-04 15:16:20
酒店文旅运营助理,厦门,进才企业管理(广州)有限公司,学历不限,经验不限,"内容运营,新媒体运营,商家运营,酒店文旅运营助理",8000-15000元,【招聘人数】6 【薪资范围】8000-15000【职位福利】可以包吃包住，年底双薪【工作年限】经验不限【学历要求】旅游 酒店相关学历优先-学历不限【职位描述】协助酒店及旅游相关内容整理与文案支持，参与旅游项目推广及日常运营工作。旅游或酒店相关专业优先，接受应届及实习生。,人力资源服务,http://jobs.zhaopin.com/CCL1448198220J40744901806.htm,100-299人,2026-01-02 09:54:52
AIGC营销内容创作,厦门,厦门雅迅智联科技股份有限公司,大专,1-3年,"AIGC,AI",8000-15000元,工作内容：1、AIGC内容创作： 根据终端客户需求，独立创作营销类AIGC作品，包括创意海报，短视频，TVC广告等；2、提示词优化： 根据不同创作场景，优化提炼创作提示词，协同产品研发团队改进智能体生成质量；3、工作流搭建： 将可复用的内容创作通过comfyui或coze等工具流程化，不断提升同类型内容创作效率；4、领导交办的其他事项。任职要求：1、学历：大专(含)以上，数字媒体、广告学，计算机等...,物联网,http://jobs.zhaopin.com/CC138128960J40781726116.htm,1000-9999人,2025-12-17 15:29:13
小红书内容运营,厦门,厦门易尔通,大专,1-3年,"视频类,文本类,音频类,小红书,抖音",8000-15000元,加入我们！小红书内容运营专员（全职）🌟📍 工作地点：[厦门软件园二期]💼 职位类型：全职💰 薪资范围：6-15K我们热爱小红书平台，致力于通过优质内容与用户建立深度连接！如果你也热爱分享、擅长创作，欢迎加入我们的团队！📝 工作内容内容策划与创作：负责小红书账号的内容规划、选题策划，撰写高互动文案，制作吸睛的图文/短视频。账号运营：日常发布、粉丝互动、评论维护，提升账号活跃度与用户粘性。数...,互联网,http://jobs.zhaopin.com/CC188190410J40788941714.htm,1000-9999人,2025-11-27 09:19:03
内容主管 (MJ000081),厦门,厦门起量科技有限公司,本科,1-3年,"视频类,美妆,抖音,小红书",1-1.5万,岗位定位：您将是我们内容团队的“技术核心”与“质量守门员”。不仅自身是剪辑领域的顶尖高手，更能带领团队将优质内容工业化、规模化生产，直接驱动公司带货业绩增长。一、 核心职责：技术与管理并重1. 顶尖技术实践与引领：* 从0到1独立操盘：熟练掌握剪映软件，能够独立完成长剧情视频（3-5分钟）的全程制作，包括但不限于剧本拆解、素材整合、精剪、节奏把控。* 精通全链路后期：深度精通各类剪辑软件，在特效包...,新媒体,http://jobs.zhaopin.com/CC891777330J40809431101.htm,500-999人,2025-11-25 09:59:56
达人运营经理,厦门,厦门雅迅智联科技股份有限公司,本科,3-5年,"短视频平台,抖音,快手,哔哩哔哩,内容运营,用户运营,达人",8000-15000元,主要职责：1、达人的挖掘、招募、价格谈判及长期关系维护；2、与商务团队协同，为达人筛选合适的商业订单；3、签约达人的日常沟通与管理，制定个性化成长路径；4、处理达人运营过程中的各类问题，维护长期良好关系。核心期望：1、有效达人开发量≥10人/月；2、月均成交金额≥2000元/月/达人。任职要求：1、本科(含)以上，市场营销、新闻传播、传媒经济等相关专业；2、 3 年以上，达人运营岗位；3、具备独立...,物联网,http://jobs.zhaopin.com/CC138128960J40767692816.htm,1000-9999人,2025-11-12 09:04:01
资深短视频编导（品牌 量级过亿）(J10453),厦门,厦门斯辰传媒有限公司,大专,1-3年,"美妆类,短视频,广告类,教育类,直播媒体",1-1.5万,【集团介绍】关于我们：顾诺集团，成立于2012年，总部位于厦门湖里区独栋6层办公大厦，专注为家庭日化品牌提供「自营+代运营」一体化解决方案，深度布局抖音、天猫、京东、拼多多等核心渠道，产品矩阵覆盖：家庭清洁、环境净化、个人护理等系列，满足家庭全场景清洁需求。我们的成绩：1、自主研发沫檬、康思嘉等日化品牌，其中地板清洁剂、洗衣机槽清洁剂成为全网爆款，2022年一跃成为抖音家清品类市TOP1，并持续高...,电子商务,http://jobs.zhaopin.com/CCL1281702680J40721115506.htm,1000-9999人,2025-09-29 10:52:25
短视频编导（资深）,厦门,厦门起量科技有限公司,大专,1-3年,"美妆类,短视频",1-1.5万,【岗位职责】1、根据美妆带货类相关账号实际需求，进行短视频脚本及相关文案撰写；2、结合热点进行拍摄脚本的优化、迭代、创新；3、根据短视频脚本策划和组织模特、演员进行短视频拍摄，保质保量完成拍摄任务；4、根据短视频脚本、文案设计及成片标准，与剪辑沟通完成视频成片的输出；5、及时跟进投放效果，分析短视频数据，协同平台投放运营策略，不断优化视频内容，提升内容质量；【任职要求】1、大专及以上学历，具有2年...,新媒体,http://jobs.zhaopin.com/CC891777330J40770437201.htm,500-999人,2025-08-21 11:51:41
AIGC内容运营,厦门,厦门雅迅智联科技股份有限公司,硕士,无经验,"热点,内容策划,CHATGPT,MIDJOURNEY",1-1.5万,主要职责：1、利用AI进行热点追踪与创意构思；2、利用AIGC工具进行图文、视频等内容创作；3、监测和分析内容数据表现，持续迭代和优化内容策略；4、跟踪AIGC行业趋势和用户反馈，为产品优化提供建议；5、管理与维护平台内容，确保内容优质、合规。核心期望：1、所负责运营的内容板块爆文产出量≥5篇/月；2、所负责运营的内容板块粉丝增长量≥1500人/月。任职要求：1、 硕士 (含)以上， 新闻传播学、...,物联网,http://jobs.zhaopin.com/CC138128960J40767118016.htm,1000-9999人,2025-10-21 11:20:31
市场营销,厦门,厦门台和电子有限公司,学历不限,经验不限,"新媒体运营,短视频运营,销售运营,渠道运营,品牌运营,自媒体运营,网络运营,海外运营,线下运营,国内市场,国际市场",9000-15000元,"岗位职责：1. 市场调研和分析，制定营销策略。2. 品牌策划和推广，通过网络渠道、促销手段、媒体宣传等方式，提升品牌知名度和影响力。3. 根据业绩、市场反馈等资讯，对运营项目进行控制、评估、调整，以确保运营项目持续达成,获得市场竞争优势。岗位要求：1.具备市场分析和判断能力，良好的计划和执行能力，有效管理销售过程和销售资源。2.具有较强的沟通能力和交际技巧，良好的客户服务意识。3.有产品销售及品牌...",电子/半导体/集成电路,http://jobs.zhaopin.com/CC138242710J40498149902.htm,1000-9999人,2025-06-17 19:11:56
新媒体房产顾问（无需地推+时间自由）,厦门,麦田房产,大专,经验不限,"住宅房产,商业房产,二手房,别墅,新房,网络销售,渠道销售,门店销售,五险一金,团建福利,带薪培训,带薪年假,高提成",9000-14000元,新媒体各类平台运营 带薪培训、手把手教学拍摄剪辑专业人员带教、大神陪同不用地推，不用陌拜，不用一直打电话【每月10号发薪日】逛逛社区、拍拍视频、邻里唠唠上班时间自由，可以接送孩子氛围轻松无压力......不懂有人手把手教学【你可以学到】1、线上新媒体平台运营:有抖音、小红书、等拍摄、剪辑、运营学习，2、与线下房产交易涉及到不动产、投资理财、美学、心理学、法务常识等多个领域的知识;3、深入了解房产行...,房地产中介,http://jobs.zhaopin.com/CC407798420J40736376506.htm,10000人以上,2026-01-12 09:21:07
视频编导,厦门,强力巨彩,大专,5-10年,"短视频,动画,视频剪辑",9000-14000元·13薪,一、岗位职责（1）视频剪辑制作：协同团队完成品牌事件报道，独立负责8~10个产品线，配合产品GTM上市宣传，完成各类视频的剪辑与效果包装：（2）视频内容选题与策划：立足《强力巨彩LED大显示》官方号、《谷亚G-ART》等账号，完成视频内容的选题、脚本创作、拍摄分镜等。（3）拍摄支持：营销活动、区域标杆案例、产品素材、总部展厅等的拍摄（4）主推产品效果图基础渲染工作二、任职要求（1）5年以上短视频相...,电子/半导体/集成电路,http://jobs.zhaopin.com/CC283635710J40863764403.htm,1000-9999人,2025-12-15 14:56:13
短视频运营专员,厦门,厦门大象岛屿电子商务有限公司,大专,1-3年,TikTok,7000-14000元,"岗位职责：东南亚市场洞察与策略制定：深入研究东南亚各国（如泰国、菲律宾、马来西亚等）的电商环境、社交媒体生态、用户行为、文化习俗及审美偏好，特别是针对箱包品类的消费特点。根据公司战略及东南亚各站点运营目标，制定并执行箱包类目短视频内容运营策略，包括内容定位、选题规划、发布排期、平台矩阵布局（如TikTok Shop, Shopee/Lazada Video, Instagram Reels, Fa...",电子商务,http://jobs.zhaopin.com/CCL1494789150J40831913205.htm,20-99人,2025-12-10 13:29:15
短视频编导【代运营爆款捕手｜多行业操盘】,厦门,厦门小题旅行科技有限公司,大专,3-5年,"短视频,广告类,美妆类,教育类,创意编导",9000-14000元,你的工作：1. 多行业账号定位与内容操盘1）负责代运营客户的短视频账号定位、风格设计及内容矩阵搭建；2）独立完成爆款脚本创作（口播/剧情/产品种草等），确保内容适配抖音、视频号等平台调性。2. 全流程制作管控1）统筹拍摄与后期：指导摄影师构图/分镜，输出剪辑思路；2）严格把关成品质量，确保视频符合客户品牌标准及平台算法偏好。3. 数据驱动优化1）监测播放量、完播率等核心指标，基于数据调整选题策略；...,广告/营销,http://jobs.zhaopin.com/CCL1381644200J40845646812.htm,500-999人,2025-11-22 00:00:02
新媒体运营主管,厦门,厦门群贤世青研究院有限公司,本科,3-5年,"短视频平台,图文平台,微信公众号,小红书,抖音,微信视频号,新闻类,教育类",8000-14000元,岗位职责：1.制定新媒体运营策略以及年度内容规划，统筹管理官方新媒体平台（包括微信、小红书、视频号、B站、抖音等）的内容编辑以及推送工作。 2.主导新媒体平台的内容创意与传播，打造并推广具有国际教育特色的优质内容IP（如升学探秘、名师访谈、国际化生活等），塑造和提升学校的品牌影响力。 3.招生推广与视频项目协同管理： 策划并执行线上内容推广活动、视频内容的创意、制作与发布、招生季专题宣传、国际升学...,培训/辅导服务,http://jobs.zhaopin.com/CC838654560J40812963814.htm,20-99人,2025-10-20 17:35:45
短视频运营主管,厦门,厦门大象岛屿电子商务有限公司,本科,1-3年,TikTok,7000-14000元,职位亮点：主导箱包品牌TikTok战略，打造爆款内容，驱动粉丝增长与销售转化。深挖箱包场景痛点与卖点，引领团队创意，塑造品类影响力。带领团队，抢占TikTok箱包细分赛道高地。岗位职责：战略规划： 制定箱包类目TikTok运营战略与KPI（粉丝、互动、种草率、GMV等），基于平台趋势与竞品（箱包类）持续优化。内容体系： 构建箱包产品特色内容体系（如场景测评、功能展示、搭配指南、开箱、痛点解决），领...,电子商务,http://jobs.zhaopin.com/CCL1494789150J40831949305.htm,20-99人,2025-12-10 11:31:35
新媒体运营（代运营｜乙方公司）,厦门,厦门小题旅行科技有限公司,大专,3-5年,"短视频平台,抖音,快手,哔哩哔哩,医疗类,数码类,旅游类,短视频运营,用户运营,直播运营",9000-14000元,你的工作：1. 协助小红书、抖音、视频号、微信公众号、B站、微博等新媒体平台的创意内容策划、撰稿、 排版制作、日常运维等工作；2. 根据甲方需求及不同平台玩法规则和传播规律，策划选题，制定内容方案及撰稿执行；我们需要你：1. 本科及以上学历，新闻类、广告类、语言类、传媒类等相关专业优先，在校期间有自媒体账号0-1运营经验尤佳；2. 中度或重度网瘾患者、有较强的文字功底，擅长文案撰写、话题策划运营；...,广告/营销,http://jobs.zhaopin.com/CCL1381644200J40845656112.htm,500-999人,2025-11-04 11:05:46
运营组长【快手】,厦门,厦门菠萝头网络科技有限公司,大专,1-3年,快手,7000-14000元,岗位职责1、负责流量投放、短视频数据分析；2、负责发掘用户需求，确定并执行推广投放策略；根据投放推广策略，搭建和操作竞价推广账户；3、负责挖掘和分析市场同行数据，对各项数据(产品、人群、创意、图片等)进行分析总结，对收集的信息结果作自有产品的的投放策略、规划、计划，提升广告投放效益；4、负责竞价投放视频的需求提交以及脚本审核对接等工作；5、负责监控广告实时投放和后端成交等数据，围绕数据分析，及时优...,电子商务,http://jobs.zhaopin.com/CCL1228419100J40828846103.htm,100-299人,2025-08-23 09:57:23
编导（美妆品类）,厦门,厦门起量科技有限公司,大专,1-3年,"美妆类,短视频,剧情,美妆产品",7000-14000元,岗位职责：1. 负责短视频内容的创意策划和脚本撰写。2. 指导拍摄工作，确保拍摄内容符合创意要求。3. 负责后期剪辑的指导工作，确保视频质量。4. 跟踪视频发布后的数据反馈，优化内容创作。岗位要求：1. 熟悉短视频平台的内容创作和运营策略。2. 具备良好的创意策划能力和文字表达能力。3. 有一定的导演和拍摄经验，能够独立完成短视频的制作。4. 熟练使用视频剪辑软件，有良好的审美观。,新媒体,http://jobs.zhaopin.com/CC891777330J40770259601.htm,500-999人,2025-08-21 10:23:34
运营助理（无责底薪+高提成+高福利+氛围轻松）,厦门,厦门三友昇电子商务有限公司,中专/中技,经验不限,"电商运营,新媒体运营,销售运营,抖音,快手,小红书,淘宝,拼多多,京东",7000-14000元,我们正在寻找充满热情、渴望在电商领域快速成长的拼多多运营助理，让你快速成长为专业运营人才！一、主要工作内容1、上下架产品、信息维护等基础操作。2、进行拼多多直通车的投放、关键词管理、数据跟踪与初步分析。3、产品主图的制作，提升点击率和转化率。4、商品标题的撰写与优化。5、进行商品SKU的规划、布局与价格策略的初步执行。6、监控商品评价，进行评价维护与优化，提升店铺评分和买家信任度。7、前期参与售前...,电子商务,http://jobs.zhaopin.com/CCL1394985860J40690352709.htm,20-99人,2025-06-19 16:33:43
外贸内贸电商新媒体平台运营,厦门,中芯渊虹(厦门)投资控股集团有限公司,大专,3-5年,"视频平台,媒体平台,企业管理平台,电商平台,品类运营,商家运营,销售运营,推广运营",7000-13000元,岗位内容：1. 制定和实施平台日常运营计划和推广策略，提高平台用户数量和活跃度。2. 负责平台活动、内容编辑和管理，以及用户维护和服务。3. 监测和分析平台关键指标，不断优化平台业务流程和用户体验。4. 协助团队完成其他相关工作任务。任职要求：1. 熟悉互联网运营基本原理和流程。2. 具备良好的文字撰写、沟通协调和组织能力。3. 熟练掌握Excel等基础办公软件。4. 对互联网行业有浓厚兴趣，具有...,电气机械/电力设备,http://jobs.zhaopin.com/CCL1477406440J40823935414.htm,20-99人,2026-01-09 01:39:29
抖音运营,厦门,厦门利川音响有限公司,本科,3-5年,"视频类,音频类,音响,抖音",9000-13000元,1. 内容运营与用户种草能力-用户痛点挖掘：深度挖掘用户痛点（如音质对比、家居美学融合、技术解读等），通过数据分析用户行为（如播放量、完播率、粉丝增长），优化内容策略，定期与粉丝互动，分析数据建立有效运营手段。 -具备深度种草能力：能结合用户痛点，策划场景化内容（如产品测评、使用场景、情感共鸣类视频）。2. 业务规划与投流能力-广告投放：投流计划制定、精细化ROI管理，负责抖音广告投流事务，优化投...,电子商务,http://jobs.zhaopin.com/CC695258220J40751803410.htm,20-99人,2025-11-18 13:56:38
短视频编导（双休 六险一金）,厦门,厦门小题旅行科技有限公司,本科,1-3年,"短视频,动画,广告类,美妆类",8000-13000元,岗位职责：1、负责各平台账号内容的定位和风格把控；2、独立完成短视频的选题、内容策划、脚本撰写，输出有创意且具有传播性的内容；3、统筹制作，给予拍摄指导和后期剪辑思路，把控拍摄内容及最终成品质量；4、洞察账号数据，统计、分析并总结经验，不断迭代优化、调整视频内容；5、完成领导安排的其他和工作。任职资格：1、本科及以上学历，广播电视编导、戏剧影视文学、新闻学、广告学等编导相关专业优秀，优秀者可适当放...,广告/营销,http://jobs.zhaopin.com/CCL1381644200J40844428312.htm,500-999人,2025-11-13 13:33:20
抖音直播运营,厦门,福建拉森科技有限公司,本科,1-3年,"抖音,0-1搭建经验",8000-13000元·13薪,一、岗位职责1、负责直播活动的全流程策划，包括主题设定、脚本撰写、流程设计、互动玩法及促销方案制定；2、协调主播、助播、场控等团队，确保直播流程顺畅，提升直播效果和转化率。3、制定直播流量投放策略，通过付费推广（如千川、巨量引擎等）、自然流量、私域引流等方式提升直播间曝光；4、分析用户画像，设计粉丝留存、互动及复购策略，维护直播间粉丝粘性。5、实时监控直播数据（观看人数、停留时长、转化率、GMV等...,电子商务,http://jobs.zhaopin.com/CCL1490657450J40796168901.htm,1000-9999人,2025-10-13 13:46:02
海外自媒体运营,厦门,容大合众(厦门)科技集团股份公司,本科,1-3年,"海外平台,Facebook,Instagram,Twitter,数码类,内容运营",8000-13000元·13薪,工作内容：1、负责公司海外社交媒体平台上相关账号日常运营管理、平台帖子内容制作及发布，协助进行品牌及产品宣传及推广；2、负责与海外社媒平台粉丝成员良好互动，建立有效运营手段提升产品和公司品牌的关注度；3、根据公司和产品方向，按时按量完成所运营海外社交媒体账号的内容更新；定期为粉丝提供优质、有传播性的内容；4、定期进行社媒平台流量数据的总结，形成分析报告，及时调整未来的账号管理和推广方向；5、监控海...,电子/半导体/集成电路,http://jobs.zhaopin.com/CC424460810J40642945612.htm,500-999人,2025-09-19 13:20:39
编导(J10467),厦门,厦门汉印股份有限公司,大专,经验不限,"短视频,直播媒体",7000-12000元,岗位职责: 1、负责视频新媒体平台（抖音/快手/视频号/小红书）的视频内容策划与脚本文案； 2、负责短视频的前期选题，素材搜集与提炼，内容策划，表现手法及方式创意； 3、指导视频拍摄及后期制作，为呈现质量及最终数据负责； 4、根据数据调整制作策略，提升内容质量和传播度，高效产出目标用户喜欢的爆款内容； 5、负责短视频内容运营和数据运营，对粉丝数据和引流数据负责； 6、善于抓住产品卖点，结合营销节点...,电子设备制造,http://jobs.zhaopin.com/CC608178620J40898302002.htm,1000-9999人,2026-01-12 09:46:44
直播运营（品牌鞋服/熟悉抖音玩法）,厦门,福建拉森科技有限公司,本科,1-3年,"抖音,电商类,抖音投流,抖音玩法,鞋服品类",9000-13000元·13薪,一、岗位职责1、负责直播活动的全流程策划，包括主题设定、脚本撰写、流程设计、互动玩法及促销方案制定；2、协调主播、助播、场控等团队，确保直播流程顺畅，提升直播效果和转化率。3、制定直播流量投放策略，通过付费推广（如千川、巨量引擎等）、自然流量、私域引流等方式提升直播间曝光；4、分析用户画像，设计粉丝留存、互动及复购策略，维护直播间粉丝粘性。5、实时监控直播数据（观看人数、停留时长、转化率、GMV等...,电子商务,http://jobs.zhaopin.com/CCL1490657450J40748966701.htm,1000-9999人,2025-06-25 10:40:39
带薪旅游销售8k+新媒体运营+拍摄剪辑,厦门,麦田房产,大专,3-5年,"KA大客户,企业客户,个人客户,面销/陌拜,电话销售,渠道销售,晋升快,带薪培训",8000-12000元,来麦田，高提成、高收入、高保障；现在平台有这样的机会，期待你的合作！ 【岗位职责】1、负责公司房屋及客户资源的搜集整理以及相关网站的运营；【内网大量完善的盘源信息，助你完成前期积累】2、负责客户接待，并根据客户需求提供房屋买卖或租赁等服务；【不知如何开展？不必担心，有系统实战课程助你成长】3、负责为客户提供看房、签约、交税、过户等交易过程服务；【不懂服务？不用担心，师父一对一传授教学】4、负责做好...,房地产中介,http://jobs.zhaopin.com/CC407798420J40680612606.htm,10000人以上,2026-01-12 09:21:10
储备干部（电商方向）,厦门,厦门新技术集成有限公司,本科,无经验,"市场营销方向,运营方向,电商运营,新媒体运营,大学英语四级,大学英语六级",1-1.2万,公司目前在京东、天猫、小红书、抖音等核心平台均设有旗舰店，同时还有官网商城及小程序店铺自营渠道，致力于通过内容营销、社交电商与数字化运营，为消费者提供优质的码组品牌系列产品与服务。 我们诚邀有潜力、有热情、有想法的年轻人加入，共同塑造电商未来！ 一、岗位描述： 1、我们将为储备干部提供全渠道运营系统化的学习，参与各平台的日常运营与实战项目机会，旨在培养具备全渠道运营思维、团队管理与战略落地能力的业...,新零售,http://jobs.zhaopin.com/CC136173410J40852785313.htm,1000-9999人,2026-01-11 00:00:01
编导（成熟品牌 团队完善）(J10612),厦门,厦门斯辰传媒有限公司,大专,1-3年,"短视频,直播媒体,美妆类,快消品类",8000-12000元·13薪,岗位职责:1、独立负责带货短视频项目的创意策划与脚本撰写。基于产品定位与用户数据分析，制定内容方向，完成可执行的拍摄方案及分镜脚本。2、主导拍摄现场执行，包括现场调度、节奏把控、画面与表演指导，确保素材高效产出并符合创意与质量要求。3、作为项目核心协调人，高效联动达人、模特、拍摄及后期团队，明确传达创意意图与修改要求，保障内容从策划到上线的流程顺畅。4、分析视频投放提供的数据与用户反馈，总结内容模...,电子商务,http://jobs.zhaopin.com/CCL1281702680J40746449306.htm,1000-9999人,2026-01-09 09:44:33
