职位,城市,公司,学历,经验,技能,薪资,工作描述,行业,职位URL,公司规模,发布时间
新媒体运营主管（日本房产）,厦门,厦门泰房信息科技有限公司,大专,1-3年,"短视频运营,日语,日本房产",6000-12000元·13薪,【岗位职责】1、负责短视频文案脚本的撰写，策划优质、有深度的新媒体内容，具备新媒体运营相关工作经验，熟悉抖音、小红书等短视频平台运营规则及特点；2、审美优、网感强，善于捕捉热点事件与话题，能将网络热点转化为适合公司营销的手段；3、完成日本房源短视频素材的剪辑、配音、讲解发布到短视频平台；4、运营多个账号（每日更新房源、讲解房源、直播）；5、能接受短期出差日本 2-3次/年；6、有日本工作经验或者会...,房地产中介,http://jobs.zhaopin.com/CCL1414613840J40791079405.htm,20人以下,2025-08-20 15:54:44
新媒体运营,厦门,厦门唯得家科技有限公司,大专,1-3年,"内容运营,短视频运营,品牌运营,TikTok,LinkedIn,Facebook,抖音,微信视频号,快手,家装类,医疗类,短视频平台,海外平台,企业官网",8000-12000元,新媒体运营涉及利用现代化的移动互联网手段，通过新兴媒体平台如抖音、快手、微信、微博等，进行产品的宣传、推广和营销。这包括策划与品牌相关的优质、高度传播性的内容，并通过线上活动向客户广泛或精准推送信息，以提高参与度和知名度，充分利用粉丝经济，达到营销目标。新媒体运营还涉及用户运营，如社群维护、用户反馈处理等，以及内容运营，如确定和调整内容输出，以满足用户需求和提升用户体验。此外，新媒体...,智能硬件,http://jobs.zhaopin.com/CCL1479160850J40533458708.htm,20-99人,2025-07-18 00:00:05
海外社媒内容运营专员,厦门,厦门泰东方健康管理有限公司,本科,1-3年,"抖音,微信公众号,小红书",8000-11000元,岗位职责1.海外社交媒体运营管理1）负责主流社交媒体平台（Facebook、Instagram、TikTok、YouTube、X、LinkedIn等）的日常内容发布、粉丝互动及评论区维护，通过优质内容提升账号活跃度与粉丝黏性。2） 协助策划符合品牌调性的图文、短视频、直播等内容，参与创意头脑风暴及本土化文案撰写，涵盖帖子话题、图片/视频文案、社交媒体推文、PR通告、广告文案、活动方案等。2. 流量...,卫生服务,http://jobs.zhaopin.com/CC330076730J40861776312.htm,100-299人,2025-12-21 15:34:39
新媒体专员（集团）,厦门,华厦眼科医院,本科,3-5年,"图文平台,短视频平台,医疗类",7000-11000元,岗位职责1.新媒体账号运营管理：结合眼科行业热点、用户兴趣及产品特点，策划制作爆款笔记，如患者故事、产品体验、干货合集等，提升账号知名度与影响力。制定各账号（小红书、抖音、快手等）的发布计划，根据平台流量高峰和用户活跃时间，合理安排发布时间，优化话题标签使用，提高内容曝光度。及时回复粉丝在评论区和私信的提问，维护良好的互动关系，增强粉丝粘性，实现粉丝增长和流量转化。2.患者互动与引流：根据目标患者...,卫生服务,http://jobs.zhaopin.com/CC217688310J40779134008.htm,1000-9999人,2025-08-15 23:02:51
新媒体运营专员,厦门,厦门联众搏程汽车服务有限公司,中专/中技,1-3年,"短视频平台,图文平台,海外平台,抖音,快手,小红书,微信视频号,汽车类",5000-10000元,岗位职责：1. 制定和执行公司线上推广方案，深度参与公司网站设计优化及品牌推广计划；2.开发新客户，拓展老客户的业务，建立和维护新老客户，引导客户需要挖掘销售机会并达成销售业绩；3、维护好部门内部资源，提高客户满意度；4、收集和分析市场数据，并定期反馈最新消息；5. 负责线上新媒体的日常更新运营，包括日常推送内容的策划、撰写发布、网络推广，粉丝的互动等；6. 协助公司网站的修改建设、内容更新及后台...,零售/批发,http://jobs.zhaopin.com/CC575099380J40816222611.htm,20-99人,2026-01-08 20:43:58
小红书文案专员,厦门,厦门易尔通,学历不限,经验不限,新媒体,6000-10000元,【招募小红书内容造梦师】我们不要文案工具人，只要会“种草”的创意玩家！你是不是那个朋友群里公认的“安利小能手”？是不是总能发现宝藏好物，并且三言两语就让大家疯狂心动？如果是，别犹豫，我们找的就是你！在这里，你写下的不是冰冷的文字，而是能点燃消费欲望的“魔法”。你的每一个标点，都将直接转化为品牌的增长与你的收入！岗位坐标：厦门软件园二期岗位名称： 小红书文案专员关于你，我们需要：笔下有“网感”： 深...,互联网,http://jobs.zhaopin.com/CC188190410J40821715814.htm,1000-9999人,2025-12-31 01:39:42
新媒体运营可小白,厦门,厦门市思明区黄美辉商贸行(个体工商户),学历不限,经验不限,,6000-10000元,1，本公司因为自研流量非常大，需要相对应流量助力及销售助理来分担2，小白也能做得很好，一周上手3，需要执行力强，零风险，无费用，免费培训！,新零售,http://jobs.zhaopin.com/CCL1505232930J40784279116.htm,20人以下,2025-12-29 15:33:02
新媒体运营（出镜）,厦门,无上智造科技有限公司,大专,1-3年,"短视频平台,家装类,短视频运营",6000-10000元,一、岗位核心1、核心：负责短视频内容的出镜、账号内容脚本和账号日常管理工作；2、外观要求：长相端正，长发黑发，身高165+，口齿清晰，普通话标准；3、工作要求：审美好、效率高、具备良好的沟通能力和学习能力；二、岗位职责1、内容脚本：与其他运营、摄像师配合、策划短视频的内容脚本，熟悉、演练、落地；2、核心应用：具备用户思维，结合产品卖点，设计爆款选题和内容；3、学历经验：大专学历以上、具备1年以上短...,建材,http://jobs.zhaopin.com/CCL1235684470J40969366804.htm,100-299人,2025-12-23 00:00:01
社媒运营专员,厦门,厦门中鑫之旅国际旅行社有限公司,大专,1-3年,"短视频平台,图文平台,海外平台,TikTok,YouTube,Facebook,小红书,今日头条,微信公众号,抖音,微信视频号,哔哩哔哩,旅游类,短视频运营,电商运营,品牌运营",6000-10000元,岗位内容：1. 负责公司社交媒体账号的日常管理和内容撰写；2. 根据公司营销计划，策划并执行各种类别的线上活动和推广；3. 追踪分析数据，不断优化社交媒体运营结果；4. 与其他部门合作，按需求完成其他任务。任职要求：1. 专科及以上学历，市场营销、新闻传媒或相关专业优先考虑；2. 具有1年以上新媒体运营相关经验，有成功案例者优先考虑；3. 熟悉社交媒体平台操作规则，具有优秀的文案撰写和编辑能力；4...,旅游服务,http://jobs.zhaopin.com/CCL1480295880J40817816107.htm,100-299人,2025-12-18 12:23:46
社媒的运营专员,厦门,厦门冠生精密科技有限公司,本科,1-3年,"图文平台,海外平台,YouTube,Facebook,小红书,医疗类,汽车类,新闻类,LinkedIn",6000-10000元,1：社交媒体职责：制定全球社媒战略、跨团队协调（市场/产品/客服）、预算管理、品牌一致性把控、绩效分析。要求：跨文化洞察力、英语专业、数据驱动决策经验。2.：内容策略师/内容创作者职责：规划多平台内容日历、设计图文/视频创意、本地化文案改编、热点追踪。要求：熟悉各平台内容调性（如TikTok的创意短片、LinkedIn的专业内容）、视觉设计或文案能力。3： 社区运营专员职责：评论回复、用户互动、危...,金属制品业,http://jobs.zhaopin.com/CCL1360648670J40905583808.htm,20-99人,2025-12-10 17:03:20
新媒体文案编辑/文案经理/文体旅品牌运营,厦门,厦门睿行文化发展有限公司,本科,3-5年,"短视频平台,微信视频号,微信公众号,小红书",6000-10000元·13薪,（一）岗位职责：1. 内容策划与创作：· 内容规划与策划：策划符合品牌调性和市场需求的内容，包括图文、视频、海报等多种形式，确保内容符合品牌定位与传播目标。· 创意内容：在理解品牌的基础上，能创新性地提出内容创意，结合市场趋势和受众需求，突破常规，提升内容的吸引力与影响力。· 品牌精准匹配：确保所有创作的内容能够准确传达品牌的核心信息，精准地传达品牌调性和价值观。2. 自媒体运营：· 平台日常运营...,体育,http://jobs.zhaopin.com/CC447235080J40749457203.htm,20-99人,2025-11-28 16:51:36
品牌内容出镜官,厦门,厦门艾威艾文化发展有限公司,本科,1年以下,"视频类,小红书",8000-10000元,职位描述 一、 岗位核心价值 本岗位是IAI品牌在数字时代的“形象代言人”与“内容连接器”。通过专业的出镜解说与内容策划，将IAI国际影像创意中心的专业能力、以及IAI全球设计奖的行业影响力，转化为生动、易懂、富有吸引力的视频内容。旨在提升品牌知名度、扩大受众圈层、并为业务增长赋能。 二、 岗位职责 1. 品牌内容策划与出镜（核心职责） ● 负责IAI全球设计奖的全年线上视频内容规划、脚本撰写与出...,广告/营销,http://jobs.zhaopin.com/CCL1448706020J40829529002.htm,20人以下,2025-11-25 15:55:33
小程序运营主管,厦门,厦门市商和商业管理有限公司,大专,1-3年,"小程序,内容运营",5000-10000元,岗位描述：1.负责微信小程序的日常运营、维护；2.优化微信小程序运营流程，提升用户体验3.后天数据分析管理，制定推广、运营计划4.完成上级安排的其他任务任职要求：1.具备微信小程序运营相关经验2.能够独立策划和执行运营活动3.有足够责任心，具备良好的沟通能力及协作能力4.有物业管理相关经验者优先,物业管理,http://jobs.zhaopin.com/CCL1439604810J40955961804.htm,20人以下,2025-11-25 15:19:53
新媒体运营专员·厦门(J11080),厦门,快乐学习(厦门)文化有限公司,本科,1-3年,"教育类,用户运营,社群运营,K12教育",6000-10000元,岗位职责: 1、负责抖音、视频号、小红书、社群等新媒体渠道资源开发； 2、主导直播和创意视频项目的推进与执行，发掘提炼用户需求，提高用户的关注度和粘性； 3、持续做资源积累和促成课程签单转化。 任职要求: 1、有1年以上的新媒体运营经验，有直播和短视频IP人设包装经验优先； 2、对抖音、微信等短视频平台了解，熟悉短视频平台的制作规范； 3、有熟练的镜头语言，思维活跃。 更加详细的岗位职责及任职要求...,培训/辅导服务,http://jobs.zhaopin.com/CCL1481350920J40576937706.htm,1000-9999人,2025-11-08 15:27:57
运营经理,厦门,厦门艾威艾文化发展有限公司,本科,3-5年,"文本类,视频类,小红书,微信公众号",8000-10000元,一、岗位职责1. 内容策略与创作： 制定并执行年度新媒体运营策略，负责IAI全球设计奖官网、微信公众平台、微博、小红书、Instagram、LinkedIn等海内外社交媒体的日常内容规划、创作、编辑与发布。 创作高质量、多形态的内容（包括但不限于图文、海报、短视频、H5、直播等），内容方向涵盖：设计作品解读、评委/获奖者专访、行业趋势分析、赛事资讯、活动预告等。 独立完成或协调外包团队完成图片处理...,广告/营销,http://jobs.zhaopin.com/CCL1448706020J40811118402.htm,20人以下,2025-11-25 15:55:23
自媒体内容运营师,厦门,白金海岸(厦门)营销管理有限公司,大专,3-5年,"视频类,健康类,小红书,营养品",8000-10000元,岗位要求：1、从事过调理营养品自媒体内容营销 2 年以上2、有相关营养品知识或经验3、从事过母婴行业自媒体内容营销工作职责：1、小红书和视频号搭建2、对接小红书运营团队3、对接视频拍摄团队4、编辑拍摄视频角本5、每天出产品相关朋友圈内容 3-5 条6、搭建线上运营团队,零售/批发,http://jobs.zhaopin.com/CC654335720J40900775915.htm,20-99人,2025-11-05 13:54:31
资深文案策划,厦门,厦门大哲新能源集团有限公司,本科,1-3年,"广告类,新媒体",6000-10000元,工作职责：1、负责各类广宣文章或活动方案的策划与撰写，对内容与创意负责。2、协同团队，完成各类品宣创意的输出与优化。3、高效沟通，有效推进各类方案的定稿与落地。4、日常各媒体平台的独立运营管理，与用户互动，并收集整理各类平台数据与用户反馈。5、微信公众号，策划优质文章和宣传模式，提供有内容的文章和服务。6、高效执行上级安排的其他任务。任职资格：1、本科以上学历，中文、新闻学、传播学、广告等相关专业...,摩托车/自行车制造,http://jobs.zhaopin.com/CCL1512232610J40897969508.htm,20-99人,2025-11-04 14:59:30
新媒体运营,厦门,厦门艾威艾文化发展有限公司,本科,1-3年,"运营策划,设计排版,内容创新,微信,微博,小红书",7000-10000元,岗位职责：1. 内容策划与创作（35%）内容规划：参与制定并执行IAI全年新媒体内容日历，围绕IAI奖项征集、评审、颁奖典礼、设计节及“破圈”活动（如“古物新生”挑战赛、设计便利店快闪等）等关键节点，策划高质量、高传播度的内容主题。内容制作：独立创作符合品牌调性的多媒体内容，包括但不限于：图文内容：微信公众号、微博、小红书等平台的文案、海报、长图文。视频内容：策划并协调制作短视频（抖音、B站）、v,广告/营销,http://jobs.zhaopin.com/CCL1448706020J40506808202.htm,20人以下,2025-11-25 15:55:15
资深新媒体运营专员,厦门,厦门小题旅行科技有限公司,大专,1-3年,"短视频平台,图文平台,小红书,微博,微信公众号,内容运营,电商运营,用户运营",7000-10000元,（一）岗位职责：1、负责微信（公众号、视频号）、微博、小红书、抖音等新媒体平台的创意内容策划、撰稿、 排版制作、日常运维等工作；2 、根据甲方需求及不同平台玩法规则和传播规律，策划选题，制定内容方案及撰稿执行， 对账号数据负责；3、协调与沟通制作过程中相关环节工作，并保证作品质量；4、定时对所负责账号进行阶段性复盘及优化方案提报；5、熟悉微信（公众号、视频号）、微博、小红书、抖音等各大社交产品属性...,广告/营销,http://jobs.zhaopin.com/CCL1381644200J40844349412.htm,500-999人,2025-10-30 13:42:40
领英运营（LinkedIn）,厦门,厦门亚迅工贸有限公司,大专,1-3年,"海外平台,LinkedIn",6000-10000元,【福利】双休+法定假期+带薪年假；团队旅游+节日礼盒+生日福利+过节费+周年感恩；丰富的下午茶+团建+中秋+尾牙宴+女神节+七夕+圣诞节+感恩节；六险一金+各种管理福利；无敌海景办公室，让你面朝大海春暖花开。 一、工作内容 1.独立负责公司产品在海外主流社交平台，LinkedIn（领英）， Facebook等，日常运营、图文及短视频内容发布。 2.用户关系及社群管理，积极与用户互动，构建高活跃度和...,贸易/进出口,http://jobs.zhaopin.com/CC558406620J40720250906.htm,20-99人,2025-10-19 00:24:22
新媒体运营专员,厦门,福建惊鸿传媒有限公司,大专,1-3年,"短视频平台,图文平台,小红书,抖音,旅游类,内容运营,短视频运营,用户运营,旅拍,写真",6000-10000元,岗位职责执行日更内容制作（图文排版、短视频剪辑），确保发布及时率；维护评论区互动，筛选高价值客资并引导成交。任职要求经历：1-2年新媒体执行经验，熟练使用剪映/CAPCUT/PS等工具；旅拍/本地生活类账号运营经历优先。能力：执行力强（日处理素材≥20条）+网感敏锐（热梗迁移能力）。,旅游服务,http://jobs.zhaopin.com/CCL1498765250J40779519713.htm,100-299人,2025-05-19 14:54:22
新媒体运营,厦门,厦门小题旅行科技有限公司,大专,1-3年,"短视频平台,图文平台,小红书,微信公众号,微博,抖音,哔哩哔哩,微信视频号",6000-10000元,【岗位职责】1、负责新媒体平台（小红书/抖音/公众号/B站/视频号）创意内容策划、撰稿、排版制作及日常运维等工作；2、根据甲方需求结合平台玩法规则和传播规律，策划选题，制定内容方案及撰稿执行，对账号数据负责；3、协调与沟通后端小伙伴把控相关环节工作，并保证作品质量；4、定时对所负责账号进行阶段性复盘及优化方案提报；【任职资格】1、具备新媒体平台账号运营经验，有头部品牌账号运营经验优先；2、有较好的...,广告/营销,http://jobs.zhaopin.com/CCL1381644200J40844299812.htm,500-999人,2025-10-30 11:08:57
新媒体运营主管,厦门,厦门市东万晟贸易有限公司,中专/中技,1-3年,"小红书,微信公众号,抖音",6000-10000元,岗位职责：1、负责公司（美赞臣及A2等成人营养品及公司其它产品）在抖音、微视频、小红书平台店铺的日常运营管理，包括销售引流、内容更新、用户互动、活动策划等运营及推广工作；2、监测平台数据，分析用户行为，提出优化建议，提升平台的用户体验和活跃度。3、与各部门协作，推动平台的推广和营销工作，提高平台的知名度和影响力。4、处理用户反馈和投诉，维护良好的用户关系。5、定期复盘各项执行活动并总结经验；6、服...,贸易/进出口,http://jobs.zhaopin.com/CC261280310J40703413716.htm,100-299人,2025-04-25 00:15:21
新媒体运营,厦门,厦门阔一心理科技有限公司,大专,3-5年,"短视频平台,图文平台,微信公众号,小红书,抖音,快手,微信视频号,教育类,科普类",7000-9000元,岗位职责：独立负责一个或多个核心运营模块（如用户增长、活动策划、内容体系等）。需具备较强的数据分析、策略规划和项目推动能力，能独立解决复杂运营问题，并对核心业务指标（如用户增长、活跃、转化等）负责。1. 核心模块运营与执行 (约50%)· 独立负责一个或多个核心运营模块的策略制定与日常执行，如：· 用户增长：策划并执行有效的拉新、促活、留存策略，对用户增长成本及效率负责；· 内容运营：规划内容体系...,科学技术推广,http://jobs.zhaopin.com/CCL1496959980J40915338615.htm,20-99人,2026-01-09 11:00:00
双休内容运营,厦门,福建云赢文化传媒有限公司,本科,1-3年,"视频类,抖音",5000-9000元,上班时间：9:00-12:00 13:30-18:30周末双休，五险一金，法定节假日岗位内容：1、负责制定项目的抖音品牌规划与推广方案，并确认方案的有效落实与执行；2、独立策划以线上为主的项目活动，有较好组织协调能力确保项目顺利交付，并结案。3、独立完成短视频内容策划与制作，包括脚本撰写、拍摄指导、视频剪辑(如使用剪映、Pr等工具)，确保视频质量符合平台调性；4、对付费流量有自己的理解，有过投放经...,互联网,http://jobs.zhaopin.com/CCL1312375600J40800509607.htm,100-299人,2025-10-15 10:38:24
党群干事,厦门,中交(福清)投资有限公司,本科,1-3年,"编辑,资料管理,党务工作",5000-8000元,"岗位职责：负责日常党务及宣传工作。任职条件（基本要求）：（1）本科及以上学历毕业，,1年以上工作经验；（2）目标感强，责任心强，有担当意识，善于学习总结，勤勉敬业；（3）认同公司文化，有大局意识。（专项要求）：（1）具备所应聘岗位工作经历1年以上；（2）具备所应聘岗位至少1项专业特长，并能独立自主开展相关工作；（3）具备较好的创新意识、服务意识，能适应公司转型发展需要； （4）中共党员。 职位福利...",工程施工,http://jobs.zhaopin.com/CC572264820J40137301008.htm,300-499人,2026-01-09 01:19:45
新媒体运营专业主管,厦门,厦门宝龙商盛商业管理有限公司,本科,3-5年,"内容运营,短视频运营,活动运营,小红书,微信公众号,抖音,微信视频号,短视频平台,图文平台,企业官网",6000-8000元,岗位职责：1、负责商业管理类自媒体矩阵日常运营（包括但不限于小红书、抖音、视频号等新媒体平台），产出适配社区、商业客群的优质内容(如活动预告、项目亮点)，提升精准粉丝量与品牌影响力，有独立运作企业IP账号经验的优先。2、策划并落地主题市集、沙龙等线下活动，覆盖创意构思、资源搭建及执行全流程3、聚焦非传统商业，关注行业趋势与竞品动态，挖掘创新运营玩法，形成差异化优势。4、协同招商、营运等部门推进商业...,景区/商业/市场等综合管理,http://jobs.zhaopin.com/CCL1363303680J40808020707.htm,20-99人,2026-01-09 00:08:02
文案策划,厦门,厦门科大慧明企业管理咨询有限公司,本科,1-3年,"活动文案,新媒体文案,市场策划,文案策划",6000-8000元,一、岗位职责： 1.根据商务反馈的客户需求，完成项目方案（培训、实训、咨询服务等各类方案）制作 2.结合客户方案进行方案优化与调整 3.月度/季度/年度中单数据分析及方案优化 4.结合运营商发展动态进行方案优化与完善 5.招投标策划（协助商务/销售输出技术规划书） 6.投标文件中技术方案的制作 7.年度产品手册文案输出二、岗位要求 1. 学历本科及以上学历 2.基本的文案编撰与逻辑能力，较强的提炼...,咨询服务,http://jobs.zhaopin.com/CC441111420J40118878207.htm,20-99人,2025-12-31 09:11:00
新媒体运营,厦门,福建金算子投资集团有限公司,大专,3-5年,"内容运营,短视频运营,产品运营,微信公众号,小红书,知乎,抖音,快手,微信视频号,金融类,短视频平台,图文平台",6000-8000元·13薪,【岗位职责】1.账号运营与推广:负责公司账号的付费投放。同时，需要负责投放效果的数据分析，监控后台数据并及时调整投放策略和优化方案，2.数据分析与优化:统计并分析每日的推广数据，结投放问题，评估投放效果，并提升调整优化方案。3.市场研究与竞品分析:收集市场同类产品投放信息，了解竞品投放方案，做出分析，优化投放策略提升广告效果。4.创意与内容制作:与短视频创作团队沟通协调，针对不同产品及市场提出明确...,商业代理服务,http://jobs.zhaopin.com/CC254893730J40851360013.htm,20-99人,2025-12-24 08:48:42
电商运营（旅游版块）,厦门,武夷山运通国际旅行社有限公司厦门分公司,大专,1-3年,"小红书,抖音,快手,微信视频号,旅游类,短视频运营,产品运营,品牌运营,电商,旅游,短视频平台,图文平台",5000-8000元,“我们是一家年轻的旅游电商公司，专注于【小众深度游/高性价比自由行/奢华度假】 致力于打造“发现-体验-分享”的一站式旅行新生态。 我们的使命不仅是卖产品，更是传递旅行带来的惊喜、感动和成长。现因业务飞速扩张，诚挚邀请热爱旅行、充满激情、敢于创新的你加入我们的星辰大海！岗位职责：1、小红书、 视频号、抖音等旅游账号运用多种营销方案，通过引流提升转化率、曝光率；2、分析数据反馈，优化内容策略，提高内...,旅游服务,http://jobs.zhaopin.com/CCL1512807140J40816834007.htm,20人以下,2025-12-16 15:28:30
tiktok运营助理(接受应届生),厦门,厦门抖歌传媒有限公司,学历不限,无经验,"电商运营,直播运营",4000-8000元,你想带薪刷抖音吗？工作轻松，经验不限，学历不限，懂得刷抖音即可上岗，欢迎应届生，小白加入我们的大家庭！ 工作内容： 在tiktok国外抖音直播间寻找符合要求的直播艺人，邀请艺人加入我们的公会，不用担心语言问题，有翻译软件 手机聊天轻松搞定，前期有人带 无责底薪4000+提成，上不封顶 上班时间：8:00-17:00 不定期下午茶和聚餐，公司都是00后氛围轻松融洽，欢迎你的加入。 公司带薪培训，法定...,新媒体,http://jobs.zhaopin.com/CCL1502613170J40809493005.htm,20-99人,2025-12-16 14:48:18
新媒体专员,厦门,厦门英诺尔电子科技股份有限公司,大专,1-3年,"短视频运营,产品运营,内容运营",6000-8000元,岗位职责： 1、负责企业新媒体平台（抖音/视频号/B站/小红书等）短视频创意策划、脚本撰写及分镜设计，视频内容发布、粉丝互动及评论区维护，跟踪视频数据（播放量、完播率、转化率等），优化运营策略； 2、独立完成视频拍摄、后期剪辑、特效包装、配音配乐及字幕制作； 3、制作新媒体平台配图、海报、长图、H5等视觉素材； 4、配合营销活动设计品牌宣传物料（如活动主视觉、产品介绍图等）； 5、联动市场、产品等...,电子/半导体/集成电路,http://jobs.zhaopin.com/CC205042510J40716372702.htm,100-299人,2025-12-16 14:22:08
