职位,城市,公司,学历,经验,技能,薪资,工作描述,行业,职位URL,公司规模,发布时间
新媒体运营专业主管,厦门,厦门宝龙商盛商业管理有限公司,本科,3-5年,"内容运营,短视频运营,活动运营,小红书,微信公众号,抖音,微信视频号,短视频平台,图文平台,企业官网",6000-8000元,岗位职责：1、负责商业管理类自媒体矩阵日常运营（包括但不限于小红书、抖音、视频号等新媒体平台），产出适配社区、商业客群的优质内容(如活动预告、项目亮点)，提升精准粉丝量与品牌影响力，有独立运作企业IP账号经验的优先。2、策划并落地主题市集、沙龙等线下活动，覆盖创意构思、资源搭建及执行全流程3、聚焦非传统商业，关注行业趋势与竞品动态，挖掘创新运营玩法，形成差异化优势。4、协同招商、营运等部门推进商业...,景区/商业/市场等综合管理,http://jobs.zhaopin.com/CCL1363303680J40808020707.htm,20-99人,2026-01-09 00:08:02
短视频运营专员,厦门,厦门酒行家进出口有限公司,大专,1-3年,"抖音,快手,小红书",6000-8000元,一、岗位职责1. 独立完成短视频选题、脚本撰写，把控内容调性，兼顾趣味性与传播性；2. 担任出镜角色，以甜美声音完成口播/演绎，负责拍摄统筹（场景、镜头等），保障画面质感；3. 负责短视频剪辑、配乐、字幕等后期制作，确保成片符合平台标准（抖音/视频号等）；4. 运营账号日常更新，跟进播放量、转化等数据，优化内容策略；5. 回复评论/私信维护粉丝，植入产品/活动信息助力引流转化；二、任职要求1. 大...,贸易/进出口,http://jobs.zhaopin.com/CC376083630J40866604703.htm,20-99人,2025-12-31 15:50:03
文案策划,厦门,厦门科大慧明企业管理咨询有限公司,本科,1-3年,"活动文案,新媒体文案,市场策划,文案策划",6000-8000元,一、岗位职责： 1.根据商务反馈的客户需求，完成项目方案（培训、实训、咨询服务等各类方案）制作 2.结合客户方案进行方案优化与调整 3.月度/季度/年度中单数据分析及方案优化 4.结合运营商发展动态进行方案优化与完善 5.招投标策划（协助商务/销售输出技术规划书） 6.投标文件中技术方案的制作 7.年度产品手册文案输出二、岗位要求 1. 学历本科及以上学历 2.基本的文案编撰与逻辑能力，较强的提炼...,咨询服务,http://jobs.zhaopin.com/CC441111420J40118878207.htm,20-99人,2025-12-31 09:11:00
新媒体运营,厦门,福建金算子投资集团有限公司,大专,3-5年,"内容运营,短视频运营,产品运营,微信公众号,小红书,知乎,抖音,快手,微信视频号,金融类,短视频平台,图文平台",6000-8000元·13薪,【岗位职责】1.账号运营与推广:负责公司账号的付费投放。同时，需要负责投放效果的数据分析，监控后台数据并及时调整投放策略和优化方案，2.数据分析与优化:统计并分析每日的推广数据，结投放问题，评估投放效果，并提升调整优化方案。3.市场研究与竞品分析:收集市场同类产品投放信息，了解竞品投放方案，做出分析，优化投放策略提升广告效果。4.创意与内容制作:与短视频创作团队沟通协调，针对不同产品及市场提出明确...,商业代理服务,http://jobs.zhaopin.com/CC254893730J40851360013.htm,20-99人,2025-12-24 08:48:42
电商运营（旅游版块）,厦门,武夷山运通国际旅行社有限公司厦门分公司,大专,1-3年,"小红书,抖音,快手,微信视频号,旅游类,短视频运营,产品运营,品牌运营,电商,旅游,短视频平台,图文平台",5000-8000元,“我们是一家年轻的旅游电商公司，专注于【小众深度游/高性价比自由行/奢华度假】 致力于打造“发现-体验-分享”的一站式旅行新生态。 我们的使命不仅是卖产品，更是传递旅行带来的惊喜、感动和成长。现因业务飞速扩张，诚挚邀请热爱旅行、充满激情、敢于创新的你加入我们的星辰大海！岗位职责：1、小红书、 视频号、抖音等旅游账号运用多种营销方案，通过引流提升转化率、曝光率；2、分析数据反馈，优化内容策略，提高内...,旅游服务,http://jobs.zhaopin.com/CCL1512807140J40816834007.htm,20人以下,2025-12-16 15:28:30
tiktok运营助理(接受应届生),厦门,厦门抖歌传媒有限公司,学历不限,无经验,"电商运营,直播运营",4000-8000元,你想带薪刷抖音吗？工作轻松，经验不限，学历不限，懂得刷抖音即可上岗，欢迎应届生，小白加入我们的大家庭！ 工作内容： 在tiktok国外抖音直播间寻找符合要求的直播艺人，邀请艺人加入我们的公会，不用担心语言问题，有翻译软件 手机聊天轻松搞定，前期有人带 无责底薪4000+提成，上不封顶 上班时间：8:00-17:00 不定期下午茶和聚餐，公司都是00后氛围轻松融洽，欢迎你的加入。 公司带薪培训，法定...,新媒体,http://jobs.zhaopin.com/CCL1502613170J40809493005.htm,20-99人,2025-12-16 14:48:18
新媒体专员,厦门,厦门英诺尔电子科技股份有限公司,大专,1-3年,"短视频运营,产品运营,内容运营",6000-8000元,岗位职责： 1、负责企业新媒体平台（抖音/视频号/B站/小红书等）短视频创意策划、脚本撰写及分镜设计，视频内容发布、粉丝互动及评论区维护，跟踪视频数据（播放量、完播率、转化率等），优化运营策略； 2、独立完成视频拍摄、后期剪辑、特效包装、配音配乐及字幕制作； 3、制作新媒体平台配图、海报、长图、H5等视觉素材； 4、配合营销活动设计品牌宣传物料（如活动主视觉、产品介绍图等）； 5、联动市场、产品等...,电子/半导体/集成电路,http://jobs.zhaopin.com/CC205042510J40716372702.htm,100-299人,2025-12-16 14:22:08
新媒体运营,厦门,厦门市思明区为国苏兰商贸行(个体工商户),学历不限,经验不限,"网络销售,自媒体,新媒体营运",4000-8000元,因为自研引流方法流量太大所以需要人来帮我分担小白宝妈也可 无费用0风险负风险 一周上手时间自由，不耽误接送孩子 我们主要做各(个公寓平台引流获客到私域(微信)然后成交产品招募代理商 我们需要的不单是员工，更是一位志同道合的事业合作伙伴且收入高时间自由,零售/批发,http://jobs.zhaopin.com/CCL1515105120J40813117901.htm,20人以下,2025-12-09 19:32:30
tiktok直播运营,厦门,厦门抖歌传媒有限公司,学历不限,经验不限,"抖音,电商类,TikTok",4000-8000元,"1、通过线上的渠道完成达人主播的邀约、招募工作;2、艺人日常管理,包括工作安排以及工作情况跟踪,引导艺人产生优质直播内容;3、负责跟进主播的咨询、投诉、建议的反馈;处理工作中遇到的各种问题并提出合理的解决方案;4、分析直播艺人、网红、达人各项数据及及时反馈;5、按时完成上级领导交办的其他事宜。任职要求:1、有主播、短视频达人资源的优先考虑;2、了解抖音/快手等短视频平台,热爱直播行业,有直播运营经...",新媒体,http://jobs.zhaopin.com/CCL1502613170J40779131405.htm,20-99人,2025-12-16 14:48:12
视频运营专员,厦门,厦门眼科中心有限公司,本科,3-5年,"抖音,快手,小红书",6000-8000元,岗位职责：1.负责公司日常抖音账号的选题挖掘、剧本撰写，脚本以及分镜策划2.整合各种创意，新奇，有趣的内容3.跟进自己的剧本拍摄（现场导戏），安排布景、服装道具的事项，及时场控场能力。4.会拍摄、会懂得镜头语言，可自行成片（硬要求）任职能力要求：1.熟悉了解抖音平台规则2.性格外向，脑洞大，幽默风趣3.良好的文案写作能力，有相关作品者优先4.沟通能力强，能独立完成拍摄时各方的沟通协调工作5.会PR...,卫生服务,http://jobs.zhaopin.com/CC368170480J40826703310.htm,500-999人,2025-12-09 15:48:39
新媒体内容运营专员,厦门,厦门中思诺新材料有限公司,本科,1-3年,"短视频平台,图文平台,企业官网,微信公众号,小红书,内容运营",5000-8000元,岗位内容： 1. 协同开展品牌策略规划和品牌推广工作，提高品牌知名度和美誉度；2. 研究市场环境，掌握市场需求和发展趋势，为品牌制定有效的营销方案；3. 会新媒体账号运营（小红书、视频号、抖音等）4. 根据品牌传播需要，协调内部资源，完成其他相关工作。5.有热点、脚本，拍摄剪辑经验的优先考虑任职要求：1. 熟悉市场营销基本理论，具备2年以上相关工作经验；2. 具备较强的数字素养和商业敏感度，熟练使...,房地产开发,http://jobs.zhaopin.com/CC572259720J40803862803.htm,20-99人,2025-11-28 15:43:38
新媒体运营助理,厦门,厦门抖歌传媒有限公司,学历不限,无经验,"短视频平台,海外平台,TikTok",4000-8000元,你想带薪刷抖音吗？工作轻松，经验不限，学历不限，懂得刷抖音即可上岗，欢迎应届生，小白加入我们的大家庭！工作内容：在tiktok国外抖音直播间寻找符合要求的直播艺人，邀请艺人加入我们的公会，不用担心语言问题，有翻译软件手机聊天轻松搞定，前期有人带无责底薪4000+提成，上不封顶上班时间：8:00-17:00不定期下午茶和聚餐，公司都是00后氛围轻松融洽，欢迎你的加入。公司带薪培训，法定节假日，不加班...,新媒体,http://jobs.zhaopin.com/CCL1502613170J40789255605.htm,20-99人,2025-12-16 14:48:08
小红书运营,厦门,厦门臻晟熠锦传媒有限公司,学历不限,经验不限,"用户运营,产品运营,内容运营,财经",4000-8000元,岗位职责:1.负责小红书平台的内容策划与执行，包括但不限于文章创作、图片编辑与视频制作。2.监控并分析平台用户行为，根据数据反馈优化内容策略。3.与用户进行互动交流，增强平台活跃度，提升用户粘性。4.跟踪最新网络趋势，不断更新内容，提高用户参与度任职要求:1.对社交媒体运营有浓厚兴趣，具备良好的内容创作能力2.熟悉互联网及社交平台规则，能够有效管理账号。3.具备良好的沟通能力和团队合作精神，能够与...,社交网络,http://jobs.zhaopin.com/CCL1507916020J40801335412.htm,20-99人,2025-11-19 12:49:06
社交媒体运营,厦门,惠尔康东方(厦门)食品有限公司,本科,3-5年,,6000-8000元,场景化社媒策略制定：研究各平台用户场景特性，制定差异化场景营销方案，规划月度 / 周度内容排期，监测竞品动态并优化自身策略。 场景化内容运营：适配平台特性分发内容、优化传播效果，发起 UGC 活动强化用户共鸣，审核场景化内容确保合规准确。 用户互动与社群运营：精准互动场景内容留言提升共鸣，运营场景化社群提活跃，收集用户场景需求并反馈至相关团队。 推广与效果优化：定向投放场景内容提升触达，监测营销核...,快速消费品,http://jobs.zhaopin.com/CC625155520J40855385703.htm,1000-9999人,2025-11-14 00:00:02
新媒体运营,厦门,北京鹏龙行汽车贸易有限公司,大专,1-3年,"短视频平台,抖音,汽车类,短视频运营,直播运营,品牌运营",7000-8000元,岗位职责：1、负责公司新媒体平台（包括但不限于微信、微博、抖音等）的内容策划与运营管理；2、制定并执行新媒体营销策略，提升品牌影响力和用户互动率；3、分析新媒体数据，优化内容发布策略，提高用户转化率和粉丝增长率；4、与团队协作，定期策划并执行线上线下活动，增强用户粘性；任职要求：1、具备丰富的社交媒体运营经验，熟悉各平台运营规则和用户行为；2、优秀的文案撰写能力，能够创作吸引目标用户的内容；3、具...,汽车4S店/经销商,http://jobs.zhaopin.com/CC197057810J40805083301.htm,1000-9999人,2025-11-10 09:18:27
tiktok运营助理,厦门,厦门抖歌传媒有限公司,学历不限,经验不限,TikTok,4000-8000元,工作内容:1、通过国际抖音Tik Tok平台完成达人主播的邀约、招募工作；2、主要负责海外抖音Tik Tok账号管理、运营和推广，完成所负责Tik Tok账号的粉丝增长；3、工作轻松，稳定，难度低上手快，市场空间大；公司提供账号手机工位电脑，配备翻译器；4、熟知短视频平台热点、玩法、新功能，了解并善用平台规则和机制。工作时间：08：00-17：00薪资待遇：无责底薪4k+提成 试用期2个月综合工资...,新媒体,http://jobs.zhaopin.com/CCL1502613170J40780018805.htm,20-99人,2025-10-31 16:02:34
直播运营,厦门,厦门正弘升光学科技有限公司,本科,1-3年,"抖音,天猫,淘宝,电商类",6000-8000元,岗位职责：1、协助店铺日常维护、产品更新、能操作店铺陈列，以增强店铺吸引力、产品销量；2、协助网络店铺推广，提高店铺点击率和浏览量，完成商城店铺销售目标；3、店铺促销活动策划执行，与其他部门沟通相关配合工作；4、商品跟进，数据解读，对近期销售情况制表上报，提出改进方案；5、定期策划店铺活动，提升店铺名气，聚集流量和人气，形成销售；6、整理每日、周、月监控的数据：流量数据、营销数据、交易数据、产品管...,耐用消费品,http://jobs.zhaopin.com/CCL1223434890J40749576310.htm,100-299人,2025-10-29 09:35:26
短视频运营,厦门,厦门好给力网络有限公司,大专,1-3年,"快手,抖音,剪辑,千川",6000-8000元,【岗位职责】1、熟悉平台运营规则，负责品牌在平台0-1搭建和运营，对相关运营结果、数据负责；2、分析竞品账号运营方式、分析粉丝特性、规划账号运营方向，提高品牌曝光，获取流量。3、了解平台规则，全面把控视频及图文内容输出，跟踪推广效果，提高品牌内容质量和曝光度。4、负责的日常内容的发掘、编辑、发布、维护、管理、热点跟进、话题制造等工作，提高账号影响力和关注度等。5、跟进用户反馈和评论，及时回复和解决...,互联网,http://jobs.zhaopin.com/CC552992880J40735051516.htm,100-299人,2025-10-22 11:36:22
媒体宣传岗（莆田万象汇）,厦门,华润置地,本科,1-3年,"短视频平台,企业官网,图文平台,微信公众号,小红书,微博,抖音,哔哩哔哩,微信视频号,内容运营,短视频运营,活动运营,商业,舆情管控",6000-8000元,岗位职责：1、负责根据经营及推广策略，制定微博/微信/抖音/一点万象等自媒体平台运营策略；2、对接新媒体运营公司，负责自媒体内容输出，确保策略落地；3、对接营运/客关等相关部门，收集租户及会员信息和需求，配合自媒体内容输出；4、自媒体平台运营及粉丝互动，提升粉丝活跃度；5、为自媒体粉丝量/活跃度/转化率负责；6、负责以微信为主导的社群运营和管理，跨界整合社群资源；7、负责整体社群运营流程与体系的梳...,房地产开发,http://jobs.zhaopin.com/CC358101520J40814141905.htm,10000人以上,2025-09-29 09:28:48
电商内容运营专员,厦门,厦门正弘升光学科技有限公司,本科,1-3年,小红书,6000-8000元,岗位职责：1、负责品牌小红书账号的内容运营，包含内容选题创作、排期、规划和发布，确保高质量输出；2、负责小红书账号的日常运营维护，包含但不限于粉丝互动、评论维护、账号直播跟进等，并进行数据分析（账号画像粉丝量、阅读量、点赞量、评论维护等），提升粉丝量，完成每个阶段KPI；3、挖掘行业卖点，消费者痛点/场景，分析产品优势，形成反馈数据报告，提出有效内容优化方向；4、协助小红书、抖音KOL、KOC等媒...,耐用消费品,http://jobs.zhaopin.com/CCL1223434890J40816208010.htm,100-299人,2025-10-29 09:22:46
tiktok运营助理,厦门,厦门贝多森文化传媒有限公司,学历不限,经验不限,TikTok,4000-8000元,"工作内容:1、通过线上的渠道完成达人主播的签约、招募工作;2、艺人日常管理,包括工作安排以及工作情况跟踪,引导艺人产生优质直播内容;3、负责跟进主播的咨询、投诉、建议的反馈；处理工作中遇到的各种问题并提出合理的解决方案;4、分析直播艺人、网红、达人各项数据及及时反馈;5、按时完成上级领导交办的其他事宜。任职要求:1、有主播、短视频达人资源的优先考虑;2、了解抖音/快手等短视频平台,热爱直播行业,有...",电子商务,http://jobs.zhaopin.com/CCL1389617090J40716189501.htm,20-99人,2025-07-30 00:12:21
新媒体客服人员,厦门,福建美穗科技有限公司,高中,1-3年,"售前客服,电话客服,网络客服",4000-8000元,岗位职责：1. 负责日常客户咨询、投诉及建议的受理，通过电话、在线聊天、邮件等渠道提供专业、高效的客户服务； 2. 准确记录客户问题并及时跟进处理，确保客户需求得到有效解决； 3. 熟悉公司产品或服务流程，解答客户疑问并推荐合适的解决方案； 4. 处理订单查询、物流跟踪、退换货等售后问题，提升客户满意度； 5. 收集和反馈客户意见，协助优化产品和服务流程； 6. 完成上级安排的其他客户服务相关工作...,美发/美容/保健,http://jobs.zhaopin.com/CCL1375766670J40695075806.htm,100-299人,2025-07-17 14:42:56
小红书运营,厦门,厦门保驾护航网络科技有限公司,学历不限,经验不限,,4000-8000元,岗位职责：接受小白！1. 负责公司小红书矩阵号运营，了解小红书平台的玩法及机制，负责运营号内容策划、执行、能够通过内容、话题等，增加用户量及用户粘性，不断进行引流2. 根据对赛道的理解和分析，后期可以不断优化内容、持续输出优质笔记【任职要求】：1. 熟悉小红书等平台的操作流程、玩法规则，具备创意文案撰写、编辑、运营能力，敏锐“网感””，高度理解新媒体营销传播环境，紧跟趋势；2. 有小红书引流及获客...,互联网,http://jobs.zhaopin.com/CC223518680J40765672314.htm,100-299人,2025-06-12 15:29:40
直播运营助理,厦门,厦门果粒文化传媒有限公司,学历不限,经验不限,"抖音,快手,虎牙直播,游戏类",4000-8000元,【岗位职责】1、负责维护直播间秩序、日常直播间管理2、调节直播间气氛，带动粉丝积极性，配合主播节奏3、负责主播培训、考核、评估4、负责辅助日常数据统计分析，直播复盘5、调整直播间设备、灯光【任职要求】1、具备较好的沟通表达能力；2、学习能力、行动力强，反应快、有耐心；3、具备良好的服务意识和团队精神；3、有直播运营经验优先考虑工作时间: 8小时排班制薪资:底薪+团队收益提成 公司优势：*福利:五险...,新媒体,http://jobs.zhaopin.com/CCL1500308260J40894212704.htm,20-99人,2025-06-01 20:30:45
抖音直播运营,厦门,厦门贝多森文化传媒有限公司,学历不限,1-3年,"主播,内容运营,直播策划,主播运营,抖音直播",4000-8000元,岗位职责： 岗位职责：1、通过单位提供的线上渠道与达人主播进行沟通达成邀约;2、维护已加入公会的艺人主播，协助优化直播内容及直播互动;3、艺人日常管理，跟进主播咨询、投诉、及建议反馈并及时处理4、配合主管的工作安排; 任职要求： 1.有相关的工作经验和主播运营经验 2.熟悉直播平台规则、玩法及主播排名方法，拥有机构网红资源优先，懂得数据分析 3.有网感，对社会热点敏感度高 4.早晚班自选 （8:0...,电子商务,http://jobs.zhaopin.com/CCL1389617090J40242022701.htm,20-99人,2025-05-27 00:08:00
新媒体运营策划,厦门,智联招聘,本科,1-3年,"内容运营,活动运营,品牌运营,图文平台,微信公众号,小红书",5000-7000元,工作内容：1.辅助社群管理人完成社群内容发布；2.结合宣发要求，独立进行月度社群传播活动规划，活动总结和推广建议3.基于月度策划，独立输出月度内容工具包，可能包含行业案例（会提供素材），创意物料设计demo，视频脚本demo（无需设计和拍摄，但需对接他人完成）4.运维数据监测平台，更新和监测新媒体账号数据，汇总可视化报表5.对接供应商，结合月度和周度投放目标进行广告投流，复盘达成情况及经验招聘要求...,互联网,http://jobs.zhaopin.com/CCL1501502560J40834526814.htm,1000-9999人,2026-01-04 11:23:45
内容营销专员,厦门,中因(厦门)生物科技有限公司,大专,1-3年,"小红书,微信公众号,抖音",5000-7000元,主要职责1. 内容创作：独立负责小红书、微信视频号等平台的图文及短视频内容策划和内容发布。2. 账号运营：负责上述账号的日常更新、维护、粉丝互动与数据分析，制定并执行内容日历。3. 热点追踪：持续关注保健品行业、生活方式领域热点，快速策划并产出相关选题内容。4. 引流转化：设计内容中的引流策略，将公域流量引导至店铺或私域，并跟踪分析内容带来的转化效果。5. 商务对接：初期需要参与达人商务板块工作，...,医疗设备/器械,http://jobs.zhaopin.com/CC466646880J40737777706.htm,20-99人,2025-12-22 00:00:00
拍摄运营助理,厦门,厦门绿帝生态股份有限公司,学历不限,1-3年,"抖音,小红书,微信视频号",5000-7000元,岗位职责:1. 账号运营：协助运营总经理的个人社交媒体账号（如微信公众号、抖音、小红书等），提升其专业影响力2、内容策划：简单的脚本策划，会基础的手机拍摄剪辑技能，能进行字幕、音效添加、产出可用于宣传的短视频内容3、协助处理总经理交代的临时性、突发性事务任职要求：1. 对新媒体平台有基本认知；2. 具备优秀的内容创作能力，能够独立完成内容策划与制作；3. 会基础的手机拍摄和剪辑。,快速消费品,http://jobs.zhaopin.com/CC669448220J40902572208.htm,1000-9999人,2025-11-25 14:37:55
tiktok运营助理,厦门,厦门贝多森文化传媒有限公司,学历不限,经验不限,短视频平台,4000-7000元,"岗位职责：1、通过线上的渠道完成达人主播的邀约工作;2、艺人日常管理,包括工作安排以及工作情况跟踪,引导艺人产生优质直播内容;3、负责跟进主播的咨询、投诉、建议的反馈；处理工作中遇到的各种问题并提出合理的解决方案;4、分析直播艺人、网红、达人各项数据及及时反馈;5、完成上级领导交办的其他事宜。任职要求:1、了解抖音/快手等短视频平台,热爱直播行业,有直播运营经验或直播相关经验者优先考虑;2、愿意跟...",电子商务,http://jobs.zhaopin.com/CCL1389617090J40733349101.htm,20-99人,2025-11-13 13:25:51
运营专员（泉州）,厦门,厦门眼科中心有限公司,大专,3-5年,"新媒体运营,销售运营",6000-7000元,"岗位要求：（1）负责信息流账户付费推广、账户搭建，创意、关键词的拟定和更改、优化；（2）管理朋友圈、小红书、抖音等账户，每日及时监控及优化数据,定期给出优化建议；（3）利用统计工具跟踪分析投放效果，通过CTR/ROI等对物料、落地页进行优化；（4）跟踪信息流账户推广效果，收集前后端数据，分析数据并根据数据调整账户；（5）搜集互联网上各同行以及竞争对手的信息动态，分析其优势与劣势，根据对手情况调整投...",卫生服务,http://jobs.zhaopin.com/CC368170480J40818148310.htm,500-999人,2025-11-05 17:07:07
运营专员,厦门,厦门市集美农业发展有限公司,大专,1-3年,"新媒体运营,用户运营,产品运营,增长产品,广告产品,商业化产品,抖音,小红书,微博",4000-7000元,岗位职责：1、负责公司文旅项目或基地的运营服务开发与推广，包括线路设计、行程编写、报价计算等。2、制定并执行营销活动方案，提升项目知名度和吸引力。3、建立和维护客户关系，实时把握客户的需求动态，分析客户需求，根据需求调整服务内容和营销策略。4、对运营服务的质量负责，确保旅游团队在行程中的各项需求得到满足，保障旅游团队各项行程顺利进行，对运营服务满意。5、负责外部合作的协调和洽谈，项目日常全流程管理...,政府/公共事业,http://jobs.zhaopin.com/CCL1484087840J40726071607.htm,20-99人,2025-10-14 16:09:57
