职位,城市,公司,学历,经验,技能,薪资,工作描述,行业,职位URL,公司规模,发布时间
文案策划（实习生）,厦门,厦门星纵物联科技有限公司,本科,无经验,活动策划,150-160元/天,岗位职责：协助人力资源部做好相关活动策划工作等。岗位职责：1.本科以上学历，有做过活动策划以及主持人相关经验的优先考虑；2.具备较强的文字功底、文案策划能力；3.一周能出勤3天，实习时间1个月左右；【福利待遇】 1、实习津贴150元/天； 2、资深HR专业辅导，简单高效的职业成长环境，免费咖啡、下午茶；,IT服务,http://jobs.zhaopin.com/CCL1235720690J40660995808.htm,500-999人,2025-11-06 13:57:41
新媒体运营实习生,厦门,清华海峡研究院(厦门),本科,无经验,"文案撰写,内容策划",100-110元/天,一、岗位职责1. 协助微信公众号内容撰写与运营。2. 协助人才活动的组织以及策划，整理活动总结。3. 协助运营视频号、小红书等等新媒体，增加平台关注度；协助制定平台运营策略，探索线下活动推广新渠道。4. 协助运营过程中的发生的其他工作事项。二、岗位要求1.本科或研究生在读。有社团经验加分；性格外向加分。2.网感好，责任心强，靠谱认真，具备自主学习能力，对工作成果有一定的自我要求。3.有良好的互联网...,零售/批发,http://jobs.zhaopin.com/CC808477970J40823803613.htm,100-299人,2025-09-17 10:10:49
兼职编辑现结300-600,厦门,郑州逸鸢教育咨询有限公司,本科,经验不限,线上兼职,200元,兼职内容:· 负责文稿的校对、润色与格式规范。· 确保内容表达清晰、无知识性错误，符合质量标准和排版要求。· 可以长期兼职，稳定合作。兼职要求：2026届本科或研究生，可长期合作1. 有基本文字功底，细心、有耐心2. 会使用WPS等办公软件3. 零经验？没问题！可以从简单的排版开始，有指导【线上兼职/远程/灵活时间】,在线教育,http://jobs.zhaopin.com/CCL1515199960J40913813315.htm,20人以下,2026-01-10 01:46:28
新媒体运营专员,厦门,漳州韬鸿钢构建材有限公司,本科,经验不限,短视频平台,7000-10000元,岗位职责：1. 负责公司新媒体平台的直播工作2. 编辑和发布新媒体平台的内容3. 通过网络引流等方式提升公司产品的线上曝光度和影响力岗位要求：1 具备直播、编辑、网络引流等技能2 性格活泼,金属制品业,http://jobs.zhaopin.com/CC872646270J40725061306.htm,20-99人,2025-10-16 09:38:18
国外社媒运营,厦门,厦门市三磊包装材料有限公司,大专,1-3年,"社媒运营,外贸,销售,业务员",5000-10000元,职位描述 岗位职责： 1、负责搭建社媒账号（包括但不限于Facebook、TikTok、Instagram），制定社媒平台制定社媒运营策略，并落地执行； 2、跟踪并分析社媒账号数据，及时调整运营策略，提高运营效果； 3、通过社媒平台开发国外业务，负责产品的销售和跟进； 4、领导交办的其它事务。 我们希望您是： 1.大专以上学历，英语四级以上，英文书面及口语表达良好； 2.有1年及以上国外社媒运营经...,印刷/包装/造纸,http://jobs.zhaopin.com/CC409167720J40770097115.htm,100-299人,2025-08-15 16:06:07
新媒体经理/品牌经理,厦门,厦门鑫湖埃安汽车销售服务有限公司,大专,1-3年,,7000-8000元,- 平台管理：负责公司微信、微博、抖音、小红书等新媒体平台的日常运营，包括内容发布、互动管理和平台维护。- 内容策划与创作：结合公司业务和热点话题，策划并撰写有吸引力的内容，如文章、短视频脚本等，以提高用户关注度和活跃度。- 粉丝互动与增长：与粉丝进行互动，回复评论和私信，举办线上活动，增加粉丝数量和粘性。- 数据分析：定期分析新媒体平台的数据，如阅读量、点赞数、评论数等，根据数据调整运营策略。,汽车研发/制造,http://jobs.zhaopin.com/CC441110120J40662486906.htm,100-299人,2025-08-22 09:29:10
国内社媒运营,厦门,厦门市三磊包装材料有限公司,大专,1-3年,"抖音,小红书",5000-10000元,岗位职责：1、制定国内社媒运营策略，优化内容和活动，提高运营效果；2、负责社交媒体平台（抖音、视频号、快手等）的文案输出、脚本创作、视频拍摄剪辑和发布，包括但不限于图文、视频、直播等形式，以吸引和保持粉丝关注、互动，打造高流量和优质流量链接内容。3、收集分析行业信息与市场调研，为社媒宣传提供策略和建议；同时策划各类线上活动，如直播、互动等，增加粉丝量及曝光度；4、领导交办的其它事务。我们希望您是：...,印刷/包装/造纸,http://jobs.zhaopin.com/CC409167720J40765356815.htm,100-299人,2025-07-25 00:00:05
