职位,城市,公司,学历,经验,技能,薪资,工作描述,行业,职位URL,公司规模,发布时间
营销主管/经理,厦门,厦门呼博仕智能健康科技股份有限公司,本科,3-5年,"市场推广,市场策划,整合营销,品牌营销,新媒体运营",9000-12000元·13薪,【岗位职责】1.负责市场信息、行业动态等市场信息的收集与分析，协助上级制定市场策略与计划；2.对接客户端产品推广需求，制定的活动方案，确保产品的有效推广；3.负责公司线上和线下各类营销活动的策划，对接执行单位有效推进各项市场活动落地；4.编写活动总结报告，分析活动的效果，提出改进意见和建议，优化活动方案；5.负责协调处理项目业务过程中出现的问题，并做好相关的报备手续。【任职要求】1.35周岁以内，...,医疗设备/器械,http://jobs.zhaopin.com/CC647956920J40976326704.htm,1000-9999人,2026-01-08 01:11:32
内容营销（专员/主管/总监）,厦门,福建中润玖通品牌管理有限公司,本科,1-3年,"视频类,直播类,图文类,小红书,微信视频号,抖音,品牌企划,达人种草,10W+阅读",7000-12000元,（一）岗位职责：【岗位职责】：1、统筹管理企划部的日常工作，品牌推广所有内容的推广运营，需要较好的文字功底，能产出爆款内容，能写会审，对内容有较好的要求把控。2、公司新媒体平台（公众号、小红书、视频号、抖音等）的日常运营及推广，打造新媒体矩阵，并有效进行内容推广。3、需要擅长达人种草，并有对接过达播商务资源，能够进行新媒体平台的种草投放，熟悉达人商务合作等相关业务。 4、主导文案策划与内容创作，具...,快速消费品,http://jobs.zhaopin.com/CCL1463532070J40867192612.htm,20-99人,2026-01-07 16:41:09
新媒体运营销售专员,厦门,麦田房产,大专,1年以下,,7000-12000元,新媒体各类平台运营 带薪培训、手把手教学拍摄剪辑专业人员带教、大神陪同不用地推，不用陌拜，不用一直打电话【每月10号发薪日】逛逛社区、拍拍视频、邻里唠唠上班时间自由氛围轻松无压力......不懂有人手把手教学【你可以学到】1、线上新媒体平台运营：有抖音、小红书等拍摄、剪辑、运营学习；2、与线下房产交易涉及到不动产、投资理财、美学、心理学、法务常识等多个领域的知识；3、深入了解房产行业的动态、市场政...,房地产中介,http://jobs.zhaopin.com/CC407798420J40691005506.htm,10000人以上,2025-12-30 01:15:19
媒体宣传岗,厦门,华润置地,本科,经验不限,"内容运营,活动运营",6000-12000元·14薪,岗位职责： 1、根据经营及推广策略，制定并推动微博/微信/抖音/小红书等自媒体平台运营策略； 2、对接新媒体运营公司，负责自媒体内容输出，确保策略落地； 3、对接营运/客关等相关部门，收集租户及会员信息和需求，配合自媒体内容输出； 4、自媒体平台运营及粉丝互动，提升粉丝活跃度； 5、为自媒体粉丝量/活跃度/转化率负责。 任职要求： 1、本科及以上学历，编导、新闻、市场营销等相关专业优先； 2、熟悉...,房地产开发,http://jobs.zhaopin.com/CC358101520J40531394205.htm,10000人以上,2025-12-30 00:00:02
新媒体运营电商推广（爆款孵化/流量玩家）,厦门,福建中润玖通品牌管理有限公司,本科,1-3年,"短视频平台,图文平台,小红书,抖音,微信视频号,微信公众号,哔哩哔哩,酒水类,食品饮料类,新酒饮类,内容运营,短视频运营,电商运营,创意策划,新媒体矩阵,电商推广",7000-12000元,（一）岗位职责：1、负责公司新媒体平台（如公众号、小红书、视频号、抖音等）的日常运营及推广，打造新媒体矩阵，并有效进行内容推广。2、主导文案策划与内容创作，具备较好的文字功底与策划思维。3、结合节假日/热点/话题，策划线上或线下品牌活动或事件营销，增强品牌曝光。4、主导平面海报的文案创意，以及短视频的文案脚本创作。5、负责公司相关品牌文宣的内容生产、创意、策划、运营、推广等。 （二）任职要求：1、...,快速消费品,http://jobs.zhaopin.com/CCL1463532070J40867189712.htm,20-99人,2026-01-07 16:36:33
短视频运营经理,厦门,中科同恒环境科技有限公司,本科,1-3年,,6000-12000元,"岗位职责：1、基于公司发展战略，协助分管领导完成公司短视频内容体系的规划与实现（生态环保微生物菌剂方向）；2、协助分管领导,能实现短视频矩阵从内容商业变现模式确定、账号定位、内容策划、制作、实现变现等全流程；3、关注账号数据与指标，深挖业务数据，触发撬动业务增长的关键点，用数据驱动并推动策略方案快速落地，4、搭建团队，培养人才梯队，承担公司销售业绩目标，并带领团队完成销售目标。岗位要求:1有项目起...",环保,http://jobs.zhaopin.com/CC326623430J40902372115.htm,100-299人,2025-12-26 00:42:42
短视频编导,厦门,厦门好给力网络有限公司,大专,1-3年,短视频,7000-12000元,【岗位职责】内容策划与创意，结合开关插座产品特性（如安全、智能、装饰性等），策划高转化率的短视频内容，挖掘产品卖点与用户痛点，制定月度视频内容计划；视频制作与执行，负责短视频全流程制作（脚本撰写、拍摄指导、后期剪辑），突出产品细节、材质、功能及使用场景，确保视频风格符合品牌调性；行业化内容深耕，解读电路安全、智能家居联动等专业话题，以通俗易懂的视频形式传递产品价值；数据分析与优化，监测视频内容数据...,互联网,http://jobs.zhaopin.com/CC552992880J40783481316.htm,100-299人,2025-12-25 13:44:55
Ai新零售专员,厦门,厦门市集美区为国艺饰服装店(个体工商户),学历不限,无经验,"产品运营,用户运营,品牌运营,销售,教育类,家装类,母婴类,大客户（KA）",7000-12000元,月入过万，小白也能做的很好，双休，一周就上手，非常勿扰！要求：现场面试,零售/批发,http://jobs.zhaopin.com/CCL1514160740J40775642216.htm,20-99人,2025-12-22 16:40:37
自媒体运营,厦门,厦门唯实信息技术有限公司,大专,1-3年,"抖音,哔哩哔哩,微信视频号,微信公众号,今日头条,小红书,医疗类,数码类,科普类,内容运营,短视频运营,用户运营,短视频平台,图文平台",6000-12000元,岗位内容：1. 负责公司所有新媒体账号的管理和内容更新；2. 根据公司整体营销方向，制定并执行线上营销策略，提升知名度和销售转化率；3. 维护客户关系，并负责新媒体平台的数据分析和报告撰写；4. 不断跟进行业和社交媒体趋势，为新媒体运营提供第一手资讯和创意。任职要求：1. 本地生活，科普类自媒体自媒体经验优先；2. 熟悉运用各种社交媒体平台及相关运营工具；3. 具备良好的沟通表达能力和团队协作精神...,网络/信息安全,http://jobs.zhaopin.com/CC370728310J40906040408.htm,20-99人,2025-12-12 13:28:41
电商新媒体运营,厦门,欧夜贸易(厦门)有限公司,高中,1-3年,"短视频平台,抖音,微信视频号,小红书,微信公众号,图文平台,快手,服装类,内容运营,短视频运营,直播运营,内衣产品运营",6000-12000元,欧夜公司优势：1. 产品定位中高档，做精品，做品牌，公司16年坚持只做性感内衣这一个细分行业，属于绝对的行业专家2. 长期签约全球最顶级模特，图片视频美轮美奂，为本行业内独家能提供彩盒包装且都配置对应模特图片3. 产品都分码制作，配置了大码，加大码尺寸，为本行业内独家能实现大码尺寸产品现货供应4. 常规现货储备超过 100万件，特别适合零售所需要的能当天发货的要求5. 公司的跨境电商业务连续多年，...,贸易/进出口,http://jobs.zhaopin.com/CC441289820J40818728409.htm,20-99人,2025-12-11 19:53:21
小红书运营,厦门,厦门利川音响有限公司,本科,3-5年,"数码类,家装类,内容运营,品牌运营,用户运营,营销思维",7000-12000元,1、深入理解品牌定位、目标用户及业务目标，制定年度/季度小红书平台运营策略及内容规划；2、紧跟小红书平台规则、算法变化、热门趋势（话题、音乐、玩法等），及时调整策略，抢占流量先机；3、规划并管理小红书营销预算，确保投入产出最大化；4、主导爆款内容生产： 策划高互动性、强种草力的原创内容（图文、短视频、直播等），包括选题、脚本撰写、视觉方向把控（与设计/拍摄团队协作）；5、账号精细化运营： 负责官方...,电子商务,http://jobs.zhaopin.com/CC695258220J40806687210.htm,20-99人,2025-11-27 14:47:56
抖音直播运营经理,厦门,郑福星(厦门)茶业进出口有限公司,大专,3-5年,"视频号,千川投流、随意投,抖音,小红书",8000-12000元,一、直播策略规划与执行1. 制定整体运营策略◦ 结合品牌目标、用户画像及平台算法，制定抖音直播的长期规划（如月度/季度直播主题、场次安排、流量目标等）。◦ 分析行业趋势与竞品动态，策划差异化直播玩法（如专场促销、达人连麦、剧情化直播等），提升账号竞争力。2. 流量获取与转化优化◦ 联动短视频团队，通过预热视频、爆款内容引流至直播间，提升直播曝光度。◦ 优化直播封面、标题、标签等基础设置，利用抖音D...,贸易/进出口,http://jobs.zhaopin.com/CC470692820J40898274804.htm,20-99人,2025-11-24 15:48:17
电商直播运营,厦门,厦门酷噜互娱传媒有限公司,大专,1-3年,"抖音,电商类,电商直播",7000-12000元,岗位职责:1、制订直播运营计划，分析各项数据，提高各环节转化率提升直播间；2、负责直播策略、玩儿法，包含直播活动等的脚本策略输出和落地；3、负责直播现场支持和运营的工作，协助主播提升直播间热度，把控主播节奏，记录数据。任职要求:1、鞋服类直播运营经验，有抖音/淘宝直播运营实习经验优先；2、沟通能力强，执行能力强，有责任心，擅长跨部门沟通及资源整合；3、对数据敏感，善于数据分析和总结方法论，能够独立...,广告/营销,http://jobs.zhaopin.com/CCL1292150870J40734153306.htm,20-99人,2025-11-17 15:26:40
新媒体运营,厦门,厦门大哲新能源集团有限公司,本科,3-5年,"短视频平台,抖音,快手,哔哩哔哩,短视频运营,用户运营",6000-12000元,岗位职责：1、负责新媒体平台（小红书/抖音/公众号/B站/视频号）创意内容策划、撰稿、排版制作及日常运维等工作。2、根据公司需求结合平台玩法规则和传播规律，策划选题，制定内容方案及撰稿执行，对账号数据负责。3、协调与沟通后端小伙伴把控相关环节工作，并保证作品质量。4、定时对所负责账号进行阶段性复盘及优化方案提报。任职资格:1. 有新媒体市场推广、品牌宣传、新媒体运营相关工作经验。2、具有独立负责小...,摩托车/自行车制造,http://jobs.zhaopin.com/CCL1512232610J40897223608.htm,20-99人,2025-10-31 11:49:03
短视频编导,厦门,厦门小题旅行科技有限公司,本科,经验不限,"短视频,抖音,小红书,品牌代运营",8000-12000元,【岗位职责】1、能够独立对接甲方，理解甲方的需求，负责平台的账号内容定位及风格把控；2、根据项目定位要求和风格，关注热点事件，挖掘选题，收集整理素材，输出有创意的内 容；3、能够独立完成视频文案的策划和撰写，完成视频脚本和分镜输出，并能够给予拍摄指导， 给予后期剪辑思路，把控拍摄内容及最终成品质量；4、及时洞察账号数据，进行数据监控、统计、分析并总结经验，不断迭代优化、调整视频 内容；5、负责账号...,广告/营销,http://jobs.zhaopin.com/CCL1381644200J40844298012.htm,500-999人,2025-10-30 11:06:20
新媒体编导,厦门,厦门种籽时代健康科技有限公司,本科,1-3年,短视频,6000-12000元,岗位职责1、独立负责IP账号短视频的拍摄和制作包括场景的布置、摄像设备的调试和使用等；2、善于使用镜头语言，能适应和驾驭各种复杂的拍摄环境，并独立完成拍摄任务；3、对原始素材进行筛选、整理，剪辑后确保视频节奏流畅、主题明确；4、完成调色、音效处理、字幕添加、特效等后期工作，提升视频观赏性；5、与运营以及团队紧密合作沟通，确保视频内容的质量和一致性。岗位要求:1、本科及以上学历，一年及以上相关工作经...,医美/健康服务,http://jobs.zhaopin.com/CCL1510822490J40723770106.htm,100-299人,2025-10-12 09:03:45
编导,厦门,厦门酷噜互娱传媒有限公司,大专,经验不限,"美妆类,泛娱乐,有网感,创意,脚本输出,短视频,综艺",7000-12000元,【任职资格】：1、技能: 提供短视频定位策划，有一定素材实拍和脚本独立编写能力; 协调、统筹、主导现场拍摄、跟进后期剪辑、配音、音乐等工作2、经验:具备校园实践与编导相关实习经验或有半年以上编导岗位实战经历。3、实时掌握热点，高效策划并产出相关热点类短视频【薪资结构】无责固定薪资➕绩效奖金➕不定期彩蛋惊喜➕调薪机会➕年终奖1、社会保障:入职缴纳五险，符合厦门政策可接收协助落户;2、丰厚奖金:年终奖...,广告/营销,http://jobs.zhaopin.com/CCL1292150870J40689655206.htm,20-99人,2025-10-10 00:00:02
大健康内容编导-桂龙药业,厦门,安徽桂龙医药经营有限公司厦门分公司,本科,1-3年,"直播引流,抖音投流逻辑,短视频编导,短视频",6000-12000元,岗位名称：大健康内容编导岗位职责：1、负责抖音电商平台短视频的内容策划、脚本撰写、拍摄及后期制作全流程，打造高转化率的短视频内容;2、结合品牌调性、产品卖点及抖音平台热点，策划创意性短视频内容，提升用户互动和商品转化;3、跟踪短视频数据(播放量、完播率、转化率等)，优化内容策略，定期输出复盘报告;4、达人资源对接，根据品牌&产品寻找合适的达人，协助达人理解brief，推动内容创作符合商业要求，处理...,医药制造,http://jobs.zhaopin.com/CCL1486828100J40802431212.htm,300-499人,2025-09-29 16:47:08
抖音短视频编导（高固薪+13薪+品牌）,厦门,厦门斯辰传媒有限公司,本科,1年以下,"广告类,短视频,熟知抖音平台算法,网感好,审美好",8000-12000元·13薪,【集团介绍】关于我们：顾诺集团，成立于2016年，总部位于厦门湖里区独栋6层办公大厦，专注为家庭日化品牌提供「自营+代运营」一体化解决方案，深度布局抖音、天猫、京东、拼多多等核心渠道，产品矩阵覆盖：家庭清洁、环境净化、个人护理等系列，满足家庭全场景清洁需求。我们的成绩：1、自主研发沫檬、康思嘉等日化品牌，其中地板清洁剂、洗衣机槽清洁剂成为全网爆款，2022年一跃成为抖音家清品类市TOP1，并持续高...,电子商务,http://jobs.zhaopin.com/CCL1281702680J40680939306.htm,1000-9999人,2025-09-10 17:11:53
新媒体运营主管（日本房产）,厦门,厦门泰房信息科技有限公司,大专,1-3年,"短视频运营,日语,日本房产",6000-12000元·13薪,【岗位职责】1、负责短视频文案脚本的撰写，策划优质、有深度的新媒体内容，具备新媒体运营相关工作经验，熟悉抖音、小红书等短视频平台运营规则及特点；2、审美优、网感强，善于捕捉热点事件与话题，能将网络热点转化为适合公司营销的手段；3、完成日本房源短视频素材的剪辑、配音、讲解发布到短视频平台；4、运营多个账号（每日更新房源、讲解房源、直播）；5、能接受短期出差日本 2-3次/年；6、有日本工作经验或者会...,房地产中介,http://jobs.zhaopin.com/CCL1414613840J40791079405.htm,20人以下,2025-08-20 15:54:44
新媒体运营,厦门,厦门唯得家科技有限公司,大专,1-3年,"内容运营,短视频运营,品牌运营,TikTok,LinkedIn,Facebook,抖音,微信视频号,快手,家装类,医疗类,短视频平台,海外平台,企业官网",8000-12000元,新媒体运营涉及利用现代化的移动互联网手段，通过新兴媒体平台如抖音、快手、微信、微博等，进行产品的宣传、推广和营销。这包括策划与品牌相关的优质、高度传播性的内容，并通过线上活动向客户广泛或精准推送信息，以提高参与度和知名度，充分利用粉丝经济，达到营销目标。新媒体运营还涉及用户运营，如社群维护、用户反馈处理等，以及内容运营，如确定和调整内容输出，以满足用户需求和提升用户体验。此外，新媒体...,智能硬件,http://jobs.zhaopin.com/CCL1479160850J40533458708.htm,20-99人,2025-07-18 00:00:05
穿搭编导,厦门,厦门酷噜互娱传媒有限公司,大专,1-3年,"美妆类,服装类,视觉类/审美好,网感好,短视频",7000-12000元,【招个会“搞穿搭”的编导，一起炸街！】如果你刷穿搭视频时总在想：“这镜头切得没内味儿啊”“这搭配明明能更炸，咋拍得这么平？”“这BGM配得还没我歌单里的一半带感！”——那你就是我们要找的人！在酷噜，你要干的是： • 抓准潮人DNA：从T恤叠穿到球鞋配色，把穿搭灵感拆成镜头语言，让观众看完直接“抄作业” • 玩转出圈点子：不管是沉浸式变装、穿搭干货吐槽，还是脑洞剧情+OOTD，你的创意说了算 • 盯...,广告/营销,http://jobs.zhaopin.com/CCL1292150870J40689677306.htm,20-99人,2025-07-10 11:31:01
编导（KOC方向） (MJ000097),厦门,厦门起量科技有限公司,本科,1-3年,"美妆类,短视频",8000-11000元,岗位职责：1. 脚本创作核心工作：深入理解品牌调性、产品核心卖点及目标用户需求，为不同领域的KOC量身定制符合其个人风格的短视频脚本。脚本需兼具内容吸引力、产品植入合理性及传播潜力，能有效激发用户兴趣与购买意愿。2. KOC拍摄全流程对接：作为品牌与KOC的核心对接人，精准向KOC传达脚本思路、拍摄要求及产品重点；耐心解答KOC在拍摄过程中的疑问，提供专业的拍摄指导，包括场景选择、镜头语言、台词表...,新媒体,http://jobs.zhaopin.com/CC891777330J40815989501.htm,500-999人,2025-12-22 15:04:32
海外社媒内容运营专员,厦门,厦门泰东方健康管理有限公司,本科,1-3年,"抖音,微信公众号,小红书",8000-11000元,岗位职责1.海外社交媒体运营管理1）负责主流社交媒体平台（Facebook、Instagram、TikTok、YouTube、X、LinkedIn等）的日常内容发布、粉丝互动及评论区维护，通过优质内容提升账号活跃度与粉丝黏性。2） 协助策划符合品牌调性的图文、短视频、直播等内容，参与创意头脑风暴及本土化文案撰写，涵盖帖子话题、图片/视频文案、社交媒体推文、PR通告、广告文案、活动方案等。2. 流量...,卫生服务,http://jobs.zhaopin.com/CC330076730J40861776312.htm,100-299人,2025-12-21 15:34:39
运营经理,厦门,厦门中科智业人力资源有限公司,本科,1-3年,"新媒体运营,抖音,快手,小红书",1-1.1万,【岗位职责】1、负责公司抖音、快手等主流短视频平台账号的整体运营，包括内容策划、脚本撰写、发布推广及数据复盘，结合公司业务属性输出优质内容，提升账号曝光与咨询转化率，打造符合公司业务属性的优质账号。2、主导或参与公司独立招聘平台的规划、开发及迭代，联动新媒体及线下资源推广平台，提升企业入驻量与求职者注册量。3、制定市场开拓战略，带领团队挖掘潜在客户，拓展合作渠道，完成业绩指标；负责团队搭建、培训及...,人力资源服务,http://jobs.zhaopin.com/CC141741340J40848539713.htm,500-999人,2025-12-10 14:51:58
新媒体专员（集团）,厦门,华厦眼科医院,本科,3-5年,"图文平台,短视频平台,医疗类",7000-11000元,岗位职责1.新媒体账号运营管理：结合眼科行业热点、用户兴趣及产品特点，策划制作爆款笔记，如患者故事、产品体验、干货合集等，提升账号知名度与影响力。制定各账号（小红书、抖音、快手等）的发布计划，根据平台流量高峰和用户活跃时间，合理安排发布时间，优化话题标签使用，提高内容曝光度。及时回复粉丝在评论区和私信的提问，维护良好的互动关系，增强粉丝粘性，实现粉丝增长和流量转化。2.患者互动与引流：根据目标患者...,卫生服务,http://jobs.zhaopin.com/CC217688310J40779134008.htm,1000-9999人,2025-08-15 23:02:51
直播培训经理,厦门,三棵树涂料股份有限公司,大专,1-3年,"主播经验,热点事件策划,电商直播",7000-11000元·13薪,岗位职责： 1.负责零售中心直播项目统筹； 2.承接市场终端直播培训及线上动销活动、精通直播平台运营规则及技巧； 3.协同部门项目打造精品培训项目，聚焦关键人士培训，提升两大团队效能； 4.针对问题设计项目培训并运营项目 5.完成部门相关的表格及报告；完成领导交办的其他事情； 任职资格： 1.拥有2年以上第三方平台主播相关经验；精通直播平台运作规则及技巧； 2.能独立承担项目直播；有数据处理和简报...,建材,http://jobs.zhaopin.com/CC155695310J40575736615.htm,10000人以上,2025-02-12 11:05:45
新媒体销售【无责底薪+高抽成】就近安排,厦门,麦田房产,大专,1年以下,"住宅房产,办公房产,商业房产,新房,公寓,二手房",7000-10000元,新媒体各类平台运营 带薪培训、手把手教学拍摄剪辑专业人员带教、大神陪同不用地推，不用陌拜，不用一直打电话【每月10号发薪日】逛逛社区、拍拍视频、邻里唠唠上班时间自由，可以接送孩子氛围轻松无压力......不懂有人手把手教学【你可以学到】1、线上新媒体平台运营:有抖音、小红书、等拍摄、剪辑、运营学习，2、与线下房产交易涉及到不动产、投资理财、美学、心理学、法务常识等多个领域的知识;3、深入了解房产行...,房地产中介,http://jobs.zhaopin.com/CC407798420J40660800706.htm,10000人以上,2026-01-12 09:21:09
新媒体专业摄影师,厦门,中芯渊虹(厦门)投资控股集团有限公司,大专,1-3年,"摄影,电商展示图,工业产品示图,电气产品示图",8000-10000元,岗位内容： 1. 拍摄各类商业摄影作品和电影，包括拍摄、后期制作等全方位服务。2. 配合客户和内部相关团队，制定和执行拍摄计划，确保任务的质量和工期。3. 使用和保管摄影/摄像器材，并确保所有器材的完好无损。4. 完成公司安排的其他任务，如文案编辑、图片处理等。任职要求： 1. 对于商业摄影和电影制作有较深入的了解和丰富的实战经验。2. 熟练掌握各种摄影/摄像设备的操作和调试，熟悉各种拍摄技巧和后...,电气机械/电力设备,http://jobs.zhaopin.com/CCL1477406440J40823935014.htm,20-99人,2026-01-12 01:38:20
新媒体运营专员,厦门,厦门联众搏程汽车服务有限公司,中专/中技,1-3年,"短视频平台,图文平台,海外平台,抖音,快手,小红书,微信视频号,汽车类",5000-10000元,岗位职责：1. 制定和执行公司线上推广方案，深度参与公司网站设计优化及品牌推广计划；2.开发新客户，拓展老客户的业务，建立和维护新老客户，引导客户需要挖掘销售机会并达成销售业绩；3、维护好部门内部资源，提高客户满意度；4、收集和分析市场数据，并定期反馈最新消息；5. 负责线上新媒体的日常更新运营，包括日常推送内容的策划、撰写发布、网络推广，粉丝的互动等；6. 协助公司网站的修改建设、内容更新及后台...,零售/批发,http://jobs.zhaopin.com/CC575099380J40816222611.htm,20-99人,2026-01-08 20:43:58
短视频编导—达人IP方向,厦门,后古文化科技有限公司,大专,1-3年,"短视频,达人IP",5000-10000元,一、岗位职责：1.负责抖音短视频达人账号的策划、编写工作；2.分析目标行业进行内容调研分析，优化视频内容；3.撰写分镜头脚本，把控视频制作流程；4.挖掘用户心理，创作具有吸引力的短视频内容。二、任职要求：1.大专及以上学历，可接受应届生，编导、传媒等相关专业；非相关专业有在这个行业实习过的也可以，有经验者薪资可详谈；2.熟悉短视频平台特性；短视频爱好者，能独立完成视频项目，有网感；3.文笔流畅、思...,文化艺术/娱乐,http://jobs.zhaopin.com/CCL1232334230J40835241314.htm,500-999人,2026-01-07 14:58:25
