职位,城市,公司,学历,经验,技能,薪资,工作描述,行业,职位URL,公司规模,发布时间
品牌运营总监/总经理（建材）,杭州,湖南创能新材料科技有限公司,大专,10年以上,"运营管理,团队管理,客户管理,副总裁/副总经理/VP,品类运营,门店运营,销售运营",3-4万,一、岗位职责1. 负责带领团队达成销量、招商建店、产品结构、均价等任务目标。2. 负责市场盘点、商圈盘点、市场规划，实现招商建店目标。3. 负责商户和门店团队建设、门店出样管理、全业务渠道组合到店、提升门店运营能力，提升门店客流量、转化率、客单价。4. 负责门店销售提升计划的有效制定、落地、复盘与持续改进。二、任职条件1.学历：统招本科及以上学历（综合条件优秀者放宽至大专）2.年龄：28岁以上至4...,房地产开发,http://jobs.zhaopin.com/CC613593930J40484247109.htm,20-99人,2025-03-17 23:20:24
招募专员,杭州,上海中毅医药科技发展有限责任公司,大专,经验不限,"药品临床研究,药理研究,药代动力,医院",2-4万,职位描述1、负责区域、医院、科室调研；2、拜访目标客户，沟通临床实验的入排标准及实验流程；3、沟通、组织、预约科室招募会的召开；4、根据项目要求制定并落实工作计划，拜访医院医生，传递临床研究项目信息，寻找合适的患者参加临床研究；5、维护客户，确保公司与客户之间长期良好关系的发展；6、严格遵循临床试验方案以及GCP要求，进行临床研究普及宣传，扩大临床研究的认知度及参与度；7、学习疾病领域知识、临床诊...,医药制造,http://jobs.zhaopin.com/CC861234330J40496073502.htm,20-99人,2025-03-17 00:02:41
轮胎运营总监,杭州,快准车服,大专,5-10年,运营管理,3-4万,1、负责本品线年度经营计划书的制定，对年度GMV、营收、毛利率目标进行规划，和战区进行对接咬合，跟踪落地。2、对品线相关行业进行市场调查，洞悉市场变化，了解竞争对手动向，深度分析，制定对策。3、负责产品纵向结构搭建（产品档次定位）和横向覆盖（SKU齐全度）工作，提升产品力。4、对品线产品从品牌、包装、市场定位、价值链设计、销售计划、销售工具等进行规划和实施。5、配合运营部门制定和实施大型促销活动，...,互联网,http://jobs.zhaopin.com/CC509652630J40248777304.htm,500-999人,2024-11-25 15:02:24
市场推广专员,杭州,上海律驰信息科技有限公司,学历不限,经验不限,,200元/时,国内知名法律品牌招募全国各市、县市场推广员（兼职），一个城市一个县只招募一人，负责产品在当地的推广和宣传：1、推广方式简单，手机或电脑操作，发布产品信息让客户看到即可，无需外出，下班空闲时间手机操作。2、年收入不低于30万，并有上升空间3、享受其他优厚福利，终身受益4、加入立刻获得终身免费法律咨询权力本品牌入驻著名大学国家科技园，正规机构，要求年龄不超45，男女不限，为人正直，无需任何专业和经验，...,咨询服务,http://jobs.zhaopin.com/CCL1462965700J40797399105.htm,20-99人,2025-07-31 00:00:01
闪购-店铺运营专家-新区,杭州,北京三快在线科技有限公司,本科,1-3年,,面议,"美团闪购是美团旗下的即时零售平台，依托即时配送能力，连接本地零售供给，满足消费者30分钟万物到家的即时需求。美团闪购涵盖超市便利、食材、水果、鲜花绿植、休闲零食、酒水饮料、数码家电、美妆个护、母婴玩具、日用百货、服饰鞋帽、宠物等诸多品类，业务覆盖全国近3,000个县市区旗，每日百万级在岗骑手，以高效的配送、丰富的品类和广泛的覆盖，为美团数亿用户带来便捷的生活体验，积极助力实体零售线上化转型，提升本...",互联网,http://jobs.zhaopin.com/CC383625320J40768600609.htm,10000人以上,2026-01-12 08:50:22
【🔥高薪诚聘 | 助贷行业精英电销专员🔥】,杭州,杭州玖玖汇融信息科技有限公司,高中,经验不限,"企业客户,个人客户",1.9-3.5万,——底薪8300+高提成+万元奖金+优质资源——📞【岗位职责】 通过电话开发意向客户，精准筛选需求，完成面谈邀约； 结合面销促成客户签约，提供专业助贷解决方案； 维护客户关系，达成团队和个人业绩目标； 参与市场分析，优化销售策略。💼【岗位要求】✅ 16-35岁，学历不限，有电销/金融销售经验优先；✅ 沟通力强，抗压能力优秀，目标感极强；✅ 渴望高收入，愿接受挑战，执行力满分！🚀【公司五大核心...,咨询服务,http://jobs.zhaopin.com/CCL1418736640J40702274016.htm,100-299人,2026-01-11 14:08:27
数据空间建设与语料数据运营咨询顾问,杭州,华信设计,本科,5-10年,"咨询顾问,数据治理,数据仓库,大数据开发",2-3.5万·13薪,**职位名称：数据治理与数据运营团队负责人****工作地点：** 杭州**汇报对象：公司数据运营主管总经理**岗位职责：**1. 战略规划与体系建设：从零开始搭建公司级数据治理体系与数据运营咨询服务交付团队，制定团队中长期发展规划，明确公司数据治理与数据运营服务产品的战略目标、实施路径与关键里程碑。2. 团队组建与管理：负责数据治理与数据运营团队的组建、招聘、培养与管理，建立高效协作的团队文化，提...,运营商/增值服务,http://jobs.zhaopin.com/CC121043380J40842936903.htm,1000-9999人,2026-01-05 01:06:07
电商运营经理（成都工作）,杭州,千禾味业,本科,1-3年,"电商运营,淘宝,京东",3-3.5万·13薪,"注意：办公地在成都！岗位职责：1、负责天猫系（包括天猫旗舰店、天猫超市），或京东系（包括京东超市、京东旗舰店）运维。2、目标制定：负责板块业务的目标制定；根据公司战略目标、年度规划，完成线上全渠道销售目标的制定、拆解。（包括销售目标、其他经营指标等）3、业务管理：带领团队完成电商业务目标；负责制定合理的、有效的店铺运营策略及运营方案,完成公司下达的销售任务和利润指标；4、团队管理：根据目标进行团队...",快速消费品,http://jobs.zhaopin.com/CC339677710J40853199813.htm,1000-9999人,2026-01-04 10:47:24
俄罗斯跨境电商运营,杭州,南方新华,本科,3-5年,"WILDBERRIES,野莓,ozon,数据运营,精品运营,选品开发,英语,俄语",3-3.5万,核心职责市场战略与平台运营制定并实施俄罗斯区域年度运营战略，聚焦Ozon、Wildberries等平台，达成销售目标与市场份额增长；深入分析俄罗斯市场趋势、消费者行为及竞品动态，持续优化产品策略、定价机制及营销活动。团队0到1搭建与管理负责俄罗斯运营团队的从零组建，包括招聘、培训、考核及日常管理；搭建高效协同的运营流程体系，明确岗位职责与绩效目标，提升团队执行力。跨平台运营与资源整合主导多平台（O...,人力资源服务,http://jobs.zhaopin.com/CC346219280J40818337111.htm,100-299人,2026-01-04 09:35:40
电商运营总监/家电运营总监（ 家电/电商/电器）,杭州,上海能良电子科技有限公司,本科,3-5年,"电商运营,家电运营,电器",2-3.5万·18薪,工作内容：1、负责天猫/京东/拼多多等全渠道全平台的整体规划和运营管理；2、负责平台网络营销与推广方案的制定与实施，提升百补坑位销售产出3、独立与平台小二对接，单独规划产品方案和营销计划，平台运营工具熟练，提出应用方案，提高入店流量，增大点击率和浏览量，转化率4、制定月度店铺推广预算，执行相关网络运营方案，完成预期销售目标5、推动团队业绩增长、完成店铺销售目标，打造爆款产品能力6、每日监控的数据:...,互联网,http://jobs.zhaopin.com/CC637353830J40822688009.htm,500-999人,2025-12-26 09:56:17
销售运营总监,杭州,浙江寰领医药科技有限公司,本科,5-10年,,2-3.5万,岗位职责1、协助营销中心总经理建立、完善销售管理与服务的体系、制度与流程等；2、负责发货管理、销售协议/合同的签订等；4、负责销售费用管理工作，做好证据链；3、负责销售数据的整理、统计、分析，以及销售报表的审核等；5、负责产品投标工作，协调解决相关问题；6、负责处理市场投诉工作，开展销售监察工作；6、负责产销协调，确保市场供应。任职要求1、本科及以上学历，医药类相关专业优先考虑；2、10以上工作经...,医药制造,http://jobs.zhaopin.com/CCL1257900970J40860582112.htm,300-499人,2025-12-25 00:28:42
天猫运营,杭州,杭州曜昀科技有限公司,大专,1-3年,"天猫,主管,医疗器械,店长,淘宝",2-3.5万,招聘职位：天猫王牌操盘手 (寻找下一个项目合-伙人)薪资范围：底薪12k-20k + 上不封顶的利润分红嘿，朋友，先别急着划走，回答我们三个问题：你是否厌倦了在会议室里浪费生命，渴望把100%的精力都用在操盘和打仗上？你是否受够了“黑箱式”的奖金制度，希望你的每一分收入，都能用一个清晰的数学公式算出来？你是否觉得自己的能力远超现在的职位，需要的不是一个“领导”，而是一个能提供充足弹药和完全信任的“...,零售/批发,http://jobs.zhaopin.com/CCL1509514360J40773370910.htm,20-99人,2025-12-22 00:00:00
策略运营定价,杭州,吉利控股集团,本科,3-5年,,面议,岗位职责:1负责区域换电业务，为交易规模增长负责；2.深度把握各区域的竞争环境，洞察问题及机会点，输出运营SOP，帮助区域完成增长指标；3.负责该换电业务的运营策略，并将有效策略产品化，推动产运研等各部门高效协同，完成关键功能点实现、推动区域使用;4.围绕换电业务，结合市场洞察，进行策略创新，及中长期方向规划等。任职要求：1、3年以上工作经验，熟悉充换电业务，有增长策略或产品经验者优先;2、熟练掌...,汽车研发/制造,http://jobs.zhaopin.com/CC000616940J40894967208.htm,10000人以上,2025-12-16 01:20:41
独立站运营专家（行业top3）,杭州,广州凌波微步信息技术有限公司,本科,3-5年,"Shopify,海外推广,精品运营,Google,Facebook,WordPress,英语",1.8-3.5万,"【岗位职责】1、为跨境电商客户提供投放策略建议与平台使用指导。为平台销售提供售前支持；2、负责投放平台的实施落地，解决客户在产品使用中的各种问题，为客户提供使用实践;3、能够准确识别和理解客户需求,并将客户需求和反馈进行收集分析，推动产品迭代优化;4、对产品的日常使用行为数据进行分析，形成改进方案，推动产品功能和客户体验的优化;5、客户的日常维护，包括咨询跟进、问题处理、培训提升、知识库汇总等支持...",电子商务,http://jobs.zhaopin.com/CCL1451823180J40851770615.htm,100-299人,2025-12-11 00:00:04
营销管理专家,杭州,杭州大王椰装饰新材料有限公司,本科,10年以上,"toB,渠道销售,代理商销售",2.5-3.5万,核心职责搭建可复制的零售营销运营体系，涵盖渠道规划、客户分层、产品组合、价格调整及库存协同，推动流程标准化。搭建核心数据指标体系，运用 SQL、Excel、BI 工具开展全链路数据分析，定位问题并输出落地优化方案。制定场景化零售策略，策划促销活动与高毛利产品推广，联动行业旺季与竞品动态，提升业绩与盈利能力。优化运营全流程，建立库存监控机制，联动跨部门协同，降低运营与库存风险。跟踪策略效果，迭代运营...,房地产开发,http://jobs.zhaopin.com/CC450125630J40848133213.htm,1000-9999人,2025-12-09 17:27:23
策略运营会员权益,杭州,吉利控股集团,本科,3-5年,,面议,岗位职责:1负责区域换电业务，为交易规模增长负责；2.深度把握各区域的竞争环境，洞察问题及机会点，输出运营SOP，帮助区域完成增长指标；3.负责该换电业务的运营策略，并将有效策略产品化，推动产运研等各部门高效协同，完成关键功能点实现、推动区域使用;4.围绕换电业务，结合市场洞察，进行策略创新，及中长期方向规划等。任职要求：1、3年以上工作经验，熟悉充换电业务，有增长策略或产品经验者优先;2、熟练掌...,汽车研发/制造,http://jobs.zhaopin.com/CC000616940J40894966508.htm,10000人以上,2025-12-13 01:22:20
新媒体运营总监,杭州,西安同辉餐饮管理咨询有限公司,大专,3-5年,"新媒体运营,直播运营,内容运营,IP人设打造",2.5-3.5万,岗位职责：1、平台运营策略制定：负责抖音平台的整体运营策略，包括内容方向、活动策划、用户增长、粉丝互动、品牌曝光等标准化SOP搭建。 2、内容创作与策划：策划并执行符合品牌调性的短视频内容（含脚本创意、视觉风格、人设打造），结合热点、趋势和用户需求，提升内容吸引力和传播效果，提升品牌曝光、粉丝互动率等核心指标增长。3、用户运营与增长：负责用户拉新、留存与转化，提高人群总资产，定期策划并执行各类线上...,餐饮服务,http://jobs.zhaopin.com/CC642396220J40857653012.htm,300-499人,2025-12-09 14:17:08
新媒体运营总监,杭州,浙江豪帝控股集团有限公司,本科,3-5年,"新媒体运营,用户运营,直播运营",1.8-3.5万,岗位职责 战略规划与体系建设： 全面负责新媒体中心的战略制定与落地，对中心的用户增长、品牌声量、销售线索及投资回报率（ROI）负责。 从0到1搭建中心的管理与运营体系，包括业务流程、团队考核激励制度、数据复盘及预算管理体系。 团队组建与人才培养： 负责招募、搭建及管理一支包含运营、策划、主播、拍摄剪辑在内的专业化团队。 主导整合与优化集团旗下各门店的新媒体资源（尤其是主播资源），建立系统化的培训机...,汽车4S店/经销商,http://jobs.zhaopin.com/CCL1491463840J40794051907.htm,1000-9999人,2025-12-08 13:30:11
双休底薪6600招运营/七小时工作制/五险一金,杭州,中国平安,大专,经验不限,"五险一金补充医疗保险,年终奖，带薪年假,朝九晚六,双休不加班",面议,"此岗位本月急招,招满为止！！！可接受无经验,公司提供完善的培训和发展空间！上班时间早上9：00-12：00，2：00-6：00七小时工作制,周末双休,不加班工作内容：针对已购客户做好维护,解答客户问题无需开发新客户,仅需做好客户承接就可以做好公司的老客户维系和服务,树立公司的形象薪资待遇底薪6600+提成+高额奖金+福利:综合收入18K-30K福利待遇1,上班时间早上9:00到下年6:00,午休2...",银行,http://jobs.zhaopin.com/CC000204810J40855591112.htm,10000人以上,2025-12-03 13:41:44
电商负责人,杭州,泉州市嘉信才略投资有限公司,大专,3-5年,"电商全渠道运营,电商团队组建,组织策划",2.5-3.5万,岗位职责1、 根据公司战略目标，制定电商全平台（天猫、京东、拼多多、抖音等）战略布局及整体运营方案；2、 完成电商全渠道运营布局，分解销售目标，制定部门年、季、月等各周期运营方案，并负责监督实施，完成销售目标；3、 负责组织策划并审定产品、市场推广、运营、市场研究等活动策略、推广方案，相关预算、组织整合资源并实施监督，提高品牌知名度和美誉度；4、 保证线上电商平台产品价格定位、供应链管控，有效降低...,人力资源服务,http://jobs.zhaopin.com/CC700772380J40965894304.htm,20-99人,2025-11-21 14:02:44
市场运营经理,杭州,浙江海高控股集团有限公司,本科,3-5年,海外运营,2.5-3.5万,岗位职责 负责沙特市场的整体运营策略制定与执行，推动品牌在当地市场的知名度和销售业绩增长 深入研究沙特市场文化、消费习惯及行业动态，制定符合当地市场特点的营销方案 管理和维护当地合作伙伴关系，协调内外部资源，确保市场活动顺利实施 监控市场竞争对手动态，收集市场反馈，及时调整运营策略 定期撰写市场运营报告，向总部汇报市场情况及业绩表现任职要求 本科及以上学历，市场营销、国际贸易等相关专业优先。 有海...,专业技术服务,http://jobs.zhaopin.com/CC251879620J40809060507.htm,1000-9999人,2025-11-17 13:51:19
双休底薪6600招运营/七小时工作制/五险一金,杭州,中国平安,大专,经验不限,"五险一金补充医疗保险,年终奖，带薪年假,朝九晚六,双休不加班",面议,"此岗位本月急招,招满为止！！！可接受无经验,公司提供完善的培训和发展空间！上班时间早上9：00-12：00，2：00-6：00七小时工作制,周末双休,不加班工作内容：针对已购客户做好维护,解答客户问题无需开发新客户,仅需做好客户承接就可以做好公司的老客户维系和服务,树立公司的形象薪资待遇底薪6600+提成+高额奖金+福利:综合收入18K-30K福利待遇1,上班时间早上9:00到下年6:00,午休2...",银行,http://jobs.zhaopin.com/CC000204810J40855591012.htm,10000人以上,2025-12-03 13:41:44
产品运营及分析（行业/品类运营方向）,杭州,中国移动通信有限公司在线营销服务中心,本科,5-10年,"品类引进经验,品类结构搭建经验",3-3.5万,岗位职责:1.基于消费者需求、制定品类规划，搭建健康的品类结构，产出具有精准性、前瞻性的商品策划，为商品力负责，提升商家/商品数量。2.负责特定类目（如3C数码、家居百货、生鲜食品等）下 POP 商品，制定类目商品规则，负责提升单品效能及ROI，针对商品生命周期进行整体规划和运营，基于各资源位进行货品策略制定。3.结合品类规划，把握消费者购买决策的关键因素，在销售策略、渠道推广产出方案并执行落地，...,运营商/增值服务,http://jobs.zhaopin.com/CCL1317363300J40855739503.htm,10000人以上,2025-11-13 09:21:13
运营管理岗/团队管理,杭州,山东玉杰企业管理有限公司,大专,1-3年,"电商运营,销售运营,用户运营,toC,toB,toG",2-3.5万,岗位内容：1. 制定和执行公司运营策略，实现业务增长和盈利目标2. 分析市场和用户需求，优化产品和服务的特性和差异性3. 挖掘和引入新的运营模式和流程，提高效率和降低成本4. 合理规划并管理预算，确保预算使用的高效5. 协调各部门和团队间的合作，保证工作流程的顺畅和高效6. 具有丰富的团队管理和协调能力，擅长解决复杂问题7. 能够快速适应公司的文化和价值观，并愿意在团队中为公司目标而努力奋斗,在线招聘/求职,http://jobs.zhaopin.com/CCL1469980330J40846123512.htm,20-99人,2025-11-05 11:54:11
双休底薪6600招运营/七小时工作制/五险一金,杭州,中国平安,大专,经验不限,"五险一金补充医疗保险,年终奖，带薪年假,朝九晚六,双休不加班",面议,"此岗位本月急招,招满为止！！！可接受无经验,公司提供完善的培训和发展空间！上班时间早上9：00-12：00，2：00-6：00七小时工作制,周末双休,不加班工作内容：针对已购客户做好维护,解答客户问题无需开发新客户,仅需做好客户承接就可以做好公司的老客户维系和服务,树立公司的形象薪资待遇底薪6600+提成+高额奖金+福利:综合收入18K-30K福利待遇1,上班时间早上9:00到下年6:00,午休2...",银行,http://jobs.zhaopin.com/CC000204810J40855590912.htm,10000人以上,2025-12-03 13:41:43
产品运营及分析（行业数据分析方向）,杭州,中国移动通信有限公司在线营销服务中心,本科,3-5年,"用户增长,活动策划,产品迭代",3-3.5万,岗位职责:1.市场与行业分析：收集监控行业主流数据信息，分析品类结构、价格带分布、新品趋势，为类目发展策略和招商方向提供数据建议。2.业务专题分析：定期输出经营分析报告，针对核心业务场景进行深度归因分析，定位关键问题，并提出可落地的优化方案。3.数据体系与监控：参与构建和优化业务数据监控体系，定义关键指标，并建立日常数据看板。及时发现数据异常波动，深入分析原因，预警业务风险。4.数据驱动决策：与运...,运营商/增值服务,http://jobs.zhaopin.com/CCL1317363300J40855734403.htm,10000人以上,2025-11-13 09:15:28
销售专员,杭州,杭州微易融信息技术有限公司,大专,经验不限,"企业客户,个人客户",2.2-3.5万,注：岗位为销售岗位，不包食宿，接受无经验小白。有带薪培训及老带新，需要线下面试沟通。【工作内容】1 .业务部分：受理来访客户的融资申请，了解和分析客户当前情况，制定融资方案；对客户进行邀约、签约以；2.技能部分：公司提供培训带教，包教包会。学习并总结客户案例，了解各银行的产品优势和细节，做好客户的日常信用养护提醒，整合渠道资源学习融资方案的梳理；3.不用开发客户，不用开发渠道！接受无经验【岗位任职...,互联网金融/小额贷款,http://jobs.zhaopin.com/CCL1379048170J40312786808.htm,100-299人,2025-11-04 11:49:44
临床医学经理/专员 (MJ000377),杭州,杭州百诚医药科技股份有限公司,硕士,3-5年,"Ⅱ期,Ⅲ期,药物研究,上市前",2-3.5万,岗位职责：1、 负责公司与临床客户开展临床研究的设计和推进；2、 负责撰写/审核临床研究项目相关的注册申报资料和伦理审查资料，包括但不限于研究方案、知情同意书、研究者手册、临床总结报告等； 3、 负责临床项目的医学监查，包括受试者入排审核，对EDC中数据或研究中心数据进行医学监查、提出医学质疑并跟进质疑答复情况，SAE报告协助审核、PD list 审核，医学编码审核等；4、 拜访研究者，与研究者沟...,医药制造,http://jobs.zhaopin.com/CC458900520J40946884104.htm,500-999人,2025-10-31 00:13:22
跨境电商运营经理（ATV、摩托车）,杭州,永康市睿与辰工贸有限公司,本科,5-10年,"亚马逊,eBay,速卖通,海外推广,数据运营,Facebook,YouTube,英语",2-3.5万,1. 战略统筹与目标达成◦ 制定跨境电商中长期发展战略，聚焦亚马逊、Shopify 独立站、TEMU 等主流平台，拆解年度 销售额目标至季度 / 月度执行计划。◦ 洞察欧美 EPA 认证、欧盟 CE 认证等市场准入规则，结合沙滩车 / 摩托车品类特性规划选品与定价策略。1. 全链路运营管理◦ 统筹平台运营：主导 Listing 优化、广告精细化投放、爆款打造，监控库存周转率，协调供应链解决大件货物...,通用设备制造,http://jobs.zhaopin.com/CC834086230J40724376706.htm,300-499人,2025-10-14 10:58:31
找工作看这里！精准客户电销专员/月入2w+,杭州,杭州新壹代信息技术咨询有限公司,学历不限,经验不限,"企业客户,个人客户,KA大客户",1.9-3.5万,职等你来！！！任职资格:1.学历不限，优秀者可接受应届生!2.工作认真负责，积极主动！3.具有良好的口头表达能力何沟通技巧！4.有直销或电话销售工作经验者优先考虑！工作时间:1.09:00-18:002.法定节假日正常休3.午休两小时 ！岗位职责:1.通过电话、微信等方式与公司现有客户进行联系沟通2.针对客户的不同需求提供合适的产品福利待遇：1.薪资5100-5600+最高45%提成开单即转正（能...,互联网金融/小额贷款,http://jobs.zhaopin.com/CCL1302666030J40811261810.htm,100-299人,2025-10-13 09:19:29
销售代表 销售专员 销售经理,杭州,跨越速运,大专,1-3年,"渠道销售,物流 销售",1.8-3.5万,岗位内容：1. 接收、处理客户的订单信息，跟进货物运输；2. 处理物流环节中可能出现的问题，及时通知相关人员解决；3. 组织、安排、监督、协调内外部人员的工作；4. 完成部门主管交给的其他任务。5.开发维护新老客户 岗位待遇： 1、新人入职公司带薪培训 ，前期经理带教。 2、入职缴纳五险，可缴纳一金 单休固定周日休息。3、第一个月无责底薪6800，第二个月起无责底薪7400，不包含额外岗位激励奖励...,货运/物流/仓储,http://jobs.zhaopin.com/CC574811320J40721791511.htm,10000人以上,2025-10-08 18:28:43
