职位,城市,公司,学历,经验,技能,薪资,工作描述,行业,职位URL,公司规模,发布时间
央企理财专员/理财顾问/销售经理,杭州,中国人寿保险股份有限公司杭州市分公司第一营销服务部(君诚支部),大专,经验不限,"个人客户,企业客户,KA大客户,电话销售,面销/陌拜,会议/会展销售",2-3.5万,一、岗位内容1、为客户提供专业全面、量身定做的投资和保险规划服务，包括保障、储蓄、投资、子女教育、退休养老规划等，为高净值客户提供资产配置和财富传承方案；2、为客户提供专业建议，与客户保持良好沟通，做好维护与后期服务，不断提升客户满意度。3、运用财富规划理念，捕捉投资和保险业务机会，以客户需求为导向；4、维护老客户做好保全和服务工作，开发新单。二、薪资待遇和工作时间 1、薪资包含：新人津贴(根据每...,保险,http://jobs.zhaopin.com/CCL1501708500J40787858612.htm,300-499人,2025-09-29 19:12:35
萤石-人力资源专员-杭州,杭州,杭州海康威视数字技术股份有限公司,本科,1年以下,,2.5-3.5万,职位描述：1.协助招聘业务的日常开展，包括简历搜索、系统录入、面试邀约及接待。2.协助完成渠道项目日常运营。3.完成人力资源部其他辅助性工作。 任职资格：1.在校大学生，热爱人力资源工作，熟悉招聘模块的办理流程优先考虑；大三、研二优先。2.每周保障4天及以上的全职实习时间，能保证4个月以上或更长时间的延续实习；3.普通话标准，具有较好的沟通表达能力，熟练使用office办公软件，有较强的学习能力和...,人工智能,http://jobs.zhaopin.com/CC120975580J40891869315.htm,10000人以上,2025-09-25 14:02:08
周末双休/每天8小时 月入1W+ 平安社区网格运营销售 保险销售+金融销售 薪资面谈,杭州,中国平安人寿保险股份有限公司浙江分公司上城区营销服务部,大专,经验不限,"销售,续保,寿险,团体险,个险产品,面销/陌拜	,电话销售,会议/会展销售	",1.8-3.5万·15薪,❤【招聘部门】平安集团-网格部（不是代理人，不是区拓，不是普惠，不是综合金融）平安未来10年核心部门❤【招聘岗位】社区网格专员（老客户服务维护+二次开发／二次续费）❤【七大优势】岗位有意向有兴趣可随时投递~HR本人24小时在线无休息~1、【时间】不加班，朝九晚六，固定周末双休，法定节假日跟着国家放2、【客户】公司提供精准客户资源转化，客户网格集中划分，不用东奔西跑3、【薪资】保底工资高，保底工资不...,保险,http://jobs.zhaopin.com/CCL1479806180J40788586214.htm,10000人以上,2025-09-09 00:00:00
电话销售专员【底薪8000+双休+五险一金】,杭州,杭州浙理融网络科技有限公司,大专,经验不限,"个人客户,企业客户",1.8-3.5万,公司简介：公司在杭州CBD钱江新城，甲级商业写字楼，公司面积1800平方。公司在杭经营3年，主要从事银行居间业务，公司规模在同行业数一数二。公司的团队基本上是90后，95后的俊男靓女，工作氛围轻松，福利多多，期待您的加入招聘：初级顾问（5名）相应政府号召，我司对应届毕业生，退伍军人优先考虑，；职位要求：普通话标准，形象气质良好；大专及以上学历；(能力优秀可以放宽）个人征信良好，身体健康；岗位职责：...,银行,http://jobs.zhaopin.com/CCL1417693890J40585333413.htm,100-299人,2025-08-27 16:21:51
新媒体运营总监,杭州,杭州兆能新能源科技有限公司,本科,5-10年,"文案,运营,光储充",2.5-3.5万,岗位内容：1. 研究行业动态和市场变化，制定全面的运营计划2. 整合并优化公司内外资源，提高运营效率和成本控制能力3. 分析竞争对手及市场趋势，制定和优化产品和服务策略4. 建立良好的客户关系，提高客户满意度和忠诚度5. 提供有效数据和报告，指导决策和优化业务流程任职要求：1. 本科以上学历，5年以上互联网或相关行业运营管理经验2. 具有出色的战略规划和数据分析能力，善于挖掘业务增长点3. 优秀的...,新能源,http://jobs.zhaopin.com/CCL1483273150J40706604109.htm,20-99人,2025-07-01 00:00:02
ai销售专员,杭州,杭州天生主角科技有限公司,学历不限,经验不限,,2-3.5万,有梦想，不甘现状，想抓住AI时代风口的请仔细看详情介绍。 --------------------------------------------分割线----------------------------------------------------我们公司有三大业务板块：1.知识付费2.企业服务3.系统开发 我们目前主做人工智能知识付费，企业服务和数字化平台，吸引全国的企业与个体户入住我们...,人工智能,http://jobs.zhaopin.com/CCL1400954970J40742770310.htm,20-99人,2025-06-25 10:40:09
销售专员+零基础可带薪培训,杭州,杭州我爱我家房地产经纪有限公司,大专,无经验,"住宅房产,二手房,新房,地推销售,区域销售,电话销售,五险一金,带薪培训,带薪年假,高提成",2.4-3.5万,部分区域可安排住宿或补贴【工作职责】1、新员工入店，熟悉了解所在门店周边的小区环境。2、收集、发布房屋出售或出租信息；3、在店内与客户电话沟通，了解客户需求并匹配优质合适房源；4、根据客户意向，带客户看房并进行房子优劣势分析；5、与房东客户进行三方面谈，促成房子成交，从中收取佣金；6、对客户提供后期服务，维护客户关系。【任职资格】(1）年满19-40周岁内，热爱销售行业；(2）具备良好的沟通表达能...,房地产开发,http://jobs.zhaopin.com/CC140599110J40738947207.htm,10000人以上,2025-03-31 14:38:57
养老运营项目经理,杭州,杭州中壹瑞和信息科技有限公司,大专,经验不限,,2.5-3.5万,养老职业规划师主要工作内容如下： 1、负责针对老年人群根据其收入状况提供相应的养老咨询、推荐服务； 2、通过公司的专业化培训，为客户群体提供专业化顾问式养老规划服务； 3、积极参加公司提供的各类培训，不断提高业务素质； 4、负责高端个人客户的维护、客户资料的管理及客户的二次开发,咨询服务,http://jobs.zhaopin.com/CCL1443521440J40492028201.htm,20-99人,2025-03-31 11:20:41
信用卡专员,杭州,兴业银行杭州分行,大专,经验不限,"面销,地推,陌拜",1.8-3.5万,高薪岗位招人：正常干12K/月，努力干18K/月，拼命干30K/月+，年薪40万招精英岗位描述：兴业银行信用卡中心业务转型升级，打破传统自己开发客户的模式，诚招优秀的大客户经理，全新的岗位，全新的理念，全新的营销模式，为2022年全新的你搭建一个更好的平台！期待你的加入 岗位内容：利用银行提供的精准数据为客户办理业务（所有的客户均由我行提供，无需自己开发客户）◆ 具备一定的沟通能力，性格活波开朗，...,银行,http://jobs.zhaopin.com/CC145645700J40243279213.htm,1000-9999人,2025-02-21 11:04:52
运营副院长,杭州,杭州朴愈医疗综合门诊部有限公司,本科,5-10年,"三甲医院,民办医院,医院,体检中心",2-3万,岗位亮点·机构核心领导岗：全面负责医疗门诊部的运营管理工作，是达成机构战略与经营目标的核心负责人之一。·发挥平台价值：在高端医疗平台上，整合资源，打造卓越的客户服务体验与高效的运营体系。·赋能团队成长：领导并培养专业运营团队，实现个人领导力与机构发展的双重成就。岗位职责1.根据集团战略，制定并实施门诊部的年度运营计划、预算及绩效目标。2.全面负责门诊部的日常运营管理，优化服务流程、客户体验和内部协...,卫生服务,http://jobs.zhaopin.com/CCL1511793510J40812238201.htm,20-99人,2026-01-12 01:01:54
社区金融服务专员（富阳）,杭州,中国平安人寿保险股份有限公司浙江分公司2,大专,3-5年,"保险销售,销售,寿险,面销/陌拜	",1.5-3万,加入世界五百强，开启职业生涯新篇章!平安集团-网格部(不是区拓，不是普惠，不是综合金融)平安未来30年核心部门【薪资福利】1. 底薪5600-7900 + 新人津贴（1500-10000/月，连续一年） + 高绩效提成（10%-50%）+最高30%绩优达成奖+最高14%季度奖2. 试用期1-3月薪资8k-15k，转正后综合薪资15k-30k 3. 六险一金+带薪年假+节日福利+月度/季度奖励 4....,保险,http://jobs.zhaopin.com/CCL1487620770J40762532804.htm,1000-9999人,2026-01-10 21:10:56
央企理财顾问，销售专员，双休月入2万,杭州,中国人寿保险股份有限公司杭州市分公司第一营销服务部(君诚部),大专,无经验,"电话销售,面销/陌拜,会议/会展销售,个人客户,企业客户,KA大客户,积极主动 开朗热情",1.5-3万,一、岗位内容1、为客户提供专业全面、量身定做的投资和保险规划服务，包括保障、储蓄、投资、子女教育、退休养老规划等，为高净值客户提供资产配置和财富传承方案；2、为客户提供专业建议，与客户保持良好沟通，做好维护与后期服务，不断提升客户满意度。3、运用财富规划理念，捕捉投资和保险业务机会，以客户需求为导向；4、维护老客户做好保全和服务工作，开发新单。二、薪资待遇和工作时间1、薪资包含：新人津贴(根据每月...,保险,http://jobs.zhaopin.com/CCL1451138720J40766580102.htm,10000人以上,2026-01-09 09:51:35
天猫推广专员,杭州,杭州松信供应链管理有限公司,本科,3-5年,"天猫,淘宝,电子产品,专员,店长,主管",1.5-3万,我们期待你，不只是运营店铺，更是驱动一个品类的增长引擎！ 岗位职责：你将负责并成就什么？ 1. 品类增长与生意操盘 · 作为店铺负责人，独立制定并执行3C品类的整体运营策略与月度/季度规划，对销售额、毛利及市场份额的核心增长目标直接负责。 · 将战略目标拆解为精准的日/周行动计划，通过持续的数据追踪与运营调优，确保生意目标超额达成。 2. 数据洞察与策略攻坚 · 深度挖掘店铺流量、转化、客单价及用...,电子商务,http://jobs.zhaopin.com/CCL1516448760J40786217016.htm,20-99人,2026-01-08 12:07:23
萧山社区金融服务专员「五险一金+早九晚六+周末双休+提供优质老客户资源」,杭州,中国平安人寿保险股份有限公司浙江分公司2,大专,经验不限,"社区深耕,客户资源稳定,客情维护",1.5-3万,平台硬实力：世界500强，金融行业头部品牌，培训体系完善，行业大佬亲授经验，小白也能快速上手！【岗位职责】1.根据公司客户划分，需完成负责区域内客户售后服务响应、服务活动完成；2.负责区域内客户建联，通过微信群等做好客户日常经营；如热点话题、健康养生、生活小细节等，提升客户活跃度；3.依托公司内外部资源，打造个人IP“做客户金融小帮手、生活小助手”，进行产品销售；4.客户原保单的续收提醒，具备基础...,保险,http://jobs.zhaopin.com/CCL1487620770J40973406004.htm,1000-9999人,2026-01-09 14:02:26
销售流程经理（杭州）,杭州,山西泫氏实业集团有限公司,本科,3-5年,"建筑建材行业,营销流程制定,客户关系管理,客户数据分析",2-3万,1.主动学习销售知识，学以致用优化营销流程； 2.识别客户问题，提出针对性解决方案和系统性改进方案； 3.独立设计并实施客户关系管理策略，显著提升客户满意度和忠诚度； 4.协助销售代表进行市场分析/客户分析，增加销售机会； 5.做过CRM数据分析项目案例，提升销售效率、客户满意度和市场响应速度； 6.协调解决销售过程中遇到的跨部门问题， 确保信息流畅。,电气机械/电力设备,http://jobs.zhaopin.com/CC689270920J40743835306.htm,1000-9999人,2026-01-08 11:51:33
销售运营经理,杭州,东方鸿鹄(杭州)科技有限公司,大专,5-10年,,2.2-3万,岗位职责1、带领团队执行公司制定的营销计划，分析销售数据，挖掘销售机会，制定营销策略，指导各区域销售工作；2、监督指导大区销售运作、销售执行等日常工作，做好各区业务人员与总部领导之间的上传下达，推动政策落地和业务发展；3、协助总经理做好内部销售管理、经销商管理、价格管理及渠道促销的推动工作。职位要求1、大专及以上学历，三年以上酒水、饮料、食品快消销售管理/运营工作经验；2、有较强的数据分析能力和销...,快速消费品,http://jobs.zhaopin.com/CCL1411763750J40859943203.htm,100-299人,2026-01-07 16:28:55
杭州社区金融服务专员「五险一金+早九晚六+周末双休+提供优质老客户资源」,杭州,中国平安人寿保险股份有限公司浙江分公司2,大专,经验不限,"客情维护,客户资源稳定,社区深耕",1.5-3万,平台硬实力：世界500强，金融行业头部品牌，培训体系完善，行业大佬亲授经验，小白也能快速上手！ 【岗位职责】 1.根据公司客户划分，需完成负责区域内客户售后服务响应、服务活动完成； 2.负责区域内客户建联，通过微信群等做好客户日常经营；如热点话题、健康养生、生活小细节等，提升客户活跃度； 3.依托公司内外部资源，打造个人IP“做客户金融小帮手、生活小助手”，进行产品销售； 4.客户原保单的续收提醒...,保险,http://jobs.zhaopin.com/CCL1487620770J40973366504.htm,1000-9999人,2026-01-09 14:02:18
销售流程经理（杭州）,杭州,山西泫氏实业集团有限公司,本科,3-5年,"建筑建材行业,营销流程制定,客户关系管理,客户数据分析",2-3万,1.主动学习销售知识，学以致用优化营销流程； 2.识别客户问题，提出针对性解决方案和系统性改进方案； 3.独立设计并实施客户关系管理策略，显著提升客户满意度和忠诚度； 4.协助销售代表进行市场分析/客户分析，增加销售机会； 5.做过CRM数据分析项目案例，提升销售效率、客户满意度和市场响应速度； 6.协调解决销售过程中遇到的跨部门问题， 确保信息流畅。,电气机械/电力设备,http://jobs.zhaopin.com/CC689270920J40746203306.htm,1000-9999人,2026-01-08 11:40:03
美妆电商运营部经理 15-20k 具体面议,杭州,上海辅佐供应链有限公司,大专,5-10年,"淘宝/天猫,京东,主管,经理",2-3万,"【岗位职责】：1、负责公司旗下全品牌国内全电商渠道（淘宝、天猫、京东、抖音等，以及私域平台）平台营运销售管理工作，包括运营团队管理、营销活动管理，对渠道平台的运营及销售目标负责；2、负责制订公司整体电商营销战略，制订营销策略与营销计划，建立营销绩效管理体系；3、依据营销计划，执行销售和市场推广方案，制定营销渠道发展策略和计划,负责渠道具体合作方式的建立工作，发展渠道合作伙伴；制定合作方案；4、制定...",人力资源服务,http://jobs.zhaopin.com/CCL1321577570J40818969609.htm,500-999人,2026-01-07 16:18:57
临平社区金融服务专员「五险一金+早九晚六+周末双休+提供优质老客户资源」,杭州,中国平安人寿保险股份有限公司浙江分公司2,大专,经验不限,"老客户关系维护,金融知识普及,客情维护,社区深耕,客户资源稳定",1.5-3万,平台硬实力：世界500强，金融行业头部品牌，培训体系完善，行业大佬亲授经验，小白也能快速上手！ 【岗位职责】 1.根据公司客户划分，需完成负责区域内客户售后服务响应、服务活动完成； 2.负责区域内客户建联，通过微信群等做好客户日常经营；如热点话题、健康养生、生活小细节等，提升客户活跃度； 3.依托公司内外部资源，打造个人IP“做客户金融小帮手、生活小助手”，进行产品销售； 4.客户原保单的续收提醒...,保险,http://jobs.zhaopin.com/CCL1487620770J40975566504.htm,1000-9999人,2026-01-09 14:02:07
运营经理,杭州,中美联泰大都会人寿保险有限公司江苏分公司,大专,3-5年,"数据运营,活动运营,新媒体运营",2-3万·13薪,岗位内容：1. 管理公司的日常业务运营，包括财务、人力资源、客户服务和销售等方面。2. 制定和实施流程和政策以提高效率和生产力。3. 监督公司的各个指标并提供分析报告以优化业务流程。4. 参与跨部门协作以推动公司目标的实现。5. 改进公司工作流程和业务流程，提高客户满意度和业务利润。任职要求：1. 具有优秀的领导力和团队管理能力，能够激励和引导下属开展工作；2. 熟练掌握公司运营所需的各种工具和软...,保险,http://jobs.zhaopin.com/CC140883570J40804712703.htm,10000人以上,2026-01-07 08:49:13
驻赤道几内亚西语商务专员,杭州,张家港万蓬木业有限公司,本科,经验不限,"笔译,口译,西班牙语专业四级,西班牙语专业八级,西班牙语DELE考试B1级,西班牙语DELE考试C1级",2-3万,岗位职责：1.非洲区当地员工人事管理，合同文本，会议等日常翻译；2.负责与当地相关政府部门文件和日常沟通对接。3.负责当地市场和合作商对接，货运等相关事宜对接。4.领导交办的其他工作。岗位要求：1、有海外工作经验者优先，西语听说书写均非常流利。2、办事认真，谨慎细心，耐心。3、工作积极，有良好的职业道德和沟通能力。4、本科以上学历，2年以上海外工作经验。5、西语相当于专业八级或者B2以上水平（能力...,贸易/进出口,http://jobs.zhaopin.com/CC534707020J40802410903.htm,500-999人,2026-01-06 01:04:39
富阳区社区金融服务专员「五险一金+早九晚六+周末双休+提供优质老客户资源」,杭州,中国平安人寿保险股份有限公司浙江分公司2,大专,经验不限,"客情维护,客户资源稳定,社区深耕",1.5-3万,平台硬实力：世界500强，金融行业头部品牌，培训体系完善，行业大佬亲授经验，小白也能快速上手！ 【岗位职责】 1.根据公司客户划分，需完成负责区域内客户售后服务响应、服务活动完成； 2.负责区域内客户建联，通过微信群等做好客户日常经营；如热点话题、健康养生、生活小细节等，提升客户活跃度； 3.依托公司内外部资源，打造个人IP“做客户金融小帮手、生活小助手”，进行产品销售； 4.客户原保单的续收提醒...,保险,http://jobs.zhaopin.com/CCL1487620770J40973369704.htm,1000-9999人,2026-01-09 14:01:59
视频号经理,杭州,山东赢响力网络科技发展有限公司,大专,3-5年,电商运营,2-3万,岗位职责：1.战略与运营： 制定视频号年度/季度增长策略，通过优化自然流和付费流，确保投资回报率，完成GMV目标。2.团队与管理： 搭建并管理运营团队，通过招聘、培训和绩效考核，提升团队整体专业能力与效率。3.产品与孵化： 主导私护等品类的爆品打造，全流程负责选品、测试与推广，并建立标准化运营流程。4.资源与风控： 整合视频号官方、达人、供应链等资源，主导大促活动，并建立合规体系，确保业务安全。任...,电子商务,http://jobs.zhaopin.com/CCL1373286820J40735805106.htm,500-999人,2026-01-05 08:49:47
亚马逊欧洲站运营专员,杭州,浙江安吉兴广家居用品有限公司,大专,1-3年,"亚马逊,精品运营,亚马逊欧洲站运营,Amazon",2-3万,工资和提成都是每月发放，这个月发上个月提成，诚招有能力的欧洲站运营，薪资待遇高于同行！ 诚招有能力的欧洲站运营，工资待遇你可以提！岗位职责：1、熟悉欧洲Amazon的各项政策，负责公司内亚马逊欧洲店铺的利润正向和管理。2、规划及实施年度、季度和月度各店铺的销售及运营计划，及时反馈和总结出有关订单的情况及网站运营数据，根据运营情况策划运营推广活动方案。3、控制产品风险，拟定合理的产品上架计划，完善店...,贸易/进出口,http://jobs.zhaopin.com/CC226171130J40687496011.htm,20-99人,2026-01-05 00:00:01
社区网格高级专员(下沙、九堡、临平),杭州,中国平安人寿保险股份有限公司浙江分公司2,大专,1-3年,"销售,寿险,财产险,医疗险,面销/陌拜	,电话销售,网络销售",1.5-3万,加入世界五百强，开启职业生涯新篇章!平安集团-网格部(不是区拓，不是普惠，不是综合金融)平安未来30年核心部门【薪资福利】1. 底薪5600-7900 + 新人津贴（1500-10000/月，连续一年） + 高绩效提成（10%-50%）+最高30%绩优达成奖+最高14%季度奖2. 试用期1-3月薪资8k-15k，转正后综合薪资15k-30k 3. 六险一金+带薪年假+节日福利+月度/季度奖励 4....,保险,http://jobs.zhaopin.com/CCL1487620770J40916169404.htm,1000-9999人,2026-01-09 11:22:42
写字楼运营总经理,杭州,浙江金鹭集团有限公司,大专,10年以上,"招商管理,运营管理,园区运营",1.8-3万·16薪,需要全面的运营管理能力、市场开拓和客户服务的前瞻性思维。负责羽绒大厦的整体运营及管理工作。该羽绒大厦总建筑面积达10万平方米，投资约12亿元。1、制定并执行写字楼的整体运营战略、年度预算及商业计划、主导租金策略，确保出租率和租金收益最大化。2、做好整体运营与物业服务管理工作。3、建立并维护与现有租户及潜在客户的长期良好关系。4、董事会安排的其他重要事宜。任职要求：1、至少8年高端商业或写字楼物业综...,家具制造,http://jobs.zhaopin.com/CC192878010J40834452214.htm,500-999人,2026-01-04 00:00:01
岩土工程研究专员,杭州,浙江省长三角基础设施科学研究院,硕士,1-3年,"岩土工程设计,岩土工程监测,岩土工程检测,岩土工程施工",2-3万,岗位职责：1．负责编制设计、临近施工对既有结构物影响等安全性评价报告工作。2．参与编制行业设计、检测、评价、养护等相关技术标准。3．组织市政、养护、运维等相关科研课题申报与实施，推动产学研合作，促进技术成果转化。4．参与重大工程可行性研究等研究，提供专业化决策依据。岗位要求：1．硕士及以上学历，岩土工程相关专业。2. 具有1年以上科研机构、设计院或咨询公司经验；3. 参与过安全性评价或行业标准编制...,学术/科研,http://jobs.zhaopin.com/CC450513130J40801197801.htm,20-99人,2026-01-01 01:01:10
直播运营总监（水杯、潮玩、文创）,杭州,广博集团,本科,5-10年,"抖音,快手,小红书,电商类,美妆类,潮玩品,货品组织,水杯",1.5-3万,一、岗位职责1. 制定直播战略规划（GMV/流量目标），规划自播+达人矩阵及美妆/水杯等品类货盘布局。2. 主导选品与货品组织，基于数据筛选高潜力商品，优化排品逻辑（引流/利润/爆款组合），联动供应链控本保量。3. 策划直播全流程（主题/脚本/玩法），设计差异化策略（如美妆测评、水杯场景实测），打造爆款场次。4. 负责直播投流（千川/DOU+等），制定投放策略（预算/人群/素材），优化ROI提升流...,互联网,http://jobs.zhaopin.com/CC140750000J40834208814.htm,1000-9999人,2025-12-31 13:59:18
运营经理,杭州,杭州微甲医院有限公司,本科,3-5年,"社群运营,用户运营,toC,私域运营",1.5-3万,岗位职责：1. 制定私域运营目标与策略，搭建并管理团队，统筹日常工作与复盘，确保目标落地。2. 私域与内容运营：搭建私域用户沉淀体系及运营SOP，统筹优质内容产出，做好用户分层与标签化管理，推动梯度转化。3. 线上线下联动：结合医院线下活动，设计联动策略，实现用户私域沉淀与线下激活闭环。4. 数据与合规管控：跟踪核心运营数据，优化策略；严守行业合规要求，防范运营风险，维护品牌声誉。任职要求：1. ...,医院,http://jobs.zhaopin.com/CC666213130J40835991405.htm,20-99人,2025-12-30 10:29:54
销售流程经理（杭州）,杭州,山西泫氏实业集团有限公司,本科,3-5年,"建筑建材行业,营销流程制定,客户关系管理,客户数据分析",2-3万,1.主动学习销售知识，学以致用优化营销流程； 2.识别客户问题，提出针对性解决方案和系统性改进方案； 3.独立设计并实施客户关系管理策略，显著提升客户满意度和忠诚度； 4.协助销售代表进行市场分析/客户分析，增加销售机会； 5.做过CRM数据分析项目案例，提升销售效率、客户满意度和市场响应速度； 6.协调解决销售过程中遇到的跨部门问题， 确保信息流畅。,电气机械/电力设备,http://jobs.zhaopin.com/CC689270920J40743648506.htm,1000-9999人,2025-12-29 16:30:28
