职位,城市,公司,学历,经验,技能,薪资,工作描述,行业,职位URL,公司规模,发布时间,薪资_最小值,薪资_最大值,年薪月数
平台运营总监,杭州,河北胜创企业管理有限公司,大专,5-10年,"电商平台,交易平台,推广运营,平台运营",20000-30000,工作地点在河北邯郸岗位职责：1、负责公司电商平台（紧固件）的整体规划及运营团队组建、包括平台产品运营、用户运营、商家运营、流量运营，实现商业化。2、深入研究 2B/2C 线上商城采购业务的特点、目标客户群体的需求以及市场竞争态势，制定平台的整体运营计划、包含长期发展战略以及阶段性运营目标。3、完成平台服务落地推广工作，结合客户及业务目标开展需求洞察分析并策划各类分化营销活动，包括日常促销、主题促销...,企业服务,http://jobs.zhaopin.com/CC595019230J40802958011.htm,500-999人,2025-11-07 09:20:44,20000.0,30000.0,12.0
产品经理（环保产品）,杭州,杭州绿洁科技股份有限公司,本科,3-5年,,15000-30000,一、岗位职责：1、负责产品（水质/大气在线监测）设计规划、用户调研分析，产品管理和项目推进；2、负责智慧环保项目相关建设方案、解决方案、分析报告等技术方案的编写；3、负责智慧环保综合服务平台相关产品的业务层面的技术统筹协调，包括产品架构、功能结构、产品原型、业务逻辑等内容；4、负责与合作单位的项目接洽、技术交流等工作；5、负责收集梳理行业相关产品技术资料；6、负责组织、参与公司的项目及行业的需求调...,环保,http://jobs.zhaopin.com/CC337751430J40806729107.htm,500-999人,2025-11-05 15:39:38,15000.0,30000.0,12.0
公共照明产品经理,杭州,罗莱迪思,本科,3-5年,硬件产品,20000-30000,岗位职责:1、负责产品功能的定义、规划和设计，根据产品生命周期协调研发、生产、运营等相关部门推动相应产品的开发；2、搜集市场新需求和竞品资料，进行需求分析、竞品分析，并研究产品发展趋势；3、结合市场与竞品情况进行产品价格策略与开发成本目标制定，定期与不定期进行成本分析与优化，持续提升产品价格优势；4、执行新品上市计划，通过对销售人员的培训和客户拜访等进行产品的深度推广；5、根据市场脉动与时事进行新...,电子/半导体/集成电路,http://jobs.zhaopin.com/CC266600710J40321836008.htm,500-999人,2025-10-28 18:51:06,20000.0,30000.0,13.0
运营助理岗,杭州,中美联泰大都会人寿保险有限公司宁波中心支公司,大专,1-3年,"活动运营,商家运营,数据运营",18000-30000,岗位职责:1. 负责部门的日常管理工作，确保部门运作高效顺畅。2. 领导团队完成公司交付的任务，并保证任务按时高质量完成。3. 促进团队成员之间的协作，优化团队结构和工作流程。任职要求：1. 具备出色的沟通能力，能够有效地与团队和客户进行交流。2. 拥有团队合作精神，能够在团队环境中迅速适应并贡献力量。3. 具备持续学习和改进的能力，能够不断提升个人和团队的工作效率。,保险,http://jobs.zhaopin.com/CC510061780J40836553013.htm,100-299人,2025-10-26 13:18:29,18000.0,30000.0,13.0
科仪与感知方案部-产品市场经理-杭州,杭州,杭州海康威视数字技术股份有限公司,本科,3-5年,,18000-30000,职位描述：1、负责产品市场洞察及需求收集，主要工作包括基于对市场、行业形势、竞品、客用户需求以及产品技术发展趋势等的洞察，输出产品需求调研结果及产品市场策略，并向研发部门提供产品设计和规划的参考意见，推动产品完善与快速迭代；2、负责对应行业的新产品的业务样板落地，制定对应细分行业的市场营销及推广计划3、构建产品行业销售渠道和通路，提升产品的行业产品影响力，协同销售团队达成产品的销售业绩。4、负责产...,人工智能,http://jobs.zhaopin.com/CC120975580J40780660015.htm,10000人以上,2025-10-17 15:27:35,18000.0,30000.0,12.0
数字平台生态运营专员,杭州,浙江同创乾元控股有限公司,大专,3-5年,,15000-30000,一、工作职责:1. 渠道支持与赋能 (40%)· 作为渠道伙伴的主要对接人，负责其从入驻到产出的全周期服务。· 为渠道伙伴提供平台系统操作、产品政策、结算规则等全方位培训。· 协助渠道解决在客户引荐、跟进过程中遇到的各种问题，提升渠道的积极性和产出效率。2. 客户运营与关系维护 (30%)· 负责对接用工企业及服务商，解答其在平台使用、任务发布/接单、合同签署、费用结算等环节的日常咨询。· 主动跟...,企业服务,http://jobs.zhaopin.com/CCL1495334090J40725173606.htm,500-999人,2025-10-16 12:57:10,15000.0,30000.0,12.0
海外电动车产品开发经理,杭州,杭州奔途数字科技有限公司,本科,5-10年,,25000-30000,岗位主要职责 负责海外电动车产品开发工作，从产品设计到最终落地全流程把控。 独立撰写产品规格书、BOM、性能测试方案，确保产品符合设计标准和市场需求。 深入了解海外市场用户需求与场景，结合市场导向意识，进行产品的场景设计，打造具有竞争力的产品。 熟悉三电核心指标（如电池 BMS 管理、电控 CAN 通信、电机效率等），与供应商进行对接调试，保障产品性能。 推动产品开发进程，协调各部门资源，确保产品...,电子商务,http://jobs.zhaopin.com/CCL1477666030J40782231602.htm,20-99人,2025-10-07 09:20:01,25000.0,30000.0,12.0
大健康运营管理经理,杭州,百帝惠源(浙江)集团有限公司,本科,1-3年,运营管理,20000-30000,大健康管理运营经理的核心职责是统筹大健康管理项目的整体运营，通过优化服务流程、整合资源及数据分析，实现用户健康管理效果与业务目标的双重达成。 具体岗位职责可分为以下几类： 1. 项目运营统筹：负责大健康管理项目（如健康体检、慢病管理、健康咨询等）的全流程运营，制定运营策略、目标及执行计划，监控项目进度与效果，确保按计划落地。2. 用户管理与服务优化：搭建用户分层管理体系，维护核心用户关系；收集用户...,快速消费品,http://jobs.zhaopin.com/CCL1481405030J40826497913.htm,500-999人,2025-09-18 07:20:08,20000.0,30000.0,13.0
产品经理（能源管理）,杭州,华立科技股份有限公司,本科,3-5年,软件产品,20000-30000,岗位职责：1、负责能源管理系统的全生命周期管理，主导产品规划与版本演进，制定并落实涵盖能效监测、负荷预测、碳排管理等核心功能的产品路线图。2、紧密跟踪国内能源政策与前沿技术趋势，持续挖掘并分析客户真实需求，将其转化为清晰的产品方案。3、高效协调研发、测试等团队，推动产品研发、迭代与发布，全程支持项目交付与落地实施。4、协同销售、实施团队，共同制定产品市场策略与定制化解决方案，为重大项目提供专业的售...,互联网,http://jobs.zhaopin.com/CC140655510J40882537615.htm,1000-9999人,2025-08-26 16:08:28,20000.0,30000.0,12.0
车规功率模块产品经理,杭州,杭州士兰微电子股份有限公司,本科,3-5年,"SIC,IGBT,功率模块",15000-30000,岗位：车规功率模块产品经理岗位职责：1. 负责车规功率模块产品定义（芯片+封装），需求分解，方案及风险策划，产品开发（设计、仿真、制造、测试、可靠性）及评测验收，并解决这过程中所有的技术问题。2. 负责与项目经理协同，管理项目节点推进，流程评审，及产品交付及垂直上量保证。3. 必要时需要前去客户端做产品推介，需求沟通及技术探讨。任职要求：1. 本科以上学历，微电子/电气/电子/机电等专业优先；2....,电子/半导体/集成电路,http://jobs.zhaopin.com/CC133971970J40824796603.htm,500-999人,2025-08-13 15:00:21,15000.0,30000.0,12.0
运营总监-杭州,杭州,杭州楚芯光电科技有限公司,本科,10年以上,"销售运营,产品运营",20000-30000,运营总监概述:运营总监将负责领导运营团队，监督日常运营，并管理运营战略，以确保组织的高效和有效运行。主要职责:1.监督和实施运营战略，以实现组织的目标和目标。2.监督生产部门的产品和活动;在计划/控制，过程质量和改进方面。3.监督组织的日常运作，包括管理预算、进度和资源。4.监督设施和设备的维护/升级工作。5.监控和确保人力计划，生产力和效率，在质量要求范围内满足生产和质量保证/控制部门的每月出货...,电子/半导体/集成电路,http://jobs.zhaopin.com/CCL1420592460J40511863516.htm,20-99人,2025-07-30 16:18:22,20000.0,30000.0,12.0
平台行业运营（工业/泛家居/建材/3C/宠物）(J10174),杭州,米奥兰特,本科,经验不限,"平台运营,跨境电商,工业机械,建材,泛家居,3c电子",15000-30000,岗位职责:1.深挖行业需求，提供专业内容与服务，提升行业网站的专业性与权威性；2.梳理行业品类结构，组织行业化专题营销活动，提升专业买家渗透率；3.数据洞察与反馈，分析用户行为数据，协助完善用户标签，为买家招募团队提供指导并制定分行业素材引导到场；任职要求:1、具有 家居 / 消费电子 / 工业机械/建材 / 宠物等行业运营经验2、熟悉海外市场（如墨西哥、巴西、中东）者优先。,会议/展览,http://jobs.zhaopin.com/CC367638310J40696933506.htm,500-999人,2025-07-22 17:27:14,15000.0,30000.0,12.0
AI运营经理,杭州,杭州中港科技有限公司,本科,3-5年,"销售运营,toG",15000-30000,岗位职责：1、负责昇腾算力业务运营，包括但不限于AI生态运营、算力运营及产业运营；2、负责AI相关项目的市场开拓与分析，基于市场调研，制定并优化商业营销策略；3、围绕运营的价值实现，建设公司运营品牌，实现商业闭环；4、积极构建和维护生态资源，包括政府，科研学术，模型企业，协会组织，行业用户等。任职要求：1、本科及以上学历，理工科专业背景更佳；2、具备AI相关运营经验，在生态运营、算力运营和产业运营...,通信/网络设备,http://jobs.zhaopin.com/CC660549420J40795798105.htm,300-499人,2025-07-22 10:40:57,15000.0,30000.0,12.0
产品经理（配电终端）,杭州,华立科技股份有限公司,本科,5-10年,配电终端,20000-30000,岗位职责：1、根据公司业务发展战略、各区域市场洞察分析，完成产品线产品规划。2、负责主要竞争产家产品分析，输出竞品分析报告，提出产品优化提升方案。3、掌握最新电力公司的技术路线，技术标准，招标模式，评分标准；通过技术及市场洞察寻求业务增长机会点；通过新技术、新产品推广协助建立行业技术品牌等。4、根据产品规划及市场需求完成新产品导入、立项需求评审，负责新产品立项需求评审，输出产品定义。5、负责各省配...,互联网,http://jobs.zhaopin.com/CC140655510J40859238215.htm,1000-9999人,2025-07-16 17:03:53,20000.0,30000.0,14.0
资深电商平台运营/主管,杭州,掌大传媒(杭州)有限公司,本科,3-5年,"电商平台,品类运营,商家运营,类目运营,店铺运营,行业运营",15000-30000,【工作职责】1、对商家进行店铺诊断和业务赋能，结合平台特征、竞品情况、消费者购买习惯等纬度，制定不同的运营和推广策略，实现商家销售额的提升;2、对商家进行分层运营、重点扶持标杆商家，挖掘潜力商家，并通过数据分析的手段，对商家进行运营指导。3、定期对商家进行店铺/商品诊断，并给予优化建议，联合内部资源促成商家销量的提升；4、对商家进行私域运营的指导和赋能。二、任职要求1.本科以上学历:2.单份工作有...,电子商务,http://jobs.zhaopin.com/CCL1306860580J40782834412.htm,300-499人,2025-06-11 10:41:16,15000.0,30000.0,12.0
私域运营专员,杭州,山东荟草堂生物制药有限公司杭州分公司,大专,1-3年,"会员体系搭建经验,C端用户,视频平台,社交平台,直播平台,电商平台,会员体系,用户增长",15000-30000,一、岗位职责1、私域流量转化:包含裂变、拉新、留存、促活、转化全过程;2、内容策划与执行:结合产品特色与用户痛点，策划利于用户转化的优质内容(图文、短视频等)，通过精细化运营提升用户转化率;3、私域平台运营:了解企业微信、社群运营、微信公众号等私域引流裂变手段，促进用户转化;4、数据分析优化:定期分析私域用户行为数据(如活跃度、转化率、复购率等)，输出运营报告并提出优化建议;5、负责运营数据，包括...,电子商务,http://jobs.zhaopin.com/CCL1502464250J40712739916.htm,20人以下,2025-06-09 20:39:08,15000.0,30000.0,12.0
POCT仪器产品经理（国际市场）,杭州,杭州博拓生物科技股份有限公司,本科,3-5年,,25000-30000,岗位职责：1、根据市场需求调研结果确定POCT平台的产品路线图，明确各阶段研发重点，并分析竞品特点提出差异化定位方案。2、组织跨部门团队推进新产品从概念设计到上市发布的全过程，监控项目进度，识别潜在风险点，保障项目按时高质量完成。3、为销售团队和客户提供技术支持与培训，解答关于产品功能、性能等方面的疑问，并积极参与学术交流促进技术创新成果的应用转化。关注用户反馈，组织用户测试，持续改进产品易用性和...,医药制造,http://jobs.zhaopin.com/CC402085610J40770477505.htm,500-999人,2025-04-27 17:10:06,25000.0,30000.0,14.0
首席产品经理,杭州,浙江英集动力科技有限公司,本科,5-10年,,15000-30000,岗位职责：1、承接公司战略，负责公司能源数字化管理等产品的客户调研、竞品分析、需求分享、产品规划等；2、承接产品规划，负责能源数字化业务平台的业务架构设计、产品架构设计；3、指导团队成员开展能源业务平台的产品设计，提升团队的专业度；对分管的能源产品线的产品竞争力、产品交付质量、产品生命力和客户满意度负责。岗位要求：1、统招本科及以上学历，暖通、动力工程、热能动力、能源系统工程、过程控制、工业工程等...,企业服务,http://jobs.zhaopin.com/CCL1431628800J40712472312.htm,100-299人,2025-01-15 15:19:56,15000.0,30000.0,14.0
产品经理,杭州,杭州书拉米医疗科技有限公司,本科,5-10年,,14000-28000,岗位要求：一、产品全周期销售赋能负责公司代理的Ⅲ类医疗器械医美产品（如玻尿酸等）的市场策略制定与销售落地；二、输出标准化产品话术、临床案例库、竞品对比工具包，赋能销售团队及代理商高效转化。三、全国渠道布局与代理商管理1.规划并执行全国代理商网络建设，筛选、评估、签约优质区域合作伙伴；2.制定代理商管理制度，监控进货、库存、终端动销数据，确保渠道健康度；3.聚焦关键资源拓展：牵头对接全国性连锁医美集...,医疗设备/器械,http://jobs.zhaopin.com/CC559908380J40979263004.htm,20-99人,2026-01-09 15:31:44,14000.0,28000.0,12.0
高级运营经理（saas）,杭州,中控技术股份有限公司,本科,3-5年,"用研项目经验,B端用户,SaaS产品,社群运营",14000-28000,【岗位职责】1、用户增长策略制定与落地：负责SaaS软件产品的用户增长全链路运营，结合不同目标市场的用户特征、渠道特性，制定可落地的用户增长策略，包括但不限于获客渠道拓展、转化路径优化、用户留存提升方案，确保用户规模与活跃度达成阶段性增长目标；2、社交媒矩阵搭建与运营：主导国内主流社交媒体平台（如 视频号、抖音、今日头条，小红书 等）的账号矩阵搭建与日常运营，结合产品功能策划优质内容，提升社媒账号...,工业自动化,http://jobs.zhaopin.com/CC191024010J40782189216.htm,1000-9999人,2025-12-19 15:20:33,14000.0,28000.0,14.0
综合运营,杭州,中美联泰大都会人寿保险有限公司上海分公司,大专,1-3年,,14000-28000,岗位内容：1. 关注市场和行业趋势，了解消费者心理需求，提出创意方案和运营建议，促进销售增长；2. 负责社交媒体的日常维护、数据分析和报告输出，反馈内容改进意见和提升策略；4. 协助其他部门完成相关工作。,保险,http://jobs.zhaopin.com/CC282397530J40847376313.htm,10000人以上,2025-12-05 09:45:32,14000.0,28000.0,14.0
海外券商App产品经理,杭州,浙江亿邦通信科技股份有限公司,本科,1-3年,"海外券商APP,客户端产品设计",20000-28000,岗位职责：1. 负责海外券商App客户端的产品规划和设计；2. 负责与产研团队、香港RO团队沟通，推动客户端产品的上线迭代；3. 负责独立完成客户端产品的需求文档撰写和原型输出。任职要求：1. 985、211学校或海外名校毕业，海外留学生经验优先；2. 2年以上客户端产品设计经验，对用户体验和交互有自己的认知；3. 产品基本功扎实，原型设计和文档撰写能力强，具备独立负责整个大功能模块或者App的能...,运营商/增值服务,http://jobs.zhaopin.com/CC352905910J40800495809.htm,300-499人,2025-10-21 15:40:31,20000.0,28000.0,12.0
产品项目经理,杭州,明月药业,硕士,1-3年,"质量管理,资料管理,供应链产品,内容产品,英语",18000-28000,岗位职责：1.公司产品分析整理，按要求不断梳理产品；2.根据已整理产品数据，及时准确提供到市场部及采购部产品相关数据支撑；3.药品注册项目的跟进和协助；药学技术资料的翻译和整理，客户调查问卷的跟踪和回复；岗位要求：1.研究生及以上学历，化工及相关专业，一定的英语读写能力；2.具备项目计划及整理和沟通的能力，责任心强；3.有原料药厂QA、QC等等相关工作经验1-2年或研发公司研发专员1-2年工作经验...,贸易/进出口,http://jobs.zhaopin.com/CC234778819J00356368402.htm,100-299人,2025-03-19 17:03:59,18000.0,28000.0,14.0
运营助理,杭州,中美联泰大都会人寿保险有限公司江苏分公司,大专,1-3年,"产品运营,用户运营",14000-27000,岗位内容：1. 协助制定和实施产品运营策略，负责产品上线、运营、推广和优化等相关工作；2. 负责收集、分析市场数据并撰写市场调研报告，根据市场变化及时调整运营策略；3. 参与团队协作推进各项项目的进展，协调内部资源，提升项目效率和执行力； 4. 协助管理产品社区运营、新媒体运营等运营活动。任职要求：1. 大专及以上学历，2年以上运营经验；2. 熟练掌握 Excel、PPT 等办公软件，具备良好的数...,保险,http://jobs.zhaopin.com/CC140883570J40809424103.htm,10000人以上,2025-07-25 14:23:39,14000.0,27000.0,13.0
运营经理,杭州,你拍拍我拍拍(杭州)科技有限公司,本科,3-5年,"产品运营,数据运营,运营管理,商业化产品",18000-26000,岗位职责：1.策划能力：负责挖掘网红达人商业价值，为其设计专属商业价值方案；2.数据分析能力：通过对各项数据指标分析，进而调整优化方案，提升价值；3.统筹能力：有效沟通团队内部网红达人，共同推进项目良好落地；4.领导力：指导运营专员，带领运营团队完成既定目标。 任职要求：1.在私域流量用户转化领域有完整、清晰的运营方法和成功实践经验，三年及以上相关行业经验： 2.思维活跃、网络敏感度高，对社交媒体...,广播/影视,http://jobs.zhaopin.com/CCL1504331080J40788794111.htm,20人以下,2025-12-03 00:00:01,18000.0,26000.0,12.0
工业智能-产品经理-杭州,杭州,科大讯飞股份有限公司,本科,经验不限,,15000-26000,岗位职责1、产品售前交流和方案编写，能够完成产品介绍，产品技术方案汇报，支撑客户商机推进。主导招投标技术标书编写，完成项目概算、技术方案等材料，配合销售完成招投标工作；2、客户调研与产品方案编写：具备客户调研和需求沟通能力，精准洞察不同层级用户的核心诉求与心理预期，明确需求优先级及技术可行性，基于内部研发评估和供应商资源，给出可应用的产品方案，深度挖掘潜在需求并转化为产品改进方向；3、负责收集产品...,计算机软件,http://jobs.zhaopin.com/CC205108410J40962593704.htm,10000人以上,2025-10-30 09:40:46,15000.0,26000.0,12.0
保险产品经理（跨境电商）,杭州,国泰财产保险有限责任公司,本科,3-5年,"产品开发,跨境保险,产品设计",15000-25000,岗位职责:1、跨境市场与客户需求分析：跟踪跨境保险行业趋势、竞品动态及监管政策变化；通过现有资源、用户调研、数据分析等方式挖掘客户痛点与潜在需求；输出产品机会报告与可行性分析；2、产品设计与开发：主导跨境保险产品设计和开发；3、跨部门协作与项目推进：牵头组织产品推动，协同运营、互联网产品、核保、核赔、风控、运管等上下游团队，对项目进行风险把控和资源协调，推动产品落地上线；4、产品上线与后续优化：支...,保险,http://jobs.zhaopin.com/CC254512410J40758200616.htm,500-999人,2026-01-12 00:12:42,15000.0,25000.0,15.0
运营管理岗(A226950),杭州,东方艺云科技集团有限公司,本科,5-10年,"展馆运营,招商,渠道",20000-25000,职位描述：1.负责数字艺术馆的商业运营策略制定与执行，包括票务销售、门票套餐设计、文创商店及餐饮运营、会员制度等，确保达到商业目标和利润指标；2.负责数字艺术馆的日常运营工作，包括场地维护、设施管理、物业对接及客服、场务等人员安排等，确保展览和活动顺利进行；3.分析市场竞争情况和行业趋势，制定相应的运营策略和推广计划，提升数字艺术馆的品牌知名度和竞争力；4.开发并执行品牌合作计划，寻找和谈判与品牌...,计算机硬件,http://jobs.zhaopin.com/CCL1360593880J40814451701.htm,300-499人,2026-01-12 00:06:41,20000.0,25000.0,14.0
AI运营经理—晨羽智云,杭州,杭州市人才市场开发有限公司,本科,5-10年,,15000-25000,晨羽智云（杭州）科技有限公司为2025年新核准的国家高新科技企业，以自主研发的分布式算力调度系统和多节点GPU集群为技术基础，构建了强大且高效的AI算力平台。为独立开发者，初创团队，中小企业提供了专业的算力支持。1、公司运营着中国最大的“一站式AI应用商店”，打造了涵盖内容生成、智能设计、自动化工作流等多领域的AI生态系统。通过无代码、即开即用的便捷体验，晨羽智云极大降低了AI应用的使用门槛，满足...,互联网,http://jobs.zhaopin.com/CCL1318355140J40868376103.htm,500-999人,2026-01-07 17:09:40,15000.0,25000.0,12.0
硬件产品研发中心-产品经理-光谱-杭州,杭州,杭州海康威视数字技术股份有限公司,本科,3-5年,,15000-25000,职位描述：1. 负责光谱垂直应用场景调研，产品调研及需求分析，包括场景分析、行业分析、市场分析；2. 负责光谱产品定义，规划新产品开发方向，3. 负责产品的商业成功，协同市场专员/项目管理/技术开发，进行产品全生命周期管理，包括市场分析、产品规划、产品开发、上市推广、产品迭代等管理工作。 任职资格：1、本科及以上学历，光学、电子科学与技术、仪器仪表、自动化等相关专业；2、3年以上产品经理工作经验，...,人工智能,http://jobs.zhaopin.com/CC120975580J40777296215.htm,10000人以上,2026-01-07 15:56:23,15000.0,25000.0,12.0
流程管理经理(J10043),杭州,新农股份,本科,5-10年,"流程管理,流程设计",15000-25000,岗位职责:1 负责构建和完善公司流程架构，推动各领域流程框架的设计和优化；2 负责指导各领域开展流程设计和评审，输出和发布流程文件；3 负责推进流程文化建设，开展流程知识、工具方法的培训和赋能；4 负责流程管理相关制度、流程及标准的建立及优化；5 负责协助开展流程监控、评价，推动流程持续优化；任职要求:1 本科及以上学历，管理类、经济类专业；2 深刻理解企业运营和业务，具备端到端业务管理经验优先；...,化工,http://jobs.zhaopin.com/CC141881230J40825263309.htm,1000-9999人,2026-01-06 14:52:58,15000.0,25000.0,15.0
