职位,城市,公司,学历,经验,技能,薪资,工作描述,行业,职位URL,公司规模,发布时间,薪资_最小值,薪资_最大值,年薪月数
系统工艺工程师1119-XM (MJ040052),厦门,宁德时代新能源科技股份有限公司,本科,经验不限,"优率提升,机械自动化,工艺质量管理",12000-24000,1、负责产品的工艺现场问题解决以及提供生产效率，保障产品安全质量；2、负责拉线整体FTY、YU工作的开展，支持和协调相关部门资源达成团队任务与目标；3、负责新拉线/拉线切换/新设备qualify；4、负责CP\SOP\ENW\WI\PFC等标准文件的发行和维护；5、负责生产拉线的PE相关的PLM\MES\SAP系统维护；6、支持Trialrun时当工序问题分析和改善；7、负责客诉、安全、质量等专项...,电子设备制造,http://jobs.zhaopin.com/CC271988630J40968046104.htm,10000人以上,2026-01-05 09:38:04,12000.0,24000.0,16.0
制程工艺工程师,厦门,厦门徕泽丰科技有限公司,本科,经验不限,"增材制造,金属3D打印,工艺设计,焊接工艺,机加工工艺,成型工艺,激光焊",12000-24000,岗位职责：1、负责公司各类金属产品设计方案工艺可行性评审。2、使用建模软件生成三维模型，输出工程图纸。3、负责编制工艺规程、相应的标准程序、体系文件，作业指导书等；任职要求：1、本科及以上学历，焊接/材料/机械设计相关专业；2、 经验不限，欢迎优秀应届毕业生；3、 熟悉金属加工工艺（机加工，焊接，热处理），金属3D打印工艺优先；特别优秀者待遇面议,船舶/航空/航天/火车制造,http://jobs.zhaopin.com/CCL1409591990J40690399307.htm,20-99人,2025-10-27 12:43:59,12000.0,24000.0,12.0
机械设计工程师,厦门,厦门蓝旭科技有限公司,本科,5-10年,"设计,非标设备,AutoCAD,SolidWorks",15000-23000,机械设计工程师：【岗位职责】一、产品的设计与开发1.方案设计：根据需求输出创新设计方案，关键零部件选型计算及校核；2.详细设计：负责三维建模、出图、BOM表整理；材料选择（金属、塑料、复合材料等）；3.设计优化：整备性能、成本、重量、可制造性等因素，进行迭代改进；4.可制造性设计（DFM）：确保设计符合量产工艺需求（如注塑、铸造、机加工、采购等）。二、工程分析与仿真1.结构分析：使用有限元分析，验...,专用设备制造,http://jobs.zhaopin.com/CC551336830J40896806908.htm,300-499人,2025-12-25 09:13:46,15000.0,23000.0,13.0
系统工艺工程师,厦门,宁德时代新能源科技股份有限公司,本科,3-5年,"装配工艺,总装工艺,工艺改良,工艺设计",14000-24000,1、 做为量产的责任人，统筹并主导量产产品的技术问题解决，良率及效率提升，降低制造成本；2、 负责新工艺、新材料、新建拉线、新设备在量产阶段的可制造性验证；3、 负责工艺优化；4、 负责量产相关文件（如BOM，CP，SOW等）的更新维护；5、 识别生产过程中可能的失效模式并输出有效的控制方法，制定过程产品规格；6、 参与客户审核，提升客户满意度。1、本科及以上学历，电化学，自动化，机电，材料等相关...,电子设备制造,http://jobs.zhaopin.com/CC271988630J40968857904.htm,10000人以上,2026-01-04 01:09:41,14000.0,24000.0,16.0
设备工程师,厦门,南昌市智通人力资源有限公司,本科,经验不限,"维修/保养,安装/调试,非标设备",11000-22000,负责车间机台的正常运作，改善机台原不良或不利生产的设计:定期维护、保养生产设备机台，进行故障排除、异常分析与追踪处理;规划生产设备之操作顺序，以便正确使用设备，进而提升生产效率进行设备改造、升级或开发，提升设备的生产力;制定产线务机台的SOP;严格执行公司各项规章管理制度，配合上级做好6S管理。,咨询服务,http://jobs.zhaopin.com/CC263088530J40739729916.htm,1000-9999人,2025-12-11 11:01:43,11000.0,22000.0,16.0
电气工程师（产业化公司）,厦门,嘉庚创新实验室,本科,经验不限,,12000-22000,岗位职责：负责碱性电解槽制氢系统的电气设计，涵盖电源设计、电气原理图及布线规划。运用PLC等工具编写电气控制逻辑，保障设备稳定安全运行。协同团队完成电解槽供电系统调试、优化，快速定位并解决电气故障。与制氢工艺团队深度协作，依据工艺需求迭代电气设计方案。紧跟新能源及氢能领域前沿技术，助力团队技术升级与创新。 任职要求： 本科及以上学历，电气工程、自动化控制相关专业。 熟稔电气设计软件（如AutoCA...,学术/科研,http://jobs.zhaopin.com/CCL1293679000J40903376915.htm,300-499人,2025-11-26 17:05:05,12000.0,22000.0,12.0
电芯工艺工程师,厦门,宁德时代新能源科技股份有限公司,本科,3-5年,"涂布工艺,卷绕工艺,工艺改良",13000-22000,1、 做为量产的责任人，统筹并主导量产产品的技术问题解决，良率及效率提升，降低制造成本；2、 负责新工艺、新材料、新建拉线、新设备在量产阶段的可制造性验证；3、 负责工艺优化；4、 负责量产相关文件（如BOM，CP，SOW等）的更新维护；5、 识别生产过程中可能的失效模式并输出有效的控制方法，制定过程产品规格；6、 参与客户审核，提升客户满意度。任职要求：1、本科及以上学历，电化学，自动化，机电，...,电子设备制造,http://jobs.zhaopin.com/CC271988630J40971078604.htm,10000人以上,2026-01-02 01:09:10,13000.0,22000.0,17.0
电气研发工程师,厦门,佳创科技,本科,5-10年,"机电一体化,AutoCAD",13000-22000,一、岗位职责： 1、负责项目电气部分的工作，独立绘制电路图、气路图、程序编写。 2、负责项目电气部分调试工作，解决调试过程中各种电气问题。 3、负责给相关售后人员指导、培训项目电气部分的相关知识。 二、岗位要求： 1、28-40岁，电气自化专业本科以上学历， 2、能够独立开发编写三菱AB、施耐德、安川等系统的程序。 3、有机械手（ABB\库卡）6轴项目自主开发和带队经验优先。 三、职位福利：五险一...,电气机械/电力设备,http://jobs.zhaopin.com/CC266941137J00421675302.htm,100-299人,2025-07-17 00:22:22,13000.0,22000.0,13.0
扩散设备工程师,厦门,厦门士兰集科微电子有限公司,本科,3-5年,,11000-21000,工作职责：1、设备PM：负责本工程设备和重点设备维护；2、设备维修：负责本工程设备和重点设备维修；3、产能扩充：协助组织和实施新设备调试，验收；4、协助完成上级交付的任务。任职要求：1、本科及以上学历，半导体或微电子相关专业；2、3-5年的同行业工作经验，具备自主装机调试经验优先；3、了解扩散设备以及工艺知识，维修保养的基本技能。,电子/半导体/集成电路,http://jobs.zhaopin.com/CC663942480J40743292606.htm,10000人以上,2026-01-01 01:15:37,11000.0,21000.0,12.0
电气工程师,厦门,宁德时代新能源科技股份有限公司,本科,3-5年,"安装/调试,机器人",13000-22000,岗位概述：统筹管理生产线设备的维修维护及切拉改造相关工作，确保产能达成。负责指导及执行设备日常检查、预防性维护、设备故障处理、备品备件管理、设备技术改善、设备安全及质量改善。岗位职责：1、负责设备点检、巡检、PM维护标准的制定及优化，并指导现场生产人员、技术员执行；2、负责日常设备故障的维修技术支持、故障原因分析及永久性改善，产线设备易损件及关键备件识别及需求提报；3、组织产线切拉换型，达成产品切...,电子设备制造,http://jobs.zhaopin.com/CC271988630J40967489304.htm,10000人以上,2025-12-28 00:00:01,13000.0,22000.0,16.0
工程设备经理,厦门,万特制药(海南)有限公司,本科,5-10年,"机械设备设计,机械设备研发,制药",11000-21000,岗位内容：1. 督导和管理机械设备的安装，保养，检修和维护工作。2. 分析机械设备的故障并提出解决方案，协调供应商进行设备维修和零部件更换。3. 制定机械设备维护计划，并监督实施情况。4. 完成机械设备相关的文档记录和报告。任职要求：1. 具有机械工程相关专业背景和至少5年以上机械维护或设备管理经验。2. 熟悉机械设备的工作原理和维护方法，并能够解决常见故障。3. 优秀的沟通和团队合作能力，能够与...,医药制造,http://jobs.zhaopin.com/CC121010060J40739623202.htm,100-299人,2025-12-23 01:02:26,11000.0,21000.0,12.0
连锁餐饮设备工程师（Base福州）,厦门,福州朴朴电子商务有限公司,大专,5-10年,"机械设备,电气设备,机电设备",10000-20000,【岗位职责】1、制定与执行闭环餐饮设备巡检计划，及时发现潜在问题，提前干预避免故障扩大；2、设备故障应急处理与维修，最大程度降低设备故障对餐饮生产的影响；3、负责项目设备安装调试协助与验收支持；4、建立与及时维护设备维护档案，规范化设备资产管理；5、梳理餐饮设备相关技术培训与一线端的运维支持内容；6、其他上级安排的事项。【任职资格】1、大专及以上学历，机电一体化技术、电气自动化技术、机械维修、酒店...,互联网,http://jobs.zhaopin.com/CC408522280J40830936510.htm,10000人以上,2026-01-12 00:45:20,10000.0,20000.0,13.0
设备质量工程师-XM (MJ042198),厦门,宁德时代新能源科技股份有限公司,本科,3-5年,"维修/保养,电气设备,自动化设备",15000-20000,"岗位职责：1、 负责管理设备质量项目整体流程，包括从业务获取到项目关闭,对整体交付结果负责； 2、 制定全面的项目计划，跟踪项目进度，协调相关资源； 3、 积极引导客户和内部的沟通，推动实现公司和项目目标； 4、 相关会议准备，记录会议纪要，形成会议相关文档，并持续跟进直至问题关闭；5、 对项目的过程文档进行归档和统一管理； 6、 在监控和管理项目过程中，负责项目变更管理（进度、成本、人员等）；7...",电子设备制造,http://jobs.zhaopin.com/CC271988630J40979430904.htm,10000人以上,2026-01-10 18:33:12,15000.0,20000.0,12.0
刻蚀设备工程师,厦门,厦门士兰集科微电子有限公司,本科,3-5年,,10000-20000,岗位职责： 1.负责所属制程设备的维护及效能精进； 2.做好工艺设备的选型、安装调试，与供应商沟通； 3.根据经验及各种异常之惯用处理方法编写相关文书，编写相关设备作业的指导书。 任职要求： 1.本科及以上学历； 2.电子、电机、电气、测控、自动化专业等相关专业 3.有半导体工作经验或3年以上设备维护工作经验尤佳； 4.良好的解决问题能力，沟通能力，团队精神，积极的学习态度,电子/半导体/集成电路,http://jobs.zhaopin.com/CC663942480J40744342406.htm,10000人以上,2026-01-10 01:17:25,10000.0,20000.0,12.0
中高级机械设计工程师,厦门,厦门精研自动化元件有限公司,本科,1-3年,"机械结构设计,机械制图,机械零部件设计,机械设计,自动化,电机设备",12000-20000,【岗位职责】 1、根据个人专长、结合公司项目分配设计任务； 2、机电产品设计、非标设备设计，工装夹具设计。 【任职要求】 1、重点一本以上机械设计专业毕业； 2、两年以上机械设计岗位工作经验； 3、有良好的机械基础知识； 4、对机械设计有浓厚的兴趣和爱好； 5、学习能力强，工作条理性好，立体思维能力强。,金属制品业,http://jobs.zhaopin.com/CC143539370J40868669203.htm,500-999人,2026-01-10 01:08:11,12000.0,20000.0,13.0
机械设计工程师,厦门,厦门晧宇机器人科技有限公司佛山市分公司,大专,3-5年,"设计,机械设计,非标设备,自动化设备,冲压工艺,焊接工艺,SolidWorks",12000-20000,岗位职责： 1、负责机械设备的设计、改进与优化，确保设计满足功能入性能需求； 2、根据销售提供的方案需求制作方案； 3、与团队合作，对产品进行故障分析及问题解决； 4、持续提升产品的可靠性和使用寿命。 任职资格： 1、具备良好的机械设计能力和创新思维； 2、能够熟悉使用CAD、SolidWorks等软件； 3、能独立完成设计任务，对设计质量负责。 4、具备良好的团队合作精神和沟通能力； 5、具备较...,电气机械/电力设备,http://jobs.zhaopin.com/CCL1491964750J40850923312.htm,20-99人,2026-01-09 01:33:35,12000.0,20000.0,12.0
机械设计工程师,厦门,厦门蓝旭科技有限公司,本科,5-10年,"研发,设计,工艺设计,非标设备,装配设备,自动化设备,装配工艺,SolidWorks,AutoCAD,自动化设备（如机器人装配系统）",15000-20000,【岗位职责】一、产品的设计与开发1.方案设计：根据需求输出创新设计方案，关键零部件选型计算及校核；2.详细设计：负责三维建模、出图、BOM表整理；材料选择（金属、塑料、复合材料等）；3.设计优化：整备性能、成本、重量、可制造性等因素，进行迭代改进；4.可制造性设计（DFM）：确保设计符合量产工艺需求（如注塑、铸造、机加工、采购等）。二、工程分析与仿真1.结构分析：使用有限元分析，验证强度、刚度、疲...,专用设备制造,http://jobs.zhaopin.com/CC551336830J40907903908.htm,300-499人,2026-01-09 01:21:36,15000.0,20000.0,13.0
薄膜设备工程师,厦门,厦门士兰集科微电子有限公司,大专,经验不限,,11000-20000,岗位职责：1.负责所属制程设备的维护及效能精进（如薄膜、湿法/减薄、蚀刻 、 扩散、注入、量测、光刻、测试等）；2.做好工艺设备的选型、安装调试，与供应商沟通；3.根据经验及各种异常之惯用处理方法编写相关文书，编写相关设备作业的指导书。任职要求：1.大专及以上学历；2.电子、电机、电气、测控、自动化专业等相关专业3.有半导体工作经验或3年以上设备维护工作经验尤佳；4.良好的解决问题能力，沟通能力，...,电子/半导体/集成电路,http://jobs.zhaopin.com/CC663942480J40609323306.htm,10000人以上,2026-01-09 01:14:13,11000.0,20000.0,12.0
机械工程师,厦门,厦门新路嘉工业自动化有限公司,大专,3-5年,"CAD,非标机械设计,SOLIWORKS",10000-20000,"一、岗位职责：1、主要负责机械手，工装夹具，非标自动化设备等相关机械设计；2、根据设计图纸出BOM表，下单给采购；3、负责跟踪项目的进度，设备的现场调试。 二、岗位要求： 1、专科以上学历，年龄25-45岁，机械设计与制造或机电一体化等相关专业； 2、熟练3D绘图设计,SOLIWORKS等相关软件的使用，3年以上同岗位工作经验； 3、工作细致负责,良好团队协作能力、创新能力，沟通能力。 4. 薪资...",工业自动化,http://jobs.zhaopin.com/CC197906710J40266415702.htm,20-99人,2026-01-09 01:02:36,10000.0,20000.0,12.0
新能源电气工程师,厦门,厦门市豪盛达工贸有限公司,本科,5-10年,客车电气,11000-20000,工作职责：1、传统能源（柴油发动机）：客车与卡车的所有电气系统和电器件，设计、应用、匹配、选型工作；2、新能源：客车高压系统设计、含电控逻辑设置（比如我司设置逻辑，供应商根据我司控制策略写程序等），高压系统零件的匹配、应用、选型，设计高压线束；传统低压系统（底盘线束、仪表线束、ABS线束等）的设计。3、其它公司拓展的领域。岗位要求：1、211院校电气类等相关专业2、善于学习，熟悉使用office办...,贸易/进出口,http://jobs.zhaopin.com/CC601194420J40812985410.htm,20-99人,2026-01-08 16:43:05,11000.0,20000.0,13.0
CVD资深工程师/专家（TM19）,厦门,天马微电子,本科,3-5年,,14000-20000,工作职责：1、负责CVD 新设备评估、新技术设计检讨、关键工艺路线制定2、负责 CVD新产品技术方案评估与开发、工艺检讨及导入验证、组织与问题协调3、负责 CVD成膜工艺调试，以及CVD不良改善管理4、负责CVD 产品CPK，良率统计分析、异常分析及改善措施实施5、制定 CVD 生产工艺CPK提升和SPC异常管控规则，防止量产中发生的不良，跟进实施进度6、制定 CVD 人员&设备运营方案，优化工作...,电子/半导体/集成电路,http://jobs.zhaopin.com/CC611978020J40832428310.htm,1000-9999人,2026-01-08 14:33:59,14000.0,20000.0,14.0
系统工艺工程师,厦门,宁德时代新能源科技股份有限公司,本科,3-5年,,12000-20000,岗位要求：1、主导工序制程不良品分析与改善，包括批量质量事故原因分析与改善；2、主导由非产品设计/材料相关导致的优率Loss改善；3、负责新拉线/拉线切换/新设备qualify；4、参与新设备的技术方案评审、未来量产线的规划等;5、支持Trial run时当工序问题分析和改善；6、负责CPISOPIENW等标准文件的编制落地工作；7、负责生产拉线的PE相关的PLMIMESISAP系统维护；8、参与...,电子设备制造,http://jobs.zhaopin.com/CC271988630J40967931204.htm,10000人以上,2026-01-08 01:11:07,12000.0,20000.0,16.0
光刻设备工程师（12吋）,厦门,厦门士兰集科微电子有限公司,本科,3-5年,"半导体设备校验,半导体设备安装调试,半导体设备维护保养,半导体曝光机,光刻,LITHO",12000-20000,岗位职责： 1.负责12吋光刻设备的日常操作与维护，确保设备稳定运行 2.制定并执行设备预防性维护计划，降低设备故障率 3.及时处理设备异常，分析故障原因并完成修复 4.协助工艺工程师优化设备参数，提升生产效率 任职要求： 1.本科及以上学历，半导体、微电子或机械相关专业 2.3年以上光刻设备操作或维护经验，熟悉12吋设备者优先 3.具备独立解决设备故障的能力，熟悉SEMI标准 4.能适应无尘室工...,电子/半导体/集成电路,http://jobs.zhaopin.com/CC663942480J40745896906.htm,10000人以上,2026-01-07 09:48:29,12000.0,20000.0,14.0
设备经理,厦门,金牌厨柜家居科技股份有限公司,本科,10年以上,,16000-20000,岗位要求：1、大专以上学历，机械电气液压均有基础；2、机电一体化或自动化相关专业；3、具备五年以上大型生产型企业设备副经理以上管理经验；4、 具有较强的沟通协调、团队建设能力，高效处理好各种工作关系；5、有较强的执行力，善于解决问题；6、有板式家具行业经验优先考虑；岗位职责：1、负责设备部门管理，跟进设备重要事项、设备连线，设备效能的提升、设备布局全厂自动化优化改善；2、作为部门安全管理、安全培训...,装饰装修,http://jobs.zhaopin.com/CC137439330J40615072715.htm,1000-9999人,2026-01-07 01:40:30,16000.0,20000.0,13.0
机械设计工程师,厦门,厦门彼格科技有限公司,本科,5-10年,"研发,设计,工艺设计,制图设计,非标设备,精密设备,钣金工艺,装配工艺,AutoCAD,SolidWorks,结构设计",10000-20000,"岗位职责：1、负责根据市场和客户需求，进行竞品分析，参与产品定义，设计开发具有行业竞争力的自动化设备；2、独立完成整机机械设计方案、三维建模、二维出图、BOM清单、装配指导等；3、项目实施过程中，配合设备的装配、调试以及售后、客户使用中出现的技术问题，并收集整理设备问题KNOW-HOW；4、参与设备升级迭代、产品化、转量产、标准化、持续改进等工作；5、提供产品发布所需的技术文档,并协助营销部门进行...",电子/半导体/集成电路,http://jobs.zhaopin.com/CC278744130J40834473308.htm,100-299人,2026-01-07 01:19:32,10000.0,20000.0,13.0
工业控制上位机软件开发工程师,厦门,厦门巨帮自动化科技有限公司,本科,3-5年,"测试,DCS系统,SCADA系统,自控系统,非标设备",10000-20000,一、岗位职责1. 系统设计与开发• 负责工业控制场景（PLC、机器人、运动控制、视觉系统等）上位机软件从需求分析、架构设计到编码实现的全流程；• 基于 C#/C++/Python 等语言，在 Windows/Linux 平台下开发设备控制、数据采集、实时监控、异常报警、日志管理等功能。2. 通信与协议• 实现上位机与下位机（PLC、单片机、运动控制卡、仪表等）之间的通信对接，完成 Modbus、O...,工业自动化,http://jobs.zhaopin.com/CC377407030J40869342915.htm,20-99人,2026-01-06 17:39:06,10000.0,20000.0,13.0
电气工程师,厦门,厦门新路嘉工业自动化有限公司,大专,1-3年,"设计,安装/调试,自动化设计,PLC设计",10000-20000,岗位职责： 1、从事非标自动化设备电器控制设计； 2、针对客户的项目需求进行控制方案整体设计； 3、控制方案的器材选型及报价； 4、设计图纸输出、接线图输出； 5、PLC控制软件编程、C++语言编程等； 6、现场安装调试及项目进度跟踪； 任职要求： 1、大专以上学历；电气自动化、机电一体化、电子及通讯、计算机软件； 2、2年以上工作经验、从事过电气自动化设计、现场设备维护者优先； 3、懂电气控制原...,工业自动化,http://jobs.zhaopin.com/CC197906717J90250018000.htm,20-99人,2026-01-06 14:28:15,10000.0,20000.0,12.0
NPI工艺工程师,厦门,厦门彼格科技有限公司,本科,3-5年,"工艺设计,新品导入（NPI）,工艺改良,工业激光器,光通信,光模块产品工艺",10000-20000,职责描述：1. 负责激光雷达、空间光通信、ASE光源、分布式振动/测温模块产品工艺、新产品导入；2. 在新产品研发阶段针对产品进行可制造性设计评审（DFM），从结构工艺制程控制等方向提出设计优化建议； 3. 主导、组织跨部门团队解决NPI阶段生产技术问题，提升新产品转产直通率，参与专项技术改进工作；4. 生产效率提升、直通率提升、在制预警处理； 5. 返回品根因分析预测试、返回品分析方案。任职要求...,电子/半导体/集成电路,http://jobs.zhaopin.com/CC278744130J40780283008.htm,100-299人,2026-01-07 01:19:26,10000.0,20000.0,13.0
设备维护工程师,厦门,宁德时代新能源科技股份有限公司,本科,3-5年,"非标设备,自动化设备",12000-20000,岗位职责：1.编制设备管理的各项制度、规范、标准和流程、组织执行各类制度及规范，并对执行情况进行监控；2.编制各项设备维护计划、对各维护计划进行分解，并指导实施；3.编制设备维护方案，对维护方案实施过程进行控制；制定设备维护标准和流程并实施；对设备的日常运行状况进行监督和控制，及时排查设备隐患；指导设备故障处理4.建立设备的维护台账，保证档案信息的齐全，对设备各项技术参数进行统计分析；5.编制设备...,电子设备制造,http://jobs.zhaopin.com/CC271988630J40978239204.htm,10000人以上,2026-01-06 09:11:53,12000.0,20000.0,16.0
设备生产经理,厦门,微亚智能,本科,5-10年,"生产管理,生产计划",15000-20000,任职要求：1.负责组织编写生产设别使用操作规范，并监督、指导生产人员执行；2.根据企业生产战略以及生产计划，制定生产设备管理计划，制定BOM表；3.拟定事故预防措施，确保生产有序进行；4.定期组织设备检查工作，发现隐患及时整改，杜绝设备安全事故；5.了解设备运转状况，及时做好设备的更新改造工作；6.负责生产设备使用的相关培训工作，提高生产人员的设备操作技能；7.负责下属人员的工作指导、监督和考核工...,电气机械/电力设备,http://jobs.zhaopin.com/CC487186620J40030549302.htm,300-499人,2026-01-06 08:49:17,15000.0,20000.0,12.0
国企稀土公司招聘—机械工程师,厦门,福建省金龙稀土股份有限公司,本科,5-10年,"新产品开发,设计,非标设备,自动化设备,装配工艺,SolidWorks,AutoCAD,结构设计",13000-20000,岗位职责：1、独立完成装备开发机械部分的技术方案制定、机械图纸绘制、BOM表清单制作、选型及核算机械成本。2、主导非标自动化机械结构的开发及装配工艺优化。3、管理项目进度，并独立解决设备机械问题。任职要求：1、本科及以上学历，机械设计制造及其自动化或相关专业。2、5年以上非标自动化设备设计经验。3、精通机械专业理论知识和设计流程、熟练运用SolidWorks、CAD等绘图软件。4、熟悉机械制造方面...,钢铁/有色金属冶炼及加工,http://jobs.zhaopin.com/CC420025220J40788413909.htm,1000-9999人,2026-01-06 01:23:53,13000.0,20000.0,13.0
