职位,城市,公司,学历,经验,技能,薪资,工作描述,行业,职位URL,公司规模,发布时间,薪资_最小值,薪资_最大值,年薪月数
半导体设备工程师,厦门,厦门云天半导体科技有限公司,本科,3-5年,"半导体设备维护保养,半导体设备维修,干法刻蚀设备,减薄设备",13000-20000,干刻设备与切割设备各1人 岗位职责：1.负责新设备评估，请购，导入；2.负责设备改造以不断增强公司制程能力及设备兼容性；3.提升设备可利用率和设备产品良率；4.对设备人员操作及阶段性预防保养负责，并形成标准化的文件，通过不断的人员训练提升总体设备操作，保养能力；5.日常设备异常处理，通过不断调配，有效屏蔽因设备Down机及治工具短缺而影响产能达成；6.对设备维护成本负责，通过精简设备保养方法及材料...,电子/半导体/集成电路,http://jobs.zhaopin.com/CC815673240J40781861209.htm,500-999人,2025-10-31 14:07:24,13000.0,20000.0,12.0
自动化机构工程师 Automation Mechanical Engineer,厦门,安费诺电子装配(厦门)有限公司,大专,5-10年,"非标设备,非标设备开发,线束装配同行",10000-20000,工作职责：1.根据生产现状、产品要求规划，完成自动化项目规划、方案设计；2.非标自动化设备自制开发，预估成本及效益；3.跟进和指导非标自动化设备配件的采购、安装及调试；4.对市场上自动化设备的调研，对外购设备评估、引进；5.对现有设备的改造与升级，3D/2D机构设计。任职资格：1.5年及以上线束装配行业非标自动化机构设计经验，大专或以上学历；2.精通自动化零件的材料种类、加工工艺及方法、热处理以及...,电子/半导体/集成电路,http://jobs.zhaopin.com/CC138882920J40508414202.htm,1000-9999人,2025-10-30 00:10:23,10000.0,20000.0,13.0
资深自动化设计工程师,厦门,广东一周达人力资源服务有限公司,本科,10年以上,"3C消费电子,苹果供应链",15000-20000,1、新产品自动化方案设计2、量产产品自动化治具&设备方案开发3、3D.2D出图4、机加件B0M表输出5、标准件的选型及BOM表输出6、治具&设备标准化、模块化开发设计与导入7、自动化开发方向及技术前沿探讨8、配合并完成周边部门的需求9、主导开发阶段DOE验证，检讨与设计10、新制治具&设备相关问题的分析与改善11、配合并完成上级临时安排的工作 1、熟练掌握solidworks、CAD设计软件及办公...,人力资源服务,http://jobs.zhaopin.com/CCL1306392470J40835555708.htm,10000人以上,2025-10-16 10:37:32,15000.0,20000.0,12.0
电气自动化工程师,厦门,南京永基自动化工程有限公司,本科,经验不限,"安装/调试,设计,维修/保养,自动化设计,电气设计,PLC设计",10000-20000,工作内容：1.仪控专业技改方案编制、设备选型、组织施工和调试；2.负责PLC、触摸屏的编程、调试工作，成套柜的PLC、变频器及低压电器的成套选型、清单配置、图纸设计；3.负责施工现场管理工作，能够对施工现场仪器仪表设备的保养维护，能够对客户遇到的问题进行远程技术支持任职要求：1、自动化/计算机等相关专业毕业2、3年以上相关工作经验3、西门子400系列/1500/1200系统设计选型组态调试经验4、...,工业自动化,http://jobs.zhaopin.com/CC508073120J40788131609.htm,20-99人,2025-09-22 14:11:19,10000.0,20000.0,12.0
售前工程师,厦门,用友网络科技股份有限公司厦门分公司,本科,5-10年,"软件产品,云服务产品,ERP系统",15000-20000,岗位职责：1.配合业务伙伴推动用友产品的销售，负责售前阶段的客户调研、需求分析，完成项目售前方案的制作、讲解以及产品演示；2.整理行业案例，深入研究分析市场需求趋势、行业知识及发展方向，并进行行业案例与解决方案的包装和推广；3.参加公司或渠道伙伴组织的市场活动并担任讲师，力争扩大产品市场美誉度；4.获取市场对产品的需求信息，整理并提出产品改善建议向产品部门反馈。,计算机软件,http://jobs.zhaopin.com/CC271575030J40790693907.htm,10000人以上,2025-09-04 17:01:32,15000.0,20000.0,12.0
开关柜高级电气设计工程师,厦门,厦门华电开关有限公司,本科,5-10年,"设计,电力设计,配电柜,开关柜,中压,高压,超高压,ABB,施耐德",15000-20000,岗位职责：产品优化及标准化：1、推动工程项目设计的标准化，完善工程项目数据库，建立并不断完善作业指导书。2、推动团队优化元器件的选型和配置标准化工作3、负责产品持续设计改进的开展与落实工作技术澄清：1、推动工程项目技术协议谈判及签订、一次方案图确认2、具备复杂项目的技术协议、一次方案图的评审及谈判技术支持：1、负责为销售团队及供应链管理团队提供必要的技术支持2、负责为生产、质量、售后团队提供必要的...,电力/水利/热力/燃气,http://jobs.zhaopin.com/CC132735240J40861762315.htm,500-999人,2025-09-01 17:01:06,15000.0,20000.0,13.0
机械工程师,厦门,厦门虹鹭,本科,5-10年,"设计,制图设计,结构设计,非标设备,自动化设备,液压工艺",15000-20000,岗位职责: 1、旧设备的技术改造、升级。 2、新设备的开发、设计、测试、升级。 3、自动化设备及新技术的收集和应用，自动化设备的开发设计。 4、技术支持和维护。 任职要求: 1、学历：本科及以上学历。 2、专业：机械设计制造及自动化、机电一体化、机械制造、等相关专业。 3、经验：5年以上从事相关机械设计、非标自动化设计等相关工作经验。 4、技能：能熟练运用三维/二维制图软件。 5、要求：能独立完成...,金属制品业,http://jobs.zhaopin.com/CC137341210J40780746613.htm,1000-9999人,2025-09-01 15:48:06,15000.0,20000.0,12.0
泵产品设计工程师,厦门,厦门三和盛科技有限公司,本科,经验不限,"设计,泵类产品",10000-20000,【岗位职责】1.负责泵类产品的设计、开发、测试、调试等工作；2. 主要涉及水力/流体模型设计和结构设计，须能独立计算、设计泵头；3.协助解决生产过程中出现的问题，保障产品顺利生产；4.完成上级领导交办的其他任务。【任职要求】1.机械工程、能源与动力工程、力学、水泵等相关专业本科及以上学历；2.熟悉泵的设计原理和相关标准，有泵设计经验者优先；3.熟练掌握二维、三维制图设计软件、仿真软件及其他工作需要...,船舶/航空/航天/火车制造,http://jobs.zhaopin.com/CC445742210J40771382914.htm,20-99人,2025-08-14 00:00:04,10000.0,20000.0,12.0
海外设备销售工程师（五险一金，双休）,厦门,佳创科技,本科,5-10年,"网络销售,企业客户,政府客户,渠道销售",10000-20000,【岗位职责】1.负责海外市场开拓，挖掘客户，开发订单，完成销售目标。2.分析海外客户需求，提供专业的产品解决方案，促成业务合作。3.全程跟进外贸订单，熟练处理询盘、报价、合同签订、生产协调、物流运输、报关清关等全流程事务，确保订单顺利交付。4.维护老客户关系，处理投诉与售后，提升满意度与复购率。5.密切关注外贸市场动态及信息政策变化，为公司市场开发提供建议。6.与公司内部研发、售后等部门高效协作，...,电气机械/电力设备,http://jobs.zhaopin.com/CC266941130J40811717513.htm,100-299人,2025-08-12 10:08:39,10000.0,20000.0,12.0
资深电芯设备工程师,厦门,厦门新能安科技有限公司,本科,5-10年,"安装/调试,维修/保养,化学材料",14000-20000,"岗位职责:1、主导解决涂布、辊压、卷绕/叠片、注液、化成等核心设备的重大、复杂故障，进行根本原因分析并推动彻底解决。2、主导建立和优化设备维护体系（TPM），制定维护标准/策略，提升设备关键指标（OEE, MTBF）。3、主导新设备/产线的选型、导入、验收及重大自动化改造/升级项目。4、制定和审核设备操作、维护、安全的核心技术规范。5、指导培养初级工程师，提升团队能力。 任职要求:1、大学本科及以...",新能源,http://jobs.zhaopin.com/CCL1409591300J40778310407.htm,1000-9999人,2025-07-29 17:47:14,14000.0,20000.0,16.0
电气类教师,厦门,厦门工学院,硕士,无经验,"职称越高薪酬越高,有教学经验有优先考虑,应届生可报名",10000-20000,1.硕士，电气类专业2.承担育人和电气类课程教学、科研等工作,学校/学历教育,http://jobs.zhaopin.com/CC313085580J40796397513.htm,500-999人,2025-07-05 11:41:11,10000.0,20000.0,13.0
海外机械工程师,厦门,厦门厦钨新能源材料股份有限公司,本科,3-5年,机械设计，机械维修维保,12000-20000,岗位职责: 1、配合新基地建设过程中机械设计、选型、安装、调试 2、配合新工艺开发，对现有生产设备进行改造，以提高生产技术水平； 3、根据项目进度跟踪新设备安装情况，解决安装过程中出现的异常情况； 4、参与生产现场的机械故障排除； 5、制定设备操作规程及保养规程。 任职要求: 1、本科及以上学历，机械设计制造及自动化相关专业； 2、至少精通一种机械设计软件； 3、有较为丰富的设备导入及现场改善经验...,新材料,http://jobs.zhaopin.com/CC527494330J40422782006.htm,1000-9999人,2025-05-26 08:38:23,12000.0,20000.0,13.0
资深设备工程师,厦门,厦门新能安科技有限公司,本科,5-10年,"安装/调试,维修/保养,非标设备,电气设备,自动化设备",14000-20000,岗位职责:1、量产设备管理（确保KPI达成）：（1）负责设备维护计划制定与实施。（2）负责设备文件管理（如WI、点检表）。（3）负责设备故障分析及品质异常分析。（4）负责安全隐患排查与改进。2、新拉线及新设备建设（确保有效交付）：（1）负责新设备进度管理。（2）参与新工艺、平台及设备开发。（3）负责新设备维护与验收。（4）参与厂房规划评审。3、改善项目计划实施（确保项目达成）：（1）负责SGA/I...,新能源,http://jobs.zhaopin.com/CCL1409591300J40778297307.htm,1000-9999人,2025-07-29 17:13:48,14000.0,20000.0,16.0
WET设备岗,厦门,天马微电子,本科,5-10年,"半导体设备维护保养,蚀刻设备",,工作职责：1.设备日常点检，维修，保养；2.熟悉设备的操作及工作原理，能够对应设备出现的问题及提出改善意见；3.熟悉处理工艺出现的问题，并能对工艺进行改善和对工艺问题提出预防措施；4.对 WET设备产生的工程不良进行分析/评价，并提出其解决方案；任职资格：1.熟悉使用office办公软件；2.具备良好的逻辑思维能力及执行力，具备良好的沟通能力；3.良好的报告能力及数据处理能力；4.吃苦耐劳，责任心...,电子/半导体/集成电路,http://jobs.zhaopin.com/CC611978020J40832182610.htm,1000-9999人,2026-01-09 01:28:26,,,
设备课长,厦门,厦门著赫电子科技有限公司,学历不限,5-10年,SMT设备,,1、效率提升：负责提高SMT生产线所生产产品的质量和产量，在质量保证的前提下，并尽可能的想办法提高生产能力及生产效率，2、设备管理：负责对生产线的设备硬件和备件报损及生产成本加以严格控制，负责生产线设备重要的维护，做一些相应的校准和方法调整3、新品导入：对新产品的试生产并转型成成熟产品；4、人员管理：负责工程人员的日常管理、考核、培训,电子/半导体/集成电路,http://jobs.zhaopin.com/CC629800320J40910532308.htm,500-999人,2026-01-07 16:35:30,,,
PTO机械设备工程师,厦门,厦门新能安科技有限公司,本科,5-10年,"设计,制图设计,结构设计,非标设备,自动化设备",11000-19000,"岗位职责:1.负责锂电池生产线设备维护计划的制定及实施,主导设备故障分析,设备DT改善,提升OEE2.负责设备技术改造及推广、工序能力与设备Yield改善;3.负责新拉线建设,新设备安装,调试,评估和验收,确保新拉按期交付4.参与处理客户投诉、不良项目的FA分析及改善;5.负责生产现场的工夹具设计及改造;6.负责测试团队管理 任职要求:1.大学本科及以上学历;2.电子技术及应用/电子信息产品工程/...",新能源,http://jobs.zhaopin.com/CCL1409591300J40821303807.htm,1000-9999人,2026-01-09 01:19:28,11000.0,19000.0,16.0
非标设备机械设计工程师/机械工程师,厦门,漳州雅宝电子股份有限公司厦门分公司,大专,5-10年,"Solidworks,机械设计,非标设备,AutoCAD",12000-18000,岗位职责：1、负责非标自动化设备整机、工装夹具的设计、改造，提升生产能力； 2、负责设备结构设计、部件选型、材料选用、成本核算、设计图纸输出； 3、主导项目方案的评审，完成设备系列化设计，编写相关技术文档； 4、配合电气工程师、装配人员等完成设备设计、调试等工作，确保设备顺利导入生产； 5、协助解决生产过程中的问题，优化现有生产工艺，提出合理的改进方案； 6、协助其他部门进行技术沟通和交流，提供技...,电子/半导体/集成电路,http://jobs.zhaopin.com/CC816143220J40492687715.htm,500-999人,2026-01-07 01:40:27,12000.0,18000.0,13.0
售前工程师,厦门,浩程信息,本科,5-10年,"售前技术支持,咨询规划,交流汇报",11000-18000,岗位职责1．负责网络、安全集成、安全服务、云计算类项目的售前支持，包括需求调研分析，网络、安全、数据中心架构设计，体系咨询，方案设计，招标方案设计，投标文件制作，技术答疑及方案宣讲等；2．分析客户需求，挖掘潜在需求，提供具有竞争力的解决方案、产品，协助销售人员拿下项目；3．负责网络、安全、云计算等领域新型解决方案的研究；4．负责客户网络、安全技术和安全意识培训、内部和外部交流；5．不定期出差泉州、...,IT服务,http://jobs.zhaopin.com/CC203411910J40257202703.htm,20-99人,2026-01-05 00:08:41,11000.0,18000.0,13.0
高级硬件产品经理（感知设备）,厦门,厦门四信,本科,5-10年,物联网产品,10000-18000,职位描述（1）调研市场，提炼需求，评估方案，规划新品，完善产品。（2）定义产品功能，整理产品需求，协调研发、结构、测试和项目经理完成产品的设计、开发、验证和量产交付。（3）整理产品技术规格书、使用说明书、产品解决方案，配合市场宣传。（4）主导完善产品认证，软著申请。（5）产品生命周期管控和质量管理。（6）产品运销配合，按产品发布和营销推广计划，配合完成各项事宜。 任职要求： （1）具备硬件产品系统...,运营商/增值服务,http://jobs.zhaopin.com/CC245395610J40845590603.htm,500-999人,2025-12-26 01:05:42,10000.0,18000.0,12.0
电气设计师/高级电气设计师（非标自动化）,厦门,厦门精合电气自动化有限公司,大专,5-10年,,,一、岗位职责负责自动化设备的研发、设计、制造1.负责设备电路设计；电气元器件选型；2.负责PLC、人机界面、伺服电机编程；设备调试二、任职要求1.大专及以上学历，5年以上经验；2.熟悉倍福PLC的优先考虑；3.熟悉C语言，C++的优先考虑。三、福利待遇生活： 环境整洁、厂车接送、免费食宿娱乐： 运动设施、娱乐活动、公司旅游福利： 年终奖金、过节福利、医疗基金、购房补贴发展： 晋级体系、加薪体系、培...,专用设备制造,http://jobs.zhaopin.com/CC000588190J40773268312.htm,300-499人,2025-12-25 14:08:00,,,
层压高级工程师 (MJ001958),厦门,安捷利美维电子(厦门)有限责任公司,本科,3-5年,"PCB,层压工艺",10000-18000,工作地点：广州/厦门岗位职责：负责压合工艺流程能力的提升与产品质量改善。主导压合工序在12层以上高多层、mSAP工艺、高频高速材料、厚铜及埋容埋阻等特殊产品方面的技术能力建设。提升压合工序在产品等级、层数等方面的工艺支撑能力。开展新工艺、新设计的开发与推广应用。负责与相关部门进行有效沟通，协调跨部门协作事宜。组织对技术人员及生产员工的培训与工作指导。就工艺策略与发展方向向高级主管提供建议。参与公司...,电子/半导体/集成电路,http://jobs.zhaopin.com/CCL1237263060J40909000515.htm,10000人以上,2025-12-25 01:44:29,10000.0,18000.0,12.0
自动化设备工程师,厦门,厦门雅迅智联科技股份有限公司,本科,5-10年,"安装/调试,测试,设计,自动化设计,自动化设备,汽车电子",12000-18000,学历：本科(含)以上， 电子信息，机械工程或自动化工程等相关专业； 工作经验：5年以上，汽车电子，通信设备，智能电器等电子行业，设备工程管理岗位；专业技能：1，熟悉ITAF16949体系及5大工具应用及VDA6.3标准应用：2，对六轴机器人的生产应用及管理有丰富经验：3，熟悉步进伺服电机的工作原理及控制方式：4，熟练使用至少1-2种主流PLC编程；熟练运用8D分析解决相关问题；5，具有大型项目管理...,物联网,http://jobs.zhaopin.com/CC138128960J40783333416.htm,1000-9999人,2025-12-24 17:36:04,12000.0,18000.0,12.0
暖通电气工程师,厦门,厦门奥普拓自控科技有限公司,本科,3-5年,"电机,控制柜,控制器",,岗位职责：1、负责工程项目实施全过程执行和外协单位现场管理，直至项目验收交付；2、协助项目二次调研，编写施工方案，并按内业流程提交相关项目文档；3、负责项目设备安装、调试等工作；4、协助项目管理工作，协调和解决项目执行过程中遇到各项问题；5、负责项目售后支持及维保工作；6、项目结束后及时整理归档相关资料，并在部门内部进行分享交流；7、积极学习和提升个人技能，持续改善和提升效率；8、及时向上级领导反...,计算机软件,http://jobs.zhaopin.com/CC540897520J40687090101.htm,20-99人,2025-12-23 09:45:40,,,
机械设计工程师(工程布局),厦门,厦门宇春环保科技有限公司,大专,3-5年,"制图设计,外观设计,暖通优先,护栏爬梯烟囱,管道设计优先,非标设备,装配设备,设计,装配工艺,焊接工艺",,一、工作职责： 1.机械设备的工程布局，机械设备图纸设计及相关技术文件的编制； 2.组织新项目评审开展工作; 3.解决产品在生产制造过程中出现的技术难题； 4.为产品在项目应用中出现的问题提供技术支持； 5.相关物料的申购提报。 二、任职要求： 1.机械类、自动化、机电类相关专业，大专以上学历 2.熟练应用CAD＆ 三维绘图软件，有环保行业同岗位优先 3.具体较好的沟通能力，责任心和组织协调能力 ...,环保,http://jobs.zhaopin.com/CCL1314163420J40599178503.htm,100-299人,2025-12-20 09:53:05,,,
电气自控工程师,厦门,厦门士兰集科微电子有限公司,本科,5-10年,,10000-18000,弱电工程师（自控工程师）1、熟悉厂务FMCS系统，熟悉应用西门子PLC2、熟悉洁净室温湿度控制原理及控制逻辑3、负责自控系统日常工作安排、维护保养及异常处理。负责自控系统的新改扩建项目的建设、管理4、负责自控系统日常备件、劳保用品、保养用品等的统计、采购及监管。5、负责自控系统的安全稳定提升改善措施优化、安全稳定基础上降本增效任职要求：1、本科及以上，优秀者可适当放宽至大专，电气工程及其自动化或机...,电子/半导体/集成电路,http://jobs.zhaopin.com/CC663942480J40738519106.htm,10000人以上,2025-12-08 13:07:41,10000.0,18000.0,12.0
电气设计工程师,厦门,厦门慧联鸿疆科技有限公司,本科,3-5年,,12000-18000,岗位职责：1、负责老旧设备电气控制系统的重新设计与程序开发。2、完成PLC、伺服驱动、HMI等核心器件的选型与调试。3、解决设备升级中的电气疑难问题，确保系统稳定可靠。4、编制电气技术文档，并对操作人员进行培训。任职要求：1、本科及以上学历，电气工程及其自动化、自动化、机电一体化等相关专业。2、3年及以上非标设备或工业自动化项目的电气设计、编程与调试经验，有完整的设备电气系统改造经验者优先。3、精...,金属制品业,http://jobs.zhaopin.com/CCL1437178630J40823277410.htm,500-999人,2025-11-25 14:18:26,12000.0,18000.0,13.0
机械高级工程师,厦门,长塑实业,本科,5-10年,"安装/调试,维修/保养,自动化设备",15000-18000,一、岗位职责：1、负责工程规划方案、初步设计和施工图设计审查，项目进度控制、质量控制、成本控制、合同管理、安全管理和组织协调等；2、熟悉政府节能减排管理条例或管理办法，制定节能改造方案；3、完善设备管理制度；4、改进和完善设备的维修检修工艺；5、支援公司各生产线重大故障的抢修维修，原因分析和改善；6、及时完成上级交办工作。二、任职要求：1、本科及以上学历，机械相关专业；2、精通机械原理知识、液压气...,橡胶和塑料制品,http://jobs.zhaopin.com/CC420885410J40576129905.htm,1000-9999人,2025-11-14 14:18:43,15000.0,18000.0,12.0
资深自动化电气工程师（攸信）,厦门,盈趣科技,本科,5-10年,"非标设备,非标自动化,3c电子,设计,电气设计,PLC设计,自动化设计",10000-18000,岗位职责：1、进行自动化设备控制方案前期的评估和验证；2、从事自动化设备电气系统的开发和设计；3、负责设备电气控制系统的调试和导入；4、协助主管进行电气设计方面的相关规范和标准化制定和推进；5、根据项目预算配制电气控制元件，根据项目进度制定和执行电气设计的工作计划。任职要求：1、本科以上学历，电气、自动化、机电、计算机软件相关专业；2、5年以上电气、自动化系统设计开发经验；3、熟悉 PLC 和 H...,电子/半导体/集成电路,http://jobs.zhaopin.com/CC408695220J40750219007.htm,1000-9999人,2025-11-11 14:06:17,10000.0,18000.0,13.0
电气控制工程师,厦门,厦门钨业股份有限公司,本科,3-5年,"PLC设计,电机",10000-18000,岗位职责:1、根据项目需求与结构工程师配合完成非标设备研发、设计以及现场调试等相关工作;2、负责元器件选型、与供应商技术沟通解决相关问题；3、生成BOM表及采购清单、编制相关技术文档;4、PLC下位机控制器编程、与上位进行数据通信交互:5、负责跟进产品试产、量产、用户反馈中发现的设计问题，及改善验证; 岗位要求: 1、电气及自动化相关专业，英语四级以上能看懂相关技术文献; 2、Eplan等电气绘图...,钢铁/有色金属冶炼及加工,http://jobs.zhaopin.com/CC133096640J40826852208.htm,10000人以上,2025-10-14 15:51:25,10000.0,18000.0,13.0
电气自控工程师,厦门,厦门托力托环保科技有限公司,大专,5-10年,"设计,安装/调试",10000-18000,1.负责物流转运项目中 AGV/RGV、工业机器人、智能立体仓库等自动化设备程序设计与调试，输出控制系统方案、编写 PLC 程序及 HMI 组态。2.设计审核电气原理图、工艺流程，完成配电控制柜图纸设计、元器件选型与接线，确保符合规范。3.统筹设备调试，对接上下位机通讯，指导控制设备安装接线，解决技术问题，保障项目验收交付。4.编制设备维护、操作等技术文档，开展生产人员培训，为客户提供技术支持与故...,环保,http://jobs.zhaopin.com/CC598407420J40790388307.htm,20-99人,2025-10-14 10:40:14,10000.0,18000.0,12.0
工艺工程师（过程开发）,厦门,厦门坤锦电子科技有限公司,本科,3-5年,过程开发,12000-18000,岗位职责：1.完成新品立项前期工艺设想及新规定、变化点评估验证；2.新品初样阶段拟制：工艺流程图、工装、设备、人员需求规划；3.组织新品初样阶段工艺验证及工艺问题点闭环，负责工艺验证及闭环改善的实施；4.新品正样阶段拟制：场地平面布置图、特性矩阵图、PFMEA、过程指导卡；5.组织新品正样阶段工艺验证、过程能力研究及工艺问题点闭环，负责工艺验证及闭环改善的实施；6.制定新品产线建设规划方案及拟制产...,仪器仪表制造,http://jobs.zhaopin.com/CC363934110J40565419714.htm,1000-9999人,2025-10-13 14:59:35,12000.0,18000.0,14.0
