职位,城市,公司,学历,经验,技能,薪资,工作描述,行业,职位URL,公司规模,发布时间
数据分析师,重庆,四川卓川人力资源有限公司,学历不限,经验不限,,1.2-1.3万,岗位内容：1. 分析和挖掘大量的数据源，为业务发展和决策提供支持。2. 负责开发、维护和优化各类数据仓库和数据报表，保证数据质量和准确性。3. 与业务团队紧密合作，深入了解业务需求，提供全面的数据分析解决方案。4. 执行并监督指标和KPI体系，跟踪业务进展和成效。任职要求：精通SQL语言和常用的数据分析工具和平台，如Excel、Tableau等。具备较强的业务理解能力和逻辑思维能力，可以通过数据分...,人力资源服务,http://jobs.zhaopin.com/CCL1480081170J40819981301.htm,20-99人,2026-01-11 21:39:56
城市运营支持,重庆,北京三快在线科技有限公司,大专,3-5年,销售数据运营,面议,1. 关注城市订单、服务质量、复购转化等数据，做数据分析，异常数据下钻分析2. 会议管理、物料等中台行政工作3. 其它流程、事务性事项任职要求：1、 有销售运营做指标追踪的背景2、家政、快递、本地生活等劳动密集型行业优先3、有数据分析能力，有一定好奇心，耐心细心4、介意外包勿扰,互联网,http://jobs.zhaopin.com/CC383625320J40769168409.htm,10000人以上,2025-12-24 01:23:49
数据分析师,重庆,华润置地,本科,1-3年,"计划运营,数学/统计学专业,电商类产品,平台类产品,工具类产品",8000-12000元·14薪,任职资格： 1、跟进零售额预算的制定及每月目标分解； 2、录入报表类及未上传业绩的租户数据，编写每日经营分析报告； 3、分析总结万象汇各业态经营业绩，编写业绩报告； 4、负责租户业绩激励制定及结算； 5、编制商场大型活动总结、会员专项分析报告报部门负责人审批； 6、录入并核对BI系统（含总部BI系统）业绩数据，配合修正业绩错误与上传遗漏； 7、收集同城竞争对手信息，编写市场调研报告；8、完成大区或...,房地产开发,http://jobs.zhaopin.com/CC358101520J40833491205.htm,10000人以上,2025-12-17 15:12:41
数据分析师,重庆,四川卓川人力资源有限公司,学历不限,经验不限,,1.2-1.3万,岗位内容：1. 分析和挖掘大量的数据源，为业务发展和决策提供支持。2. 负责开发、维护和优化各类数据仓库和数据报表，保证数据质量和准确性。3. 与业务团队紧密合作，深入了解业务需求，提供全面的数据分析解决方案。4. 执行并监督指标和KPI体系，跟踪业务进展和成效。任职要求：精通SQL语言和常用的数据分析工具和平台，如Excel、Tableau等。具备较强的业务理解能力和逻辑思维能力，可以通过数据分...,人力资源服务,http://jobs.zhaopin.com/CCL1480081170J40819981201.htm,20-99人,2026-01-11 21:39:56
数据分析员（通信）,重庆,立信(重庆)数据科技股份有限公司,本科,3-5年,"SPSS,excel",6000-12000元,岗位职责：1.对数据进行深入分析，提炼关键信息和满意度趋势；2.撰写数据分析报告，按照需求将复杂的数据结果转化为清晰易懂的结论和可行的建议，为客户决策制定等提供依据；3.跟踪分析市场策略的实施效果，及时调整分析方向和方法，持续优化数据模型；4.项目管理：与督导紧密沟通，确保项目按时推动，对项目执行过程中的突发事件，及时协调沟通处理，保障顺利完成数据采集及交付。任职资格：1、本科及以上学历，统计学、...,咨询服务,http://jobs.zhaopin.com/CC628093580J40814829013.htm,100-299人,2025-08-19 10:49:01
实验设计与数据分析工程师,重庆,北京星睿元科技有限公司,本科,1-3年,方差分析,7000-12000元,【岗位职责】1.设计并实施实验方案，优化产品开发和生产流程。2.使用JMP、Minitab或Design-Expert等工具进行数据分析和建模。3.分析实验数据，提供科学的决策支持报告。4.与研发、生产团队紧密合作，解决技术难题。5.持续改进实验设计方法，提升团队整体能力。【岗位要求】1.本科及以上学历，统计学、工程学等相关专业优先。2.熟练使用JMP、Minitab或Design-Expert等...,计算机软件,http://jobs.zhaopin.com/CCL1499813240J40752135605.htm,20-99人,2025-03-18 09:32:45
数据分析师,重庆,四川卓川人力资源有限公司,学历不限,经验不限,,1.1-1.2万,岗位内容：1. 收集和整理大量的数据，设计并实施数据分析模型和算法。2. 评估现有的数据集，并根据需要进行清理、转换和预处理。3. 对数据结果进行解释和汇报，向相关部门提供数据分析技术支持。4. 利用机器学习和人工智能技术改进公司的数据分析和决策过程。任职要求：1. 熟练使用Python、R等数据分析软件和工具，能够独立完成数据分析任务。2.深入理解机器学习和人工智能的原理和应用，拥有良好的编程和...,人力资源服务,http://jobs.zhaopin.com/CCL1480081170J40819996401.htm,20-99人,2026-01-11 22:52:12
数据统计分析师,重庆,重庆安于诺财税服务有限公司,本科,1-3年,"数据建模,报表开发,数据仓库,SPSS,hive,R语言",9000-11000元·13薪,岗位内容：1. 收集、整理和分析各类数据，为公司提供基础数据和决策支持。2. 建立和维护各种类型的数据指标和报告，跟踪业务进展和趋势。3. 参与规划和执行公司数据战略，推动数字化转型和技术创新。4. 探索和应用数据挖掘和机器学习技术，提高数据价值和利用效率。任职要求：1. 具备统计学、数学、计算机科学或相关领域的学士及以上学历。2. 熟练使用常见的数据分析工具和平台，如Excel、SQL、BI工具...,财务/审计/税务,http://jobs.zhaopin.com/CCL1511500440J40866031312.htm,100-299人,2026-01-07 01:34:34
数据分析师,重庆,中财信忠(临沂)人力资源服务有限责任公司,本科,3-5年,"数据仓库,数据建模,数据加工，分析，运维,ETL工具,Sql,Power BI",8000-11000元,职业描述1、理解业务，基于业务需求，能够进行数据支持，包括数据加工、数据分析、数据规范沉淀、数据运维等，支持业务方看清用户和用户增长。2、能够基于业务理解，开发业务标签、业务报表，提供业务洞察。职位要求1、本科及以上学历，统计学、数学、计算机科学、金融工程、经济学等相关专业优先。 2、有较多的数据加工、数据分析、数据运维等经验。精通业务建模、数据仓库建模、精通ETL设计开发。熟练使用sql、Pow...,人力资源服务,http://jobs.zhaopin.com/CCL1500801770J40806198901.htm,20-99人,2026-01-05 16:12:50
数据分析师,重庆,四川卓川人力资源有限公司,学历不限,经验不限,,1.1-1.2万,岗位内容：1. 收集和整理大量的数据，设计并实施数据分析模型和算法。2. 评估现有的数据集，并根据需要进行清理、转换和预处理。3. 对数据结果进行解释和汇报，向相关部门提供数据分析技术支持。4. 利用机器学习和人工智能技术改进公司的数据分析和决策过程。任职要求：1. 熟练使用Python、R等数据分析软件和工具，能够独立完成数据分析任务。2.深入理解机器学习和人工智能的原理和应用，拥有良好的编程和...,人力资源服务,http://jobs.zhaopin.com/CCL1480081170J40819996001.htm,20-99人,2026-01-11 22:52:08
金融数据分析师,重庆,平安融易(黑龙江)信息服务有限公司重庆第五分公司,学历不限,经验不限,,6000-11000元,我们正在寻找金融数据分析师，负责为公司提供高质量的金融数据分析和决策支持。工作内容:1.收集、整理和处理金融市场数据;2.运用财务分析工具和模型进行数据分析和建模;3.撰写分析报告，为投资决策提供参考;4.跟踪金融市场动态，及时提供市场分析和预警。岗位要求:4.金融、数学、统计学等相关专业本科及以上学历;5.熟练掌握Excel、R、Python等数据分析工具;6.具备扎实的金融理论基础和数据分析能...,互联网金融/小额贷款,http://jobs.zhaopin.com/CC449260480J40675541912.htm,100-299人,2025-12-26 20:18:23
数据分析师,重庆,菁沐人力资源服务(沧州)有限公司,本科,经验不限,"Sql,Python,数据治理,数据仓库",8000-11000元,职业描述1、理解业务，基于业务需求，能够进行数据支持，包括数据加工、数据分析、数据规范沉淀、数据运维等，支持业务方看清用户和用户增长。2、能够基于业务理解，开发业务标签、业务报表，提供业务洞察。职位要求1、本科及以上学历，统计学、数学、计算机科学、金融工程、经济学等相关专业优先。2、有较多的数据加工、数据分析、数据运维等经验。精通业务建模、数据仓库建模、精通ETL设计开发。熟练使用sql、Powe...,人力资源服务,http://jobs.zhaopin.com/CCL1483621100J40819252305.htm,300-499人,2025-10-16 11:25:05
电商体验运营数据分析岗位招聘 永川,重庆,万声(重庆)信息技术有限公司,大专,3-5年,电商数据运营,6000-10000元,"职位描述：1、驱动服务核心指标波动（全局满意度，解决率，万工单外溢）的归因和业务owner建联确认归因； 2、专项支持：门户看板等需求的评审与建设保障监测能力落地； 3、资产运维：涉及服务资产众多，需partner协助完成资产的盘点和运维工作； 4、外溢洞察：完成对外溢指标的分析，并承担外溢case的标注工作，洞察可优化的点，push到对应的业务方；""5、日常会议支持：整理日会/周会及重点项目数据...",企业服务,http://jobs.zhaopin.com/CCL1297855710J40915064715.htm,1000-9999人,2026-01-12 01:42:27
数据运营助理,重庆,深圳领境教育科技有限公司,学历不限,经验不限,,5000-10000元,岗位内容： 1. 负责公司各类数据资源的管理和开发，包括数据仓库、数据流水线等；2. 协调各部门的数据需求，提供数据支持和分析服务；3. 利用数据模型和算法对业务数据进行深度挖掘，帮助业务提升效率和增长。任职要求： 1. 熟悉主流数据仓库、ETL工具的使用和开发方法，熟练掌握常用数据库及SQL语言；2. 具备一定的数据建模能力和数据可视化能力，熟练使用Hadoop/Spark等大数据处理平台；3....,新媒体,http://jobs.zhaopin.com/CCL1508941400J40849777813.htm,20人以下,2026-01-12 01:36:06
即时零售数据中台运营,重庆,重庆英思顿网络科技有限公司,本科,经验不限,"电商数据运营,策略运营,数据监控,FineBI,Power BI",8000-10000元,即时零售数据中台运营岗位职责1、负责中台数据运营工作，涵盖业务流程梳理、运营规则设计、资源统筹调配，推动中台能力与前端业务高效协同，提升整体业务运转效率。2、聚焦用户消费行为、订单履约数据、商品动销数据、库存周转数据等多维度开展深度分析，通过数据洞察挖掘门店运营痛点、库存管理漏洞等优化机会，输出精准数据报告并推动落地执行，助力业务提效降本。3、设计针对性的中台运营策略，包括中台能力在多业态门店的复...,电子商务,http://jobs.zhaopin.com/CCL1486125550J40853774413.htm,500-999人,2026-01-10 01:40:38
数据分析师,重庆,万声(重庆)信息技术有限公司,大专,1-3年,"报表开发,数据治理,数据挖掘,Sql",6000-10000元,"数据支持岗薪资:(面试评估定级)工作时间:10:00-19:00周末双休职位描述:1、驱动服务核心指标波动(全局满意度,解决率,万工单外溢)白的归因和业务 owner建联确认归因;2、专项支持:门户看板等需求的评审与建设保障监测能力落地;3、资产运维:涉及服务资产众多,需partner协助完成资产的盘点点和运维工作;4、外溢洞察:完成对外溢指标的分析,并承担外溢case的标注工作,洞察可优化的点,...",企业服务,http://jobs.zhaopin.com/CCL1297855710J40915009415.htm,1000-9999人,2026-01-12 01:42:27
数据运营助理,重庆,深圳领境教育科技有限公司,学历不限,经验不限,,5000-10000元,岗位内容： 1. 负责公司各类数据资源的管理和开发，包括数据仓库、数据流水线等；2. 协调各部门的数据需求，提供数据支持和分析服务；3. 利用数据模型和算法对业务数据进行深度挖掘，帮助业务提升效率和增长。任职要求： 1. 熟悉主流数据仓库、ETL工具的使用和开发方法，熟练掌握常用数据库及SQL语言；2. 具备一定的数据建模能力和数据可视化能力，熟练使用Hadoop/Spark等大数据处理平台；3....,新媒体,http://jobs.zhaopin.com/CCL1508941400J40849778013.htm,20人以下,2026-01-12 01:36:06
遗传咨询师,重庆,上海韦翰斯生物医药科技有限公司,硕士,无经验,,6000-10000元,工作职责：1.掌握所有特殊检测方案的数据分析方法和报告出具流程；2.熟悉OGM的数据分析方法和报告出具流程；3.制定/优化至少两种临床检测产品的SOP，或者制作/完善至少两种临床检测产品的报告模板；4.学习PGT/NIPT等产前检测的数据分析方法和报告出具流程；5.学习室间质评/质量认证等样本的数据分析方法和报告出具流程；6.熟悉面向代理商/客户（医生）/患者的遗传咨询工作；7.学习开展面向销售等...,生物工程,http://jobs.zhaopin.com/CC435527480J40598082807.htm,100-299人,2026-01-09 14:05:10
业务分析师（客服中心）,重庆,成都微招网络科技有限公司,本科,1-3年,"企业培训,数据治理",8000-10000元,工作职责：1、负责BPO业务日常运营服务与质量的结构化分析，并提供解决方案； 2、搭建业务质量提升和控制机制； 3、监控各业务日常运营指标的达成，有问题能及时发现并干预；4、需针对于质量问题，出具周报以及月报等。5、负责业务运营内审与报告；6、负责各业务扣款率目标的下达。岗位要求：1、本科及以上学历，22周岁以上，具备较强的逻辑思维，数据分析类专业优先； 2、具备一定的沟通协调能力，能承受较大工作...,人力资源服务,http://jobs.zhaopin.com/CC843010600J40887001902.htm,1000-9999人,2026-01-06 10:15:17
数据运营助理,重庆,深圳领境教育科技有限公司,学历不限,经验不限,,5000-10000元,岗位内容： 1. 负责公司各类数据资源的管理和开发，包括数据仓库、数据流水线等；2. 协调各部门的数据需求，提供数据支持和分析服务；3. 利用数据模型和算法对业务数据进行深度挖掘，帮助业务提升效率和增长。任职要求： 1. 熟悉主流数据仓库、ETL工具的使用和开发方法，熟练掌握常用数据库及SQL语言；2. 具备一定的数据建模能力和数据可视化能力，熟练使用Hadoop/Spark等大数据处理平台；3....,新媒体,http://jobs.zhaopin.com/CCL1508941400J40849777913.htm,20人以下,2026-01-12 01:36:06
金融实习生/大学城,重庆,中国人寿保险股份有限公司重庆市沙坪坝区支公司(大学城部),大专,1-3年,,6000-10000元,1安排部门工作人员服务老客户2.带领团队完成公司及上级下达的工作目标，并对部门人员进行考核；任职资格：1、大专及以上学历2、23--45周岁，1年以上管理工作经验者优先（可接受优秀应届毕业生）3.具有较强的沟通、协调能力，有团队协作精神4.性格开朗，积极主动，有一定的抗压性，喜欢有挑战的工作底薪+绩效+钻石奖+季度奖+组织利益津贴+节假日福利+外出旅游，综合薪资6000-12000工作时间：8:3...,保险,http://jobs.zhaopin.com/CCL1505202540J40764379802.htm,10000人以上,2026-01-05 14:52:28
业务分析师 光电园附近,重庆,成都微招网络科技有限公司,本科,3-5年,"企业培训,数据治理",8000-10000元,工作职责：1、负责BPO业务日常运营服务与质量的结构化分析，并提供解决方案； 2、搭建业务质量提升和控制机制； 3、监控各业务日常运营指标的达成，有问题能及时发现并干预；4、需针对于质量问题，出具周报以及月报等。5、负责业务运营内审与报告；6、负责各业务扣款率目标的下达。岗位要求：1、本科及以上学历，22周岁以上，具备较强的逻辑思维，数据分析类专业优先； 2、具备一定的沟通协调能力，能承受较大工作...,人力资源服务,http://jobs.zhaopin.com/CC843010600J40887002102.htm,1000-9999人,2026-01-06 10:15:08
业务分析师9k+ 入职五险一金,重庆,重庆扬策科技有限公司,本科,1-3年,呼叫中心经验,8000-10000元·13薪,岗位职责1、负责BPO业务日常运营服务与质量的结构化分析，并提供解决方案； 2、搭建业务质量提升和控制机制； 3、监控各业务日常运营指标的达成，有问题能及时发现并干预；4、需针对于质量问题，出具周报以及月报等。5、负责业务运营内审与报告；6、负责各业务扣款率目标的下达。岗位要求1、本科及以上学历，22周岁以上，具备较强的逻辑思维，数据分析类专业优先； 2、具备一定的沟通协调能力，能承受较大工作压力...,电子商务,http://jobs.zhaopin.com/CCL1327479730J40818506407.htm,100-299人,2025-12-24 01:20:08
业务支持专员,重庆,顺丰速运,本科,3-5年,"销售数据运营,市场数据分析,数据采集,数据监控,策略运营,行业数据分析,经营数据分析",8000-10000元,岗位职责：1、业务监控: 日度/周度/月度业务进展监控及输出；2、数据分析: 搭建和沉淀不同维度的业务数据库，并结合数据分析输出当前存在的业务问题，为业务组织提供支持和建议;3、工作协同: 跨组织协同、推动数据分析输出问题的跟进闭环:4、其他: 根据组织工作需要，完成相关支持和配合;任职要求：1、本科及以上学历，具备物流相关工作经验优先；2、理解底层业务逻辑，并具有较强的业务数据分析能力；3、具备...,货运/物流/仓储,http://jobs.zhaopin.com/CC131486150J40820074514.htm,10000人以上,2025-11-10 22:17:38
数据分析,重庆,重庆凤梧商贸有限公司,本科,1-3年,"数据仓库,报表开发,数据建模,BI工具,Sql,FineBI",6000-10000元,岗位内容：1. 分析和挖掘大量的数据源，为业务发展和决策提供支持。2. 负责开发、维护和优化各类数据仓库和数据报表，保证数据质量和准确性。3. 与业务团队紧密合作，深入了解业务需求，提供全面的数据分析解决方案。4. 执行并监督指标和KPI体系，跟踪业务进展和成效。任职要求：1. 具备统计学、数学、计算机科学或相关领域的本科及以上学历，并拥有至少两年相关工作经验。2. 精通SQL语言和常用的数据分析...,零售/批发,http://jobs.zhaopin.com/CC224560320J40765065316.htm,1000-9999人,2025-11-10 11:10:01
数据分析员,重庆,立信(重庆)数据科技股份有限公司,本科,3-5年,"数据统计分析,市场研究",5000-10000元,岗位职责：1、负责市场研究项目前期方案撰写、问卷设计；2、负责研究项目整体管控、数据分析及研究报告的撰定及讲解；3、负责在项目管控中与客户的沟通。任职资格：1、本科及以上学历，统计学、社会学、经济学、心理学、市场营销等专业毕业，有市场调查、数据分析工作经验者尤佳，中共党员优先； 2、能协助进行抽样与问卷设计，精通1种及以上统计分析工具软件，如SPSS、SAS等；3、数据分析能力强，有独立的报告撰写...,咨询服务,http://jobs.zhaopin.com/CC628093580J40336496513.htm,100-299人,2025-06-24 00:32:43
数据运营及数据分析师,重庆,重庆鼎工机电股份有限公司,本科,3-5年,"销售数据运营,Power BI",6000-9000元,主要以（有亚马逊网站相关工作经验为主）岗位职责：1. 建立和完善业务数据监控体系，负责核心指标的日常监控与报表搭建。2. 运用数据可视化工具打造直观的数据看板，实现业务状态实时可视化。3. 开展深度专题分析，为业务提供深度洞察。4. 驱动用户增长，优化关键用户流程，分析获客渠道。5. 提升用户留存，评估并优化召回、促活策略。6. 支持供应链优化，为选品、采购和库存管理提供数据建议。7. 快速响应业...,金属制品业,http://jobs.zhaopin.com/CC401934620J40806675914.htm,500-999人,2026-01-10 01:43:55
Analyst - 估值与建模 - GDC - Chongqing,重庆,德勤企业咨询(上海)有限公司,本科,无经验,,7000-9000元,"Work you'll doConducts economy, industry, or target company research and summarize the researchresult in report formatRetrieves, collates and analyzes public records, media archives and internet posti...",咨询服务,http://jobs.zhaopin.com/CC000423050J40641440507.htm,10000人以上,2026-01-09 16:18:58
理赔企划分析岗,重庆,平安健康保险股份有限公司重庆分公司,本科,3-5年,"数据治理,报表开发,BI工具",6000-9000元·16薪,岗位职责：1、负责理赔相关数据报表的搭建、整理和分析，确保数据的准确性和完整性2、运用统计方法和数据分析工具，对理赔数据进行深入挖掘，发现潜在问题和优化点3、输出理赔数据分析报告，为管理层提供数据支持和决策依据4、其他领导交办的工作岗位要求：1、本科及以上学历，具有保险行业企划、数据分析经验优先；2、具备较强的逻辑分析能力和数据敏感度;；3、具备较强的沟通协调能力和解决问题的能力；4、具备一定的数...,保险,http://jobs.zhaopin.com/CC857698380J40852576602.htm,20-99人,2025-12-30 01:03:21
数据分析师（客服呼叫中心 双休+员工宿舍）,重庆,成都智仁千益人力资源管理有限公司,大专,1-3年,"报表开发,数据分析,数据统计",6000-9000元·13薪,薪资范畴：薪资面议、年终奖金、入职缴纳五险一金、法定节假日三倍薪资；l 福利补贴：住宿补贴、餐补、下午茶、节假日福利（中秋、春节）、生日会、司龄庆祝及丰富的团建活动；l 培训及晋升：提供免费学历提升，完善的晋升体系，提供免费的晋升培训辅导及岗位见习机会；l 工作时间：9:00-18:00或10:00-19:00；l 休班制度：月休8天，根据业务需求轮休；l 办公环境：互联网产业园区食宿，生活便利、...,咨询服务,http://jobs.zhaopin.com/CCL1289943720J40817099607.htm,500-999人,2025-12-15 13:51:14
大数据工程师,重庆,重庆清研理工汽车智能技术研究院有限公司,本科,3-5年,"数据治理,数据挖掘,数据建模,Sql,Python,Matlab",8000-9000元,一、核心职责1. 知识图谱全流程构建与互联网产品适配：深入理解互联网产品业务场景（如电商推荐、社交关系、内容分发），设计贴合产品需求的领域知识图谱 Schema（含用户、商品、内容等实体类型及关联关系定义）；主导从多源异构数据（用户行为日志、交易数据、非结构化内容）中进行知识抽取、融合与推理，解决 “数据碎片化”“关联挖掘难” 问题；基于 Neo4j 等图数据库搭建知识存储与查询体系，优化图查询性...,专业技术服务,http://jobs.zhaopin.com/CC842693910J40825609905.htm,20-99人,2025-12-10 15:57:47
电商平台数据分析员+双休,重庆,重庆德合益供应链科技有限公司,大专,经验不限,,5000-8000元,岗位内容：1. 通过数据挖掘和分析，帮助公司了解客户需求、预测市场趋势和进行业务决策。2. 收集、整合、清洗和验证数据源，并开发和维护各类数据模型和算法。3. 提高数据使用效率和价值，不断改进数据分析流程和方法。任职要求：。1. 数学、人工智能、广告、统计学和计算机等相关专业，专科以上学历。2.逻辑思维能力较强，对数据敏感。3.对互联网电商及广告行业有较大的兴趣。3. 具备良好的沟通、协作和抗压能...,计算机软件,http://jobs.zhaopin.com/CC432293710J40837624105.htm,20-99人,2026-01-12 01:12:58
初级数据分析（双休）,重庆,重庆伊豪博机械设备有限公司,大专,无经验,"数据挖掘,数据治理",6000-8000元,工作内容：1、基于数据平台开发数据集市表和应用报表；2、海量数据实时查询数据开发，实时数据流处理；3、属于数据应用岗位，不需要编程。任职要求：1、专科及以上学历，专业不限；2、计算机、数学、统计学、财务管理、会计或相关专业优先考虑；3、熟悉使用办公软件，对新鲜事物感兴趣，肯专研。福利待遇：1、购买五险一金，享受带薪年假；2、丰富的业余集体活动（下午茶，拓展，旅游，年会等）；3、每年享受年度体检、生...,电气机械/电力设备,http://jobs.zhaopin.com/CCL1479866250J40827108810.htm,20-99人,2026-01-11 01:25:52
