职位,城市,公司,学历,经验,技能,薪资,工作描述,行业,职位URL,公司规模,发布时间
机器人数据与地图研发经理,重庆,七腾机器人有限公司,硕士,5-10年,"机器人算法,导航算法,地图与仿真模块落地,导航定位,路径规划,机器避障,感知机,Python,工业机器人",2.6-5万,岗位职责:1.负责机器人与慢速无人车项目地图与仿真模块落地：设计 “激光点云 + 视觉数据” 融合的先验地图构建方案，同步搭建防爆场景数字孪生模型（如厂房、管道、设备的三维仿真），实现地图与仿真场景的精准映射。2.主导先验地图与仿真优化：解决防爆场景建图痛点（管道遮挡、金属反光）与仿真虚实偏差（如地面摩擦系数、障碍物物理属性匹配），开发地图轻量化与仿真场景压缩算法（适配端侧加载）。3.搭建 “建图...,专用设备制造,http://jobs.zhaopin.com/CC387441310J40818271901.htm,500-999人,2026-01-04 15:44:07
高级算法专家,重庆,重庆富沛和科技有限公司,本科,3-5年,"机器学习,图像算法,大模型算法,C++,Python",3-4.5万,一、 战略与规划1、制定并执行公司算法技术的长期发展战略、发展施路线图和实时策略，确保与公司整体业务目标对齐。2、洞察业界最新算法技术趋势（如大模型、多模态、计算机视觉技术等），评估其与公司业务的结合点，推动技术前瞻性试验与落地。3、负责算法团队的技术选型、架构设计、数据体系建设和评审，确保技术方案的先进性、可扩展性和稳定性。二、 团队建设与管理1、负责算法团队的搭建、培养和管理，包括但不限于招聘...,IT服务,http://jobs.zhaopin.com/CC311178430J40823275010.htm,20-99人,2025-11-24 16:47:03
对日开发初级技术员到项目经理的全职位招聘,重庆,株式会社ProfaceSystems,大专,1-3年,"C,Python,Java,AI,赴日,对日,MySQL,PostgreSQL,Spring,Hibernate,Struts,SQLServer",2-4万,【会社概要】当社は、公共事業や受託開発、SES型開発を中心に、AIなどの先端技術を活用した新規マーケットの開拓も行っています。また、ITマネジメント人材の育成、組織運営、経営への参画など、幅広い開発環境・業務領域を提供しています。多様なプロジェクトを通じて、あなたの経験・スキル・可能性を最大限に発揮できるポジションをご用意しております。本公司以公共事业、委托开发和SES模式开发为核心业务，同时也积...,计算机软件,http://jobs.zhaopin.com/CC579165780J40398754113.htm,20-99人,2025-11-27 10:48:24
深度学习算法工程师（重庆）,重庆,同致电子科技(厦门)有限公司,硕士,3-5年,"图像算法,智能驾驶,导航算法,人工神经网络,Transformer,PyTorch,TensorFlow,Caffe,Python,C++,C语言,BEV,感知融合,影像",2.5-4万,岗位职责：1.负责公司原有影像产品相关算法的维护和优化；2.负责车载行业图像相关产品调研，掌握业内新应用.新技术的相关动态，并结合实际需求进行技术预研；3.负责图像算法实现的研究设计.效果仿真.代码编写及优化；4.负责算法实车效果及性能测试，对问题点进行分析定位，并快速应对；5.负责整理编写算法软件开发中的流程图.软件框架.接口定义.说明书等相关文档；6.负责算法：目标检测（主要是行人/车辆）.交...,汽车研发/制造,http://jobs.zhaopin.com/CC204092510J40841573912.htm,1000-9999人,2025-11-20 10:21:41
高级软件工程师,重庆,理工特智科技(重庆)有限公司,本科,5-10年,Spark,2-4万,岗位职责：1、核心平台架构与开发：参与设计并实现制造业操作系统的核心后端架构。基于 GraphQL + PostgreSQL + MinIO 技术栈，构建高可用、可扩展的数据服务与API接口。集成 Casbin 与数据库行级安全（RLS），实现精细化的多租户权限管理体系。2、数据与业务流程引擎：使用 Airflow 构建数据ETL、指标计算与AI模型训练的任务调度平台。使用 Camunda 设计与...,工业自动化,http://jobs.zhaopin.com/CCL1459508070J40967240004.htm,20-99人,2025-11-17 18:01:48
全国有岗位（开发、测试、算法、数据分析等,重庆,外企德科数字技术有限公司,本科,经验不限,"C语言,Python,Java",1.9-3.5万·16薪,"岗位： C/C++，java，JS，python、Go等通用软件开发工程师，软件测试工程师（ 社招模式），各产品线各类语言开发岗位开放，只要你懂一门语言，就有合适的岗位! 工作稳定，工作内容相同（pl无差异分配任务）（机考：提供复习资料，每个环节 TIPS 辅导，通过率高！！-直达面试！！！全程流程随时跟进可查, 一个部门不满意可转推不同部门）：工作：接触并开发核心业务代码，技术栈全面，技术牛人多...",专业技术服务,http://jobs.zhaopin.com/CCL1480117890J40632910605.htm,100-299人,2026-01-12 00:24:20
算法主管（影像/毫米波）,重庆,同致电子科技(厦门)有限公司,硕士,5-10年,"深度学习,图像算法,强化学习 ,Transformer,DNN,智能驾驶,导航算法,Python,C语言,C++,TensorFlow,PyTorch",3-4万,岗位职责：1.负责公司原有影像产品相关算法的维护和优化；2.负责车载行业图像相关产品调研，掌握业内新应用.新技术的相关动态，并结合实际需求进行技术预研；3.负责图像算法实现的研究设计.效果仿真.代码编写及优化；4.负责算法实车效果及性能测试，对问题点进行分析定位，并快速应对；5.负责整理编写算法软件开发中的流程图.软件框架.接口定义.说明书等相关文档；6.负责算法：目标检测（主要是行人/车辆）.交...,汽车研发/制造,http://jobs.zhaopin.com/CC204092510J40851306312.htm,1000-9999人,2025-11-20 10:20:56
对日软件开发工程师,重庆,杭州优灿科技有限公司,学历不限,3-5年,"Java,C#,C/C++,嵌入式技术,VB,SQL,日语,.NET,Python,Android",1.8-3.5万,1.3年以上Java/.NET/C/C++/开发经验2.了解Spring boot、mybatis、redis、mysql等常用开发框架与工具3.有对日项目经验，可不借助翻译软件独立读写式样书4.日语N3及以上5.了解React、angular、vue等前端技术者优先6. 学习和理解能力强，反应敏捷，具有一定的系统分析能力，及独立解决问题的能力,计算机软件,http://jobs.zhaopin.com/CC272317030J40853033513.htm,500-999人,2026-01-08 01:36:23
自动驾驶感知算法工程师/双休/五险一金,重庆,北京易才博普奥管理顾问有限公司,硕士,3-5年,"C++,Python,ROS,linux",2.5-3.5万,岗位职责：1. 负责自动驾驶系统中语义地图，地势图等感知算法研发，实现车辆在复杂环境下的精确障碍感知以及地势分析。2. 负责多传感器（如激光雷达、摄像头、毫米波雷达等）融合的目标跟踪算法的设计、开发与优化，提升目标状态估计的精度与鲁棒性。3. 负责感知模型的训练、调优，利用真实路测数据与仿真数据持续迭代算法性能。4. 参与算法的实车部署、测试与验证，解决实际场景中的技术难题。任职要求：1. 硕士及...,咨询服务,http://jobs.zhaopin.com/CC227750710J40741533906.htm,300-499人,2025-12-15 13:20:56
深度学习算法工程师,重庆,同致电子科技(厦门)有限公司,硕士,3-5年,"智能驾驶,Transformer,DNN,RCNN,TensorFlow,PyTorch,Python,C++",2.5-4万,岗位职责：1.负责公司原有影像产品相关算法的维护和优化；2.负责车载行业图像相关产品调研，掌握业内新应用.新技术的相关动态，并结合实际需求进行技术预研；3.负责图像算法实现的研究设计.效果仿真.代码编写及优化；4.负责算法实车效果及性能测试，对问题点进行分析定位，并快速应对；5.负责整理编写算法软件开发中的流程图.软件框架.接口定义.说明书等相关文档；6.负责算法：目标检测（主要是行人/车辆）.交...,汽车研发/制造,http://jobs.zhaopin.com/CC204092510J40851229512.htm,1000-9999人,2025-11-20 10:07:25
算法开发岗(045253),重庆,歌尔股份,硕士,5-10年,"PyTorch,TensorFlow,Python,C++",2.5-3.5万,岗位职责:岗位职责：1、牵头负责主动降噪（RNC路噪降噪、ENC发动机降噪和WNC风噪降噪等）类算法体系的完善和更新；2、负责车载主动降噪相关的AI模型的搭建、训练、优化和应用开发，拓展AI技术的应用场景和解决方案；3、主导团队的算法研发，确保算法的稳定性和鲁棒性，保持在业界的竞争力；4、参与项目需求分析、方案设计和实现，协同团队完成项目交付；5、持续关注国内外行业动态和技术进展，积极推进团队技术...,电子/半导体/集成电路,http://jobs.zhaopin.com/CC132726540J40724033606.htm,10000人以上,2025-10-13 11:22:33
自动驾驶规控算法工程师/双休/五险一金,重庆,北京易才博普奥管理顾问有限公司,硕士,3-5年,"C++,Python,APOLLO,AUTOWARE,Carsim,ROS,PRESCAN,CARSIM-SIMULINK",2.5-3.5万,岗位职责：1、 负责自动驾驶车辆路径规划、运动规划和控制算法的开发、优化与落地，包括全局路径规划、局部行为决策、轨迹生成、车辆横向/纵向控制等。 2、 设计高鲁棒性的规划控制算法，解决复杂交通场景（如拥堵、变道、路口通行、紧急避障等）下的车辆运动问题。 3、 与感知、定位、预测等模块团队协作，完成多模块联合调试与系统集成，提升自动驾驶系统整体性能。 4、 基于实车测试数据或仿真平台（如CARLA、...,咨询服务,http://jobs.zhaopin.com/CC227750710J40741533106.htm,300-499人,2025-12-15 13:17:18
算法主管（影像/毫米波）,重庆,同致电子科技(厦门)有限公司,硕士,5-10年,"深度学习,图像算法,Transformer,RCNN,机器视觉,PyTorch,TensorFlow,C++,Python",3-4万,岗位职责：1.负责公司原有影像产品相关算法的维护和优化；2.负责车载行业图像相关产品调研，掌握业内新应用.新技术的相关动态，并结合实际需求进行技术预研；3.负责图像算法实现的研究设计.效果仿真.代码编写及优化；4.负责算法实车效果及性能测试，对问题点进行分析定位，并快速应对；5.负责整理编写算法软件开发中的流程图.软件框架.接口定义.说明书等相关文档；6.负责算法：目标检测（主要是行人/车辆）.交...,汽车研发/制造,http://jobs.zhaopin.com/CC204092510J40851285412.htm,1000-9999人,2025-11-20 10:06:48
算法开发工程师,重庆,歌尔股份,硕士,5-10年,"图像算法,语音识别,Python,C++,PyTorch,TensorFlow,RNC,ENC",2.1-3.5万,岗位职责：1、牵头负责主动降噪（RNC路噪降噪、ENC发动机降噪和WNC风噪降噪等）类算法体系的完善和更新；2、负责车载主动降噪相关的AI模型的搭建、训练、优化和应用开发，拓展AI技术的应用场景和解决方案；3、主导团队的算法研发，确保算法的稳定性和鲁棒性，保持在业界的竞争力；4、参与项目需求分析、方案设计和实现，协同团队完成项目交付；5、持续关注国内外行业动态和技术进展，积极推进团队技术能力提升。...,电子/半导体/集成电路,http://jobs.zhaopin.com/CC132726540J40723619606.htm,10000人以上,2025-10-11 15:27:13
系统架构师,重庆,同炎数智科技(重庆)有限公司,本科,5-10年,"Java,Python,SQL,微服务架构,搜索引擎技术",2.5-3.5万,岗位职责：1、负责软件平台基础架构设计、研发、调优，解决开发中各种系统架构问题，完成基础核心架构后台建设；2、主导软件平台的设计工作，负责核心模块的设计开发工作；3、参与软件平台的优化与部署，保障系统可用性、稳定性、和可扩展性；4、组织软件技术研究和攻关工作；5、对相关开发人员进行技术培训，指导开发工作。 专业能力要求专业知识：计算机、软件专业知识专业技能：1、熟练掌握JAVA或Python编程语...,咨询服务,http://jobs.zhaopin.com/CC450790080J40717215306.htm,500-999人,2025-10-03 00:03:40
IT技术岗（线上面+多地+高薪）,重庆,外企德科数字技术有限公司,本科,经验不限,"软件运维,Java,Python,C++",1.5-3万·14薪,业务方向:智能汽车(自动驾驶、智能座舱、融合感知、车云、车载网络等)、新能源(光伏、电动、充电桩等)、云&AI/高性能计算、5G、芯片、光通信&应用(光纤、车载光)、路由交换机等任职要求：1. 熟悉C/C++/Java/JS/Python任一语言及相关技术，熟悉Spring框架2. 具有扎实的编程基础和良好的面向对象编程思想3. 对常见数据库如MySQL、Oracle等有一定的了解和应用经验4. ...,专业技术服务,http://jobs.zhaopin.com/CCL1480117890J40832101205.htm,10000人以上,2026-01-12 00:26:43
技术专家/架构师,重庆,了了(重庆)农业科技有限公司,本科,10年以上,"Java,C语言,Python,全栈开发,企业级应用开发",2-3万,教育水平：计算机科学、软件工程或相关专业本科以上学历。工作职责描述：1、制定并推进公司技术发展战略与年度技术规划。2、有效带领技术团队，培养下属成员，提高团队整体专业技能。3、主导重大技术决策与系统架构设计，确保系统的稳定性、可扩展性与安全性。4、组织评审关键技术方案与系统设计，指导团队攻克技术难点。5、管理技术项目的进度与质量，保障项目按时高质量交付。6、跟踪前沿技术趋势，推动技术创新与成果转化...,物联网,http://jobs.zhaopin.com/CCL1489212500J40860736712.htm,20-99人,2026-01-09 01:34:11
嵌入式软件工程师,重庆,重庆力华科技有限责任公司,本科,3-5年,"C语言,C++,Python,8位单片机,32位单片机,PIC单片机,IIC总线,SPI总线,PC端编程软件",1.5-3万·13薪,1.根据项目任务书，设计项目相关应用软件，并进行调试验证。2.结合硬件电路，进行嵌入式软件搭建，进行软硬件调试，并做好相关设计说明文档。3.验证设计方案，解决调试软件难点，完成设计及验证工作。4.梳理开发资料并归档，协助公司完成其他相关工作。5.熟练使用PC端编程软件（QT、Python 、C#等）可独立设计制作相关PC端配套软件，能独立制作自动化测试平台软件，并能够进行外接设备的操作。任职资格：...,电子商务,http://jobs.zhaopin.com/CC555545820J40802515809.htm,20-99人,2026-01-08 08:57:18
C/C++/Java/Python/JS软件开发/算法/数据,重庆,外企德科数字技术有限公司,本科,经验不限,"Java,Python,C语言",1.5-3万·15薪,岗位选择： 软件开发、软件测试、嵌入式开发、算法、运维、数据分析等（工作地点可选北京、上海、深圳、东莞、杭州、南京、武汉、成都、西安、长沙、苏州、济南、广州等） 岗位要求： 1、统招本科及以上学历（学信网可查），985/211/双一流大学优先；计算机、通信相关专业优先，非相关专业有相关工作经验也可以。 2、热爱编程，基础扎实，熟悉JAVA/C++/C/Python/JS/HTML/GO等编程语言中...,专业技术服务,http://jobs.zhaopin.com/CCL1480117890J40616279705.htm,10000人以上,2026-01-12 00:24:19
AI工程师,重庆,重庆捷旭科技有限公司,本科,1-3年,"多模态,Python,语音处理,语音信号处理",1.5-3万,岗位职责1. AI 功能研发与优化负责公司产品中语音实时识别转写（ASR）、光学字符识别（OCR）、自然语言处理（NLP）、计算机视觉（CV）等 AI 相关功能的研发与优化，确保功能的稳定性、准确性和高效性。探索并应用最新的生成式 AI 技术，提升产品的智能化水平和用户体验。2. 模型开发与优化基于开源模型（如 Whisper、Tesseract、BERT、CLIP等）进行二次开发和定制，结合公司...,IT服务,http://jobs.zhaopin.com/CC457860710J40892731404.htm,100-299人,2026-01-07 01:08:13
图像算法工程师/视觉,重庆,重庆丰海坤翔实业(集团)有限公司,本科,5-10年,"图像识别产品,机器人,OpenCV,HALCON,Qt,Python,C#,C++",1.5-3万,岗位职责：1、负责收集客户需求，与设计人员沟通，确认检测方案；2、编写对应方案文档，设计流程图，软件说明书等科目；3、负责基于视频/图片的图像处理、检测算法和识别算法的设计、仿真和编码实现；4、收集研究行业内新的技术、算法，不断提高系统对图形图识别的效率与准确率。 招聘要求：1、计算机、电子信息、自动化相关专业大学专科以上学历;2、熟悉光源、相机、镜头的选型，能独立完成光学系统的搭建及实验；3、有...,橡胶和塑料制品,http://jobs.zhaopin.com/CCL1203913000J40807562909.htm,500-999人,2025-12-25 01:26:08
研发工程师（互联网加密流量识别）,重庆,北京中创信测科技股份有限公司,本科,3-5年,"Python,C++,加密流量识别",1.5-3万,岗位职责：负责互联网加密流量识别核心技术与算法的研发、优化及落地，包括但不限于TLS/SSL、QUIC等主流加密协议的流量特征提取、识别模型构建与迭代，重点覆盖代理网站相关加密流量的识别与业务分析；主导加密流量识别相关项目的技术方案设计与实施，攻克协议变体、加密强度升级等场景下的识别难题，提升识别准确率、实时性与泛化能力；跟踪加密通信领域的前沿技术动态（如新型加密协议、规避识别技术），结合业务需求...,通信/网络设备,http://jobs.zhaopin.com/CC000140950J40862208212.htm,100-299人,2025-12-22 16:06:22
智能驾驶系统软件工程师-软件框架,重庆,南方新华,本科,5-10年,"C++,C语言,自然语言处理,深度学习算法,机器学习算法,ROS,无人自主驾驶技术软件设计,操作系统原理，通信框架和中间件,Python,REVIEW代码经验",1.8-3万,工作职责：1、负责无人自主驾驶技术软件的框架设计，开发和维护；2、负责项目和技术架构的分析和软件架构设计，拆分软件模块，给出模块开发意见；3、持续跟进前沿软件框架，尽可能实现自主研发，降低外部三方依赖。任职要求：1、本科及以上学历（985/211），计算机、电子、自动化相关专业本科，5年以上一线开发和设计经验，深圳优先；2、精通C++、Python等编程语言，熟悉设计模式；3、良好的文档编写能力和...,人力资源服务,http://jobs.zhaopin.com/CC346219280J40792938311.htm,100-299人,2025-10-27 14:18:57
系统架构师,重庆,同炎数智科技(重庆)有限公司,本科,3-5年,"Java,Python,SQL",2-3万,岗位职责：1、负责软件平台基础架构设计、研发、调优，解决开发中各种系统架构问题，完成基础核心架构后台建设；2、主导软件平台的设计工作，负责核心模块的设计开发工作；3、参与软件平台的优化与部署，保障系统可用性、稳定性、和可扩展性；4、组织软件技术研究和攻关工作；5、对相关开发人员进行技术培训，指导开发工作。专业能力要求专业知识：计算机、软件专业知识专业技能：1、熟练掌握JAVA或Python编程语言...,咨询服务,http://jobs.zhaopin.com/CC450790080J40254699606.htm,500-999人,2025-10-26 00:35:03
算法工程师,重庆,重庆天如生物科技有限公司,本科,3-5年,"深度学习,图像算法,ViT,Transformer,PyTorch,TensorFlow,OpenCV,Python,C++,C语言",1.5-3万,岗位职责：1．负责图像类算法研发，包括图像分类、目标检测、语义分割、大模型等；2．负责算法测试、分析、验证，输出实验报告；3．负责深度学习算法在特定硬件平台上的部署；4．负责相应方向技术难点攻关、解决技术难题、前瞻研究；5．进行技术分享、专利申请和学术文章发表，提升公司的技术影响力。任职资格：1．本科及以上学历，生物医学工程、计算机、模式识别、信号处理、自动化等相关专业，数学基础好，211/985...,医疗设备/器械,http://jobs.zhaopin.com/CC501908020J40870002504.htm,20-99人,2025-09-26 14:26:03
结构分析求解器研发高级工程师,重庆,重庆数字赛道研究院,硕士,5-10年,"有限元,非线性有限元算法,隐式/显式动力学算法,结构静力学,动力学,ANSYS,Nastran,VISUALSTUDIO,Python,C++",2-3万,岗位职责：1.负责结构分析求解器研发。2.负责有限元算法开发和维护，包括梁、壳、膜、实体、低阶、高阶单元等。3.负责线性/非线性、隐式/显式动力学、结构力学等算法研发。4.实现结构静力、动力、振动、非线性分析相关模块的数值算法。5.根据产品需求，独立完成模块设计、功能实现与测试。6.撰写设计文档、开发手册与测试用例，推动工程代码质量提升。 任职要求：1.力学、航空航天、数学、机械、土木水利等相关专...,政府/公共事业,http://jobs.zhaopin.com/CCL1376365390J40800113513.htm,20-99人,2025-08-29 10:04:32
GPU算力服务器维保主管,重庆,成都弘智融信科技有限责任公司,大专,1-3年,"GPU,HGX,AI,Python,Kubernetes",1.5-3万,NVIDIA 维保工程师招聘信息 职位名 NVIDIA 硬件维保工程师（全职/驻场） 工作地点 [重庆]（可接受国内重点数据中心驻场） 岗位职责 1. 硬件维护 - 负责 NVIDIA H200H100 H800等设备， HGX 系统的日常巡检、故障诊断与硬件更换（GPU、NVLink、电源模块等）。 - 执行固件升级（如从 HGX 1.5.0 升级至 1.7.0），确保兼容性与稳定性。 2. 故,人工智能,http://jobs.zhaopin.com/CCL1508332480J40811381812.htm,20-99人,2025-08-13 00:00:05
算法主管,重庆,重庆天如生物科技有限公司,本科,5-10年,"深度学习,图像算法,ViT,VGGNet,Transformer,PyTorch,TensorFlow,OpenCV,Python,C++",2-2.8万,岗位职责：1. 负责带领团队完成公司项目的整体规划、管理与监督；设定团队目标和绩效标准，激励团队成员，提升团队士气和凝聚力；提供技术指导和支持，解决团队在开发过程中遇到的技术难题；2. 负责公司产品的软件技术方案编制、软件技术架构设计和系统优化，确保产品的稳定性和可靠性，实现项目软件经验库的建立与维护；3. 负责带领团队实现软件需求、设计、编码、集成、测试和发布，制定并执行医疗器械软件的质量管理体...,医疗设备/器械,http://jobs.zhaopin.com/CC501908020J40918205404.htm,20-99人,2025-07-08 11:42:18
编程辅导老师,重庆,高控(中国)智能科技有限公司,本科,经验不限,"C/C++,Python",75-150元/时,1，精通Python 和C++，最好有过带班经验。 2，可以辅导和监督学生完成网络课程。 内容：根据竞赛考试的要求设定学生的学习目标，根据目标选定网络课程，制定学生学习计划，监督学生按计划完成网络课程学习并且答疑并布置作业。,仪器仪表制造,http://jobs.zhaopin.com/CC816539990J40797056211.htm,20-99人,2025-10-22 11:17:45
ai运维工程师,重庆,成都弘智融信科技有限责任公司,本科,1-3年,"网络运维,Shell,Vmware,CUDA,C,Python",1.8-3万,"岗位职责： 对GPU服务器A100、A800、H100、H800、H200等型号 进行性能监控与故障处理 1、GPU云服务器维护，包括日常报警巡检，集群使用状态记录，处理系统报警；GPU状态检查，定期进行GPU状态检查，是否有ECC报警；GPU使用问题，客户在使用过程中遇到的问题，如驱动兼容性，任务失败原因；环境搭建，为GPU服务器，搭建cuda工具相关依赖，conda虚拟环境等 2,有搭建GPU...",人工智能,http://jobs.zhaopin.com/CCL1508332480J40808136912.htm,20-99人,2025-08-11 22:47:26
算法主管（重庆）,重庆,重庆天如生物科技有限公司,本科,5-10年,"深度学习,图像算法,OpenCV,PyTorch,Python,C++",2-2.8万,岗位职责：1.负责带领团队完成公司项目的整体规划、管理与监督；设定团队目标和绩效标准，激励团队成员，提升团队士气和凝聚力；提供技术指导和支持，解决团队在开发过程中遇到的技术难题；2.负责公司产品的软件技术方案编制、软件技术架构设计和系统优化，确保产品的稳定性和可靠性，实现项目软件经验库的建立与维护；3.负责带领团队实现软件需求、设计、编码、集成、测试和发布，制定并执行医疗器械软件的质量管理体系，确...,医疗设备/器械,http://jobs.zhaopin.com/CC501908020J40918202004.htm,20-99人,2025-06-09 17:09:20
软件开发（语言不限制 导师1对1 6个月）,重庆,外企德科数字技术有限公司,本科,无经验,"C语言,Java,Python",1.3-2.6万,[C/C++/JAVA/Python/web/算法岗位/测试均有岗位需求]构建业界先进的系统工程，同时注重培养人员的复合型技能，具备国内领先的开发模式和框架开发团队。业务发展形式好，前景广阔，针对各场景用户需求进行技术使能创新，技术提升发展机会大。[福利待遇]1、六险一金全额缴纳、为期半年的老员工带教、周末双休、丰厚年奖、双倍加班费、班车福利、带薪年假、入职&年度体检、加班免费宵夜、部门团建/下午...,专业技术服务,http://jobs.zhaopin.com/CCL1480117890J40825697105.htm,10000人以上,2026-01-12 00:26:17
