职位,城市,公司,学历,经验,技能,薪资,工作描述,行业,职位URL,公司规模,发布时间
网络安全工程师,重庆,上海微创软件股份有限公司,本科,1-3年,"云安全,Python,Shell",1.4-1.7万,职责： 1.负责公司整体网络与信息系统的安全防护、监测与响应工作。能够主动进行漏洞扫描、渗透测试和安全评估，识别系统、网络及应用程序中的安全隐患，并推动相关团队进行修复与加固，确保安全风险得到有效管理。2.主导安全事件的应急响应流程，在发生安全事件时能够迅速定位、遏制和消除威胁，并进行根因分析与复盘，制定并实施改进措施以防止事件复发。 3.设计和实施网络安全技术方案，包括但不限于防火墙、WAF、I...,IT服务,http://jobs.zhaopin.com/CC000638920J40835903614.htm,10000人以上,2026-01-08 15:03:59
汽车软件测试工程师（大型汽车企业，全额五险一金）,重庆,南方新华,本科,3-5年,"C++,C,Python,控制器",1.2-1.7万·14薪,需具备汽车软件产品测试经验！ 岗位职责： 1、负责测试需求的提炼，测试用例设计，编制、评审等工作； 2、负责软件开发过程中的回归测试及验证； 3、负责测试用例与上下有的追溯链接建立； 4、负责测试问题的跟踪管理及反馈； 5、支持软件发布测试工作开展，输出测试报告； 6、具备测试环节搭建能力； 7、具备台架问题排查及解决能力； 任职要求： 1、本科及以上，具有3年以上汽车控制器软件测试相关工作经验；...,人力资源服务,http://jobs.zhaopin.com/CC346219280J40810071511.htm,100-299人,2025-11-27 11:04:10
项目系统工程师,重庆,重庆道微投资管理有限公司,本科,经验不限,"JavaScript,分布式技术,多线程,数据结构,算法基础,大数据架构,量化系统,Python,Java,分布式系统",1.2-1.7万,一、工作内容1、负责公司业务相关数据的分析与挖掘，基于自研业务语言构建高质量工程；2、根据开发规范与流程，协助总经理完成策略分析，同时承担相应模块的编码、自测以及相关文档的编写工作。3、协同技术团队，持续优化现有工程架构与流程，提升系统性能与研发效率。 二、岗位要求 1、本科以上，计算机、数学、物理学、电子信息、自动化、软件工程等相关理工科专业优先，成绩优异者优先； 2、热爱技术钻研，踏实，有责任...,计算机软件,http://jobs.zhaopin.com/CC236071130J40814931407.htm,20-99人,2026-01-12 01:17:57
少儿编程助教！七险一金！,重庆,作业帮,大专,经验不限,助教,1.3-1.7万,作业帮主打工资按时发放！不限专业！！新人入组帮带！！！ 已读必回的HR ！！！【工作职责】：1、不需要推销新客户，负责对已经在作业帮各类 APP及公众号里购买了我们低价体验课的学员进行维护服务，答疑解惑;2、做好开课提醒，课中维护好课堂纪律，课后及时与家长微信电话沟通学员上课以及学习情况，及时反馈;3、体验课周期两周左右结束时做好体验课到正价课的转化，做好转化率。【任职要求】:1.大专及以上学历，...,互联网,http://jobs.zhaopin.com/CC287198080J40681320514.htm,10000人以上,2025-09-10 00:20:05
产品测试开发工程师（外企双休）,重庆,光翼(重庆)能源科技有限公司,本科,1-3年,"Java,Python,Windows,自动化测试,软件测试,系统测试,Selenium,CUCUMBER,PLAYWRIGHT",1.2-1.6万·13薪,您的主要职责是：1. 测试策略与规划：积极参与产品需求、设计评审，深入理解业务逻辑，制定全面且高效的测试策略、测试计划和测试方案。与其他团队协作，定位问题并优化产品质量。2. 测试用例设计与执行：根据测试计划和方案、编写并高标准执行功能、接口及非功能测试用例/脚本，确保测试的广度和深度。3. 测试报告与流程：撰写规范的测试报告，清晰分析测试结果，总结并推动测试过程中的改进，持续完善测试流程和质量保...,新能源,http://jobs.zhaopin.com/CCL1326358110J40742424506.htm,100-299人,2026-01-11 01:15:08
系统工程师（策略特征方向）,重庆,重庆道微投资管理有限公司,本科,经验不限,"多线程,量化系统,Java,Python,SQL,分布式技术",1.2-1.7万,一、工作内容1、负责公司业务相关数据的分析与挖掘，基于自研业务语言构建高质量工程；2、根据开发规范与流程，协助总经理完成策略分析，同时承担相应模块的编码、自测以及相关文档的编写工作。3、协同技术团队，持续优化现有工程架构与流程，提升系统性能与研发效率。 二、岗位要求 1、本科以上，计算机、数学、物理学、电子信息、自动化、软件工程等相关理工科专业优先，成绩优异者优先； 2、热爱技术钻研，踏实，有责任...,计算机软件,http://jobs.zhaopin.com/CC236071130J40814930907.htm,20-99人,2026-01-05 01:18:29
AI算法工程师,重庆,康硕(山西)智能制造有限公司,硕士,1-3年,"深度学习,机器学习,机器视觉,Python,C++,无人机飞控",1.2-1.6万,岗位职责：1. 无人机飞控算法研发• 负责无人机飞行控制系统的开发与优化，包括导航、姿态控制、路径规划等核心算法的设计、实现与调优，涵盖PID控制、一阶低通滤波、卡尔曼滤波等方法的应用。• 构建自主飞行安全机制：地理围栏、失联返航、紧急降落、避障降级策略与故障检测（FDI），满足应急场景安全要求。• 与飞控及嵌入式团队协作，基于MPU6050嵌入式微控制器及集成LoRa通信的GPS模块等硬件，完成...,船舶/航空/航天/火车制造,http://jobs.zhaopin.com/CCL1379394770J40897596502.htm,500-999人,2026-01-08 16:11:34
自动化测试工程师,重庆,光翼(重庆)能源科技有限公司,本科,1-3年,"Java,Python,Windows,自动化测试,软件测试,系统测试,Selenium,CUCUMBER,PLAYWRIGHT",1.2-1.6万·13薪,您的主要职责是：1. 测试策略与规划：积极参与产品需求、设计评审，深入理解业务逻辑，制定全面且高效的测试策略、测试计划和测试方案。与其他团队协作，定位问题并优化产品质量。2. 测试用例设计与执行：根据测试计划和方案、编写并高标准执行功能、接口及非功能测试用例/脚本，确保测试的广度和深度。3. 测试报告与流程：撰写规范的测试报告，清晰分析测试结果，总结并推动测试过程中的改进，持续完善测试流程和质量保...,新能源,http://jobs.zhaopin.com/CCL1326358110J40742488406.htm,100-299人,2026-01-09 01:16:20
需求分析工程师（策略特征方向）,重庆,重庆道微投资管理有限公司,本科,经验不限,"Python,Java,多线程,算法基础,SQL",1.2-1.7万,一、工作内容1、负责公司业务相关数据的分析与挖掘，基于自研业务语言构建高质量工程；2、根据开发规范与流程，协助总经理完成策略分析，同时承担相应模块的编码、自测以及相关文档的编写工作。3、协同技术团队，持续优化现有工程架构与流程，提升系统性能与研发效率。 二、岗位要求 1、本科以上，计算机、数学、物理学、电子信息、自动化、软件工程等相关理工科专业优先，成绩优异者优先； 2、热爱技术钻研，踏实，有责任...,计算机软件,http://jobs.zhaopin.com/CC236071130J40820183907.htm,20-99人,2025-12-31 17:55:22
AI算法,重庆,中软国际,本科,1-3年,"机器学习,大模型算法,PyTorch,Python,C++,检测",面议,岗位内容：1、算法研发：针对特定工业应用（如缺陷检测、尺寸测量、定位引导、OCR读码等），独立或协作完成传统视觉算法的设计、实现与验证。2、性能优化：对现有算法进行性能调优，提升处理速度、准确率和鲁棒性，满足高速产线实时性要求。3、问题攻关：分析并解决生产现场反馈的复杂视觉问题，提供有效的算法级解决方案。4、技术调研：跟踪传统视觉领域新技术（如深度学习在传统框架中的融合应用）、新工具库（如Open...,计算机软件,http://jobs.zhaopin.com/CC508620120J40867465012.htm,10000人以上,2026-01-08 09:40:32
测试开发工程师(外企双休),重庆,光翼(重庆)能源科技有限公司,本科,1-3年,"Selenium,CUCUMBER,PLAYWRIGHT,Java,Python,Windows,自动化测试,软件测试,系统测试",1.2-1.6万·13薪,您的主要职责是：1. 测试策略与规划：积极参与产品需求、设计评审，深入理解业务逻辑，制定全面且高效的测试策略、测试计划和测试方案。与其他团队协作，定位问题并优化产品质量。2. 测试用例设计与执行：根据测试计划和方案、编写并高标准执行功能、接口及非功能测试用例/脚本，确保测试的广度和深度。3. 测试报告与流程：撰写规范的测试报告，清晰分析测试结果，总结并推动测试过程中的改进，持续完善测试流程和质量保...,新能源,http://jobs.zhaopin.com/CCL1326358110J40742486606.htm,100-299人,2026-01-08 01:17:04
后端开发工程师（策略特征方向）,重庆,重庆道微投资管理有限公司,本科,经验不限,"Python,Java,JavaScript,Erlang,HASKELL,多线程,算法基础,大数据架构,数据结构,分布式技术",1.2-1.7万,一、工作内容1、负责公司业务相关数据的分析与挖掘，基于自研业务语言构建高质量工程；2、根据开发规范与流程，协助总经理完成策略分析，同时承担相应模块的编码、自测以及相关文档的编写工作。3、协同技术团队，持续优化现有工程架构与流程，提升系统性能与研发效率。 二、岗位要求 1、本科以上，计算机、数学、物理学、电子信息、自动化、软件工程等相关理工科专业优先，成绩优异者优先； 2、热爱技术钻研，踏实，有责任...,计算机软件,http://jobs.zhaopin.com/CC236071130J40818783107.htm,20-99人,2025-12-23 11:28:39
小孩编程课程顾问老师--有2次固定双休,重庆,作业帮,本科,经验不限,助教,8000-16000元,入职缴纳七险一金、餐补500元\月、下班免费打车，65元\天交通补贴、过年放假10天起步、额外带薪年假5天，节假日礼品等超多福利！七险一金=（五险一金+意外险+补充医疗险）接受新人，看重学习能力！提供学习发展机会！大平台有保障，当月薪资当月发，薪资按时发放！【我们的优势】1、我们对接已经主动报名课程的学生群体！名师讲题吸引！我们不授课，不讲课！分析学生学习问题，为学生提供学习建议和方法，帮助学生学...,互联网,http://jobs.zhaopin.com/CC287198080J40833852114.htm,10000人以上,2026-01-07 18:18:05
运维开发工程师,重庆,软通动力信息技术(集团)股份有限公司,大专,3-5年,"Python,Java,GoLang,Prometheus,Docker",1.1-1.6万,岗位职责负责后端服务的部署、发布与环境管理，保障稳定可用参与运维平台建设，完善监控、告警与问题定位能力基于 Prometheus + Grafana 搭建与维护监控体系接入并维护 CAT 等链路追踪/监控服务编写并维护后端自动化测试脚本，提升交付质量参与音视频 / IoT 相关后端项目研发与系统优化任职要求扎实的后端开发基础（Java / Go / Python 至少一种）熟悉 Linux 环境下...,互联网,http://jobs.zhaopin.com/CC000544460J40784735816.htm,10000人以上,2026-01-07 01:46:08
高级算法工程师（外骨骼机器人方向）,重庆,重庆新翼创电气科技有限公司,本科,1-3年,"运动控制算法,运动规划,C/C++,Python,医疗机器人,康复机器人",8000-16000元·13薪,岗位职责：1、负责外骨骼机器人相关的机器学习算法设计与开发，具体包括采集和分析表面肌电信号、多维力传感器、IMU（惯性测量单元）等多维传感信号。2、研发基于多传感器融合的人体运动意图识别模型，特别是对步态进行识别与预测，并部署分类器，结合机器人控制算法实现精准的助力控制。3、主导具身大模型在外骨骼机器人中的应用探索，包括但不限于多模态数据（视觉、语言、触觉）融合、端到端模型架构设计，以及模型在仿真...,电子/半导体/集成电路,http://jobs.zhaopin.com/CCL1259681130J40806578801.htm,20-99人,2026-01-06 01:01:27
销售编程课老师,重庆,作业帮,本科,经验不限,助教,8000-16000元,入职缴纳七险一金、餐补500元\月、下班免费打车，65元\天交通补贴、过年放假10天起步、额外带薪年假5天，节假日礼品等超多福利！七险一金=（五险一金+意外险+补充医疗险）接受新人，看重学习能力！提供学习发展机会！大平台有保障，当月薪资当月发，薪资按时发放！【我们的优势】1、我们对接已经主动报名课程的学生群体！名师讲题吸引！我们不授课，不讲课！分析学生学习问题，为学生提供学习建议和方法，帮助学生学...,互联网,http://jobs.zhaopin.com/CC287198080J40833842314.htm,10000人以上,2025-12-29 20:39:36
销售数据分析双休,重庆,平安融易(黑龙江)信息服务有限公司重庆第九分公司,大专,经验不限,Python,8000-16000元,职位描述我们正在寻找金融数据分析师，负责为公司提供高质量的金融数据分析和决策支持。工作内容:1.收集、整理和处理金融市场数据;2.运用财务分析工具和模型进行数据分析和建模;3.撰写分析报告，为投资决策提供参考;4.跟踪金融市场动态，及时提供市场分析和预警。岗位要求:4.金融、数学、统计学等相关专业本科及以上学历;5.熟练掌握Excel、R、Python等数据分析工具;6.具备扎实的金融理论基础和数...,互联网金融/小额贷款,http://jobs.zhaopin.com/CC846946760J40838073002.htm,10000人以上,2025-12-01 09:35:10
大数据开发工程师,重庆,腾讯瑞德铭(重庆)科技发展有限公司,本科,3-5年,"数据仓库,ETL",1.2-1.6万,任职要求：1.本科及以上学历，计算机相关专业；2.三年以上数据仓库ETL开发经验，熟悉数据库的架构和理论，熟悉ETL开发流程和规范3.精通Hadoop、Hive或者Spark，以及SQL的性能调优，有相应的调优经验4.熟悉Oracle、Mysql等关系型数据库的架构和理论5.沟通能力强，乐观积极主动,互联网,http://jobs.zhaopin.com/CCL1379480290J40810613008.htm,10000人以上,2025-11-04 16:58:00
算法工程师,重庆,重庆慧睿智能物联科技有限公司,本科,3-5年,"PyTorch,TensorFlow,机器人,强化学习 ,模仿学习,Python,C++,C#,遥操作,ROS",1.2-1.6万,岗位内容：1.负责人形机器人的运动控制与行为决策算法的研发，应用强化学习、模仿学习等技术优化机器人动作与交互能力；2.设计和实现机器人感知、运动规划及动态控制算法，提升机器人的灵活性和适应性；3.参与机器人系统的需求分析、功能设计及仿真验证，推动算法在实际场景中的落地；4.跟踪机器人领域的前沿技术（如强化学习、模仿学习、多模态融合等），持续优化机器人核心性能。任职要求：1.熟悉机器人学、强化学习、...,物联网,http://jobs.zhaopin.com/CCL1423333490J40766074805.htm,100-299人,2025-10-24 00:39:21
高级Java开发工程师（兼具移动端能力）,重庆,重庆千兆蜂科技有限责任公司,本科,5-10年,"JavaScript,Python,小程序,Android",8000-16000元,"1.本科学历，JAVA开发，三年以上的开发经验。 2.熟练使用Springboot,mybatis plus。了解quartz,线程池，异步执行器、分布式等组件。 3.mysql具备基本的数据库设计能力（存储过程，空间存储，视图，函数）。 4.熟练使用rabbitmq、kafka（Kafka connect，ksqldb等生态）、amqp、mqtt、redis、clickhosue等中间件。并对l...",居民服务,http://jobs.zhaopin.com/CCL1491942990J40727377106.htm,20-99人,2025-10-23 11:11:53
嵌入式开发工程师,重庆,广东中科晟测控技术有限公司,本科,5-10年,"8位单片机,32位单片机,C语言,C++,Python",8000-16000元,职位详情:1、文档编写:撰写设计文档、测试报告、用户手册等。.2、负责硬件选型、原理图设计、PCB绘制、PCB打样与焊接调试等，以及量产阶段的EMI、EMC、老化等测试方案的设计与实施。3、负责恒温恒湿控制器的部分功能代码的编写、调试、集成。4、参与恒温恒湿控制器的系统需求、系统架构设计、软件需求、软件架构、详细设计等。5、参与恒温恒湿控制器PID算法的设计、调试、集成。任职要求:1、本科以上学历...,电子/半导体/集成电路,http://jobs.zhaopin.com/CCL1478638240J40809440614.htm,20-99人,2025-10-22 17:22:30
AI工程师,重庆,浙江友华工程咨询有限公司,本科,1-3年,"大模型算法,Python",8000-16000元,1.计算机相关专业，本科以上学历；2.熟悉开源大模型如llama3、deep seek 等的部署、二次开发，有生成式模型的训练技巧和优化方法；3.熟悉RAG技术，了解如何提升知识库召回率；4.熟悉自然语言处理及相关的AI框架；5.熟悉python语言进行大模型编程；6.具备较强专利及论文撰写能力;7.有大模型成果产出2项以上，包括论文、专利、商业应用成果。,通信/网络设备,http://jobs.zhaopin.com/CC284529010J40788850101.htm,1000-9999人,2025-09-17 14:32:05
软件工程师,重庆,重庆永光电器科技有限公司,本科,3-5年,"C语言,Python,汇编语言,8位单片机,PIC单片机,ARM处理器",9000-16000元,岗位职责：1..负责嵌入式电子产品软件开发，软件功能开发和维护、客户需求定制和编写相关文件2.软件系统结构设计与功能模块设计、实现3.测试软件问题跟踪解决4.解决产品生产过程中出现的技术问题，提供技术支持任职资格任职要求：1.电子信息、自动化、计算机、通信等相关专业2.熟练掌握嵌入式软件，如KEIL-ARM、MPLAB3.懂逆变电源类（AC转DC/DC转DC） 最佳,通用设备制造,http://jobs.zhaopin.com/CCL1480089480J40537189109.htm,100-299人,2025-03-07 09:06:31
Python工程师,重庆,重庆山外山血液净化技术股份有限公司,本科,1-3年,"Django,Flask,MySQL,Python",1-1.5万·13薪,岗位职责：1.参与系统项目和各模块的需求分析，与项目负责人沟通和确认某个模块的需求和实现方法；2.负责项目模块的代码编写、维护；3.负责系统开发模块所需软件文档的编制，以及完整存档；4.保证自己负责的开发项目的开发进度和开发结果，并符合规范要求；5.辅助参与产品的安装、部署等工作，辅助参与售前、售后技术指导；6.负责协调所承担模块软件及软件测试过程的相关工作，负责与测试人员的交互，处理测试人员的问...,医疗设备/器械,http://jobs.zhaopin.com/CC343078780J40746178206.htm,1000-9999人,2026-01-12 09:08:10
策略工程师（特征分析）,重庆,重庆道微投资管理有限公司,本科,经验不限,"Java,Python,机器学习,贝叶斯,预测分析,时间序列模型,方差分析,因子分析,多元统计分析,协同过滤,非线性动力学",1-1.5万,（一）工作内容：1、对目标对象进行数据统计、分析、维护，深入挖掘规律；2、根据已有数据，发现决策中的问题和隐含的风险；3、协助总经理调研、分析、设计、优化策略特征。 （二）职位要求： 1、本科以上学历，数学、计算机、软件工程、自动化、电子信息等理工科相关专业优先，成绩优异者优先； 2、热爱技术钻研，踏实，有责任心，有强烈的自我驱动力和较好的学习态度，愿意在团队里追求长期事业发展； 3、有较强的执行...,计算机软件,http://jobs.zhaopin.com/CC236071130J40808011607.htm,20-99人,2026-01-12 01:17:37
信号采集软件开发工程师,重庆,遨谱(上海)科技有限公司,本科,经验不限,"C++,Python,C#,接口通讯,信号采集,了解系统集成和传感器",1-1.5万,信号采集软件开发工程师职位需求和岗位职责：岗位职责：1. 依据客户需求、架构设计，进行软件模块设计、代码开发、测试验证、运行维护、文档编写等工作2. 负责全公司软件开发、系统集成、公司软件定制化等工作3. 研究和掌握公司所用软件以及所需的编程技术和工具，扩展软件功能，提高软件质量和运行效率4. 服从公司工作安排，按照项目计划按时提交代码与文档5. 根据项目需要，配合团队完成其他相关工作岗位要求：1...,仪器仪表制造,http://jobs.zhaopin.com/CC872771270J40867015603.htm,20-99人,2026-01-12 00:21:41
Python开发工程师,重庆,软通动力信息技术(集团)股份有限公司,本科,3-5年,,1-1.5万,基本要求· 本科及以上学历，计算机相关专业· 3 年及以上 Python 开发经验，具备扎实的编程基础· 熟悉 Linux 操作系统及常见系统管理、网络基础知识· 有 DevOps 或运维开发（SRE / DevOps）相关实战经验· 有ITSM/CMDB等运维系统开发经验优先；技术能力要求· 精通 Python，熟悉常用框架或工具（如 Flask / FastAPI / Requests / C...,互联网,http://jobs.zhaopin.com/CC000544460J40786577616.htm,10000人以上,2026-01-09 15:47:42
AI投资数据分析师,重庆,重庆道微投资管理有限公司,本科,经验不限,Python,9000-15000元,一、工作内容1、负责对商品上下游产业链、公司财务分析等传统领域进行深度研究；2、运用AI工具与公司方法论，构建、管理并优化多行业多领域的“AI agent”；3、推动AI分析工具在实际业务场景中的落地应用；4、及时有效地向关键客户传递公司策略，协助产品发行流程；5、支持公司重点项目的研究需求，完成上级领导安排的其他任务。 二、岗位要求 1、双一流以上学历，专业不限，成绩优异者优先； 2、踏实，认真...,计算机软件,http://jobs.zhaopin.com/CC236071130J40775161807.htm,20-99人,2026-01-11 01:16:12
开发工程师兼运维,重庆,聚慧食品科技(重庆)有限公司,本科,3-5年,"Python,JavaScript,Spring,Mybatis,MySQL,PostgreSQL",1-1.5万,岗位职责1:负责公司平台架构的规划与设计，主导技术架构方向制定；2:参与核心组件及代码开发，主导中初级开发人员的系统设计与代码质量评审，编写技术文档并制定标准化开发规范；3:设计核心功能架构与代码模板，开发并维护系统基础核心模块，保障系统稳定性与可扩展性；4:协同产品经理梳理业务需求，从技术视角提供可行性解决方案，并推动方案落地与研发执行；5:管理测试团队，凭借丰富测试经验识别系统重大缺陷，推动问...,快速消费品,http://jobs.zhaopin.com/CC843819990J40819663711.htm,1000-9999人,2026-01-09 09:25:43
数据开发治理高级工程师,重庆,中国电信重庆分公司,本科,5-10年,"Sql,Python,Scala,Hadoop,Spark,Kafka,数据治理,ETL,数据建模",1.2-1.5万,岗位要求：1、大学本科以上学历，计算机、大数据、数据科学、统计学、教育技术学、医学信息工程等相关专业；2、熟悉 Hadoop 生态，熟悉HDFS、Hive、Spark、Kafka、ETL、Ceph、Doris等组件和工具，熟练掌握SQL、Python等数据开发语言，有多模态数据处理、数据挖掘相关经验优先；3、熟悉数据仓库、数据建模，熟悉数据治理、数据管理知识，能够规划数据架构、数据治理体系并实施，...,通信/网络设备,http://jobs.zhaopin.com/CC203258710J40809908510.htm,500-999人,2026-01-09 01:27:18
monad工程师（策略特征方向）,重庆,重庆道微投资管理有限公司,本科,经验不限,"Python,Java,HASKELL,MONAD",1-1.5万,一、工作内容1、负责公司业务相关数据的分析与挖掘，基于Monad范式构建高质量策略；2、根据开发规范与流程，协助总经理完成策略分析，同时承担相应模块的编码、自测以及相关文档的编写工作。3、协同技术团队，持续优化现有工程架构与流程，提升系统性能与研发效率。二、岗位要求1、重本以上，计算机、数学、物理学、电子信息、自动化、软件工程等相关理工科专业优先，成绩优异者优先；2、有一定工程基础，至少掌握1种编...,计算机软件,http://jobs.zhaopin.com/CC236071130J40804787307.htm,20-99人,2026-01-10 01:19:45
视觉算法工程师（工业自动化）,重庆,合肥星睿智造技术有限公司重庆分公司,本科,1-3年,"机器人,图像识别产品,C++,Python",1.2-1.5万,职位描述1、使用c++语言，参与3D视觉底层算法（工业应用：检测、定位、识别）的开发实现。2、根据项目需求，分析讨论需求的技术实现路径。3、参与视觉软件平台的开发。4、参与专利的编写。5、参与算法测试与机器人联动调试。6、参与项目的视觉系统硬件选型，对应视觉模板工程设计，及项目调试支持。岗位要求1、本科及以上，具有较好的数学能力及英文阅读能力，具有相关工作经验，或者相关项目经历（应届生）。2、熟悉...,工业自动化,http://jobs.zhaopin.com/CCL1491801660J40658841009.htm,20-99人,2026-01-09 01:22:44
