职位,城市,公司,学历,经验,技能,薪资,工作描述,行业,职位URL,公司规模,发布时间
平面设计,重庆,重庆乐速文化传媒有限公司,大专,3-5年,"电商设计,广告设计",6000-7000元,岗位内容：1. 根据公司品牌定位和市场需求，进行平面设计、VI设计、海报设计、产品包装设计等相关工作；任职要求：1. 大专及以上学历，平面设计或相关专业毕业，有3年以上品牌设计经验；2. 熟练使用Ai、Ps、Id等设计软件，可以独立完成各类设计任务；3. 具备良好的审美能力和设计感，对颜色、构图、排版等方面具有敏锐的嗅觉。,新媒体,http://jobs.zhaopin.com/CCL1455287360J40819464707.htm,300-499人,2025-12-26 12:16:43
资深平面设计师,重庆,重庆厚石广告设计制作有限公司,学历不限,3-5年,"设计师,视觉设计,CDR,方案设计,VI设计,广告设计",4000-7000元,平面设计师（医院/部队项目方向）招聘我们专注服务医院、部队等专业领域，现诚邀资深平面设计师加入，用专业设计助力政务与医疗宣传的规范化呈现！核心岗位职责1. 负责医院、部队相关视觉物料全案设计，涵盖文化墙、宣传栏、主题海报、VI系统延展等；2. 独立完成会议汇报PPT、宣传推广PPT制作，精准匹配医院学术场景、部队政务场景的风格要求；3. 参与宣传片相关视觉设计工作，配合完成脚本可视化、片头片尾设计...,广告/营销,http://jobs.zhaopin.com/CC382109710J40844470313.htm,20-99人,2025-11-24 15:53:04
设计师,重庆,小岢健康科技(重庆)有限公司,本科,1-3年,"VI设计,广告设计,包装设计,PS,AI,CAD",4000-6000元·13薪,一、岗位职责1、产品设计负责公司产品线的整体设计规划，完成产品外观设计。2.市场需求转化设计根据市场需求设计产品、活动海报参与产品前期策划，提供设计视角的商业化建议，助力产品定位与差异化竞争。3.设计体系搭建与创新 建立或优化公司产品设计标准与流程，提升设计效率与质量。 二、任职要求 硬性要求 1.设计相关专业本科及以上学历。 2.2年以上设计经验，有日化品等实体产品全链路设计经验者优先。 3.精...,快速消费品,http://jobs.zhaopin.com/CCL1495877200J40836759905.htm,20-99人,2026-01-09 15:03:06
美工平面设计,重庆,重庆乐速文化传媒有限公司,大专,1-3年,,6000-7000元,"美工平面设计师（请主动将简历和作品发给hr,谢谢配合~）要求：电商平台美工设计经验，【工作职责】1、负责公司电商/私域/直播运营 /产品/品牌等相关设计工作。2、根据需求，进行创意构思、设计方案的制定和执行。与团队成员协作，完成设计项目的全流程。3.结合数据反馈进行数据分析，根据用户体验持续优化设计4.收集和分析设计素材，关注设计趋势，分享经验，不断提升设计水平。【职位要求】1. 专业技能：美术、...",新媒体,http://jobs.zhaopin.com/CCL1455287360J40814671807.htm,300-499人,2025-12-05 09:55:47
平面设计师,重庆,重庆金彩旗胜科技集团有限公司,大专,无经验,"广告设计,排版设计,标识导视设计,PS,CDR,AI",3000-6000元,周六、周日双休岗位内容：1. 根据客户需求，进行平面设计、标示标牌设计、VI设计、海报设计、产品包装设计等相关工作；2. 设计并制作宣传资料，包括门头、户外标识标牌、文化氛围设计、宣传册、广告海报、DM单页、PPT、视频等；任职要求：1. 大专及以上学历，平面设计或相关专业毕业；2. 熟练使用Ai、Ps、cdr、草图大师等设计软件，可以独立完成各类设计任务；3. 具备良好的审美能力和设计感，对颜色...,文体/办公设备制造,http://jobs.zhaopin.com/CC865437120J40796999813.htm,20-99人,2025-12-31 16:00:09
PS图片编辑员（实习生）,重庆,成都海祥联创科技有限公司,本科,无经验,"PS,视觉设计,AI,AE,广告设计,排版设计,UI设计",3000-6000元,"岗位内容： 1. 按照公司要求完成PS图片处理、编辑和优化；2. 制定视觉设计标准和规范，确保设计风格的一致性和可维护性；3. 运用数据分析、市场调研等手段，为产品设计提供分类处理方案；4.有进取心，有团队合作意识，服从管理，提供良好的晋升空间。任职要求： 1. 本科及以上学历，美术、设计等相关专业，有PS,AI,PR,AN,AE经验者优先；2. 熟练掌握各类设计软件及工具，熟悉PS,AI,AN,...",通信/网络设备,http://jobs.zhaopin.com/CC650203820J40802412011.htm,100-299人,2025-12-26 11:03:51
平面设计,重庆,他山石企业管理咨询(重庆)有限公司,大专,经验不限,,4000-6000元,岗位职责：负责为餐饮商家打造具有竞争力的品牌形象，推动线上线下整体运营落地。1. 品牌视觉体系：独立完成LOGO、品牌VI及延展物料设计，输出完整的品牌视觉规范；2. 营销推广设计：结合运营策略，设计抖音、小红书、美团、大众点评等平台的宣传素材；3. 线下物料设计：设计菜单、桌贴、台卡、展架等门店物料，提升门店整体视觉体验；4. 跨部门协作：与策划、运营、内容团队紧密配合，确保视觉与品牌策略、运营...,广告/营销,http://jobs.zhaopin.com/CCL1483314680J40887624302.htm,20-99人,2025-12-23 17:29:07
美工兼新媒体-应届毕业生,重庆,重庆当为企业管理咨询有限公司,本科,经验不限,"方案设计,UI设计,电商设计",3000-6000元,1、22岁，广告学、视觉传达、艺术设计类相关专业，2026应届毕业生。2、主要负责小程序、平面、公众号、视频等及新媒体运营，有平面设计、新媒体运营实践经验优先3、薪酬福利：实习期3K，转正后4-6K，五险一金，双休，节假日福利。4、工作地点：冉家坝,咨询服务,http://jobs.zhaopin.com/CCL1503026400J40886746602.htm,20人以下,2025-12-22 16:43:26
视觉设计师助理,重庆,重庆蓝思晨科技有限公司,大专,经验不限,,4000-6000元,岗位内容：1. 根据设计师提供的设计概念和方向，协助完成各类平面设计和产品设计；2. 使用设计软件进行创意设计、制图、排版等工作；任职要求：1. 熟练掌握Photoshop、Illustrator等主流设计软件，2. 创新思维，能够理解和发挥设计师的设计意图，方便有效地完成各项任务；3. 坚韧不拔、勤奋踏实，对细节有高度认知。4. 具有良好的沟通能力，喜欢工作中团队协作，有一定的组织能力和时间管理...,互联网,http://jobs.zhaopin.com/CCL1504338550J40878347002.htm,20-99人,2025-12-10 14:42:53
软件ui设计师/视觉设计师,重庆,重庆珀菲特信息技术有限公司,大专,1-3年,"界面设计,可视化,2.5D建模",4000-6000元,岗位职责与要求： 1、熟练使用Photoshop、Illustrator等设计软件，有很强的视觉设计能力、沟通能力，色彩感强； 2、能负责与客户沟通，快速掌握客户实际需求； 3、熟悉常用网页设计效果，拥有使用多种设计方案，解决问题的能力； 4、收集美工素材，整理思路，能够为下一次设计充分的做好准备； 5、会做可视化设计； 6、会做2.5D建模； 7、积极配合好各部门之间的工作，有较强的沟通协调能力...,IT服务,http://jobs.zhaopin.com/CC373858987J00492668803.htm,20人以下,2025-12-02 08:35:49
品牌视觉岗,重庆,重庆奇文鸿迈科技有限公司,大专,1-3年,"广告设计,包装设计,VI设计,PS,AI,CDR",5000-6000元,我们公司正在寻找一位具有创新、创造力的品牌设计师，以支持我们的公司发展。作为我们的品牌设计师，您将创建和实施新的品牌设计，从而增强我们的品牌形象和识别度。主要职责：1. 具备较强品牌的视觉产出（创意发想、设计执行）。2. 设计公司品牌形象、标志、视觉识别系统、线下门店品牌物料、产品包装和其他品牌元素。3. 参与并协助进行品牌传播策略的制定和执行。4. 与产品团队和其他相关团队密切合作，确保品牌设计...,宠物服务,http://jobs.zhaopin.com/CCL1494730540J40707138610.htm,100-299人,2025-11-13 09:32:01
高级UI设计师,重庆,好活(重庆)网络科技有限公司,学历不限,经验不限,,4000-5000元,职位名称：高级UI设计师 岗位职责： 负责公司产品界面设计，提升用户体验与视觉表现力； 主导用户界面的创意设计与视觉规范制定，确保设计风格统一与品牌一致性； 与产品、开发团队紧密协作，推动设计方案的落地与优化； 持续关注设计趋势与用户需求，进行设计方案的迭代与创新； 参与设计流程的优化与标准化建设，提升团队设计效率与质量。 任职要求： 本科及以上学历，设计相关专业优先； 3年以上UI设计经验，有成...,云计算/大数据,http://jobs.zhaopin.com/CCL1405717820J40837769205.htm,20-99人,2026-01-09 11:47:13
平面设计师,重庆,重庆龙悦鸿祥科技发展有限公司,大专,1-3年,,4000-5000元,1.根据公司品牌定位和发展战略，设计公司整体VI标准化（包括东坡晓、栖元乾）和更新公司的品牌标识（logo）、标准字、标准色等基础视觉元素；2、公司品牌视觉规范手册，包括（东坡晓，栖元乾）品牌在各类宣传物料、办公文具、网站界面、社交媒体平台等应用场景中的使用规范；3、参与公司广告创意策划与设计工作，配合其他部门，做好产品设计、营销、宣传等设计，并根据反馈意见对设计方案进行修改和完善；4、参与小程序...,医美/健康服务,http://jobs.zhaopin.com/CCL1493835380J40818779411.htm,20-99人,2026-01-05 10:57:17
平面设计兼职,重庆,重庆木岩文化传播有限公司,学历不限,1-3年,,3000-5000元,一、招聘条件：1、美术生及有美术行业相关经验者优先。2、能够独立完成电商图和小红书图文设计。3、有良好的审美，设计思维，学历不限。4、积极乐观，有良好的沟通能力。二、工作时间和薪资：面议。,文化艺术/娱乐,http://jobs.zhaopin.com/CC806900370J40975496604.htm,20人以下,2025-12-22 20:54:41
设计/视觉方向标注-朝九晚六,重庆,软通动力信息技术(集团)股份有限公司,大专,经验不限,"设计方向标注,视觉方向标注",3000-5000元,岗位要求：1、负责对数据中相关内容、视频、图片、文字等进行信息标注、研判；2、针对标注内容进行定期复盘总结，自我提升；3、针对标注任务提出可行性优化建议及改进措施；4、快速响应，具备较强的风险敏感度。任职要求：● 本科及以上学历，具备美学、美工、图像设计相关专业及工作背景优先，如有一年以上相关专业背景工作经验的可以放宽至大专；（本科不要求经验，专科要求相关背景或专业）● 必须具备良好的逻辑思维能力...,互联网,http://jobs.zhaopin.com/CC000544460J40778051016.htm,10000人以上,2025-12-05 14:47:43
平面设计/美陈设计,重庆,新世界百货,本科,1-3年,"PS,CorelDRAW,AI,视觉设计,延展设计,设计师助理,设计师",4000-5000元·13薪,1、负责商场节气宣传海报设计，协助卖场氛围形象设计，熟练使用ai及ps；2、负责市场部文职类工作（报销流程，线上采购流程等工作）； 3、大型商业体日常物料的更新维护，和大型活动的主视觉及延展设计，包涵 DM单、桁架、立牌、地贴、美陈等；4、商场异业活动协调； 5、活动数据整理及分析； 任职要求：大学本科学历以上，年龄30岁以下，早九晚六 ，综合排班制度，月休7-8天（含法定节假日）。类似大小休,零售/批发,http://jobs.zhaopin.com/CC235580310J40350038712.htm,1000-9999人,2025-10-30 00:00:02
平面设计,重庆,重庆大墨文化传播有限公司,本科,经验不限,"AI,CDR,标志设计,广告设计,画册设计",4000-5000元,1、负责公司各类广告、导视设计制作；2、根据客户要求，完成书籍设计排版、海报、产品画册、公司宣传册等相关设计；3、根据公司不同市场活动及需求，完成相关设计工作；职位福利：绩效奖金、加班补助、全勤奖、交通补助、餐补、通讯补助、弹性工作、节日福利,广告/营销,http://jobs.zhaopin.com/CC371864584J00586313001.htm,20-99人,2025-04-28 15:14:25
平面设计工程师,重庆,苏州泊曼包装有限公司,大专,经验不限,"平面设计,包装设计,排版设计,AI,PS",3000-5000元,岗位职责：1.根据公司项目要求负责有关图稿的设计与排版；2.产品平面设计，制作与其他图文处理；3.协助其他部门完成相关平面设计；4. 负责公司活动、品牌标志设计。任职资格：1.大学专科及以上学历，设计专业；2.熟练运用Illustrator，Photoshop和Acrobat等平面设计软件；3.具有较强的领悟力，能充分理解客人的意图；4.有责任心，工作认真仔细，肯吃苦耐劳，能严格按照设计要求制作稿...,印刷/包装/造纸,http://jobs.zhaopin.com/CC490884620J40865087304.htm,100-299人,2025-02-19 15:50:05
平面设计,重庆,重庆源点艺工贸有限公司,学历不限,经验不限,"广告设计,PS,AI,CAD",3000-4000元,岗位详情：1、负责公司对外日常工作宣传及广告、产品、活动的平面设计2、负责公司形象宣传设计3、负责公司宣传平台（小红书、抖音、视频号等）的创意设计、平面广告设计4、完成领导交办的其它工作岗位要求：1、有责任心，有良好的沟通、协调、执行能力2、CDR PS AI 等相关设计软件熟练运用3、有美术功底，广告学、美术设计或相关专业优先考虑 4、有做过小红书、网页详情设计的优先 薪酬福利： 早九晚六，月休...,家具/家居/家电,http://jobs.zhaopin.com/CC571773780J40543294213.htm,20-99人,2025-12-30 09:11:00
平面设计,重庆,重庆法吉玛机电设备有限公司,中专/中技,1-3年,"PS,3D MAX,AE,VI设计,方案设计,排版设计",3000-4000元,岗位内容：1. 根据公司品牌定位和市场需求，进行平面设计、VI设计、海报设计、产品包装设计等相关工作；2. 设计并制作企业形象宣传资料，包括公司画册、产品样本、宣传册、广告海报、DM单页、PPT、视频等；3. 参与网站界面设计、微信公众号运营和活动策划，提高公司品牌知名度。任职要求：1. 大专及以上学历，平面设计或相关专业毕业，有3年以上品牌设计经验；2. 熟练使用Ai、Ps、Id等设计软件，可以...,电气机械/电力设备,http://jobs.zhaopin.com/CC664246580J40521419206.htm,20-99人,2025-12-04 08:30:44
平面设计实习生,重庆,重庆三航新材料技术研究院有限公司,本科,无经验,"广告设计,排版设计",100-150元/天,【关于我们】品牌故事：我们是国内前沿的钛制品品牌-理态LETIOSA，以「小众科研国货 原创美学钛品」为核心理念，致力于将钛金属的自然质感与现代设计语言融合，打造兼具功能性、艺术性与可持续性的高端生活方式用品。团队氛围：年轻开放的创意社群，鼓励跨界思维与设计实验；定期产品共创工坊、行业大咖分享会，助你快速成长。实习优势：提供薪资+住宿（简装公寓），优秀实习生可转正留用。【我们需要这样的你】设计学科...,学术/科研,http://jobs.zhaopin.com/CCL1281494230J40674191706.htm,20-99人,2026-01-08 08:58:03
视觉平面设计实习生,重庆,重庆海汀顿教育科技有限公司,本科,经验不限,排版设计,2000-3000元,1、协助完成日常平面设计、公众号文案与视频内容的编辑等工作；2、领导安排的临时性工作；,培训/辅导服务,http://jobs.zhaopin.com/CC698278680J40714744806.htm,500-999人,2026-01-12 09:47:18
兼职平面设计,重庆,重庆晶凌艺数文化传媒有限公司,大专,3-5年,"方案设计,广告设计,包装设计,PS,AI,兼职",2000-3000元,岗位内容：1. 根据公司品牌定位和市场需求，进行平面设计、VI设计、海报设计、产品包装设计等相关工作；2. 设计并制作企业形象宣传资料，包括公司画册、产品样本、宣传册、广告海报、DM单页、PPT等；任职要求：1. 大专及以上学历，平面设计或相关专业毕业，有3年以上品牌设计经验；2. 熟练使用Ai、Ps、Id等设计软件，可以独立完成各类设计任务；3. 具备良好的审美能力和设计感，对颜色、构图、排版等...,文化艺术/娱乐,http://jobs.zhaopin.com/CCL1512110380J40828147614.htm,20-99人,2025-12-06 18:49:33
信息技术实习生（UI方向）J10394,重庆,中信建投期货有限公司,本科,经验不限,交互设计,50-60元/天,岗位职责:学习UI设计技巧。任职要求:1、数字媒体、视觉传达、工业设计等相关艺术类专业，具有较强的执行能力； 2、熟悉常用设计工具，具备一定图标、插画绘制能力，对交互设计、动效设计有一定了解；3、具备工作责任心以及较强的沟通和理解能力。,证券/期货,http://jobs.zhaopin.com/CC217016320J40568527608.htm,500-999人,2025-07-24 10:14:20
设计师线上兼职,重庆,郑州掌迈科技有限公司,学历不限,经验不限,"VI设计,广告设计,方案设计,PS,AI,CDR",100-120元,职位描述：1. 负责公司平面设计、海报、宣传物料等创意设计工作；2. 根据项目需求，完成UI设计、网页设计或品牌视觉设计；3. 配合团队完成其他设计相关任务，全程线上沟通协作。职位要求：1. 熟练使用Photoshop、Illustrator、Sketch、Figma等设计工具；2. 有设计经验，有成熟作品集优先；3. 具备良好的审美能力和创意能力，能够独立完成设计任务；4. 沟通能力强，能够按时...,互联网,http://jobs.zhaopin.com/CCL1503208480J40903045108.htm,20人以下,2025-11-27 15:32:20
