职位,城市,公司,学历,经验,技能,薪资,工作描述,行业,职位URL,公司规模,发布时间
产品经理（供应链方向）,重庆,平安银行股份有限公司,本科,3-5年,,面议,工作职责1、按照分行发展战略，推动供应链金融相关业务及指标；2、负责分行供应链金融业务营销与推动，包括客户需求挖掘及协同营销、授信方案沟通、项目跟踪、存续期管理等；3、围绕市场及客户内在需求，洞察商机，研究和推动供应链新场景、新模式和新产品；职位要求1、3年以上的银行供应链业务推动工作经验，熟悉票据、信用证、保函等基础供应链产品；2、具备较强的学习能力，逻辑思维清晰，具有较强的责任心和团队意识；3...,银行,http://jobs.zhaopin.com/CC196209320J40690151201.htm,10000人以上,2025-12-16 15:55:36
销售管理,重庆,平安融易(黑龙江)信息服务有限公司重庆第九分公司,大专,经验不限,"产品经理,KA大客户,企业客户,个人客户,渠道销售,门店销售,区域销售,大客户（KA）,销售经理",1-2万,、岗位职责1、根据公司整体战略，组织制定销售策略，做好目标分解，带领团队完成销售目标；2、负责面销团队组建和管理工作，对销售人员进行培训、指导，培养核心骨干，建设优秀的销售团队；3、负责相关行业广告客户的开拓与维护工作，建立与企业的深度合作关系；4、收集市场客户及竞争产品相关市场信息及动态，并提出合理化建议。二、岗位要求1、大专及以上学历，具有面销团队管理经验者优先；2、1年以上互联网行业销售经验...,互联网金融/小额贷款,http://jobs.zhaopin.com/CC846946760J40639070802.htm,10000人以上,2025-11-25 14:25:47
产品经理（大营销）,重庆,东方鑫源集团有限公司,本科,3-5年,SCRM、APP等,1-2万·13薪,职能职责1、负责公司116APP和小程序、后台管理系统、DMS系统等需求对接、产品设计、后期项目运维工作；2.统筹规划和安排内外部资源，整理业务提出的优化建议和问题，UI设计和产品原型设计，并给出相关解决方案给开发团队；3. 开发与测试协同：协调技术团队（前端、后端、测试）推进产品开发，跟进测试进度，解决开发中的需求理解偏差，确保产品符合预期；；任职要求：1、信息工程、计算机等相关专业，本科及以上...,汽车研发/制造,http://jobs.zhaopin.com/CC880859730J40807789411.htm,10000人以上,2025-12-11 18:04:01
产品经理（跨境方向）,重庆,平安银行股份有限公司,本科,3-5年,,面议,工作职责1、负责为分行公司跨境类产品提供营销支持，以及直接营销推动重点客户；2、研究分析市场、同业、客户以及产品动态，以市场为导向，策划、组织和推动分行跨境类产品（跨境结算、贸易融资、衍生品等）发展；3、负责分行跨境业务的培训宣导，研究跨境业务的新场景、新模式。职位要求1、3年以上的跨境业务营销推动工作经验，有分行工作经验者优先；2、具有较强的学习能力，逻辑思维清晰，具有较强的责任心和团队意识；3...,银行,http://jobs.zhaopin.com/CC196209320J40690151101.htm,10000人以上,2025-12-16 15:55:31
产品经理,重庆,重庆小侬侣科技有限公司,本科,5-10年,"软件产品,ERP系统,CRM系统,MES系统,商业化产品,智慧服务",1.2-2万,岗位职责1、业务场景与需求洞察：深度调研养殖场、金融机构等客户需求，结合畜牧业政策与行业痛点，挖掘产品创新机会，输出用户画像、需求清单及商业价值分析报告。2、产品规划与设计：主导智慧养殖系统（环境监测、健康诊断、饲喂决策）、养殖金融工具等产品的全生命周期管理，制定产品路线图（Roadmap），输出 PRD 文档、产品原型（Figma/Axure）及交互逻辑设计。3、跨部门协同落地：协调研发、算法、...,IT服务,http://jobs.zhaopin.com/CCL1488646190J40735297206.htm,20-99人,2025-11-21 18:21:16
产品经理（海外）,重庆,东方鑫源集团有限公司,本科,3-5年,"墨刀、AXURE（SKETCH）,PHOTOSHOP,C端产品",1-2万·13薪,职能职责：1、基于用户行为分析，带领产品团队完成海外产品区域策略制定、产品策划、原型设计、体验设计、发布、上线运营；2、协调产品相关部门，推动产品完成进度，把控产品质量，监控产品运行效果，收集用户反馈等；3、定期收集运营数据，根据数据提出有效的应对策略和产品需求分析，提出有效的运营策略，并对已有用户价值及数据结果为导向进行优化和创新，提升用户长期留存；4、深入研究公司海外产品的用户需求，挖掘用户需...,汽车研发/制造,http://jobs.zhaopin.com/CC880859730J40807789311.htm,10000人以上,2025-12-11 18:03:57
市场部经理RPM,重庆,新疆丝路瑞康医疗器械有限公司,本科,5-10年,西北大区,1.5-2万,"工作职责1、根据企业战略规划目标，制定并实施切实可行的区域市场推广计划。2、负责开拓医院客户渠道，销售区域内销售活动的策划、执行。3、完成本区域客户信息管理体系的建立并定期对重点客户进行评估，对销售形势、流程进行分析、评估。4、及时关注市场竞品信息动态，完成市场信息的收集与反馈。5、定期组织销售团队进行产品知识培训及产品应用学习。6、与区域内KOL,学科委员会建立良好的合作关系。 任职要求1、本科...",医药批发/零售,http://jobs.zhaopin.com/CCL1485886540J40817940814.htm,20人以下,2025-11-19 18:40:17
产品经理（公安业务）,重庆,熙菱信息技术(重庆)有限公司,本科,5-10年,"软件产品,硬件产品",1.3-2万,一、工作职责： 1.深耕公安行业业务场景（如治安防控体系、智慧安防、交通管理、社区防控等），主导公安领域相关产品的战略规划、路线图制定及落地执行。 2.联动公安干警、技术团队及合作伙伴，挖掘前端感知、数据研判、智能决策等全流程需求，输出高质量需求规格说明书、产品原型及文档。 3.牵头前端摄像机、物联网感知设备等硬件产品的功能定义，主导与研发团队的技术协同。 4.精准衔接GA/T1400协议及GB/...,计算机软件,http://jobs.zhaopin.com/CCL1460003600J40856902103.htm,20-99人,2025-11-19 15:02:05
用户体验产品经理,重庆,东方鑫源集团有限公司,本科,1-3年,,1.4-2万,一、智能驾驶：包括5G/V2X/自动驾驶等技术路线规划（3-5年发展蓝图）、车内外交互逻辑设计（V2X/远程控制）、远程诊断体系搭建（含流程、策略、质量标准）及OTA升级计划制定（基于行业对标与数据分析）；二、智能座舱：聚焦座舱系统协同（硬件/软件/供应链资源保障）、HMI全链路设计（UI组件库、交互原则、多端规范）及核心场景定义（如充电导航一体化）与量化指标（如响应速度<1s）；三、软件定义：涵...,汽车研发/制造,http://jobs.zhaopin.com/CC880859730J40806462111.htm,10000人以上,2025-11-18 11:46:50
ivd产品经理,重庆,重庆康巨全弘生物科技有限公司,硕士,3-5年,"西南大区,免疫、生化",1-2万,负责IVD产品线（如免疫/生化/发光/凝血等）的全生命周期管理，制定并执行产品策略，达成销售与市场份额目标。深入市场调研，分析行业趋势、竞争格局与客户需求，为产品规划与迭代提供决策依据。主导新产品上市全过程，包括定价策略、市场推广计划，并生成关键市场工具（如产品手册、学术资料）。对销售及技术支持团队进行产品知识、竞争策略培训与赋能，并提供专业的临床学术支持。建立并维护与关键意见领袖（KOL）及临床...,医疗设备/器械,http://jobs.zhaopin.com/CC526889630J40810070909.htm,100-299人,2025-11-14 17:09:01
b端产品经理,重庆,思特奇,本科,经验不限,软件产品,1.3-2万·13薪,【岗位职责】 1、负责产品的运营，响应客户问题，详细调研客户需求，并形成文档。2、结合客户诉求、协同产品、开发，落地并交付运营需求3、定期输出运营分析报告，反馈客户问题进展，系统运营情况等信息。4、推进系统、产品的推广、培训工作。【任职要求】1、国家正规院校本科及以上学历；2、两年及以上工作经验；3、熟悉Axure、visio 等软件；熟练使用office 工具，如excel、PPT等；4、具备独...,运营商/增值服务,http://jobs.zhaopin.com/CC120747250J40803139011.htm,1000-9999人,2025-11-07 13:44:15
主机厂充电产品经理,重庆,武汉搜马人力资源服务有限公司,本科,5-10年,"硬件产品,AI产品,数据产品",1.3-2万,工作职责1，协助高级产品经理拆解平台需求，开展需求调研、用户访谈，整理调研数据形成报告；2，对接 UI/UX 团队完成界面设计，跟进开发测试进度；3，收集用户及运营端反馈，提出功能优化建议并推动落地；4，领导安排的其他工作。任职资格1.本科及以上学历，计算机、设计、心理学、市场营销等相关专业背景；2.3年以上互联网产品工作经验，熟悉产品需求分析、用户调研、UI/UX协作和开发测试全流程；3.具备良...,汽车研发/制造,http://jobs.zhaopin.com/CC668399420J40896261415.htm,1000-9999人,2025-10-17 14:41:04
产品经理,重庆,北京融通智慧科技集团有限公司,大专,3-5年,"硬件产品,软件产品",1-2万,拥有至少三年以上电力行业从业经验，有较强文档编写能力、项目管理能力。一、岗位职责1、负责公司输变电工程智慧工地（变电、线路）Web、APP、小程序等产品相关规划与设计；2、负责编制与实施产品操作规程及流程，与开发团队紧密合作，确定产品功能模块、界面设计、交互方式等按计划和进度进行；3、负责生命周期，包括但不限于产品细化概念、设计到推动实施、整体应用策划过程；4、牵头项目管理产品的开发和实施工作，制...,互联网,http://jobs.zhaopin.com/CC437673980J40795694309.htm,100-299人,2025-10-10 15:56:01
产品部经理,重庆,重庆正辉基因科技有限责任公司,本科,3-5年,,1-2万,"职位描述 1.负责公司麻醉科、急诊科、重症医学科代理产品（麻醉机、监护仪、CRRT）推广；2.开拓新市场,发展新客户，增加产品销售范围；3.制定区域营销计划，完成销售指标；4.负责辖区市场信息的收集及竞争对手的分析；5.负责销售区域内销售活动的策划和统筹，完成部门销售任务；6.完成上级领导交办的工作。任职要求：1.大学本科及以上学历，医学、医学工程等相关专业；2.三年以上医疗行业销售管理经验；3....",医疗检测,http://jobs.zhaopin.com/CCL1495872570J40746395016.htm,20-99人,2025-09-29 00:17:04
产品经理,重庆,重庆软江图灵人工智能科技有限公司,本科,3-5年,"数据产品,数据治理产品,大数据产品",1.8-2万,岗位职责： 1、制定大数据和人工智能产品的战略规划和路线图，包括产品的功能、定价、定位和市场推广策略。 2、负责产品需求的定义和管理，与研发团队合作确保产品按时交付，并根据市场反馈进行迭代和改进。 3、分析市场竞争情况和客户需求，制定产品定位和差异化策略。 4、与设计团队合作，确保产品的用户体验和界面设计符合用户期望。 5、与市场营销团队合作，制定市场推广计划和营销策略，推动产品的市场份额和销售额...,人工智能,http://jobs.zhaopin.com/CCL1264708430J40478269204.htm,20-99人,2025-08-15 14:34:46
产品经理,重庆,中电智安科技有限公司,本科,3-5年,"智慧旅游,智慧文宣",1-2万,一、职位描述 1、负责行业动态、前沿技术信息收集整理和深度分析，分析行业痛点并结合具体场景针对性提出解决方案；2、负责需求分析、产品规划及原型设计，优化系统功能，提升用户体验（逻辑修改、用户体验改善、操作流程优化），持续性优化产品；3、负责项目各阶段文档编制，与项目经理、开发团队、测试团队密切配合，驱动项目开发进度，确保软件系统交付质量；4、负责与生态的沟通，形成自研+生态合作的产品画像，实现可短...,通信/网络设备,http://jobs.zhaopin.com/CC269568510J40648469416.htm,500-999人,2025-08-12 15:53:51
公司业务营销推动岗,重庆,厦门银行,本科,3-5年,"营销推动,产品经理",1.3-2万,岗位职责：(1)负责对公信贷业务的市场分析及同业调研，制定实体类客群建设的解决方案并组织实施；(2)负责推动并参与经营机构对政府机构、行业协会、产业链等渠道的开发与维护；(3)负责协助并参与经营机构重点客户的营销及维护。任职要求：(1)38周岁及以下，大学本科及以上学历；(2)具备3年及以上实体客群营销或相关岗位工作经验。有跨境融资或债券承销相关岗位经验优先；(3)具有较强的责任心，能熟练实用办公...,银行,http://jobs.zhaopin.com/CC138493580J40793117213.htm,1000-9999人,2025-07-30 00:20:02
mes业务顾问/产品经理,重庆,和利时集团,本科,3-5年,"MES,需求分析",1.5-2万·15薪,核心岗位职责：1、负责MES项目业务调研、流程梳理、需求分析、概要设计；2、负责需求说明书和蓝图设计的输出；3、负责现有MES项目的运维和技术支持；4、负责MES项目相关系统培训。核心任职要求：1、大学本科以上学历，计算机、自动化、工业工程等相关专业优先2、3年以上MES实施经验；3、熟悉MES系统，了解制造相关系统(WMS、APS、ERP等)；4、熟悉SQL语句；,仪器仪表制造,http://jobs.zhaopin.com/CC000145900J40155334101.htm,1000-9999人,2025-04-30 11:01:13
软件产品经理,重庆,中电智安科技有限公司,本科,3-5年,"Axure,Visio,MINDMAN,AGER",1-2万,一、职位描述： 1. 产品规划：针对行业特性以及需求，负责产品线的规划，制定实施方案； 2. 产品设计：针对项目或产品需求，具体设计软件实现方式.功能模块.流程.界面以及最终的实现效果； 3. 配合UI设计人员，编制产品设计思路，制定产品原型设计； 4. 流程建设：设计相关研发流程制定及优化，包括但不限于项目关键节点准入准出条件和交付物.项目关键节点制定，并对关键节点进行把控等。 二、职位要求： ...,通信/网络设备,http://jobs.zhaopin.com/CC269568510J40084532716.htm,500-999人,2025-08-12 15:53:34
绿色金融营销推动岗,重庆,厦门银行,本科,3-5年,"绿色金融,营销推动,产品经理",1.3-2万,岗位职责：(1)负责进行市场分析及同业调研，根据年度绿色金融任务制定营销推动方案，推动完成分支行与政府机构、绿色相关商协会等渠道的建设工作；(2)负责梳理分行绿色金融重点客户名单，会同经营机构拜访重点客户，挖掘客户需求，指导经营机构设计综合服务方案；(3)负责开展跨条线业务联动营销，推动绿色银团贷款、绿色零售类贷款、绿色债券承销、绿色供应链等业务落地。(4)负责绿色金融相关培训及宣传组织工作。任职...,银行,http://jobs.zhaopin.com/CC138493580J40767600913.htm,1000-9999人,2025-07-30 00:11:01
产品市场经理（医检）,重庆,浦洛通,本科,3-5年,"国内市场,西南大区,重庆市场,医疗检测行业经验,基因检测行业经验",1.5-2万,岗位职责：（1）负责公司的品牌体系建立、建立及优化相关制度，公司宣传模式、维护与宣传渠道、媒体、互联网平台的良好合作关系；（2）完善产品开发工作流程，制定产品开发申请表，梳理产品开发工作中各关联部门的工作职责，并督导开发相关部门严格执行；（3）负责制定产品开发项目计划书、负责公司产品包装，提高产品竞争优势；（4）制定年度营销目标及营销计划、建立和完善营销数据收集、分析、研讨及应对策略的制定；（5）...,医药制造,http://jobs.zhaopin.com/CC348394180J40668675010.htm,100-299人,2025-04-08 11:28:29
产品经理,重庆,重庆辰荣科技有限公司,本科,3-5年,"软件产品,AI产品,硬件产品,大模型产品",1-2万·13薪,1.负责协同技术编制产品解决方案，与客户交流并推进项目落地。2.负责与客户沟通获取需求，独立完成产品设计、原型图及及需求文档；3.管理产品研发进度，确保产品按时高质量交付；4.跟进产品售后问题，及时与客户沟通并协调研发提供解决方案；5.产品培训，协同技术编制产品使用说明，对客户培训。任职要求：1.统招本科及以上学历，计算机、软件工程、物联网等相关专业优先；2.可熟练绘制原型图，熟练使用Axure、...,计算机软件,http://jobs.zhaopin.com/CC497866320J40654500810.htm,20-99人,2025-04-01 20:18:44
高级产品经理（汽车金融事业部）,重庆,华科金融,本科,3-5年,金融投资组合,1-2万,岗位职责：1、产品规划：负责懂车商平台的产品整体规划，根据市场调研、用户需求分析及公司战略目标，制定长期和短期的产品路线图。分析市场趋势、竞争对手动态及政策变化，调整产品策略以保持市场竞争力。2、产品设计：深入理解目标用户群体的需求，准确分析三方合作关系、法律关系、业务关联方利益关系等，转化为具体的标准产品功能需求文档，设计产品的核心功能、用户界面及交互流程。3、产品开发：与系统开发、业务、风险的...,证券/期货,http://jobs.zhaopin.com/CC552969720J40677354409.htm,300-499人,2025-02-25 18:31:07
高级ai产品经理,重庆,重庆环宇星科信息技术有限公司,本科,5-10年,大模型,1.2-1.8万·13薪,我们正在寻找一位经验丰富、对AI技术充满热情的AI产品经理。您将负责AI产品的规划、设计、落地及项目管理，驱动产品创新和业务增长。岗位职责：1.负责AI产品的战略规划、需求分析、产品设计和功能迭代。2.深入理解AI技术（特别是生成式AI、NLP等）的现状与发展趋势，能够将其转化为可行的产品方案。3.主导或参与项目的全流程管理，包括需求沟通、资源协调、进度跟踪及风险控制。4.与售前团队紧密协作，提供...,人工智能,http://jobs.zhaopin.com/CCL1282297050J40825471109.htm,20-99人,2026-01-10 01:27:39
座椅产品经理,重庆,恩永(北京)科技股份有限公司,大专,经验不限,"汽车座椅,内饰设计,CATIA",1-1.8万,负责座椅骨架产品定位、开发策略制定、竞品分析、成本分析，撰写并发布SOR;寻找潜在供应商，评估技术能力，进行技术方案评审和定点;设计并布置零件，发布3D数模和图纸;进行DFMEA、专利申请、供应商交样支持等工作;解决零件和造车问题，反馈相关情况，输出并维护设计变更进度等。,汽车研发/制造,http://jobs.zhaopin.com/CC362753420J40818665301.htm,300-499人,2026-01-10 01:02:22
人工智能产品经理,重庆,中电智安科技有限公司,本科,3-5年,,1-1.8万,一、职位描述1.负责智能外呼、智能客服、智能IVR导航、智能知识库、智能质检、智能工单、数字人等相关AI应用场景的打造；2.跟踪自然语言处理（NLP）、智能体（AI Agent）、大模型（LLM）的前沿技术，主导将大模型能力（如对话生成、语义理解、知识问答、内容摘要等）与现有智能云呼叫类产品深度融合，设计创新性的应用场景；3.完成产品全生命周期管理工作，协调研发、算法、测试、运营等跨部门团队，确保...,通信/网络设备,http://jobs.zhaopin.com/CC269568510J40760802816.htm,500-999人,2026-01-08 01:43:33
汽车APP产品经理,重庆,软通动力信息技术(集团)股份有限公司,本科,3-5年,"社区产品,产品价格管理,客户端产品,TO C,汽车",1.4-1.8万,职位描述：1.本科及以上学历，5年以上互联网产品设计及相关经验，有成功互联网产品经验优先；2.参与过产品立项、设计、研发、推广应用及维护改进的整个过程；3.具备独立撰写产品规划方案、产品可行性分析、需求分析说明、系统设计以及运营方案等产品文档的能力；3.具有敏锐的市场触觉，良好的行业洞察能力，能准确把握行业需求，对互联网主流产品模式有深入了解；关注行业趋势、用户体验和产品细节；4.具备整合不同组织...,互联网,http://jobs.zhaopin.com/CC000544460J40785454216.htm,10000人以上,2026-01-07 01:46:10
厨卫电器产品经理,重庆,良彬家居(重庆)有限公司,学历不限,5-10年,"厨卫电器,开关吊顶",1.2-1.8万,岗位职责：1. 进行市场调研和竞品分析， 负责供应商开发及管理，定期进行评估及优化，降低成本、提升产品线及服务质量；2. 负责对厨卫电器（含开关、吊顶）产品上市后的生命周期管理及反馈追踪，包括产品改进、产品线延伸、淘汰等工作；3. 协助制定产品价格策略、产品陈列、导购培训、新品推广等销售管理工作的实施；任职要求：1. 28-45岁，学历不限，优秀者可适当放宽标准；2. 3年以上厨卫电器（含开关、吊...,零售/批发,http://jobs.zhaopin.com/CCL1407178260J40831836710.htm,1000-9999人,2026-01-06 10:50:58
产品开发经理,重庆,重庆英泰帝克科技有限公司,本科,3-5年,"项目开发管理,团队管理",1-1.8万,一、岗位职责1.产品开发全过程管理：主导需求分析、产品设计、原型开发、测试及发布等环节。确保产品开发流程的高效性和规范性。2.项目管理：监督项目进度、质量和预算，识别并解决项目中的问题。善于使用各种项目管理方法确保项目按时交付。3.团队管理：制定团队目标，明确分工，评估团队成员的工作绩效。提供技术指导和职业发展建议，组织培训以提升团队能力。4.跨部门协作：与市场、销售、设计等部门紧密合作，确保产品...,医疗设备/器械,http://jobs.zhaopin.com/CC818552370J40793424508.htm,20-99人,2026-01-05 14:38:03
产品经理-C端汽车app经验,重庆,软通动力信息技术(集团)股份有限公司,大专,5-10年,"TO C,汽车APP",1.4-1.8万,职位描述：1.本科及以上学历，5年以上互联网产品设计及相关经验，有成功互联网产品经验优先；2.参与过产品立项、设计、研发、推广应用及维护改进的整个过程；3.具备独立撰写产品规划方案、产品可行性分析、需求分析说明、系统设计以及运营方案等产品文档的能力；3.具有敏锐的市场触觉，良好的行业洞察能力，能准确把握行业需求，对互联网主流产品模式有深入了解；关注行业趋势、用户体验和产品细节；4.具备整合不同组织...,互联网,http://jobs.zhaopin.com/CC000544460J40785455216.htm,10000人以上,2026-01-07 01:46:10
品质经理,重庆,重庆两江联创电子有限公司,大专,5-10年,"硬件产品,人工智能,C端产品",1.4-1.8万,职位描述：1.统筹管理研发品质、生产品质、物料质量、体系、客户服务几大板块；2.部内KPI制定及考核 ；3.人力规划及培训； 4.制程品质管控，出货品质目标达成 ；5.现场改善策划及推动； 任职要求： 1、有显示模组关联行业经验最佳，或有触摸屏厂、背光厂、玻璃盖板厂、汽车电子产品行业从业经验。 2、年龄33周岁以上.。 3、大专以上。 职位福利：五险一金、包吃、包住、全勤奖、双休、带薪年假等,电子/半导体/集成电路,http://jobs.zhaopin.com/CC450963730J40072013703.htm,1000-9999人,2025-12-22 00:15:40
低空吊装产品经理,重庆,华夏云翼国际教育科技有限公司,本科,5-10年,"硬件产品,软件产品",1-1.8万,岗位职责1、负责低空吊装产品的整体规划、功能设计及技术路线制定；2、结合建筑、工程类吊装场景，设计适用于低空载具的吊装方案，提升作业效率与安全性。3、编制低空吊装作业流程、安全规范与技术标准；4、针对不同场景定制化开发吊装工艺与提效方案。5、指导并监督低空吊装现场作业，确保吊装任务安全、高效完成；6、处理吊装过程中的技术问题，提供实时解决方案与工艺支持。7、建立并完善低空吊装安全管理体系，编制安全...,培训/辅导服务,http://jobs.zhaopin.com/CCL1305228260J40861633812.htm,100-299人,2025-12-20 12:09:10
