职位,城市,公司,学历,经验,技能,薪资,工作描述,行业,职位URL,公司规模,发布时间
零售运营总监,深圳,深圳市铁马体育文化发展有限公司,大专,5-10年,"门店运营,社群运营,toB,toC,鞋服配饰,连锁门店,男女服饰,电商运营",20-25万·13薪,连锁零售门店/电商运营总监（运动品牌）工作职责1、统筹公司品牌全国线下门店与线上商城的整体运营工作2、根据公司的发展战略和规划，制定线下门店、线上商城的年度经营计划并组织落实执行3、定期对线上线下营运数据进行统计分析，并输出分析报告，提出优化建议并为选品团队提供数据支撑4、制定直营新开店与阶段性运营方案，评估渠道及店铺拓展、推动新店落地，同时优化现有门店效率、提升盈利5、分析运动品牌行业市场状况，...,体育,http://jobs.zhaopin.com/CCL1463304600J40909266308.htm,500-999人,2025-12-30 17:20:59
薪酬绩效高级专员,深圳,顺丰速运,本科,5-10年,,15-25万,岗位职责：1、经营人工成本管控体系搭建，制定经营人工成本预算、分析、管控，保障经营人工成本投产管控在预算目标内；2、岗位薪酬绩效标准体系及相关机制流程的建立，对推动及实施效果进行管理与评估；3、岗位薪酬绩效实施管理与分析，推动员工薪酬健康度提升；4、根据对应岗位薪酬绩效类需求，制定解决方案。任职要求：1、本科以上学历，5年以上薪酬福利经验，具有物流行业HRBP工作经验优先；2、熟练掌握现代人力资源...,货运/物流/仓储,http://jobs.zhaopin.com/CC131486150J40803745614.htm,10000人以上,2025-09-16 17:41:16
销售专员,深圳,深圳市广聚能源股份有限公司,本科,经验不限,"销售专员,企业客户,政府客户,渠道销售,代理商销售",12-20万,岗位职责:1、积极拓展新的业务项目；2、协同完成公司年度目标；3、拓展新业务板块，发掘商机并积极落地；4、能够胜任长期驻外出差工作；5、完成领导安排的其他工作事项。任职要求:1、学历：本科2、工作年限：不限3、有进取心，能承受一定的销售工作压力4、具备良好的沟通能力5、适应能力强，能适应出差,石油/石化,http://jobs.zhaopin.com/CC146991600J40881382715.htm,20-99人,2025-11-14 14:55:08
中控直播运营,深圳,深圳市南山区浩浩天空服饰工作室(个体工商户),高中,3-5年,"抖音,快手",10-12万,招聘直播中控运营 岗位职责1. 负责直播全程操作，精准控制推流、上下架商品链接、发放优惠券及互动道具，确保直播流程顺畅。 2. 实时监控直播数据（观看人数、转化率、销售额等），快速响应主播需求，配合调整直播节奏。 3. 协助筹备直播前的物料核对、设备调试（灯光、声音、网络），以及直播后的数据分析与复盘总结.,电子商务,http://jobs.zhaopin.com/CCL1513386800J40818010710.htm,20人以下,2025-11-06 11:13:06
亚马逊运营（美国站精品）,深圳,深圳卓熠科电子有限公司,大专,1-3年,"亚马逊,精品运营,数据运营,英语,3c电子,跨境电商运营,AMAZON",7-12万,"职位描述1、负责Amazon站点帐号管理，产品上架，维护和优化listing页面，确保帐号安全；2、按产品品类划分，负责Amazon市场调查分析，寻找热销产品；3、售前、售中、售后的客户服务，提高Review的质量和数量；4、完成公司规定的销售目标.任职要求:1、2年以上Amazon亚马逊平台操作经验,可独立操作一个或多个站点；2、国际贸易，电子商务，外贸，翻译，市场营销，外语专业优先；3、英语C...",贸易/进出口,http://jobs.zhaopin.com/CC497939820J40775988403.htm,20-99人,2025-10-10 15:52:50
Keeta-效果广告渠道经理（Performance Marketing Manager）,深圳,北京三快在线科技有限公司,本科,1-3年,,面议,Keeta是全球领先的外卖平台美团旗下独立品牌，专注于国际市场的餐饮与商品即时配送服务，致力推进全球市场的创新发展，实践“帮大家吃得更好，生活更好”的公司使命。我们于2023年从中国香港起步，不到一年便成为当地行业的领跑者。紧接着，我们在2024年快速进入沙特阿拉伯，现已覆盖20余城。2025年我们继续提速，在短短40天内接连开拓卡塔尔、科威特和阿联酋。随后我们登陆巴西，以桑托斯和圣维森特为试点，...,互联网,http://jobs.zhaopin.com/CC383625320J40746346909.htm,10000人以上,2026-01-11 08:47:26
仓储物流专员电子仓储6500-8500元 深圳 福永 大专,深圳,深圳市新瑞科技有限公司,大专,1-3年,"ERP,制造业,仓库管理,电商仓",6.5-8.5万,仓储物流专员电子仓储6500-8000元深圳 福永 大专 1-3年 职位详情：.物流承运商管理 物流异常处理 安全管理 熟练使用ERP系统 库存控制/盘点 高位货架仓库工作经验 工厂连接器线束岗位职责：物料管理:负责电子物料(如电阻、电容、二极管等)的验收、入库、出库及库存管理，确保账、物、卡一致;系统操作:熟练使用ERP系统进行数据录入、库存查询及日常报表整理;仓储规范:执行5S管理，优化物料摆...,电子设备制造,http://jobs.zhaopin.com/CC239899110J40816553511.htm,100-299人,2026-01-11 00:04:41
物流消费者体验运营-TikTok Shop,深圳,字节跳动,本科,5-10年,,4-8万,岗位职责：1、对接美国区域国际电商物流业务，深入了解消费者的物流体验痛点，建立以优化物流体验为核心的解决方案，协同运营、产品和相关治理团队，推动方案的落地，并持续推动相关业务目标的达成；2、深入了解海外市场和业务阶段，协同业务和合作伙伴，不断创新业务模式和产品方案，通过提升物流能力，提升用户转化、以及提升消费者的物流体验；3、深入分析相关数据，持续挖掘消费者体验痛点和机会，通过数据拆解、指标提升，...,互联网,http://jobs.zhaopin.com/CC469217510J40785857501.htm,10000人以上,2025-12-29 14:45:48
运营副总,深圳,深圳君佩珠宝集团有限公司,大专,5-10年,"电商运营,新媒体运营,销售运营,toC",6-8万,岗位职责：1、协助总经理统筹公司整体运营管理工作；2、协助制定公司的战略规划及年度经营计划，组织落实相关工作，确保年度经营目标的达成；3、健全公司内部运营管理体系，完善管理制度、管理流程、考核标准等，推动公司经营管理的规范化和科学化；4、根据销售指标计划，参与制定和调整销售方案、活动策划方案、异业合作方案、商城运营方案、私域承接方案等；5、根据公司战略，进行公司品牌战略规划，制定年度市场工作目标和...,珠宝/首饰,http://jobs.zhaopin.com/CCL1459983570J40908013915.htm,300-499人,2025-12-04 13:51:26
销售运营总监,深圳,长治市世纪景源房地产开发有限公司,本科,5-10年,"toB,总监",5-8万,1、制定可落地的销售目标与策略：基于公司战略拆解销量、回款指标，结合大宗商品“大额长单、周期长”特性，设计适配的渠道与客户覆盖方案并跟踪达成结果；2、搭建销售流程、考核机制、培训体系等标准化运营体系（梳理询价-报价-合同-物流-结算全流程 SOP），建立合规风控（如价格波动应对、履约担保）和 CRM 管理机制，优化人效；3、统筹销售数据复盘，搭建销售数据体系（客单价、回款周期、转化率等），通过数据...,贸易/进出口,http://jobs.zhaopin.com/CC464951110J40807563407.htm,1000-9999人,2025-11-08 09:59:11
COO首席运营官（深圳）,深圳,广西易伙人科技有限责任公司,本科,10年以上,,4-8万,【岗位职责】 1、协助董事长制定集团战略发展规划，不断完善集团化的经营管理体系，组织开展全面管理工作，督导集团管理平台与事业部落实各项工作，让战略有效落地； 2、全面主持集团的业务运营管理，推进集团下属各事业部的经营管理工作，完成集团既定运营指标； 3、在集团经营战略指导下，围绕集团企业服务产品主线及发展趋势，进行市场调查和反馈，进行业务的综合策划与布局，促进企业服务业务的健康发展； 4、集团核心...,互联网,http://jobs.zhaopin.com/CCL1234349120J40757104413.htm,500-999人,2025-03-25 10:15:14
电商总监,深圳,泉州市嘉信才略投资有限公司,大专,3-5年,"3C智能硬件,电商全渠道运营,组建新品牌",5-7万,岗位职责1、 根据公司战略目标，制定电商全平台(天猫、京东、拼多多、抖音等)战略布局及整体运营方案；2、 完成电商全渠道运营布局，分解销售目标，制定部门年、季、月等各周期运营方案，并负责监督实施，完成销售目标；3、 负责组织策划并审定产品、市场推广、运营、市场研究等活动策略、推广方案，相关预算、组织整合资源并实施监督，提高品牌知名度和美誉度；4、 保证线上电商平台产品价格定位、供应链管控，有效降低...,人力资源服务,http://jobs.zhaopin.com/CC700772380J40978468604.htm,20-99人,2026-01-06 16:40:30
跨境物流B段采购Leader-TikTok Shop,深圳,字节跳动,本科,10年以上,,4-7万,岗位职责：1、在指定范围内执行日常采购活动，推动沟通计划的制定并监督其实施，制定实施策略、职责分配和时间安排；2、能够向关键领导层和管理层有效展示并传达有说服力的商业案例和商品策略；具备数字化招标（RFP）、报价（RFQ）、信息征集（RFI）标准和流程的专业知识；3、能够深入分析市场，确保价格低于或符合市场水平，并识别供应商能力差异与企业发展愿景的匹配程度；能够根据成本、质量标准和交付目标管理多家...,互联网,http://jobs.zhaopin.com/CC469217510J40782652301.htm,10000人以上,2025-11-21 11:58:32
独立站运营经理,深圳,宁波渠成集团有限公司,本科,3-5年,"独立站运营,跨境运营",4-7万,岗位职责：1、0-1搭建运营跨境独立站，统筹负责独立站的整体运营；2、负责独立站站点架构、广告投放、网站活动与产品精细化运营等工作；3、负责品牌广告投放，擅长营销推广，利用facebook、Instagram、Twitter、LinkedIn、Tiktok等社交媒体渠道进行推广，组建公司自己的站外渠道； 4、掌握SEO优化知识，熟悉搜索引擎排名技术、能通过优化网站程序，提高网站搜索引擎友好度；5、...,贸易/进出口,http://jobs.zhaopin.com/CC388690030J40759002102.htm,500-999人,2025-06-24 18:13:52
海外销售运营总监,深圳,深圳欧瑞特供应链管理有限公司,本科,5-10年,"团队管理经验,英语,渠道资源",3-6万,一、岗位职责1、 负责制定海外市场销售战略与运营规划，明确市场定位、目标客户群体及核心业务方向，带领团队完成海外销售业绩指标，推动公司海外业务的持续增长。2、统筹海外销售团队的搭建、管理与培养，优化团队架构，制定合理的绩效考核与激励机制，提升团队整体销售能力与运营效率。3、 深入调研海外仓储物流市场动态，包括行业趋势、竞争对手情况、政策法规变化等，挖掘市场需求，拓展海外客户资源（如跨境电商企业、贸...,货运/物流/仓储,http://jobs.zhaopin.com/CC241164310J40868054712.htm,1000-9999人,2026-01-09 11:18:08
FBT行业运营专家-TikTok Shop,深圳,字节跳动,本科,5-10年,,4-7万,岗位职责：1、精准筛选并与目标商家建联，清晰阐述FBT的优势与价值、解决潜在障碍、打消顾虑，成功说服商家加入FBT；2、深度参与商家日常运营，包括但不限于日常问询、月度总结、库存规划、协助入仓、解决账单问题等，有效指导商家解决问题；3、持续总结商家反馈、输出商家洞察，做好根因分析，从而找出商家需求与当前业务/产品能力的差距，提出高质量的产品/业务解决方案需求、推动实现；4、通过与商家建立、维系互信...,互联网,http://jobs.zhaopin.com/CC469217510J40756690601.htm,10000人以上,2025-10-23 18:11:00
招商运营总(J19412),深圳,路劲地产集团,本科,经验不限,KA大客户,4-6万,岗位职责: 1、主导制定项目的整体招商规划、合作方案，推动项目招商落地及后期运营； 2、全面负责与国际、国内一线品牌、顶级网红IP、非物质文化遗产传承人、高端零售及奢华酒店等潜在合伙人的接洽、谈判与关系维护； 3、系统性地开拓、积累并管理高端商业品牌与文旅IP资源库，构建完整的文旅消费生态； 4、深度参与项目前期定位、业态规划与动线设计，确保引入的合伙品牌与项目“自然、文化、高端体验”的定位高度契...,房地产开发,http://jobs.zhaopin.com/CC163874610J40896108902.htm,1000-9999人,2026-01-06 15:32:50
亚马逊运营总监,深圳,深圳宥成供应链科技有限公司,大专,1-3年,"精品运营,跨境店铺运营,管理经验,Amazon,小语种",3-6万,"1、（需要具备亚马逊管理20人以上团队的相关经验，）培养过三个销售冠军，根据公司年度发展规划，制定团队年度，季度,月度销售目标和运营计划，并带领团队实施与达成，对运营风险，销量和毛利目标负责。2、负责品牌、品类线、产品划分、店铺划分及团队人员配置给与全面规划布局。3、负责运营方向的把控和实施路径的落实。制定及优化产品运营方案，运营情况的跟踪及复盘，数据分析及数据化决策。4、定期调查分析市场以及持续...",电子商务,http://jobs.zhaopin.com/CCL1282468830J40386614804.htm,20-99人,2025-12-24 16:49:12
印尼物流运营专家-TikTok Shop,深圳,字节跳动,本科,5-10年,,4.5-6.5万,岗位职责：1、推动在印度尼西亚的物流业务部署，与当地物流行业主要参与者建立合作关系；2、开展市场和行业研究，制定运营计划以解决问题，并在必要时规避市场或政策变化带来的风险；3、管理日常运营，跟踪绩效指标和团队改进情况；4、确保程序和规定得到执行，不断提高运营效率、服务质量和消费者满意度等关键指标；5、与相关合作方（当地和区域团队）合作，推出新服务并实施相关物流解决方案。任职要求：1、本科或以上学历...,互联网,http://jobs.zhaopin.com/CC469217510J40757783601.htm,10000人以上,2025-11-24 12:29:02
合伙人/月入3W起/稳定运营,深圳,深圳市嘉荣网络科技有限公司,学历不限,经验不限,创业型,3-6万,1、年龄25岁—45岁之间；2、有格局，有创业思维和创业认知；3、人品好，诚实可靠，有团队协作精神；4、服从公司管理安排，执行力强。,电子商务,http://jobs.zhaopin.com/CCL1501830130J40735229306.htm,100-299人,2025-12-16 10:39:13
跨境亚马逊运营总监（精品，垂直）,深圳,广州屹谨信息科技有限公司,大专,5-10年,"电商运营,toB,toC,toG",3-6万,精品运营 (偏品牌) 1、品类不限，做过纺织类/家具/快消品)的产品更佳，其他品也可以。2、规模:该企业深圳 中心 杭州多家公司(深圳独立站5亿体量，亚马逊刚开始不久，新财年大力发展，需要操盘手0-1开始，工作地点:深圳南山大学城)3、男女不限、专业不限、学历大专以上、年龄38岁以内4、底薪4万以下，优秀可放宽至5万，股权可谈(试用期可签)，综合年包第一年70万以下，第二年百万的候选人可谈。5、双...,咨询服务,http://jobs.zhaopin.com/CCL1294351570J40910375215.htm,20人以下,2025-12-16 00:00:02
平台物流商家解决方案经理-TikTok Shop,深圳,字节跳动,本科,5-10年,,3-6万,岗位职责：1、制定并实施物流策略，以提高服务效率、提升美区TikTok Shop店铺卖家的物流体验；2、与跨职能团队协作，包括产品和开发团队，以改善系统能力，并确保物流线上产品流程和客户需求的对齐；3、监控和分析物流操作的关键绩效指标（KPI），识别改进领域，提出完整的解决方案，并执行落地；4、关注行业趋势、法规及最佳实践，推动现有业务模式的持续升级。任职要求：1、5年以上跨境电商及海外本地电商物...,互联网,http://jobs.zhaopin.com/CC469217510J40818819001.htm,10000人以上,2026-01-06 14:29:03
电商运营总监,深圳,深圳数言互联网科技有限公司,大专,5-10年,"电商运营,产品运营,数据运营,消费品",3.5-6万,1.负责过线上电商类平台等渠道的整体规划、营销、推广、客户关系管理等经营性工作；2.能根据公司战略，历史数据情况、平台的特性、洞察规划制定品类，为品类和单品的收入和净利率负责；3.通过本品牌和行业竞品数据分析，深度洞察品类发展机会点和问题点，输出品类发展建议和可落地策略，沉淀可复用的销售方法；4.根据历史销售情况和未来计划，进行周期性单品销售预估调整和下单把控；5.相关平台营销工具研究，优化店铺及...,互联网,http://jobs.zhaopin.com/CC887333250J40821259605.htm,20-99人,2025-12-10 15:36:46
运营副总裁,深圳,中财信忠(临沂)人力资源服务有限责任公司,本科,经验不限,运营管理,3-6万,岗位职责：1、协助总经理统筹公司整体运营管理工作；2、协助制定公司的战略规划及年度经营计划，组织落实相关工作，确保年度经营目标的达成；3、健全公司内部运营管理体系，完善管理制度、管理流程、考核标准等，推动公司经营管理的规范化和科学化；4、根据销售指标计划，参与制定和调整销售方案、活动策划方案、异业合作方案、商城运营方案、私域承接方案等；5、根据公司战略，进行公司品牌战略规划，制定年度市场工作目标和...,人力资源服务,http://jobs.zhaopin.com/CCL1500801770J40811919501.htm,20-99人,2025-12-04 13:54:17
东南亚快递网络规划专家-TikTok Shop,深圳,字节跳动,本科,5-10年,,4-6万,岗位职责：1、快递产能分析评估1）推动服务商在快递核心节点（区域分拣中心、中转场、末端网点/驿站/自提柜）的选址、投建、产能等做科学布局规划，输出“分拣中心+中转场+末端网点”快递网络架构方案，保障运力及产能；2）结合快递业务特性，联合服务商设计干线运输路由与末端配送路径，明确运力模式，及日常及大促的运力需求；3）与服务商联合制定快递网络资源配置标准（如分拣中心自动化设备容量、中转场装卸货位数量、...,互联网,http://jobs.zhaopin.com/CC469217510J40804505401.htm,10000人以上,2025-12-31 15:54:29
大区运营总监（区域总监）,深圳,深圳君佩珠宝集团有限公司,大专,5-10年,"华南大区,华东大区,华中大区",4-6万,职位描述：1、根据公司年度规划制定公司年度工作计划，组织分解实施，确保年度目标的达成；2、制定相关制度、流程、方案，并组织实施，并在实施中提出优化建议；3、根据工作需要，调整、优化各店铺岗位、人员结构，合理定岗定编，使岗位结构合理、人员高效；4、负责公司活动策划方向的制定，品牌宣传跟进；5、负责公司制度落地执行情况的监督跟进工作，并实时给出指导意见；6、执行年度促销活动方案，监督，指导各店铺促销方...,珠宝/首饰,http://jobs.zhaopin.com/CCL1459983570J40880802715.htm,300-499人,2025-12-04 11:56:33
新媒体运营总监（疗愈赛道头部）,深圳,深圳华章智慧文化传播有限公司,大专,10年以上,"疗愈赛道头部,全域矩阵获客,纯自然流",4-6万,一、薪酬与福利1、薪资open无责底薪20k-40k（特别优秀者另议）+绩效+提成，综合薪资40-60k+2、入职缴纳五险一金3、法定节假日正常休息4、带薪年假5、旅游/团建二、作息时间1、上班时间9:00-18:00，中午休息1.5小时2、法定节假日正常休息3、单休三、公司氛围90后——年轻化团队扁平化管理——公司氛围宽松、开放、有爱、互助四、企业文化1、使命助力中国3亿家庭生命蜕变、幸福重生。...,文化艺术/娱乐,http://jobs.zhaopin.com/CCL1486652000J40836196312.htm,20-99人,2025-11-12 15:07:38
电商运营总监,深圳,深圳市紫米迅驰网络科技有限公司,本科,10年以上,3C产品,3-6万,岗位要求：1.本科及以上学历，市场营销、电子商务、工商管理等相关专业优先。2.至少10年以上电商运营经验，其中5年以上团队管理经验，有知名电商平台（淘宝、京东、拼多多、天猫、亚马逊、速卖通、阿里、抖音等）或品牌自营电商操盘经验者优先。3.基于市场趋势、竞品分析和公司目标，制定清晰的电商年度 / 季度运营战略及业绩目标（如 GMV、利润、用户增长等）。4.精通电商各模块运营逻辑，包括产品选品、流量获...,电子商务,http://jobs.zhaopin.com/CC535442620J40849108602.htm,20-99人,2025-10-30 17:24:35
运营总监,深圳,珍爱网,本科,3-5年,"新媒体运营,用户运营,产品运营",4-6万,一、核心岗位职责 1. 战略规划与落地：结合市场趋势与公司战略，制定婚恋业务年度运营规划、盈利模式及增长目标，推动战略从规划到执行的闭环落地。2. 全渠道运营管理：统筹线上线下运营体系，线上负责新媒体矩阵（抖音、小红书等）内容策划、用户拉新与留存优化；线下主导门店体验升级、主题相亲活动（潮玩、高端圈层等）策划执行，实现双线协同引流 。3. 服务体系搭建：设计并优化会员服务流程，制定高端会员匹配策略...,互联网,http://jobs.zhaopin.com/CC158632610J40895280308.htm,1000-9999人,2025-10-23 17:36:29
高级外贸销售专员,深圳,新思想(深圳)实业有限公司,大专,3-5年,"英语,集成电路/IC芯片/半导体,电子元器件",3-6万,众所周知，过去2023年芯片行业呈现弱势，公司优秀的销售和采购依然收入超百万，公司欢迎有资源，有能力，有意愿的人才加入，共同创收！ 职位描述： 本岗位为高级外贸销售岗位，产品为IC芯片/半导体/电子元器件，客户对象为海外终端、大贸、或其他同行业贸易商。具体待遇、要求、职责如下。 薪酬福利： 1. 底薪：真实无责任底薪11k - 20k，如果特别优异，欢迎当面提要求 2. 提成：最低按毛利润的8个点...,电子/半导体/集成电路,http://jobs.zhaopin.com/CCL1369663480J40516545615.htm,20-99人,2025-07-18 00:29:23
亚马逊运营总监,深圳,河南江舸云科技有限公司,本科,5-10年,"亚马逊,精品运营,选品开发,跨境电商,团队管理,GMV1亿",3-6万,"至少要做过1亿以上规模!!!目前深圳团队60多人【岗位职责】1、负责亚马逊团队建设和销售管理；2、负责亚马逊团队的日常管理工作包括业务规范流程建设、分工协调等等；3、精通亚马逊上架规则，精通亚马逊 listing规则，制定产品营销计划;4、熟识站内广告投放及各种营销工具的使用及优化;5、收集并分析竟争对手信息,把握市场动向,分析产品关键词;6、定期制定销售目标制定相应销售策略,7、定期跟踪标杆企业...",电子商务,http://jobs.zhaopin.com/CCL1495979550J40759167511.htm,500-999人,2025-07-17 18:18:52
综合金融业务专员,深圳,中国人寿保险股份有限公司深圳市分公司,本科,经验不限,,3-6万·13薪,岗位职责：1、参会每天参加早上8：30——10：00的早会学习和培训。2、拜访服务客户公司会下发已购买过产品的老客户名单，根据要求拜访名单内的客户，并提供相应专业的基础和增值服务。3、达标参会达标、考核达标、拜访客户达标4、领钱金融行业的收入排市面第一，超过程序员【岗位要求】最好是乡镇出身的大学生！！不是歧视乡镇出身，也不是看不起非大学生，而是乡镇出身的宝子们，具有很多我们这个行业所需的优良特质，...,保险,http://jobs.zhaopin.com/CC135627160J40497143711.htm,10000人以上,2025-06-30 10:25:29
总经办经理,深圳,深圳鼎华伟业商贸有限公司,大专,3-5年,"门店运营,电商运营,京东,淘宝,拼多多,新媒体运营,抖音,快手,微信公众号,toB,toC",3-6万,一、形象好气质佳，懂公关技巧，对酒不反感，可以适量酒量。从事过进口酒水、高端食品饮料、高档酒店会所行业持有驾照者优先考虑。 二、工作经验 具备3年以上中大型企业或5年以上相关企业综合管理工作、企业管理、行政管理工作经验，有同等职位工作经验者优先。三、知识技能 具备全面的管理知识，熟悉财务、人力资源、市场等相关专业知识。 熟悉企业经营管理、公共关系、法律事务等知识基础，熟悉国家相关劳动行政法律法规。...,烟草/酒业,http://jobs.zhaopin.com/CCL1494155750J40687676511.htm,100-299人,2025-03-12 00:59:21
