职位,城市,公司,学历,经验,技能,薪资,工作描述,行业,职位URL,公司规模,发布时间
信用卡销售专员,深圳,中国光大银行深圳分行,大专,经验不限,"信用卡销售,银行,高薪,时间自由,销售专员",2-4万,岗位内容：1. 积极主动开展信用卡销售业务，完成个人销售指标；2. 建立良好的客户关系，提供优质的信用卡服务和解决方案；3. 搜集市场信息，发掘客户需求，进行有效跟进；4. 完成公司安排的其他销售相关工作。任职要求：1. 具备一年以上信用卡销售经验，有成功的销售案例；2. 具备良好的市场洞察力和营销策划能力；3. 热爱销售行业，认真负责，积极进取，勇于挑战；4. 具备出色的沟通表达和人际交往能力。,银行,http://jobs.zhaopin.com/CC136886020J40241188006.htm,1000-9999人,2025-04-14 16:45:31
银行贷款专员,深圳,深圳市金裕瑞辰信息咨询有限公司,学历不限,经验不限,"销售,面销,渠道销售,网络销售",2.8-4万,一、公司介绍1.深圳较有实力的金融经纪公司。2.渠道过硬，深圳90%以上的银行都有合作，四大行战略合作！4.晋升空间大，公司计划今年到明年再开5家分公司。5.公司氛围非常好，团队成员关系都非常融洽，有凝聚力，有方向，互帮互助。共同进步，6.核心价值观：诚信为本、务实敢为、追求极致、合作共赢7、我们的使命：让普惠金融更简单8.我们的愿景：打造普惠金融卓越平台，成为行业领跑者二、职位要求：1.勤奋、听...,投资/融资,http://jobs.zhaopin.com/CCL1493928200J40741195508.htm,100-299人,2025-04-14 15:02:02
跨境电商运营经理,深圳,宁波渠成集团有限公司,本科,5-10年,"跨境运营电商经理,亚马逊",3-4万,岗位职责：1、根据市场特征和业务目标，制订跨境电商平台营销策略，优化运营流程，建立完善的线上运营体系；2、根据公司销售目标，制定平台全年运营规划及各类营销方案，监督指导各项营销活动执行与优化；3、熟悉平台运营规则，统计分析运营数据、善于根据产品的销售与排名变化，制定和调整产品的销售策略；4、负责运营团队建设和日常管理工作，优化业务流程，合理配置人力资源。 岗位要求： 1、英语六级及以上，8年及以上...,贸易/进出口,http://jobs.zhaopin.com/CC388690030J40736607902.htm,500-999人,2025-05-08 18:52:08
续保专员,深圳,中国人寿保险股份有限公司深圳市分公司,大专,1-3年,"财产险,车险,人身险,意外险,医疗险,重疾险,寿险,养老险",2-4万,勤奋有责任心有赚钱的欲望,保险,http://jobs.zhaopin.com/CC135627160J40330814211.htm,10000人以上,2024-07-06 18:33:00
AI事业部运营总监（工作地点：福州）,深圳,福建博士通信息股份有限公司,本科,5-10年,"产品运营,销售运营,toB",2.5-4万·13薪,岗位职责：1. 制定运营管理体系，全面负责事业部日常运营工作，对客户满意度、客户成 本负责；2. 根据业务类型以及客户真实需求，进行调研和分析提取，为客户提供最佳的AI解决方案；3. 根据客户需求、行业变化，对公司AI产品体系进行迭代优化；4. 根据细分行业的特点，不断探索及突破AI的能力边界，确保实现公司整体运营目标。岗位要求：1. 本科以上学历，有5年及其以上的AI运营工作经验，有金融营销、保...,运营商/增值服务,http://jobs.zhaopin.com/CC181240110J40528209308.htm,100-299人,2024-06-12 01:07:30
兼职运营,深圳,深圳市远近模特经纪有限公司,学历不限,经验不限,小红书,100-200元/时,小红书/抖音/快手等平台内容发布【岗位内容】根据公司提供的素材，在平台发布帖子并后台回复私信，文案图文会提供。在家办公，工作期间不需要到公司来。【薪资】日结兼职，每发布一条笔记，或者后台私信有目标客户咨询推微信过来，都有薪资结算。,广播/影视,http://jobs.zhaopin.com/CC468449720J40797751401.htm,100-299人,2025-12-25 11:26:49
市场推广专员,深圳,上海律驰信息科技有限公司,高中,经验不限,,200元/时,国内知名法律品牌招募全国各市、县市场推广员（兼职），一个城市一个县只招募一人，负责产品在当地的推广和宣传：1、推广方式简单，手机或电脑操作，发布产品信息让客户看到即可，无需外出，下班空闲时间手机操作。2、年收入不低于30万，并有上升空间3、享受其他优厚福利，终身受益4、加入立刻获得终身免费法律咨询权力本品牌入驻著名大学国家科技园，正规机构，要求年龄不超45，男女不限，为人正直，无需任何专业和经验，...,咨询服务,http://jobs.zhaopin.com/CCL1462965700J40797397905.htm,20-99人,2025-08-07 00:00:02
亚马逊推广专员,深圳,深圳市迈呀科技有限公司,大专,经验不限,,2-3.5万,出色的语言表达能力（尤其是书面英语）： 能够根据不同产品特点和目标受众调整写作风格。 可能需要撰写其他文案，如QA回复、产品描述优化建议等。 对亚马逊平台规则与生态的深刻理解： 熟悉亚马逊买家/卖家中心操作。 精通亚马逊平台关于产品评论、卖家反馈、社区准则、促销政策（特别是 Vine 计划）的所有规定。 敏锐的产品洞察力和用户体验思维： 能够快速理解产品的功能、卖点、目标用户群体。 能够从用户角度...,电子商务,http://jobs.zhaopin.com/CCL1377019430J40761390611.htm,20-99人,2026-01-11 00:01:40
行业解决方案专员（物流行业）,深圳,上海启程商服科技有限公司,本科,5-10年,,2-3.5万,"工作职责： 1、对客户需求进行分析评估，并转换为行业解决方案(运营型、资源型、技术型); 2、协助行业销售向客户讲解解决方案，从技术维度为项目运作提供支撑； 3、负责整合公司内部资源，协调外部资源，引导解决方案开发、制定方案落地SOP,负责解决方案的落地实施。、 任职要求： 1、本科以上学历，5年以上物流解决方案相关经验，熟悉国内或国际物流，有3PL合同物流项目经验优先； 2、具备优秀的需求分析，...",互联网,http://jobs.zhaopin.com/CCL1414724340J40974255904.htm,100-299人,2026-01-10 01:11:39
跨境电商运营,深圳,深圳市东正光学技术股份有限公司,学历不限,3-5年,"Shopify,英语,海外推广",1.8-3.5万,职位介绍岗位职责：1.负责品牌站点整体运营：制定并执行站点运营规划，统筹站点优化、流量运营、用户运营、活动运营相关工作，对站点流量、转化率、GMV和库存负责；2.推广策略：制定合理的流量策略，协同管理和维护包括Google 广告/EDM/Affiliate在内的重点渠道，优化站点流量结构，保障业绩目标达成；3.流量运营：洞察用户需求，策划并协同实现网站架构、排版、功能、购物流程优化，改善用户转化、...,仪器仪表制造,http://jobs.zhaopin.com/CCL1430715510J40820012711.htm,300-499人,2026-01-09 16:00:38
高级理赔专员/财产险理赔专员,深圳,某大厂旗下控股子公司,本科,5-10年,"财产险,人身险,车险产品",2.5-3.5万·16薪,【岗位职责】1、负责车险、财产险、宠物险的产品核赔规则管理、作业机制梳理，协助沉淀和构建理赔特色服务承诺及口碑；2、负责车险、财产险、宠物险的理赔案件管理及保司管理，包括案件初审、复核、理算作业及保司沟通推动；3、建立车险、财产险、宠物险的核赔及风险管理能力，帮助平台及合作保司降低理赔风险敞口；4、根据公司战略发展及业务需求，协调合作保司、外部服务商等资源，联合推动理赔重点产品项目落地。岗位要求：...,互联网,http://jobs.zhaopin.com/CCL1318355140J40824780403.htm,500-999人,2026-01-09 01:05:13
京东运营(J10030),深圳,深圳诗普琳珠宝有限公司,本科,3-5年,"京东,淘宝/天猫,唯品会,店长,经理,付费推广,活动执行,商品运营",2-3.5万,工作职责：1、熟悉并掌握各电商平台的运营特性、交易规则。2、熟悉店铺运营、后台操作及各种营销推广工具。3、学习竞争对手，对店铺做差异化营销调整。4、负责店铺的总体运营及管理，策划店铺及产品推广方案，组织产品营销工作5、根据年度目标分解制定并实施公司年、季、月销售目标和执行方案任职条件：1、本科及以上学历优先；2、2年以上京东或京东成功运营经验，珠宝类相关经验优先3、精通京东运营环境、交易规则和京东...,零售/批发,http://jobs.zhaopin.com/CC213889830J40803865301.htm,1000-9999人,2026-01-09 00:17:42
孵化器运营高级经理（国际科创）,深圳,港大青年科创(深圳)有限公司,硕士,5-10年,,2.5-3.5万,职位描述：1. 负责国际科创项目的整体运营与管理，搭建并维护与国际合作伙伴的沟通桥梁，推动跨境技术转移与合作。具体职责包括但不限于：策划并执行国际科创活动，吸引海外优质项目落地；协调内外部资源，为入驻企业提供全方位的孵化服务；跟踪国际科技前沿动态，为学院战略决策提供有力支持。2. 负责建立国际科创培训服务体系，结合国际科创项目的特点与需求，设计并开发具有针对性的培训课程与项目，涵盖技术创新、商业管...,社团/组织/社会保障,http://jobs.zhaopin.com/CCL1498740140J40978858104.htm,20人以下,2026-01-09 00:00:01
高级运营经理（养老险/年金险方向）,深圳,某大厂旗下控股子公司,本科,3-5年,"活动运营,门店运营,toC,养老保险",2.5-3.5万·16薪,岗位职责：1、根据业务目标制定并执行运营计划与节奏，对所负责的保险品类的业绩达成负责；2、基于各阶段目标和需求，提炼产品卖点，优化产品转化链路，提升品类转化效率；3、能够洞察并提炼用户需求，识别用户转化中的卡点及问题，制定线上或者人工辅助的解决方案；4、积极探索在养老产品转化中外部合作机会，跟进行业趋势，寻找业务增长机会。岗位要求：1、本科以上学历，3年以上互联网运营经验，具备电商/广告/保险/金...,互联网,http://jobs.zhaopin.com/CCL1318355140J40834110203.htm,500-999人,2026-01-07 01:07:53
运营总监（旅行社）,深圳,大同出版传媒有限公司,本科,5-10年,,2.5-3.5万,【岗位职责】 1.完成业绩指标：根据公司整体战略，制定年度运营计划、预算及业绩指标，以结果为导向，能拆解营销目标为可执行动作(如线索量、转化率、复购率指标)，并通过过程管控确保完成业绩指标。 2.市场分析与拓展：研究市场趋势、竞争态势，发掘新产品、新线路、新合作资源（如酒店、航空、地接社等）。 3.产品体系优化：监督旅游产品的设计、采购、包装与定价，确保产品竞争力和利润率。 4.行程质量管理：监控...,新闻/出版,http://jobs.zhaopin.com/CCL1369907560J40867899303.htm,20-99人,2026-01-06 11:16:20
TikTok运营经理/主管(J10101),深圳,重庆麦一科技有限公司,本科,3-5年,"电商运营,新媒体运营",2.5-3.5万,岗位职责: 1.制定品牌在TikTok平台上的整体运营战略，确保与公司业务目标和品牌价值相一致； 2.负责TikTok北美的销售运营工作，包含小店销售运营、直播策划、推广引流、内容策划等方向； 3.负责TikTok运营团队的搭建以及管理工作，有效把控团队工作效率，推动高质量项目； 4.深入了解TikTok平台的规则和算法，对海外市场文化和用户行为有深刻理解。 任职要求: 1.本科以上学历，英语/国...,电子商务,http://jobs.zhaopin.com/CC883272980J40910040808.htm,300-499人,2026-01-05 18:25:35
酒吧运营,深圳,深圳市晨弘宇电商科技有限公司,学历不限,3-5年,"酒吧运营总监,广东人优先",1.8-3.5万,酒吧经理 / 店长 职责 选址、设计，装修 制定酒吧经营计划和销售目标-管理库存、控制成本、监督进货-招聘、培训和考核员工-维护顾客关系，提升服务质量-处理顾客投诉和突发事件-制定活动与促销方案 要求 - 5年以上酒吧或餐饮管理经验- 熟悉酒水知识与酒吧运营流程- 具备团队管理与沟通协调能力- 有较强的成本控制意识,电子商务,http://jobs.zhaopin.com/CCL1513475200J40867436603.htm,100-299人,2026-01-05 00:00:01
电商运营经理（成都工作）,深圳,千禾味业,本科,1-3年,"电商运营,淘宝,京东",3-3.5万·13薪,"注意：办公地在成都！岗位职责：1、负责天猫系（包括天猫旗舰店、天猫超市），或京东系（包括京东超市、京东旗舰店）运维。2、目标制定：负责板块业务的目标制定；根据公司战略目标、年度规划，完成线上全渠道销售目标的制定、拆解。（包括销售目标、其他经营指标等）3、业务管理：带领团队完成电商业务目标；负责制定合理的、有效的店铺运营策略及运营方案,完成公司下达的销售任务和利润指标；4、团队管理：根据目标进行团队...",快速消费品,http://jobs.zhaopin.com/CC339677710J40853200413.htm,1000-9999人,2026-01-04 10:47:15
955-中层管理岗-双休,深圳,中美联泰大都会人寿保险有限公司江苏分公司,本科,3-5年,"产品运营,用户运营,数据运营",2.8-3.5万·13薪,任职要求:1.学历学信网可查2.熟悉公司管理制度，有一定管理经验优先3.思维敏捷，有良好的分析能力和问题解决能力，积极推动业务发展4.负责公司所属营业部机构的大客户资源的收集，整理和管理工作5.良好的跨部门沟通协作能力6.协助上下级之间传达事务，并进行适当的沟通和协调7.工作细致，工作细心，认真、责任心强、逻辑分析能力及执行力强8、工作朝九晚五双休，偶尔加班不多，不出差任职要求：1、本科学历及以上...,保险,http://jobs.zhaopin.com/CC140883570J40808229003.htm,10000人以上,2026-01-04 09:44:11
国际空运运营经理,深圳,友通达,本科,5-10年,空运,2-3.5万,【工作职责】1.协助空运总经理进行空运业务运营全盘管理。2.参与空运重大项目，深度了解客户需求，对渠道运营进行质量把控。3.对空运运营组织进行管理，负责运营团队人才招聘，和培训。4.维护客情，提高客户满意度。5.带领部门优化成本，提高业务落地率。6.处理空运订单执行过程中出现的各类异常。【任职要求】1.本科以上学历，英语能作为工作语言。2.5年以上国际空运从业经验，有资源开发能力。3.熟悉行业内各...,货运/物流/仓储,http://jobs.zhaopin.com/CC459227380J40818055311.htm,100-299人,2025-12-30 15:14:22
亚马逊运营经理,深圳,深圳市龙联胜科技有限公司,大专,1-3年,"亚马逊,阿里巴巴国际站,ozon,英语",2-3.5万,岗位职责：1、负责公司自有品牌的Amazon电商平台的建设、统筹运营、店铺管理及维护优化的工作，根据销售额、利润等重要运营指标，制定实施方案；2、对整体平台运营进行数据分析，针对销售端运营效果进行跟踪及原因分析；3、调查分析市场及竞争对手状况，制定推广计划和销售策略，熟悉站内外渠道推广引流手段，不断改进运营策略，提高流量及销量；4、跟据销售数据、流量分析等优化产品信息以提高客户购物体验和成交转化率...,运营商/增值服务,http://jobs.zhaopin.com/CCL1236038770J40744322106.htm,20-99人,2025-12-29 15:23:16
电商运营总监/家电运营总监（ 家电/电商/电器）,深圳,上海能良电子科技有限公司,本科,3-5年,"电商运营,家电运营,电器",2-3.5万·18薪,工作内容：1、负责天猫/京东/拼多多等全渠道全平台的整体规划和运营管理；2、负责平台网络营销与推广方案的制定与实施，提升百补坑位销售产出3、独立与平台小二对接，单独规划产品方案和营销计划，平台运营工具熟练，提出应用方案，提高入店流量，增大点击率和浏览量，转化率4、制定月度店铺推广预算，执行相关网络运营方案，完成预期销售目标5、推动团队业绩增长、完成店铺销售目标，打造爆款产品能力6、每日监控的数据:...,互联网,http://jobs.zhaopin.com/CC637353830J40822687909.htm,500-999人,2025-12-26 09:56:16
国际场景解决方案专员（物流行业）,深圳,上海启程商服科技有限公司,本科,5-10年,,2-3.5万,工作职责： 1、国际供应链市场与行业洞察：深入研究特定行业(如通信高科技、工业制造、家居家电等)的 出海供应链趋势，形成行业化销售策略； 2、解决方案与投标支持：协同销售团队共同面客，深挖客户的需求及痛点，整合内/外部资源， 为客户提供供应链出海的综合解决方案； 3、协助商务谈判：协同销售与客户进行商机谈判，维护并深化大客户的合作关系，确保客户满意 度与长期合作黏性； 4、跨部门协作：协调解决方案...,互联网,http://jobs.zhaopin.com/CCL1414724340J40974259704.htm,100-299人,2025-12-16 19:22:15
招商运营经理,深圳,建滔集團有限公司,本科,3-5年,"KA大客户,企业客户",2-3.5万·13薪,【工作内容】- 负责商业项目的招商策划及执行，制定并实施有效的招商策略；- 拓展和维护与品牌商家的合作关系，吸引优质商户入驻；- 定期分析市场动态和行业趋势，为项目运营提供数据支持和决策依据；- 协调内部资源，确保招商计划的顺利推进，实现招商目标；- 对招商团队进行培训和指导，提升团队整体业务能力和工作效率；- 及时解决招商过程中遇到的问题，提高客户满意度。【任职要求】- 具备敏锐的市场洞察力和优...,电子/半导体/集成电路,http://jobs.zhaopin.com/CC872505120J40748794209.htm,10000人以上,2025-12-12 17:28:02
运营支持经理,深圳,深圳市卓越物业管理有限责任公司,本科,5-10年,"物业运营,项目运营,品质管理,品质督导",2-3.5万·14薪,岗位职责：1、牵头制定华南大区项目运营管理标准、服务流程（含企业客户入驻对接、设施设备运维、商户运营协同、会务服务等）及考核体系，定期更新运营操作手册；2、针对现有运营体系中的痛点（如跨项目资源调度不畅、服务响应效率低等）提出优化方案并推动落地，确保运营体系适配不同类型商企物业项目（企业总部大楼项目、写字楼、产业园、商业综合体）的差异化需求。3、监督各项目运营体系执行情况，开展合规性与标准化检查，...,物业管理,http://jobs.zhaopin.com/CC133097290J40818616209.htm,10000人以上,2025-12-11 14:30:38
IDC采购专员,深圳,清云云计算(深圳)有限公司,本科,3-5年,"招商采购,数据中心采购,服务器采购",2-3.5万,岗位职责负责公司IDC硬件类（服务器、配件、交换机、网络设备等）采购供应链工作，包括但不限于以下几方面：1、负责硬件设备类供应商寻源及采购工作，按照公司采购计划和流程完成采购工作，并提出合理的产品价格。2、负责硬件设备类供应商管理，建立良好的合作关系，确保采购的顺利进行。3、负责跟进采购项目进度，对采购合同进行管理和跟踪，处理采购项目的风险和问题；4、负责采购成本的预算和控制，对采购成本进行分析和...,人工智能,http://jobs.zhaopin.com/CCL1308498350J40874729202.htm,20-99人,2025-12-05 14:20:49
亚马逊精品运营专员/ 7.5h+双休+五险一金,深圳,深圳市喜达科技有限公司,本科,1-3年,"亚马逊,精品运营,英语,日语,法语",1.8-3.5万,【热招】精品运营专员（3C 爆款经验复用・核心岗）一、核心职责：全链路操盘，打造 3C 类目爆款标杆 1.精品店铺全流程运营：负责亚马逊全球核心站点（欧美日为主）的全链路运营，聚焦 3C 高端配件（手机壳、支架等），从选品调研、Listing 精细化优化（标题 / 关键词 / A + 页面 / 视频）到上架推广，全程主导执行； 2.爆款策略落地与优化：制定单品爆款打造计划，通过精准的 CPC 广告...,贸易/进出口,http://jobs.zhaopin.com/CC372133630J40830620805.htm,100-299人,2025-12-04 09:18:38
商文旅运营总监,深圳,蕾奥规划,本科,5-10年,"文旅,招商运营,运营策划",2-3.5万,岗位职责：1、调研与价值判断：独立带队对新项目地块进行现场勘查，快速判断其商业价值、文化潜力及客群画像；主导完成市场调研、竞争对手分析、客群研究及财务可行性分析，形成专业的《项目前期调研报告》及《商业计划书》；2、商业策划与定位：基于在地文化属性，提出项目的核心主题、商业定位、业态规划与品牌落位方案；能塑造项目独特的文化IP和品牌故事，确保商业规划与文化调性高度统一；3、招商资源与落地：主导整个招...,专业技术服务,http://jobs.zhaopin.com/CC547527880J40803465107.htm,500-999人,2025-12-03 14:49:54
双休底薪6600招运营/七小时工作制/五险一金,深圳,中国平安,大专,经验不限,"五险一金补充医疗保险,年终奖，带薪年假,朝九晚六,双休不加班",面议,"此岗位本月急招,招满为止！！！可接受无经验,公司提供完善的培训和发展空间！上班时间早上9：00-12：00，2：00-6：00七小时工作制,周末双休,不加班工作内容：针对已购客户做好维护,解答客户问题无需开发新客户,仅需做好客户承接就可以做好公司的老客户维系和服务,树立公司的形象薪资待遇底薪6600+提成+高额奖金+福利:综合收入18K-30K福利待遇1,上班时间早上9:00到下年6:00,午休2...",银行,http://jobs.zhaopin.com/CC000204810J40855591812.htm,10000人以上,2025-12-03 13:41:49
金融贷款销售专员（提供客户资源+住宿）小白也可以,深圳,深圳市瑞思通金融服务有限公司,学历不限,经验不限,,1.8-3.5万,深圳银行居间行业龙头企业，规模实力雄厚的银行贷款中介公司。公司高管全部由曾任职于各头部银行高管组成。团队朝气上进，有强大的晋升空间。独特合伙人机制，让每个人都有机会成为公司的合伙人股东。公司力求和各位同仁共同长远稳定发展。任职要求：年龄20-40岁岗位职责：1、公司提供精准优质客户资源，通过电话的形式跟进有需求的意向客户和邀约；2、无经验可总监亲自全程带学。福利待遇：1、公司提供入职培训，学习金融...,咨询服务,http://jobs.zhaopin.com/CC820032410J40483769216.htm,500-999人,2025-11-28 10:34:13
运营经理,深圳,熵数科技(深圳)有限公司,本科,3-5年,"社群运营,toC",2-3.5万,一、岗位职责1、制定 APP 全生命周期推广策略，规划从 0 到 1 冷启动及后续增长方案，完成用户拉新、留存、促活目标2、开拓并维护应用商店、社交媒体、信息流广告等核心推广渠道，优化投放策略，提升下载转化率3、策划并执行裂变活动、KOL 合作、异业联动等营销活动，打造爆款传播事件4、监控推广数据（CPI、ROI 等），分析用户行为，及时调整优化推广方案5、协同产品、设计、技术等部门，确保推广素材...,人工智能,http://jobs.zhaopin.com/CCL1495978530J40823113110.htm,20人以下,2025-11-24 11:34:21
资深合规专员2454-10802,深圳,富士康科技集团,本科,3-5年,"出口管制法规,合规法律,熟悉西班牙语和中文",2.5-3.5万·13薪,一、职位概述为公司墨西哥厂区提供出口管制、隐私保护、劳动与雇佣等领域的合规支持，支持业务单位的合同审查及出具法律意见。候选人有墨西哥律师执照（优先），具墨西哥法律教育背景Bachelor of Laws in Mexico，西班牙语及中文双语流利。二、岗位职责1、法规跟踪与解读：及时更新并解读与墨西哥经营相关法规，不限于《商业企业法》、《股份公司法》、《联邦经济竞争法》、《对外贸易法》、《私有主体...,电子设备制造,http://jobs.zhaopin.com/CC146033880J40681542801.htm,10000人以上,2025-11-18 14:18:26
金融电话销售专员,深圳,深圳市瑞思通金融服务有限公司,学历不限,经验不限,"电话销售,销售",1.8-3.5万,岗位职责： 电话邀约有意向的客户到公司，有专业人士帮忙谈单 上班时间：早九晚六点半，午休两小时，周六固定休 薪资：8000补贴+提成25% 本岗位接受无经验人员，入职会有培训，也有老人带,咨询服务,http://jobs.zhaopin.com/CC820032410J40487841516.htm,500-999人,2025-11-28 10:33:13
