职位,城市,公司,学历,经验,技能,薪资,工作描述,行业,职位URL,公司规模,发布时间
新媒体运营总监,成都,成都海思朗图健康科技有限公司,大专,5-10年,"新媒体运营,产品运营,销售运营",1.1-2万,岗位职责：1、全面负责公司新媒体账号的战略规划、内容运营与团队管理，提升品牌影响力与用户增长；2、制定KPI考核机制，优化工作流程，提升团队效率与执行力；3、主导新媒体渠道的商业变现，拓展并维护品牌客户资源，独立完成招商方案策划、谈判与落地执行，达成年度招商目标；4、策划并统筹线上线下整合营销活动，提升用户活跃度与转化率；任职要求：1、5年以上新媒体管理经验，熟悉网络媒体传播特点，在互联网平台有一...,医疗设备/器械,http://jobs.zhaopin.com/CCL1469897390J40801405109.htm,20人以下,2025-12-26 15:22:16
新媒体销售,成都,成都明升共创房地产经纪有限公司,学历不限,经验不限,"个人客户,五险",1-2万,工作内容：1.负责网上销售，具备一定的网感，需要外出拍摄工作时间：早九晚七中午休息一个小时四十分钟（不加班）工资：无责底薪3500+20%-30%提成福利：不定时旅游+五险+奖金+超长年假工作要求：需要性格外向，不怯镜头，年龄18岁以上,房地产中介,http://jobs.zhaopin.com/CCL1432296390J40781755208.htm,20-99人,2025-12-26 13:59:26
新媒体房产经纪人(10-30K）,成都,成都海纳千川房地产经纪有限公司,学历不限,经验不限,"住宅房产,商业房产,办公房产,新房,二手房,别墅,面销/陌拜	,电话销售,网络销售",1-2万,成都海纳千川是一家房产自媒体品牌公司，通过孵化【房产】专家类IP，在抖音直播间分享购房知识，解答粉丝提问，从而协助粉丝在线下成功置业，买对房。公司分配客户 公司分配客户 成交周期短，时间相对自由、公司40%以上的员工月入5w+职位描述1、接手公司优质主播的留资客户（至少每月100-200组）的后续工作，按照公司服务标准为客户提供专业置业方案；2、熟悉各大楼盘，能做到精准的推荐，维护客户促进交易;3...,房地产开发,http://jobs.zhaopin.com/CCL1466148560J40973355804.htm,100-299人,2025-12-26 09:04:57
房产主播/房产直播官/新媒体经纪人,成都,贝壳找房(北京)科技有限公司,大专,经验不限,主播经纪人,1-2万,【岗位职责】：1. 短视频内容创作与出镜：负责公司账号的直播或者短视频出镜（包括但不限于抖音、视频号、小红书等）；2. 直播运营与粉丝互动：按照公司要求，确定直播/短视频流程、初编直播/短视频脚本，配合出镜；讲解房产卖点、引导留资，增加粉丝的粘性以及粉丝数；3. 账号运营与数据分析：配合团队复盘数据，不断反馈调整，优化短视频/直播内容、流程、提高用户参与度；4 市场热点跟进：积极学习和研究行业知识...,互联网,http://jobs.zhaopin.com/CC300255130J40912728415.htm,10000人以上,2025-12-25 22:17:43
产品运营与营销推广,成都,言灵无界信息咨询(北京)有限公司,本科,5-10年,"新媒体运营,品牌运营,网络运营,渠道运营",1.2-2万,职位描述 1、负责公司产品业务线设计，通过海内外各主流社媒平台进行产品推广与获客 2、制定和执行社交媒体营销计划，包括内容创作、设计优化、以及效果跟踪。 3、利用各主流推广平台的玩法与规则进行数字化营销，提高在线可见性和用户参与度。 5、分析市场趋势，对竞争对手的社媒策略进行评估，并据此调整自身的运营策略。 6、跨部门合作，确保营销活动和公司整体战略及其他市场活动的一致性。 7、监测并报告主流平台...,咨询服务,http://jobs.zhaopin.com/CC481983130J40705055215.htm,100-299人,2025-12-23 01:42:57
千川素材编导,成都,云南绿A生物,大专,1-3年,"短视频,口服美容类",1.2-2万,任职要求1.经验：大专学历及以上，1年以上抖音编导经验，需提供过往爆款案例2.创作能力：熟练创作千川脚本，能精准提炼产品卖点。根据用户画像，匹配合适的视角、卖点、画面、文案。3.制作能力（不需要亲自制作，但需要懂）：拍摄技巧，灯光，布景，后期。根据素材风格，匹配合适的BGM。4.洞察力：能抓热点、及时跟进同行或跨行业的新玩法。5.沟通能力：能和同事有效沟通，高标准完成素材。6.具备优质素材迭代能力...,医药制造,http://jobs.zhaopin.com/CC135729190J40813263801.htm,100-299人,2025-12-23 00:06:01
内容运营（小红书）,成都,四川俞晟家居有限公司,本科,3-5年,"视频类,文本类,小红书,家居类",1.2-2万,岗位职责：1、负责小红书平台的整体运营，包括账号、内容、博主运营，打造符合品牌调性的优质内容；2、负责KOC/KOL达人整体运营，整合达人资源，跟踪达人发稿情况销售数据，分析转化效果，提高ROI；4、制定专属的小红书爆款运营策略，结合平台热点、算法规则优化内容，提升笔记曝光量、互动率（点赞 / 收藏 / 评论）及品牌转化效果；4、通过小红书引流至私域（微信/企业微信），设计转化路径提升私域成交率，...,家具制造,http://jobs.zhaopin.com/CCL1509923350J40856115003.htm,500-999人,2025-12-22 14:16:32
图书销售 新媒体电商运营,成都,四川矩创世家出版传媒股份有限公司成都分公司,大专,1-3年,网络销售,1-2万,避免浪费彼此的时间，无发行经验者勿扰，谢谢。 申明：为保护求职者权益，本公司平台上发布的工作内容 ，薪资构成，上班时间等全部和公司真实情况一致。 【我们是做什么的】： 我们是一家图书出版公司，公司主营图书出版发行。 【工作时间】： 1、早上09: 00-12: 20——下午2: 00-7: 00 2、周末大小周休息。 3、所有法定节假日正常带薪休全假。 4、超长春节年假：20--25天（带薪，新老...,新闻/出版,http://jobs.zhaopin.com/CCL1495997160J40850341413.htm,100-299人,2025-12-18 15:33:44
内容营销副经理,成都,吉香居食品股份有限公司,本科,5-10年,,1.2-2万,岗位职责：1.根据品牌年度规划，融合节日营销、社会热点、产品周期制定年度、季度、月度内容营销日历；2.根据品牌调性、产品卖点，开展用户画像、竞品内容矩阵、行业趋势分析，挖掘品牌差异化内容切入点，从而搭建品牌自媒体内容矩阵；3.主导产出宣传片、深度图文、短视频等新媒体内容，并对接媒介渠道进行分发，对分发效果负责；4.管理摄影、剪辑团队，确保内容团队稳定，内容产出高效、出彩。岗位要求：1.35岁以下，...,快速消费品,http://jobs.zhaopin.com/CC157770010J40742753810.htm,1000-9999人,2025-12-16 14:00:47
高级短视频编导,成都,犀重新能源汽车有限公司,本科,3-5年,短视频,1-2万,【岗位职责】1.内容体系策划：负责汽车类内容的选题策划、脚本撰写、拍摄指导及后期沟通，聚焦产品卖点、参数对比、应用工况、生产制造、客户采访、亮点展示等核心场景，输出有干货、有网感的视频内容（短视频为主，含长视频/直播脚本策划）。2.爆款逻辑落地：结合新能源重卡热点、车主痛点（如“电池寿命”“用车成本”等），运用悬念、实测、对比、剧情化等手法设计内容，提升完播率、互动率及产品种草转化，实现账号健康涨...,汽车研发/制造,http://jobs.zhaopin.com/CCL1486804690J40967230304.htm,1000-9999人,2025-12-15 15:31:32
直播运营,成都,成都大展顺途汽车销售服务有限公司,大专,经验不限,"汽车类,直播",1-2万,1. 全职汽车直播运营，负责直播投流，主播管理及培训等。有直播运营经验优先。2. 整理并深刻理解产品特点，结合用户需求，输出直播话术。3. 能够敏锐的把握直播间流量，结合付费流和自然流，稳定直播间流量，把控线索成本。4. 针对每日直播数据进行复盘，提升主播个人产出能力。任职要求：1. 大专以上学历，热爱直播行业，热爱生活、有经验者优先；2. 对流量敏感，精通直播付费流逻辑，严控成本；3. 良好的亲...,汽车4S店/经销商,http://jobs.zhaopin.com/CCL1513581380J40849306113.htm,20-99人,2025-12-12 18:00:40
新媒体运营专员,成都,四川巴蜀印象食品有限公司,大专,1-3年,"电商运营,短视频运营,短视频平台",1-2万,1-3年，大专，底薪5-6k，综合薪资14-28k岗位基本要求：一，大专以上学历，有强烈的个人展现力。二，性格活跃，语言表达能力强，抗压能力强。三，愿意做一枚美食领域的博主岗位工作内容：一，创作新媒体内容二，为餐饮火锅门店推荐产品。薪酬待遇：综合薪资：12-25k，无责底薪5180-6180+提成（2-5%）一，开放式的谈，可以根据个人要求，灵活定制薪酬二，基础工资+岗位工资+绩效工资+提成+年终...,快速消费品,http://jobs.zhaopin.com/CC609869130J40848859813.htm,100-299人,2025-12-12 10:05:32
运营总监（茶叶检测）,成都,重庆东渝中能实业有限公司,本科,5-10年,"电商运营,新媒体运营,销售运营,toC",1-2万,岗位职责：1、负责公司私域体系0-1搭建与日常运营。2、制定私域年度/季度运营策略与销售目标，统筹产品上架、内容策划、活动推广、用户分层与复购提升。3、主导私域用户增长与转化路径设计，打造从认知到忠诚的闭环运营体系。4、管理私域客服体系，建立标准化响应机制与用户关怀方案，提升客户满意度与复购率。5、负责数据分析与复盘，跟踪关键指标（如留存率、转化率、客单价、复购率），提出优化策略并推动执行。6、协...,医疗设备/器械,http://jobs.zhaopin.com/CC559198180J40829701714.htm,100-299人,2025-12-11 11:37:42
新媒体运营经理(J11546),成都,成都市全友家私销售有限公司,大专,3-5年,家装类,1.1-2万,岗位职责:1. 通过研发新零售获客模式，提升终端销售业绩；2. 负责开发能力提升课程，确保团队技能不断提高；3. 组织和实施终端新媒体培训，提升团队对新媒体运营的理解和实践；4. 打造标杆门店，提供到店的全面支持与培训。任职要求:1. 具有丰富的新媒体运营和团队管理经验；2. 对新零售获客模式有深刻理解，能够有效地应用于实际运营中；3. 能够独立设计并实施培训课程，提升团队专业技能；4. 有较强的...,耐用消费品,http://jobs.zhaopin.com/CC349356610J40857688612.htm,1000-9999人,2025-12-09 14:59:02
汽车行业直播运营总监,成都,成都瑞马特汽车贸易有限公司,大专,1-3年,"内容运营,新媒体运营,toC",1.5-2万,岗位职责：1. 制定并执行公司新媒体平台的整体直播运营策略，提升品牌影响力和用户粘性；2. 指导并协调团队进行内容创作、活动策划及执行，确保内容质量和发布时效；3. 分析新媒体运营数据，优化推广效果，提出改进方案并推动实施；4. 跟踪行业动态，把握市场趋势，为公司提供创新运营思路及方向。任职要求：1. 拥有丰富的媒体直播运营经验，熟悉各大新媒体平台的运作机制；2. 具备出色的团队领导能力，能够激励...,汽车4S店/经销商,http://jobs.zhaopin.com/CC688628420J40970726204.htm,300-499人,2025-12-03 09:35:30
自媒体运营主管,成都,四川元创堂健康管理有限公司,学历不限,3-5年,"医疗类,电商运营,品牌运营,短视频运营,自媒体运营,抖音运营,美团运营",1-2万,岗位内容：1. 执行公司新媒体（美团，抖音，小红书等）的推广策略，及时更新各个社交媒体平台的内容和互动，提升社交媒体品牌影响力；2. 关注市场和行业趋势，了解消费者心理需求，提出创意方案和运营建议，促进销售增长；3. 负责社交媒体平台的日常维护、数据分析和报告输出，反馈内容改进意见和提升策略；4. 协助其他部门完成相关工作。任职要求：1. 具备良好的写作和编辑能力，热爱新媒体和数字营销，对社交媒体...,,http://jobs.zhaopin.com/CCL1513368160J40902425108.htm,,2025-11-26 00:00:01
小白号妇科生殖负责人,成都,成都双楠医院,大专,3-5年,,1-2万,岗位职责:1.战略统筹:依据医院战略，制定新媒体中长期发展规划与年度目标，统筹抖音、小红书、快手，视频号，等全平台矩阵搭建，明确品牌曝光、用户增长、就诊转化等核心指标及落地路径。2.内容管控:主导医疗内容体系建设，围绕医院优势、妇科/生殖打造等方向策划内容，统筹选题、创作、审核全流程，确保内容符合《医疗广告法》等法规要求，兼具专业性与传播力。3.团队管理:搭建并管理新媒体团队(内容、运营等)，负责...,卫生服务,http://jobs.zhaopin.com/CC468916710J40969213104.htm,500-999人,2025-11-25 17:57:19
新媒体运营总监,成都,成都瑞马特汽车贸易有限公司,大专,1-3年,内容运营,1.5-2万,岗位职责：1. 制定并执行公司新媒体平台的整体直播运营策略，提升品牌影响力和用户粘性；2. 指导并协调团队进行内容创作、活动策划及执行，确保内容质量和发布时效；3. 分析新媒体运营数据，优化推广效果，提出改进方案并推动实施；4. 跟踪行业动态，把握市场趋势，为公司提供创新运营思路及方向。任职要求：1. 拥有丰富的媒体直播运营经验，熟悉各大新媒体平台的运作机制；2. 具备出色的团队领导能力，能够激励...,汽车4S店/经销商,http://jobs.zhaopin.com/CC688628420J40970470404.htm,300-499人,2025-12-02 11:14:48
新媒体运营经理,成都,成都创智公关策划有限公司,本科,3-5年,"短视频平台,图文平台,微信公众号,抖音,微信视频号,小红书,知乎,内容运营,短视频运营,品牌运营",1.5-2万,岗位职责：1.负责基于公司组织战略制定部门内容运营策略包括不限于内容管理、账号定位、传播机制；2.负责明确部门年度、季度、月度工作目标、工作计划；3.负责拓展公司媒体渠道，提升公司品牌影响力；4.负责公司内部核心项目的协同，确保目标达成；5.负责渠道营销等产品对应客户交付内容的及时性，提升客户满意度；6.负责内容运营中心预算管理，确保部门预算合理情况下成本控制。任职要求：1.本科以上学历，3年以上...,广告/营销,http://jobs.zhaopin.com/CC384209410J40807585901.htm,20-99人,2025-11-18 14:14:48
直播运营经理,成都,四川省百世兴食品产业有限公司,大专,3-5年,"抖音,电商类,休闲食品",1.5-2万·13薪,岗位职责： 1.管理直播团队（主播），优化主播话术、排品策略及试吃展示技巧，提升直播转化效率。 2.制定直播流量策略（自然流 + 付费千川流），结合食品消费时段与人群偏好优化投放，提升引流效率；实时监控直播数据并指导现场优化。 3.主导每场直播复盘，沉淀高转化玩法，持续优化直播 “人、货、场” 匹配度。 4.负责抖音平台直播销售目标的推进落地，确保直播销售目标和利润目标达成。 5.分析行业直播趋势...,快速消费品,http://jobs.zhaopin.com/CC120857670J40809019909.htm,100-299人,2025-11-18 10:40:26
新媒体运营总监,成都,成都瑞马特汽车贸易有限公司,大专,3-5年,"直播运营,新媒体运营,电商运营",1.5-2万,岗位职责：1. 制定并执行公司新媒体平台的整体运营策略，提升品牌影响力和用户粘性；2. 指导并协调团队进行内容创作、活动策划及执行，确保内容质量和发布时效；3. 分析新媒体运营数据，优化推广效果，提出改进方案并推动实施；4. 跟踪行业动态，把握市场趋势，为公司提供创新运营思路及方向。任职要求：1. 拥有丰富的媒体运营经验，熟悉各大新媒体平台的运作机制；2. 具备出色的团队领导能力，能够激励团队达成...,汽车4S店/经销商,http://jobs.zhaopin.com/CC688628420J40969621304.htm,300-499人,2025-11-27 09:50:56
新媒体运营主管,成都,北京自如住房租赁有限公司,本科,3-5年,短视频运营,1-2万·15薪,主要职责：1. 内容策略与策划：o 敏锐捕捉社会及行业热点，结合业务节点，策划高传播性、高转化率的线上内容选题（包括但不限于短视频、图文、直播等）。o 构思能引发线上互动并引导至线下消费的内容主题2. 内容创作与制作：o 独立或协同摄影师完成短视频、直播的脚本撰写，确保内容兼具趣味性、实用性和转化引导。o 负责或指导短视频的拍摄与后期制作，对成片质量负责。o 撰写具有吸引力和说服力的社交媒体文案（...,互联网,http://jobs.zhaopin.com/CC328521330J40809423609.htm,10000人以上,2025-11-13 15:58:01
短视频运营总监,成都,四川蓝海文化旅游发展集团有限公司,大专,3-5年,抖音  小红书  视频号,1-2万,职能概述抖音/小红书/视频号等自媒体平台的运营/引流/营销/变现全过程。 1、 账号运营：抖音/小红书/视频号平台全过程运营管理，从0-1搭建矩阵。 2、产品营销：线上潮玩盲盒类产品的推广引流与营销变现。 3、视频剪辑：短视频的拍摄剪辑，根据脚本需求进行混剪/精剪等制作。 4、 后期制作：根据短视频要求进行调色/音效/特效/美化等后期处理，保障成片效果。 5、 脚本创作：具有独特的创作思维与创新能...,房地产开发,http://jobs.zhaopin.com/CCL1484042510J40820232610.htm,20-99人,2025-11-12 16:29:06
电商直播运营负责人,成都,四川福摩数字科技有限公司,大专,3-5年,"抖音,快手,电商类,美妆类,情感类",1.5-2万,岗位职责：1、负责直播业务整体运营，制定运营策略，不断迭代符合公司发展战略的直播模式；2、不断创新升级直播玩法，逐步搭建标准化直播运营服务体系，对直播策划和运营的质量、效率、GMV等关键指标负责；3、了解行业动向，研究电商直播新玩法，分析品类和账号的运营销售情况，根据市场行情及时调整优化直播运营策略方向；4、根据粉丝属性以及用户习惯的分析和培养，挖掘用户需求不断优化直播内容，总结系统的运营经验，提...,互联网金融/小额贷款,http://jobs.zhaopin.com/CCL1277525940J40825343105.htm,300-499人,2025-11-10 13:17:54
ip运营主管,成都,成都新经济发展研究院有限公司,本科,1-3年,,1-2万,岗位职责：1. IP定位与战略规划：· 参与或主导IP的定位分析，确定其核心价值、目标受众和世界观。· 制定IP的长期发展策略和短期运营目标，规划其内容矩阵和商业化路径。2. 内容生态构建与传播：· 内容策划与生产：围绕IP核心，策划并组织生产多元化的内容，包括故事、漫画、短视频、条漫、音频、周边文案等，丰富IP内涵。· 内容分发与推广：负责在各大内容平台（如微信公众号、微博、B站、抖音、小红书等...,咨询服务,http://jobs.zhaopin.com/CC810408550J40896668608.htm,20-99人,2025-10-29 11:01:04
短视频高级运营,成都,成都大展征途汽车销售服务有限公司,大专,经验不限,,1.5-2万,工作内容：1.新媒体平台: 短视频文案、拍摄剪辑、账户运营任职要求：1.编导，传播学，电子商务，市场营销，广告营销相关专业优先；2.有自己作品及成功案例，善于思考，善于分析，有想法，有创新；3.熟念掌握拍摄技能、拍摄工具及高级剪辑能力；4.年龄要求40以下工作时间:9:30-19:00 中午午休，月休5天，法定节假日当月多一天休假，法定节假日上班加班工资。薪资: 试用期薪资福利待遇面议，转正底薪1...,汽车4S店/经销商,http://jobs.zhaopin.com/CCL1500481430J40796948901.htm,20-99人,2025-10-15 13:42:40
运营总监,成都,成都查数估科技有限公司,本科,5-10年,新媒体运营,1.5-2万·13薪,岗位职责：1、新媒体战略与矩阵布局：制定项目的新媒体整体战略，规划微信、抖音、小红书等平台矩阵的定位与运营模式。2、内容战略与IP打造：通过短视频、直播、深度文章等形式，创作引发行业共鸣、解决用户痛点的爆款内容，建立情感连接。3、用户增长与流量运营：精通各平台流量规则，通过内容投放、热点营销、跨界合作等方式，低成本、高效率地获取精准用户。对用户增长及转化的核心指标负责。4、团队管理与赋能：组建并管...,互联网,http://jobs.zhaopin.com/CC805706420J40810305010.htm,20-99人,2025-10-10 10:38:28
证券新媒体投资顾问,成都,华西证券股份有限公司成都龙腾东路证券营业部,本科,经验不限,"股票市场,投资分析,证券从业资格证,基金市场,基本面分析",1-2万,【工作职责】：1、围绕搜索引擎关键词寻找流量，在相关网站进行内容制作，获取曝光量，实现客户粘性和转化。内容制作平台主要有：知乎、小红书、叩富网、贴吧、股吧等。每日回答问题，活跃更新内容等；2、入驻流量平台进行投资理财内容创作，以优质内容获取曝光量，从而提升客户粘性并进行转化。内容制作平台主要有：今日头条、雪球、公众号、小红书、知乎等。每日发文，活跃更新内容等；3、入驻抖音、快手、B站、视频号等平台,证券/期货,http://jobs.zhaopin.com/CC692159820J40753928715.htm,1000-9999人,2025-09-10 10:24:56
微短剧编剧,成都,西藏易境旅游景观规划设计有限公司四川分公司,大专,3-5年,"剧本编剧,短视频编剧,电影编剧,网剧编剧,电视剧编剧",1-2万,非相关专业、无相关工作经验请勿随意投递简历一、工作内容：网络短剧、微电影等项目的选题、策划及剧本创作（全职、兼职皆可）。1. 改编剧本：无题材限制，可根据各类热门IP、网文小说等改编。投稿要求:人设+故事大纲+正文前30集。2. 原创剧本：剧本人物角色设置、剧本大纲以及一卡剧本供初审（10集左右）。二、剧集要求：1.单集标准:1-3分钟/每集，600-800字/集；2.集数标准:IP改编类80-1...,建筑设计,http://jobs.zhaopin.com/CCL1292138880J40766726610.htm,100-299人,2025-08-22 11:16:11
我在传媒公司当人事之急缺运营！！！,成都,成都七彩阳光文化传媒有限公司,学历不限,无经验,,1-2万,"工作内容:1.拥有一点的互联网思维2.定期分析主播账号数据，输出运营报告3.抓住网络热点，积极创新4.账号和后台回复及账号基础运营【任职要求】1.熟悉抖音、快手等娱乐平台的算法和机制的优先，可接受应届生和小白2.网感强、创意多、擅长社交岗位福利：上班时间晚，可以睡懒觉办公环境良好，交通便利、餐饮多薪资：8-15k,优秀者2-3w 。弹性打卡上班！！！（真实薪资，无套路，工龄半年以上3-5w)",文化艺术/娱乐,http://jobs.zhaopin.com/CCL1495448470J40827421508.htm,20-99人,2025-07-29 15:00:15
新媒体销售运营,成都,四川梦马教育咨询有限公司,本科,1-3年,"网络销售,渠道销售",1-2万,岗位关键词：课程顾问 · 有销售经验 · 在线教育 · 考研专业课 · 双休 · 五险一金 岗位职责：1.负责从销售角度开拓用户增量的渠道平台运营工作，如：小红书、闲鱼、抖音等；2.新媒体营销过程中撰写原创优质内容，包括文案、图片、视频等，以提高产品曝光率和咨询量等；3.搭建新媒体账号矩阵，多账号联动运营，提高品牌知名度；4.整理分析新媒体运营数据，不断调整并优化运营策略，提升粉丝数量和阅读量；5...,培训/辅导服务,http://jobs.zhaopin.com/CCL1481235320J40799952503.htm,500-999人,2025-07-16 19:03:38
小红书运营经理10000以上,成都,成都惠买材网络科技有限公司,学历不限,3-5年,"新媒体运营,社群运营,门店运营,小红书,抖音,toB,toC",1-2万,小红书运营经理10K+成都恒冠绿田建材有限公司成立于2009年，从一家建材小店成长为员工逾百、营业额数亿元的一站式建材批发企业，拥有2万㎡仓储和1万㎡建材超市，经营品类超20万种，全面覆盖装修、房建、市政等建材需求。公司以“让装修简单省钱”为使命，立志成为世界级家居建材服务商，未来五年冲刺10亿元营收，十年内成功上市。我们崇尚创新与挑战，不断探索行业新模式和技术；以客户价值为核心，提供多元化培训与...,建材,http://jobs.zhaopin.com/CCL1492152180J40823586908.htm,100-299人,2025-07-16 14:35:59
