职位,城市,公司,学历,经验,技能,薪资,工作描述,行业,职位URL,公司规模,发布时间,薪资_最小值,薪资_最大值,年薪月数
社区MALL运营总监/项目总(J20956),北京,正大集团,本科,5-10年,"门店运营,toC,商超运营",30000-50000,岗位职责:1、全面负责莲花荟社区MALL的运营管理工作，制定社区MALL项目长期发展战略及年度运营计划，确保项目目标与集团战略一致，并保障战略和计划落地实施。2、主导新店筹备全流程，协调资源推进项目落地，确保时间节点与质量达标。3、搭建高效团队，实施教练式领导风格，提升团队绩效能力。建立有效的沟通机制，促进团队内部和跨部门间的信息流通和协作，营造积极向上的工作氛围和团队士气，负责团队的人才梯队建设...,农/林/牧/渔,http://jobs.zhaopin.com/CC000325800J40807090705.htm,10000人以上,2026-01-11 00:18:21,30000.0,50000.0,12.0
充电宝-渠道策略运营,北京,北京三快在线科技有限公司,本科,3-5年,,,美团充电宝是服务零售中的共享租赁业务，承接美团使命，致力让大家充电更简单。美团充电宝业务以应急充电功能为服务核心，覆盖吃喝玩乐生活全场景。目前，已在全国超过2000多个城市的餐饮、娱乐、机场、地铁、火车站、医院、学校、景区等公共区域及场所提供充电服务，铺设机柜超过百万，有KA、直营、渠道合作商多种业务模式，随时随地保障和满足消费者的充电需求。我们的业务资产数量多、场景多元化，追求精益管理。我们的团...,互联网,http://jobs.zhaopin.com/CC383625320J40778654209.htm,10000人以上,2026-01-11 09:01:00,,,
商家运营,北京,京东集团,本科,5-10年,,30000-50000,工作内容： 1、根据商家所处阶段，完成商家运营周期管理标准及运营策略，制定商家长期规划; 2、挖掘商家差异化特征，针对获取流量，识别优势、机会品类、提升用户规模等策略，实现业绩增长； 3、充分了解行业动态，健康行业商家有效策略，定期复盘商家策略，优化迭代运营打法。 4、数据分析复盘，包括供给、流量、转化、动销等维度，寻找优化点并落地执行。任职资格： 1. 本科及以上学历； 2. 有敏锐的市场的观察...,互联网,http://jobs.zhaopin.com/CC192921310J40618767009.htm,10000人以上,2026-01-11 00:10:03,30000.0,50000.0,16.0
运营管理中总经理,北京,欧伏电气股份有限公司,本科,10年以上,,30000-50000,关键职责：运营管理体系搭建与落地1：主导公司运营管理体系建设，聚焦战略执行落地，运用DSTE（华为的战略执行）体系方法论，牵头完成公司战略拆解、目标分解，并建立全流程监督机制，确保战略规划层层落地、有效执行。2：统筹经营分析工作，搭建完善的经营分析框架，定期组织开展经营数据复盘、盈亏分析、运营风险评估，形成专业经营分析报告，为公司决策提供数据支撑。3：负责组织绩效管理体系搭建与优化，制定科学合理的...,电气机械/电力设备,http://jobs.zhaopin.com/CC491078920J40746505006.htm,500-999人,2026-01-09 11:40:46,30000.0,50000.0,13.0
美团会员成长运营专家,北京,北京三快在线科技有限公司,本科,5-10年,,,美团平台为用户的基础产品体验负责，还承担了美团的用户增长、市场和品牌营销以及多条业务线的产品设计职责，建立了融合文字、图片、视频和直播等不同形式的內容生态系统，同时整合地图服务部、客户服务和体验部、企业业务部、网约车业务部等部门，致力于用科技提升美团数亿消费者、近千万商家、骑手、司机和团长的服务体验。美团平台拥有高并发、多业务的复杂场景，为技术深度优化提供了最佳实践可能。这里有简单、讲逻辑、有爱的...,互联网,http://jobs.zhaopin.com/CC383625320J40768914509.htm,10000人以上,2026-01-11 08:46:00,,,
电商运营经理,北京,京东集团,本科,3-5年,"拼多多,京东,淘宝/天猫,品类运营,POP,电商运营",25000-50000,1. 负责自营或pop 采销业务的工作规划与执行，深入理解市场需求，优化商品结构和销售策略，推动业务持续增长；2. 根据业务发展需求，进行市场调研和竞争对手分析，制定有效的销售计划，确保销售目标的达成；3. 与供应商建立良好的合作关系，谈判采购价格和合同条款，确保供应链的稳定性和成本优势；4. 负责销售团队的培训和激励，提升团队的销售能力和业绩表现，营造积极向上的工作氛围；5. 定期分析销售数据，...,互联网,http://jobs.zhaopin.com/CC192921310J40816187809.htm,10000人以上,2026-01-11 00:08:20,25000.0,50000.0,20.0
抖音直播运营操盘手（奶片/牛肉干）,北京,内蒙古叮叮电子商务有限公司,大专,5-10年,"抖音,快手,小红书,电商类",30000-50000,此岗位工作地点在呼和浩特市，此岗位工作地点在呼和浩特市，此岗位工作地点在呼和浩特市， 关于我们： 内蒙古集众合健康产业科技公司成立于 2009 年，经过十多年的发展，已经发展成集产品研发、包装设计、产品生产、营销策划、物流配送和企业服务为一体的全渠道运营集团企业，企业旗下拥有 9 个子公司，包括生产基地 5 个、研究院 1 个、检测中心 2 个、品牌运营 1 个，通过传统电商、渠道电商、直播电商等...,电子商务,http://jobs.zhaopin.com/CC852860870J40864722612.htm,100-299人,2026-01-09 10:44:17,30000.0,50000.0,12.0
业务分析组负责人,北京,北京三快在线科技有限公司,本科,5-10年,,,美团酒店旅行业务涵盖酒店、民宿、机票、火车票、旅游度假、景点门票等各类住行游品类，通过与产业上下游的深度合作，为用户提供美好的旅游旅行体验。我们积极打造AI友好型组织，使用AI等新技术提升旅游服务的供需匹配效率，更好满足用户个性化、多样化的出游需求。我们持续深耕产业链，用数字化服务助力实体商家高质量经营，探索自有品牌等供给新模式，打造健康的商家生态，保障用户服务体验。为满足用户日益增长的跨境旅行需...,互联网,http://jobs.zhaopin.com/CC383625320J40761840109.htm,10000人以上,2026-01-11 08:45:21,,,
即时配送城市运营负责人,北京,京东集团,本科,5-10年,,25000-50000,岗位职责：1.负责城市全域业务的整体运营，依据业绩目标制定并实施达成计划，处理突发危机，确保合规运营；2.负责城市全域订单履约率及配送时效达标，制定并实施恶劣天气、高峰期运力保障预案；优化单均配送成本（如配送成本、补贴策略），提升运营效益；3.负责城市骑手生态运营，确保运力稳定（如恶劣天气、高峰期弹性调度），优化骑手体验，降低流失率；4.管理城市运营团队，基于构建高效团队目标，通过识别和培养关键人...,互联网,http://jobs.zhaopin.com/CC192921310J40818977109.htm,10000人以上,2026-01-11 00:08:00,25000.0,50000.0,16.0
运营绩效总监(J11292),北京,宁波容百新能源科技股份有限公司,本科,5-10年,经营运营,30000-50000,岗位职责:职位描述：1、承接集团战略，根据各部门的经营计划拟定公司年度经营计划，协同财务编制战略预算并动态刷新，明确目标与资源配置；2、跟进各事业部中长期业绩，分析产业投入产出，推动新产业落地、优化低效产业；3、建立经营计划与预算执行跟踪机制，协调解决跨组织运营问题；4、归集分析集团经营数据，编制经营报告，组织经营会议，支撑经营管理专委会运作；5、主导高管及一级部门 KPI 制定、绩效考核，输出结...,新能源,http://jobs.zhaopin.com/CC340246130J40746047906.htm,1000-9999人,2026-01-09 09:08:50,30000.0,50000.0,12.0
配送运营专家 Delivery Operations Specialist,北京,北京三快在线科技有限公司,本科,1-3年,,,Keeta是全球领先的外卖平台美团旗下独立品牌，专注于国际市场的餐饮与商品即时配送服务，致力推进全球市场的创新发展，实践“帮大家吃得更好，生活更好”的公司使命。我们于2023年从中国香港起步，不到一年便成为当地行业的领跑者。紧接着，我们在2024年快速进入沙特阿拉伯，现已覆盖20余城。2025年我们继续提速，在短短40天内接连开拓卡塔尔、科威特和阿联酋。随后我们登陆巴西，以桑托斯和圣维森特为试点，...,互联网,http://jobs.zhaopin.com/CC383625320J40781380409.htm,10000人以上,2026-01-11 08:42:43,,,
新媒体用户增长负责人,北京,北京嘉护在线科技发展有限公司,本科,3-5年,"视频平台,C端用户,知识/教育平台,用户增长,新媒体用户增长,成人职业教育,UG中台",30000-50000,岗位职责:1、负责(母婴服务职业技能培训)和孕产妇，用户数量的获取、增长和活跃度提升，给销售提供意向客户线索。2、作为 UG 中台以全行业的视角为各项目团队持续赋能 ，沉淀可复用工作方法论 ，促进各项目平稳交付。3、以品牌建设和私域流量转化为目标 ，以抖音号为主带领团队根据平台属性通过账号定位、创意策划 ，账号运营动作实现账号增粉，重点关注粉丝增长，互动率，私域转化等指标。任职要求:1、统招本科及...,在线医疗,http://jobs.zhaopin.com/CCL1413111250J40729291407.htm,300-499人,2026-01-07 17:00:45,30000.0,50000.0,12.0
企业运营总监/副总,北京,北京好人好事人力资源有限公司,本科,3-5年,"toB,研发管理,项目管理,经营计划",30000-50000,该公司属于仪器仪表行业，在行业内有核心技术规模100人，经营比较稳定，以JP为主，航天，航空，中船，兵器等，工业行业正在进入。需要一名运营总，帮助将公司的内部流程，制度梳理好，在企业搭建第二曲线的过程中利用自己的专业能力协调好各部门，各模块做好项目管理、采购管理、物资管理、人力资源、行政管理。能够组织召开经营计划化会。要求：1、统招本科以上学历最好是211以上；2、有研产销一体，最好JG行业工作经...,人力资源服务,http://jobs.zhaopin.com/CC890014030J40835635314.htm,100-299人,2026-01-07 14:42:29,30000.0,50000.0,14.0
Rider Care and Rider Public Opinion Monitoring Expert,北京,北京三快在线科技有限公司,本科,1-3年,,,Keeta是全球领先的外卖平台美团旗下独立品牌，专注于国际市场的餐饮与商品即时配送服务，致力推进全球市场的创新发展，实践“帮大家吃得更好，生活更好”的公司使命。我们于2023年从中国香港起步，不到一年便成为当地行业的领跑者。紧接着，我们在2024年快速进入沙特阿拉伯，现已覆盖20余城。2025年我们继续提速，在短短40天内接连开拓卡塔尔、科威特和阿联酋。随后我们登陆巴西，以桑托斯和圣维森特为试点，...,互联网,http://jobs.zhaopin.com/CC383625320J40813998509.htm,10000人以上,2026-01-11 08:38:16,,,
运营总监,北京,北京兆福基新材料科技发展有限公司,本科,5-10年,"销售运营,数据运营,品牌运营,toB,toC,toG",35000-50000,运营总监招聘一、岗位基本信息岗位名称：运营总监薪资范围：面议/40-60工作地点：公司总部 + 全国市场出差业务领域：预应力及相关专业技术领域学历与专业：本科及以上学历，结构工程、工民建、市场营销等相关专业优先；8 年以上运营管理经验，3 年以上类似岗位工作经验。专业能力：精通建筑行业工程招投标、经销商管理等核心业务，具备丰富的铁路、基建大客户资源者优先；具备敏锐的行业趋势洞察力，能基于政策变化快...,新材料,http://jobs.zhaopin.com/CC242228980J40978275204.htm,20-99人,2026-01-06 14:46:11,35000.0,50000.0,12.0
线上营销运营总监,北京,铸诚集团,本科,5-10年,"新媒体运营,产品运营,工业产品,toB,内容运营,建筑,医疗",30000-50000,岗位核心职责1. 主导装配式建筑、智慧医院整装等To B业务的新媒体矩阵搭建与运营，制定年度/季度运营策略，助力品牌提升与招商线索转化。2. 统筹内容创作与渠道投放，产出技术科普、项目案例等优质内容，优化投放效果，对曝光、转化等核心指标负责。3. 管理新媒体团队，协调研发、生产、销售等跨部门资源，管控运营预算，配合企业上市品牌形象建设。4. 跟踪运营数据，分析竞品策略，持续优化内容与投放方向，推动...,金属制品业,http://jobs.zhaopin.com/CC141308800J40863308212.htm,500-999人,2025-12-25 13:11:47,30000.0,50000.0,12.0
新媒体达人矩阵运营,北京,北京三快在线科技有限公司,本科,1-3年,,,核心本地商业（Core Local Commerce）是美团“零售+科技”战略的重要载体，涵盖了到店餐饮、服务零售、酒店旅行、外卖、履约配送、闪购、医药健康等多个业务，覆盖了超过200个消费场景，致力于通过“随时随地”的商品和服务，满足消费者的多样性需求，帮大家吃得更好，生活更好。核心本地商业扎根本地消费，围绕消费者的“吃、住、行、游、购、娱”进行深度创新，引领发展了即时零售、团购等多种消费业态，...,互联网,http://jobs.zhaopin.com/CC383625320J40781602609.htm,10000人以上,2026-01-11 08:36:15,,,
集团肿瘤连锁运营总监董事长助理,北京,北京美欧赛奥金生物科技有限公司,硕士,5-10年,"战略管理,市场管理,招商管理,集团公司,政府资源",30000-50000,一、岗位职责1、统筹集团肿瘤连锁医院的日常运营，制定连锁化发展策略与执行计划，涵盖医院选址拓展、医疗服务标准化落地、诊疗流程优化、医护团队配置等，确保连锁医院运营方向与集团战略一致，推动医疗业务健康可持续发展。2、监控肿瘤连锁医院关键运营指标，定期分析运营数据，及时解决医院运营中的问题，保障连锁医院整体医疗服务水平与盈利水平。3、对内协调集团各职能部门及细胞板块，统筹连锁医院所需资源，解决跨部门协...,卫生服务,http://jobs.zhaopin.com/CC630061980J40842560813.htm,100-299人,2025-12-25 09:17:17,30000.0,50000.0,12.0
B2C用户运营岗,北京,云梦泽(北京)电子商务有限公司,本科,5-10年,,,岗位职责：1.负责云梦泽C端APP的用户增长，基于云梦泽平台端加油、充电、缴费等业务能力搭建用户增长策略，包括用户拉新，用户留存等2.设定用户增长目标，结合中国石油线上、线下不同场景制定新用户增长及流失用户召回策略，设计并搭建各类互动类营销工具，同时联动供给团队打造新人专属货盘，对进站用户进行新客转化3.深入分析用户需求，挖掘中国石油集团内外的用户增长机会，寻找并推动渠道合作，搭建系统化的分层触达...,电子商务,http://jobs.zhaopin.com/CCL1478504940J40907675608.htm,100-299人,2025-12-22 10:02:12,,,
产品运营专家 Product Operations Specialist,北京,北京三快在线科技有限公司,本科,1-3年,,,Keeta是全球领先的外卖平台美团旗下独立品牌，专注于国际市场的餐饮与商品即时配送服务，致力推进全球市场的创新发展，实践“帮大家吃得更好，生活更好”的公司使命。我们于2023年从中国香港起步，不到一年便成为当地行业的领跑者。紧接着，我们在2024年快速进入沙特阿拉伯，现已覆盖20余城。2025年我们继续提速，在短短40天内接连开拓卡塔尔、科威特和阿联酋。随后我们登陆巴西，以桑托斯和圣维森特为试点，...,互联网,http://jobs.zhaopin.com/CC383625320J40782646009.htm,10000人以上,2026-01-11 08:34:17,,,
销售专员,北京,中国人寿保险股份有限公司北京市海淀支公司,大专,经验不限,"面销/陌拜,销售专员",26000-50000,我们正在寻找一位经验丰富的销售顾问，负责为公司带来稳定的销售增长。工作内容：1.开展市场调研，分析客户需求；2.制定销售策略，完成销售目标；3.维护客户关系，提供专业服务；4.跟进销售订单，确保客户满意度。岗位要求：1.大专及以上学历；2.销售工作经验，有成功案例者优先；3.良好的沟通能力和谈判技巧；4.具备较强的市场敏感度和分析能力；5.有责任心，团队协作精神，能承受一定的工作压力。,保险,http://jobs.zhaopin.com/CC227127010J40817437007.htm,10000人以上,2025-12-16 16:30:32,26000.0,50000.0,12.0
B2C活动运营岗,北京,云梦泽(北京)电子商务有限公司,本科,5-10年,,,岗位职责：1.负责电商平台活动策划、执行及优化，包括但不限于大促、日常促销、补贴活动等，提升用户活跃度及转化率；2.深入理解电商运营逻辑，合理制定补贴策略，监控ROI、GMV、转化率等核心指标，确保活动效果；3.独立完成活动页面的搭建与配置，协调设计、开发等团队推进活动上线；4.对运营数据进行监控与分析，通过SQL、Excel等工具提取数据，定位问题并提出优化方案；5.熟悉移动互联网产品逻辑及数据...,电子商务,http://jobs.zhaopin.com/CCL1478504940J40907669408.htm,100-299人,2025-12-22 09:53:40,,,
中医行业用户运营,北京,北京三快在线科技有限公司,本科,3-5年,,,美团医药健康事业部是美团核心本地商业板块下专注健康领域的业务部门，涵盖美团买药、美团医美和美团医疗三大业务。自创立以来，美团医药健康致力于为用户提供全健康周期产品及服务，满足人民群众多层次多元化医疗健康需求，现已覆盖购药到家、居家检测、问诊挂号、医保支付、求医寻院、医疗美容等核心场景。此外，美团医药健康还为商户提供数字化转型创新解决方案，打造贯穿上游的联动机制，长期参与共建更透明、更可持续的医药健...,互联网,http://jobs.zhaopin.com/CC383625320J40700127809.htm,10000人以上,2026-01-11 08:27:20,,,
电商运营总监,北京,妙飞江苏食品科技有限公司,大专,5-10年,,30000-50000,一、技能要求：平台运营、活动运营、网络推广、用户运营、电商管理二、岗位职责：1、全面负责公司电商业务的运营工作，参与公司战略制定，负责平台运营策略制订与执行；2、能够准确的把握移动互联网用户体验，确定业务主导思想和主题方向，根据整体运营规划制定内容建设、推广运营策略，并提出长期发展规划；3、带领团队完成运营指标，实现线上推广目标，定期出具运营分析报告，分析公司运营数据，优化和提高公司运营流程和效率...,快速消费品,http://jobs.zhaopin.com/CC890511110J40910068115.htm,100-299人,2025-12-13 10:04:16,30000.0,50000.0,12.0
B2C商品运营岗,北京,云梦泽(北京)电子商务有限公司,本科,3-5年,,,"岗位职责：1.商品规划与策略。负责类目商品结构规划，制定上新、汰换策略，优化SKU效率。分析市场趋势、竞品动态及用户需求，制定商品定价、促销及爆款打造策略；2.供应链协同（自营平台适用）。联动采购、供应商管理团队，确保库存健康（周转率、滞销率控制）。推动商品备货计划，协调大促期间供应链资源保障。""3.流量与转化优化。协同流量运营团队，制定商品搜索、推荐、活动坑位策略，提升曝光转化率。通过A/B测试...",电子商务,http://jobs.zhaopin.com/CCL1478504940J40907668508.htm,100-299人,2025-12-22 09:51:37,,,
旅游度假-用户运营（渠道增长）,北京,北京三快在线科技有限公司,本科,1-3年,,,美团酒店旅行业务涵盖酒店、民宿、机票、火车票、旅游度假、景点门票等各类住行游品类，通过与产业上下游的深度合作，为用户提供美好的旅游旅行体验。我们积极打造AI友好型组织，使用AI等新技术提升旅游服务的供需匹配效率，更好满足用户个性化、多样化的出游需求。我们持续深耕产业链，用数字化服务助力实体商家高质量经营，探索自有品牌等供给新模式，打造健康的商家生态，保障用户服务体验。为满足用户日益增长的跨境旅行需...,互联网,http://jobs.zhaopin.com/CC383625320J40763795709.htm,10000人以上,2026-01-11 08:25:55,,,
运营工程师,北京,科益虹源,本科,1-3年,"项目信息管理,项目计划监控,项目运作协助",25000-50000,1、运营支撑：① 结合半导体行业技术迭代趋势与市场竞争格局，支撑组织制定公司中长期运营战略，牵头优化业务流程与组织架构，推动运营效率与市场竞争力双提升。② 深度参与经营决策，负责运营成本管控、利润目标拆解，推动营收与利润率双向增长。③ 建立规范、高效的运营管理体系，支撑组织战略分解到重点工作导出，以及战略执行落地。④ 定期输出运营管理报告，并通过持续改进，不断提高公司整体运营效率；对工作质量及目标...,电子/半导体/集成电路,http://jobs.zhaopin.com/CC424343330J40761643007.htm,300-499人,2025-12-09 11:05:49,25000.0,50000.0,12.0
B2C策略运营岗,北京,云梦泽(北京)电子商务有限公司,本科,3-5年,,,岗位职责：1、深入理解电商各业务模块，搭建经营分析体系，负责多维度定期经营分析报告；2、负责对数据进行处理、分析、建模和预测，对相关数据进行深度挖掘分析，产生有价值的商业洞察，并转换为可执行的业务策略；3、基于外部市场分析与内部业务监控，开展用户行为、营销效果等专题分析，定位问题并提出解决方案；4、协助业务部门进行策略制定与拆解，通过策略制定、数据反馈等方式，不断改善业务结果，提升业务效率；5、负...,电子商务,http://jobs.zhaopin.com/CCL1478504940J40907667308.htm,100-299人,2025-12-22 09:49:37,,,
医美及医疗用户增长策略专家,北京,北京三快在线科技有限公司,本科,3-5年,,,美团医药健康事业部是美团核心本地商业板块下专注健康领域的业务部门，涵盖美团买药、美团医美和美团医疗三大业务。自创立以来，美团医药健康致力于为用户提供全健康周期产品及服务，满足人民群众多层次多元化医疗健康需求，现已覆盖购药到家、居家检测、问诊挂号、医保支付、求医寻院、医疗美容等核心场景。此外，美团医药健康还为商户提供数字化转型创新解决方案，打造贯穿上游的联动机制，长期参与共建更透明、更可持续的医药健...,互联网,http://jobs.zhaopin.com/CC383625320J40762961509.htm,10000人以上,2026-01-11 08:25:32,,,
业务经营分析（垂直APP群组）-CQC,北京,字节跳动,本科,3-5年,,25000-50000,岗位职责：1、目标管理与业务盘点：负责群组目标管理方案的设计与下沉，确保目标合理并落实过程管理；周期性开展全局业务及人员盘点，推动组织目标有效达成；2、业务分析与风险洞察：深入业务一线，识别在安全、质量、风险、体验、成本等方面的风险与机会点；协同中台推动横向项目落地，确保业务拿到实际成果；3、数据运营与绩效核算：负责群组绩效核算、运维及复盘，优化核算方案并支持产品迭代；管理工时、考勤、排班等基础运...,互联网,http://jobs.zhaopin.com/CC469217510J40812677601.htm,10000人以上,2025-12-08 10:37:46,25000.0,50000.0,12.0
PC电商运营总监,北京,上海能良电子科技有限公司,本科,10年以上,"京东,拼多多,淘宝/天猫,经理,总监,国代,厂商",30000-50000,岗位职责：1. 全面负责京东平台PC类目战略级店铺运营，制定并实施年GMV增长的运营规划 2. 主导与品牌厂商、平台方的商务谈判 3. 搭建精细化库存管理体系，提高库存周转率 4. 管理运营团队，培养可独立操盘千万级项目的骨干成员 5. 建立行业情报监测体系，每月输出深度竞品分析报告 任职要求：1. 京东平台8年及以上核心品类运营经验 2. 具备PC行业头部品牌厂商/国代/平台方高层人脉资源3. ...,互联网,http://jobs.zhaopin.com/CC637353830J40816508609.htm,500-999人,2025-12-04 15:54:02,30000.0,50000.0,15.0
履约-运力策略运营leader,北京,北京三快在线科技有限公司,本科,3-5年,,,美团配送是以科技为内核的即时物流品牌，利用高效、稳定、广阔的配送网络和前沿科技能力为各行业客户提供涵盖商流物流一体化、流量赋能、行业定制化即时配送、末端配送、前置仓等服务在内的全方位同城物流综合解决方案。作为科技创新和智慧物流的实践者，美团配送在人工智能（AI）、5G应用、物联网（IoT）、云计算等多维度不断探索科创蓝海，让同城物流进入数智化时代。美团配送在IoT智能设备、外卖柜、换电网络、无人配...,互联网,http://jobs.zhaopin.com/CC383625320J40745432509.htm,10000人以上,2026-01-11 08:00:03,,,
