职位,城市,公司,学历,经验,技能,薪资,工作描述,行业,职位URL,公司规模,发布时间
信号处理算法工程师,成都,成都蓝色起源科技有限公司,本科,3-5年,"信号处理,无线通信,C++,数字信号,MATLAB",2.5-4万·14薪,蓝色起源是国内领先的无线通信信号处理高科技企业，近年业务高速发展，未来市场前景广阔。公司提供具备行业竞争力的薪酬、福利体系，多通道职业发展晋升体系，行业精英、大牛带队的人才培养体系，优越的办公环境，便利的交通条件，宽松快乐的工作氛围。诚邀行业优秀人才加入团队。福利待遇：1、 薪资收入：富有行业竞争力的薪酬体系，含固定月薪、年终奖、项目奖金及合伙持股激励；2、 工作时间：周一至周五9:00-18:0...,计算机软件,http://jobs.zhaopin.com/CC457008130J40261544116.htm,20-99人,2025-07-18 10:34:11
【高层次人才引进】AI开发工程师,成都,东方电气风电股份有限公司,博士,经验不限,,2.5-4万,工作内容：1. 架构设计与技术预研：负责公司大模型应用技术体系的顶层设计和演进路线规划（目前已有70B本地部署大模型），主导、跟进下一代AI应用的核心架构。2. 前沿算法探索： 跟踪并研究最新的LLM技术，包括但不限于高效微调（如QLoRA、DoRA）、检索增强生成（RAG）的先进策略（如HyDE、Self-RAG）、长上下文处理、Agent智能体以及多模态融合等。3. 核心难题攻坚： 领导团队解...,通用设备制造,http://jobs.zhaopin.com/CC271793780J40752897901.htm,1000-9999人,2025-07-16 16:05:39
感知算法工程师,成都,成都路桥,硕士,3-5年,"C++,Python,智能驾驶",2-4万,岗位职责:1、负责基于Camera/Lidar/RGBD等机器上传感器的深度学习感知算法维护和优化，包括目标检测，分割，多目标跟踪等；2、负责各场景下，基于视觉的深度学习感知调研，方案制定，算法开发，模型优化和部署；3、负责机器人感知算法前沿技术调研，提前进行相关算法布局；4、了解vslam框架，熟悉SuperPoint、SuperGlue等图像特征点检测和匹配网络；5、能熟练部署模型到arm平台...,房地产开发,http://jobs.zhaopin.com/CC336773110J40792956305.htm,1000-9999人,2025-07-11 10:57:10
对日开发初级技术员到项目经理的全职位招聘,成都,株式会社ProfaceSystems,大专,1-3年,".NET,Java,Python,C语言,全栈开发,AI,对日,赴日",2-4万,【会社概要】当社は、公共事業や受託開発、SES型開発を中心に、AIなどの先端技術を活用した新規マーケットの開拓も行っています。また、ITマネジメント人材の育成、組織運営、経営への参画など、幅広い開発環境・業務領域を提供しています。多様なプロジェクトを通じて、あなたの経験・スキル・可能性を最大限に発揮できるポジションをご用意しております。本公司以公共事业、委托开发和SES模式开发为核心业务，同时也积...,计算机软件,http://jobs.zhaopin.com/CC579165780J40398769813.htm,20-99人,2025-07-09 09:49:53
存储软件研发工程师,成都,中兴通讯(成都)有限责任公司,本科,经验不限,"Python,C语言,Linux开发",2-4万·15薪,岗位职责:1. 负责存储系统、文件系统相关的软件设计与开发工作；2. 负责云环境下的存储相关问题分析、性能调优等工作。技能要求:1. 熟练掌握 C/C++/Python 语言，熟悉 Linux Shell 脚本，具备较为丰富的编程经验；2. 熟悉 Linux 系统内核，有内核态组件或驱动开发经验；3. 熟悉 Linux 文件系统、有内核文件系统开发经验；4. 了解云计算相关技术、了解 openst...,通信/网络设备,http://jobs.zhaopin.com/CCL1501704850J40819763008.htm,10000人以上,2025-07-02 16:36:53
AI开发工程师,成都,成都三环科技有限公司,本科,1-3年,"大模型算法,多模态算法,深度学习,Python,Java",2-4万·13薪,【工作职责】1.跟踪主流开源大模型（如 GPT 、 LLaMA 、 DeepSeek 、 Qwen 等）技术演进，结合业务场景进行模型预训练、微调与定制化开发；2.负责大模型在对话系统、代码生成、知识问答、智能写作等方向的应用落地；3.与产品、工程、行业专家紧密协作，实现语言模型在实际业务中的高性能部署与持续优化；【任职要求】1.计算机、人工智能、数学等相关专业本科及以上学历；2.深入理解 Tra...,电子/半导体/集成电路,http://jobs.zhaopin.com/CCL1411331550J40780917703.htm,10000人以上,2025-06-23 16:10:29
能源/工业人工智能研究员(J10017),成都,清华四川能源互联网研究院,博士,经验不限,"深度学习,多模态算法,大模型算法,机器视觉,自然语言处理,知识图谱,PyTorch,TensorFlow,OpenCV",2.5-4万,岗位职责: 1. 从事工业行业（包括但不限于能源、装备制造等领域）的数据分析及相关工作，旨在利用数据分析、人工智能技术解决典型的行业挑战；2. 从行业的业务需求出发，抽象出本质问题，建模并实现算法；3. 基于数据分析工具，实现高效的数据分析算法；4. 带领团队，实现行业/企业的数据分析项目的实施。 博士研究员工作概述：主要承担科研方面的工作，后续在研究方向上拿主意，出paper，做科研牵头人，有比...,矿产/采掘,http://jobs.zhaopin.com/CC336758630J40672445906.htm,100-299人,2025-06-16 12:02:34
多物理场耦合研发工程师,成都,英特工程仿真技术(大连)有限公司,硕士,3-5年,"C++,多物理场耦合,耦合接口,数据映射",2-4万,岗位职责：1.消化并维护公司已有多物理场耦合仿真控制器代码；2.基于已有功能研究耦合技术体系，方向包括耦合控制技术、求解器间通信与数据传递技术、映射插值技术、收敛控制技术等；3.协调各物理场对接耦合控制器，并对相关产品及案例的问题进行调试梳理；4.对于变量传递和文件传递两种方式的耦合功能进行开发与维护；5.针对工程问题，基于已有基础开发拓展耦合仿真功能。任职要求：1.具有硕士及以上学历，计算数学/...,计算机软件,http://jobs.zhaopin.com/CC204304420J40714693016.htm,100-299人,2025-05-21 09:05:24
后端研发工程师（Agent中台方向）-生活服务,成都,字节跳动,本科,5-10年,,2.8-3.6万,岗位职责：1、负责Agent系统的稳定性建设，设计高可用架构与容灾降级方案，保障系统在极端场景下稳定运行；2、优化系统性能，解决分布式场景下的任务调度、数据一致性、故障自愈等挑战，提升服务SLA；3、建立系统监控、告警及应急响应机制，负责重大故障的排查与恢复；4、持续优化系统架构，通过代码重构、性能调优等手段提升系统扩展性与可维护性；5、探索分布式计算、任务调度、流式数据处理等领域的前沿技术（如分...,互联网,http://jobs.zhaopin.com/CC469217510J40710919801.htm,10000人以上,2025-09-09 10:04:43
NLP/CV/语音/深度学习/算法岗,成都,外企德科数字技术有限公司,本科,经验不限,"PyTorch,TensorFlow,Python,C++,C#,OpenCV,自然语言处理,机器视觉,知识图谱,深度学习,机器学习,图像算法,Transformer,DNN,LSTM,K-means算法,随机森林,SVM,ViT,CLIP,VGGNet",1.8-3.5万·16薪,岗位职责描述:1、根据业务场景，负责AIGC、多模态、预训练模型NLP、OCR、AIOPS等AI算法和模型研究和调优，支撑AI应用运行2、协助及独立完成机器学习/深度学习算法编码，完成数据清洗，特征提取工作。包括对文本分类及目标检测、图像识别进行采集、整理、清洗、标注及审核。3、按时保质完成上级安排工作任职要求:1、本科及以上学历，精通python等各种编程语言（语言不限制），具有python等各...,专业技术服务,http://jobs.zhaopin.com/CCL1480117890J40833282105.htm,10000人以上,2026-01-11 00:26:49
计算机视觉工程师,成都,南阳翰格信息咨询有限公司,本科,3-5年,"图像处理,缺陷检测,模式识别",2-3.5万·14薪,岗位职责运用计算机视觉、图像处理、数学建模、数值分析、AI和优化相关知识，负责有关3D图像重建，自动缺陷检测和自动对准定位技术，图像理解，模式识别等计算机视觉技术的研究任职要求任职资格： 1、数学/计算机科学与技术/信息工程/电子/自动化相关专业，本科及以上学历 2、掌握C语言/C++编程及图像处理相关知识 3、有计算机视觉相关背景 4、工作地点：成都 5、具有4年以上的工作经验的优先,咨询服务,http://jobs.zhaopin.com/CCL1411120670J40786370916.htm,500-999人,2026-01-09 14:38:29
CV算法工程师,成都,四川长虹电子控股集团有限公司,硕士,3-5年,"深度学习,机器学习,图像算法",面议,1.岗位职责（1）负责面向机器人场景的3D环境感知算法研发，包括物体的检测、分类、位姿估计与多目标跟踪（MOT）；（2）设计并实现多传感器（Camera、LiDAR、Radar、IMU等）时空对齐与前/后融合感知系统，提升环境理解的鲁棒性与精度；（3）推进先进感知模型（如BEV感知、Occupancy Network、多模态Transformer等）的开发、训练、量化与端侧部署；（4）与系统、控制...,电子设备制造,http://jobs.zhaopin.com/CC285896080J40910886808.htm,10000人以上,2026-01-09 13:55:21
NLP/CV/语音/深度学习/算法岗（接受应届+考研失败）,成都,外企德科数字技术有限公司,本科,经验不限,"Java,Python,C++,C语言,主题模型,PyTorch",1.8-3.5万·16薪,岗位职责描述:1、根据业务场景，负责AIGC、多模态、预训练模型NLP、OCR、AIOPS等AI算法和模型研究和调优，支撑AI应用运行2、协助及独立完成机器学习/深度学习算法编码，完成数据清洗，特征提取工作。包括对文本分类及目标检测、图像识别进行采集、整理、清洗、标注及审核。3、按时保质完成上级安排工作任职要求:1、本科及以上学历，精通python等各种编程语言（语言不限制），具有python等各...,专业技术服务,http://jobs.zhaopin.com/CCL1480117890J40832915605.htm,10000人以上,2026-01-11 00:26:47
点云感知算法工程师,成都,四川中科友成科技有限公司,硕士,1-3年,"激光雷达点云,3D点云,点云建模",2-3.5万,岗位职责：1.负责激光传感器数据的采集、处理及辅助标定;2.负责研发三维工业检测场景激光点云深度学习检测以及分割模型;3.负责研发三维工业检测场景激光点云配准融合法;4.负责相关算法工程化和加速优化工作。任职要求：1.计算机、控制、电子、应用数学等相关专业的硕士或以上学历，2年以上工作经验;2.熟悉激光点云特征提取、分割、配准、物体检测等相关技术之一;3.熟悉激光点云SLAM 以及配准等相关技术之...,电子设备制造,http://jobs.zhaopin.com/CC582446330J40804573814.htm,100-299人,2026-01-09 13:32:37
高级算法工程师,成都,四川惠蕾网络科技有限公司,硕士,5-10年,深度学习,2-3.5万,岗位职责：1、利用数据挖掘/机器学习/深度学习等相关算法，解决零售核心智能化业务需求; 相关技术场景主要包括：供应链需求预测、商品调拨及配送调度（运筹优化方向），智能定价/调价、商品标签预测等。2、跟踪AI前沿技术动态，探索大模型与业务结合的场景，如智能问答、用药咨询等；熟悉大模型基础技术，熟练应用前沿 AIGC工具，熟悉Prompt工程设计，AI Agent设计、RAG框架设计及研发；3、参与业...,广播/影视,http://jobs.zhaopin.com/CCL1226328750J40910839408.htm,20-99人,2026-01-09 10:45:37
软件开发工程师（多语言/地点可选/可小白）,成都,外企德科数字技术有限公司,本科,经验不限,"Java,Python,C语言,嵌入式开发",1.8-3.5万·16薪,职位描述在这里，你将从事IT应用层软件、分布式云化软件、互联网软件等的设计开发，可以采用敏捷、Devops、开源等先进的软件设计开发模式，接触最前沿的产品和软件技术，成为大容量高并发技术的专家；你将参与产品的软件研发工作，包括但不限于：（1）完成从客户需求到软件产品定义、架构设计、开发实现、再到上线运营维护等产品生命周期中的各个环节；（2）创造性解决产品在实现过程中的技术难题，应用前沿技术提升产品...,专业技术服务,http://jobs.zhaopin.com/CCL1480117890J40681948205.htm,10000人以上,2026-01-11 00:24:25
机器视觉算法工程师,成都,歌尔股份,硕士,3-5年,"机器人,OpenCV",2-3.5万·15薪,岗位职责：①负责自动化装备视觉硬件的需求分析、物料选型及测试②负责视觉算法的需求分析、方案制定、开发测试及维护③负责标准化算法平台开发，高性能算法模块的优化④负责项目开发与试验过程中视觉/算法的数据处理、问题分析、解决方案制定任职要求：①光电信息/电子信息/计算机类硕士及以上学历，具有优秀的光学背景优先；②熟悉工业相机/镜头/光源等视觉硬件参数及性能③具有丰富的图像处理算法开发经验，熟练掌握传统图...,电子/半导体/集成电路,http://jobs.zhaopin.com/CC132726540J40742577306.htm,10000人以上,2026-01-07 01:15:49
软件开发工程师（求解器）,成都,华大九天,硕士,经验不限,"C++,PETSC",1.8-3.5万·15薪,岗位职责：1.研究和优化大型线性方程组求解器;2.研究和优化线性方程组求解的迭代算法和预处理方法;3.研究和优化多物理场问题数值求解方法。 任职要求：1.计算机，计算数学，相关专业，硕士以上学历，博士优先；2.熟悉C/C++软件开发；3.熟悉偏微分方程数值解法及线性/非线性方程组数值解法; 4.有高性能计算开发经验者优先。,计算机软件,http://jobs.zhaopin.com/CC284828810J40866076312.htm,1000-9999人,2026-01-05 14:40:43
算法工程师,成都,成都极客未来教育科技有限公司,本科,3-5年,"搜索/推荐算法,大模型算法,Python,推荐系统,AI算法",2.5-3.5万,工作职责：1、参与需求沟通分析、负责详细设计、编码以及相关文档撰写；2、负责业务流程的数学抽象、核心需求的算法设计、行业相关技术的论文追踪； 3、具备独立解决核心问题的能力，包括问题定位，方法研究等； 4、优化提升既有项目，进行技术提升与用户体验优化。任职资格：1、双一流大学理工科本科以上学历，硕士、计算机、数学专业优先； 2、3年以上相关算法项目实践经验，NLP、ML、DL或运筹优化相关领域优先...,培训/辅导服务,http://jobs.zhaopin.com/CC538265030J40821225209.htm,1000-9999人,2025-12-30 17:06:48
感知算法工程师,成都,歌尔股份,硕士,3-5年,"感知算法,机器人",2-3.5万·14薪,岗位职责：1、负责面向机器人场景的3D环境感知算法研发，包括障碍物的检测、分类、位姿估计与多目标跟踪（MOT）；2、设计并实现多传感器（Camera、LiDAR、Radar、IMU等）时空对齐与前/后融合感知系统，提升环境理解的鲁棒性与精度；3、推进先进感知模型（如BEV感知、Occupancy Network、多模态Transformer等）的开发、训练、量化与端侧部署；4、与系统、控制、AI团...,电子/半导体/集成电路,http://jobs.zhaopin.com/CC132726540J40744779506.htm,10000人以上,2025-12-31 13:26:39
音频编码工程师/高级音频算法,成都,成都水月雨科技有限公司,硕士,3-5年,"机器学习,多模态算法,C++,C#,Python,Keras",2.5-3.5万,岗位职责1、深入研究音频编码领域的前沿算法和技术趋势，评估其性能潜力和应用价值。2、主导设计、原型实现和性能优化创新的音频编解码算法及核心工具。3、负责定义和设计高性能、高效率、可扩展的音频编解码系统架构。4、负责向技术领导层、管理层及执行团队清晰阐述技术愿景、战略规划、项目进展和成果价值。5、提供技术指导和支持，解决产品开发中遇到的复杂音频编解码技术难题。6、与知识产权团队紧密协作，识别创新点，...,电子/半导体/集成电路,http://jobs.zhaopin.com/CC510713180J40745139909.htm,100-299人,2025-12-26 00:13:22
研发总监/副总监,成都,佑赛科技,硕士,3-5年,"压缩空气储能,储能系统,非补燃式系统",2.5-3.5万,岗位职责： 1、负责部门压储工艺的研发工作，主导技术创新与工艺优化，提升研发技术水平和产品竞争力；2、统筹公司研发管理工作，制定研发战略规划和年度研发计划，确保与公司整体战略目标一致；3、全面把控研发项目进度、成本与质量，建立并完善研发管理体系，推动研发工作高效、规范运行；4、组织压储技术方向的前瞻性研究，主导关键技术攻关，确保公司在压储领域的持续创新能力；5、为公司经营计划的实现提供技术支持和决...,电力/水利/热力/燃气,http://jobs.zhaopin.com/CC415887220J40910388815.htm,300-499人,2025-12-15 15:45:58
AI算法部署工程师,成都,振芯科技,硕士,1-3年,"图像算法,C++",2.5-3.5万,岗位职责：1.调研、分析重点用户应用方案，了解其发展趋势及需求，形成调研报告；2.为客户提供一线的远程或现场技术支持，收集反馈意见，输出对芯片迭代升级建议的反馈报告；3.负责将各种AI模型转换到目标SOC平台的移植、部署、优化工作；4.根据自研SOC芯片进行算子开发与适配工作，分析端侧AI算法应用的各种延迟、存储、带宽瓶颈，归纳现有问题并提出优化方案；5.参与AI部署工具链的开发与维护。任职资格：...,电子/半导体/集成电路,http://jobs.zhaopin.com/CC665384420J40879367308.htm,500-999人,2025-12-11 00:36:01
C++ 测向算法工程师（干涉仪 / GPU 加速方向）,成都,成都华力创通科技有限公司,硕士,3-5年,,2-3.5万,岗位职责1.测向算法研发与实现负责干涉仪测向、比幅测向、比相测向等核心算法的理论研究、C++ 建模与工程化实现，包括初测、精测及解模糊算法的设计与优化。基于 CUDA 技术实现测向算法的GPU 加速解算，提升大规模数据处理的实时性与效率。2.系统集成与仪器控制参与测向系统的仪器控制模块开发，实现硬件设备（如接收机、天线阵）的通信与控制逻辑，保障信号采集与测向流程的闭环。对接 FPGA、嵌入式系统或...,电子/半导体/集成电路,http://jobs.zhaopin.com/CC684223420J40901081815.htm,500-999人,2025-12-10 14:07:17
运筹优化算法工程师,成都,鲜生活冷链物流有限公司,本科,1-3年,"深度学习,调度,运筹优化",2-3.5万,一、岗位职责：1 核心算法研发与落地：主导冷链全链路算法模型的设计、搭建与迭代，聚焦智能调度、路径规划等，实现算法对业务的深度赋能。2 业务问题建模与解决：通过数据分析与算法建模形成可落地的优化方案3 算法工程化全流程管理：参与算法从设计、开发、测试到上线监控的全生命周期管理，将机器学习、时间序列分析等模型转化为生产级应用，保障算法在高并发场景下的稳定性与准确性，同时建立模型效果追踪机制，根据业务...,货运/物流/仓储,http://jobs.zhaopin.com/CC486350930J40828628914.htm,1000-9999人,2025-12-08 18:31:00
高级C++跨平台研发工程师,成都,谷英人才,本科,3-5年,"C#,Python",2.5-3.5万,岗位职责1. 负责 CAE 软件在 Windows、Linux 等操作系统上的适配、维护与性能优化，确保多平台版本功能一致、运行稳定；2. 负责 CAE 软件在 x86_64、ARM 等硬件架构上的移植与适配工作，分析并解决因架构、编译器等差异引发的编译及运行时问题；3. 与算法研发、测试等团队协作，定位和解决跨平台、多架构环境下的功能、性能及稳定性问题，保障产品质量与交付效率。任职资格1. 计算...,咨询服务,http://jobs.zhaopin.com/CC438861510J40847153913.htm,100-299人,2025-12-04 12:02:03
高级c++跨平台研发工程师,成都,四川中久数创科技有限公司,本科,3-5年,C语言,2.5-3.5万,岗位职责：1. 负责 CAE 软件在 Windows、Linux 等操作系统上的适配、维护与性能优化，确保多平台版本功能一致、运行稳定；2. 负责 CAE 软件在 x86_64、ARM 等硬件架构上的移植与适配工作，分析并解决因架构、编译器等差异引发的编译及运行时问题；3. 与算法研发、测试等团队协作，定位和解决跨平台、多架构环境下的功能、性能及稳定性问题，保障产品质量与交付效率。任职资格：1. ...,计算机软件,http://jobs.zhaopin.com/CCL1487355790J40810503111.htm,100-299人,2025-11-28 16:40:03
C++量化系统开发工程师,成都,四川君逸数码科技股份有限公司,本科,3-5年,"C++,Rust,系统开发,交易系统开发,券商开发",2.5-3.5万,注：此岗位为我公司上海子公司，上海兀隼科技有限公司人员招聘，后续工作地址为上海！！！岗位职责：1.参与低延迟交易系统核心模块开发，包括订单路由、行情接收、交易执行引擎等，基于 C++ 11+/RUST 实现高并发、低延迟的代码编写与优化；2.负责 T0 交易策略的技术落地，配合量化团队完成策略回测、实盘部署，解决策略执行中的性能瓶颈（如纳秒级延迟优化、内存管理优化）；3.参与跨市场交易接口适配（如...,计算机软件,http://jobs.zhaopin.com/CC341563180J40809605811.htm,100-299人,2025-11-26 16:43:07
算法工程师--语音前端信号处理方向,成都,成都启英泰伦科技有限公司,硕士,1-3年,"语音增强,语音信号处理,3A,多麦阵",1.8-3.5万·14薪,岗位职责：1.跟踪语音信号处理前沿技术，调研并复现最新算法。包括语音增强算法（单麦及麦克风阵列语音增强算法）、3A算法（AEC/ANC/AGC）、多麦阵算法、盲源分离、动态范围压缩算法、EQ均衡器、声音检测算法、声源定位算法等其中的一种或多种，并协同嵌入式开发团队完成算法到芯片的落地实现；2.针对低功耗芯片，设计低算力、低延迟场景的语音信号处理算法；3.参与现有算法调优，提升语音识别性能；4.支持...,电子/半导体/集成电路,http://jobs.zhaopin.com/CC422340680J40969111304.htm,20-99人,2025-11-25 14:29:44
软件工程师,成都,上海穹窿科技有限公司,本科,3-5年,"C#,C语言",2-3.5万·13薪,岗位职责：1、负责公司核心产品（桌面端/嵌入式端）的软件设计、开发、测试与维护工作。2、使用 Qt 框架和 C++ 语言，高效地实现复杂的图形用户界面（GUI）和业务逻辑。3、参与需求分析和技术方案设计，编写相关技术文档。4、进行代码审查，确保代码质量、性能、稳定性和可维护性。5、定位并解决开发和生产环境中的技术问题与性能瓶颈。6、与其他团队成员紧密协作，保证项目顺利交付。7、领导安排的其他工作。...,船舶/航空/航天/火车制造,http://jobs.zhaopin.com/CCL1319805290J40819849013.htm,100-299人,2025-11-13 11:07:01
AI 算法工程师,成都,成都蓝星智探科技有限公司,硕士,经验不限,"深度学习,图像算法,多模态算法",1.9-3.5万·13薪,职位描述作为核心研发成员，您将负责智能模型与 AI 系统的设计、优化与落地实施，推动人工智能在矿业与地质等实际业务场景中的应用。该岗位聚焦于模型应用与平台化建设，强调跨学科协作与工程落地能力。 主要职责1.负责智能模型的研发与应用，提升系统在不同业务场景下的识别、分析与预测能力。2.建立和维护高质量的数据体系，参与数据收集、整理与建模过程。3.推动 AI 系统的工程化落地，与后端开发团队协作，构建...,人工智能,http://jobs.zhaopin.com/CCL1512290600J40836300802.htm,20-99人,2025-10-18 00:00:01
软件平台技术专家,成都,成都鼎桥通信技术有限公司,本科,5-10年,"Go,微服务架构,全栈开发",2.5-3.5万,岗位职责：1、负责软件平台竞争力根据业务需求制定软件平台技术方案，包括系统架构设计，技术选型及规范制定2、技术攻关及平台性能优化通过深入研究，提高软件平台的运行效率和响应速度，解决项目中的技术难题及协调外部资源快速定位并处理问题3、团队协作与管理组建技术团队，做好人员管理，促进团队成员的技术交流和知识分享，提升团队整体技术实力4、行业动态跟踪关注产品技术趋势，分析竞争对手技术动态，推动技术创新任职...,通信/网络设备,http://jobs.zhaopin.com/CC451015510J40790256307.htm,1000-9999人,2025-09-03 15:37:45
