职位,城市,公司,学历,经验,技能,薪资,工作描述,行业,职位URL,公司规模,发布时间
资深算法工程师,成都,成都某信息通信科技公司（央企）,硕士,5-10年,资深算法工程师,4-8万,"岗位要求：1. 硕士研究生及以上学历，图像处理、自然语言处理、计算机视觉、机器学习相关专业，数学功底良好；2. 对以下几个领域中的一个或几个方向有深入理解：语言/视觉/多模态大模型、语言嵌入向量检索、图像增强与复原，图像特征提取，图像分割，目标识别，深度学习；3. 具有人工智能或工业智能领域从业5年以上技术或运营管理工作经验；4. 有大模型开发优化经验者有优先,熟悉LangChain、Prompt...",互联网,http://jobs.zhaopin.com/CCL1318355140J40788795403.htm,500-999人,2025-11-04 10:31:35
图像算法负责人,成都,成都主导科技有限责任公司,硕士,5-10年,"图像识别产品,Python,C++",5-8万·14薪,岗位职责：1、负责轨道交通检测场景（如轨道缺陷识别、接触网状态分析、车辆部件损伤检测等）的计算机视觉算法设计与优化，包括目标检测、图像分割、三维重建、时序分析等方向；2、攻克复杂环境（低光照、高噪声、动态模糊等）下的图像处理难题，提升算法在真实场景中的鲁棒性与实时性；3、探索深度学习模型轻量化、多传感器融合、小样本学习等技术在工业检测中的落地应用；4、参与制定轨道交通检测行业标准，推动技术成果专利...,仪器仪表制造,http://jobs.zhaopin.com/CC130508850J40756523212.htm,500-999人,2025-03-31 15:03:49
AI算法专家,成都,成都瀚辰光翼生物工程有限公司,硕士,5-10年,图像识别产品,4-7万,岗位职责：1、评估已实施视觉项目的方案稳定性、技术领先性，识别技术瓶颈点，优化模型算法、持续提升模型检测率；2、基于对AI技术发展趋势及业务需求，识别新场景，牵头确定需求方向和具体内容，确定模型算法选型及软件集成方案，满足各产品和业务需求；3、梳理搭建视觉模型训练平台架构、技术选型及算法构成，确定视觉模型、算法发展路线，引领相关底层基础技术的创新研发，培养视觉算法开发工程师；4、与其他团队合作，将...,医疗设备/器械,http://jobs.zhaopin.com/CC890127420J40754080515.htm,100-299人,2025-03-19 16:07:30
无人机制导控制算法工程师(A177987),成都,深圳市塞防科技有限公司,本科,1-3年,"飞控算法,制导控制算法",3-6万·15薪,岗位职责：1.主导无人机制导算法开发，设计飞行控制策略（如姿态控制、轨迹跟踪）2.熟悉高机动目标的运动估计与预测算法；3.结合无人机动力学模型与场景需求，优化轨迹规划算法（如基于采样的运动规划、探索式规划），提升算法实时性与鲁棒性4.负责算法仿真与测试，优化飞控系统动态响应与稳定性5.参与飞控系统与硬件平台（瑞芯微3588、英伟达NX）的集成调试，解决复杂工况下的控制问题；6.制定飞控制导算法开发...,智能硬件,http://jobs.zhaopin.com/CCL1474860650J40865174512.htm,100-299人,2025-12-31 16:31:46
高级图像算法带头人,成都,成都主导科技有限责任公司,硕士,5-10年,"图像处理,模式识别,缺陷检测,OpenCV,C++,Python,Transformer,图像识别产品",4-7万·13薪,岗位职责：1. 承担项目开发及技术管理工作，组建并带领团队推进项目进程，包括项目需求分析、可行性论证、系统方案、算法实施及部署；2. 负责2D测量及视觉系统开发，承担光学成像方案、图像处理、模式识别及缺陷检测等算法开发工作；3. 负责团队图像算法开发工作质量控制；4. 负责对既有产品的相关算法优化及难点攻关；5. 跟踪技术行业发展。任职条件：1.硕士及以上2.具备5 年以上类似项目独立开发经验，或...,仪器仪表制造,http://jobs.zhaopin.com/CC130508850J40733395212.htm,500-999人,2025-12-23 09:50:34
应届通信算法工程师,成都,成都涌智科技有限公司,博士,无经验,通信算法,3-6万·15薪,岗位职责：1、 算法研发和优化2、 算法移植与调试3、 算法分析与支持任职要求：1、 计算机、电子工程、通信工程、数学等相关专业211/985硕士及以上学历，博士优先；2、 熟悉通信原理、数字信号处理及常用机器学习算法（如滤波、分类、回归）；3、 掌握C/C++、Python编程语言，具备Matlab/R等工具使用经验；4、 有数字前端设计前的算法工程化仿真经验，有支撑数字前端进行芯片开发和验证经...,人工智能,http://jobs.zhaopin.com/CCL1482835610J40855774503.htm,20-99人,2025-11-13 10:08:20
高级算法工程师,成都,四川国软科技集团有限公司,硕士,5-10年,"大模型算法,深度学习,Python,机器视觉,PyTorch,TensorFlow,图像算法,ViT,CV/NLP",4-6万,岗位职责1.针对客户AI图像处理业务需求（不限于目标检测、目标跟踪、异物检测等），快速响应并设计高效的算法解决方案，完成相关技术的研发和应用落地；2.独立承担项目，从算法设计、模型训练到产品集成的全流程工作，确保项目按时按质完成。3.优化现有算法，提升算法性能，包括但不限于提高现有算法性能；4.参与过大模型应用架构设计，有利用大模型优化图像算法的经历；5.跟踪最新的 AI 技术动态，将前沿技术应用...,IT服务,http://jobs.zhaopin.com/CC219030910J40698466906.htm,100-299人,2025-10-30 18:27:37
AI应用技术经理,成都,成都三环科技有限公司,本科,3-5年,"深度学习,大模型算法,Python,C++,C#",3.5-6万·13薪,岗位要求： 1、两年以上主导AI项目经验，拥有技术管理能力，组织带领过AI项目组。 2、熟练掌握Python、Java、SQL等常用开发语言。 3、熟悉使用学习框架，如TensorFlow、PyTorch等。 4、有AI相关工具使用、调试经验，如Dify、Ollama、Xinference等。 5、熟练使用RAG、微调、参数调优等AI技术。 6、掌握大模型性能评估方法。 7、熟悉制造业业务优先。 ...,电子/半导体/集成电路,http://jobs.zhaopin.com/CCL1411331550J40764914403.htm,10000人以上,2025-06-23 16:11:26
研发总监(K12教育+AI),成都,四川特爱教育科技有限公司,本科,5-10年,,2.8-5.5万,【我们是谁】 国内高精的AI+特殊教育解决方案服务商，专注为自闭症、多动症、听力障碍等特殊儿童提供智能化教育支持，已服务全国500+特教学校及上万家庭，团队由教育专家与AI工程师跨界组成。【坐标】成都双流电子科大科技园【薪酬】30-60W年薪+股权激励+年度利润分红【你将获得】1.参与制定公司技术战略，直接向CEO汇报2.组建并带领30+人AI研发团队3.主导千万级政府科技项目申报4.享有特殊教育...,人工智能,http://jobs.zhaopin.com/CC458880730J40765448416.htm,20-99人,2025-10-20 14:43:44
it技术总监,成都,成都鸿坤医疗器械有限公司,本科,10年以上,,2.8-5.5万,一、负责通过技术架构设计与精准需求转化，驱动系统高效交付与业务目标达成二、负责技术标准制定，系统架构设定，了解微服务架构的理念和基本组件;三、负责深度挖掘业务需求，熟练掌握需求分析方法，能够深入了解用户需求，编写详细的需求规格说明书，包括功能需求、非功能需求(如性能、安全、可靠性等)和用户界面需求等;四、负责项目全周期管控，能够快速进行项目计划制定、任务分配、进度跟踪和问题管理，确保项目按计划推进...,医疗设备/器械,http://jobs.zhaopin.com/CC294863680J40871496515.htm,20-99人,2025-07-31 14:36:42
AI 图编译器工程师,成都,象帝先计算技术(重庆)有限公司成都分公司,本科,3-5年,"C++,LLVM,MLIR",2.5-5万·16薪,岗位职责：1. 负责开发图编译器，对接使能各个模型；2. 负责图优化；3. 负责开发组内各种工具和其他工作；任职要求：1. 具备丰富的C++开发经验，熟悉基本的数据结构和算法；2. 熟悉LLVM和MLIR相关知识；3. 具备一定的AI基础知识；4. 良好的问题解决能力与团队沟通能力。,电子/半导体/集成电路,http://jobs.zhaopin.com/CCL1311940980J40943648504.htm,500-999人,2026-01-04 15:37:55
大模型算法工程师,成都,成都主导科技有限责任公司,硕士,3-5年,"图像算法,多模态算法,大模型算法,OpenCV,Transformer,C++,自注意力机制,RAG、AGENT、PROMPT",2.5-5万·13薪,岗位职责：1. 算法研究与开发：负责设计、开发和优化视觉大模型算法，以应用解决行业特定业务或研究问题，如目标识别、图像生成、图像分割、图像分类、异常检测等任务。2. 数据处理与分析：管理和优化数据处理流程，具备数据分析能力（清洗、标注、增强、质量管理、多样性分析等），能够根据业务需求编写数据方案及标注方案，保证模型训练和优化。3. 模型训练与评估：承担大模型的训练、微调和验证工作，确保模型达到预定...,仪器仪表制造,http://jobs.zhaopin.com/CC130508850J40733408712.htm,500-999人,2025-12-23 09:50:16
AI智能体开发+搭建+技术总监,成都,成都谷小智人工智能科技集团有限公司,本科,3-5年,,2.8-5万,岗位职责:1. 负责AI智能体的开发与搭建，确保技术实现符合项目要求2. 领导技术团队，持续优化智能体性能，提升用户体验3. 制定技术策略，推动公司技术创新和应用任职要求：1. 具备出色的沟通能力，能够高效协调团队资源2. 拥有扎实的团队合作精神，能够在多变的工作环境中迅速适应3. 具备持续学习和改进的能力，不断提升个人及团队技术水平4.需要有3年以上团队经理经验，独立负责团队组建、项目进度等工作...,人工智能,http://jobs.zhaopin.com/CCL1486393990J40806255809.htm,20-99人,2025-12-20 12:26:23
AI Framework工程师,成都,象帝先计算技术(重庆)有限公司成都分公司,本科,3-5年,AI架构,2.5-5万·16薪,"岗位职责：1. 基于高性能算子库和AI编译器，对接各个AI开源框架；2. 负责使能模型业务；3. 负责其他与AI框架相关的开发工作；任职要求：1. 具备丰富的C++开发经验，熟悉基本的数据结构和算法；2. 熟悉常见的AI框架，比如tensorflow,pytorch，vllm等；3. 具备相关AI框架的开发经验优先；4. 良好的问题解决能力与团队沟通能力。",电子/半导体/集成电路,http://jobs.zhaopin.com/CCL1311940980J40942004504.htm,500-999人,2026-01-04 15:37:53
研发中心总监,成都,北京凝思软件股份有限公司,本科,10年以上,"C语言,全栈开发,LINUX操作系统,虚拟化,信息安全,研发团队管理经验",3-5万,岗位职责：1、组织研究行业新产品和技术发展方向，对公司技术发展战略及产品开发计划的提出有效建议；2、主导整体技术研究及产品开发，持续提升公司核心技术水平及产品综合竞争力；3、主导关健技术问题攻关，对产品开发的品质、成本、进度负责；4、负责研发相关制度建设，推进管理流程及体系的不断完善；5、负责研发团队的日常管理，包括团队建设、人才培养、绩效激励等。任职要求：1、计算机相关专业本科及以上学历；2.、...,计算机软件,http://jobs.zhaopin.com/CC374935780J40488876407.htm,500-999人,2025-12-17 09:05:49
研发总监,成都,成都微泰科技有限公司,本科,5-10年,,2.5-5万,岗位职责：1. 负责研发部门综合事务管理及内外部资源协调；2.负责研制项目管理，组织开展项目策划、评审与验收工作;3.负责对项目过程、技术状态等进行管控，开展风险评估及防控，跟踪、关注项目进度和质量；4.负责监督及控制项目成本，跟踪项目改良、成本控制的落实；5.负责组织制定、实施项目计划，对各专业组计划进行监督与考核；6.负责研发队伍管理与建设，包括人员招聘、考核、人才梯队搭建，监督人员任务完成情...,电子/半导体/集成电路,http://jobs.zhaopin.com/CC383420080J40852980612.htm,100-299人,2025-12-16 10:37:28
算法工程师,成都,玖锦科技,硕士,经验不限,通信算法,2.5-5万,【岗位职责】1、负责雷达电子对抗系统中信号处理算法的设计与开发，包括但不限于：o 雷达对抗侦察（信号检测、参数估计、调制识别）o 干扰技术（噪声干扰、欺骗干扰、智能干扰波形生成）o 高精度测向算法（DBF、MUSIC、ESPRIT等）o 雷达信号分选与识别（PRI分析、时频分析、机器学习分选）2、完成算法的数学建模、仿真验证及性能优化，参与系统级指标论证与方案设计。3、完成算法在FPGA/DSP平...,仪器仪表制造,http://jobs.zhaopin.com/CC561023020J40898131815.htm,300-499人,2025-12-02 13:07:07
多模态大模型算法工程师,成都,成都九洲电子信息系统股份有限公司,硕士,3-5年,"深度学习,多模态算法,大模型算法",3-5万·15薪,岗位要求： 1、算法研发与优化：设计并开发多模态大模型（如图文、视频、音频等多模态融合架构），提升模型在跨模态理解、生成、对齐等任务上的性能； 2、数据处理与增强：构建高质量多模态预训练数据集，设计数据清洗、增强、对齐策略，提升数据多样性及鲁棒性； 3、模型落地与应用：推动模型在具体场景（如智能创作、人机交互、内容审核、自动驾驶等）的落地，设计微调方案及部署策略； 4、前沿技术探索：跟踪多模态学习...,计算机软件,http://jobs.zhaopin.com/CC142850050J40796051302.htm,100-299人,2025-11-29 20:12:47
海外技术支持总监,成都,成都特隆美储能技术有限公司,本科,5-10年,,3-5万,岗位职责：1. 规划海外售前售后技术支持团队体系，契合公司业务，组建、培训团队，实施绩效考核，打造高绩效海外售前售后技术支持团队。2. 带领团队完成海外售前售后工作，深度调研需求，指导方案撰写，参与推广。对接重要客户，解析 RFQ/RFP，把控方案质量，助力销售。3. 监督项目需求澄清，保持与客户沟通，协调公司内部部门，确保需求准确传达。优化需求管理流程，保障项目推进。4. 统筹产品培训资料编写，...,新能源,http://jobs.zhaopin.com/CC503042530J40867051902.htm,300-499人,2025-11-25 14:55:11
算法工程师（电子侦察方向）,成都,成都能通科技股份有限公司,硕士,3-5年,,2.5-5万·15薪,职责描述： 1、支持系统总师开展项目论证工作，参与总体方案设计，进行相关算法的研究和实现； 2、跟踪、研究雷达、通信、电子战新技术和趋势； 3、深入研究电子对抗的侦察、目标识别、信号特征提取核心算法，为项目提供关键技术支撑； 4、参与信号处理流程的实现，信号参数提取，信号特征分析，对通信信号进行调制样式识别，信道编码识别等。 任职要求： 1、具备扎实的雷达，通信，电子对抗专业知识，对行业的发展趋势...,电子/半导体/集成电路,http://jobs.zhaopin.com/CC120864570J40651548316.htm,100-299人,2025-11-18 14:55:33
算法工程师（信号调制/解调）,成都,成都蓝色起源科技有限公司,本科,3-5年,"MATLAB,数字信号,电磁波,通信信号",3-5万·14薪,岗位职责 1、负责算法的MATLAB仿真与C/C++，CUDA实现； 2、负责信号检测、信号识别、信号调制/解调、信号编码/译码等底层信号处理算法的仿真、实现与持续更新； 3、负责各类特定规格信号解调库的仿真、实现与验证； 4、负责完成算法库应用，主导算法效果验证并根据需求持续改进； 5、负责算法设计文档、仿真报告文档、算法测试文档等算法相关文档的编制、整理，支撑项目实施方案的制定； 6、负责指导...,计算机软件,http://jobs.zhaopin.com/CC457008130J40388250916.htm,20-99人,2025-07-21 10:51:09
高级图像算法工程师,成都,成都主导科技有限责任公司,硕士,5-10年,"OpenCV,TensorFlow,Python,C++",3-5万·14薪,岗位职责： 1、负责轨道交通检测场景（如轨道缺陷识别、接触网状态分析、车辆部件损伤检测等）的计算机视觉算法设计与优化，包括目标检测、图像分割、三维重建、时序分析等方向； 2、攻克复杂环境（低光照、高噪声、动态模糊等）下的图像处理难题，提升算法在真实场景中的鲁棒性与实时性； 3、探索深度学习模型轻量化、多传感器融合、小样本学习等技术在工业检测中的落地应用。 任职要求： 1、硕士及以上学历，计算机视觉...,仪器仪表制造,http://jobs.zhaopin.com/CC130508850J40755518212.htm,500-999人,2025-06-26 16:47:35
资深电机控制算法工程师,成都,犀重新能源汽车有限公司,硕士,5-10年,,2.5-5万,岗位职责： 1、有感电机控制算法开发与调试 2、使用相关工具进行模型开发模型代码生成 3、软件代码 4、软件代码集成 5、所开发功能的软件集成测试 6、设计、开发、测试等文档编写 7、解决调试以及生产中的控制问题 任职要求： 1.硕士及以上学历，5年以上电机控制算法(FOC)架构设计、研发经验; 2. 熟悉汽车电子软件开发流程，精通嵌入式软件编程及测试; 3. 熟悉英飞凌、瑞萨、TI控制器的优先考...,汽车研发/制造,http://jobs.zhaopin.com/CCL1486804690J40914335004.htm,1000-9999人,2025-06-20 11:33:47
伺服算法工程师,成都,成都大陆希望集团有限公司,硕士,5-10年,"永磁同步电机,伺服算法,MATLAB/SIMULINK",2.5-4.5万·13薪,核心职责：1.负责永磁同步电机核心控制算法设计，包括FOC、三环闭环、SVPWM等，优化动态响应与控制精度；2.开展先进补偿与自整定算法研发，提升系统抗扰与自适应能力；3.基于MATLAB/Simulink进行系统建模与仿真，完成算法仿真与实机调试；4.分析并解决量产中的算法相关问题，持续优化算法性能与资源占用；5.协同硬件、软件及测试团队推进算法落地，编写相关技术文档。 任职要求： 1.硕士及以...,电气机械/电力设备,http://jobs.zhaopin.com/CC120855270J40819204807.htm,1000-9999人,2026-01-05 10:43:28
技术总监,成都,四川川能智网实业有限公司,本科,5-10年,Java,3-4.5万,岗位职责：1.技术战略规划参与公司技术战略制定，结合能源互联网、虚拟电厂等行业趋势，推动技术方向与公司业务目标深度协同。主导技术架构设计，优化现有技术体系，确保技术先进性、安全性及可扩展性，支撑公司从传统能源服务向数字化、智能化转型。2.技术研发与创新负责虚拟电厂平台、能源大数据平台等核心产品的研发，整合AI、物联网、大数据等前沿技术，提升产品竞争力。3.团队建设与管理组建并管理30人以上规模的研...,电力/水利/热力/燃气,http://jobs.zhaopin.com/CC378633530J40823424609.htm,300-499人,2025-12-29 14:47:52
高级存储开发工程师,成都,同有科技,本科,经验不限,"C语言,Ceph,SAN,RAID",3-4.5万·14薪,接受base长沙岗位职责：1.负责存储核心子系统/模块的设计、代码编写，把控开发过程；2.负责存储关键技术的攻关，发现和解决存在的技术问题；3.协助架构师/研发经理决策存储产品技术路线，对架构方案、设计、代码进行评审，并对开发质量 负责；4.负责集中存储技术预研、突破与攻关，参与重要原型开发与选型。任职要求：1.本科及以上学历，计算机相关专业；2.5年以上存储系统实际开发经验优先；3.深入理解存储...,计算机硬件,http://jobs.zhaopin.com/CC000607090J40848019915.htm,300-499人,2025-11-19 00:10:03
AI开发研究员（搜索）,成都,思特奇,博士,无经验,,3.5-4.5万·13薪,加入思特奇，你将：1.跟踪AI搜索技术发展趋势和前沿技术，研究与RAG、LLM、多模态一起，解决提升搜索效率和效果等问题；2.负责AI搜索在文本、向量、图等多种企业场景下的工具能力的设计、开发3.提升行业影响力，包括专利、论文4.定期组织行业前沿分享，观点发布；5.提升行业影响力，包括顶会论文、专利等；6.定期组织行业前沿分享，观点发布；如果你是：1. 国家正规院校博士学历，计算机、人工智能相关专...,运营商/增值服务,http://jobs.zhaopin.com/CC120747250J40727952011.htm,1000-9999人,2025-04-23 10:22:06
java/Python/C/C++/JS/AI算法/软件测试,成都,外企德科数字技术有限公司,本科,经验不限,"深度学习,机器学习,图像算法,VGGNet",2-4万·14薪,1、本科及以上学历；2、熟悉Java，C/C++，Python等任意一种后端开发技术；3、编写概要设计能力要强；4、沟通表达能力较好，逻辑思维清晰；5、资深导师专业带教，六险一金，法定节假日福利，内部知识论坛；6、薪资架构：薪资薪资+绩效工资+年终奖，周末加班双倍。岗位要求岗位要求 1、计算机、软件、通信等相关专业，统招本科及以上学历； 2、基础扎实，熟悉掌握但不限于Python/JAVA/C++...,专业技术服务,http://jobs.zhaopin.com/CCL1480117890J40837669705.htm,10000人以上,2026-01-11 00:27:06
雷达数据处理算法工程师,成都,河南承方人力资源服务有限公司,本科,3-5年,雷达算法,2-4万·13薪,岗位职责：1. 负麦汽车雷达多目标轨迹跟踪、预测算法的开发与调试:2. 负麦解决汽车雷达实际应用中的多目标跟踪问题;3. 负麦汽车雷达大量路试数据的后处理，优化目标跟踪算法；4. 负责汽车雷达多目标轨迹跟踪算法的相关技术文档撰写;5. 协助汽车雷达测试、数据采集及分析；6. 协助汽车雷达多目标轨迹跟踪算法的嵌入式软件实现。任职要求：1. 学历要求:电子、信号处理、计算机等相关专业，本科及以上学历;...,人力资源服务,http://jobs.zhaopin.com/CCL1484302980J40825609214.htm,100-299人,2026-01-08 09:25:39
2026-多模态VLA模型开发工程师,成都,鼎桥技术有限公司,本科,3-5年,"机器学习,多模态算法,大模型算法",2-4万,岗位职责:1. VLA模型研发与算法优化1.1 负责研发面向机器人操作的具身智能算法，重点设计与开发视觉-语言-动作（VLA）模型架构，构建从多模态感知到动作输出的端到端推理管线。1.2 优化模仿学习、动作生成及强化学习算法，提升模型在复杂任务中的泛化能力、样本效率与长时序规划能力。1.3 运用目标检测、语义分割、三维重建等计算机视觉技术，持续优化VLA模型的感知与理解模块。2. 仿真验证、系统集...,通信/网络设备,http://jobs.zhaopin.com/CCL1511150630J40835740214.htm,1000-9999人,2026-01-07 19:58:28
java/Python/C/C++/JS/AI算法/软件测试,成都,外企德科数字技术有限公司,本科,经验不限,"Python,C语言,Java,五险一金,全程线上面试,算法编程基础",2-4万·14薪,1、本科及以上学历毕业生（25届毕业生），学信网可查，毕业证与学位证齐全。；2、熟悉Java，C/C++，Python等任意一种后端开发技术；3、编写概要设计能力要强；4、沟通表达能力较好，逻辑思维清晰；5、资深导师专业带教，五险一金，法定节假日福利，内部知识论坛；6、薪资架构：薪资薪资+绩效工资+年终奖，周末加班双倍。岗位要求1、计算机、软件、通信等相关专业，统招本科及以上学历；2、基础扎实，熟...,专业技术服务,http://jobs.zhaopin.com/CCL1480117890J40836814405.htm,10000人以上,2026-01-11 00:27:03
信号处理算法工程师,成都,河南承方人力资源服务有限公司,硕士,3-5年,雷达算法,2-4万,岗位职责1、负责毫米波雷达的信号处理算法方案设计与仿真;2、负责和参与项目中外场试验与测试数据的采集、处理、分析与问题排查;3、负麦对民用毫米波雷达领域前沿算法技术的调研与仿真开发;4、配合软件工程师共同完成嵌入式代码编写:5、整理编写、整理与算法相关的设计文档、试验报告等:任职要求1、电子信息、雷达、信号处理相关专业硕士及以上学历，3年以上相关工作经验;2、掌握常见的雷达信号处理算法，包括:FM...,人力资源服务,http://jobs.zhaopin.com/CCL1484302980J40825608514.htm,100-299人,2026-01-08 09:24:55
2026-视觉感知模型工程师,成都,鼎桥技术有限公司,本科,3-5年,"深度学习,机器学习,多模态算法",2-4万,岗位职责:1.核心算法研发与迭代1.1 负责机器人视觉感知核心算法的研究、开发与迭代，涵盖基于图像/点云的目标检测、识别、跟踪、分割等任务。1.2 深入探索基于多模态视觉-语言模型（VLM）的场景理解与事态感知技术（如复杂行为识别、异常事件检测等），提升机器人对动态环境的认知能力。1.3 研究与开发多传感器（如多目相机、激光雷达）的时空对齐与融合感知算法，构建鲁棒、精确的环境理解系统。2.算法工程...,通信/网络设备,http://jobs.zhaopin.com/CCL1511150630J40835739514.htm,1000-9999人,2026-01-07 19:50:17
