职位,城市,公司,学历,经验,技能,薪资,工作描述,行业,职位URL,公司规模,发布时间,薪资_最小值,薪资_最大值,年薪月数
跨境电商产品开发经理双休20k+,郑州,河南优众人力资源管理有限公司,本科,5-10年,,15000-25000,岗位职责：1、负责跨境电商业务选品开发，搜集、追踪、分析、汇总及考察评估新产品的信息，开发新产品；2、熟悉电商平台产品开发/选品技巧，分析国外市场，了解国外消费习惯，获取产品热卖元素，挖掘市场潜在需求，多渠道进行电商平台产品开发；3、熟练运用第三方工具和数据分析，追踪、搜集、分析、汇总及考察评估产品的信息，从而开发高质量、有潜力、利润可观的产品；4、统计分析新产品销售数据，收集分析市场情报及竞争对...,人力资源服务,http://jobs.zhaopin.com/CCL1276872930J40895172208.htm,100-299人,2025-12-05 01:23:15,15000.0,25000.0,12.0
产品经理(J12824),郑州,蜜雪冰城股份有限公司,本科,经验不限,"软件产品,营销中台,ERP系统,CRM系统,B端产品,大厂经验",15000-25000,岗位职责:1.通过市场调研，掌握客户的实际需求；2.通过内部调研，掌握公司内部业务部门的协作需求；3.根据内外部客户需求输出完整的PRD，推进产品系统的建设和落地；4.根据业务的阶段目标，管理产品的版本迭代内容，把控产品质量；5.输出产品原型，辅助用户体验设计师完成UI和UE设计，把控用户体验。任职要求:1.3年以上用户营销增长、门店智能终端、招商运营管理或供应链信息化的全生命周期产品经验；2.拥...,快速消费品,http://jobs.zhaopin.com/CC407014910J40735510606.htm,1000-9999人,2025-11-24 09:29:03,15000.0,25000.0,12.0
高级产品经理,郑州,河南省恒安智控技术有限公司,本科,5-10年,"AI产品,软件产品,硬件产品",15000-25000,岗位职责1.产品及解决方案设计负责主导或审核产品方案及项目解决方案的设计，并在客户满意度、技术可行性、成本竞争力和实施便利性等方面实现综合最优，同时提供产品开发或项目实施的最佳方案或路径以保障产品开发与项目交付。2.产品规划和能力建设①基于行业、市场、客户与竞品分析，进行产品体系规划，提出建设方案，对产品线的投入产出（roi）和生命周期管理负责。②进行项目经验和产出积累，建立并维护产品与解决方案知...,通信/网络设备,http://jobs.zhaopin.com/CCL1391305300J40811353009.htm,100-299人,2025-11-19 10:04:43,15000.0,25000.0,12.0
肉制品产品经理研发经理,郑州,天康畜牧科技有限公司,本科,3-5年,"肉制品,技术研发,配方研发",15000-25000,岗位职责1.市场调研：负责市调工作的组织实施。主要包括B端(大客户定制和流通分销)和C端的UA(消费者行为和态度)调研，市场需求调研分析，行业及竞品调研分析，销售渠道和产品流通调研等，为产品开发优化以及品牌策略等提供决策依据。2.产品战略规划：产品系列规划、以及每个系列产品定位和营销职能规划，明确各产品的渠道适配策略。3.产品开发和优化：整体负责公司的产品开发和优化工作，主要包括老产品优化、新产品...,农/林/牧/渔,http://jobs.zhaopin.com/CCL1313838910J40797988814.htm,1000-9999人,2025-11-11 00:36:02,15000.0,25000.0,13.0
产品经理(J12179),郑州,蜜雪冰城股份有限公司,本科,3-5年,"软件产品,硬件产品,电商产品",13000-25000,工作职责:1.负责通过市场调研，掌握外部客户的实际需求；2.负责通过内部调研，掌握公司其他业务部门的协作需求；3.负责根据内外部客户需求输出完整的PRD，推进产品系统的建设和落地；4.负责根据业务的阶段目标，管理产品的版本迭代内容，把控产品质量；5.负责输出产品原型，辅助用户体验设计师完成UI和UE设计，把控用户体验。任职资格:1.3年以上用户营销增长、门店智能终端、招商运营管理或供应链信息化的全...,快速消费品,http://jobs.zhaopin.com/CC407014910J40639927906.htm,1000-9999人,2025-11-20 17:31:17,13000.0,25000.0,12.0
高级产品经理,郑州,金丝猴食品有限公司,本科,5-10年,,20000-25000,"1、结合公司战略制定公司品类发展规划、销售预算方案和对应的营销推广方案，并将目标分解至各个产品，推动产品策略及规划的制定及落地。2、负责品类机会点挖掘,制定满足用户需求的品类/产品策略，包括但不限于产品定位、产品组合策略、产品差异化策略、新产品开发策略、产品价格策略以及产品的生命周期管理；3、按期推进各品类产品管理工作，包括但不限于新品开发、老品迭代及产品的上、下市工作；4、月度/季度/年度品类数...",零售/批发,http://jobs.zhaopin.com/CC823208260J40898722908.htm,500-999人,2025-11-07 12:16:42,20000.0,25000.0,12.0
MES产品经理,郑州,北京外企人力资源服务河南有限公司,本科,5-10年,"MES系统,B端产品,智慧物流,智能汽车",15000-25000,岗位职责：1. 负责公司智能制造软件产品线的市场调研、用户需求收集与分析，完成产品规划和版本管理；2. 深度理解AI技术能力，主导将AI功能（如预测性维护、智能排产、质量缺陷检测等）融入产品工具链，定义产品AI特性；3. 编写详细的产品需求文档（PRD）和原型设计，协调研发、测试、UI设计团队，推动产品功能落地，确保项目目标达成；4. 跟踪产品上线后的用户反馈和数据表现，持续进行产品迭代优化，提升...,人力资源服务,http://jobs.zhaopin.com/CC329281210J40804048901.htm,100-299人,2025-11-05 14:03:00,15000.0,25000.0,12.0
产品经理（郑州办事处）,郑州,中寰医药有限公司,本科,经验不限,"仿制药,全科室,市场运营,精细化招商,学术,原装进口仿制药,销售运营管理",15000-25000,岗位职责：1、 市场策略制定、产品标杆医院制定、KOL管理2、相关产品学术会议及内部会议的医学市场支持：协助会议内容审核、会议流程支持、协助会议资料制作3、内外部培训会议：线上培训，确保平台通畅；线下培训确保会议场地及设备；协助培训内容的制定与制作4、 临床研究的学术及方案支持：供应商进度跟进，与内外部客户基础内容沟通5、领域进展及产品优势进展更新：协助每月文献查询及内容更新；每月更新产品临床使用...,医药制造,http://jobs.zhaopin.com/CC846263510J40796565907.htm,300-499人,2025-09-24 10:22:07,15000.0,25000.0,12.0
产品经理,郑州,河南三支梅进出口贸易有限公司,大专,5-10年,,15000-25000,岗位职责：1、进行消费者调研，挖掘未满足需求，识别创新机会点。监测行业趋势、竞品动态及消费者行为变化，进行市场分析。2、推进新品开发：从概念设计、配方/包装开发到测试，协调采购&生产等供应链团队落地，制定上市计划（渠道策略、促销方案），确保高效落地，监控新品销售表现，及时调整。3、管理现有产品优化（配方升级、包装焕新、成本优化）。4、产品定制相关需求的协助。5、其他如展会等事宜筹办。,快速消费品,http://jobs.zhaopin.com/CCL1482128160J40756265816.htm,500-999人,2025-09-12 13:33:48,15000.0,25000.0,12.0
产品总监10-15k,郑州,河南达尊网络科技有限公司,本科,1-3年,,15000-25000,岗位职责1. 产品生命周期管理，产品上下市管理，每月数据分析，合理调整产品结构2. 定期进行产品周转率报表统计，对销量差的产品进行分析并出具调整建议3. 负责整理报货，收集销售部产品需求和建议4. 针对产品质量和口感，定期进行员工调查，并提报处理方案5. 分析竞品与本品产品线状态，输出新品需求清单及开发提案6. 输出新品核心卖点，统一终端销售话术，优化产品宣传7. 新商标注册，以及热门商标调研。任...,电子商务,http://jobs.zhaopin.com/CCL1351483440J40776276511.htm,500-999人,2025-08-27 11:47:27,15000.0,25000.0,12.0
产品经理,郑州,河南欢行盒子科技有限公司,学历不限,3-5年,,20000-25000,岗位职责：1. 负责对应细分场景产品体系能力搭建，包括不限于产品规划、商业模式、使用场景、业务拓展能力；2. 参与负责全生命周期的产品设计工作，关注用户价值和消费体验，联动行业供给优化产品转化效率，提升运营效能；3. 洞察场景客户用车诉求，为细分行业与品类提供定制化能力，跟进具体产品需求分析，设计、落地与迭代，汇报并生效功能、产品及服务需求，并向商品、技术部门输出开发需求； 4. 深度理解客户、行...,新能源汽车,http://jobs.zhaopin.com/CCL1476942690J40779844114.htm,100-299人,2025-08-25 00:03:41,20000.0,25000.0,12.0
产品负责人（智能网联汽车实训产品）(A178851),郑州,捷安高科,本科,5-10年,智能网联,15000-25000,职位描述：1. 深入理解院校智能网联汽车、新能源汽车专业建设的市场需求，转化为具体的产品特性和技术要求。2. 基于需求分析，设计并实施相关实训系统的整体解决方案，包括硬件选型、软件架构设计等。3. 负责实训产品开发项目的进度管理、质量控制与风险管理，确保项目按时、按质完成。4. 编写技术文档、用户手册及培训材料，为内外部用户提供技术支持和解决方案咨询。5. 跟踪行业动态，持续优化现有解决方案，引入...,计算机软件,http://jobs.zhaopin.com/CC219039210J40871188515.htm,500-999人,2025-08-08 16:36:02,15000.0,25000.0,12.0
产品总监,郑州,河南龙翼信息技术有限公司,大专,5-10年,"软件产品,AI产品,智慧服务,智慧园区,智慧城市,智慧社区",15000-25000,岗位职责；1. 战略规划：制定产品战略及发展路线图，确保与公司战略协同2. 产品全周期管理：主导需求分析、产品定义到上市推广全流程3. 研发交付：协调跨部门资源，推动产品高质量按时交付4. 商业化落地：制定产品定价及市场推广策略，持续优化产品竞争力任职要求：1. 5年以上软件产品管理经验，物联网/大数据领域优先。统招大专及以上学历2. 完整0到1产品落地经验，数据中心运维背景更佳3. 卓越的商业思...,IT服务,http://jobs.zhaopin.com/CC394795810J40767921511.htm,100-299人,2025-08-07 14:04:21,15000.0,25000.0,12.0
产品经理（快消品）,郑州,杨掌柜食品科技(河南)有限公司,本科,3-5年,,15000-25000,1、有头部快消品、互联网快消产品经验优先；或者做过调研公司、咨询公司、市场调研经验的优先；2、3年以上产品及品牌岗位工作经验，有独立开发产品的经历，快消品行业背景；3、熟悉产品开发上市全部流程，有新品上市推广的实操经验（有成功案例），具备优秀的文字能力及审美能力，有一定的品牌思维；4、灵活抗压，优秀的沟通协调能力和项目管理能力。 备注：优秀者工资可放宽。,食品/饮料,http://jobs.zhaopin.com/CCL1422983630J40759549107.htm,1000-9999人,2025-06-19 14:28:07,15000.0,25000.0,12.0
高级产品经理（教育、大数据）,郑州,精华教育科技股份有限公司,本科,5-10年,软件产品,13000-25000,职位关键词：B端产品，数据产品岗位职责  1、根据行业政策、市场洞察、公司发展战略规划设计公司整体产品发展思路； 2、根据竞品的深入调研分析、客户需求、公司产品、项目现状，输出产品整体设计及研发规划方案；  3、根据产品规划方案和客户反馈持续优化迭代现有产品，并以此为基础规划设计新的产品；  4、综合各方面产品需求和技术平台，撰写产品需求书，详细阐述产品功能和操作流程，对产品的各项运营指标负责； ...,IT服务,http://jobs.zhaopin.com/CC140283900J40682589811.htm,100-299人,2025-04-15 00:06:40,13000.0,25000.0,12.0
软件产品经理（数据/AI产品方向）,郑州,郑州埃文科技有限公司,本科,3-5年,"中台产品,大数据产品,市场调研,需求分析,产品设计,用户研究,Axure,墨刀",15000-25000,岗位职责：1.负责人工智能、数据平台及工具类产品调研。2.了解市面上的主要竞品，清晰各家产品的优劣势，能够根据自家产品现状，挖掘出差异化卖点。3.负责打造数据平台类产品，制定和维护产品的规划和迭代节奏，能够和团队一起协作确保需求有效评估和迭代最终成功发布。4.负责相关解决方案研究，贯穿数据采集、存储、应用、销毁整个生命周期，包括数据治理体系框架及实施流程。5.负责项目客户需求提炼及行业特性提炼，制...,计算机软件,http://jobs.zhaopin.com/CC521610020J40733775210.htm,100-299人,2025-04-03 19:21:31,15000.0,25000.0,12.0
产品经理,郑州,河南锅圈实业发展有限公司,本科,3-5年,"食品,快消品",15000-25000,岗位职责：一、新产品开发1、根据公司发展战略，开展市场调研，分析市场变化及销售、客户的需求，提报新产品开发提案。主要负责：市场数据收集与分析、行业超势分析、开发品类、目标群体定位、策略等；2、负责新产品上市的全程推进和全链条管理，对进度和质量负责。包括但不限于：立项、研发、包装设计、产品打样、优化、生产资源匹配、上市前的产销协调等过程管理；3、新产品上市后执行问题的追踪，组织生产、市场、销售等部门...,食品/饮料,http://jobs.zhaopin.com/CCL1478395550J40704773411.htm,10000人以上,2025-03-10 10:01:43,15000.0,25000.0,12.0
高级产品经理（现代教育技术或教育大数据专业）,郑州,精华教育科技股份有限公司,硕士,5-10年,软件产品,13000-25000,职位关键词：B端产品，数据产品岗位职责  1、根据行业政策、市场洞察、公司发展战略规划设计公司整体产品发展思路； 2、根据竞品的深入调研分析、客户需求、公司产品、项目现状，输出产品整体设计及研发规划方案；  3、根据产品规划方案和客户反馈持续优化迭代现有产品，并以此为基础规划设计新的产品；  4、综合各方面产品需求和技术平台，撰写产品需求书，详细阐述产品功能和操作流程，对产品的各项运营指标负责； ...,IT服务,http://jobs.zhaopin.com/CC140283900J40581276411.htm,100-299人,2025-02-21 00:22:02,13000.0,25000.0,12.0
产品经理(A121619),郑州,捷安高科,本科,5-10年,系统集成,15000-25000,职位描述： 岗位职责： 1 开展产品规划与设计工作； 2 开展竞品与行业研究； 3 应用产品开发管理知识与技能，参与、协调、推动产品实现的过程； 4 搜集用户体验反馈，并落实优化措施； 5 用户调研，采集有效用户需求； 6 策划迭代、优化、改进产品； 7 编写产品管理相关的文档资料。 职位要求： 1 统招本科及以上学历，计算机、电子、信息技术、通信等相关专业； 2 本科7年以上工作经验，研究生5年...,计算机软件,http://jobs.zhaopin.com/CC219039210J40570613315.htm,500-999人,2025-02-06 09:02:43,15000.0,25000.0,12.0
产品经理,郑州,郑州德派医疗器械有限公司,本科,3-5年,,12000-24000,一、岗位职责：1.主导产品策略的制定和落地，对产品的整体销售目标及损益结果负责；2.有独立推进产品上市及立项的能力，能根据行业特性完善相关的产品功能；3.制定产品发售周期表，协调各部门配合，确保产品开发、备案直至发售运营的顺利展开，对进度负责；4.负责组织品类供应商的开发与维护，建立完善的供应商库，辨识供应商的优劣；5.负责组织撰写及核对外包装.产品宣传类文案，提炼产品定位及设计理念文稿至设计部门...,新材料,http://jobs.zhaopin.com/CC703017120J40701228609.htm,500-999人,2026-01-08 09:00:24,12000.0,24000.0,12.0
金融产品经理,郑州,河南豫泽通信息科技有限公司,高中,1-3年,,12000-24000,信贷产品接待岗，主要负责了解客户资质，给客户匹配合适的银行产品、录单、谈费用 底薪7500+提成，单双休 要求：专业经验2年以上，有较强的谈判及沟通能力 熟悉各银行产品政策 有责任心，抗压能力强,咨询服务,http://jobs.zhaopin.com/CCL1426555060J40813809911.htm,20-99人,2026-01-08 01:30:10,12000.0,24000.0,12.0
IOT产品经理,郑州,郑州数耘工业技术有限公司,本科,5-10年,"SCADA,MES系统,智能控制",12000-24000,岗位职责： 1.负责工业物联网IOT平台产品规划及全生命周期管理； 2.主导SCADA系统与工业设备的数据采集方案设计； 3.协调研发团队完成至少1个大型工业IOT项目实施落地； 4.分析设备运行数据，优化产品能效指标提升15%以上。 任职要求： 1.本科及以上学历，自动化/电气控制/计算机相关专业； 2.3年以上工业IOT实施经验，熟悉Modbus/OPC UA协议； 3.精通SCADA、MES...,工业自动化,http://jobs.zhaopin.com/CCL1271755360J40787386911.htm,100-299人,2026-01-03 00:49:40,12000.0,24000.0,13.0
产品经理,郑州,六夫丁作物保护有限公司,本科,1-3年,"水溶肥,颗粒肥,肥料,河南,郑州",12000-24000,职位描述一、岗位职责：1、进行产品市场规划跟进，跟踪产品生产计划；2、负责作物试验区的药效实验，采集数据形成农作物病虫害防治实验报告；3、根据实验报告，拟定公司内部专业用药及相关知识培训计划并实施；4、为老产品的配方改良和新产品的药效测试提供各种实验数据支持；5、对产品品牌进行扶持推广，协助业务员进行农民会、订货会等的策划与召开。二、任职资格：1、统招本科学历及以上，农学、植物保护等相关专业；2、...,农/林/牧/渔,http://jobs.zhaopin.com/CC461412320J40953315704.htm,500-999人,2025-11-11 14:48:55,12000.0,24000.0,12.0
产品经理,郑州,郑州牧小二食品有限公司,大专,3-5年,,12000-24000,岗位内容：1. 开发并维护产品路线图，跟踪市场趋势和用户反馈，快速响应变化并做出调整。2. 组织用户研究并深入了解用户需求，挖掘用户痛点并提供有针对性的解决方案。3. 制定产品推广计划和策略，协调各部门落实执行计划，提升产品在市场上的影响力和竞争力。任职要求：1. 具备3年以上产品经理相关工作经验，并有成功案例经验；2. 出色的项目管理和组织协调能力；3. 较强的数据分析和创新思维，擅长从用户需求...,食品/饮料,http://jobs.zhaopin.com/CC584577180J40737126901.htm,20人以下,2025-07-09 10:26:31,12000.0,24000.0,12.0
软件项目经理,郑州,北京合众伟奇科技股份有限公司,本科,5-10年,"软件产品,数据产品,云计算产品,大数据产品,数据治理产品,数据中后台产品,电力行业,产品设计",18000-24000,（一）职位描述： 研发、需求分析、原型设计、数模设计、接口设计、详细设计 （二）岗位职责： 1.协助项目经理设计软件项目售前方案与产品规划； 2.负责软件项目的业务调研、需求分析工作，编写业务需求文档； 3.与UI设计人员结合，设计契合用户体验的系统原型； 4.负责数据库表设计、与外部系统接口设计、详细设计等系统设计； 5.负责对接开发组长，协助开发人员对系统设计成果进行代码转化，解答并解 6.决...,计算机软件,http://jobs.zhaopin.com/CC468463280J40832122715.htm,1000-9999人,2025-06-09 15:20:10,18000.0,24000.0,12.0
电商产品开发经理+大平台,郑州,河南海一云商实业集团有限公司,本科,3-5年,"市场调研,产品规划,需求分析,产品设计,产品/版本迭代",11000-22000,岗位职责1.市场调研与分析：搜集竞品信息，分析竞品特点、优势与劣势。研究行业发展趋势，为产品开发方向提供依据。分析消费者痛点，明确各市场用户的需求。2.产品线规划与管理：制定产品线的产品规划和路线图，提升产品线竞争力。组织产品需求评估与策划，负责新产品定义、立项。管理产品生命周期，包括新品上市、推广、售后质量监控等。3.成本管理与供应商管理：负责各阶段产品成本输出，参考竞品成本倒退目标成本。监控产...,零售/批发,http://jobs.zhaopin.com/CC673304930J40793524808.htm,1000-9999人,2026-01-09 19:04:48,11000.0,22000.0,12.0
产品经理（智慧养殖智能硬件方向）-郑州,郑州,科大讯飞股份有限公司,本科,5-10年,智慧城市产品,11000-22000,工作职责：1.负责智慧养殖智能硬件产品的整个生命周期管理，包括市场研究、产品规划、需求分析、功能设计、原型设计、用户体验优化等。2.参与产品开发项目流程，推进产品开发、测试、试产和量产进程，协调解决产品开发过程中的问题；3.协同外协企业，进行关键模智能硬件块调研、选型和合作，制订技术规格和验收；4.跨部门协同：与研发、供应链、品质、市场等部门紧密合作，完成产品上市的推动工作。任职要求：1.本科以上...,计算机软件,http://jobs.zhaopin.com/CC205108410J40907697904.htm,10000人以上,2026-01-09 15:14:05,11000.0,22000.0,12.0
乐园周边产品统筹岗,郑州,蜜雪冰城股份有限公司,本科,3-5年,商业化产品,11000-22000,岗位职责： 1.结合IP主题乐园客群画像（如亲子家庭、青少年、IP 粉丝），围绕乐园核心IP角色规划周边产品矩阵，主导乐园IP产品创意策划、设计对接（对接内部设计团队或外部机构），完成IP衍生品从概念到市场落地的全过程；2.结合节假日、IP 周年庆、乐园主题活动等节点，规划限定款、联名款周边产品，打造销售爆点，提升乐园热度及销售数据，拉动用户复购；3.制定采购计划，根据销售数据、活动规划及库存预警...,快速消费品,http://jobs.zhaopin.com/CC407014910J40742122606.htm,1000-9999人,2025-12-17 15:16:44,11000.0,22000.0,12.0
电商产品经理,郑州,郑州海纳电子商务有限公司,大专,3-5年,,11000-22000,【岗位职责】：1.市场分析和品类规划：分析大家电品牌的市场形势，梳理产品发展方向，制定产品开发计划，支持业务目标达成；2.产品开拓：主动挖掘未被满足的需求、新业务触点及潜在的增长机会，市场和竞品分析，定义开发目标，执行项目实际落地；3.产品分析和改进优化：在产品策划或立项和开发前端进行产品质量风险分析和预防，在产品销售中，根据客户的反馈及时开展产品质量分析研讨会，确保产品优良用户口碑；4.产品管理...,互联网,http://jobs.zhaopin.com/CC571336720J40817439708.htm,1000-9999人,2025-06-24 09:47:05,11000.0,22000.0,12.0
产品总监,郑州,河南达尊网络科技有限公司,本科,5-10年,"食品,红酒,酒类",15000-21000,【岗位职责】1、结合公司战略，与销售部门合作，深入了解市场趋势和消费者偏好，负责公司内部平台全线产品运营及战略规划，并指导各产品模块的规划；2、制定公司中长期产品体系规划，有品类规划和产品规划能力，熟悉开发新品流程，能快速丰富产品线，维护老品优化升级；3、统筹产品开发整体流程包括寻找优质供应商、统筹新品打样、生产节奏跟进、采购品质跟进、交期跟进、异常状况处理等，跟进环节并对结果负责；4、分析销售数...,电子商务,http://jobs.zhaopin.com/CCL1351483440J40705273411.htm,500-999人,2025-11-05 15:26:21,15000.0,21000.0,12.0
休闲食品产品经理（烘焙、礼品、米饼、馍片方向）,郑州,博慧人才服务有限公司,大专,5-10年,休闲食品,15000-20000,职位描述产品经理岗位职责(1)负责收集行业、市场、客户、竞品信息，通过实地走访与市场调研，深度挖掘市场机会和消费者需求，提供准确可靠的市场情报，协助确定新产品发展目标与战略；(2)根据新产品前期市场调研结果及公司确定的产品战略提出新产品概念规划、设计、成本核算、价格策略、销售策略等可行性立项方案；(3)定期与公司营销中心、技术部门、生产部门等对接，全程对新产品需求、设计、样品、内外部品调、生产等进...,咨询服务,http://jobs.zhaopin.com/CC829923280J40858353303.htm,20人以下,2026-01-12 09:42:04,15000.0,20000.0,12.0
