职位,城市,公司,学历,经验,技能,薪资,工作描述,行业,职位URL,公司规模,发布时间,薪资_最小值,薪资_最大值,年薪月数
ETL开发（国企+长期稳定项目+五险一金）,郑州,软通动力信息技术(集团)股份有限公司,本科,5-10年,"分布式系统开发经验,ETL设计/开发经验,ERP数据库经验,Redis",,"1、具有5年以上数据研发或者测试经验，对数据仓库、数据平台、数据引擎领域知识有较好储备；2、必须有财经领域的工作经历，必须有ERP经验，熟悉ERP数据流3、熟悉数据仓库架构，并精通至少一种数据库产品；4、熟悉数据仓库模型设计、ETL开发、维度建模设计方法，具备海量数据处理经验；5、具备出色的需求分析能力及快速学习能力，能深入理解复杂的业务逻辑,具备良好的团队合作精神，具备出色的沟通能力",互联网,http://jobs.zhaopin.com/CC000544460J40660999116.htm,10000人以上,2025-12-23 01:46:06,,,
大数据开发工程师,郑州,郑州科瑞思拓软件科技有限公司,本科,10年以上,"数据仓库,数据建模",,岗位职责1、负责公司大数据应用产品的平台搭建、架构优化、技术迭代和开发维护，提供稳定的大数据平台服务；构建数据存储、数据挖掘、数据计算及数据服务于一体的大型分布式数据平台；2、负责构建和维护算法平台，对海量数据进行离线计算、实时计算等分析挖掘；协同数据分析师，根据业务场景设计并实现数据模型和服务模型，并跟进和评估模型效果，确保算法和模型的有效落地；3、持续学习了解大数据领域的新技术，并结合实际需求...,计算机软件,http://jobs.zhaopin.com/CC393603820J40783635803.htm,100-299人,2025-12-07 09:56:11,,,
大数据开发工程师,郑州,八六三软件,大专,5-10年,"数据仓库,数据库开发,Flink",11000-13000,岗位职责：1、参与项目蓝图规划、需求分析，根据需求设计文档、准确且高质量完成代码编写及技术文档编写:2、按照项目计划，完成开发任务，确保项目进度和质量；3、负责系统上线后的技术服务支撑，保障生产环境安全、平稳运行，支撑业务发展；4、对技术难点进行探索和预测，独立执行实施方案。任职要求：1、计算机相关专业，5年以上项目研发经验；2、责任心强，沟通能力强，熟悉掌握阿里云平台数据开发技术；3、精通Hiv...,计算机软件,http://jobs.zhaopin.com/CC621497980J40762538809.htm,500-999人,2025-12-01 16:17:14,11000.0,13000.0,12.0
6k-1w报表开发工程师数据开发,郑州,宿州飞鑫文化传媒有限公司,学历不限,经验不限,"SQL,MySQL,报表开发,数据清洗,数据可视化,FineBI,FINEDATALINK,FineReport",,注意！此岗位需要来安徽省宿州市上班！待遇保底6000-10000元招报表开发工程师职位描述1.项目设计：参与项目经理组织的需求调研、需求分析会议。2.项目开发：基于模板应用开发需求，使用finereport、finebi等帆软产品，完成模板应用搭建开发工作，包含但不限于报表、大屏、移动端等；3.项目测试：具备自测能力4.项目交付：具备一定实施部署能力，保持项目文档的完整、连续和可追溯性。任职资格1...,文化艺术/娱乐,http://jobs.zhaopin.com/CCL1348710510J40744633506.htm,500-999人,2026-01-12 00:11:20,,,
BI数据架构工程师,郑州,北京剑鱼信息技术有限公司河南分公司,本科,3-5年,"数仓开发,Java,Python,ETL开发经验,MySQL,SQL Server,SQL,数仓开发经验,实时数仓",,岗位职责：1、数仓建设与优化：主导公司数据仓库、数据集市设计与落地，运用维度建模等方法构建适配招投标业务的数据模型，提升数据查询效率。2、ETL 全流程管理：负责 ETL 流程设计、开发与优化，从招投标业务系统、第三方数据等数据源高效抽取数据，保障数据清洗、转换的准确性与完整性。3、数据分析与支持：结合招投标业务需求，设计数据可视化报表与仪表盘，为业务决策提供数据洞察；解决业务部门数据分析痛点，输...,云计算/大数据,http://jobs.zhaopin.com/CCL1328926320J40834243014.htm,100-299人,2026-01-09 01:40:00,,,
大数据开发（项目制）,郑州,八六三软件,本科,5-10年,"数据中台开发,数据库开发",10000-12000,岗位职责：1、参与项目蓝图规划、需求分析，根据需求设计文档、准确且高质量完成代码编写及技术文档编写:2、按照项目计划，完成开发任务，确保项目进度和质量；3、负责系统上线后的技术服务支撑，保障生产环境安全、平稳运行，支撑业务发展；4、对技术难点进行探索和预测，独立执行实施方案。任职要求：1、计算机相关专业，5年以上项目研发经验；2、责任心强，沟通能力强，熟悉掌握阿里云平台数据开发技术；3、精通Hiv...,计算机软件,http://jobs.zhaopin.com/CC621497980J40816519609.htm,500-999人,2026-01-10 01:27:07,10000.0,12000.0,12.0
数据开发工程师,郑州,河南君友数字科技有限公司,本科,3-5年,"数据库开发,数据架构,数据建模",,一、岗位职责1. 负责关系型数据库（如MySQL、PostgreSQL等）的设计、搭建与维护，优化数据库索引、查询语句，保障数据存储安全与访问高效。2. 参与产品知识库的构建与管理，设计合理的数据模型，实现知识数据的高效录入、更新、检索与关联，支撑大模型知识问答功能。3. 负责工作流编排相关开发，设计并实现数据处理、报告生成等环节的自动化工作流，提升数据处理与报告输出效率。4. 主导向量数据库（如...,咨询服务,http://jobs.zhaopin.com/CC146277870J40810688605.htm,20-99人,2026-01-05 15:59:53,,,
数据开发工程师,郑州,浩鲸云计算科技股份有限公司,本科,3-5年,"数据治理,ETL,Java,Python,Flink,MaxCompute,DATAWORKS",10000-12000,工作职责1、参与项目蓝图规划、需求分析，根据需求设计文档、准确且高质量完成代码编写及技术文档编写:2、按照项目计划，完成开发任务，确保项目进度和质量；3、负责系统上线后的技术服务支撑，保障生产环境安全、平稳运行，支撑业务发展；4、对技术难点进行探索和预测，独立执行实施方案。任职资格1、计算机相关专业，5年以上项目研发经验；2、责任心强，沟通能力强，熟悉掌握阿里云平台数据开发技术；3、精通Hive ...,计算机软件,http://jobs.zhaopin.com/CC131936250J40765677616.htm,1000-9999人,2026-01-05 01:43:14,10000.0,12000.0,12.0
大数据开发岗（项目制）,郑州,八六三软件,大专,5-10年,"数据仓库,Flink",,岗位职责：1、参与项目需求分析、根据需求设计文档、准确且高质量完成代码编写及技术文档编写:2、按照项目计划，完成开发任务，确保项目进度和质量；2、构建项目指标体系，并基于指标体系，及时发现与定位业务问题；3、设计数据质量监控规则，协同业务部门提升数据准确性及完整性；4、参与数据中台的开发、建设流程和规范设计，包括：数据建模，数据管理规范设计，ETL流程优化等；5、协调业务与技术团队，推动数据标准与...,计算机软件,http://jobs.zhaopin.com/CC621497980J40788780509.htm,500-999人,2026-01-08 01:22:52,,,
架构工程师,郑州,郑州奥特科技有限公司,本科,5-10年,,,岗位职责：1. 负责公司信息化系统的整体架构设计、技术选型与规划，确保系统具备良好的扩展性、稳定性、安全性和可维护性；2. 参与项目开发计划的制定与执行，确保软件按时高质量交付；3. 主导或参与关键技术解决方案的评审与制定，解决复杂技术难题；4. 制定并推广软件开发规范、技术标准和最佳实践；5. 维护和优化现有系统，解决运行中出现的故障与性能问题；6. 与业务部门、开发团队、运维团队紧密协作，理解...,专用设备制造,http://jobs.zhaopin.com/CC358207910J40903848915.htm,300-499人,2025-11-17 14:40:17,,,
大数据开发工程师,郑州,中科软科技股份有限公司,本科,1-3年,"数据治理,数据架构,数据挖掘,Sql,Java,Python,Hadoop,Flink,MaxCompute",,【核心职责】1. 负责大数据平台（Hadoop/Spark/Flink 等）的架构设计、搭建与优化，保障集群稳定高效运行；2. 参与数据采集、清洗、转换、存储等全流程研发，设计高可用、高性能的数据处理管道；3. 基于业务场景开发大数据分析模型、算法应用，支撑数据驱动决策；4. 主导大数据相关工具、组件的二次开发与定制化改造，解决技术瓶颈；5. 制定数据安全、备份与恢复策略，保障数据资产完整性与安全...,计算机软件,http://jobs.zhaopin.com/CC120160390J40771179916.htm,1000-9999人,2025-11-07 17:38:32,,,
高级大数据开发工程师,郑州,八六三软件,本科,5-10年,"Sql,Python,Java,MaxCompute,Flink,Spark",10000-12000,"郑州东区，工作经验3年，周期3个月左右，薪资10-12k,大小周，项目结束合同到期，需着正装上班岗位职责：1、参与项目蓝图规划、需求分析，根据需求设计文档、准确且高质量完成代码编写及技术文档编写:2、按照项目计划，完成开发任务，确保项目进度和质量；3、负责系统上线后的技术服务支撑，保障生产环境安全、平稳运行，支撑业务发展；4、对技术难点进行探索和预测，独立执行实施方案。任职要求：1、计算机相关专业...",计算机软件,http://jobs.zhaopin.com/CC621497980J40812075909.htm,500-999人,2026-01-05 01:24:32,10000.0,12000.0,12.0
研发项目经理,郑州,郑州海之阳能源科技有限公司,本科,3-5年,"嵌入式硬件开发,嵌入式软件开发",,1.参与实施产品开发、研发工作、制定开发计划； 2.按研发计划完成技术文件编制及图纸设计工作及时记录各种工作要素，编制完整的产品文件。 3.汇同产品生产部门完成试生产，处理试生产中的设计问题。 4.总结产品研发经验，持续产品的改进，并根据客户或公司有关部门的合理要求进行设计修改和设计改进，完成产品定型工作。 5.协助质量、销售部门解决客户技术问题和搞好客户服务。 6.为产品的投标提供技术支持。 7...,电子/半导体/集成电路,http://jobs.zhaopin.com/CCL1495880570J40820956708.htm,20-99人,2025-09-29 14:58:12,,,
大数据工程师,郑州,河南旭凯新能源有限公司,本科,3-5年,数据记录,,1.日常数据、监控记录，文案记录；2.平台搭建、网站维护、app开发。,工程技术与设计服务,http://jobs.zhaopin.com/CCL1475553890J40742632401.htm,20-99人,2025-06-12 15:40:46,,,
大数据工程师,郑州,河南棕佩科技有限公司,大专,经验不限,"Scala,Python",,岗位内容：1. 负责设计、开发和维护大型数据处理系统。2. 制定和执行数据编码、测试和部署策略。3. 维护现有的数据集成和 ETL 流程，并对其进行优化。4. 跟踪新技术和趋势，推动公司数据技术发展方向。任职要求:1. 要求年龄在21~28 2. 熟悉至少一种主流编程语言（如 Python/Java/Scala），有扎实的编码能力。3. 精通 Hadoop 生态系统中的工具和技术。4. 熟悉云计算...,计算机软件,http://jobs.zhaopin.com/CCL1514727230J40820824007.htm,20人以下,2026-01-10 01:20:35,,,
校企合作讲师-河南,郑州,丰沃创新(北京)科技有限公司,硕士,3-5年,"Spark,Flink,大数据分析,大数据开发,Hadoop",10000-11000,岗位职责：1. 长期驻校教学实施：全职常驻合作院校（工作日全程在校），承担大数据（Hadoop/Spark/Flink等）专业课程教学，每周授课量≥20课时。2. 多厂商技术融合授课：基于主流厂商实验平台中实训项目进行授课，同时具备将企业级项目案例转化为教学资源，指导学生参加数字技术类竞赛的能力。3. 校企协同与资源对接：协调校方与厂商技术资源（设备支持、工程师入校），定期提交《驻校教学报告》并推...,互联网,http://jobs.zhaopin.com/CC454917820J40832799905.htm,300-499人,2025-12-31 01:14:06,10000.0,11000.0,12.0
大数据开发工程师/郑州,郑州,八六三软件,大专,5-10年,数据库开发,10000-12000,岗位职责：1、参与项目蓝图规划、需求分析，根据需求设计文档、准确且高质量完成代码编写及技术文档编写:2、按照项目计划，完成开发任务，确保项目进度和质量；3、负责系统上线后的技术服务支撑，保障生产环境安全、平稳运行，支撑业务发展；4、对技术难点进行探索和预测，独立执行实施方案。任职要求：1、学信网大专以上学历，计算机相关专业，5年以上项目研发经验；2、责任心强，沟通能力强，熟悉掌握阿里云平台数据开发...,计算机软件,http://jobs.zhaopin.com/CC621497980J40785250209.htm,500-999人,2025-11-12 09:29:10,10000.0,12000.0,12.0
数据开发工程师,郑州,华企高科(北京)科技产业发展有限公司,大专,3-5年,Sql,,岗位内容：1. 负责设计、开发和维护大型数据处理系统。2. 制定和执行数据编码、测试和部署策略。3. 维护现有的数据集成和 ETL 流程，并对其进行优化。4. 跟踪新技术和趋势，推动公司数据技术发展方向。任职要求：1. 至少三年以上数据领域相关的工作经验。2. 熟悉至少一种主流编程语言（如 Python/Java/Scala），有扎实的编码能力。3. 精通 Hadoop 生态系统中的工具和技术。4...,计算机软件,http://jobs.zhaopin.com/CCL1468998810J40746600306.htm,20-99人,2026-01-11 01:15:19,,,
数据工程师,郑州,河南君友数字科技有限公司,本科,1-3年,"数仓开发,Python",,一、岗位职责1.主导数仓架构设计与知识库建设，负责数据接入、清洗、建模，优化代码，保障数据质量。2.负责关系型/向量数据库搭建与维护，优化性能，确保数据存储安全、访问高效。3.统筹数据项目全流程（采集、ETL、集成），编写数据库脚本，保障项目高效交付。4.参与知识库管理，设计知识数据模型，支撑基于大模型的检索及应用。5.开发数据处理程序与自动化工作流，搭建优化数据平台，提升处理与输出效率。6.对接...,咨询服务,http://jobs.zhaopin.com/CC146277870J40836614305.htm,20-99人,2026-01-11 01:12:46,,,
开发工程师,郑州,智联猎头,本科,1-3年,"Java,Python",,岗位职责：1.参与公司信息系统建设工作；2.负责公司bip、无人计量等重要信息系统的日常维护，保障稳定运行； 3.基于公司现有信息系统进行二次开发工作； 4.基于公司现有信息系统进行报表开发工作； 5.基于公司信息系统开展数据分析工作。任职资格：1.本科及以上学历；2.计算机科学与技术、软件工程等相关专业背景优先； 3.熟悉软件开发的全过程，能完成需求分析、系统设计、测试方案等工作；4.熟悉Jav...,互联网,http://jobs.zhaopin.com/CCL1318355140J40867372103.htm,10000人以上,2026-01-08 01:07:58,,,
高级大数据开发工程师,郑州,哈尔滨膏珍堂仁和中医门诊有限公司,本科,3-5年,"数据架构,Java",,1.数据平台开发与维护：参与设计、开发并优化公司的大数据平台架构，确保其高可用性、高性能及可扩展性。2.数据仓库建模与开发：基于业务需求，进行数据仓库的建模，设计并开发稳定、准确的事实表与维度表。3.数据处理与计算：编写复杂的 SQL 进行数据处理和查询，满足多样化的数据应用需求。4.数据质量管理：建立和实施数据质量监控体系，及时发现并修复数据问题，保障数据资产的准确性与一致性。1.本科及以上学历...,医院,http://jobs.zhaopin.com/CCL1371386270J40829272710.htm,20人以下,2026-01-07 01:28:36,,,
交付工程师（数据治理方向）,郑州,国机工业互联网研究院(河南)有限公司,本科,3-5年,"数据清洗,SQL Server,SQL",,岗位职责：1、负责数据项目中数据治理相关工作的落地实施;2、参与数据全生命周期管理制度、规范、流程设计与制定;3、参与数据项目的数据模型设计、数据标准设计、系统集成等环节，保障项目高效交付；4、负责数据质量管理与监控，并开展对数据清洗，归集工作;5、能够和客户的业务部门进行需求调研和沟通，进行系统资料分析;6、开发和维护数据目录，定义数据资产、数据字典和数据地图，确保数据流程的可见性。任职要求：1...,IT服务,http://jobs.zhaopin.com/CC870769860J40755120501.htm,100-299人,2026-01-06 01:00:19,,,
大数据讲师,郑州,中企报(河南)传媒有限公司,学历不限,1-3年,"大数据开发,大数据讲师",,岗位职责：1、负责大数据相关课程的讲授与教案编写，确保教学内容的专业性和前沿性；2、参与教学资源的开发与优化，包括但不限于案例研究、实验指导及在线课程制作；3、指导学生学习，解答疑问，提升学生的大数据技能与理论水平；4、跟踪大数据领域的新技术、新应用，不断更新教学内容，保持课程活力。5、有就业经验（辅导简历，工作内推等）任职要求：1、具备扎实的大数据理论基础，熟悉Hadoop、Spark、Kafk...,文化艺术/娱乐,http://jobs.zhaopin.com/CCL1297173940J40799150405.htm,20人以下,2025-12-28 01:11:45,,,
软件架构师,郑州,河南省悉数大数据科技有限公司,大专,3-5年,"Java,微服务架构,SpringCloud,Dubbo,Vue,JavaScript,SQL",,工作职责:1、负责技术架构设计，根据业务规划，制定技术规划，制定相关的架构方案；2、解决重要项目中的关键架构问题和技术难题，负责项目中关键技术难点的攻关和预研；3、为技术团队提供可行的、有前瞻性的架构方案。形成良好的研发氛围，提升团队整体技术水平；4.积极和其他项目组成员沟通，协同完成整个系统的联调和集成。任职资格:1、计算机相关专业，专科以上学历，5年及以上JAVA开发经验，2年及以上系统架构经...,计算机软件,http://jobs.zhaopin.com/CCL1454683790J40810910811.htm,20-99人,2025-12-27 00:00:03,,,
技术经理,郑州,河南匠策信息技术有限公司,大专,3-5年,,,岗位职责 1、制定并执行技术部门月度工作计划，统筹技术资源分配，确保团队目标与公司战略对齐 2、完善技术管理体系、开发流程、代码规范及文档标准，推动技术标准化建设 3、主导客户技术方案设计与审核，协调跨部门资源，确保项目按时交付并满足质量要求 4、建立项目风险评估机制，针对需求变更、技术难点、人员波动等制定应急预案 技术架构与创新 5、主导技术选型与架构升级，平衡客户定制化需求与公司技术资产沉淀 ...,互联网,http://jobs.zhaopin.com/CCL1409671510J40815791107.htm,20-99人,2025-12-25 15:56:25,,,
技术研发部经理,郑州,河南远东生物工程有限公司,硕士,3-5年,,,一、岗位职责1.主导研发项目全流程（总体规划-立项 - 执行 - 量产转化），优化管理体系，跨部门协同保障项目交付；2.带领团队攻关核心技术，解决量产关键难题，推动研发成果落地；3.搭建并管理知识产权体系（专利 / 软著等布局、申报与维护），防范知识产权风险；4.负责高企、专精特新等政府项目申报、资质维护，对接政策资源；5.推动技术标准化建设，参与行业 / 企业标准制定；6.组建并管理研发团队，搭...,生物工程,http://jobs.zhaopin.com/CC312099210J40859516003.htm,100-299人,2025-12-03 00:00:03,,,
数据治理工程师,郑州,河南景信信息技术有限公司,大专,3-5年,数据治理,,岗位职责：1、数据治理落地推进：主导数据治理项目全流程实施，涵盖需求调研、方案设计、执行落地与效果复盘，协调技术、教务、行政等跨部门资源，解决项目卡点，确保治理目标高效达成。2、数据体系规范搭建：参与数据全生命周期管理制度、技术规范及操作流程制定，设计数据标准（如编码、格式、口径）与数据模型，优化数据架构，为数据资产化奠定基础。3、数据质量管控：构建多维度数据质量监控体系（完整性、准确性、一致性等...,计算机软件,http://jobs.zhaopin.com/CCL1469729100J40801007301.htm,20-99人,2025-10-28 10:55:45,,,
大数据开发工程师,郑州,上海克娜蒂科技有限公司,本科,无经验,大数据,,任职要求1、对大数据分析与开发有一定的技术基础，数据库 Python 等技术有一定的了解；有计算机Linux 数据库MySQL和Oracle数据库基础操2、具备良好的逻辑思维能力和问题解决能力，能够独立完成数据分析任务；3、能够与团队成员有效沟通，共同推进项目的进展。4、要求专业为计算机科学 软件工程 大数据等相关专业。本科及以上学历，公司新项目，急招，可接受应届本科毕业生。5、高底薪项目奖金、年...,计算机软件,http://jobs.zhaopin.com/CCL1515029620J40832989405.htm,20-99人,2026-01-11 01:12:31,,,
BI数据工程师,郑州,河南乐享微生活贸易有限公司,大专,1-3年,,,岗位职责：1. 数据仓库开发与维护负责电商业务数据仓库建设，包括模型设计、数据清洗、指标加工、任务调度，确保数据的准确性、稳定性与时效性。2. 多源数据集成与治理对接 ERP、OMS、WMS、客服系统、投放系统、平台 API（淘宝/京东/拼多多/快手/抖音）等多源数据，完成采集、清洗、规范与标准化建设。3. BI 报表与可视化搭建使用 FineBI、Power BI、QuickBI、Tableau...,互联网,http://jobs.zhaopin.com/CC289456680J40782197516.htm,300-499人,2025-12-31 01:45:55,,,
研发经理,郑州,河南花样年通讯科技有限公司,本科,5-10年,,,岗位职责：1、平台架构能力：具备复杂系统架构设计能力，能规划高可用、高可扩展的连接管理平台，并对技术选型做出决策。2、深度业务理解：深刻理解物联网卡的商业模式、业务流程及运营商的合作模式。3、项目管理与交付能力：优秀的项目全生命周期管理能力，能驱动多团队协作，确保关键项目高质量按时交付。4、难题攻关能力：具备解决物联网连接领域深度技术难题（如海量连接并发、资费计算准确性、跨境漫游、端到端安全）的能...,通信/网络设备,http://jobs.zhaopin.com/CC477722530J40829320710.htm,20-99人,2025-12-25 00:00:01,,,
数据治理专员,郑州,贵州朋航科技有限公司,本科,经验不限,"数据库开发,数据建模,数据治理",,"、构建和优化企业数据治理体系，提升数据管理能力；2、制定和实施数据标准化、元数据管理、数据安全等策略；3、设计并推动数据共享交换机制，完善数据架构与数据目录；4、协助业务部门理解数据需求，促进数据驱动的业务决策；5、监控数据质量，确保数据的准确性、完整性和一致性；6、公司安排老带新，积累经验可晋升专业技术人员。任职要求：1、20-30岁，大专及以上学历，计算机相关专业优先；2、熟练GDPR,CCP...",IT服务,http://jobs.zhaopin.com/CCL1456263840J40805348907.htm,20-99人,2025-12-23 01:18:03,,,
软件测试工程师课程/培训招生(ZZ）,郑州,51Testing,大专,经验不限,"软件测试,测试,游戏软件,工业软件,物流软件",,岗位条件： 1、年龄20-32周岁，超龄勿扰； 2、学历大专及以上，理工科专业毕业优先录用； 3、对互联网行业感兴趣（非销售、非保险岗位）； 4、工作认真、细致、敬业，责任心强； 5、想获得一份有长远发展、稳定、有晋升空间的工作。 待遇： 1、基本工资，另有项目奖金和提成； 2、五险一金，双休、法定节假日，正常休息； 3、公司工作环境优雅、氛围好，同事关系融洽，生日派对、聚餐等活动丰富； 4、给予...,计算机软件,http://jobs.zhaopin.com/CC145362720J40257618902.htm,100-299人,2025-09-05 09:56:03,,,
大数据开发实习生,郑州,滑县巨旺商贸有限公司,大专,经验不限,"数据治理,Sql",,岗位内容：1. 参与设计、实现和维护数据管道和 ETL 流程。2. 进行数据处理和分析，确保数据质量和完整性。3. 支持用户在数据仓库中制定与需求相符的报表或 Dashboard。4. 协助其他团队成员处理数据相关问题并解决疑难杂症。任职要求：1. 熟悉至少一种主流数据库及SQL 语言。2. 了解基础的数据结构和算法，具备简单的编程知识。3. 具备数据挖掘、数据清洗和数据处理的基本能力。4. 具备...,电子商务,http://jobs.zhaopin.com/CCL1486365070J40811999013.htm,20-99人,2025-08-12 16:31:50,,,
