职位,城市,公司,学历,经验,技能,薪资,工作描述,行业,职位URL,公司规模,发布时间
技术研发工程师,北京,北京华德液压工业集团有限责任公司,本科,5-10年,"机械结构设计,液压系统,非标件,船舶制造,航空航天,军工制造",2-4万,岗位职责：1) 负责机电产品的设计、集成和研发。2) 负责非标产品生产、研发运行过程的技术工作。3) 负责非标产品技术文件的编制或审批。4) 针对现有成熟产品进行技术创新，提供高质量、高性价比的产品方案。5) 负责组织或参加产品研发节点会议，攻关解决设计研发过程中遇到的问题。6) 协助经营部门进行客户开发，为销售人员提供技术支持。7) 配合完成产品试验、交付及相关审价工作。任职资格：1)本科及以上...,电气机械/电力设备,http://jobs.zhaopin.com/CC000145790J40411600601.htm,1000-9999人,2025-12-04 00:08:41
技术负责人（需具备四库一平台业绩）,北京,中航天业,大专,10年以上,四库一平台业绩,2-4万,1、符合工业设计资质标准、建筑业企业资质中对于技术负责人的要求（冶金、机电安装环保专业）。2、个人业绩信息可在“全国建筑市场监管公共服务平台（四库一平台）”查询验证（需提供平台截图及网址链接）。3、其他事项可面议。,环保,http://jobs.zhaopin.com/CC285492130J40971114504.htm,100-299人,2025-12-03 13:40:31
高级硬件工程师,北京,北京历正科技有限责任公司,本科,5-10年,安防监控产品,3-4万·13薪,岗位职责：1、反无类产品设计开发，包括单板、模块、整机类产品，数字基带方向;2、负责单板硬件设计、开发、测试、维护，输出相关技术文档、单元测试报告、使用手册等;3、负责方案选型、评估、协助PM按时完成产品交付;4、负责单板、整机BUG定位及整改，EMC、EMI、可靠性问题整改;5、负责外协类产品技术沟通。任职要求：1、电子、自动化、电气、通信相关专业统招本科以上学历;2、有过5年及以上产品开发经验...,通信/网络设备,http://jobs.zhaopin.com/CC662918130J40397614906.htm,100-299人,2025-12-02 18:27:43
非标机械设计总监,北京,济南易恒技术有限公司,本科,5-10年,"研发,设计,结构设计,非标设备,自动化设备,装配工艺,SolidWorks,汽车制造装备",3-4万,岗位概述：作为公司机械设计领域的最高技术及管理负责人，本岗位将全面指导公司的机械设计团队。核心职责是制定并实施机械技术发展战略，提升团队整体设计与创新能力，优化设计流程与规范，确保所有非标自动化项目在技术先进性、设计质量、交付效率及成本控制方面达到行业领先水平。您是公司技术实力的象征，也是团队成长的催化剂。 岗位职责： 一、技术战略与规划 负责公司非标自动化装备的机械技术路线规划与前瞻性技术研究，...,工业自动化,http://jobs.zhaopin.com/CC120759330J40807815807.htm,100-299人,2025-12-02 10:24:14
机械研发主任,北京,徐州瑞马智能技术股份有限公司,本科,5-10年,"研发,非标设备,SolidWorks",3-4万,岗位职责：1.负责连续镀锌线/镀锌铝镁线/彩涂线/酸洗线的机械研发设计；2.负责产线及单机设备的研发设计；任职要求：1.本科及以上学历，机械类专业；2.有丰富的非标自动化设计经验，参与主导过研发项目；3.具备较强的沟通能力和创新研发思维；,通用设备制造,http://jobs.zhaopin.com/CC703566680J40821664914.htm,1000-9999人,2025-11-29 07:59:00
资深硬件开发工程师(J10065),北京,中信科智联科技有限公司,本科,5-10年,"PCBLAYOUT,硬件测试",2.5-4万,岗位职责: 1. 负责车载电子ECU/边缘计算设备硬件系统的电路设计和优化，包括原理图设计、PCBLayout设计，以及整机的电气系统架构设计； 2. 负责车载电子ECU/边缘计算设备关键器件的选型并与外部厂家进行技术对接，与软件团队合作与协同开发； 3. 负责完成硬件需求的研发落实、测试验证和文档编写，参与解决开发中各阶段的技术问题。 任职要求: 1. 本科及以上学历，电子、机电、自动化等相关专...,物联网,http://jobs.zhaopin.com/CCL1382511140J40898773715.htm,300-499人,2025-11-28 10:45:15
压裂撬技术专家 (MJ000191),北京,北京天玛智控科技股份有限公司,本科,10年以上,"设计,压裂泵,压裂撬",2-4万·20薪,岗位职责：1.负责组织压裂撬领域前瞻性技术路线规划与核心产品开发策略制定；2.负责组织压裂撬产品技术研究及产品开发；3.负责组织压裂撬相关技术规范与标准、一体化解决方案和牵头重点科研项目的申报及实施；4.负责协助开展技术团队建设及专业化人才培养；5.完成领导交办的其他工作。任职资格：1.硕士及以上学历，机械、液压等相关专业；2.具备独立进行压裂撬技术研究及产品开发能力；3.8年及以上压裂撬核心技术...,仪器仪表制造,http://jobs.zhaopin.com/CC000454810J40692913406.htm,500-999人,2025-11-26 11:48:15
高级硬件开发工程师,北京,北京亿波普天科技有限公司,硕士,5-10年,嵌入式,3.5-4万,岗位职责：1.负责产品设计工作，参加科研项目，完成产品的设计、研制、试验和应用。2.负责产品改进工作，完成产品存在的故障和问题进行分析，提出解决方法。3.协助需求调研工作，完成相关技术与产品的政策需求、客户需求和竞品分析。4.负责技术支持工作，完成产品的生产与推广应用中技术支持。5.负责相关技术成果撰写专利技术文档。 任职要求：1.硕士及以上学历，计算机、电子、通信、仪器仪表等相关专业。2.熟悉模...,通信/网络设备,http://jobs.zhaopin.com/CC435876430J40968946704.htm,20-99人,2025-11-24 21:21:59
火箭结构总体设计师,北京,江苏深蓝航天有限公司,硕士,3-5年,火箭,2-4万,岗位职责:1. 负责火箭结构的总体设计，确保设计符合技术和安全标准2. 与团队合作，参与火箭结构的测试和验证工作3. 持续优化火箭结构设计，提升产品性能和可靠性4.制定结构总体技术要求，安排任务计划，协调各专业工作。任职要求:1. 具备出色的沟通能力，能够高效协调项目相关事宜2. 能够在团队环境中迅速适应并贡献力量3. 具有持续学习和改进工作方法的能力，以应对挑战,船舶/航空/航天/火车制造,http://jobs.zhaopin.com/CCL1306800450J40775288616.htm,300-499人,2025-11-21 11:04:46
高级硬件工程师,北京,卓曜(深圳)科技有限公司,本科,5-10年,"嵌入式硬件开发,电路设计,PCB设计,Layout设计",2-4万,岗位职责：1、 元器件评估选型，硬件方案文档撰写；2、 参与完成公司硬件研发，原理图设计、PCB设计；3、 参与硬件调试、性能测试和产品化等工作；4、 参与并承担硬件与设备的维护及改进工作；5、 严格执行硬件开发和生产质量控制规范，各阶段按规定输出对应的文档。岗位要求：1、 电子专业本科，五年以上工作经验；2、 熟悉Cadence Allegro、Concept HDL开发软件；3、 熟悉模拟和数...,电子设备制造,http://jobs.zhaopin.com/CCL1296775410J40443144007.htm,20-99人,2025-11-20 10:20:56
光机结构设计,北京,济宁市正海商贸有限公司,本科,经验不限,"SolidWorks,CAD",2.5-4万·14薪,职责描述：1、完成精密仪器设备中光学系统的机械结构设计、精密机械部件设计；2、联系外协加工商，并控制加工到货产品质量；3、进行光机结构及设备整体结构设计、装调、完善；4、整理编写研发文档。,零售/批发,http://jobs.zhaopin.com/CCL1225848840J40900889908.htm,,2025-11-17 17:11:05
高级硬件开发工程师,北京,中电智能科技有限公司,硕士,5-10年,"设计,开发,硬件测试,FPGA研发,DSP研发,PCB设计,团队管理经验优先",2-4万,职位描述1. 硬件需求分析及设计；2. 产品规格设计、原理设计、PCB设计、元器件选型；3. 公司新产品样机的调试及验证；4. 公司已有产品的改进和完善；5. 参与产品规划、需求调研，与客户的交流和沟通；6. 为生产、售前和售后部门提供技术支持；7.参与硬件设计、开发、测试、维护的各个环节。任职资格：1. 具备5年及以上相关硬件开发工作经验，统招硕士及以上学历，计算机相关专业，有过三年以上团队管理...,仪器仪表制造,http://jobs.zhaopin.com/CC819861210J40796931705.htm,100-299人,2025-11-17 15:14:25
结构仿真工程师,北京,北京泽声科技有限公司,本科,经验不限,"结构仿真,力学仿真",2-4万,岗位职责：1. 针对公司应变传感器芯片及客户应用结构建立参数化仿真模型。2. 运用有限元分析软件进行静力、冲击、疲劳及非线性（如大变形）等仿真计算。3. 参与或主导仿真结果的实验验证，通过对比测试数据，校准和修正仿真模型，提升仿真精度。4. 对传感器在不同条件下的应用结构进行优化。5. 与设计工程师紧密合作，为传感器芯片的设计（硅片形状、应变区布局、力传导结构）提供仿真数据支持和改进建议。6. 负...,电子/半导体/集成电路,http://jobs.zhaopin.com/CC602652730J40850047312.htm,20-99人,2025-11-17 09:47:58
硬件工程师,北京,丹阳慧创医疗设备有限公司,本科,经验不限,,2-4万,工作职责1，负责硬件电路设计，可行性验证，可靠性实验等2，负责原理图设计、PCB设计及调试工作；样机的调试工作；3，负责样机生产转产及在线产品硬件维护工作任职资格1，电子信息、自动化、机电一体化、生物医学工程、精密仪器、计算机、测控技术等相关专业，本科及以上学历；2，有较好的硬件相关基础知识，和良好的的电路设计、调试能力；具有嵌入式系统开发调试经验，开发过相关产品；3，熟悉电子电路的原理图设计、P...,医疗设备/器械,http://jobs.zhaopin.com/CC478377080J40624746709.htm,100-299人,2025-11-14 17:45:17
卫星结构工程师,北京,北京钧天航宇技术有限公司,本科,3-5年,,2-4万,岗位职责：1、负责卫星构型及布局设计;2、负责卫星各系统相关接口协调:3、负责卫星平台结构详细设计、投产工作4、负责星上单机结构详细设计、投产工作;5、负责整星及单机有限元分析、优化工作;6、完成技术要求编写、技术协调、产品过程控制及验收等工作:7、负责相关结构机构产品的试验方案设计、试验大纲编写、试验开展及试验结果分析工作。任职资格：1、飞行器设计、机械设计、力学等相关专业本科以上学位;2、具有...,船舶/航空/航天/火车制造,http://jobs.zhaopin.com/CCL1389293510J40837696613.htm,100-299人,2025-11-12 17:09:23
硬件工程师（医疗行业）,北京,北京谊安医疗系统股份有限公司,硕士,5-10年,"嵌入式硬件开发,PCB   原理图",2-4万·13薪,"岗位职责： 1. 负责呼吸机、麻醉机等医疗产品硬件电路方案的设计，关键器件的选型； 2. 参与硬件产品的前期规划和评审，以及可行性,风险分析； 3. 根据产品需求，负责硬件方案选择和总体设计，规格制定和分解； 4. 支持制订硬件开发的测试方案和相关硬件模块的调试； 5. 负责关键硬件问题的定位分析； 6. 提供项目后期的技术支持，产品培训等。 任职资格： 1. 本科及以上学历，通信工程，电子信息工...",医疗设备/器械,http://jobs.zhaopin.com/CC145182990J40486452914.htm,1000-9999人,2025-11-12 00:25:43
高级硬件工程师,北京,华力创通,本科,5-10年,"设计,技术支持,硬件项目管理经验",2-4万,岗位职责：航空、航天、国防电子领域的定位导航定位设备的硬件设计工作：1.板卡及整机设备的组件、元器件选型工作；2.板卡的原理设计、PCB设计、BOM表编制；3.单板的硬件调试工作；4.配合逻辑、软件人员进行单板联合调试；5.配合项目现场调试；6.配合生产部门解决生产中的技术问题；7.配合测试部门解决环境试验中的技术问题；8.编写各阶段设计报告、设计方案、调试记录、总结报告等；9.参与项目前期的系统...,计算机硬件,http://jobs.zhaopin.com/CC000244620J40940107204.htm,500-999人,2025-11-11 09:53:03
机械设计师（灵巧手）,北京,北京因时机器人科技有限公司,本科,1-3年,"设计,研发,结构设计,精密设备,灵巧手,传动机构",2-4万·14薪,岗位职责：1.负责灵巧手结构设计，包括原理设计、详细设计、出图及BOM整理等。如：根据灵巧手的应用场景和性能要求，提出创新性的解决方案；2. 进行灵巧手结构的力学分析和建模仿真，确保结构的强度满足设计要求，并基于仿真结果对结构进行优化改进；3. 跨部门沟通：协调机械、电控、软件、测试之间的工作对接，协助完成灵巧手的整体性能测试和问题优化；4. 负责灵巧手零部件的选型和供应商评估，跟踪供应商开发和产...,通用设备制造,http://jobs.zhaopin.com/CC439173380J40817535705.htm,100-299人,2025-11-11 00:06:40
高级硬件工程师,北京,北京通嘉宏瑞科技有限公司,本科,5-10年,,3-4万·15薪,岗位职责1、负责硬件团队管理，技术路径制定；2、负责制定电路原理图设计方案、熟悉数电、模电，制定功能电路的绘制方案；3、负责制定产品硬件的PCB检查、样机调试、硬件性能和功能测试方案；4、负责控制硬件成本、风险、质量、方案评估器件选型等；5、管理相关设计文档和使用说明文档；6、领导交办的其他工作任务；任职要求1、本科及以上学历，电子、电气、控制、通信、机电等相关专业；2、3年以上工业控制硬件开发团...,电子/半导体/集成电路,http://jobs.zhaopin.com/CC891906420J40819061502.htm,1000-9999人,2025-11-10 10:13:46
硬件工程师,北京,新拓尼克科技研发中心 / Syntronic Beijing R&D Center,本科,5-10年,机器人,2-4万,职位描述：1.机器人硬件方案设计，嵌入式硬件开发；2.硬件系统集成，关键零部件选型评估；3.机器人硬件调测，试产、量产流程推动；4.负责撰写技术相关及质量体系所要求的文档。任职要求：1.计算机/自动化/电子相关专业，本科学历5年以上或研究生学历3年以上工作经验；2.熟练使用Cadence 设计软件，精通嵌入式硬件开发，有较强的电路设计和调试能力，熟悉常用传感器及接口；3.熟悉CPU、MCU、FPG...,运营商/增值服务,http://jobs.zhaopin.com/CC134310320J40731694806.htm,500-999人,2025-11-07 14:10:56
硬件研发（武汉/南京/北京/西安/深圳）(J13297),北京,北京四方继保自动化股份有限公司,本科,5-10年,"DCDC,变流器,脉冲电源",2-4万·14薪,岗位职责:1. 负责SST产品功率单元内部功率器件（MOS或IGBT）的选型、开关损耗分析设计、仿真分析；2. 负责SST产品模块内板载焊接式隔离变压器、功率电感的及隔离电容等关键器件的设计与选型3. 能够对大电流（≥100A）电路进行PCB布局，负责模块级电磁兼容分析和硬件疑难问题排查；4. 参与并指导单板、模块及产品整机的试制、调试、型式试验指导和故障分析。任职要求:1. 本科及以上学历，电力...,电力/水利/热力/燃气,http://jobs.zhaopin.com/CC000599020J40807124807.htm,1000-9999人,2025-11-06 15:56:40
事业部副总经理/总工程师（材料、结构或环境方向均可）,北京,上海建科咨询集团股份有限公司,本科,5-10年,,2-4万,核心职责包括战略分解与执行、分管业务线管理、事业部业绩指标达成、跨部门协调等。任职要求：1.年龄40周岁以下；2.具备8年及以上检测行业管理工作经验，有中大型国有或央企检测机构背景；3.具备副高级及以上专业技术职称；4.本科及以上学历；5.专业背景符合以下条件之一：材料、结构、环境等相关工程或检测类专业；6.中共党员优先。,专业技术服务,http://jobs.zhaopin.com/CC710523380J40802420211.htm,1000-9999人,2025-11-05 18:38:53
硬件开发工程师,北京,科益虹源,本科,3-5年,,2-4万,岗位职责：1、负责单板硬件全流程开发，主导单板硬件器件选型、原理图设计到SDV测试的完整研发过程；2、完成硬件板卡的程序编写和调试工作； 3、根据板卡的功能和性能需求，制定准确合理的板卡测试方案； 4、对现有功能电路进行优化和升级；5、负责撰写板卡使用说明等应用文档；6、负责协助解决客户在产品使用和项目开发过程中遇到的问题。任职要求：1、985/211本科及以上学历，电子电气、控制、自动化、计算机...,电子/半导体/集成电路,http://jobs.zhaopin.com/CC424343330J40790485307.htm,300-499人,2025-10-31 00:38:03
硬件工程师,北京,北京华信泰科技股份有限公司,本科,1-3年,"通信/网络设备,硬件设计,ADC/DAC",2-4万·13薪,岗位职责：1、参与原子钟硬件电路的开发2、参与硬件设计文档的编写及版本维护3、针对原子钟特性进行深入研究4、解决生产及研发过程中遇到的问题任职要求：1、电子科学与技术，自动化等专业，本科以上学历2、具有扎实的模拟电路设计经验，有射频电路设计设计经验优先3、熟练使用ADS/Candance等电子设计自动化软件4、有Jun品设计经验者优先5、具有独立钻研能力,运营商/增值服务,http://jobs.zhaopin.com/CC229963610J40794060811.htm,20-99人,2025-10-14 20:09:51
硬件工程师(J10071),北京,中国大恒(集团)有限公司北京图像视觉技术分公司,硕士,3-5年,"器件选型,集成电路",2-4万,岗位职责1、 负责公司智能工业摄像机、高速图像采集处理设备、3D相机等工业智能嵌入式产品的的硬件设计，包括Sensor单板，数字处理单板，传输物理层单板，控制单板等；覆盖单板需求分析，单板方案设计、器件选型与认证、原理图设计、高速PCB设计、信号完整性仿真等开发活动，输出规范化的设计文档；2、 负责工业相机设计中电路单板及整机性能的调试与测试：包括电源质量、功耗测试，高速信号完整性测试、整机EMC...,计算机硬件,http://jobs.zhaopin.com/CC120188730J40250933412.htm,500-999人,2025-10-11 13:29:40
硬件工程师（子公司机器人方向）,北京,新兴装备,硕士,5-10年,硬件测试,2-4万,负责永磁同步电机（PMSM）驱动核心算法的设计、开发与优化，聚焦机器人应用场景（如机械臂关节、移动机器人驱动轮、末端执行器等）。包括但不限于：1、磁场定向控制（FOC）、空间矢量脉宽调制（SVPWM）算法的精细化实现；2、无传感器控制算法（如滑模观测器、扩展卡尔曼滤波、模型参考自适应等）的研发与迭代，解决机器人传感器安装受限问题；3、位置环 / 速度环 / 电流环三闭环控制策略设计，优化动态响应速...,船舶/航空/航天/火车制造,http://jobs.zhaopin.com/CC564432120J40761971216.htm,300-499人,2025-09-30 11:27:34
硬件工程师(J10057),北京,北京微纳星空科技股份有限公司,本科,5-10年,硬件设计,2-4万,岗位职责: 1、负责卫星单机设备硬件设计，提出FPGA相关设计解决方案； 2、负责依项目需求进行器件选型、电路原理图及PCB绘制； 3、负责系统硬件单机测试，与其他部组件联合测试； 4、负责编写硬件产品接口技术要求、测试及总结文档。 任职要求: 1、具有五年以上的硬件设计工作经验，以Cadence设计工具为主； 2、具有电子信息、自动化、计算机等相关专业背景； 3、具备模拟电路与数字芯片电路设计经...,船舶/航空/航天/火车制造,http://jobs.zhaopin.com/CC552355480J40565647603.htm,100-299人,2025-09-25 10:49:25
中级结构工程师,北京,北京中凯新科科技有限公司,硕士,5-10年,,2-4万,岗位职责：1.主导热控产品的结构设计工作；2.主导热控产品的有限元仿真和热仿真；3. 主导设计方案的撰写，项目评审，主导产品的制造过程；4.撰写GJB质量体系文件；5. 优化产品设计工艺，设计方法等，持续提高产品竞争力；6. 辅导新员工；7.撰写专利； 任职要求：1.学历：统招硕士及以上，机械、力学等相关专业。2.经验：8年结构设计或3D打印等设计经验，有热设计与流体力学等设计经验优先；有多批次、...,船舶/航空/航天/火车制造,http://jobs.zhaopin.com/CC507191730J40743886507.htm,20-99人,2025-09-25 00:08:03
机械工程师,北京,北京伯兰特科技有限公司,硕士,经验不限,,2.5-4万·16薪,岗位职责1、参与新品的需求分析、评审、测试验证，负责机械结构方案设计；2、产品零部件三维模型的设计、二维图纸的绘制，整机明细表的编制；3、负责组织主管产品的设计方案、主要计算数据、产品试验方案等；4、负责根据产品生产要求编制、维护技术标准文档；5、负责产品结构改进，解决量产阶段遇到的技术问题；6、协助生产和客服部门进行人员培训和技术指导。,电子/半导体/集成电路,http://jobs.zhaopin.com/CCL1483626040J40803073710.htm,1000-9999人,2025-09-19 15:39:08
卫星结构工程师(J10010),北京,北京微纳星空科技股份有限公司,硕士,5-10年,SolidWorks,2-4万,岗位职责: 1、负责与大系统及总体进行接口协调； 2、负责卫星构型和单机布局设计； 3、负责卫星结构、部件设计并投产； 4、负责结构的试装和问题处理； 5、完成上级安排的其他工作。 任职要求: 1、专业、学历：硕士以上学历，机械结构设计或飞行器结构设计专业； 2、工作经验：5年以上航天器结构设计经验； 3、岗位技能：熟练运用机械设计软件； 4、熟悉常用的传动形式，有设计传动设备经验优先； 5、独立...,船舶/航空/航天/火车制造,http://jobs.zhaopin.com/CC552355480J40559266103.htm,100-299人,2025-09-25 09:52:45
混凝土预制件技术工程师,北京,金风科技股份有限公司,本科,5-10年,,2.5-4万,一、生产效率提升1、分析生产数据（如OEE、节拍时间、良品率），提出效率提升方案。2、设计并实施标准化作业指导书（SOP），确保操作规范化和一致性。3、推动自动化、智能化设备应用，减少人工干预。二、成本控制与质量管理1、监控原材料、能源、人力等资源消耗，制定降本措施。2、与质量部门协作，分析生产缺陷根因，减少返工和报废率。3、建立精益生产KPI体系，定期评估改进效果。三、跨部门协作与培训1、与研发...,电气机械/电力设备,http://jobs.zhaopin.com/CC138718430J40747781614.htm,10000人以上,2025-09-18 00:45:41
高级机械设计工程师,北京,北京中测国宇科技有限公司,硕士,5-10年,"非标设备,精密设备,装配设备,微波测试系统,紧缩场",2.5-4万·13薪,岗位职责 1、根据项目方案要求独立完成机械结构设计及出图； 2、机械类转台、直线传动等部件的设计，传动部件力学计算，包括驱动电机、减速机等外采标准件的选型； 3、根据客户需求绘制产品方案模型并编写产品方案投标文档； 4、主导产品结构设计，组织各阶段的评审工作； 5、根据客户需求，编写外协定制产品的技术协议文档； 6、根据项目经理要求，按时完成项目中实施部分产品交付，并完成定制品的验收及相关文件的编...,电子/半导体/集成电路,http://jobs.zhaopin.com/CC342860330J40569677412.htm,20-99人,2025-09-17 16:44:55
卫星结构分系统工程师,北京,北京天章卫星科技有限公司,硕士,1-3年,"整星结构,结构力学仿真,卫星工艺性设计",2-4万·13薪,主要职责： 1、卫星结构和工装设计、结构力学仿真、投产； 2、开展卫星工艺性设计，编制总装技术要求； 3、卫星电缆网模型图及电缆长度、分支设计；4、卫星结构惯量和质心等核准，星箭分离对接等；5、参与星箭一体化设计的论证和设计工作。任职要求:1、硕士及以上学历；机械设计、飞行器设计、航天工程等相关专业； 2、具备扎实的机械设计基础和动力学仿真分析基础，能够熟练使用Creo等结构设计制图软件、Adam...,船舶/航空/航天/火车制造,http://jobs.zhaopin.com/CCL1492283710J40783939511.htm,20-99人,2025-09-12 14:43:49
