职位,城市,公司,学历,经验,技能,薪资,工作描述,行业,职位URL,公司规模,发布时间
阀门设计师(J10049),北京,北京中科宇航技术有限公司,本科,5-10年,设计,2-4万·13薪,岗位职责: 1.负责液体阀门的方案论证、选型或设计出图； 2.负责相关阀门的流动性、强度等仿真分析； 3.负责产品生产加工过程的技术协调、跟踪产品生产进度，负责产品的验收和交付后的使用维护； 4.负责组织策划产品相关试验的策划实施、技术协调和跟踪配合。 5.负责本专业前沿技术跟踪，参与项目论证、汇报以及市场开发的技术支持等工作 任职要求: 1.本科及以上学历，液体火箭发动机、航空宇航推进理论与工程...,船舶/航空/航天/火车制造,http://jobs.zhaopin.com/CCL1234922810J40770790510.htm,500-999人,2026-01-08 00:41:01
机械-机器人结构工程师,北京,北京金钢科技有限公司,本科,5-10年,"机器人,机械结构",2-4万,岗位职责1、深度参与机器人产品从概念设计到量产交付的全生命周期，负责结构、传动、执行机构等核心模块的方案设计与细节落地； 2、输出关键零部件的详细设计方案、工程图纸及 BOM 清单，主导核心部件的敏捷试制、性能验证与快速迭代优化，同步设计生产所需工装夹具； 3、与软件、算法、硬件等团队紧密协作开展系统联调，确保机械结构与控制系统的高兼容性，快速定位并解决机械设计、工艺实现、装配集成中的技术问题； ...,电子/半导体/集成电路,http://jobs.zhaopin.com/CC699520630J40785894816.htm,100-299人,2026-01-07 11:32:36
设计管理岗（结构）,北京,中化学国际工程有限公司,硕士,10年以上,"结构专业设计,建筑专业设计",2.8-4万,岗位职责：（1） 参与组织、指导和协调项目的设计管理工作。（2）监督推进设计工作按合同的要求（包括进度、费用和质量）完成。（3）参与配合采购与施工工作，满足项目建设的要求。（4）对接业主或PMC，汇总分析业主或PMC审查意见，及时解决专业问题。（5）做好项目设计变更管理，建立专业变更台账。（6）参与设计交底，处理施工开车中的设计问题，做好设计总结。岗位要求： （1） 10年以上炼油石化项目土建或结...,石油/石化,http://jobs.zhaopin.com/CCL1456969080J40665879809.htm,100-299人,2026-01-07 09:56:58
结构工程师-无人机,北京,航景创新科技,本科,3-5年,"航空器,飞机部件设计,机身设计,机翼设计,AutoCAD,起落架系统设计",2-4万,岗位职责：1.负责无人机、固定翼无人机的结构设计开发，包括无人机复合材料和金属材料结构设计、起落架设计工作；2.负责无人机数字样机、系统布置协调和制造协调；3.负责复合材料零部件的材料选择、铺层设计；4.负责无人直升机的装配与调试，编制设计方案、测试方案及相关技术报告等，参与设计、工艺评审，并落实评审改进意见；5.完成上级交代的其他任务。任职要求：1.理工科本科及以上学历，机械设计类或复合材料类专...,船舶/航空/航天/火车制造,http://jobs.zhaopin.com/CC188648320J40810903108.htm,300-499人,2026-01-06 11:55:20
高级机械工程师-英语工作语言,北京,南阳翰格信息咨询有限公司,本科,经验不限,"设计,研发,制图设计,AutoCAD",2.5-4万,岗位职责1. 机械安装手册编制与迭代依据项目定制化需求，独立编制项目级机械安装操作手册；持续收集手册现场应用反馈，推动内容的优化升级，确保手册与项目实际场景的适配性、实操性。2. 技术支持与培训赋能为项目提供机械安装环节的技术支持，组织开展整机吊装专项培训；梳理现场问题清单，协调客户、施工方等相关方推进问题闭环，并同步更新优化安装手册。3. 安全风险管控文件管理负责机械安装作业过程中的安全风险识别...,咨询服务,http://jobs.zhaopin.com/CCL1411120670J40785428716.htm,500-999人,2026-01-06 10:51:28
2026-结构设计工程师,北京,鼎桥技术有限公司,本科,5-10年,"装配工艺,焊接工艺,CREO,手机",2-4万·15薪,岗位职责:1、参与新产品结构件2D&3D 设计；制作结构工程文件并发行，支持新产品开发试产试制；2、产品各开发阶段生产和测试问题点分析定位，提供改善方案并跟踪改善；3、模具方案分析，供应商模具问题检讨及分析，模具进度追踪，现场支持试模；4、各阶段料号申请，BOM发行，工程变更等文档管理，协助完成样品封样。5、协助产线处理生产问题，来料质量问题，售后问题处理。任职要求:1、机械设计及制造、材料成型、...,通信/网络设备,http://jobs.zhaopin.com/CCL1511150630J40835144014.htm,1000-9999人,2026-01-06 10:12:58
硬件工程师（中高级）,北京,京清数电(北京)技术有限公司,本科,5-10年,"储能变流器 逆变器 变频器,电源",2.5-4万·14薪,岗位职责：1、负责级联式高压大功率电力电子硬件开发工作；2、功率模块等硬件开发及测试，配合结构、电气工程师，对级联式高压整机的硬件进行开发及测试；3、解决产品开发过程中遇到的技术问题；4、负责技术开发过程中的文档编写及汇总。任职要求：1、电力电子，电气工程，自动控制等相关专业本科及以上学历；2、高压变频器/高压SVG/光伏/储能等相关行业5-10年以上工作经验；3、有高压电力电子变压器、中压SVG...,新能源,http://jobs.zhaopin.com/CCL1379379080J40862536503.htm,100-299人,2026-01-06 00:00:03
修缮技术总工,北京,东方雨虹,本科,5-10年,"建筑设计,建筑施工管理,建筑监理,建筑造价,建筑招投标,土建工程,市政工程",2.5-4万·14薪,1、负责建筑检测和修缮技术体系的建设和发展；2、负责建筑修缮重点项目的工程技术支持；3、负责与行业协会、设计院、大客户等的技术交流；4、负责对建筑修缮施工群体的技术培训和技术推广。任职要求：1、具有修缮工程技术的规划与策划能力，能够制定建筑修缮的技术发展方向和技术路线图2、善于沟通和表达；3、熟悉使用各种常用设计软件；4、熟悉相关专业技术规范，且好学上进，有创新意识；5、工作踏实、责任心强，团队合...,建材,http://jobs.zhaopin.com/CC000447610J40914432615.htm,10000人以上,2026-01-05 18:36:02
硬件工程师（电源）,北京,大束科技(北京)有限责任公司,本科,10年以上,"电源模块,开关电源,高压控制板",2.5-4万,岗位职责：1、负责不同规格高压控制电路、隔离电源电路的设计和调试；2、负责低压恒流源和恒流源模组电路原理图设计、PCB Layout与调试工作3、负责技术文档的编写；4、负责疑难问题的分析，并提供解决方案；岗位要求：1、本科及以上学历2、有相关电源经验，或者模拟电路能力突出，愿意研究,仪器仪表制造,http://jobs.zhaopin.com/CC840143720J40904699315.htm,20-99人,2026-01-05 11:05:11
结构工程师（PCS模块热设计方向）,北京,杰瑞集团,本科,5-10年,,2-4万·15薪,一、工作内容1、和研发硬件工程紧密合作，依照产品开发流程，全程主导产品的散热评估、设计计算；2、负责产品的热测试工作；3、进行散热器件开发工作，并控制成本；4、负责竞品散热方案测试、分析；5、参与热设计规范的制定与完善；6、掌握业界技术动态，参与技术预研。二、任职资格1、3年以上储能变流器产品集成热设计经验。本科3年以上，硕士1年以上工作经验；2、熟悉功率电力电子产品（如光伏逆变器、储能变流器）的...,石油/石化,http://jobs.zhaopin.com/CC212499610J40867543803.htm,1000-9999人,2026-01-05 09:58:55
结构及设备设计工程师,北京,先进核能装备系统(北京)有限公司,硕士,3-5年,"核电站设计,核电设备管理,核反应堆管理",2-4万,"岗位职责： 1、根据公司安排完成反应堆结构及设备设计及分析; 2、熟练使用solidworks或其他三维设计软件，或熟练使用workbench、abaqus三维结构分析软件； 3、进行反应堆结构及设备设计相关的安审交流沟通； 4、编写设计报告、图册等技术报告、文件。 岗位要求： 1、力学/机械/设备设计等相关专业。硕士研究生及以上学历; 2、3年以上工作经验; 3、具备良好的沟通与团队合作能力,责...",工程技术与设计服务,http://jobs.zhaopin.com/CCL1511571060J40861571303.htm,20-99人,2026-01-04 15:23:59
气液连接器设计师(J10007),北京,东方空间技术(山东)有限公司,硕士,3-5年,"非标设备,研发,航空航天",2-4万,岗位职责: 1.负责箭地加泄&气管连接器产品总体方案设计、详细方案设计； 2.负责箭地加泄&气管连接器产品仿真计算、投产、试验、交付； 3.负责箭地加泄&气管连接器设计、试验、操作类文档编制； 4.负责与箭上、地面其他分系统的技术要求、接口对接。 任职要求: 1.机械设计、流体力学、工程热物理、低温工程等相关专业硕士及以上学历； 2.熟练应用设计制图软件，熟练应用流体力学、液压等仿真计算软件； 3...,计算机软件,http://jobs.zhaopin.com/CCL1337298890J40683765602.htm,100-299人,2026-01-04 14:36:57
结构工程师（PCS模块结构设计）,北京,杰瑞集团,本科,5-10年,,2-4万·15薪,一、工作内容1、功率模块结构设计，根据产品需求完成PCS功率模块的电路结构设计，包括元器件选型、散热系统设计、绝缘防护设计、EMC设计等；2、样机组装与测试：负责样机组装、评审及调试，解决产线生产中的结构问题；3、与硬件工程师、测试工程师协作，完成产品的迭代设计及性能验证；4、输出功率模块组装、走线、紧固、标识等工艺文件；5、文件管理：编制产品BOM清单、设计图纸及技术文档，确保设计符合规范。二、...,石油/石化,http://jobs.zhaopin.com/CC212499610J40867542203.htm,1000-9999人,2026-01-05 09:57:08
北京建龙矿业 机械工程师,北京,黑龙江建龙矿业集团有限公司,本科,5-10年,,3-4万,一、任职资格：1、本科及以上学历，985/211/双一流院校优先，机械工程、矿山机械、机电一体化等相关专业背景；2、45周岁以下(条件优秀者，年龄可适当放宽)；3、需具备 5年以上大型井下矿山机械设备管理或设计经验，熟悉铁矿开采流程及核心设备的运维、改造或研发；4、精通机械设计原理、液压传动、设备故障诊断与维修技术，能独立完成设备优化方案；5、熟练使用AutoCAD、SolidWorks等制图软件...,矿产/采掘,http://jobs.zhaopin.com/CCL1252533680J40836482405.htm,1000-9999人,2026-01-04 10:40:50
结构设计工程师（齿科种植体及配件）,北京,爱迪特(秦皇岛)科技股份有限公司,本科,1-3年,"Pro/E,UGNX,ANSYS,精密设备",2-4万,一、核心工作职责1. 产品设计与仿真一体化开发◦ 主导齿科种植体核心结构设计，包括植入体（螺纹结构、表面形态、连接方式等）、基台（愈合基台、修复基台）、上部结构（abutment、冠桥连接配件）的 3D 建模、2D 工程图绘制，确保设计数据精准合规。◦ 依托 ANSYS 开展结构仿真分析：运用 ANSYS Mechanical 等模块，对种植体及配件进行生物力学仿真（如咀嚼载荷下的应力分布、应变分...,医疗设备/器械,http://jobs.zhaopin.com/CC599187620J40866719803.htm,500-999人,2026-01-03 14:01:23
硬件工程师（惯导方向）,北京,北京李龚导航科技股份有限公司,本科,5-10年,"惯导,航空航天,原理图设计",2-4万,岗位职责： 负责惯导产品原理图设计、PCB设计、硬件方案设计、电路调试。 任职要求： 1.理工科专业本科以上学历，电子、导航控制、自动化、精密仪器等专业优先； 2.大学英语四级以上水平，具备良好的听说读写能力； 3. 刻苦耐劳，积极主动；具有团队合作精神和坚韧的毅力； 4.五年以上惯导产品开发相关经验。熟悉惯性器件应用，有惯导型号设计经验者优先，精通电磁兼容设计者优先; 5.精通FPGA软件开发者...,船舶/航空/航天/火车制造,http://jobs.zhaopin.com/CC373907880J40619498403.htm,100-299人,2025-12-31 11:13:39
阀门设计-北京-00165,北京,北京天兵科技有限公司,硕士,3-5年,"研发,设计,结构设计,非标设备,精密设备",2-4万,岗位职责1、负责液体火箭增压系统保险阀、电磁阀和加注阀方案分析工作；2、负责保险阀、加注阀、电磁阀、过滤器、单向阀和手阀等阀门的方案设计工作及出图工作；3、负责阀门安装、测试和使用维护的各项设计工作，对产品工作性能进行全流程分析；4、参加飞行试验，处理阀门有关的技术问题，编写结果分析报告，参加故障分析。任职要求1、具备航空宇航推进理论与工程、流体机械及工程、化工过程机械、热能与动力工程等相关专业硕...,船舶/航空/航天/火车制造,http://jobs.zhaopin.com/CC873790450J40833809114.htm,500-999人,2025-12-29 17:27:02
强度设计岗,北京,北京箭元科技有限责任公司,本科,3-5年,"运载火箭,焊接工艺,装配工艺,CATIA,ANSYS,ABAQUS",2.8-4万,岗位职责:1、负责运载火箭箭上及地面结构产品强度仿真分析工作，编写仿真分析报告。2、负责复核箭体结构试验任务书、试验大纲。3、负责结构试验预示仿真工作。开展试验结果与仿真结果对比工作，编写相应试验结果分析报告。任职要求:1、本科及以上学历，飞行器设计、固体力学、工程力学、机械设计等专业。2、具有3年以上航空航天飞行器结构强度分析经验，具有一定的强度试验经验。3、具有扎实的理论力学、材料力学、结构力...,船舶/航空/航天/火车制造,http://jobs.zhaopin.com/CCL1451662510J40832875414.htm,100-299人,2025-12-25 09:16:03
光机结构工程师,北京,北极极光(北京)科技有限公司,本科,3-5年,"精密设备,非标设备",2-4万,岗位职责：1.负责光机、结构、工业相关的设计工作2.配合系统开展联调联测、问题分析3.开发过程中文档资料撰写、整理与归档 任职要求：1.机械、精密仪器等相关专业，本科及以上学历2.三年以上光机/光机电设计和开发经验，有光电载荷设计经验优先3.具备良好的团队协作合作、沟通和解决问题的能力4.熟练使用常用结构设计软件（如UG等）5.有光机热一体化、结构动力学分析经验者更佳,光电子行业,http://jobs.zhaopin.com/CCL1500043060J40802636911.htm,20-99人,2025-12-25 00:00:01
无人机结构工程师,北京,山东龙翼航空科技有限公司,本科,3-5年,"无人机设计,无人机研发,无人机控制系统,无人机应用系统,多旋翼无人机,固定翼无人机,民用无人机",2-4万,一、岗位职责：1、 负责无人机整体结构设计，根据工业设计进行结构拆分，并完成三维建模，输出二维图纸及其他设计文件。2、 负责无人机结构材料选型，强度校核，振动特性分析。3、 负责无人机结构零件出图，校核，及加工跟产。4、负责无人机结构部装、总装，并及时发现并解决技术问题。5、 负责制定机械结构相关测试方案，并根据测试结果优化设计。6、 负责无人机结构批产等相关技术文档编写。二、任职要求：1、本科及...,人工智能,http://jobs.zhaopin.com/CC476870280J40694389006.htm,20-99人,2025-12-24 00:00:00
结构强度仿真工程师,北京,道一(天津)企业管理咨询有限公司,硕士,经验不限,"结构设计,仿真设计,航空发动机",2-4万,岗位职责：“镜像”动力是指采用航空化方法设计的火箭发动机，具有长寿命、多次使用特点。负责“镜像”动力适航技术和适航标准研究；解读航空发动机适航标准并制定“镜像”动力适航技术体系；开展满足适航标准的“镜像”动力技术指标研究。岗位要求：航空发动机安全性与适航/航空发动机结构强度/航空宇航推进理论与工程专业或相关专业；具有相关工作实践经历、工作经历者或博士后优先；具备独立科研能力者优先。,人力资源服务,http://jobs.zhaopin.com/CCL1447804550J40862428112.htm,100-299人,2025-12-23 09:46:14
PCS硬件工程师,北京,深圳天顺智慧能源科技有限公司北京分公司,本科,5-10年,,2-4万·13薪,工作职责：1、负责储能变流器的硬件设计、器件选型；2、负责储能变流器的硬件电路设计计算、验证，以及产品的维护工作；3、负责储能变流器的原理图和PCB设计及测试；4、负责储能变流器的整机测试及认证工作；5、负责编制硬件相关的技术文档；6、分析并解决设计、生产、售后各阶段产生的问题；7、参与产品技术规范与相关专利的撰写工作。任职要求：1、本科及以上学历，电力电子、自动化、电子工程及相关专业；2、熟悉模...,人工智能,http://jobs.zhaopin.com/CCL1463144870J40907663608.htm,20-99人,2025-12-22 09:39:09
0103硬件开发工程师,北京,中科先为激光科技(北京)有限公司,本科,3-5年,"电路原理图设计,PCB设计,大功率恒流电源,STM32",2-4万·13薪,工作内容：1、根据激光器电源的要求，制定技术方案、绘制电路原理图及pcb图；2、DC-DC电源设计开发；3、控制电路开发；4、编写技术文档，指导转产等工作。任职要求：1、 本科及以上学历，电子信息、 工业控制、电气技术等相关专业；2、二年以上激光器电源相关设计、调试经验；3、buck电路设计经验；3、stm32系列单片机开发经验。,电子/半导体/集成电路,http://jobs.zhaopin.com/CC310898730J40886184702.htm,20-99人,2025-12-21 19:34:11
伺服驱动硬件设计岗,北京,北京星际荣耀科技有限责任公司,本科,经验不限,,2-4万,岗位职责: 1、负责硬件模块产品生命周期内全流程管理； 2、负责无刷直流和永磁同步伺服电机控制器算法研究； 3、负责硬件驱动控制器硬件设计，包括功率驱动电路，二次电源电路，硬件采集，通讯，控制电路； 4、与结构设计人员协调，负责硬件驱动控制器布局设计，布线设计，电磁兼容设计 5、负责硬件驱动控制器产品试验及验证，硬件模块产品元器件质量分析，产品技术状态把控，模块产品维护、故障排查； 6、负责电机硬...,船舶/航空/航天/火车制造,http://jobs.zhaopin.com/CCL1264678700J40611340606.htm,100-299人,2025-12-19 09:19:29
硬件研发工程师（北京办公）(J10254),北京,保定飞凌嵌入式技术有限公司,本科,经验不限,"硬件设计,EMC设计,ARM研发",2-4万,岗位职责:1.与嵌入式硬件工程师配合，共同完成嵌入式产品硬件设计、调试及实现；2.负责产品的EMC测试、问题定位、对策分析，以及整改和验证，组织EMC改进方案评审；3.收集并研究各种国际、国家标准及相关EMC要求；4.量产项目EMC问题的解决；5.负责产品的硬件使用文档编写工作；6.负责解决客户及批量生产中遇到的技术问题。任职要求:1. 熟知常用元器件相关知识，能熟练查看芯片的数据手册。2.熟悉硬...,电子/半导体/集成电路,http://jobs.zhaopin.com/CC299581510J40849715313.htm,300-499人,2025-12-15 15:49:45
高级硬件开发工程师,北京,北京卫信杰科技发展有限公司,本科,5-10年,"卫星导航,通信原理,PCB设计,设计",2-4万·13薪,岗位职责：1.依据需求完成硬件原理图、PCB设计；2.负责器件选型及BOM、安装图等文件的输出；3.配合结构人员完成产品结构设计；4.进行单板调试、编写设计文档、测试记录以及其他有关文档；5.到客户现场进行技术问题定位和支持。任职要求： 1.本科或以上学历，电子类相关专业毕业，3～5年电子产品硬件研发工作经验； 2.熟悉altiumdesigner设计软件，有DDR、ADC和DAC的设计经验，并有...,电子/半导体/集成电路,http://jobs.zhaopin.com/CC000574550J40787363914.htm,20-99人,2025-12-15 09:42:09
机电结构设计工程师（北京）(R10140),北京,北京星际荣耀科技有限责任公司,本科,1-3年,,2-4万,工作职责1、负责机电产品的结构设计与开发，确保结构设计符合产品功能与性能需求。2、根据项目需求进行机电系统方案设计，进行部件选择、材料选用、尺寸计算等工作。3、完成机电系统的3D建模、结构分析、装配图及零部件图的绘制。4、与电气工程师、软件工程师等团队成员协作，确保机电一体化设计的顺利实施。5、进行产品的结构力学分析，优化设计方案，保证产品的强度、稳定性和安全性。6、参与产品的调试、测试，解决生产...,船舶/航空/航天/火车制造,http://jobs.zhaopin.com/CCL1264678700J40633127806.htm,100-299人,2025-12-19 09:19:28
高级产品设计工程师（三维设计系统）,北京,中国恩菲工程技术有限公司,本科,5-10年,"REVIT BENTLEY,GDMP BIMBASE",2-4万,职位描述年龄35周岁以下（优秀可放宽），五年及以上从业经验，优秀高校本科毕业生优先 主要岗位职责:1、负责三维设计平台产品从业务调研、竞品分析、需求分析到产品设计，产品发布及迭代的整个流程；2、设计具体产品功能、流程，编辑产品需求文档及完成产品迭代规划；3、负责推动产品的落地实施，检测用户反馈及产品数据，不断完善产品功能及用户体验；4、负责跨部门协调和沟通推动业务、设计、开发、测试等人员紧密合作达...,工程技术与设计服务,http://jobs.zhaopin.com/CC135816980J40906089508.htm,1000-9999人,2025-12-12 15:25:06
光模块硬件开发工程师,北京,华夏芯智慧光子科技(北京)有限公司,本科,5-10年,"400G光模块硬件开发,熟悉MCU工作原理,硬件设计方案,光模块原理图设计",2-4万,岗位职责：1、负责光模块产品或光模块装备硬件开发；2、参与产品需求分析，任务分解，测试系统搭建及自动化测试工作，实现生产光模块自动化测试需求；3、了解光模块技术规格要求，测试项。二、岗位要求：1、本科及以上学历，硕士优先，光学工程、物理光电子、电子通讯专业等；2、熟练光模块基本工作原理及产品开发流程，熟悉光模块MSA协议和CMIS协议要求，有光模块自动化硬件开发经验；3、精通模拟电路与数字电路设计...,通信/网络设备,http://jobs.zhaopin.com/CCL1308503130J40747795907.htm,100-299人,2025-12-11 00:15:41
高级机械设计工程师（机械设计专家）,北京,北京品创联拓科技有限公司,硕士,10年以上,"研发,非标设备,自动化设备",2.5-4万·13薪,岗位职责：1、承担机电产品或试验台中机械部分设计开发指导工作；2、作为机械设计专家，参加所有机械设计评审；3、解决项目设计、调试中遇到的机械技术难题；4、制定、维护机械设计规范；5、能进行解决结构强度测试等方面技术难题。任职要求：1、机械相关专业，硕士研究生及以上学历，博士优先；2、具有丰富的机械机构设计、调试经验，相关工作经验不少于十五年；3、熟悉机械加工工艺；4、良好的沟通协调和团队合作精神。,船舶/航空/航天/火车制造,http://jobs.zhaopin.com/CC322439810J40796040307.htm,100-299人,2025-12-10 17:16:51
火箭单机硬件设计师,北京,东方空间技术(山东)有限公司,硕士,1-3年,"设计,PCB设计,ARM研发,FPGA研发,硬件测试",2-4万·16薪,岗位职责： 1.负责运载火箭、飞行器计算机等电子产品的设计； 2.负责运载火箭、飞行器单机板卡或模块的研发设计及硬件测试工作； 3.负责相关软件任务书的分解和协调工作； 4.组织相关地面试验、结果分析； 5.负责相关产品跟产及问题协调； 6.负责国内外相关技术发展现状跟踪和研究； 7.负责相关文件及报告的编制。 任职要求： 1.自动化控制、电气工程、电子科学与技术、信息与通信工程、计算机等专业； ...,计算机软件,http://jobs.zhaopin.com/CCL1337298890J40878352302.htm,100-299人,2025-12-10 14:54:51
电源结构工程师,北京,锐仕方达人才科技集团有限公司,本科,5-10年,"电源结构,服务器电源,通信电源",2-4万·14薪,"1、负责产品的结构设计，包括塑料Case，铁壳Case及散热片，包装及标签等的设计；2、解决产品的散热问题, 负责产品内器件的散热设计；3、能够快速分析解决生产现场的异常并提供有效的解决方案。 任职资格：1、精通Pro/E, auto CAD 等2D,3D图的绘制；2、5年以上相关行业的经验；有设计服务器/通讯电源产品经验者优先；3、机械设计相关专业，本科及以上学历，良好的英文读写能力，熟悉常用的...",人力资源服务,http://jobs.zhaopin.com/CCL1236606730J40806785614.htm,1000-9999人,2025-12-04 11:30:18
